date,title,stock,close,volume,1_past_close,2_past_close,3_past_close,4_past_close,5_past_close,next_close,next_volume,label
2010-04-15,"Stocks That Have Crossed 52-Week Highs (ACOR, ACTL, AMZN, ARII, AAPL)",ACOR,0.0155673203163468,0.0130313170472897,0.0767045321132853,0.0057142711821056,-0.0093404838543538,-0.0114717715251815,-0.0077734254753721,-0.0166276794721387,-0.4867527002255739,1
2011-08-10,A Peek Into The Market Before The Trading Starts,ACOR,0.0011751399867951,-0.1312231404958678,0.1167978170453885,-0.0611909792465855,0.0192549869969225,-0.0843234797136759,-0.0162141899838206,0.0492957585322508,-0.1811609368162706,0
2012-06-12,A Peek Into The Market Before The Trading Starts,ACOR,-0.0100732000386127,-0.0272445024158138,-0.0353357124643776,0.0129753180848615,-0.0040106453400231,0.0049261358647267,0.0031446404359287,0.0235892501526231,-0.1214919735599622,0
2012-12-21,A Peek Into The Market Before The Trading Starts,ACOR,0.0165523267036005,1.8127005285428648,-0.0060193226963357,-0.0157977483241897,-0.013250249778913,0.0202784157796716,-0.0055358611194826,-0.0218427522621296,-0.7482572588955567,1
2014-06-17,"Mid-Afternoon Market Update: Oil Falls, US Indexes Rise In Afternoon Session",ACOR,-0.0895691237296957,9.212269779507134,0.0048418731412722,-0.0098702335915837,0.018672765896234,0.013391530446873,-0.0340269707820937,0.077521805452341,0.5892659830371136,0
2014-06-17,Market Wrap For June 17: Markets Higher Ahead Of Fed Decision,ACOR,-0.0895691237296957,9.212269779507134,0.0048418731412722,-0.0098702335915837,0.018672765896234,0.013391530446873,-0.0340269707820937,0.077521805452341,0.5892659830371136,0
2014-06-17,Market Wrap For June 17: Markets Higher Ahead of Fed Decision,ACOR,-0.0895691237296957,9.212269779507134,0.0048418731412722,-0.0098702335915837,0.018672765896234,0.013391530446873,-0.0340269707820937,0.077521805452341,0.5892659830371136,0
2014-06-17,Mid-Morning Market Update: Markets Gain; FactSet Posts Rise In Revenue,ACOR,-0.0895691237296957,9.212269779507134,0.0048418731412722,-0.0098702335915837,0.018672765896234,0.013391530446873,-0.0340269707820937,0.077521805452341,0.5892659830371136,0
2014-09-24,Stocks Gain While Dollar Reaches Highest Level Since 2010,ACOR,0.2817716831197594,16.97750139431121,0.0034188381966702,-0.025,-0.0138067291993876,0.0245874306602642,-0.0073554400692928,-0.0552897202731115,-0.7180072011679717,1
2014-11-17,"Events for the Week of Nov. 17-21, 2014",ACOR,0.0188228196466209,-0.1290444810543657,-0.007708259318884,-0.0335243038122635,-0.0281259288431684,-0.0091059405137405,0.0321845564484644,0.0126099046691148,-0.1276788923146764,0
2015-01-12,Biotechs Presenting at the J.P. Morgan Healthcare Conference: Day One,ACOR,0.0323194671220774,0.1164517488411294,0.0033380875056749,0.0028694453449595,0.0423728684634325,-0.0059464916568778,-0.0037027643607517,0.0181859651932896,0.0381227022579209,0
2015-01-12,Biotechs Presenting At The J.P. Morgan Healthcare Conference: Day 1,ACOR,0.0323194671220774,0.1164517488411294,0.0033380875056749,0.0028694453449595,0.0423728684634325,-0.0059464916568778,-0.0037027643607517,0.0181859651932896,0.0381227022579209,0
2015-08-25,Benzinga's Volume Movers,ACOR,0.0832182733137592,6.417313189056758,-0.0314381247577008,0.0236220445019297,-0.041666722290714,-0.0215087701709523,-0.0382834340928495,0.0188077423396777,-0.7431136801541426,0
2015-10-05,Benzinga's Volume Movers,ACOR,0.1201426075701543,0.7453742640874685,0.0214858501028598,0.0358355151246776,0.0283165573455466,-0.0164059641432998,-0.0582105729393072,-0.0544239843682402,-0.5149981929887966,1
2016-12-30,January Will Feature Some Of The Market's Most Influential Events,ACOR,0.0245232026798924,2.2633165829145727,0.0110192555686696,-0.0108991549943049,0.0110192555686696,0.0,-0.0189189051722621,0.0372340144912499,-0.3543763473975978,0
2017-03-03,Benzinga's Option Alert Recap From March 3,ACOR,0.0018382540279884,-0.3278613422921279,-0.0101892763513948,0.0389414496119104,-0.0346715155709265,0.1004016105274618,-0.0040000406901041,-0.0036697621010129,0.0697076409901582,2
2017-08-07,"Activists Gonna Activate: Hedge Funds Send Letters To Acorda, Taubman Centers Boards",ACOR,0.0359308994508948,0.5483146601399598,-0.0147126296470905,-0.0224719101123596,0.0229885057471264,0.0046189848476341,-0.0023041709584453,-0.0450450460770763,-0.4715424695166401,1
2018-01-19,28 Stocks Moving In Friday's Mid-Day Session,ACOR,0.0879999796549479,1.3685133252325992,0.0101010101010101,-0.0119760679654674,-0.0309477940868309,0.0097656246119488,0.0534979621981823,0.0128676846984354,-0.7201673579736506,0
2018-01-19,14 Stocks Moving In Friday's Pre-Market Session,ACOR,0.0879999796549479,1.3685133252325992,0.0101010101010101,-0.0119760679654674,-0.0309477940868309,0.0097656246119488,0.0534979621981823,0.0128676846984354,-0.7201673579736506,0
2018-01-22,34 Biggest Movers From Friday,ACOR,0.0128676846984354,-0.7201673579736506,0.0879999796549479,0.0101010101010101,-0.0119760679654674,-0.0309477940868309,0.0097656246119488,0.0090744099958082,-0.4850376344086021,0
2018-02-23,"Pharma Stock Roundup: AstraZeneca, Merck, AbbVie And More",ACOR,-0.0132575184699749,1.9129417488098408,0.0114941744751844,0.0316205728277962,-0.0193798445791821,0.0278884248208814,-0.0195312492238979,-0.0479846439767274,-0.500761482883535,1
2018-05-30,"Benzinga's Daily Biotech Pulse: Chinese Cheer For Gilead, Immutep Presents Positive Phase 1 Data, FDA Accepts Exelixis sNDA",ACOR,0.0395256909049879,1.889754825247783,0.045454588445124,0.027600805465346,0.0129032476828516,0.0043196985592581,0.0021644139953695,-0.0019011599870464,-0.6661058620926195,2
2018-07-13,24 Stocks Moving In Friday's Mid-Day Session,ACOR,0.0101695087669932,-0.0891602156628275,0.0016978101694347,-0.0183333502875433,-0.0066224998258965,-0.0114566615851209,0.0099173721859935,0.0067113922134263,-0.0687288389340581,0
2018-10-31,"The Daily Biotech Pulse: KemPharm, FDA Nod For Merck, Clovis Q3 Miss, 3 Stocks To Debut",ACOR,0.0932494914646147,0.1370302988267808,-0.0515464322956445,-0.0128548014208572,0.033776264415831,0.0391254495475186,-0.0481927610163835,0.0559916096624621,-0.0875903846244081,0
2018-12-20,"The Daily Biotech Pulse: Tilray Inks Cannabis Drink Pact, Double Delight For Merck, FDA Snub For Spectrum",ACOR,-0.0471956148202986,0.5882476412371567,-0.0799244326607878,-0.0275398261161082,0.0098887419279545,0.0125156926576146,-0.0238241085135715,-0.0710696615371357,1.1197161227227372,1
2018-12-21,"The Daily Biotech Pulse: Proteostasis Delays Data, Akron Gets New CEO, Pfizer Halts Vaccine Trial",ACOR,-0.0710696615371357,1.1197161227227372,-0.0471956148202986,-0.0799244326607878,-0.0275398261161082,0.0098887419279545,0.0125156926576146,0.0641422384863847,0.0707643484848012,0
2018-12-31,Attention Biotech Investors: Mark Your Calendar For These January PDUFA Dates,ACOR,0.0400534736707363,0.0985938600808746,0.0087541952037566,-0.0529337081208448,0.1387073190934595,0.0641422384863847,-0.0710696615371357,0.0410782648694225,0.65959783191166,0
2019-04-10,"The Daily Biotech Pulse: Amgen's Bone-Building Osteoporosis Drug Clears FDA Muster, PhaseBio Offering",ACOR,0.0223820991182996,-0.0053884408136891,-0.0218921077917952,-0.0361718762052684,0.0145259854852914,0.0015314286070358,-0.0150829183643252,-0.0359655275432185,0.1801972157772622,1
2019-04-12,"The Daily Biotech Pulse: Merck's Keytruda Clinches Another FDA Win, KemPharm Close To NDA Filing For ADHD Drug",ACOR,-0.0064882851466998,-0.0273559218739248,-0.0359655275432185,0.0223820991182996,-0.0218921077917952,-0.0361718762052684,0.0145259854852914,-0.02693882118277,-0.0340272865083375,1
2019-04-16,"The Daily Biotech Pulse: J&J Earnings, FDA Nod For Mediconova, Proteon To Explore Strategic Alternatives",ACOR,0.0008389987528627,0.3979159473965035,-0.02693882118277,-0.0064882851466998,-0.0359655275432185,0.0223820991182996,-0.0218921077917952,-0.0284995929497489,0.145063876602528,1
2019-06-05,44 Stocks Moving In Wednesday's Mid-Day Session,ACOR,-0.0648648373715512,0.1746547522339561,-0.0149094808362244,0.0107642349489358,-0.0095948314239964,-0.023933421293222,-0.0193877449734712,-0.0728324177815161,0.1131074227754724,1
2019-06-06,66 Biggest Movers From Yesterday,ACOR,-0.0728324177815161,0.1131074227754724,-0.0648648373715512,-0.0149094808362244,0.0107642349489358,-0.0095948314239964,-0.023933421293222,-0.0399002122103768,-0.184523242473067,1
2019-06-27,"The Daily Biotech Pulse: Verrica Rallies, Aclaris Flunked Hair Loss Study, 3 Biotechs To IPO",ACOR,0.0678210574949531,-0.0747967945048655,-0.0184135686510417,-0.0459459649869226,-0.012015957216989,0.0288461152181791,-0.0344827876970115,0.0364864611759199,0.8540953889366651,0
2019-08-02,Stocks That Set New 52-Week Lows Friday Morning,ACOR,-0.4892915618724655,4.108704130868407,-0.1240982067070411,-0.0114122569320964,0.021865926365777,0.0117993986881868,-0.0014727876980605,-0.0580645108363548,-0.3765950485331006,1
2019-08-05,New 52-Week Lows For Monday Morning,ACOR,-0.0580645108363548,-0.3765950485331006,-0.4892915618724655,-0.1240982067070411,-0.0114122569320964,0.021865926365777,0.0117993986881868,0.0308218603920995,-0.5231513879169583,0
2019-08-14,"The Daily Biotech Pulse: Regeneron's Bad Cholesterol Drug Aces Late-Stage Trial, Oncolytics Offering",ACOR,-0.1245420703723184,0.2528746081504702,-0.0353357124643776,-0.0308219692590276,-0.0101695083286476,-0.0296052091532239,0.0099667946012527,0.096234316579967,0.0590491584243884,0
2019-10-30,"The Daily Biotech Pulse: Novartis Program Placed On Partial Clinical Hold, Adcom Snub For Amag, Amgen Earnings",ACOR,0.0223463478801524,-0.3418071889239108,-0.0959596239344314,0.0050761777636061,-0.015000025431315,-0.2619926303146668,0.1198346912026304,-0.0983606528899807,0.3203686029016435,1
2019-11-01,"The Daily Biotech Pulse: Amgen Takes 20.5% Stake In BeiGene, Paratek's Mixed Clinical Readout, CareDx Slips On Guidance",ACOR,0.2121212588270267,1.146518308080808,-0.0983606528899807,0.0223463478801524,-0.0959596239344314,0.0050761777636061,-0.015000025431315,0.0,-0.5251104016517234,2
2019-11-21,"The Daily Biotech Pulse: Patent Win For Cellectis, Hepion Proves Efficacy In Animal Model, Job Cuts At Neon",ACOR,0.1381579215671879,0.5265235398902901,-0.037974649162517,-0.0246914319134935,-0.1049723228073503,-0.0109289517815991,-0.051813504786078,0.086705164605747,-0.3673085275807152,0
2020-01-08,50 Healthcare Stocks Moving In Wednesday's Pre-Market Session,ACOR,-0.0737704848619513,-0.3517976399437954,-0.0161290167521737,0.092511030798009,0.1581632330337206,-0.0392156496088299,-0.0684931924421095,0.0088495488086772,-0.2736919932153264,0
2020-01-15,Mid-Afternoon Market Update: OrganiGram Rises Following Q1 Results; Nektar Therapeutics Shares Plummet,ACOR,-0.08974360628955,1.975781675540332,-0.0330578843510982,0.0254237721914494,0.0350876850532468,0.0088495488086772,-0.0737704848619513,0.0093896626030041,-0.7587179858197077,0
2020-01-15,Mid-Morning Market Update: Markets Open Higher; Goldman Sachs Reports Mixed Q4 Results,ACOR,-0.08974360628955,1.975781675540332,-0.0330578843510982,0.0254237721914494,0.0350876850532468,0.0088495488086772,-0.0737704848619513,0.0093896626030041,-0.7587179858197077,0
2020-01-15,Mid-Day Market Update: Concrete Pumping Falls On Weak Q4 Results; Fluent Shares Jump,ACOR,-0.08974360628955,1.975781675540332,-0.0330578843510982,0.0254237721914494,0.0350876850532468,0.0088495488086772,-0.0737704848619513,0.0093896626030041,-0.7587179858197077,0
2020-01-15,34 Healthcare Stocks Moving In Wednesday's Pre-Market Session,ACOR,-0.08974360628955,1.975781675540332,-0.0330578843510982,0.0254237721914494,0.0350876850532468,0.0088495488086772,-0.0737704848619513,0.0093896626030041,-0.7587179858197077,0
2020-01-27,70 Biggest Movers From Friday,ACOR,0.0380952006114414,-0.3258262577266039,-0.113924040445716,0.1449275506986931,0.0197044142122211,-0.0193236529503934,-0.0372092679403517,-0.0321100977632837,-0.1687196692276761,1
2020-02-26,"The Daily Biotech Pulse: Menlo Flunks Midstage Trial, GW Pharma's Earnings, COVID-19 Updates",ACOR,-0.036496372383124,-0.0310522244804013,-0.0072463125455745,-0.0921052810447921,-0.0318471537478893,-0.0818713580749536,0.0555555501047422,0.0075757502779743,0.3796365422714329,0
2020-02-27,"The Daily Biotech Pulse: Gilead Kicks Off Coronavirus Drug Trials, Adcom Nod For Lily, FDA Approves Esperion's Lipid-Lowering Adjunctive Combo Therapy",ACOR,0.0075757502779743,0.3796365422714329,-0.036496372383124,-0.0072463125455745,-0.0921052810447921,-0.0318471537478893,-0.0818713580749536,0.0827068073523509,-0.316557464223218,0
2020-02-27,Stocks That Hit 52-Week Lows On Thursday,ACOR,0.0075757502779743,0.3796365422714329,-0.036496372383124,-0.0072463125455745,-0.0921052810447921,-0.0318471537478893,-0.0818713580749536,0.0827068073523509,-0.316557464223218,0
2020-03-12,"The Daily Biotech Pulse: AstraZeneca Faces Setback In Ovarian Cancer Study, Mallinckrodt To Explore COVID-19 Treatment, Imara IPO",ACOR,-0.1584158493748515,0.5287942002956356,-0.0560747864853952,0.0288462038106014,-0.1111111413002317,0.0086206813865932,-0.0793650673510415,0.0235293897652979,-0.3929704025634172,0
2020-03-13,"The Daily Biotech Pulse: Roche Obtains FDA Emergency Use Authorization For COVID-19 Test, Chembio Appoints New CEO, Inovio Slumps On Earnings",ACOR,0.0235293897652979,-0.3929704025634172,-0.1584158493748515,-0.0560747864853952,0.0288462038106014,-0.1111111413002317,0.0086206813865932,-0.0804596966164565,-0.3912313128567545,1
2020-05-05,"The Daily Biotech Pulse: Bio-Rad's Coronavirus Test Gets EUA, Beat-and-Raise Quarter From GenMark, Adverum's Positive Gene Therapy Readout",ACOR,0.0444444012740028,0.4423457437510925,0.0112359440196763,-0.0729166770146948,-0.0769230063850331,0.0399999618530273,-0.0476190764527373,-0.0851063883752508,-0.1556050540133743,1
2020-07-15,"The Daily Biotech Pulse: Moderna To Kickstart Phase 3 Study On July 27, Immutep Awarded Antibody Patent",ACOR,0.0857143213959794,0.1915465273482479,0.0,-0.0540541092032255,0.0277777501830358,0.0140844928534873,0.0,-0.0263157647072109,-0.7513847597435861,1
2020-07-31,"The Daily Biotech Pulse: Sanofi-GSK Land $2.1M Funding For Coronavirus Vaccine, D-Day For GW Pharma, FDA Nod For Roche",ACOR,0.0,-0.4277627134769992,-0.0597014951929002,-0.0694444858365572,-0.0399999618530273,-0.0131578823536054,-0.0500000496705352,0.0158730008554686,-0.2509860429887032,0
2020-08-04,38 Stocks Moving In Tuesday's After-Hours Session,ACOR,0.0,2.1930635885672944,0.0158730008554686,0.0,-0.0597014951929002,-0.0694444858365572,-0.0399999618530273,0.1093750844011101,0.0896871262553635,0
2020-08-04,"Earnings Scheduled For August 4, 2020",ACOR,0.0,2.1930635885672944,0.0158730008554686,0.0,-0.0597014951929002,-0.0694444858365572,-0.0399999618530273,0.1093750844011101,0.0896871262553635,0
2020-08-05,85 Stocks Moving In Wednesday's Mid-Day Session,ACOR,0.1093750844011101,0.0896871262553635,0.0,0.0158730008554686,0.0,-0.0597014951929002,-0.0694444858365572,0.0704224642674371,-0.2581610121533542,0
2020-08-05,54 Stocks Moving in Wednesday's Pre-Market Session,ACOR,0.1093750844011101,0.0896871262553635,0.0,0.0158730008554686,0.0,-0.0597014951929002,-0.0694444858365572,0.0704224642674371,-0.2581610121533542,0
2020-08-06,90 Biggest Movers From Yesterday,ACOR,0.0704224642674371,-0.2581610121533542,0.1093750844011101,0.0,0.0158730008554686,0.0,-0.0597014951929002,-0.0263157647072109,-0.4955272751016456,1
2020-08-19,"The Daily Biotech Pulse: Gilead's Filgotinib Stumbles With FDA, J&J Laps Up Momenta In $6.5B Deal, 2 IPOs",ACOR,0.0163934266045031,-0.4201321414691021,-0.0317460017109371,-0.0597014951929002,-0.0428571039316587,0.0144927402692103,-0.028169097640574,-0.0161290167521737,-0.0207774798927613,1
2020-09-01,30 Stocks Moving in Tuesday's Pre-Market Session,ACOR,-0.0535713791543108,-0.1458220582205822,0.018181801105005,0.0377358122767121,0.0,0.0192308280124724,-0.0714285764969937,-0.0188679811127504,0.7147177129033186,1
2020-10-13,34 Stocks Moving in Tuesday's Pre-Market Session,ACOR,0.0,-0.56452676267377,-0.0405405013556029,0.1562500407453635,-0.0153846614694678,0.0156250475362573,0.103448245150203,-0.0140846047870866,-0.0839173137284137,1
2020-10-20,44 Stocks Moving in Tuesday's Pre-Market Session,ACOR,0.3913044479809229,15.089769089477826,0.0298507179423979,-0.0289854805384205,-0.0142857013105529,-0.0140846047870866,0.0,-0.0208333954215025,-0.9307056267716014,1
2020-10-20,Mid-Day Market Update: Cleveland BioLabs Jumps On Merger News; Isoray Shares Slide,ACOR,0.3913044479809229,15.089769089477826,0.0298507179423979,-0.0289854805384205,-0.0142857013105529,-0.0140846047870866,0.0,-0.0208333954215025,-0.9307056267716014,1
2020-10-20,Mid-Afternoon Market Update: Dow Rises 1%; Aptinyx Shares Spike Higher,ACOR,0.3913044479809229,15.089769089477826,0.0298507179423979,-0.0289854805384205,-0.0142857013105529,-0.0140846047870866,0.0,-0.0208333954215025,-0.9307056267716014,1
2020-10-20,50 Stocks Moving In Tuesday's Mid-Day Session,ACOR,0.3913044479809229,15.089769089477826,0.0298507179423979,-0.0289854805384205,-0.0142857013105529,-0.0140846047870866,0.0,-0.0208333954215025,-0.9307056267716014,1
2020-10-21,60 Biggest Movers From Yesterday,ACOR,-0.0208333954215025,-0.9307056267716014,0.3913044479809229,0.0298507179423979,-0.0289854805384205,-0.0142857013105529,-0.0140846047870866,-0.0744681003965441,-0.2163646348160351,1
2020-10-23,38 Stocks Moving in Friday's Pre-Market Session,ACOR,-0.0344827271213384,-0.421096205826409,-0.0744681003965441,-0.0208333954215025,0.3913044479809229,0.0298507179423979,-0.0289854805384205,0.0714285984601565,-0.017811841242886,0
2020-11-04,40 Stocks Moving In Wednesday's Mid-Day Session,ACOR,-0.1481481535989616,-0.5211186882646599,-0.0181818011050051,0.2643678486412835,-0.0543478608281642,0.0454545002995132,0.0114943337218977,-0.0869565254949367,-0.1561167951721707,1
2020-11-05,51 Biggest Movers From Yesterday,ACOR,-0.0869565254949367,-0.1561167951721707,-0.1481481535989616,-0.0181818011050051,0.2643678486412835,-0.0543478608281642,0.0454545002995132,-0.0357142519248042,-0.4076525500815305,1
2021-01-04,Stocks That Hit 52-Week Highs On Monday,ACOR,-0.0821255857812223,-0.5832087515721032,-0.028169097640574,0.0142858148432147,-0.0140846047870866,-0.0138888750915179,-0.0399999618530273,0.0631578980390386,-0.3416078342063311,0
2021-01-13,61 Stocks Moving In Wednesday's Mid-Day Session,ACOR,0.443396277341102,116.59385992964502,0.0341463096931808,-0.0024331456343007,-0.0120191624355009,0.06393855654566,-0.0321781874380789,0.0408496739664827,-0.9372668037289648,0
2021-01-13,"The Daily Biotech Pulse: Bausch Health Issues Positive Pre-Announcement, Acorda Streamlines Operations",ACOR,0.443396277341102,116.59385992964502,0.0341463096931808,-0.0024331456343007,-0.0120191624355009,0.06393855654566,-0.0321781874380789,0.0408496739664827,-0.9372668037289648,0
2021-03-05,"The Daily Biotech Pulse: Fulgent's Big Quarter, Gilead Awaits FDA Decision, Apellis Winds Up COVID-19 Study",ACOR,-0.2300885503454572,0.6260162601626016,0.0779014707356164,0.0161550732969575,0.0403361774199726,0.0223367068332318,-0.038016530879737,-0.0095784896374238,-0.5045098039215686,1
2021-05-06,"The Daily Biotech Pulse: Merck's Keytruda Snags Another FDA Approval, Moderna Slips On Revenue Miss, Chemocentryx Adcom",ACOR,-0.0426829339208381,0.2256675279931093,-0.0040485790880266,-0.0351562172581899,-0.0191570706229659,0.0740740013965637,-0.0221327286359914,-0.0233545929136936,0.1370344342937455,1
2021-07-22,12 Stocks Moving In Thursday's After-Hours Session,ACOR,-0.0427135868038311,5.143543956043956,0.0613333384195964,0.0359116349587509,-0.0189702359284258,-0.0489690854681422,-0.0076726267854791,0.2414698399241366,55.77026271660145,0
2022-03-09,"The Daily Biotech Pulse: Pfizer Begins Late-Stage Pediatric COVID Pill Study, Midatech And J&J Unit Expand R&D Collaboration, AbbVie-Alvotech Settle Humira Dispute",ACOR,0.0227272505602564,-0.034324942791762,0.0045662055716786,0.0233644625538571,-0.0138248711221274,0.0187793238046498,0.0597015545010046,-0.1688888867696126,0.8815165876777251,1
2022-04-01,Stocks That Hit 52-Week Lows On Friday,ACOR,0.0,0.16414686825054,-0.0416666282311306,0.00598801839535,-0.0059523754615901,-0.034482794057458,-0.0113636255880031,0.0372670448735601,-0.4452690166975881,0
2022-04-18,Stocks That Hit 52-Week Lows On Monday,ACOR,-0.0258064277958539,1.1733333333333331,-0.0251572831588691,0.0127388409288757,-0.054216816854815,0.0,0.006060600368335,0.033112551411967,-0.0511247443762781,0
2022-04-21,Stocks That Hit 52-Week Lows On Thursday,ACOR,-0.0529801612056969,3.6296296296296298,-0.0320512526604305,0.033112551411967,-0.0258064277958539,-0.0251572831588691,0.0127388409288757,-0.062937005224118,-0.5395555555555556,1
2022-04-22,Stocks That Hit 52-Week Lows On Friday,ACOR,-0.062937005224118,-0.5395555555555556,-0.0529801612056969,-0.0320512526604305,0.033112551411967,-0.0258064277958539,-0.0251572831588691,0.0223880377929024,0.6196911196911197,0
2022-05-06,Stocks That Hit 52-Week Lows On Friday,ACOR,-0.1916666749450892,2.0538555691554468,-0.0322580335043474,-0.0534350658781502,0.0,-0.0367647580879776,0.0225563687381624,-0.1237113414731564,-0.2188376753507014,1
2022-05-11,"Earnings Scheduled For May 11, 2022",ACOR,-0.0975609561079388,0.622077922077922,-0.0352941531211025,-0.1237113414731564,-0.1916666749450892,-0.0322580335043474,-0.0534350658781502,-0.1216216651604411,0.6020816653322658,1
2022-05-18,Stocks That Hit 52-Week Lows On Wednesday,ACOR,-0.1212121814188307,1.6740139211136893,-0.0294117363472713,-0.0810810832580221,0.1384615948919734,-0.1216216651604411,-0.0975609561079388,-0.0517240900913955,-0.220824295010846,1
2022-05-19,24 Stocks Moving in Thursday's Pre-Market Session,ACOR,-0.0517240900913955,-0.220824295010846,-0.1212121814188307,-0.0294117363472713,-0.0810810832580221,0.1384615948919734,-0.1216216651604411,-0.0545455097166948,0.3232182628062361,1
2022-05-25,Stocks That Hit 52-Week Lows On Wednesday,ACOR,-0.0681818212605704,-0.2472675839012472,-0.1020408386689626,-0.0576922547887749,-0.0545455097166948,-0.0517240900913955,-0.1212121814188307,0.0,0.4036556200888281,2
2022-10-13,Why Relmada Therapeutics Shares Are Trading Lower By 84%; Here Are 23 Stocks Moving Premarket,ACOR,-0.0540540823542867,0.1034482758620689,0.0277777501830358,-0.0270270009037353,0.0,0.0,0.0571428887698119,-0.028571401810159,0.5304054054054055,1
2022-10-18,Why Minerva Neurosciences Shares Dipped By Around 70%; Here Are 90 Biggest Movers From Yesterday,ACOR,-0.1888888462090187,-0.8355837308907894,1.6470587255633014,-0.028571401810159,-0.0540540823542867,0.0277777501830358,-0.0270270009037353,-0.2054794956761322,-0.5604055327047017,1
2022-10-20,Why Ericsson Shares Are Trading Lower? Here Are 56 Stocks Moving In Thursday's Mid-Day Session,ACOR,-0.0862069195856244,-0.698474497156921,-0.2054794956761322,-0.1888888462090187,1.6470587255633014,-0.028571401810159,-0.0540540823542867,-0.018867907552966,-0.4811244414734545,1
2022-10-20,Why IBM Shares Are Trading Higher; Here Are 21 Stocks Moving Premarket,ACOR,-0.0862069195856244,-0.698474497156921,-0.2054794956761322,-0.1888888462090187,1.6470587255633014,-0.028571401810159,-0.0540540823542867,-0.018867907552966,-0.4811244414734545,1
2022-10-21,Why Super Micro Computer Shares Jumped Over 10%; Here Are 73 Biggest Movers From Yesterday,ACOR,-0.018867907552966,-0.4811244414734545,-0.0862069195856244,-0.2054794956761322,-0.1888888462090187,1.6470587255633014,-0.028571401810159,0.0384616178168377,-0.0848928668294005,0
2022-10-27,Why UserTesting Shares Are Trading Higher By Around 93%? Here Are 53 Stocks Moving In Thursday's Mid-Day Session,ACOR,0.2291666395030909,14.912980176951509,-0.0943395939956301,-0.0185186105009913,0.0384616178168377,-0.018867907552966,-0.0862069195856244,0.1186441619722955,-0.7442552802156426,0
2022-10-28,Why Meta Platforms Shares Dipped Around 25%; Here Are 77 Biggest Movers From Yesterday,ACOR,0.1186441619722955,-0.7442552802156426,0.2291666395030909,-0.0943395939956301,-0.0185186105009913,0.0384616178168377,-0.018867907552966,,,2
