date,title,stock,close,volume,1_past_close,2_past_close,3_past_close,4_past_close,5_past_close,next_close,next_volume,label
2020-10-13,Johnson & Johnson's CFO On COVID-19 Trial Pause: 'We Are Letting The Science Dictate',AZN,-0.0142935961975662,0.0597449254535655,0.0100511148153958,0.0116474132346247,0.0104614052739961,-0.0033513766618278,-0.0143145726112932,-0.0236783138655435,0.5786154993558885,1
2020-10-14,World Bank Approves $12B Financing To Ensure Developing Countries Aren't Deprived Of COVID-19 Vaccine,AZN,-0.0236783138655435,0.5786154993558885,-0.0142935961975662,0.0100511148153958,0.0116474132346247,0.0104614052739961,-0.0033513766618278,-0.0120322277820967,-0.3474423399046514,1
2020-10-15,"Donald Trump's Latest Thoughts On COVID-19 Vaccines, Social Media, China And More",AZN,-0.0120322277820967,-0.3474423399046514,-0.0236783138655435,-0.0142935961975662,0.0100511148153958,0.0116474132346247,0.0104614052739961,0.0091339191663259,-0.1228156777569355,0
2020-10-16,Pfizer CEO: Emergency Use Application For Coronavirus Vaccine Could Come In Late November,AZN,0.0091339191663259,-0.1228156777569355,-0.0120322277820967,-0.0236783138655435,-0.0142935961975662,0.0100511148153958,0.0116474132346247,-0.0111256399816502,0.1794034890264491,1
2020-10-19,Moderna Nears Finish Line For Enrollment In Phase 3 Coronavirus Vaccine Study,AZN,-0.0111256399816502,0.1794034890264491,0.0091339191663259,-0.0120322277820967,-0.0236783138655435,-0.0142935961975662,0.0100511148153958,-0.0047674263078497,0.5647485447084646,2
2020-10-22,"Pfizer, Moderna Vaccines, Gilead Treatment In Focus As Health Firms Report Q3 Earnings",AZN,0.0075625074743739,-0.5436628628433782,-0.0118796414111707,-0.0047674263078497,-0.0111256399816502,0.0091339191663259,-0.0120322277820967,0.0007698943496867,0.4867768595041322,2
2020-10-23,Why The Economic Recovery Likely Won't Come Until 2023,AZN,0.0007698943496867,0.4867768595041322,0.0075625074743739,-0.0118796414111707,-0.0047674263078497,-0.0111256399816502,0.0091339191663259,0.0205768536445676,0.0798113647366816,0
2020-10-26,"FAANGs In Focus: Amazon, Facebook, Apple, Alphabet, All Set To Report Later This Week",AZN,0.0205768536445676,0.0798113647366816,0.0007698943496867,0.0075625074743739,-0.0118796414111707,-0.0047674263078497,-0.0111256399816502,-0.0111174069820859,-0.3852042510793756,1
2020-11-04,"AstraZeneca Gets Chile, Peru Nod To Resume COVID-19 Vaccine Trials",AZN,0.0646036103786871,0.7767994611239415,0.0213354092086677,0.0091705705508786,-0.0178187168904129,0.0017655020421851,-0.0285822925965192,0.0021802127242089,-0.0981477971242112,2
2020-11-05,"The Daily Biotech Pulse: Bluebird Bio Plunges On Regulatory Filing Delay, Synlogic Soars On Study Initiation, European Label Expansion For Vertex, Merck Goes Shopping",AZN,0.0021802127242089,-0.0981477971242112,0.0646036103786871,0.0213354092086677,0.0091705705508786,-0.0178187168904129,0.0017655020421851,0.0065264830119931,-0.4465762884895434,0
2020-11-05,"COVID-19 Vaccines To Generate over $10B Annual Revenue, Analyst Say",AZN,0.0021802127242089,-0.0981477971242112,0.0646036103786871,0.0213354092086677,0.0091705705508786,-0.0178187168904129,0.0017655020421851,0.0065264830119931,-0.4465762884895434,0
2020-11-06,Catalent Could Be A Big COVID-19 Vaccine Play: The Thing Behind The Thing,AZN,0.0065264830119931,-0.4465762884895434,0.0021802127242089,0.0646036103786871,0.0213354092086677,0.0091705705508786,-0.0178187168904129,-0.0264768878240688,0.1885359303366518,1
2020-11-13,"A Peek Into The Markets: US Stock Futures Gain Ahead Of Producer Price, Consumer Sentiment Data",AZN,0.0095003370724635,-0.0008267594474491,-0.0203378395302574,0.0256319789369259,0.0466234466960056,-0.0264768878240688,0.0065264830119931,-0.0189962417150123,0.7895190484399242,1
2020-11-19,"Tale Of Two Earnings: Nvidia Results Solid All the Way Through, But Macy's Struggles",AZN,0.0007407958099834,0.4302136381886186,-0.0176491510361493,-0.0236276106265345,-0.0189962417150123,0.0095003370724635,-0.0203378395302574,0.023505436655953,-0.3637894861262964,0
2020-11-19,"AstraZeneca COVID-19 Vaccine Triggers Robust Immune Response In Older Adults, Peer-Reviewed Study Says",AZN,0.0007407958099834,0.4302136381886186,-0.0176491510361493,-0.0236276106265345,-0.0189962417150123,0.0095003370724635,-0.0203378395302574,0.023505436655953,-0.3637894861262964,0
2020-11-20,"The Daily Biotech Pulse: Amarin Surges On Vascepa Data, Mesoblast Rallies On Novartis Deal, Decision Day For Eiger",AZN,0.023505436655953,-0.3637894861262964,0.0007407958099834,-0.0176491510361493,-0.0236276106265345,-0.0189962417150123,0.0095003370724635,-0.0108498121434419,2.1747793776126336,1
2020-11-23,"Retail Earnings Roll On This Week With Best Buy, Nordstrom, Gap, Dollar Tree",AZN,-0.0108498121434419,2.1747793776126336,0.023505436655953,0.0007407958099834,-0.0176491510361493,-0.0236276106265345,-0.0189962417150123,-0.0206582081935811,-0.3898292686495106,1
2020-11-23,"Bill Gates Says AstraZeneca, Johnson & Johnson, Novavax COVID-19 Vaccines All Likely To Prove 'Very Efficacious And Safe' By February",AZN,-0.0108498121434419,2.1747793776126336,0.023505436655953,0.0007407958099834,-0.0176491510361493,-0.0236276106265345,-0.0189962417150123,-0.0206582081935811,-0.3898292686495106,1
2020-11-27,A Peek Into The Markets: US Stock Futures Edge Higher Following Thanksgiving Holiday,AZN,0.0001901510427699,0.2677580632712741,-0.0181071004573166,-0.0206582081935811,-0.0108498121434419,0.023505436655953,0.0007407958099834,0.0062725534140053,-0.0039233724768655,0
2020-11-27,"5 Stocks To Watch For November 27, 2020",AZN,0.0001901510427699,0.2677580632712741,-0.0181071004573166,-0.0206582081935811,-0.0108498121434419,0.023505436655953,0.0007407958099834,0.0062725534140053,-0.0039233724768655,0
2020-12-01,The COVID-19 Vaccine Front Runner Updates,AZN,0.0007555654903266,-0.096711759432809,0.0062725534140053,0.0001901510427699,-0.0181071004573166,-0.0206582081935811,-0.0108498121434419,0.0077386607635776,-0.6275721556863718,0
2020-12-03,South Korea Inks COVID-19 Vaccine Deal With AstraZeneca: Reuters,AZN,-0.0114252200719293,0.5982195126874861,0.0077386607635776,0.0007555654903266,0.0062725534140053,0.0001901510427699,-0.0181071004573166,0.0181887736902284,-0.4081923936795039,0
2020-12-03,The COVID-19 Vaccine Makes Its Way to the UK,AZN,-0.0114252200719293,0.5982195126874861,0.0077386607635776,0.0007555654903266,0.0062725534140053,0.0001901510427699,-0.0181071004573166,0.0181887736902284,-0.4081923936795039,0
2020-12-08,Pfizer Tells US It Can't Provide Substantial Extra Doses Before June As Other Countries Have Already Secured Supply: WaPo,AZN,0.0084778487111909,0.0189430190341641,0.0096760543920046,0.0181887736902284,-0.0114252200719293,0.0077386607635776,0.0007555654903266,-0.0124270100537186,0.1855805355119566,1
2020-12-08,Bill Gates Says 6 COVID-19 Vaccines Likely To Get Regulatory Approval By Q1,AZN,0.0084778487111909,0.0189430190341641,0.0096760543920046,0.0181887736902284,-0.0114252200719293,0.0077386607635776,0.0007555654903266,-0.0124270100537186,0.1855805355119566,1
2020-12-09,Specialized Equipment Has A Role In Re-Imagining The Automotive Industry,AZN,-0.0124270100537186,0.1855805355119566,0.0084778487111909,0.0096760543920046,0.0181887736902284,-0.0114252200719293,0.0077386607635776,-0.0027757342611091,-0.0484885066143554,2
2020-12-14,3 ETFs For AstraZeneca's $39B Alexion Pharmaceuticals Takeover,AZN,-0.0781278480380295,13.185684754521963,0.0070514128886725,-0.0027757342611091,-0.0124270100537186,0.0084778487111909,0.0096760543920046,0.0159903420517899,-0.594754693198005,0
2020-12-18,Johnson & Johnson's Late-Stage Trial Of Single Dose COVID-19 Vaccine Fully Enrolled,AZN,-0.0114194678133823,0.8538961969449459,-0.0027489259909705,0.0019674044820559,0.0159903420517899,-0.0781278480380295,0.0070514128886725,-0.0105557726123926,-0.4973101657185258,1
2020-12-21,"CDC Says Over 556,208 Pfizer/BioNTech COVID-19 Shots Administered In Week 1 Of Inoculation Drive",AZN,-0.0105557726123926,-0.4973101657185258,-0.0114194678133823,-0.0027489259909705,0.0019674044820559,0.0159903420517899,-0.0781278480380295,-0.0191223338049272,0.093386739651885,1
2020-12-22,"US Congress Clears $900B COVID-19 Relief Bill, $1.4T Government Spending Plan",AZN,-0.0191223338049272,0.093386739651885,-0.0105557726123926,-0.0114194678133823,-0.0027489259909705,0.0019674044820559,0.0159903420517899,0.0008208421392585,-0.2046772934699301,2
2020-12-22,"The Daily Biotech Pulse: Ziopharm To Start Blood Cancer Study, Chemocentryx & Soligenix Slump On Adverse Clinical Trial Outcomes",AZN,-0.0191223338049272,0.093386739651885,-0.0105557726123926,-0.0114194678133823,-0.0027489259909705,0.0019674044820559,0.0159903420517899,0.0008208421392585,-0.2046772934699301,2
2020-12-29,Moderna Agrees To Supply South Korea With COVID-19 Vaccine For 20M People: Yonhap,AZN,0.0105305652585243,0.1179829349110896,0.0177248261081319,-0.0051261808917337,0.0008208421392585,-0.0191223338049272,-0.0105557726123926,0.0056112527550269,-0.1709795765086518,0
2020-12-30,AstraZeneca COVID-19 Vaccine Gets UK Nod For Emergency Use,AZN,0.0056112527550269,-0.1709795765086518,0.0105305652585243,0.0177248261081319,-0.0051261808917337,0.0008208421392585,-0.0191223338049272,-0.0037864560474996,-0.2605808029771902,2
2021-01-07,Moderna Has Big Plans For 2021,AZN,-0.0141427949563398,0.0633246830629796,0.0041420946916825,0.0035629129264755,0.0106021463084138,-0.0037864560474996,0.0056112527550269,0.0133493558912261,-0.1892410009880111,0
2021-01-12,"The Daily Biotech Pulse: GSK, Vir To Start COVID-19 Antibody Study, Novartis In-Licenses BeiGene's Cancer Drug, Earnings Preannouncements Continue",AZN,-0.00534010146072,-0.1756376120476357,-0.0058985717157979,0.0133493558912261,-0.0141427949563398,0.0041420946916825,0.0035629129264755,0.011731969245865,0.189431704885344,0
2021-01-15,"The Daily Biotech Pulse: DBV's Positive FDA Feedback, Pfizer's Cancer Drug Gets Label Expansion, Applied DNA COVID Testing Volume Surges",AZN,0.0009748798008049,-0.1733858718765459,0.0080580625990396,0.011731969245865,-0.00534010146072,-0.0058985717157979,0.0133493558912261,0.023957909209521,0.4246850062998739,0
2021-01-20,"Biden's Day One Executive Orders Agenda To Include Health, Equality, Climate Change, Halt Trump Legacy Orders",AZN,-0.0062773265813516,0.0042376941048147,0.023957909209521,0.0009748798008049,0.0080580625990396,0.011731969245865,-0.00534010146072,0.005934291248288,0.1782301742231877,0
2021-01-21,"Fire Breaks Out At World's Largest Vaccine Manufacturer Site In India, Vaccine Production Not Hit: Report",AZN,0.005934291248288,0.1782301742231877,-0.0062773265813516,0.023957909209521,0.0009748798008049,0.0080580625990396,0.011731969245865,0.0133206021895067,-0.1670590726760844,0
2021-01-22,"Johnson & Johnson Could Have 100 Million COVID-19 Vaccines By April, Board Member McClellan Says",AZN,0.0133206021895067,-0.1670590726760844,0.005934291248288,-0.0062773265813516,0.023957909209521,0.0009748798008049,0.0080580625990396,0.014272170086313,0.0276757872381792,0
2021-01-25,Tata In Partnership Talks With Moderna To Launch COVID-19 Vaccine In India: Report,AZN,0.014272170086313,0.0276757872381792,0.0133206021895067,0.005934291248288,-0.0062773265813516,0.023957909209521,0.0009748798008049,0.0079615299619917,-0.1548738248391885,0
2021-01-28,"Preliminary Study Finds Pfizer's COVID-19 Vaccine Effective Against UK, South Africa Variants: WSJ",AZN,-0.001151621040028,-0.4244202828827095,-0.0429830856346901,0.0079615299619917,0.014272170086313,0.0133206021895067,0.005934291248288,-0.0276710841004144,0.5155585805034151,1
2021-01-29,Johnson & Johnson To Start With 2 Million Doses COVID-19 Vaccine Supply,AZN,-0.0276710841004144,0.5155585805034151,-0.001151621040028,-0.0429830856346901,0.0079615299619917,0.014272170086313,0.0133206021895067,-0.0039525335555055,0.1495686428993499,2
2021-02-02,Pfizer Expects COVID-19 Vaccine To Bring $15B In Revenue This Year,AZN,-0.0067459707199944,-0.2221316025742071,-0.0039525335555055,-0.0276710841004144,-0.001151621040028,-0.0429830856346901,0.0079615299619917,-0.0011986321281713,-0.2008934078133535,2
2021-02-02,Moderna Proposes Filling Vials With Additional Doses Of COVID-19 Vaccine - Reuters,AZN,-0.0067459707199944,-0.2221316025742071,-0.0039525335555055,-0.0276710841004144,-0.001151621040028,-0.0429830856346901,0.0079615299619917,-0.0011986321281713,-0.2008934078133535,2
2021-02-03,European Medical Agency Starts Rolling Review Of Novavax's COVID-19 Vaccine Candidate,AZN,-0.0011986321281713,-0.2008934078133535,-0.0067459707199944,-0.0039525335555055,-0.0276710841004144,-0.001151621040028,-0.0429830856346901,0.0072000163483154,-0.1931706671664994,0
2021-02-03,Switzerland Declines To Approve AstraZeneca COVID-19 Vaccine - Financial Times,AZN,-0.0011986321281713,-0.2008934078133535,-0.0067459707199944,-0.0039525335555055,-0.0276710841004144,-0.001151621040028,-0.0429830856346901,0.0072000163483154,-0.1931706671664994,0
2021-02-04,UK To Test Combining Pfizer And AstraZeneca Vaccines In Two-Shot Regimen - Reuters,AZN,0.0072000163483154,-0.1931706671664994,-0.0011986321281713,-0.0067459707199944,-0.0039525335555055,-0.0276710841004144,-0.001151621040028,-0.0125100173421067,0.3405031635623214,1
2021-02-05,Pfizer Drops India Vaccine Application After Regulator Seeks Local Trial - Reuters,AZN,-0.0125100173421067,0.3405031635623214,0.0072000163483154,-0.0011986321281713,-0.0067459707199944,-0.0039525335555055,-0.0276710841004144,0.0066359786658529,-0.1274593757008584,0
2021-02-05,"Next Week Includes Earnings From Twitter, Coca-Cola, General Motors, Disney",AZN,-0.0125100173421067,0.3405031635623214,0.0072000163483154,-0.0011986321281713,-0.0067459707199944,-0.0039525335555055,-0.0276710841004144,0.0066359786658529,-0.1274593757008584,0
2021-02-08,South Africa Halts AstraZeneca's COVID-19 Vaccine Rollout On Efficacy Against Variant,AZN,0.0066359786658529,-0.1274593757008584,-0.0125100173421067,0.0072000163483154,-0.0011986321281713,-0.0067459707199944,-0.0039525335555055,0.0069916683682527,-0.0585341916790316,0
2021-02-08,"Earnings Schedule This Week Includes General Motors, Disney, CocaCola, Uber",AZN,0.0066359786658529,-0.1274593757008584,-0.0125100173421067,0.0072000163483154,-0.0011986321281713,-0.0067459707199944,-0.0039525335555055,0.0069916683682527,-0.0585341916790316,0
2021-02-11,Merck In Talks To Possibly Produce COVID-19 Shots: WSJ,AZN,0.0024014190514534,0.3748110100863657,-0.0087285084060587,0.0069916683682527,0.0066359786658529,-0.0125100173421067,0.0072000163483154,0.0319424578535716,-0.1069297981319674,0
2021-02-11,"Earnings Scheduled For February 11, 2021",AZN,0.0024014190514534,0.3748110100863657,-0.0087285084060587,0.0069916683682527,0.0066359786658529,-0.0125100173421067,0.0072000163483154,0.0319424578535716,-0.1069297981319674,0
2021-02-17,AstraZeneca/Merck's PARP Inhibitor In Late-Stage Breast Cancer Study To Enter Early Analysis,AZN,0.0110041875042645,0.0782813686489181,-0.0154768993562094,0.0319424578535716,0.0024014190514534,-0.0087285084060587,0.0069916683682527,0.000971768933571,0.0260773596804708,2
2021-02-17,"The Daily Biotech Pulse: Novartis Funding For Gene Therapy Research, Priority Review For Amgen Cancer Drug, Pfizer-BioNTech Vaccine Supply Deal",AZN,0.0110041875042645,0.0782813686489181,-0.0154768993562094,0.0319424578535716,0.0024014190514534,-0.0087285084060587,0.0069916683682527,0.000971768933571,0.0260773596804708,2
2021-02-17,Shortage Of Giant Sterile Liners Threatens Global Vaccines Rollout: FT,AZN,0.0110041875042645,0.0782813686489181,-0.0154768993562094,0.0319424578535716,0.0024014190514534,-0.0087285084060587,0.0069916683682527,0.000971768933571,0.0260773596804708,2
2021-02-18,Pfizer Says South African Variant Could Significantly Reduce Vaccine Protection: Reuters,AZN,0.000971768933571,0.0260773596804708,0.0110041875042645,-0.0154768993562094,0.0319424578535716,0.0024014190514534,-0.0087285084060587,-0.0176698622545458,-0.2936355907028201,1
2021-02-22,Sanofi/GlaxoSmithKline Initiate COVID-19 Vaccine Development After Setback,AZN,-0.0003953314676927,0.5627356575207378,-0.0176698622545458,0.000971768933571,0.0110041875042645,-0.0154768993562094,0.0319424578535716,-0.0249158934341857,0.34891425389755,1
2021-02-23,FDA Says Conduct Smaller Trials To Test Vaccine Efficacy Against COVID Variants,AZN,-0.0249158934341857,0.34891425389755,-0.0003953314676927,-0.0176698622545458,0.000971768933571,0.0110041875042645,-0.0154768993562094,0.0160209861842275,-0.1594190934169882,0
2021-02-25,Moderna To Test New COVID-19 Vaccine Targeting South Africa Strain,AZN,-0.0048829235886445,0.0472476388456941,0.0160209861842275,-0.0249158934341857,-0.0003953314676927,-0.0176698622545458,0.000971768933571,-0.010836296420347,-0.3317234426652287,1
2021-02-25,Moderna Raises 2021 Base COVID-19 Vaccine Production Plan To 700M Doses,AZN,-0.0048829235886445,0.0472476388456941,0.0160209861842275,-0.0249158934341857,-0.0003953314676927,-0.0176698622545458,0.000971768933571,-0.010836296420347,-0.3317234426652287,1
2021-02-26,"The Daily Biotech Pulse: Adcom Test Awaits J&J's COVID-19 Vaccine, Lilly To Supply Additional Antibody Therapy Doses To US, Regulatory Setback For Tricida",AZN,-0.010836296420347,-0.3317234426652287,-0.0048829235886445,0.0160209861842275,-0.0249158934341857,-0.0003953314676927,-0.0176698622545458,-0.005994204567667,0.3313570025259613,1
2021-02-26,"AstraZeneca/Amgen's Tezepelumab Reduces Asthma Exacerbations, Phase 3 Trial Shows",AZN,-0.010836296420347,-0.3317234426652287,-0.0048829235886445,0.0160209861842275,-0.0249158934341857,-0.0003953314676927,-0.0176698622545458,-0.005994204567667,0.3313570025259613,1
2021-02-26,Johnson & Johnson's COVID-19 Vaccine Likely To Get EU Approval Early March: Bloomberg,AZN,-0.010836296420347,-0.3317234426652287,-0.0048829235886445,0.0160209861842275,-0.0249158934341857,-0.0003953314676927,-0.0176698622545458,-0.005994204567667,0.3313570025259613,1
2021-03-01,A Peek Into The Markets: US Stock Futures Rise; J&J Secures Emergency Authorization for Covid-19 Vaccine,AZN,-0.005994204567667,0.3313570025259613,-0.010836296420347,-0.0048829235886445,0.0160209861842275,-0.0249158934341857,-0.0003953314676927,-0.0074859538711642,0.261034546364858,1
2021-03-02,"Merck To Offer Hand With JNJ COVID-19 Vaccine Production, Biden Administration Says: Report",AZN,-0.0074859538711642,0.261034546364858,-0.005994204567667,-0.010836296420347,-0.0048829235886445,0.0160209861842275,-0.0249158934341857,-0.0119422424162506,-0.0226238985825235,1
2021-03-02,"People Allergic To Pfizer, Moderna COVID-19 Vaccine Might Be Allowed To Get JNJ Shot: CNBC",AZN,-0.0074859538711642,0.261034546364858,-0.005994204567667,-0.010836296420347,-0.0048829235886445,0.0160209861842275,-0.0249158934341857,-0.0119422424162506,-0.0226238985825235,1
2021-03-02,European Officials Seek To Garner Support For AstraZeneca COVID-19 Shot: CNBC,AZN,-0.0074859538711642,0.261034546364858,-0.005994204567667,-0.010836296420347,-0.0048829235886445,0.0160209861842275,-0.0249158934341857,-0.0119422424162506,-0.0226238985825235,1
2021-03-02,"AstraZeneca, Pfizer/BioNtech Single Shot COVID-19 Jab 80% Effective At Preventing Hospitalizations In Elderly",AZN,-0.0074859538711642,0.261034546364858,-0.005994204567667,-0.010836296420347,-0.0048829235886445,0.0160209861842275,-0.0249158934341857,-0.0119422424162506,-0.0226238985825235,1
2021-03-02,Novavax Bullish On Potential FDA EUA Nod For COVID-19 Vaccine By May,AZN,-0.0074859538711642,0.261034546364858,-0.005994204567667,-0.010836296420347,-0.0048829235886445,0.0160209861842275,-0.0249158934341857,-0.0119422424162506,-0.0226238985825235,1
2021-03-02,"The Daily Biotech Pulse: Roxadustat Delay For FibroGen, AstraZeneca, Decision Day For KemPharm, NanoViricides Jumps On COVID-19 Drug Data",AZN,-0.0074859538711642,0.261034546364858,-0.005994204567667,-0.010836296420347,-0.0048829235886445,0.0160209861842275,-0.0249158934341857,-0.0119422424162506,-0.0226238985825235,1
2021-03-03,EU Considers Emergency Approvals To Boost COVID-19 Vaccine Rollout: Reuters,AZN,-0.0119422424162506,-0.0226238985825235,-0.0074859538711642,-0.005994204567667,-0.010836296420347,-0.0048829235886445,0.0160209861842275,0.0014843915328457,0.1400186720069556,2
2021-03-04,"Emergent BioSolutions Capable Of Manufacturing 1B COVID-19 Vaccine Doses Annually, CEO Says",AZN,0.0014843915328457,0.1400186720069556,-0.0119422424162506,-0.0074859538711642,-0.005994204567667,-0.010836296420347,-0.0048829235886445,0.0175735523415054,-0.3014178190092771,0
2021-03-04,Novartis Lends Support To Manufacture CureVac's COVID-19 Shots,AZN,0.0014843915328457,0.1400186720069556,-0.0119422424162506,-0.0074859538711642,-0.005994204567667,-0.010836296420347,-0.0048829235886445,0.0175735523415054,-0.3014178190092771,0
2021-03-05,"WHO, SII Warn Of Raw Materials Shortage For COVID-19 Shots, Cites US Law As 'Serious' Limit:' Bloomberg",AZN,0.0175735523415054,-0.3014178190092771,0.0014843915328457,-0.0119422424162506,-0.0074859538711642,-0.005994204567667,-0.010836296420347,0.0027049485468131,0.0517414181909297,2
2021-03-09,New York Times Credits Report On Emergent BioSolutions For Biden's Canceled Vaccine Plant Visit,AZN,0.0224113418048474,0.3221390283331915,0.0027049485468131,0.0175735523415054,0.0014843915328457,-0.0119422424162506,-0.0074859538711642,0.0109599200792722,-0.1808598953607352,0
2021-03-09,"J&J Facing Supply Issues, Shaky To Meet EU Q2 Vaccine Deliveries: Reuters",AZN,0.0224113418048474,0.3221390283331915,0.0027049485468131,0.0175735523415054,0.0014843915328457,-0.0119422424162506,-0.0074859538711642,0.0109599200792722,-0.1808598953607352,0
2021-03-10,"Pfizer, BioNTech Predict Increase In Capacity To 3B COVID-19 Vaccine Shots In 2022: Bloomberg",AZN,0.0109599200792722,-0.1808598953607352,0.0224113418048474,0.0027049485468131,0.0175735523415054,0.0014843915328457,-0.0119422424162506,-0.0228869411277985,-0.0058764838514537,1
2021-03-11,Johnson & Johnson Poised To Win European Approval For Its COVID-19 Vaccine,AZN,-0.0228869411277985,-0.0058764838514537,0.0109599200792722,0.0224113418048474,0.0027049485468131,0.0175735523415054,0.0014843915328457,-0.0051367097880821,-0.2950947929096958,1
2021-03-15,"Germany, France Join List Of Countries Suspending AZN's COVID-19 Vaccine; WHO Urges Not To Halt Vaccinations",AZN,0.0072284915446831,0.1934572524047624,-0.0051367097880821,-0.0228869411277985,0.0109599200792722,0.0224113418048474,0.0027049485468131,0.0262456903130881,0.5751216487872697,0
2021-03-15,IDT Biologika To Make J&J's COVID-19 Vaccine Using Takeda's Manufacturing Capacity,AZN,0.0072284915446831,0.1934572524047624,-0.0051367097880821,-0.0228869411277985,0.0109599200792722,0.0224113418048474,0.0027049485468131,0.0262456903130881,0.5751216487872697,0
2021-03-16,"Thinking About Buying Stock In AstraZeneca, Apple, McDonald's, Savara Or Jabil?",AZN,0.0262456903130881,0.5751216487872697,0.0072284915446831,-0.0051367097880821,-0.0228869411277985,0.0109599200792722,0.0224113418048474,0.0003995200652509,-0.2242214243967604,2
2021-03-17,"Pfizer/BioNTech COVID-19 Vaccination Could Protect Pregnant Women, Newborns, Study In Israel Suggests: Reuters",AZN,0.0003995200652509,-0.2242214243967604,0.0262456903130881,0.0072284915446831,-0.0051367097880821,-0.0228869411277985,0.0109599200792722,-0.0147792103461411,-0.2472228842029197,1
2021-03-17,"AstraZeneca's COVID-19 Vaccine Has No Efficacy Against South African Virus Strain, Study Shows",AZN,0.0003995200652509,-0.2242214243967604,0.0262456903130881,0.0072284915446831,-0.0051367097880821,-0.0228869411277985,0.0109599200792722,-0.0147792103461411,-0.2472228842029197,1
2021-03-22,AstraZeneca's COVID-19 Shot Shows 79% Efficacy In US Trials,AZN,0.0404390449757348,0.4865661088852226,-0.0024326744060939,-0.0147792103461411,0.0003995200652509,0.0262456903130881,0.0072284915446831,-0.035156278640658,0.0792508917954815,1
2021-03-23,"Unhappy Anniversary: A Year After Pandemic Collapse, Market Looks Ahead To Q1 Earnings",AZN,-0.035156278640658,0.0792508917954815,0.0404390449757348,-0.0024326744060939,-0.0147792103461411,0.0003995200652509,0.0262456903130881,-0.0123481611673355,-0.4048183036779963,1
2021-03-24,Medically Necessary: The Fake Vaccine Supply Chain Threatens The Real Thing,AZN,-0.0123481611673355,-0.4048183036779963,-0.035156278640658,0.0404390449757348,-0.0024326744060939,-0.0147792103461411,0.0003995200652509,0.0186512551779143,0.0489926881189646,0
2021-03-24,"Is Now The Time To Buy Stock or Options In Intel, Uber, Airbnb, Tesla, AMC Or GameStop?",AZN,-0.0123481611673355,-0.4048183036779963,-0.035156278640658,0.0404390449757348,-0.0024326744060939,-0.0147792103461411,0.0003995200652509,0.0186512551779143,0.0489926881189646,0
2021-03-24,Intel Helps Market Comeback As Shares Rise Following Announcement,AZN,-0.0123481611673355,-0.4048183036779963,-0.035156278640658,0.0404390449757348,-0.0024326744060939,-0.0147792103461411,0.0003995200652509,0.0186512551779143,0.0489926881189646,0
2021-03-25,AstraZeneca Revises COVID-19 Vaccine Efficacy To 76% After Controversy,AZN,0.0186512551779143,0.0489926881189646,-0.0123481611673355,-0.035156278640658,0.0404390449757348,-0.0024326744060939,-0.0147792103461411,0.0189135369230888,0.4275315431899062,0
2021-03-29,White House Contemplates Waiving-Off Patent Protections For COVID-19 Treatments,AZN,0.0033571043778,-0.1086891578676281,0.0189135369230888,0.0186512551779143,-0.0123481611673355,-0.035156278640658,0.0404390449757348,-0.0165322339144037,-0.1811751652720632,1
2021-03-29,Glaxo To Fill About 60M Novavax COVID-19 Shots For Britain,AZN,0.0033571043778,-0.1086891578676281,0.0189135369230888,0.0186512551779143,-0.0123481611673355,-0.035156278640658,0.0404390449757348,-0.0165322339144037,-0.1811751652720632,1
