date,title,stock,close,volume,1_past_close,2_past_close,3_past_close,4_past_close,5_past_close,next_close,next_volume,label
2019-06-04,"The Daily Biotech Pulse: ASCO Presentations From Roche, Celgene & More, Edwards Recommends Rejection Of Mini-tender Offer",AZN,0.0182059092691417,0.4175486655875151,0.0139112085480548,-0.0034656646576413,-0.0005330423711762,-0.0126282361336698,-0.025884177860731,-0.0059601268935899,-0.3859104617456739,1
2019-06-07,Sanofi's Leadership Transition: What You Need To Know,AZN,0.0048931138851175,-0.083469794202257,0.0122523150019315,-0.0059601268935899,0.0182059092691417,0.0139112085480548,-0.0034656646576413,0.0146079721281673,0.4143126177024483,0
2019-07-05,"The Daily Biotech Pulse: FDA Approves Karyopharm's Blood Cancer, Grifols' Immunodeficiency Drug; ESMO, ISTH Conferences In The Spotlight",AZN,-0.0250060094616025,0.5457394172622321,0.006713101572604,0.0096826815848409,0.000726775018861,0.0070749907323546,0.0004881828364495,-0.0026868698725455,-0.2566063235764839,2
2019-07-12,"Novartis, Amgen Scrap Pivotal Study Of Alzheimer's Prevention Drug",AZN,-0.0059330851488494,0.3787406616862325,-0.0165329283436997,0.0095727886957794,-0.0022041482206274,-0.0026868698725455,-0.0250060094616025,0.0002485996935794,-0.3799114468836114,2
2019-07-25,25 Stocks Moving In Thursday's Pre-Market Session,AZN,0.0572492009610903,1.4335995889387143,-0.0056679528871157,0.0061988074189751,0.005234414087357,-0.0149766886995993,0.0096678146357618,0.0199248423009172,-0.5943453266408822,0
2019-07-26,Companies That Achieved 52-Week Highs Friday,AZN,0.0199248423009172,-0.5943453266408822,0.0572492009610903,-0.0056679528871157,0.0061988074189751,0.005234414087357,-0.0149766886995993,0.0202253190613501,0.5188085549351755,0
2019-07-29,New Equities that Broke Through 52-Week Highs Monday Morning,AZN,0.0202253190613501,0.5188085549351755,0.0199248423009172,0.0572492009610903,-0.0056679528871157,0.0061988074189751,0.005234414087357,-0.011939657020875,-0.4586195616617599,1
2019-08-14,"The Daily Biotech Pulse: Regeneron's Bad Cholesterol Drug Aces Late-Stage Trial, Oncolytics Offering",AZN,-0.0234062528612646,-0.1920751988430947,0.0112714600315702,-0.0091578075354722,0.0142726403844031,0.0154129448085755,0.0068775802927458,0.0084454927920052,-0.3128087635139973,0
2019-08-22,"The Daily Biotech Pulse: ViiV's Long-Acting HIV Drug Meets Study Goal, Chinese Cheer For FibroGen, Retrophin Flunks Late-Stage Study",AZN,-0.0002202253525749,-0.2417265947529631,0.0179291182903862,0.0045025318729827,0.0018043379275269,0.0036215553335823,0.0084454927920052,-0.0182777516022641,-0.1762639678602006,1
2019-09-18,"The Daily Biotech Pulse: NewLink Genetics Rallies, Breakthrough Designation For Roche, IGM Biosciences Debuts",AZN,0.0102017834700605,-0.5738131544169971,0.0145846065656682,-0.0060787699729615,-0.003030418373412,-0.0046402346404794,-0.0039289833644267,0.0238696783655711,0.981538021181185,0
2019-09-25,"The Daily Biotech Pulse: PhaseBio Leaps On Trial Results, Pacira Set To Join SmallCap 600 Index, Positive Readout For Amgen's Blood Cancer Drug",AZN,0.0037636251005606,0.4569205113952195,0.0134619487312641,-0.013501677701056,0.0127773916089337,0.0238696783655711,0.0102017834700605,0.0028673346586791,0.1153901182754673,2
2019-09-27,"The Daily Biotech Pulse: ESMO Conference Gets Underway, J&J's Darzalex Snags Another Approval, Kaleido Biosciences CFO To Leave",AZN,-0.0041788513766489,-0.5083912346338857,0.0028673346586791,0.0037636251005606,0.0134619487312641,-0.013501677701056,0.0127773916089337,-0.0156800936516948,0.5242878886714504,1
2019-09-30,"Movers And Shakers At ESMO 2019: Immunomedics, G1 Therapeutics, Seattle Genetics And More",AZN,-0.0156800936516948,0.5242878886714504,-0.0041788513766489,0.0028673346586791,0.0037636251005606,0.0134619487312641,-0.013501677701056,-0.0204173484051195,-0.1218795469458788,1
2019-10-09,13 Healthcare Stocks Moving In Wednesday's Pre-Market Session,AZN,0.0083643763679468,-0.3593598448108632,-0.009208119993654,0.0030016338888323,0.0032429745089419,0.0167214885519932,-0.0274848779084403,0.0046082549187793,2.13812768104971,2
2019-10-21,Earnings Season Kicks Into Full Gear In Round 3 Of The WeTrader Competition,AZN,-0.0034191399877512,0.4478100199915187,-0.0058919071287427,0.0077645598285212,-0.0095000608486516,0.0084397135755909,0.0059659784451562,0.0045745260753828,0.1117619984099753,2
2019-10-23,Biotech Stock On The Radar: Immunomedics' Long Wait For Redemption,AZN,0.0175319214816254,0.3867519759126834,0.0045745260753828,-0.0034191399877512,-0.0058919071287427,0.0077645598285212,-0.0095000608486516,0.0572835215917211,0.6291592031699507,0
2019-10-24,"Earnings Scheduled For October 24, 2019",AZN,0.0572835215917211,0.6291592031699507,0.0175319214816254,0.0045745260753828,-0.0034191399877512,-0.0058919071287427,0.0077645598285212,0.0088888388718846,-0.5553075231558606,0
2019-10-29,"The Daily Biotech Pulse: Mirati Tastes Success With KRAS Inhibitor, Roche-Spark Deal Delayed Further, Morphosys Halts Study",AZN,-0.0033508790851306,-0.5161759049532031,0.0016782953409826,0.0088888388718846,0.0572835215917211,0.0175319214816254,0.0045745260753828,0.0300485076219036,0.6566999381680063,0
2019-10-30,13 Healthcare Stocks Moving In Wednesday's Pre-Market Session,AZN,0.0300485076219036,0.6566999381680063,-0.0033508790851306,0.0016782953409826,0.0088888388718846,0.0572835215917211,0.0175319214816254,0.0002039666909068,0.5110767508197596,2
2019-11-01,"The Daily Biotech Pulse: Amgen Takes 20.5% Stake In BeiGene, Paratek's Mixed Clinical Readout, CareDx Slips On Guidance",AZN,-0.0130533411009324,-0.505292685508627,0.0002039666909068,0.0300485076219036,-0.0033508790851306,0.0016782953409826,0.0088888388718846,-0.0057862870517182,-0.1712135801148319,1
2019-11-08,"The Daily Biotech Pulse: Therapix Calls Off Merger, Alimera's Reverse Split, 2 Biotechs To Debut",AZN,0.0098290550499549,0.6968347383489741,-0.0114068424250126,0.0029660847805086,-0.0189149233567942,-0.0057862870517182,-0.0130533411009324,-0.00804061859908,-0.6330521184851894,1
2019-12-11,"The Daily Biotech Pulse: Correvio Faces FDA Panel Rejection, Iterum's Antibiotic Trial Narrowly Misses Primary Endpoint",AZN,0.0043769303474063,-0.0604114604521415,0.0043959079858644,0.0018876422570179,0.0012599551181653,-0.0120332381655335,0.0064731242811184,-0.0056027347010197,-0.403123550332457,1
2019-12-16,Stocks That Hit 52-Week Highs On Tuesday,AZN,0.0196444897733019,0.7255396077572038,0.0091818549344333,-0.0056027347010197,0.0043769303474063,0.0043959079858644,0.0018876422570179,-0.006895271034181,-0.5539399326941393,1
2019-12-17,"The Daily Biotech Pulse: Roche Gets US Antitrust Clearance For Spark Purchase, An Orphan Drug Designation For Prevail, Dynavax Names CEO",AZN,-0.006895271034181,-0.5539399326941393,0.0196444897733019,0.0091818549344333,-0.0056027347010197,0.0043769303474063,0.0043959079858644,0.0055134936312031,1.395658362989324,0
2019-12-20,"The Daily Biotech Pulse: Axovant Surges On Gene Therapy Study Results, FDA Approves Merck's Ebola Vaccine, Abeona Announces Offering",AZN,0.0098058700822343,0.0771708587485435,0.0148254267565144,0.0055134936312031,-0.006895271034181,0.0196444897733019,0.0091818549344333,-0.0112960658389119,-0.3234714003944773,1
2019-12-20,Stocks That Hit 52-Week Highs On Friday,AZN,0.0098058700822343,0.0771708587485435,0.0148254267565144,0.0055134936312031,-0.006895271034181,0.0196444897733019,0.0091818549344333,-0.0112960658389119,-0.3234714003944773,1
2019-12-30,Merck-AstraZeneca's Lynparza Snags FDA Nod For Pancreatic Cancer,AZN,-0.008524985012794,0.1980809192030315,0.0118356022542196,-0.0004010644453557,-0.0004009036571527,-0.0112960658389119,0.0098058700822343,-0.0029995206058283,-0.1072794980360148,2
2020-01-17,Stocks That Hit 52-Week Highs On Friday,AZN,0.0162346280042089,-0.1274729558522561,-0.005708764961977,0.0123555227214908,0.0102679466315278,-0.0036110282632485,-0.0045927747778794,-0.0103254559910117,-0.2687367362895119,1
2020-03-02,Attention Biotech Investors: Mark Your Calendar For These March PDUFA Dates,AZN,0.0472603467377612,0.0844868735083532,-0.0281783851726979,-0.0332474348847923,0.0104077131747406,-0.0107164584993034,-0.0514251879101569,-0.0076303134299492,-0.3075443401147626,1
2020-03-12,"The Daily Biotech Pulse: AstraZeneca Faces Setback In Ovarian Cancer Study, Mallinckrodt To Explore COVID-19 Treatment, Imara IPO",AZN,-0.0856886342572841,-0.0714481764847153,-0.0494670165499285,0.0369223346807305,-0.048190140018667,-0.0177759887515257,-0.0045266752071279,0.0372913573977986,1.1980823588095104,0
2020-03-16,Stocks That Hit 52-Week Lows On Monday,AZN,-0.1061966149779843,-0.3825180702639099,0.0372913573977986,-0.0856886342572841,-0.0494670165499285,0.0369223346807305,-0.048190140018667,0.0830907053898475,-0.2633935863232972,0
2020-03-17,"The Daily Biotech Pulse: Setback For DBV In Peanut Allergy Patch Review, Roche Starts Coronavirus Test Shipment, Regeneron Aims For 'Cocktail' COVID-19 Treatment",AZN,0.0830907053898475,-0.2633935863232972,-0.1061966149779843,0.0372913573977986,-0.0856886342572841,-0.0494670165499285,0.0369223346807305,-0.038358147187654,-0.0928543710848717,1
2020-04-28,"The Daily Biotech Pulse: Pfizer Earnings, Roche's Spinal Muscular Dystrophy Treatment, Moderna COVID-19 Vaccine Update",AZN,-0.0099068379420176,1.7399049881235156,0.0058615688415644,0.0156777842262567,0.000595701173933,0.0057918788473412,-0.0073354100589403,-0.0049047666200542,-0.3435630689206762,2
2020-04-29,"Earnings Scheduled For April 29, 2020",AZN,-0.0049047666200542,-0.3435630689206762,-0.0099068379420176,0.0058615688415644,0.0156777842262567,0.000595701173933,0.0057918788473412,0.0307571639551755,0.5487585842577918,0
2020-04-29,"The Daily Biotech Pulse: Inovio's MERS Vaccine Data, Fast Track Designation For Erytech, FDA Approves Higher Dose Of Merck's Keytruda",AZN,-0.0049047666200542,-0.3435630689206762,-0.0099068379420176,0.0058615688415644,0.0156777842262567,0.000595701173933,0.0057918788473412,0.0307571639551755,0.5487585842577918,0
2020-05-01,"The Daily Biotech Pulse: Gilead Slips Despite Forecast-Beating Q1, Moderna Partners With Lonza For Coronavirus Vaccine Production, Lyra Therapeutics IPO",AZN,-0.0080337691914287,-0.4531687018214066,0.0307571639551755,-0.0049047666200542,-0.0099068379420176,0.0058615688415644,0.0156777842262567,0.009448599345792,-0.1102482534930139,0
2020-05-20,"The Daily Biotech Pulse: Aldeyra Jumps Into COVID-19 Drug Fray, FDA Nod For Myriad's Companion Diagnostic Test",AZN,0.0039201174763721,0.2344093910491562,0.0022449753868769,0.0007489111670584,-0.001682215508427,-0.0327245563667932,0.022176910996682,0.0278914139574111,4.0589895988112925,0
2020-06-04,"The Daily Biotech Pulse: Positive Readout For Kezar, AstraZeneca Stitches Oncology Partnership, D-Day For Merck's Triple Combo Antibiotic",AZN,-0.0205454918892286,-0.1794407232531751,0.0051169504034425,-0.0079768130121362,0.0102564684515991,0.0205607185613494,0.0196301771411282,-0.0003713342737421,0.3587885005687268,2
2020-06-08,4 Analysts On Why The Rumored AstraZeneca-Gilead Deal Is Unlikely To Materialize,AZN,-0.0235838755303671,0.6024226905652945,-0.0003713342737421,-0.0205454918892286,0.0051169504034425,-0.0079768130121362,0.0102564684515991,0.0028527489871199,-0.5101407411959928,2
2020-06-11,Johnson & Johnson To Start Coronavirus Vaccine Human Trials Ahead Of Schedule In July,AZN,-0.0385906637104879,0.0446035001963951,0.0172576794806058,0.0028527489871199,-0.0235838755303671,-0.0003713342737421,-0.0205454918892286,-0.0019390804112059,0.1761646124921663,2
2020-06-15,A Peek Into The Markets: US Stock Futures Plunge Following Last Week's Selloff,AZN,0.0227317172804946,0.0144752499866791,-0.0019390804112059,-0.0385906637104879,0.0172576794806058,0.0028527489871199,-0.0235838755303671,0.0178572416878348,-0.0308659266781049,0
2020-06-18,"EU, Johnson & Johnson In Coronavirus Vaccine Talks: Report",AZN,-0.0230055717100737,-0.2282937935801264,0.0059722798725039,0.0178572416878348,0.0227317172804946,-0.0019390804112059,-0.0385906637104879,0.006836197060323,0.7932088195779878,0
2020-07-16,"The Daily Biotech Pulse: Mallinckrodt Gets FDA Panel Backing, Regulatory Setback For Tricida, Relay Therapeutics IPO",AZN,-0.0098275684834956,-0.3790378093204372,0.0744719554485926,0.0138991727117818,-0.0096724617935698,-0.0038912147729307,-0.0040596478140235,0.0639039182710272,0.9678040570610178,0
2020-07-16,"7 Stocks To Watch For July 16, 2020",AZN,-0.0098275684834956,-0.3790378093204372,0.0744719554485926,0.0138991727117818,-0.0096724617935698,-0.0038912147729307,-0.0040596478140235,0.0639039182710272,0.9678040570610178,0
2020-07-16,"A Peek Into The Markets: US Stock Futures Down Ahead Of Earnings, Economic Data",AZN,-0.0098275684834956,-0.3790378093204372,0.0744719554485926,0.0138991727117818,-0.0096724617935698,-0.0038912147729307,-0.0040596478140235,0.0639039182710272,0.9678040570610178,0
2020-07-20,Transportation Stocks Will Likely Be In Focus This Week As Several Report Earnings,AZN,-0.0396072291836463,1.3169308579534942,0.0639039182710272,-0.0098275684834956,0.0744719554485926,0.0138991727117818,-0.0096724617935698,-0.0103952659716256,-0.727552327913308,1
2020-07-24,Moderna Faces Hurdle With Coronavirus Vaccine As Court Refuses To Invalidate Arbutus Patent,AZN,0.0114192867196403,-0.105198119853561,-0.0317655188743514,-0.0187704963789289,-0.0103952659716256,-0.0396072291836463,0.0639039182710272,0.0139784870327874,-0.2694630872483221,0
2020-07-27,AstraZeneca To Pay $6B To Japan's Daiichi As Part of Collaboration On New Cancer Drugs,AZN,0.0139784870327874,-0.2694630872483221,0.0114192867196403,-0.0317655188743514,-0.0187704963789289,-0.0103952659716256,-0.0396072291836463,-0.0045952608829314,-0.1203314370516942,2
2020-07-28,"Moderna Looking To Price Its Coronavirus Vaccine At $50-$60, Significantly Above Rivals: FT",AZN,-0.0045952608829314,-0.1203314370516942,0.0139784870327874,0.0114192867196403,-0.0317655188743514,-0.0187704963789289,-0.0103952659716256,0.0056817983115693,0.0120102026470647,0
2020-07-28,"The Daily Biotech Pulse: Spectrum's Positive Dementia Readout, Pfizer, BioNTech Start Late-Stage Coronavirus Trial, resTORbio Receives COVID-19 Funding",AZN,-0.0045952608829314,-0.1203314370516942,0.0139784870327874,0.0114192867196403,-0.0317655188743514,-0.0187704963789289,-0.0103952659716256,0.0056817983115693,0.0120102026470647,0
2020-07-29,"Front Lines Against Coronavirus: Gilead, Moderna Prepare To Update Investors",AZN,0.0056817983115693,0.0120102026470647,-0.0045952608829314,0.0139784870327874,0.0114192867196403,-0.0317655188743514,-0.0187704963789289,0.0220692839796707,0.6303359860286968,0
2020-07-29,"GlaxoSmithKline, Sanofi Ink Deal With UK To Supply Up To 60M Doses of COVID-19 Vaccine",AZN,0.0056817983115693,0.0120102026470647,-0.0045952608829314,0.0139784870327874,0.0114192867196403,-0.0317655188743514,-0.0187704963789289,0.0220692839796707,0.6303359860286968,0
2020-07-30,"Earnings Scheduled For July 30, 2020",AZN,0.0220692839796707,0.6303359860286968,0.0056817983115693,-0.0045952608829314,0.0139784870327874,0.0114192867196403,-0.0317655188743514,-0.0364484778307721,-0.1676181665469683,1
2020-08-05,"J&J Clinches Coronavirus Vaccine Deal With US Government: $1B, 100M Doses",AZN,-0.0023181523209436,-0.2120447431635649,-0.013023587337856,0.0186446652770142,-0.0364484778307721,0.0220692839796707,0.0056817983115693,0.0046470039354651,0.0876701361088871,2
2020-08-06,Moderna Analyst Breaks Down Biopharma's Coronavirus Vaccine Pricing,AZN,0.0046470039354651,0.0876701361088871,-0.0023181523209436,-0.013023587337856,0.0186446652770142,-0.0364484778307721,0.0220692839796707,-0.0142323303111266,0.0897766201409926,1
2020-08-13,"AstraZeneca Inks Deal With Mexico, Argentina For Production, Supply Of Its COVID-19 Vaccine To Latin America",AZN,-0.0087049504171462,-0.361011953795742,0.028271172853713,-0.0036115011143401,-0.0005413356416497,-0.0142323303111266,0.0046470039354651,-0.0109319101792798,-0.1711167134590041,1
2020-08-13,A Peek Into The Markets: US Stock Futures Flat; Initial Jobless Claims Report In Focus,AZN,-0.0087049504171462,-0.361011953795742,0.028271172853713,-0.0036115011143401,-0.0005413356416497,-0.0142323303111266,0.0046470039354651,-0.0109319101792798,-0.1711167134590041,1
2020-08-14,Novavax To Supply 60M Coronavirus Vaccine Doses To UK Under New Deal,AZN,-0.0109319101792798,-0.1711167134590041,-0.0087049504171462,0.028271172853713,-0.0036115011143401,-0.0005413356416497,-0.0142323303111266,0.0230113915895988,0.0360488024055576,0
2020-08-17,CanSino Gets China's First COVID-19 Vaccine Patent,AZN,0.0230113915895988,0.0360488024055576,-0.0109319101792798,-0.0087049504171462,0.028271172853713,-0.0036115011143401,-0.0005413356416497,-0.0023024582530734,0.3927141713370696,2
2020-08-21,"The Daily Biotech Pulse: Pfizer-BioNTech Vaccine Data, Sorrento To Buy R&D Partner, Kymera IPO",AZN,-0.0138077728344685,0.3527992087042533,0.0046238969830212,-0.001775309139814,-0.0023024582530734,0.0230113915895988,-0.0109319101792798,0.0188475431823305,1.1581071595694898,0
2020-08-24,AstraZeneca's Coronavirus Vaccine Could Get FDA Approval For Emergency Use By October: FT,AZN,0.0188475431823305,1.1581071595694898,-0.0138077728344685,0.0046238969830212,-0.001775309139814,-0.0023024582530734,0.0230113915895988,0.0044045783115076,-0.5392736143108823,2
2020-08-24,"AstraZeneca, Airline Stocks All Getting An Early Boost Amid Hopes For Virus Treatment Progress",AZN,0.0188475431823305,1.1581071595694898,-0.0138077728344685,0.0046238969830212,-0.001775309139814,-0.0023024582530734,0.0230113915895988,0.0044045783115076,-0.5392736143108823,2
2020-08-24,Cannabis Countdown: Top 10 Marijuana And Psychedelic Stock News Stories Of The Week,AZN,0.0188475431823305,1.1581071595694898,-0.0138077728344685,0.0046238969830212,-0.001775309139814,-0.0023024582530734,0.0230113915895988,0.0044045783115076,-0.5392736143108823,2
2020-08-26,"AstraZeneca, Novavax, Pfizer, Others Lobby EU For Legal Protection Against COVID-19 Vaccine Liabilities: FT",AZN,-0.0001753705363075,-0.1756919728211312,0.0044045783115076,0.0188475431823305,-0.0138077728344685,0.0046238969830212,-0.001775309139814,-0.0156140005943361,0.4969668855266913,1
2020-08-31,FDA Head Says A COVID-19 Vaccine Could Get Emergency Approval Without Phase 3 Trial Results: FT,AZN,0.0055665888008447,0.0032903840831512,-0.0074854462352832,-0.0156140005943361,-0.0001753705363075,0.0044045783115076,0.0188475431823305,-0.0110713287746235,0.2085759823453687,1
2020-09-01,"Sanofi, Regeneron Rheumatoid Arthritis Drug Proves Ineffective Against COVID-19",AZN,-0.0110713287746235,0.2085759823453687,0.0055665888008447,-0.0074854462352832,-0.0156140005943361,-0.0001753705363075,0.0044045783115076,0.0093895857763557,-0.0834115290000253,0
2020-09-01,"No Conclusive Evidence On Convalescent Plasma Use Against COVID-19, NIH Says After FDA Emergency Use Approval",AZN,-0.0110713287746235,0.2085759823453687,0.0055665888008447,-0.0074854462352832,-0.0156140005943361,-0.0001753705363075,0.0044045783115076,0.0093895857763557,-0.0834115290000253,0
2020-09-02,3 Pharma Stocks That Are COVID-19 Resistant,AZN,0.0093895857763557,-0.0834115290000253,-0.0110713287746235,0.0055665888008447,-0.0074854462352832,-0.0156140005943361,-0.0001753705363075,-0.0311270955586162,0.4171877593935034,1
2020-09-03,"Be Ready To Distribute A COVID-19 Vaccine In Two Months, CDC Tells All States",AZN,-0.0311270955586162,0.4171877593935034,0.0093895857763557,-0.0110713287746235,0.0055665888008447,-0.0074854462352832,-0.0156140005943361,-0.0107088393924381,-0.0999609527528309,1
2020-09-04,The Dow Jones Index: The Story Of COVID-19 Winners,AZN,-0.0107088393924381,-0.0999609527528309,-0.0311270955586162,0.0093895857763557,-0.0110713287746235,0.0055665888008447,-0.0074854462352832,0.0210898046481675,0.4610845986984815,0
2020-09-08,AstraZeneca Shares Drop 8% As Advanced COVID-19 Vaccine Trials Are Halted,AZN,0.0210898046481675,0.4610845986984815,-0.0107088393924381,-0.0311270955586162,0.0093895857763557,-0.0110713287746235,0.0055665888008447,-0.0195576039582036,0.6949195320387196,1
2020-09-08,"As Political Pressure Mounts, COVID-19 Vaccine Developers Pledge To Put Safety First",AZN,0.0210898046481675,0.4610845986984815,-0.0107088393924381,-0.0311270955586162,0.0093895857763557,-0.0110713287746235,0.0055665888008447,-0.0195576039582036,0.6949195320387196,1
2020-09-09,Tech Stocks Continued To Tumble On Tuesday,AZN,-0.0195576039582036,0.6949195320387196,0.0210898046481675,-0.0107088393924381,-0.0311270955586162,0.0093895857763557,-0.0110713287746235,-0.0106264160794913,-0.61396424410711,1
2020-09-09,"The Daily Biotech Pulse: AstraZeneca Pauses Coronavirus Vaccine Study, Trillium To Get $25M Pfizer Investment",AZN,-0.0195576039582036,0.6949195320387196,0.0210898046481675,-0.0107088393924381,-0.0311270955586162,0.0093895857763557,-0.0110713287746235,-0.0106264160794913,-0.61396424410711,1
2020-09-09,"Tesla, Apple Bounce Back After Three-Day Slide As Market Has Sunnier Disposition",AZN,-0.0195576039582036,0.6949195320387196,0.0210898046481675,-0.0107088393924381,-0.0311270955586162,0.0093895857763557,-0.0110713287746235,-0.0106264160794913,-0.61396424410711,1
2020-09-10,"GameStop Earnings Disappoint; Chewy, Peloton Open Books After Market Closes",AZN,-0.0106264160794913,-0.61396424410711,-0.0195576039582036,0.0210898046481675,-0.0107088393924381,-0.0311270955586162,0.0093895857763557,0.012436446071774,0.0500555921127272,0
2020-09-14,Oracle Up Sharply After News Reports Say It Has Been Chosen As TikTok Partner,AZN,0.0053973461715808,0.0718067290446657,0.012436446071774,-0.0106264160794913,-0.0195576039582036,0.0210898046481675,-0.0107088393924381,0.0233247097071296,-0.132883064516129,0
2020-09-14,'Room For Disappointment': Stock Market Update For The Week Ahead,AZN,0.0053973461715808,0.0718067290446657,0.012436446071774,-0.0106264160794913,-0.0195576039582036,0.0210898046481675,-0.0107088393924381,0.0233247097071296,-0.132883064516129,0
2020-09-16,AstraZeneca Trial Participant Adverse Events Likely Unrelated To COVID-19 Vaccine: Oxford,AZN,-0.0027134709976063,-0.0819363389058104,0.0233247097071296,0.0053973461715808,0.012436446071774,-0.0106264160794913,-0.0195576039582036,0.0146925227539609,0.0109915157654805,0
2020-09-16,Pfizer Says COVID-19 Vaccine Only Showed Moderate Side-Effects In Preliminary Late-Stage Trials,AZN,-0.0027134709976063,-0.0819363389058104,0.0233247097071296,0.0053973461715808,0.012436446071774,-0.0106264160794913,-0.0195576039582036,0.0146925227539609,0.0109915157654805,0
2020-09-17,Is AstraZeneca Still A Safe Bet?,AZN,0.0146925227539609,0.0109915157654805,-0.0027134709976063,0.0233247097071296,0.0053973461715808,0.012436446071774,-0.0106264160794913,0.0091170106358089,-0.2655878153260352,0
2020-09-21,"A Peek Into The Markets: US Stock Futures Plunge; Trump Gives ""Blessing"" to TikTok-Oracle-Walmart Deal",AZN,-0.0095660445621205,1.316983320257871,0.0091170106358089,0.0146925227539609,-0.0027134709976063,0.0233247097071296,0.0053973461715808,-0.0084064003886296,-0.4290046667746257,1
2020-09-21,"5 Stocks To Watch For September 21, 2020",AZN,-0.0095660445621205,1.316983320257871,0.0091170106358089,0.0146925227539609,-0.0027134709976063,0.0233247097071296,0.0053973461715808,-0.0084064003886296,-0.4290046667746257,1
2020-09-23,Johnson & Johnson Advances Coronavirus Vaccine Candidate; EUA Likely In Early 2021,AZN,0.0039682915559111,-0.2464033414118496,-0.0084064003886296,-0.0095660445621205,0.0091170106358089,0.0146925227539609,-0.0027134709976063,-0.0267697593571799,0.4108248657155564,1
2020-09-24,FDA Vaccine Committee Head Steps Aside Over Conflict Of Interest With Moderna Role,AZN,-0.0267697593571799,0.4108248657155564,0.0039682915559111,-0.0084064003886296,-0.0095660445621205,0.0091170106358089,0.0146925227539609,0.0247369425669836,0.2015665543080242,0
2020-09-24,Current Updates On COVID-19 Vaccines,AZN,-0.0267697593571799,0.4108248657155564,0.0039682915559111,-0.0084064003886296,-0.0095660445621205,0.0091170106358089,0.0146925227539609,0.0247369425669836,0.2015665543080242,0
2020-09-24,Novavax Shares Surge 7% As It Begins Late-Stage COVID-19 Vaccine Trials,AZN,-0.0267697593571799,0.4108248657155564,0.0039682915559111,-0.0084064003886296,-0.0095660445621205,0.0091170106358089,0.0146925227539609,0.0247369425669836,0.2015665543080242,0
2020-09-29,Stocks To Watch Amid The First Trump Vs. Biden Presidential Debate,AZN,0.0065753569288282,0.523856423725104,-0.0136911038112359,0.0247369425669836,-0.0267697593571799,0.0039682915559111,-0.0084064003886296,-0.0056251728943088,-0.2815320167564332,1
2020-10-01,Will October Be A Reachable Goal For A Vaccine?,AZN,-0.0091241534713709,0.5753315119610849,-0.0056251728943088,0.0065753569288282,-0.0136911038112359,0.0247369425669836,-0.0267697593571799,-0.0014732832468008,0.2053424136034853,2
2020-10-01,"October FDA, CDC Meetings On Coronavirus Vaccines Set Stage For Emergency Use Authorization",AZN,-0.0091241534713709,0.5753315119610849,-0.0056251728943088,0.0065753569288282,-0.0136911038112359,0.0247369425669836,-0.0267697593571799,-0.0014732832468008,0.2053424136034853,2
2020-10-06,"COVID-19 Vaccine Makers AstraZeneca, GSK To Get First Access To Nvidia's 'Cambridge-1' Supercomputer",AZN,-0.0143145726112932,-0.4488611786465403,0.0049797800373789,-0.0014732832468008,-0.0091241534713709,-0.0056251728943088,0.0065753569288282,-0.0033513766618278,-0.0477131258457375,2
2020-10-07,Bill Gates Says Regulatory Approval For Antibody Drugs Could Sharply Reduce COVID-19 Mortality,AZN,-0.0033513766618278,-0.0477131258457375,-0.0143145726112932,0.0049797800373789,-0.0014732832468008,-0.0091241534713709,-0.0056251728943088,0.0104614052739961,-0.3317702560604768,0
2020-10-13,Eli Lilly Halts Antibody COVID-19 Trial,AZN,-0.0142935961975662,0.0597449254535655,0.0100511148153958,0.0116474132346247,0.0104614052739961,-0.0033513766618278,-0.0143145726112932,-0.0236783138655435,0.5786154993558885,1
