date,title,stock,close,volume,1_past_close,2_past_close,3_past_close,4_past_close,5_past_close,next_close,next_volume,label
2021-03-31,EMA May Issue Updated Recommendation If AstraZeneca Jab-Clot Link Is Established: Report,AZN,-0.0050030749238462,-0.0559648825654923,-0.0165322339144037,0.0033571043778,0.0189135369230888,0.0186512551779143,-0.0123481611673355,-0.0038213146061206,-0.1091009673609137,2
2021-03-31,Pfizer-BioNTech's COVID-19 Vaccine Gives 100% Protection In Adolescents,AZN,-0.0050030749238462,-0.0559648825654923,-0.0165322339144037,0.0033571043778,0.0189135369230888,0.0186512551779143,-0.0123481611673355,-0.0038213146061206,-0.1091009673609137,2
2021-04-01,EU Turns To India To Fill AstraZeneca Vaccine Supply Gap: Reuters,AZN,-0.0038213146061206,-0.1091009673609137,-0.0050030749238462,-0.0165322339144037,0.0033571043778,0.0189135369230888,0.0186512551779143,0.0,-0.1115362669083341,2
2021-04-01,15M Doses Of JNJ COVID-19 Vaccine Batch Ruined After Ingredient Issues At Emergent Biosolutions' US Plant: NYT,AZN,-0.0038213146061206,-0.1091009673609137,-0.0050030749238462,-0.0165322339144037,0.0033571043778,0.0189135369230888,0.0186512551779143,0.0,-0.1115362669083341,2
2021-04-05,Emergent BioSolutions' Plasma-Based Therapy Candidate Flunks COVID-19 Study; HHS Increases Task Order By $23M,AZN,0.0,-0.1115362669083341,-0.0038213146061206,-0.0050030749238462,-0.0165322339144037,0.0033571043778,0.0189135369230888,-0.0062588244514397,0.346392142047601,1
2021-04-06,Is Silicon Valley Replacing Big Pharma In Neuroscience?,AZN,-0.0062588244514397,0.346392142047601,0.0,-0.0038213146061206,-0.0050030749238462,-0.0165322339144037,0.0033571043778,-0.0162536953217136,0.3284744240859731,1
2021-04-07,Fed Minutes Later Today Loom Large As Investors Seek Insight Into FOMC's Next Steps,AZN,-0.0162536953217136,0.3284744240859731,-0.0062588244514397,0.0,-0.0038213146061206,-0.0050030749238462,-0.0165322339144037,0.0223049700755906,0.094222259771256,0
2021-04-07,Europe's Drug Watchdog Concludes Possible Link Between AstraZeneca COVID-19 Vaccine And Blood Clots,AZN,-0.0162536953217136,0.3284744240859731,-0.0062588244514397,0.0,-0.0038213146061206,-0.0050030749238462,-0.0165322339144037,0.0223049700755906,0.094222259771256,0
2021-04-08,"Government, Officials Defend AstraZeneca's COVID-19 Shot: CNBC",AZN,0.0223049700755906,0.094222259771256,-0.0162536953217136,-0.0062588244514397,0.0,-0.0038213146061206,-0.0050030749238462,0.0088887960185293,-0.2826961867719302,0
2021-04-08,US Allocates Significantly Lower Number Of J&J Vaccines To States For Next Week: Reuters,AZN,0.0223049700755906,0.094222259771256,-0.0162536953217136,-0.0062588244514397,0.0,-0.0038213146061206,-0.0050030749238462,0.0088887960185293,-0.2826961867719302,0
2021-04-09,J&J Seeks To Conduct Study For COVID-19 Vaccine In India: Reuters,AZN,0.0088887960185293,-0.2826961867719302,0.0223049700755906,-0.0162536953217136,-0.0062588244514397,0.0,-0.0038213146061206,-0.0104124816713196,0.0616641102230832,1
2021-04-09,"Johnson & Johnson's COVID-19 Vaccine Under Review At EMA For Blood Clots, AstraZeneca Probe Expanded",AZN,0.0088887960185293,-0.2826961867719302,0.0223049700755906,-0.0162536953217136,-0.0062588244514397,0.0,-0.0038213146061206,-0.0104124816713196,0.0616641102230832,1
2021-04-12,AstraZeneca Farxiga Drug Doesn't Work Against COVID-19,AZN,-0.0104124816713196,0.0616641102230832,0.0088887960185293,0.0223049700755906,-0.0162536953217136,-0.0062588244514397,0.0,-0.0046539802230083,-0.0198466510360559,2
2021-04-12,"South African Variant Able To Elude Pfizer/BioNTech' Vaccine Protection, Israeli Study Shows: Reports",AZN,-0.0104124816713196,0.0616641102230832,0.0088887960185293,0.0223049700755906,-0.0162536953217136,-0.0062588244514397,0.0,-0.0046539802230083,-0.0198466510360559,2
2021-04-13,"FDA, CDC Officials Discuss Johnson & Johnson Vaccine: A 'Pause Recommendation', Resolution Timeline And Advisory",AZN,-0.0046539802230083,-0.0198466510360559,-0.0104124816713196,0.0088887960185293,0.0223049700755906,-0.0162536953217136,-0.0062588244514397,0.0132140507349403,0.5339738036436985,0
2021-04-13,"Why Vaccine Stocks Pfizer, BioNTech, Moderna And Novavax Are Higher",AZN,-0.0046539802230083,-0.0198466510360559,-0.0104124816713196,0.0088887960185293,0.0223049700755906,-0.0162536953217136,-0.0062588244514397,0.0132140507349403,0.5339738036436985,0
2021-04-14,"UK Trial On Mix-Match COVID-19 Vaccines Expanded To Add Moderna, Novavax Shots",AZN,0.0132140507349403,0.5339738036436985,-0.0046539802230083,-0.0104124816713196,0.0088887960185293,0.0223049700755906,-0.0162536953217136,0.019863698193711,0.1719039751845983,0
2021-04-19,"JNJ COVID-19 Vaccine Could Return This Week With Warning, Says Anthony Fauci",AZN,0.017540378580205,-0.2727350650991148,-0.0017706839725484,0.019863698193711,0.0132140507349403,-0.0046539802230083,-0.0104124816713196,0.0123958775600783,-0.1351244052677613,0
2021-04-20,"EMA Finds Potential Blood Clot Link With JNJ COVID-19 Shot, Adds Safety Warning",AZN,0.0123958775600783,-0.1351244052677613,0.017540378580205,-0.0017706839725484,0.019863698193711,0.0132140507349403,-0.0046539802230083,0.0160704592034564,-0.1800766008721597,0
2021-04-21,"House Democrats Investigating Emergent BioSolutions' Vaccine Contracts, Call On Execs To Testify",AZN,0.0160704592034564,-0.1800766008721597,0.0123958775600783,0.017540378580205,-0.0017706839725484,0.019863698193711,0.0132140507349403,-0.0075315281226929,-0.1745759598309962,1
2021-04-21,Johnson&johnso Set To Resume COVID-19 Vaccine Rollout In Europe — With A Warning On The Label,AZN,0.0160704592034564,-0.1800766008721597,0.0123958775600783,0.017540378580205,-0.0017706839725484,0.019863698193711,0.0132140507349403,-0.0075315281226929,-0.1745759598309962,1
2021-04-21,"FDA's Inspection Of Emergent's COVID-19 Vaccine Baltimore Plant Outlines Concerns About Sanitary Conditions, Employee Training",AZN,0.0160704592034564,-0.1800766008721597,0.0123958775600783,0.017540378580205,-0.0017706839725484,0.019863698193711,0.0132140507349403,-0.0075315281226929,-0.1745759598309962,1
2021-04-22,Johnson & Johnson's Vaccine Is On Hold But lts Businesses Emerged Healthier From The Pandemic,AZN,-0.0075315281226929,-0.1745759598309962,0.0160704592034564,0.0123958775600783,0.017540378580205,-0.0017706839725484,0.019863698193711,-0.0085373435762363,-0.3045040271301399,1
2021-04-23,Johnson & Johnson COVID-19 Vaccine Could Make Its Way To India By July,AZN,-0.0085373435762363,-0.3045040271301399,-0.0075315281226929,0.0160704592034564,0.0123958775600783,0.017540378580205,-0.0017706839725484,0.0021047811613719,-0.0169442455087083,2
2021-04-23,JNJ's COVID-19 Vaccine Halt Due To Blood-Clot Concerns To Be Scrutinized Today: WSJ,AZN,-0.0085373435762363,-0.3045040271301399,-0.0075315281226929,0.0160704592034564,0.0123958775600783,0.017540378580205,-0.0017706839725484,0.0021047811613719,-0.0169442455087083,2
2021-04-26,A Peek Into The Markets: US Stock Futures Mixed; Tesla Earnings In Focus,AZN,0.0021047811613719,-0.0169442455087083,-0.0085373435762363,-0.0075315281226929,0.0160704592034564,0.0123958775600783,0.017540378580205,0.0,0.2930636286135006,2
2021-04-26,US To Send COVID-19 Vaccine Raw Materials 'Urgently Required' To Help India Tackle Surge In Infections,AZN,0.0021047811613719,-0.0169442455087083,-0.0085373435762363,-0.0075315281226929,0.0160704592034564,0.0123958775600783,0.017540378580205,0.0,0.2930636286135006,2
2021-04-27,US To Share Up To 60M AstraZeneca COVID-19 Vaccine Doses,AZN,0.0,0.2930636286135006,0.0021047811613719,-0.0085373435762363,-0.0075315281226929,0.0160704592034564,0.0123958775600783,-0.0055373622103206,-0.0236268610198748,1
2021-04-29,Pfizer-BioNTech Bullish On COVID-19 Vaccine Trial Results In Infants By September: Reuters,AZN,-0.0136329303688026,0.3690316877631949,-0.0055373622103206,0.0,0.0021047811613719,-0.0085373435762363,-0.0075315281226929,0.0330932013482012,0.3719072003156696,0
2021-04-30,Emergent BioSolutions Has Supply Of 60M Johnson & Johnson COVID-19 Vaccine Doses Awaiting Approval: Bloomberg,AZN,0.0330932013482012,0.3719072003156696,-0.0136329303688026,-0.0055373622103206,0.0,0.0021047811613719,-0.0085373435762363,0.0118711736887118,-0.5661720486338083,0
2021-04-30,Novavax Secures Additional $147M From Warp Speed Program For COVID-19 Vaccine,AZN,0.0330932013482012,0.3719072003156696,-0.0136329303688026,-0.0055373622103206,0.0,0.0021047811613719,-0.0085373435762363,0.0118711736887118,-0.5661720486338083,0
2021-04-30,"Emergent BioSolutions Hopeful To Restart Vaccine Production, Plans To Submit Response To FDA Within Days",AZN,0.0330932013482012,0.3719072003156696,-0.0136329303688026,-0.0055373622103206,0.0,0.0021047811613719,-0.0085373435762363,0.0118711736887118,-0.5661720486338083,0
2021-04-30,"Earnings Scheduled For April 30, 2021",AZN,0.0330932013482012,0.3719072003156696,-0.0136329303688026,-0.0055373622103206,0.0,0.0021047811613719,-0.0085373435762363,0.0118711736887118,-0.5661720486338083,0
2021-05-03,Novavax Next In List To Start Testing Its COVID-19 Shot In Adolescents,AZN,0.0118711736887118,-0.5661720486338083,0.0330932013482012,-0.0136329303688026,-0.0055373622103206,0.0,0.0021047811613719,-0.0143389750996876,0.227974746485452,1
2021-05-05,Facebook Sees Paid Subscribers For Workplace Rise 40% But It Remains Far Behind Microsoft's Teams,AZN,0.0136029297201707,-0.0968379204142483,-0.0143389750996876,0.0118711736887118,0.0330932013482012,-0.0136329303688026,-0.0055373622103206,-0.0031686816816284,-0.2524420895319611,2
2021-05-06,"Biden Administration Backs Waiving IP Protections For COVID-19 Vaccines, Pharma Industry Rebukes Move",AZN,-0.0031686816816284,-0.2524420895319611,0.0136029297201707,-0.0143389750996876,0.0118711736887118,0.0330932013482012,-0.0136329303688026,0.006170522745551,-0.1320332945623727,0
2021-05-07,"EMA Safety Committee Reviews Heart Inflammation, Rare Nerve Disorder Reports After Pfizer, AstraZeneca COVID-19 Shots",AZN,0.006170522745551,-0.1320332945623727,-0.0031686816816284,0.0136029297201707,-0.0143389750996876,0.0118711736887118,0.0330932013482012,0.0105928124611753,0.7508741807826798,0
2021-05-07,COVID-19 Vaccine Patent Polarizes The World: What You Need to Know,AZN,0.006170522745551,-0.1320332945623727,-0.0031686816816284,0.0136029297201707,-0.0143389750996876,0.0118711736887118,0.0330932013482012,0.0105928124611753,0.7508741807826798,0
2021-05-10,FDA Outlines Plan For Restarting Facility Inspections Halted Due To Pandemic,AZN,0.0105928124611753,0.7508741807826798,0.006170522745551,-0.0031686816816284,0.0136029297201707,-0.0143389750996876,0.0118711736887118,-0.0051489450141259,-0.1054651997129872,1
2021-05-10,FDA To Hold AdCom Meeting For Expanding Use COVID-19 Vaccine In Children,AZN,0.0105928124611753,0.7508741807826798,0.006170522745551,-0.0031686816816284,0.0136029297201707,-0.0143389750996876,0.0118711736887118,-0.0051489450141259,-0.1054651997129872,1
2021-05-11,Cannabis Industry Salary Report: Increased Demand For Top Talent As Salaries Continue To Surge,AZN,-0.0051489450141259,-0.1054651997129872,0.0105928124611753,0.006170522745551,-0.0031686816816284,0.0136029297201707,-0.0143389750996876,0.0073937055176265,0.115693640459352,0
2021-05-14,"The Daily Biotech Pulse: CorMedix Slumps On Delay In Resubmission of DefenCath NDA, Apellis Awaits FDA Decision, Vera Therapeutics Debuts",AZN,0.0029065174327931,-0.2890065102029652,0.01009172980837,0.0073937055176265,-0.0051489450141259,0.0105928124611753,0.006170522745551,0.0121354660238706,0.0634221410022122,0
2021-05-17,US Poised To Dispatch 20M Additional COVID-19 Shots To Countries In Need: CNBC,AZN,0.0121354660238706,0.0634221410022122,0.0029065174327931,0.01009172980837,0.0073937055176265,-0.0051489450141259,0.0105928124611753,0.0019685727315263,0.2631055316377844,2
2021-05-18,G20 Countries Water Down US Push For COVID-19 IP Waiver: Reuters,AZN,0.0019685727315263,0.2631055316377844,0.0121354660238706,0.0029065174327931,0.01009172980837,0.0073937055176265,-0.0051489450141259,0.0062509646990751,0.4818336746530711,0
2021-05-21,Pfizer Hits Deadlock With India Over Vaccine Indemnity Issue: Reuters,AZN,-0.0006962389054741,-0.2870049054786037,0.0195242917376039,0.0062509646990751,0.0019685727315263,0.0121354660238706,0.0029065174327931,0.0012194409231767,-0.4037475181998676,2
2021-05-26,FDA May Not Review New COVID-19 Vaccine Emergency Use Requests,AZN,-0.0065014147438334,-0.4512107829234364,-0.0097442015072852,0.0012194409231767,-0.0006962389054741,0.0195242917376039,0.0062509646990751,0.0061901577353733,2.0431166018605107,0
2021-05-27,India To Skip Local Trials for 'Well Established' COVID-19 Vaccines; Pfizer Shots May Arrive By July: Reuters,AZN,0.0061901577353733,2.0431166018605107,-0.0065014147438334,-0.0097442015072852,0.0012194409231767,-0.0006962389054741,0.0195242917376039,-0.0021092609380486,-0.5501075581865529,2
2021-05-28,Emergent BioSolutions Poised To Receive FDA Nod to Restart J&J COVID-19 Shot Production at Baltimore Plant After Mishap: WSJ,AZN,-0.0021092609380486,-0.5501075581865529,0.0061901577353733,-0.0065014147438334,-0.0097442015072852,0.0012194409231767,-0.0006962389054741,-0.0091597552399268,0.2146285344502165,1
2021-06-01,Attention Biotech Investors: Mark Your Calendar For June PDUFA Dates,AZN,-0.0091597552399268,0.2146285344502165,-0.0021092609380486,0.0061901577353733,-0.0065014147438334,-0.0097442015072852,0.0012194409231767,-0.0026667340668834,-0.100531293010315,2
2021-06-01,"CureVac's COVID-19 Vaccine Is Safe, But Efficacy Not Yet Disclosed",AZN,-0.0091597552399268,0.2146285344502165,-0.0021092609380486,0.0061901577353733,-0.0065014147438334,-0.0097442015072852,0.0012194409231767,-0.0026667340668834,-0.100531293010315,2
2021-06-03,AstraZeneca Seeks Switching COVID-19 Vaccine Production to Catalent Plant: NYT,AZN,0.0026738645525758,-0.0954457204909671,-0.0026667340668834,-0.0091597552399268,-0.0021092609380486,0.0061901577353733,-0.0065014147438334,0.009777764588035,-0.1143932917401823,0
2021-06-04,"AstraZeneca, Merck Lynparza Earns Win in Early Breast Cancer, Showing Potential in Post-Surgery Setting",AZN,0.009777764588035,-0.1143932917401823,0.0026738645525758,-0.0026667340668834,-0.0091597552399268,-0.0021092609380486,0.0061901577353733,-0.0070422441134579,0.2903795596450871,1
2021-06-04,"The Daily Biotech Pulse: Merck, AstraZeneca, Novartis Among Early Presenters At ASCO, Sanofi Strikes Breast Cancer Study Pact",AZN,0.009777764588035,-0.1143932917401823,0.0026738645525758,-0.0026667340668834,-0.0091597552399268,-0.0021092609380486,0.0061901577353733,-0.0070422441134579,0.2903795596450871,1
2021-06-07,"The Week Ahead In Biotech: Biogen, Alexion And Vertex FDA Decisions, Multiple Conference Presentations On The Deck",AZN,-0.0070422441134579,0.2903795596450871,0.009777764588035,0.0026738645525758,-0.0026667340668834,-0.0091597552399268,-0.0021092609380486,-0.0015957425339946,-0.1779358864164517,2
2021-06-07,"Safety Concerns, Lower Demand Interrupts Use of Johnson & Johnson COVID-19 Shot: Reuters",AZN,-0.0070422441134579,0.2903795596450871,0.009777764588035,0.0026738645525758,-0.0026667340668834,-0.0091597552399268,-0.0021092609380486,-0.0015957425339946,-0.1779358864164517,2
2021-06-15,Fusion Pharma's Stock Moves Higher As Radiopharmaceutical Candidate Shows Early Promising Action In Solid Tumor Study,AZN,0.0013614686299128,-0.0994891385086482,-0.0001702225627731,-0.0011895974868251,0.0215277494184833,0.0229088663062941,-0.0015957425339946,-0.007307876476519,0.1730523197091105,1
2021-06-23,14 Biotech Stocks To Watch Over The Next 6 Months,AZN,0.0015546705100197,0.184677238310986,-0.0072028032901936,-0.0010279239678357,0.0003427587659288,-0.0010272883334778,-0.007307876476519,0.0075887443991036,-0.0959378445424475,0
2021-06-24,"The Daily Biotech Pulse: Lily Spikes On Alzheimer's Drug Regulatory Filing Plan, Applied Genetics, Arcus Issue Data Readouts, Adcom Test Awaits Incyte, Monte Rosa Prices IPO",AZN,0.0075887443991036,-0.0959378445424475,0.0015546705100197,-0.0072028032901936,-0.0010279239678357,0.0003427587659288,-0.0010272883334778,0.0159191850748821,0.8164408620591093,0
2021-06-28,"India Made AstraZeneca's COVID-19 Vaccine Not Eligible For EU Travel, Seeks Resolution: Reuters",AZN,0.0121314755364938,-0.3892158405455022,0.0159191850748821,0.0075887443991036,0.0015546705100197,-0.0072028032901936,-0.0010279239678357,0.0018311945020552,-0.1983752125448705,2
2021-06-29,Moderna's COVID-19 Vaccine Produced Neutralizing Titers Against All Variants Tested,AZN,0.0018311945020552,-0.1983752125448705,0.0121314755364938,0.0159191850748821,0.0075887443991036,0.0015546705100197,-0.0072028032901936,-0.0046526360048767,-0.0196687592398174,2
2021-07-01,Attention Biotech Investors: Mark Your Calendar For July PDUFA Dates,AZN,0.0068447316521036,0.0391651185662769,-0.0046526360048767,0.0018311945020552,0.0121314755364938,0.0159191850748821,0.0075887443991036,0.0079588018391374,0.0930868403895093,0
2021-07-07,"COVID-19 Vaccine-Induced Blood Clots Probably Linked To Amino Acids, Study Shows: WSJ",AZN,-0.0023372254421817,-0.0665689915283741,-0.0146404809511808,0.0079588018391374,0.0068447316521036,-0.0046526360048767,0.0018311945020552,-0.008366855621102,0.0715340264503394,1
2021-07-08,"The Daily Biotech Pulse: Priority Review For Amgen's Asthma Treatment, Evaxion Reports Positive Skin Cancer Readout, Quidel Recalls Lyra COVID-19 Test",AZN,-0.008366855621102,0.0715340264503394,-0.0023372254421817,-0.0146404809511808,0.0079588018391374,0.0068447316521036,-0.0046526360048767,0.0062437309299641,-0.1046265409717186,0
2021-07-08,Amgen - AstraZeneca's Asthma Candidate Under Priority Review With FDA,AZN,-0.008366855621102,0.0715340264503394,-0.0023372254421817,-0.0146404809511808,0.0079588018391374,0.0068447316521036,-0.0046526360048767,0.0062437309299641,-0.1046265409717186,0
2021-07-09,"The Daily Biotech Pulse: Lilly, Morphic's Positive Data At ECCO, Humanigen's COVID Treatment Gets Expedited Review In UK, TransCode IPO",AZN,0.0062437309299641,-0.1046265409717186,-0.008366855621102,-0.0023372254421817,-0.0146404809511808,0.0079588018391374,0.0068447316521036,0.0145899509710192,0.6307988855772968,0
2021-07-09,EMA Says Heart Inflammation Likely Linked To mRNA-Based COVID-19 Vaccines,AZN,0.0062437309299641,-0.1046265409717186,-0.008366855621102,-0.0023372254421817,-0.0146404809511808,0.0079588018391374,0.0068447316521036,0.0145899509710192,0.6307988855772968,0
2021-07-12,Bayer's Kerendia Scores Long-Awaited Kidney & Heart Disease Nod For Type 2 Diabetes,AZN,0.0145899509710192,0.6307988855772968,0.0062437309299641,-0.008366855621102,-0.0023372254421817,-0.0146404809511808,0.0079588018391374,0.0018181132878054,-0.1734522591603016,2
2021-07-13,"AstraZeneca, JNJ To Start Research On Potentially Modified COVID-19 Shots: WSJ",AZN,0.0018181132878054,-0.1734522591603016,0.0145899509710192,0.0062437309299641,-0.008366855621102,-0.0023372254421817,-0.0146404809511808,-0.013364113720158,1.852552393770429,1
2021-07-13,"Ahead Of AdComm AstraZeneca, FibroGen's Roxadustat Hit With Safety, Efficacy Questions",AZN,0.0018181132878054,-0.1734522591603016,0.0145899509710192,0.0062437309299641,-0.008366855621102,-0.0023372254421817,-0.0146404809511808,-0.013364113720158,1.852552393770429,1
2021-07-15,"The Daily Biotech Pulse: Galapagos Sinks On Data, J&J Recalls Sunscreen Products, FibroGen Awaits AdCom Verdict, 3 IPOs",AZN,-0.0474916421462888,0.1397770644288856,-0.013364113720158,0.0018181132878054,0.0145899509710192,0.0062437309299641,-0.008366855621102,-0.0029845465859691,0.0586565542323642,2
2021-07-27,"The Daily Biotech Pulse: ObsEva Surges On Out-Licensing Deal, EyeGate Appoints New CEO, 2 Positive Catalysts For Merck, Candel Therapeutics Debuts",AZN,0.011797835971065,-0.1974798218547173,-0.0247295555281832,0.0046584478974076,0.0032888999557365,0.0039972140545188,0.0187676801688174,-0.0113122022562824,-0.3182125247015297,1
2021-07-29,"The Daily Biotech Pulse: Merck's Disappointing Q2, Atreca Falls On Data, FDA Nod For Viatris, Nuvalent, Icosavax IPOs",AZN,0.0146100140433453,-0.0182518589856374,-0.0113122022562824,0.011797835971065,-0.0247295555281832,0.0046584478974076,0.0032888999557365,-0.0069394780349633,-0.3079948687958649,1
2021-07-29,"A Peek Into The Markets: US Stock Futures Mostly Higher Ahead Of GDP, Jobless Claims Data",AZN,0.0146100140433453,-0.0182518589856374,-0.0113122022562824,0.011797835971065,-0.0247295555281832,0.0046584478974076,0.0032888999557365,-0.0069394780349633,-0.3079948687958649,1
2021-07-29,"7 Stocks To Watch For July 29, 2021",AZN,0.0146100140433453,-0.0182518589856374,-0.0113122022562824,0.011797835971065,-0.0247295555281832,0.0046584478974076,0.0032888999557365,-0.0069394780349633,-0.3079948687958649,1
2021-07-29,"Earnings Scheduled For July 29, 2021",AZN,0.0146100140433453,-0.0182518589856374,-0.0113122022562824,0.011797835971065,-0.0247295555281832,0.0046584478974076,0.0032888999557365,-0.0069394780349633,-0.3079948687958649,1
2021-08-02,Johnson & Johnson Pulls Application For Accelerated Approval Of COVID-19 Shot In India: Report,AZN,0.0024456991166348,-0.0113814489197846,-0.0069394780349633,0.0146100140433453,-0.0113122022562824,0.011797835971065,-0.0247295555281832,0.0048798125274482,-0.2762856748931477,2
2021-08-04,WHO Asks To Hold Off COVID-19 Vaccine Booster Shots Citing Inequality: Report,AZN,-0.0060699886543109,0.3231411099045551,0.0048798125274482,0.0024456991166348,-0.0069394780349633,0.0146100140433453,-0.0113122022562824,0.019193831215257,0.2778569680215397,0
2021-08-12,Britain Study Shows Restricted Use Of AstraZeneca COVID-19 Shot Associated With No Clot Cases: Reuters,AZN,0.0231480214267714,0.4901734667359667,0.0035454656411246,0.0008872236743957,-0.0014174325380441,-0.033727123775903,0.019193831215257,0.0177515572155313,-0.2155165836485116,0
2021-08-12,Do mRNA COVID-19 Vaccines Cause Skin Or Kidney Disorders? EMA Investigates Possible Links,AZN,0.0231480214267714,0.4901734667359667,0.0035454656411246,0.0008872236743957,-0.0014174325380441,-0.033727123775903,0.019193831215257,0.0177515572155313,-0.2155165836485116,0
2021-08-13,Moderna's Shot Seems To Have A Better Shot Against Delta Than Pfizer's,AZN,0.0177515572155313,-0.2155165836485116,0.0231480214267714,0.0035454656411246,0.0008872236743957,-0.0014174325380441,-0.033727123775903,0.0046168395136099,-0.1501097618584489,2
2021-08-18,"Cannabis Movers & Shakers: Jay-Z-Backed The Parent Co. Appoints First Black CEO In Major Public Cannabis Company, CannaSafe, HEXO And Delta 9 Each Announce New Appointments",AZN,0.001516521088074,0.4098673924373155,0.0102127636617563,0.0046168395136099,0.0177515572155313,0.0231480214267714,0.0035454656411246,-0.0042059428288514,-0.5556947467860517,2
2021-08-26,EU Says Without EMA Approval COVID-19 Boosters May Face Higher Legal Risks: Reuters,AZN,0.0030727066106577,-0.3373403724049368,0.0010252630807869,-0.004761912141461,-0.0099343334687307,0.003378992774744,-0.0042059428288514,-0.0022123303095724,0.4115842170425796,2
2021-09-02,Can Vaccine Help In Long Term COVID-19 Symptoms? UK Study Gives Encouraging Answer,AZN,0.0148160852566208,-0.2509034827244896,0.0075497620199227,-0.0056304233484315,-0.0003411807380802,-0.0022123303095724,0.0030727066106577,-0.0127538093087137,0.6380173923731678,1
2021-09-03,EMA Reviewing Cases Of Multisystem Inflammatory Syndrome After Pfizer COVID Shot,AZN,-0.0127538093087137,0.6380173923731678,0.0148160852566208,0.0075497620199227,-0.0056304233484315,-0.0003411807380802,-0.0022123303095724,-0.0074792467066497,-0.050088170187221,1
2021-09-03,White House Commits $3B To Boost COVID-19 Vaccine Supply Chain: Report,AZN,-0.0127538093087137,0.6380173923731678,0.0148160852566208,0.0075497620199227,-0.0056304233484315,-0.0003411807380802,-0.0022123303095724,-0.0074792467066497,-0.050088170187221,1
2021-09-07,"Amgen, AstraZeneca Tout Additional Data From Asthma Trial With Tezepelumab",AZN,-0.0074792467066497,-0.050088170187221,-0.0127538093087137,0.0148160852566208,0.0075497620199227,-0.0056304233484315,-0.0003411807380802,-0.0226065507131245,-0.2413500276483134,1
2021-09-07,"Illumina, Merck Join Hands For Homologous Recombination Deficiency CDx, Research Assay",AZN,-0.0074792467066497,-0.050088170187221,-0.0127538093087137,0.0148160852566208,0.0075497620199227,-0.0056304233484315,-0.0003411807380802,-0.0226065507131245,-0.2413500276483134,1
2021-09-08,"EMA To Add New Side Effects To Janssen, AstraZeneca COVID-19 Shots",AZN,-0.0226065507131245,-0.2413500276483134,-0.0074792467066497,-0.0127538093087137,0.0148160852566208,0.0075497620199227,-0.0056304233484315,-0.013667407782641,0.4659377847195105,1
2021-09-08,Johnson & Johnson Plans COVID-19 Booster Shot Trial In South Africa: Bloomberg,AZN,-0.0226065507131245,-0.2413500276483134,-0.0074792467066497,-0.0127538093087137,0.0148160852566208,0.0075497620199227,-0.0056304233484315,-0.013667407782641,0.4659377847195105,1
2021-09-09,Moderna Shares Gain Amid R&D Day Presentations: What You Need To Know,AZN,-0.013667407782641,0.4659377847195105,-0.0226065507131245,-0.0074792467066497,-0.0127538093087137,0.0148160852566208,0.0075497620199227,-0.0005330808554293,-0.3019852967290549,2
2021-09-24,Why AstraZeneca Stock Is Trading Higher Today,AZN,0.0146267742692025,0.8992521889444214,0.0125978214631454,-0.0065955944098722,0.0107692820311593,0.0529157065968022,-0.0183744882569015,-0.0270091139831837,-0.4213311964543638,1
2021-09-24,AstraZeneca - Merck's Lynparza Delays Disease Progression In Prostate Cancer Patients,AZN,0.0146267742692025,0.8992521889444214,0.0125978214631454,-0.0065955944098722,0.0107692820311593,0.0529157065968022,-0.0183744882569015,-0.0270091139831837,-0.4213311964543638,1
2021-09-29,NIH-Backed US Study Of Mixed COVID-19 Vaccines Regime To Conclude Soon: CNBC,AZN,0.0353981059798289,0.3715303404678625,-0.0185625791595946,-0.0270091139831837,0.0146267742692025,0.0125978214631454,-0.0065955944098722,0.0065359724482458,-0.0873868182775321,0
