date,title,stock,close,volume,1_past_close,2_past_close,3_past_close,4_past_close,5_past_close,next_close,next_volume,label
2018-04-25,"More Big Companies Beat Projections, But Wall Street Appears To Still Struggle",BA,0.0419377289558196,0.5632320825888426,-0.028863255232373,0.0005018779493797,-0.0057832137688046,-0.0010555825514895,0.012710840260792,-0.0002041902971782,-0.521608186073515,2
2018-04-25,"15 Stocks To Watch For April 25, 2018",BA,0.0419377289558196,0.5632320825888426,-0.028863255232373,0.0005018779493797,-0.0057832137688046,-0.0010555825514895,0.012710840260792,-0.0002041902971782,-0.521608186073515,2
2018-04-25,"Earnings Scheduled For April 25, 2018",BA,0.0419377289558196,0.5632320825888426,-0.028863255232373,0.0005018779493797,-0.0057832137688046,-0.0010555825514895,0.012710840260792,-0.0002041902971782,-0.521608186073515,2
2018-04-30,Playmakers: The Investor Picks From CNBC's 2018 Stock Draft,BA,-0.0214740242428185,0.0976875884851344,-0.0055718059072781,-0.0002041902971782,0.0419377289558196,-0.028863255232373,0.0005018779493797,-0.0120517182396661,0.1589370163370593,1
2018-05-01,32 Stocks Moving In Tuesday's Mid-Day Session,BA,-0.0120517182396661,0.1589370163370593,-0.0214740242428185,-0.0055718059072781,-0.0002041902971782,0.0419377289558196,-0.028863255232373,-0.0162347768447038,-0.2033340288887343,1
2018-05-01,21 Stocks Moving In Tuesday's Pre-Market Session,BA,-0.0120517182396661,0.1589370163370593,-0.0214740242428185,-0.0055718059072781,-0.0002041902971782,0.0419377289558196,-0.028863255232373,-0.0162347768447038,-0.2033340288887343,1
2018-05-02,42 Biggest Movers From Yesterday,BA,-0.0162347768447038,-0.2033340288887343,-0.0120517182396661,-0.0214740242428185,-0.0055718059072781,-0.0002041902971782,0.0419377289558196,0.0200499878509943,0.8576874945432322,0
2018-05-08,"US Will Withdraw From The Iran Nuclear Deal, Trump Calls It A 'Great Embarrassment'",BA,-0.0060512127651787,-0.0424836601307189,0.0179409819245732,0.0113096852140184,0.0200499878509943,-0.0162347768447038,-0.0120517182396661,0.018116305758181,0.0829326623651627,0
2018-05-22,Code Pink Plans Protest Aimed At iShares Aerospace ETF,BA,-0.0244559698532155,-0.2057358446075397,0.0361299939524553,0.0206022620668102,0.0092969467635046,-0.003361289709104,-0.0071679601200095,0.0118021736841338,-0.1654915203918803,0
2018-06-01,General Dynamics Wins $87M Maintenance Deal For War Ships,BA,0.0129485730584972,-0.3968181921339899,-0.0168346091009715,0.0161994018878897,-0.0211334328345066,0.0030362277963091,-0.0005846994636812,0.0112415009431692,0.110053427646926,0
2018-06-22,OPEC Meeting Front And Center As DJIA Enters Session Down Eight-Straight Days,BA,0.0037019525797368,-0.2115208853098831,-0.0146779901299819,0.0046024638681256,-0.0383943540538049,-0.0087738486682541,-0.0125270589495121,-0.0227493266700771,0.568358395989975,1
2018-07-09,What Trade War? Positive Sentiment Seems To Continue From Friday,BA,0.0217547849156718,0.4862476841955252,0.0043821094365381,0.0007509475176732,-0.009372688846071,0.0016986347509067,0.0025699441413298,0.0153251233354352,0.0478153865822865,0
2018-07-12,Boeing Wins $131M Deal For MH-47G Block II Aircraft,BA,0.0159423301205141,-0.3356995649187084,-0.018896213852401,0.0153251233354352,0.0217547849156718,0.0043821094365381,0.0007509475176732,0.0137561599601216,0.1189737528930909,0
2018-07-13,"Big Banks Deliver Mixed Results, But JP Morgan Stands Out With Strong Quarter",BA,0.0137561599601216,0.1189737528930909,0.0159423301205141,-0.018896213852401,0.0153251233354352,0.0217547849156718,0.0043821094365381,0.0151371050199651,0.271399023016327,0
2018-07-16,Mid-Afternoon Market Update: Black Box Falls After Q4 Results; Coda Octopus Shares Surge,BA,0.0151371050199651,0.271399023016327,0.0137561599601216,0.0159423301205141,-0.018896213852401,0.0153251233354352,0.0217547849156718,0.0021905808939355,-0.0548632744894427,2
2018-07-16,Today's Pickup: Autonomous Vehicle Companies Insist On Safety,BA,0.0151371050199651,0.271399023016327,0.0137561599601216,0.0159423301205141,-0.018896213852401,0.0153251233354352,0.0217547849156718,0.0021905808939355,-0.0548632744894427,2
2018-07-16,Benzinga Pro's 5 Stocks To Watch Today,BA,0.0151371050199651,0.271399023016327,0.0137561599601216,0.0159423301205141,-0.018896213852401,0.0153251233354352,0.0217547849156718,0.0021905808939355,-0.0548632744894427,2
2018-07-16,31 Stocks Moving In Monday's Mid-Day Session,BA,0.0151371050199651,0.271399023016327,0.0137561599601216,0.0159423301205141,-0.018896213852401,0.0153251233354352,0.0217547849156718,0.0021905808939355,-0.0548632744894427,2
2018-07-16,Mid-Day Market Update: Crude Oil Down Over 3%; Genetic Technologies Shares Spike Higher,BA,0.0151371050199651,0.271399023016327,0.0137561599601216,0.0159423301205141,-0.018896213852401,0.0153251233354352,0.0217547849156718,0.0021905808939355,-0.0548632744894427,2
2018-07-17,Earnings Preview: Legacy Tech Giant IBM To Report After Wednesday's Close,BA,0.0021905808939355,-0.0548632744894427,0.0151371050199651,0.0137561599601216,0.0159423301205141,-0.018896213852401,0.0153251233354352,0.0093868612373442,0.1316974913019593,0
2018-07-17,40 Biggest Movers From Yesterday,BA,0.0021905808939355,-0.0548632744894427,0.0151371050199651,0.0137561599601216,0.0159423301205141,-0.018896213852401,0.0153251233354352,0.0093868612373442,0.1316974913019593,0
2018-07-19,"Upcoming Earnings: GE Reports Friday Morning, Turnaround And Restructuring Rolls On",BA,-0.0136024207587562,-0.1224555839616841,0.0093868612373442,0.0021905808939355,0.0151371050199651,0.0137561599601216,0.0159423301205141,-0.0012101874907196,-0.3300512593575986,2
2018-07-20,"Trade Tension Back In Town, Weighing On Sentiment Despite Strong Tech Results",BA,-0.0012101874907196,-0.3300512593575986,-0.0136024207587562,0.0093868612373442,0.0021905808939355,0.0151371050199651,0.0137561599601216,-0.0045928844954947,0.0699069741839599,2
2018-07-23,Upcoming Earnings: Alphabet's $5 Billion Fine to Weigh on Results,BA,-0.0045928844954947,0.0699069741839599,-0.0012101874907196,-0.0136024207587562,0.0093868612373442,0.0021905808939355,0.0151371050199651,0.0141534963063514,0.637083912126357,0
2018-07-23,"The Week Ahead: FANG Earnings Continue, Fox Vote On Disney Deal, More IPOs",BA,-0.0045928844954947,0.0699069741839599,-0.0012101874907196,-0.0136024207587562,0.0093868612373442,0.0021905808939355,0.0151371050199651,0.0141534963063514,0.637083912126357,0
2018-07-24,Food And Beverage Earnings: Reports Coming Up From Coca-Cola And McDonald's,BA,0.0141534963063514,0.637083912126357,-0.0045928844954947,-0.0012101874907196,-0.0136024207587562,0.0093868612373442,0.0021905808939355,-0.0065592849082903,1.3186989314896294,1
2018-07-24,"Earnings Preview: Boeing, GM And Ford To Report Q2 Earnings This Week",BA,0.0141534963063514,0.637083912126357,-0.0045928844954947,-0.0012101874907196,-0.0136024207587562,0.0093868612373442,0.0021905808939355,-0.0065592849082903,1.3186989314896294,1
2018-07-25,"Concerns About Trade Picture Overshadowing Earnings As GM, Boeing Report",BA,-0.0065592849082903,1.3186989314896294,0.0141534963063514,-0.0045928844954947,-0.0012101874907196,-0.0136024207587562,0.0093868612373442,0.0095528472486077,-0.5674767216492052,0
2018-07-25,"Earnings Scheduled For July 25, 2018",BA,-0.0065592849082903,1.3186989314896294,0.0141534963063514,-0.0045928844954947,-0.0012101874907196,-0.0136024207587562,0.0093868612373442,0.0095528472486077,-0.5674767216492052,0
2018-07-25,A Peek Into The Markets: US Stock Futures Flat Ahead Of Earnings,BA,-0.0065592849082903,1.3186989314896294,0.0141534963063514,-0.0045928844954947,-0.0012101874907196,-0.0136024207587562,0.0093868612373442,0.0095528472486077,-0.5674767216492052,0
2018-07-25,"14 Stocks To Watch For July 25, 2018",BA,-0.0065592849082903,1.3186989314896294,0.0141534963063514,-0.0045928844954947,-0.0012101874907196,-0.0136024207587562,0.0093868612373442,0.0095528472486077,-0.5674767216492052,0
2018-07-27,Economic Growth Hits Best Level Since 2014 As Earnings Season Keeps Rolling,BA,0.0037014332486762,-0.0866445224367009,0.0095528472486077,-0.0065592849082903,0.0141534963063514,-0.0045928844954947,-0.0012101874907196,-0.0265910565323813,0.0568497615535046,1
2018-07-27,"For Boeing, GM, Trump And Juncker's Talks Provide A Needed Respite",BA,0.0037014332486762,-0.0866445224367009,0.0095528472486077,-0.0065592849082903,0.0141534963063514,-0.0045928844954947,-0.0012101874907196,-0.0265910565323813,0.0568497615535046,1
2018-08-09,"Two Major Mergers Fall Through, A Reminder That Deals Don't Always Work Out",BA,-0.006790589159874,-0.0136270140555364,-0.0084957167514674,0.012089931686845,-0.0053668005280442,-0.003688515040871,-0.0085894759549591,-0.0125393648005729,0.1928490746372404,1
2018-08-17,Podcast: 6 Charts Explain Why The Correction Has Started,BA,0.001213891271601,-0.4769508682833723,0.0428623463723278,-0.0217609023839279,0.0023052855679257,-0.0030936115188434,-0.0125393648005729,0.0125287905233988,-0.0166167079369217,0
2018-08-21,Boeing Wins An $152M F/A-18 Jets Deal,BA,0.0086390183894551,-0.0168974885693459,0.0125287905233988,0.001213891271601,0.0428623463723278,-0.0217609023839279,0.0023052855679257,-0.0105718994761185,-0.0958142356430304,1
2018-08-22,Leveraged ETF Gets A Lift UBS's Boeing Upgrade,BA,-0.0105718994761185,-0.0958142356430304,0.0086390183894551,0.0125287905233988,0.001213891271601,0.0428623463723278,-0.0217609023839279,-0.0072850694925501,-0.3166349845316635,1
2018-08-23,"Fed On Center Stage As Jackson Hole Meeting Starts, With Powell Speech Friday",BA,-0.0072850694925501,-0.3166349845316635,-0.0105718994761185,0.0086390183894551,0.0125287905233988,0.001213891271601,0.0428623463723278,0.0054678504323439,0.0658339696738301,0
2018-08-23,Boeing Secures Air Force Deal To Modify F-15 Program,BA,-0.0072850694925501,-0.3166349845316635,-0.0105718994761185,0.0086390183894551,0.0125287905233988,0.001213891271601,0.0428623463723278,0.0054678504323439,0.0658339696738301,0
2018-08-27,"The Week Ahead: Best Buy, Foot Locker Look To Extend Retail's Rally",BA,0.0124792733814904,0.1665216723811473,0.0054678504323439,-0.0072850694925501,-0.0105718994761185,0.0086390183894551,0.0125287905233988,-0.0071522046811187,0.08580829129195,1
2018-09-04,"The Week Ahead: Mr. Dorsey Goes To Washington, Employment And Wage Data On Tap",BA,0.0100935555269812,-0.2204349207266006,-0.0118477778424552,-0.0093949055202661,-0.0029041476748357,-0.0071522046811187,0.0124792733814904,0.0012419221298696,0.0961695191524043,2
2018-09-07,"Solid Employment Report, But Tech Selloff Enters Fourth Day",BA,-0.0056650262013075,0.0937003262779219,0.0132398388859882,0.0012419221298696,0.0100935555269812,-0.0118477778424552,-0.0093949055202661,-0.0212440604931115,-0.2183635482801703,1
2018-09-13,"Air Of Cautious Optimism To Start Day On Positive China Talk, Easing Price Fears",BA,0.0058007067016669,-0.2091263299865128,0.0236350739104973,0.0099165868172506,-0.0212440604931115,-0.0056650262013075,0.0132398388859882,0.0122093661623094,-0.1044370756355598,0
2018-09-18,Gain Altitude With This Aerospace ETF,BA,0.0214069140494364,0.1757682521041299,-0.0106725312608134,0.0122093661623094,0.0058007067016669,0.0236350739104973,0.0099165868172506,0.0045106561191816,0.5826202763442649,2
2018-09-21,Boeing Secures $40M Navy Deal To Aid F/A-18 And EA-18 Programs,BA,0.0129811474855943,0.7810575652564133,0.0061332017664768,0.0045106561191816,0.0214069140494364,-0.0106725312608134,0.0122093661623094,-0.0113908550719158,-0.6080347144456887,1
2018-10-02,"Lunch With Powell: Fed Chair To Speak Later, But Focus Now On Weak Europe, Trade Relations",BA,0.0106725788845478,-0.0279874676703745,0.0279376350791014,0.0122757948336904,0.0064652808480349,-0.0059908602608302,-0.0020652225170729,0.0153478476633126,0.0371435988404793,0
2018-10-03,Boeing Wins $26.7M Deal To Support Trident II D5 Missile,BA,0.0153478476633126,0.0371435988404793,0.0106725788845478,0.0279376350791014,0.0122757948336904,0.0064652808480349,-0.0059908602608302,-0.0058883821273197,-0.2027407546461422,1
2018-10-05,Boeing Wins $63M Navy Deal For F/A And E/A-18 Aircraft Support,BA,-0.0090258245228196,-0.2413729953169557,-0.0058883821273197,0.0153478476633126,0.0106725788845478,0.0279376350791014,0.0122757948336904,-0.0018112707477487,0.1463254819464081,2
2018-10-10,Dow Falls 800 Points As Markets Experience Worst Day Months,BA,-0.0466220511017528,1.1074859398469976,-0.0008553430683883,-0.0018112707477487,-0.0090258245228196,-0.0058883821273197,0.0153478476633126,-0.025471572561084,0.038736304718967,1
2018-10-22,"Benzinga's Week Ahead: Can Tech Earnings Restore The Rally? Amazon, Google To Report",BA,-0.0007859978838722,-0.351729865964028,-0.0085987627172947,-0.0168262341431006,-0.0074677474175957,0.026108942550638,-0.0034154593211014,-0.0166583588182197,0.9392975480450628,1
2018-10-22,Upcoming Earnings: Telecom Giants Verizon And AT&T Report This Week,BA,-0.0007859978838722,-0.351729865964028,-0.0085987627172947,-0.0168262341431006,-0.0074677474175957,0.026108942550638,-0.0034154593211014,-0.0166583588182197,0.9392975480450628,1
2018-10-22,"Tug-of-War: Volatile October Continues As Bulls, Bears Duke It Out",BA,-0.0007859978838722,-0.351729865964028,-0.0085987627172947,-0.0168262341431006,-0.0074677474175957,0.026108942550638,-0.0034154593211014,-0.0166583588182197,0.9392975480450628,1
2018-10-23,Will Tariffs Weigh On Boeing and Ford Earnings? Analysts Don't Seem Too Worried,BA,-0.0166583588182197,0.9392975480450628,-0.0007859978838722,-0.0085987627172947,-0.0168262341431006,-0.0074677474175957,0.026108942550638,0.0131409494891008,0.9233187534171678,0
2018-10-23,Wall Street Starts The Day In Risk-off Mood As Global Sentiment Weakens,BA,-0.0166583588182197,0.9392975480450628,-0.0007859978838722,-0.0085987627172947,-0.0168262341431006,-0.0074677474175957,0.026108942550638,0.0131409494891008,0.9233187534171678,0
2018-10-24,A Peek Into The Markets: US Stock Futures Down Ahead Of Earnings,BA,0.0131409494891008,0.9233187534171678,-0.0166583588182197,-0.0007859978838722,-0.0085987627172947,-0.0168262341431006,-0.0074677474175957,0.0257154826776286,-0.5257977400326914,0
2018-10-24,The Final Frontier Has Its Own ETF,BA,0.0131409494891008,0.9233187534171678,-0.0166583588182197,-0.0007859978838722,-0.0085987627172947,-0.0168262341431006,-0.0074677474175957,0.0257154826776286,-0.5257977400326914,0
2018-10-24,Mid-Afternoon Market Update: NASDAQ Down Over 2.5%; Clementia Pharmaceuticals Shares Spike Higher,BA,0.0131409494891008,0.9233187534171678,-0.0166583588182197,-0.0007859978838722,-0.0085987627172947,-0.0168262341431006,-0.0074677474175957,0.0257154826776286,-0.5257977400326914,0
2018-10-24,Struggling For Direction: Wall Street Seems Rudderless After Mixed Earnings Results,BA,0.0131409494891008,0.9233187534171678,-0.0166583588182197,-0.0007859978838722,-0.0085987627172947,-0.0168262341431006,-0.0074677474175957,0.0257154826776286,-0.5257977400326914,0
2018-10-24,Mid-Morning Market Update: Markets Mostly Lower; Boeing Earnings Top Expectations,BA,0.0131409494891008,0.9233187534171678,-0.0166583588182197,-0.0007859978838722,-0.0085987627172947,-0.0168262341431006,-0.0074677474175957,0.0257154826776286,-0.5257977400326914,0
2018-10-24,Mid-Day Market Update: Dow Falls Over 100 Points; Zix Shares Rise Following Q3 Results,BA,0.0131409494891008,0.9233187534171678,-0.0166583588182197,-0.0007859978838722,-0.0085987627172947,-0.0168262341431006,-0.0074677474175957,0.0257154826776286,-0.5257977400326914,0
2018-10-24,"Earnings Scheduled For October 24, 2018",BA,0.0131409494891008,0.9233187534171678,-0.0166583588182197,-0.0007859978838722,-0.0085987627172947,-0.0168262341431006,-0.0074677474175957,0.0257154826776286,-0.5257977400326914,0
2018-10-24,"14 Stocks To Watch For October 24, 2018",BA,0.0131409494891008,0.9233187534171678,-0.0166583588182197,-0.0007859978838722,-0.0085987627172947,-0.0168262341431006,-0.0074677474175957,0.0257154826776286,-0.5257977400326914,0
2018-10-25,"Snapping Back, But Can Rally Attempt Last? Strong Earnings Might Power Market",BA,0.0257154826776286,-0.5257977400326914,0.0131409494891008,-0.0166583588182197,-0.0007859978838722,-0.0085987627172947,-0.0168262341431006,-0.0123703748677294,0.0173598101661045,1
2018-10-25,"A Peek Into The Markets: US Stock Futures Rise Ahead Of Earnings, Economic Reports",BA,0.0257154826776286,-0.5257977400326914,0.0131409494891008,-0.0166583588182197,-0.0007859978838722,-0.0085987627172947,-0.0168262341431006,-0.0123703748677294,0.0173598101661045,1
2018-10-29,"The Latest Tech Wreck Sends Markets Lower; S&P 500, Nasdaq Close In Correction Territory",BA,-0.0659114515020361,0.8320648170881415,-0.0123703748677294,0.0257154826776286,0.0131409494891008,-0.0166583588182197,-0.0007859978838722,0.0426711161011701,-0.2262128115786652,0
2018-10-30,Earnings Preview: Automaker GM to Report Q3 Results Wednesday Morning,BA,0.0426711161011701,-0.2262128115786652,-0.0659114515020361,-0.0123703748677294,0.0257154826776286,0.0131409494891008,-0.0166583588182197,0.0141465569485774,-0.2768271562175268,0
2018-11-05,"Fundstrat, Reality Shares Partner On New Multi-Factor ETF",BA,0.0118239444333614,-0.4406918457491686,-0.0146528069563313,0.0231358461087332,0.0141465569485774,0.0426711161011701,-0.0659114515020361,0.0124038268688828,0.0967212387417364,0
2018-11-07,Today's Pickup: What Midterm Elections May Mean For Transportation Funding,BA,0.0151445883563752,0.6243780088191271,0.0124038268688828,0.0118239444333614,-0.0146528069563313,0.0231358461087332,0.0141465569485774,0.0012422314945503,-0.3146713819639877,2
2018-11-26,"Data Dive, Trade Talks And Powell: Busy Post-Holiday Week On The Way",BA,0.0129354642652721,1.1022258346880078,-0.0157569835921622,-0.0011961548662693,-0.0100953037065597,-0.0446791929875338,-0.0164535310153818,0.0052788223661481,-0.123695089670761,0
2018-11-28,Boeing Wins $383M Protected Tactical Enterprise Service Deal,BA,0.04864316063966,1.0762964974205809,0.0052788223661481,0.0129354642652721,-0.0157569835921622,-0.0011961548662693,-0.0100953037065597,0.0271664657499364,-0.1284327187132208,0
2018-11-29,"Powell Pop: After Sharp Rally On Fed Speech, Nerves Still Seem Frayed",BA,0.0271664657499364,-0.1284327187132208,0.04864316063966,0.0052788223661481,0.0129354642652721,-0.0157569835921622,-0.0011961548662693,0.0122606844240047,0.0078958720156041,0
2018-11-30,Boeing Wins $13.8M Contract To Support F/A-18E/F And EA-18G Programs,BA,0.0122606844240047,0.0078958720156041,0.0271664657499364,0.04864316063966,0.0052788223661481,0.0129354642652721,-0.0157569835921622,0.0380666339764916,0.2231857089691105,0
2018-12-03,Big deal or little deal? What's the deal with Trump's trade truce?,BA,0.0380666339764916,0.2231857089691105,0.0122606844240047,0.0271664657499364,0.04864316063966,0.0052788223661481,0.0129354642652721,-0.0485053696652456,-0.2090698877293333,1
2018-12-03,Trade Truce: Market Appears To Get A Big Lift As Tariff Fears Retreat After G20,BA,0.0380666339764916,0.2231857089691105,0.0122606844240047,0.0271664657499364,0.04864316063966,0.0052788223661481,0.0129354642652721,-0.0485053696652456,-0.2090698877293333,1
2018-12-07,Make Mine Vanilla: Dull Jobs Report Might Be Just What's Needed After Wild Week,BA,-0.026152449469061,-0.5131649708520662,-0.0309489992703609,-0.0485053696652456,0.0380666339764916,0.0122606844240047,0.0271664657499364,0.0096838110962573,-0.0277931202085588,0
2018-12-17,A Peek Into The Markets: US Stock Futures Edge Lower; Crude Oil Rises Over 1%,BA,-0.0082196796410822,0.5063060878001455,-0.0206470100250435,-0.0037344766526953,0.0144708977732144,-0.0132374929591642,0.0096838110962573,0.0377377516403139,0.1837009902584332,0
2018-12-17,4 Stocks Moving In Monday's After-Hours Session,BA,-0.0082196796410822,0.5063060878001455,-0.0206470100250435,-0.0037344766526953,0.0144708977732144,-0.0132374929591642,0.0096838110962573,0.0377377516403139,0.1837009902584332,0
2018-12-18,"10 Stocks To Watch For December 18, 2018",BA,0.0377377516403139,0.1837009902584332,-0.0082196796410822,-0.0206470100250435,-0.0037344766526953,0.0144708977732144,-0.0132374929591642,-0.0259403587055429,-0.1716685654044311,1
2018-12-20,ATSG to Acquire 20 767s and Convert Them to Freighters; Destination Unclear Though Amazon May Want Some,BA,-0.0203413345242667,0.1020424920455711,-0.0259403587055429,0.0377377516403139,-0.0082196796410822,-0.0206470100250435,-0.0037344766526953,-0.0271521394233326,0.4234064746861379,1
2018-12-24,Boeing Inks $12B Deal With Green Africa Airways For 100 737s,BA,-0.0341157643743318,-0.5504534331366058,-0.0271521394233326,-0.0203413345242667,-0.0259403587055429,0.0377377516403139,-0.0082196796410822,0.0672081159742137,0.409891421418799,0
2018-12-27,Boeing Inks $240M Deal With The Missile Defense Agency,BA,0.010225390782802,-0.1037081389106825,0.0672081159742137,-0.0341157643743318,-0.0271521394233326,-0.0203413345242667,-0.0259403587055429,-0.0023964350664037,-0.1418764829190758,2
2018-12-28,Boeing Wins $49M Foreign Military Sales Deal To Support Qatar's AH-64E Aircraft,BA,-0.0023964350664037,-0.1418764829190758,0.010225390782802,0.0672081159742137,-0.0341157643743318,-0.0271521394233326,-0.0203413345242667,0.019343902553546,-0.0449640287769784,0
2019-01-03,Bell-Boeing Wins $23.2M Navy Deal To Support MV-22 Tiltrotor Program,BA,-0.0398690900442887,0.7330660348702995,0.0040620019395083,0.019343902553546,-0.0023964350664037,0.010225390782802,0.0672081159742137,0.0520424263258429,-0.2202748177229389,0
2019-01-04,Apple Lowers Revenue Expectations As China's Market Slows,BA,0.0520424263258429,-0.2202748177229389,-0.0398690900442887,0.0040620019395083,0.019343902553546,-0.0023964350664037,0.010225390782802,0.0031490018974669,-0.0940703110951267,2
2019-01-08,"Boeing Sets Annual Delivery Record, Has Backlog Of Nearly 900 Orders",BA,0.0378531829467132,0.1752226881373595,0.0031490018974669,0.0520424263258429,-0.0398690900442887,0.0040620019395083,0.019343902553546,0.009690882297767,-0.1103346352792146,0
2019-01-09,"Watching The Clock: Trade Talks End With Optimism, But Deadline Draws Closer",BA,0.009690882297767,-0.1103346352792146,0.0378531829467132,0.0031490018974669,0.0520424263258429,-0.0398690900442887,0.0040620019395083,0.0255357703475083,0.2715299366382686,0
2019-01-10,"A Peek Into The Markets: US Stock Futures Down Ahead Of Economic Data, Fed Speakers",BA,0.0255357703475083,0.2715299366382686,0.009690882297767,0.0378531829467132,0.0031490018974669,0.0520424263258429,-0.0398690900442887,0.0008224595405841,-0.4104440006718799,2
2019-01-10,"Global Airfreight Continues In So-So Form As Trade Tensions, Slow Demand Weigh",BA,0.0255357703475083,0.2715299366382686,0.009690882297767,0.0378531829467132,0.0031490018974669,0.0520424263258429,-0.0398690900442887,0.0008224595405841,-0.4104440006718799,2
2019-01-14,Government Shutdown Impacts U.S. Airline Industry,BA,-0.007197593136816,-0.2160562221026306,0.0008224595405841,0.0255357703475083,0.009690882297767,0.0378531829467132,0.0031490018974669,0.0053659766192186,0.1875706670973995,0
2019-01-17,Airbus Announces 400 New Jobs; Will Build The A220 In Mobile,BA,0.0199680832529496,0.5636190545933872,-0.0005108992281142,0.0053659766192186,-0.007197593136816,0.0008224595405841,0.0255357703475083,0.0157063895822384,-0.0032549644061445,0
2019-01-17,Industry Turns To Exoskeletons To Boost Worker Productivity,BA,0.0199680832529496,0.5636190545933872,-0.0005108992281142,0.0053659766192186,-0.007197593136816,0.0008224595405841,0.0255357703475083,0.0157063895822384,-0.0032549644061445,0
2019-01-18,Hope Takes Flight: China Optimism Has Markets Looking Strong Ahead of Weekend,BA,0.0157063895822384,-0.0032549644061445,0.0199680832529496,-0.0005108992281142,0.0053659766192186,-0.007197593136816,0.0008224595405841,-0.0187262640951578,0.0187947844473159,1
2019-01-22,Bell-Boeing Wins $144M Deal To Support V-22 Tiltrotor Program,BA,-0.0187262640951578,0.0187947844473159,0.0157063895822384,0.0199680832529496,-0.0005108992281142,0.0053659766192186,-0.007197593136816,0.0019837244386848,-0.3255159690995042,2
2019-01-23,"Geopolitics Aside, How About Those Earnings? Investors Appear To Switch Focus",BA,0.0019837244386848,-0.3255159690995042,-0.0187262640951578,0.0157063895822384,0.0199680832529496,-0.0005108992281142,0.0053659766192186,-0.0009480360633794,-0.0422578549694007,2
2019-01-23,Analysts Diverge On Arconic After It Shelves Sale Plans,BA,0.0019837244386848,-0.3255159690995042,-0.0187262640951578,0.0157063895822384,0.0199680832529496,-0.0005108992281142,0.0053659766192186,-0.0009480360633794,-0.0422578549694007,2
2019-01-24,"Market Seems Generally Pleased With Earnings Results, But Geopolitics Still Weigh",BA,-0.0009480360633794,-0.0422578549694007,0.0019837244386848,-0.0187262640951578,0.0157063895822384,0.0199680832529496,-0.0005108992281142,0.0165518052701565,0.1371863063577625,0
2019-01-25,"Stock Market Gets Lift On Deal To Reopen Govt.; Positive Trade, Fed News Also Help",BA,0.0165518052701565,0.1371863063577625,-0.0009480360633794,0.0019837244386848,-0.0187262640951578,0.0157063895822384,0.0199680832529496,-0.0033771023458106,-0.0177988448016072,2
2019-01-28,"Deal To Reopen Govt. Boosts Wall Street As Trade, Fed News Also Help",BA,-0.0033771023458106,-0.0177988448016072,0.0165518052701565,-0.0009480360633794,0.0019837244386848,-0.0187262640951578,0.0157063895822384,0.0053448205745869,0.0235865639681678,0
2019-01-28,"Lockheed And Boeing Earnings: Questions On China Trade, Defense Demand",BA,-0.0033771023458106,-0.0177988448016072,0.0165518052701565,-0.0009480360633794,0.0019837244386848,-0.0187262640951578,0.0157063895822384,0.0053448205745869,0.0235865639681678,0
2019-01-29,How To Approach Q4 Earnings: The Technical Perspective,BA,0.0053448205745869,0.0235865639681678,-0.0033771023458106,0.0165518052701565,-0.0009480360633794,0.0019837244386848,-0.0187262640951578,0.0625084506410695,2.967059043931682,0
