date,title,stock,close,volume,1_past_close,2_past_close,3_past_close,4_past_close,5_past_close,next_close,next_volume,label
2020-08-21,A Look Into Boeing's Debt,BA,-0.0122656080233264,-0.2699949167291305,0.0018313791621034,-0.0056393789530173,-0.0103482288014731,-0.0340858449113078,0.0191724728748885,0.0642985329699159,1.3201541375790016,0
2020-08-25,Cobwebs And Corrosion: Reactivating Parked Aircraft Requires Extra Care,BA,-0.0198575669494653,-0.2034381986463904,0.0642985329699159,-0.0122656080233264,0.0018313791621034,-0.0056393789530173,-0.0103482288014731,-0.0161964282049635,-0.4830595335025623,1
2020-08-27,Why Boeing's Stock Is Trading Higher Today,BA,0.013379890246784,0.8251059308947608,-0.0161964282049635,-0.0198575669494653,0.0642985329699159,-0.0122656080233264,0.0018313791621034,0.0091848802040508,-0.3101451531570558,0
2020-09-01,"Zoom Shares Soar On Strong Earnings Results, While Industrial Data Awaited",BA,0.0016296052110422,0.1668070559446148,-0.022639338216435,0.0091848802040508,0.013379890246784,-0.0161964282049635,-0.0198575669494653,0.0155722985516297,-0.1277947864027021,0
2020-09-08,A Peek Into The Markets: US Stock Futures Mostly Lower Following Last Week's Plunge,BA,-0.0582870566666188,0.1990427883162933,0.0135095024090658,-0.0343860541755984,0.0155722985516297,0.0016296052110422,-0.022639338216435,-0.0018624475313357,-0.0296737347885088,2
2020-09-09,Boeing Discovers A Third Production Issue That Prematurely Fatigues Most Dreamliners,BA,-0.0018624475313357,-0.0296737347885088,-0.0582870566666188,0.0135095024090658,-0.0343860541755984,0.0155722985516297,0.0016296052110422,-0.0192187856782626,-0.337964776734058,1
2020-09-11,Boeing Uncovers Fourth Production Flaw Affecting About 700 Dreamliners,BA,0.0161075099677077,0.0130602920330842,-0.0192187856782626,-0.0018624475313357,-0.0582870566666188,0.0135095024090658,-0.0343860541755984,0.03195413163889,0.1702168124762266,0
2020-09-14,'Room For Disappointment': Stock Market Update For The Week Ahead,BA,0.03195413163889,0.1702168124762266,0.0161075099677077,-0.0192187856782626,-0.0018624475313357,-0.0582870566666188,0.0135095024090658,-0.0112488693177739,-0.1362111397460007,1
2020-09-16,Boeing And FAA Share Blame For Deadly 737 Max Crashes: Congressional Report,BA,0.0242828374048169,0.4683403105827963,-0.0112488693177739,0.03195413163889,0.0161075099677077,-0.0192187856782626,-0.0018624475313357,0.0004179628724683,-0.0976413410582388,2
2020-09-16,Looking Into Boeing's Return On Capital Employed,BA,0.0242828374048169,0.4683403105827963,-0.0112488693177739,0.03195413163889,0.0161075099677077,-0.0192187856782626,-0.0018624475313357,0.0004179628724683,-0.0976413410582388,2
2020-09-16,"With The Fed On Deck, Investors Cheer FedEx Earnings, But Boeing Loses Altitude",BA,0.0242828374048169,0.4683403105827963,-0.0112488693177739,0.03195413163889,0.0161075099677077,-0.0192187856782626,-0.0018624475313357,0.0004179628724683,-0.0976413410582388,2
2020-09-18,Analyzing Boeing's Unusual Options Activity,BA,-0.0381424188874172,0.1186389962369027,0.0004179628724683,0.0242828374048169,-0.0112488693177739,0.03195413163889,0.0161075099677077,-0.0297256628042442,0.0484288505741914,1
2020-09-21,Boeing Expands Freighter Conversion Lines As Orders Increase,BA,-0.0297256628042442,0.0484288505741914,-0.0381424188874172,0.0004179628724683,0.0242828374048169,-0.0112488693177739,0.03195413163889,0.00287813834778,-0.2316251032419038,2
2020-09-25,Return On Capital Employed Overview: Boeing,BA,0.0683327320712365,0.0747247962034238,-0.0339329929392518,-0.0358419022104321,0.00287813834778,-0.0297256628042442,-0.0381424188874172,0.0644107103145816,0.3346221199739039,0
2020-10-07,Looking Into Boeing's Return On Capital Employed,BA,0.0317789114803694,-0.4479584151063491,-0.0681074992404028,0.0185625599904715,0.0013106232568997,0.0157328221586505,0.0101466280036075,0.0205941277995187,-0.2083277284763884,0
2020-10-07,"Sports Betting Site Allows Wagers On Tesla, Rivian, Lordstown In Race For First Electric Pickup",BA,0.0317789114803694,-0.4479584151063491,-0.0681074992404028,0.0185625599904715,0.0013106232568997,0.0157328221586505,0.0101466280036075,0.0205941277995187,-0.2083277284763884,0
2020-10-16,"Boeing 737 Max Cleared For Takeoff After 19-Month Grounding, European Regulator Says",BA,0.0189357069309219,1.4027429158980254,0.0061259493160326,0.0067842981846333,-0.031132396318196,0.000119549825148,-0.0039880843389601,-0.0014341528796575,-0.4801986117316853,2
2020-10-16,"Pfizer Vaccine Announcement Raises Optimism Going Into Weekend, But Stimulus Hopes Fall",BA,0.0189357069309219,1.4027429158980254,0.0061259493160326,0.0067842981846333,-0.031132396318196,0.000119549825148,-0.0039880843389601,-0.0014341528796575,-0.4801986117316853,2
2020-10-19,"Halliburton, IBM Earnings Today Kick Off Busy Week Of Corporate Reporting",BA,-0.0014341528796575,-0.4801986117316853,0.0189357069309219,0.0061259493160326,0.0067842981846333,-0.031132396318196,0.000119549825148,0.0007779599206372,-0.2542252839051793,2
2020-10-23,"Gilead Shares Pop After Company's Drug Gets COVID-19 OK, But Intel Down On Earnings",BA,-0.0101141931731745,-0.2959643775196303,0.0317954759823067,-0.0202105044952934,0.0007779599206372,-0.0014341528796575,0.0189357069309219,-0.0390176789883028,0.6112108696953373,1
2020-10-26,"FAANGs In Focus: Amazon, Facebook, Apple, Alphabet, All Set To Report Later This Week",BA,-0.0390176789883028,0.6112108696953373,-0.0101141931731745,0.0317954759823067,-0.0202105044952934,0.0007779599206372,-0.0014341528796575,-0.0347571738745777,-0.0408145575223978,1
2020-10-27,"Caterpillar, Pfizer, 3M Earnings Come In Better Than Expected, With Microsoft Straight Ahead",BA,-0.0347571738745777,-0.0408145575223978,-0.0390176789883028,-0.0101141931731745,0.0317954759823067,-0.0202105044952934,0.0007779599206372,-0.045735672843868,0.309058282069985,1
2020-10-28,What Does Boeing's Debt Look Like?,BA,-0.045735672843868,0.309058282069985,-0.0347571738745777,-0.0390176789883028,-0.0101141931731745,0.0317954759823067,-0.0202105044952934,0.001012514493738,-0.2823252694799751,2
2020-10-28,"Weakness Spreads Through Every Sector, With FAANG Stocks Down 3% To 5% Ahead Of Earnings",BA,-0.045735672843868,0.309058282069985,-0.0347571738745777,-0.0390176789883028,-0.0101141931731745,0.0317954759823067,-0.0202105044952934,0.001012514493738,-0.2823252694799751,2
2020-10-28,"Earnings Scheduled For October 28, 2020",BA,-0.045735672843868,0.309058282069985,-0.0347571738745777,-0.0390176789883028,-0.0101141931731745,0.0317954759823067,-0.0202105044952934,0.001012514493738,-0.2823252694799751,2
2020-10-28,Recap: Boeing Q3 Earnings,BA,-0.045735672843868,0.309058282069985,-0.0347571738745777,-0.0390176789883028,-0.0101141931731745,0.0317954759823067,-0.0202105044952934,0.001012514493738,-0.2823252694799751,2
2020-11-09,Return On Capital Employed Overview: Boeing,BA,0.1370609507055231,4.44870825737027,0.0041378138037211,0.0360086478879815,-0.0131466911416394,0.0339837657170141,0.0291571904679224,0.0520182972753413,-0.0532516974603382,0
2020-11-09,Boeing 737 MAX Jets Could Be Ungrounded Next Week: Report,BA,0.1370609507055231,4.44870825737027,0.0041378138037211,0.0360086478879815,-0.0131466911416394,0.0339837657170141,0.0291571904679224,0.0520182972753413,-0.0532516974603382,0
2020-11-10,A Look Into Boeing's Debt,BA,0.0520182972753413,-0.0532516974603382,0.1370609507055231,0.0041378138037211,0.0360086478879815,-0.0131466911416394,0.0339837657170141,-0.0346600692156583,-0.3554950726549049,1
2020-11-11,Boeing Continues To Lose 737 Max Orders Even As Jets Get Closer To Ungrounding,BA,-0.0346600692156583,-0.3554950726549049,0.0520182972753413,0.1370609507055231,0.0041378138037211,0.0360086478879815,-0.0131466911416394,-0.0298105564519925,-0.3216351587211362,1
2020-11-12,"A Peek Into The Markets: US Stock Futures Mostly Lower; Disney, Cisco Earnings In Focus",BA,-0.0298105564519925,-0.3216351587211362,-0.0346600692156583,0.0520182972753413,0.1370609507055231,0.0041378138037211,0.0360086478879815,0.0587935678920266,-0.027794207527454,0
2020-11-12,"Boeing Raises China Demand Expectations By 6.3% On Pandemic Recovery, Improved Infrastructure",BA,-0.0298105564519925,-0.3216351587211362,-0.0346600692156583,0.0520182972753413,0.1370609507055231,0.0041378138037211,0.0360086478879815,0.0587935678920266,-0.027794207527454,0
2020-11-17,Tuesday's Market Minute: Costco Announces $10/Share Special Dividend,BA,0.0377964890610913,-0.0558023607837723,0.0817166011237078,0.0587935678920266,-0.0298105564519925,-0.0346600692156583,0.0520182972753413,-0.0321352054364729,0.7230262694096237,1
2020-11-17,Not Good Enough? Impressive Earnings From Walmart And Home Depot Fail To Lift Market,BA,0.0377964890610913,-0.0558023607837723,0.0817166011237078,0.0587935678920266,-0.0298105564519925,-0.0346600692156583,0.0520182972753413,-0.0321352054364729,0.7230262694096237,1
2020-11-18,"After Nearly 2 Years, FAA Says Boeing's 737 Max Can Carry Passengers And Fly Again",BA,-0.0321352054364729,0.7230262694096237,0.0377964890610913,0.0817166011237078,0.0587935678920266,-0.0298105564519925,-0.0346600692156583,0.0116576246021211,-0.4811981082182792,0
2020-11-18,"Jim Cramer Discusses Boeing 737 Max, COVID-19 Vaccines",BA,-0.0321352054364729,0.7230262694096237,0.0377964890610913,0.0817166011237078,0.0587935678920266,-0.0298105564519925,-0.0346600692156583,0.0116576246021211,-0.4811981082182792,0
2020-11-18,"Lowe's, Target Earnings Looks Solid, But Shares Go Different Directions In Early Trading",BA,-0.0321352054364729,0.7230262694096237,0.0377964890610913,0.0817166011237078,0.0587935678920266,-0.0298105564519925,-0.0346600692156583,0.0116576246021211,-0.4811981082182792,0
2020-11-18,A Look Into Boeing's Debt,BA,-0.0321352054364729,0.7230262694096237,0.0377964890610913,0.0817166011237078,0.0587935678920266,-0.0298105564519925,-0.0346600692156583,0.0116576246021211,-0.4811981082182792,0
2020-11-18,PreMarket Prep Stock Of The Day: Boeing,BA,-0.0321352054364729,0.7230262694096237,0.0377964890610913,0.0817166011237078,0.0587935678920266,-0.0298105564519925,-0.0346600692156583,0.0116576246021211,-0.4811981082182792,0
2020-11-18,36 Stocks Moving in Wednesday's Pre-Market Session,BA,-0.0321352054364729,0.7230262694096237,0.0377964890610913,0.0817166011237078,0.0587935678920266,-0.0298105564519925,-0.0346600692156583,0.0116576246021211,-0.4811981082182792,0
2020-11-18,"A Peek Into The Markets: US Stock Futures Up; Target, NVIDIA Earnings In Focus",BA,-0.0321352054364729,0.7230262694096237,0.0377964890610913,0.0817166011237078,0.0587935678920266,-0.0298105564519925,-0.0346600692156583,0.0116576246021211,-0.4811981082182792,0
2020-11-24,"December Outlook: Holidays Arrive For A Wild 2020 As Volatility Eases, Vaccine Hopes Grow",BA,0.0329031662366197,0.0972635378043451,0.0596633801895325,-0.0294160699451559,0.0116576246021211,-0.0321352054364729,0.0377964890610913,-0.0040276665325088,-0.3815334703841706,2
2020-11-25,Deere Earnings Greeted With Cheer As Company Cites Improved Equipment Demand,BA,-0.0040276665325088,-0.3815334703841706,0.0329031662366197,0.0596633801895325,-0.0294160699451559,0.0116576246021211,-0.0321352054364729,-0.0051008713167511,-0.4821778218665116,1
2020-12-03,ROCE Insights For Boeing,BA,0.0596381080219987,0.7731000335747888,0.0508896853491622,0.0109154179663237,-0.0267436179498051,-0.0051008713167511,-0.0040276665325088,-0.0189291327661978,-0.3605759917814958,1
2020-12-04,"Boeing Gets Largest 737 Max Order Since Grounding Last Year, Shares Surge 6%",BA,-0.0189291327661978,-0.3605759917814958,0.0596381080219987,0.0508896853491622,0.0109154179663237,-0.0267436179498051,-0.0051008713167511,0.0234626414745953,0.1316715682269966,0
2020-12-04,A Peek Into The Markets: US Stock Futures Gain; All Eyes On Jobs Report,BA,-0.0189291327661978,-0.3605759917814958,0.0596381080219987,0.0508896853491622,0.0109154179663237,-0.0267436179498051,-0.0051008713167511,0.0234626414745953,0.1316715682269966,0
2020-12-07,A Look Into Boeing's Debt,BA,0.0234626414745953,0.1316715682269966,-0.0189291327661978,0.0596381080219987,0.0508896853491622,0.0109154179663237,-0.0267436179498051,-0.0067178521939258,-0.4080013956272351,1
2020-12-08,Boeing 737 MAX Passenger Flights To Start With Brazil's Gol,BA,-0.0067178521939258,-0.4080013956272351,0.0234626414745953,-0.0189291327661978,0.0596381080219987,0.0508896853491622,0.0109154179663237,-0.0190641654731997,-0.032435728076415,1
2020-12-09,7 Stocks That Could Benefit From China's 'Urban Air Mobility' Investment,BA,-0.0190641654731997,-0.032435728076415,-0.0067178521939258,0.0234626414745953,-0.0189291327661978,0.0596381080219987,0.0508896853491622,0.0102128550466311,-0.1501081728244659,0
2020-12-15,Boeing To Conduct Enhanced Fuselage Inspections For 787 Dreamliner: WSJ,BA,0.0038492034887911,-0.0123497233661965,-0.0074241596851176,-0.0174891906872892,0.0102128550466311,-0.0190641654731997,-0.0067178521939258,-0.0158170147399236,-0.0597724508652869,1
2020-12-21,Airlines Secure $15B Payroll Reimbursement In Bipartisan COVID-19 Relief Deal,BA,-0.0020022864227815,-0.019185242604542,-0.0067347923348795,-0.02049847135128,-0.0158170147399236,0.0038492034887911,-0.0074241596851176,-0.0024166649272578,-0.2908445251381731,2
2020-12-21,Return On Capital Employed Overview: Boeing,BA,-0.0020022864227815,-0.019185242604542,-0.0067347923348795,-0.02049847135128,-0.0158170147399236,0.0038492034887911,-0.0074241596851176,-0.0024166649272578,-0.2908445251381731,2
2020-12-22,"US Congress Clears $900B COVID-19 Relief Bill, $1.4T Government Spending Plan",BA,-0.0024166649272578,-0.2908445251381731,-0.0020022864227815,-0.0067347923348795,-0.02049847135128,-0.0158170147399236,0.0038492034887911,0.0041594463259293,-0.1815512048192771,2
2020-12-24,Early Christmas For Banks? 10-Year Yield Flirting With 1% Again As Holiday-Shortened Session Starts,BA,-0.0115617848636481,-0.4113073879841752,0.0041594463259293,-0.0024166649272578,-0.0020022864227815,-0.0067347923348795,-0.02049847135128,-0.0048814072686507,0.4207392357583808,2
2020-12-28,Return On Capital Employed Overview: Boeing,BA,-0.0048814072686507,0.4207392357583808,-0.0115617848636481,0.0041594463259293,-0.0024166649272578,-0.0020022864227815,-0.0067347923348795,0.0007404491870099,0.6053725826678107,2
2020-12-28,From Mars To Your Hands: KULR Is Making Electronics Cooler And Safer,BA,-0.0048814072686507,0.4207392357583808,-0.0115617848636481,0.0041594463259293,-0.0024166649272578,-0.0020022864227815,-0.0067347923348795,0.0007404491870099,0.6053725826678107,2
2020-12-29,Top Five US Banks Generate Record $37 Billion Investment Bank Revenues In 2020: FT,BA,0.0007404491870099,0.6053725826678107,-0.0048814072686507,-0.0115617848636481,0.0041594463259293,-0.0024166649272578,-0.0020022864227815,0.0019421880644869,-0.2590963285778892,2
2020-12-29,"House Passes $2,000 Direct Payments, But Senate Approval Seen Tougher",BA,0.0007404491870099,0.6053725826678107,-0.0048814072686507,-0.0115617848636481,0.0041594463259293,-0.0024166649272578,-0.0020022864227815,0.0019421880644869,-0.2590963285778892,2
2020-12-30,FAANGs In Focus After Mega-Caps Had A Tough Tuesday Aside From Gains For Amazon,BA,0.0019421880644869,-0.2590963285778892,0.0007404491870099,-0.0048814072686507,-0.0115617848636481,0.0041594463259293,-0.0024166649272578,-0.0120459714423242,-0.0300575254795331,1
2021-01-04,Airlines Expect Turbulent 2021 After 2020 Erased Two Decades Of Passenger Traffic Growth,BA,-0.0529757846735776,1.023875815248484,-0.0120459714423242,0.0019421880644869,0.0007404491870099,-0.0048814072686507,-0.0115617848636481,0.0439522672082512,-0.0889162143826323,0
2021-01-04,ROCE Insights For Boeing,BA,-0.0529757846735776,1.023875815248484,-0.0120459714423242,0.0019421880644869,0.0007404491870099,-0.0048814072686507,-0.0115617848636481,0.0439522672082512,-0.0889162143826323,0
2021-01-05,"""Reopening"" Shares In Focus After Coca-Cola, Boeing Hit By Virus Fears On Monday",BA,0.0439522672082512,-0.0889162143826323,-0.0529757846735776,-0.0120459714423242,0.0019421880644869,0.0007404491870099,-0.0048814072686507,-0.0028351655704391,-0.1621704079469239,2
2021-01-05,Cramer Says It's 'Inconceivable' US Won't Have Better Relationship With China,BA,0.0439522672082512,-0.0889162143826323,-0.0529757846735776,-0.0120459714423242,0.0019421880644869,0.0007404491870099,-0.0048814072686507,-0.0028351655704391,-0.1621704079469239,2
2021-01-07,Democrats In Charge — What Does It Mean for Wall Street? 9 Themes To Watch,BA,0.0079609910642484,-0.1066583550382046,-0.0028351655704391,0.0439522672082512,-0.0529757846735776,-0.0120459714423242,0.0019421880644869,-0.0132105341953319,-0.0228062539294325,1
2021-01-08,A Peek Into The Markets: US Stock Futures Climb; All Eyes On Jobs Report,BA,-0.0132105341953319,-0.0228062539294325,0.0079609910642484,-0.0028351655704391,0.0439522672082512,-0.0529757846735776,-0.0120459714423242,-0.0148165826621476,0.1856829751131221,1
2021-01-08,Boeing Agrees To Settle US Criminal Charges Related To 737 MAX Probe For $2.5B,BA,-0.0132105341953319,-0.0228062539294325,0.0079609910642484,-0.0028351655704391,0.0439522672082512,-0.0529757846735776,-0.0120459714423242,-0.0148165826621476,0.1856829751131221,1
2021-01-12,"Atlas Air, DHL Express Buy Large Boeing Freighters",BA,0.0078340849585258,-0.2345873359450934,-0.0148165826621476,-0.0132105341953319,0.0079609910642484,-0.0028351655704391,0.0439522672082512,-0.0057578663555312,-0.3323179757249029,1
2021-01-13,Cathie Wood Could Be Launching A Space Exploration ETF,BA,-0.0057578663555312,-0.3323179757249029,0.0078340849585258,-0.0148165826621476,-0.0132105341953319,0.0079609910642484,-0.0028351655704391,0.0130302440073299,0.4522839974330552,0
2021-01-13,"A Peek Into The Markets: US Stock Futures Flat Ahead Of Consumer Prices, Beige Book Report",BA,-0.0057578663555312,-0.3323179757249029,0.0078340849585258,-0.0148165826621476,-0.0132105341953319,0.0079609910642484,-0.0028351655704391,0.0130302440073299,0.4522839974330552,0
2021-01-13,"Boeing Delivered 157 Aircrafts In 2020, Its Worst Showing In Decades",BA,-0.0057578663555312,-0.3323179757249029,0.0078340849585258,-0.0148165826621476,-0.0132105341953319,0.0079609910642484,-0.0028351655704391,0.0130302440073299,0.4522839974330552,0
2021-01-14,"Delta, BlackRock Both Up Early On As Investors Cheer Earnings Results",BA,0.0130302440073299,0.4522839974330552,-0.0057578663555312,0.0078340849585258,-0.0148165826621476,-0.0132105341953319,0.0079609910642484,-0.0266304427629319,-0.1079393900440274,1
2021-01-15,Return On Capital Employed Overview: Boeing,BA,-0.0266304427629319,-0.1079393900440274,0.0130302440073299,-0.0057578663555312,0.0078340849585258,-0.0148165826621476,-0.0132105341953319,0.0312744673090612,0.0760044311150738,0
2021-01-20,A Peek Into The Markets: US Stock Futures Up; Biden's Inauguration In Focus,BA,0.0035118893778018,-0.1858343377527789,0.0312744673090612,-0.0266304427629319,0.0130302440073299,-0.0057578663555312,0.0078340849585258,-0.0191061401959807,0.1402590726842809,1
2021-01-20,"Morgan Stanley Impresses With Earnings, Buttressed By Robust Investment Banking",BA,0.0035118893778018,-0.1858343377527789,0.0312744673090612,-0.0266304427629319,0.0130302440073299,-0.0057578663555312,0.0078340849585258,-0.0191061401959807,0.1402590726842809,1
2021-01-21,Boeing Secures $2.1B Deal With US Air Force,BA,-0.0191061401959807,0.1402590726842809,0.0035118893778018,0.0312744673090612,-0.0266304427629319,0.0130302440073299,-0.0057578663555312,-0.0075695834168946,-0.3224779782351933,1
2021-01-21,"Earnings Extravaganza As Investors Digest United's Losses, Await Intel And IBM",BA,-0.0191061401959807,0.1402590726842809,0.0035118893778018,0.0312744673090612,-0.0266304427629319,0.0130302440073299,-0.0057578663555312,-0.0075695834168946,-0.3224779782351933,1
2021-01-25,Monday's Market Minute: Will Tech Strength Continue?,BA,-0.0120481722292109,0.8997950656056211,-0.0075695834168946,-0.0191061401959807,0.0035118893778018,0.0312744673090612,-0.0266304427629319,-0.0063926192361136,-0.2286602877516426,1
2021-01-25,"Earnings Palooza: 20% Of S&P 500 Reports This Week, Including Apple, Tesla",BA,-0.0120481722292109,0.8997950656056211,-0.0075695834168946,-0.0191061401959807,0.0035118893778018,0.0312744673090612,-0.0266304427629319,-0.0063926192361136,-0.2286602877516426,1
2021-01-26,"Earnings Continue With Johnson & Johnson, 3M Early, Followed By Microsoft Later",BA,-0.0063926192361136,-0.2286602877516426,-0.0120481722292109,-0.0075695834168946,-0.0191061401959807,0.0035118893778018,0.0312744673090612,-0.0397406655266752,0.9023683684774516,1
2021-01-26,"Boeing Earnings Ahead: Eyeing Workforce Cuts, Aerospace Spending, And The Newly ""Ungrounded"" 737 MAX",BA,-0.0063926192361136,-0.2286602877516426,-0.0120481722292109,-0.0075695834168946,-0.0191061401959807,0.0035118893778018,0.0312744673090612,-0.0397406655266752,0.9023683684774516,1
2021-01-27,"Markets Shift To Risk-Off After Fed Meeting, And Ahead Of Apple, Tesla Earnings",BA,-0.0397406655266752,0.9023683684774516,-0.0063926192361136,-0.0120481722292109,-0.0075695834168946,-0.0191061401959807,0.0035118893778018,0.0164922793814068,-0.5033916509535289,0
2021-01-27,Boeing: Q4 Earnings Insights,BA,-0.0397406655266752,0.9023683684774516,-0.0063926192361136,-0.0120481722292109,-0.0075695834168946,-0.0191061401959807,0.0035118893778018,0.0164922793814068,-0.5033916509535289,0
2021-01-27,"Earnings Scheduled For January 27, 2021",BA,-0.0397406655266752,0.9023683684774516,-0.0063926192361136,-0.0120481722292109,-0.0075695834168946,-0.0191061401959807,0.0035118893778018,0.0164922793814068,-0.5033916509535289,0
2021-01-27,Boeing's Debt Insights,BA,-0.0397406655266752,0.9023683684774516,-0.0063926192361136,-0.0120481722292109,-0.0075695834168946,-0.0191061401959807,0.0035118893778018,0.0164922793814068,-0.5033916509535289,0
2021-01-27,A Peek Into The Markets: US Stock Futures Mixed; Microsoft Beats Q2 Estimates,BA,-0.0397406655266752,0.9023683684774516,-0.0063926192361136,-0.0120481722292109,-0.0075695834168946,-0.0191061401959807,0.0035118893778018,0.0164922793814068,-0.5033916509535289,0
2021-01-27,"7 Stocks To Watch For January 27, 2021",BA,-0.0397406655266752,0.9023683684774516,-0.0063926192361136,-0.0120481722292109,-0.0075695834168946,-0.0191061401959807,0.0035118893778018,0.0164922793814068,-0.5033916509535289,0
2021-01-28,"The Tech Earnings Barrage: Earnings Beats By Apple, Facebook; More Big Tech Companies Report Next Week",BA,0.0164922793814068,-0.5033916509535289,-0.0397406655266752,-0.0063926192361136,-0.0120481722292109,-0.0075695834168946,-0.0191061401959807,-0.015413442944715,0.3153356659489388,1
2021-02-09,"Virgin Galactic Forms Advisory Board With NASA, Boeing Vets",BA,0.0149563492077775,0.2176335393173016,0.0193334507481526,-0.0128655845125318,0.0156709581443887,0.0320991184924615,0.0260416983194606,-0.0148754045224804,-0.1546009386223257,1
2021-02-10,"After Getting A Lyft, Market Awaits Uber Earnings, Fed's Powell Later Today",BA,-0.0148754045224804,-0.1546009386223257,0.0149563492077775,0.0193334507481526,-0.0128655845125318,0.0156709581443887,0.0320991184924615,-0.0059456139945388,-0.3796902012909727,1
2021-02-12,ROCE Insights For Boeing,BA,0.0015189977208152,-0.1581748410408672,-0.0059456139945388,-0.0148754045224804,0.0149563492077775,0.0193334507481526,-0.0128655845125318,0.0293866578528558,0.6921374858587874,0
2021-02-12,Dogecoin Co-Founder Says He Can't 'Comprehend' Calls For The Joke Crypto He Created In 3 Hours To Hit $1,BA,0.0015189977208152,-0.1581748410408672,-0.0059456139945388,-0.0148754045224804,0.0149563492077775,0.0193334507481526,-0.0128655845125318,0.0293866578528558,0.6921374858587874,0
2021-02-16,DMS Selects Boeing Veteran As New Finance Chief,BA,0.0293866578528558,0.6921374858587874,0.0015189977208152,-0.0059456139945388,-0.0148754045224804,0.0149563492077775,0.0193334507481526,-0.0076433762745283,-0.0880042473282142,1
2021-02-22,"Home Depot, Lowe's, Nvidia Among Highlights Of Another Key Earnings Week",BA,-0.0211063425397803,0.7247831304922152,0.0431216695961229,-0.0326652208860476,-0.0076433762745283,0.0293866578528558,0.0015189977208152,-0.0035701322256328,-0.2529688937455927,2
2021-02-22,Boeing Seeks Grounding Of 777s Equipped With Pratt-Whitney Engine Model,BA,-0.0211063425397803,0.7247831304922152,0.0431216695961229,-0.0326652208860476,-0.0076433762745283,0.0293866578528558,0.0015189977208152,-0.0035701322256328,-0.2529688937455927,2
2021-02-22,Boeing 757 Diverted To Emergency Landing Over Engine Problems,BA,-0.0211063425397803,0.7247831304922152,0.0431216695961229,-0.0326652208860476,-0.0076433762745283,0.0293866578528558,0.0015189977208152,-0.0035701322256328,-0.2529688937455927,2
2021-02-23,Tuesday's Market Minute: Boeing 777 Grounded,BA,-0.0035701322256328,-0.2529688937455927,-0.0211063425397803,0.0431216695961229,-0.0326652208860476,-0.0076433762745283,0.0293866578528558,0.0811804715118429,0.9197271937337076,0
2021-02-23,United Airlines Sacrifices Cargo Capacity To Replace Grounded 777s,BA,-0.0035701322256328,-0.2529688937455927,-0.0211063425397803,0.0431216695961229,-0.0326652208860476,-0.0076433762745283,0.0293866578528558,0.0811804715118429,0.9197271937337076,0
2021-02-25,Nvidia Becomes Latest Company To Beat Earnings Estimates But Get Punished,BA,-0.0562047597256318,-0.3720794677833751,0.0811804715118429,-0.0035701322256328,-0.0211063425397803,0.0431216695961229,-0.0326652208860476,-0.0205128320813419,-0.3342114816159311,1
2021-02-25,Boeing Trying To Resume Max 737 Flights In Asia: Report,BA,-0.0562047597256318,-0.3720794677833751,0.0811804715118429,-0.0035701322256328,-0.0211063425397803,0.0431216695961229,-0.0326652208860476,-0.0205128320813419,-0.3342114816159311,1
2021-02-26,"Boeing 777 Experiences Engine Problem Again, This Time Over Russia",BA,-0.0205128320813419,-0.3342114816159311,-0.0562047597256318,0.0811804715118429,-0.0035701322256328,-0.0211063425397803,0.0431216695961229,0.0583934965500567,0.4593251495513459,0
