date,title,stock,close,volume,1_past_close,2_past_close,3_past_close,4_past_close,5_past_close,next_close,next_volume,label
2017-10-17,8 Stocks Moving On Trump's Latest Obamacare Comments,CI,0.0119467223995661,0.8711001642036125,-0.0062313074416286,-0.0043327543822169,5.364561418663705e-05,-0.0059553145529138,-0.0053940650933368,0.0115384915336189,0.0788503729706011,0
2017-11-02,"Earnings Scheduled For November 2, 2017",CI,0.0027800784678351,0.1665276950565812,0.0031434947248218,-0.0025287899866722,-0.0208970973018809,0.0160503897204689,0.015584940439093,0.0176923026469344,-0.3678137445113857,0
2017-11-02,"15 Stocks To Watch For November 2, 2017",CI,0.0027800784678351,0.1665276950565812,0.0031434947248218,-0.0025287899866722,-0.0208970973018809,0.0160503897204689,0.015584940439093,0.0176923026469344,-0.3678137445113857,0
2018-01-30,"Mark Cuban Thinks Amazon, Berkshire, JPMorgan Collab Could Pressure Congress To Act",CI,-0.0715051054977442,4.039418865505822,-0.0102556192096394,0.0195602966943473,0.0039817622893729,0.0055052898101779,-0.0043487909166513,0.0022126475934871,-0.4234323992029507,2
2018-01-30,"Amazon, Berkshire, And JPMorgan Are Creating A Heath Care Company: Here's What You Need To Know",CI,-0.0715051054977442,4.039418865505822,-0.0102556192096394,0.0195602966943473,0.0039817622893729,0.0055052898101779,-0.0043487909166513,0.0022126475934871,-0.4234323992029507,2
2018-02-01,"A Peek Into The Markets: U.S. Stock Futures Mixed; Apple, Alphabet Earnings In Focus",CI,-0.0160305941194471,0.0130151843817787,0.0022126475934871,-0.0715051054977442,-0.0102556192096394,0.0195602966943473,0.0039817622893729,-0.0026827705661079,-0.2166733205095633,2
2018-02-01,"Earnings Scheduled For February 1, 2018",CI,-0.0160305941194471,0.0130151843817787,0.0022126475934871,-0.0715051054977442,-0.0102556192096394,0.0195602966943473,0.0039817622893729,-0.0026827705661079,-0.2166733205095633,2
2018-02-13,How A Walgreens-AmeriSource Combo Stacks Up Against CVS-Aetna,CI,0.0097125966648088,-0.1092659191876453,-0.001083795028596,0.0237754460993051,-0.0315695022552717,-0.010881321245814,0.0060078397622846,0.0005629248121472,-0.2335827098919368,2
2018-03-08,"ICYMI: Cigna And Express Scripts, AMD And Nvidia, Amazon And Wayfair",CI,-0.1145431900323518,12.59627134576218,0.0006179761412163,0.0093064902871382,-0.0037293935839338,-0.0018613080597338,-0.0126090464892111,0.0081415905689443,-0.6414760615313706,0
2018-03-13,Analyst: Why Diplomat Could Be Amazon's Ticket Into The Pharma Space,CI,-0.0174526020736177,-0.1574508515929245,-0.0348983633441809,0.0081415905689443,-0.1145431900323518,0.0006179761412163,0.0093064902871382,0.0151468359453714,-0.3214439850199779,0
2018-03-20,Checking In On The Healthcare Sector Ahead Of Q1 Earnings Season,CI,-0.0086517163026301,0.016770496543385,-0.0132210360453827,0.0106053494048559,0.0001195963461699,0.0151468359453714,-0.0174526020736177,0.0124240676901261,0.4663271373542565,0
2018-04-02,"'It Could Be In Walmart's Best Interest To Act': Morgan Stanley Breaks Down Pros, Cons Of A Humana Deal",CI,-0.0184214904430874,0.0076386096999379,-0.003445973757628,0.0167937273516369,-0.0186151051732421,0.0285364922848918,-0.0081046675051136,0.0194353446672692,-0.3842582517228872,0
2018-06-07,"Eli Lilly CEO Calls For Uniform Prices, Better Use Of Technology In Health Care",CI,0.0124622260595748,-0.4550270471926879,0.024000505215139,-0.0009942100900633,0.0010535836052583,0.0085615299547701,-0.0227904098249837,0.0039522444961406,0.1412924424972617,2
2018-06-13,"Wall Street Analysts Reflect On AT&T-Time Warner Ruling, Assess Implications Outside Tech, Media",CI,-0.0147635847958809,1.4859028194361126,-0.0117709175027495,0.0176590973434129,0.0039522444961406,0.0124622260595748,0.024000505215139,-0.0048244429558135,-0.4001769626769627,2
2018-06-13,Cramer: AT&T-Time Warner Decision A 'Huge Positive' For Overall Market,CI,-0.0147635847958809,1.4859028194361126,-0.0117709175027495,0.0176590973434129,0.0039522444961406,0.0124622260595748,0.024000505215139,-0.0048244429558135,-0.4001769626769627,2
2018-07-09,Health Care Sector Outlook: Checking In Ahead Of Q2 Earnings Reports,CI,0.0065078059562995,0.4689373644597525,0.0006980514613463,0.0101614638755225,0.0072174116677545,-0.0054132554932808,0.0011192265000985,0.0013276747182286,-0.1591836734693877,2
2018-07-30,"The Week Ahead: Apple And Tesla Earnings, FOMC Meeting, Sonos IPO",CI,-0.0025391242455933,0.3604350888175913,-0.0038777273015825,0.0024791495186273,0.0060648346061287,-0.0055800429721074,-0.003762215709157,0.0148189319658276,0.6387115329306874,0
2018-08-02,Benzinga Pro's 5 Stocks To Watch Today,CI,0.0326352813880972,-0.1897565339638315,0.0195633085834188,0.0148189319658276,-0.0025391242455933,-0.0038777273015825,0.0024791495186273,0.0018530788328661,-0.4376158365866162,2
2018-08-07,Benzinga Pro's 5 Stocks To Watch Today,CI,0.0021823949085897,0.6451467064514671,-0.0073448693428096,0.0018530788328661,0.0326352813880972,0.0195633085834188,0.0148189319658276,0.0063209101031924,0.575750913737668,0
2018-11-01,"Earnings Scheduled For November 1, 2018",CI,0.0115523049960484,0.4607248074397472,0.0168839918608783,0.0163870898472699,0.0008707395437184,-0.0174928129496619,0.0418480837912385,-0.0145645557202032,-0.445654022792992,1
2018-11-01,"12 Stocks To Watch For November 1, 2018",CI,0.0115523049960484,0.4607248074397472,0.0168839918608783,0.0163870898472699,0.0008707395437184,-0.0174928129496619,0.0418480837912385,-0.0145645557202032,-0.445654022792992,1
2018-11-05,"Fundstrat, Reality Shares Partner On New Multi-Factor ETF",CI,0.0111199792048908,-0.4059089115854994,-0.0145645557202032,0.0115523049960484,0.0168839918608783,0.0163870898472699,0.0008707395437184,-0.0058468062982867,0.5766251014535526,1
2018-11-15,"Q3 13F Roundup: How Buffett, Einhorn, Ackman And Others Adjusted Their Portfolio",CI,0.0021189763137416,-0.1268152773743828,-0.0032855294177045,-0.0200993349986945,-0.0010566498746613,-0.0128805608813223,0.000908014945949,0.0043233766443873,-0.2528377198453286,2
2019-02-01,"Earnings Scheduled For February 1, 2019",CI,-0.0287773531428542,0.9229334346609556,5.0104349653024016e-05,0.0071072469368265,0.016967344729367,-0.006113719811902,0.016625969348329,-0.0102544850700413,-0.3988718630427362,1
2019-02-01,"12 Stocks To Watch For February 1, 2019",CI,-0.0287773531428542,0.9229334346609556,5.0104349653024016e-05,0.0071072469368265,0.016967344729367,-0.006113719811902,0.016625969348329,-0.0102544850700413,-0.3988718630427362,1
2019-05-06,"Top Ideas From The 2019 Sohn Conference: AerCap, Cigna, 3M, Zillow And More",CI,0.0390629418892167,-0.4360856587532972,-0.0340664509471295,-0.0233334576771382,0.0198943779584312,-0.0113897049111321,-0.0016776742583981,-0.0229220030433889,-0.2766579473765195,1
2019-07-11,Trump Administration Withdraws Drug Rebate Plan,CI,0.092392780164108,9.610162344507696,0.0048832734107813,-0.012366190586031,-0.0104628069257759,-0.0084328013010728,0.0186637675243916,0.0220716854184854,-0.6202805818297432,0
2019-07-12,Stock Market Eyes Records On Dovish Commentary From Federal Reserve,CI,0.0220716854184854,-0.6202805818297432,0.092392780164108,0.0048832734107813,-0.012366190586031,-0.0104628069257759,-0.0084328013010728,-0.0121645441723333,-0.527369302422942,1
2019-08-01,"15 Stocks To Watch For August 1, 2019",CI,-0.0138888940747214,0.5743320279581619,-0.0135268928257559,5.819941329088252e-05,0.0295276771903811,0.0045031274760771,-0.0276154767276886,-0.0177846656387253,-0.3998866463049844,1
2019-08-01,"A Peek Into The Markets: US Stock Futures Up Ahead Of Earnings, Economic Data",CI,-0.0138888940747214,0.5743320279581619,-0.0135268928257559,5.819941329088252e-05,0.0295276771903811,0.0045031274760771,-0.0276154767276886,-0.0177846656387253,-0.3998866463049844,1
2019-08-01,"Earnings Scheduled For August 1, 2019",CI,-0.0138888940747214,0.5743320279581619,-0.0135268928257559,5.819941329088252e-05,0.0295276771903811,0.0045031274760771,-0.0276154767276886,-0.0177846656387253,-0.3998866463049844,1
2019-10-28,More Earnings And A Fed Decision In Week Four Of The WeTrader Competition,CI,0.0192429975287489,0.523655021504565,0.0081125967675674,-0.0161935205186755,0.0148492605950745,0.0218302872810252,-0.0008388709173832,0.0182504752501069,-0.0457089090278809,0
2019-10-31,"9 Stocks To Watch For October 31, 2019",CI,0.0114486541055545,0.9532756246311234,-0.0086526222412814,0.0182504752501069,0.0192429975287489,0.0081125967675674,-0.0161935205186755,0.0058835501810001,-0.1373822833257793,0
2019-12-20,Stocks That Hit 52-Week Highs On Friday,CI,0.0295389714322384,1.936263736263736,0.0026237370174593,0.0241834631630004,-0.0082508539213157,0.0277031420624429,-0.0190638986903628,0.0091890028737584,-0.6154312995630361,0
2020-01-09,Stocks That Hit 52-Week Highs On Thursday,CI,-0.0026489317955769,0.3603397142086815,0.0167364323138459,0.0048811534417467,0.01840749752008,-0.0085880546285872,0.0022005846352484,-0.0027032837646054,-0.4872658804875631,2
2020-01-10,Stocks That Hit 52-Week Highs On Friday,CI,-0.0027032837646054,-0.4872658804875631,-0.0026489317955769,0.0167364323138459,0.0048811534417467,0.01840749752008,-0.0085880546285872,-0.0321952225475552,1.2966756861229225,1
2020-01-21,Stocks That Hit 52-Week Highs On Tuesday,CI,0.0022586431930375,0.3048809523809523,0.0074426873375066,0.0130624899929754,0.0148154664249136,0.0082551244098429,-0.0321952225475552,-0.0081691769649523,-0.3300337560441565,1
2020-02-06,Stocks That Hit 52-Week Highs On Thursday,CI,0.026055721382181,0.4162819184019599,0.0488672783499473,0.0265421041235096,-0.0031707519772472,-0.0234021464407554,-0.0274020029380852,-0.0138769237933362,-0.3191404430842924,1
2020-02-12,Stocks That Hit 52-Week Highs On Wednesday,CI,0.034296950404284,0.4989256790259491,0.0231075349883751,0.0067009910503383,-0.0138769237933362,0.026055721382181,0.0488672783499473,-0.0030103176070369,-0.2222957327158452,2
2020-03-04,38 Stocks Moving in Wednesday's Pre-Market Session,CI,0.107212683444902,0.7164705882352942,-0.0261911065740079,0.0623154286857754,0.0055517185401889,-0.0369999031134826,-0.0148101368953162,-0.0410900960966089,-0.4929827996997291,1
2020-03-04,60 Stocks Moving In Wednesday's Mid-Day Session,CI,0.107212683444902,0.7164705882352942,-0.0261911065740079,0.0623154286857754,0.0055517185401889,-0.0369999031134826,-0.0148101368953162,-0.0410900960966089,-0.4929827996997291,1
2020-03-05,92 Biggest Movers From Yesterday,CI,-0.0410900960966089,-0.4929827996997291,0.107212683444902,-0.0261911065740079,0.0623154286857754,0.0055517185401889,-0.0369999031134826,-0.0269246945619667,0.1097557050436126,1
2020-03-05,Tech Companies Could Be In Focus As Apple Pulls Out Of SXSW; Volatility Flares Up,CI,-0.0410900960966089,-0.4929827996997291,0.107212683444902,-0.0261911065740079,0.0623154286857754,0.0055517185401889,-0.0369999031134826,-0.0269246945619667,0.1097557050436126,1
2020-03-18,Stocks That Hit 52-Week Lows On Wednesday,CI,-0.0785350619424634,0.1153131141445795,0.029199055953597,-0.16222824651907,0.0949656390495781,-0.1226298746974918,-0.0532942720997767,0.0252605085302277,-0.0505286217735022,0
2020-04-15,Every Member Of Trump's 'Great American Economic Revival' Industry Groups,CI,-0.016269719901787,0.4436725393208469,0.0458643558468145,-0.0239234800281837,-0.0235743506119423,0.0510806745989442,0.0212117348162956,0.0698247637376092,0.0312596242685556,0
2020-04-21,"CocaCola, IBM Earnings Under Scrutiny As Both Multinationals Withdraw Guidance, Netflix Later",CI,-0.0571806741597583,0.3176470588235294,-0.0279710020265775,-0.0062451933044527,0.0698247637376092,-0.016269719901787,0.0458643558468145,0.0263054006024963,-0.2837573385518591,0
2020-04-30,"Earnings Scheduled For April 30, 2020",CI,-0.0004596995016089,0.4815397126592573,0.033124342145324,-0.0167004672090873,0.0244952003205964,0.0212719891372974,0.0092557748063701,-0.0443865879347982,-0.4093021553774655,1
2020-05-04,A Peek Into The Markets: US Stock Futures Down; Dow Futures Fall Over 300 Points,CI,-0.0132556041010086,-0.0548878701523974,-0.0443865879347982,-0.0004596995016089,0.033124342145324,-0.0167004672090873,0.0244952003205964,0.0313092224448932,-0.0559124278972207,0
2020-06-17,"The Daily Biotech Pulse: Patent Win For Amarin, FDA Nod For Novartis & Merck, Chembio's Coronavirus EUA Revoked",CI,-0.0063204988833226,-0.1326757638682884,0.0314754557917142,-0.0152088316408992,-0.0080393180127148,-0.0834450596918462,-0.0256409877283237,-0.0094892124708513,0.6085506626763575,1
2020-07-30,"Earnings Scheduled For July 30, 2020",CI,-0.0183168746923054,-0.1885376606322109,0.0344239472789271,0.0014244129966392,-0.0304938911649177,0.0106075177700157,0.012377848936681,-0.0323863710072823,0.417523985666397,1
2020-11-04,40 Stocks Moving In Wednesday's Mid-Day Session,CI,0.1454208316239713,2.15319263101413,0.0517044514051423,0.0471340658735326,0.0218482333689926,-0.0292875799291089,-0.0558639809067921,0.0168075901252837,-0.3701891715590345,0
2020-11-05,"Investors Cheer Gridlock Potential That Could Prevent Tax, Tech, Health Care Overhauls",CI,0.0168075901252837,-0.3701891715590345,0.1454208316239713,0.0517044514051423,0.0471340658735326,0.0218482333689926,-0.0292875799291089,-0.0592548888326623,-0.1785288091324611,1
2020-11-05,51 Biggest Movers From Yesterday,CI,0.0168075901252837,-0.3701891715590345,0.1454208316239713,0.0517044514051423,0.0471340658735326,0.0218482333689926,-0.0292875799291089,-0.0592548888326623,-0.1785288091324611,1
2020-11-17,"Q3 13F Roundup: How Buffett, Einhorn, Ackman And Others Adjusted Their Portfolios",CI,-0.0159870951413695,0.5868765800965294,-0.006327077717026,-0.0020895881474993,-0.0043416934318484,0.0041326414798665,0.0426137786410543,-0.0180625133804324,-0.3968788471286841,1
2021-01-21,Stocks That Hit 52-Week Highs On Thursday,CI,-0.0097626766297254,0.0361541124684703,0.0345106843545828,0.0086799199119895,-0.0085154329697768,-0.0135381603307316,-0.0062605818725544,-0.0122462749555316,-0.3208114558472553,1
2021-02-04,"Earnings Scheduled For February 4, 2021",CI,-0.0640294105000023,1.4781700711348953,0.0074375982839267,0.0046585606876843,-0.0011518098538374,-0.0079526692888542,0.0293092778544339,-0.0094946084333976,-0.2567613830879836,1
2021-03-08,52 Weeks High Article 0.27862264452415353,CI,0.0227214357546221,-0.0163057324840764,0.0268945884315443,0.0179031574202059,0.005102410874509,0.0212142229054115,0.0240590347359812,0.0074513339666826,0.0039713373046705,0
2021-03-15,Stocks That Hit 52-Week Highs On Monday,CI,0.0083380161910129,0.5522388059701493,0.0181924901619334,0.0037360231391887,0.006804463066806,0.0074513339666826,0.0227214357546221,-0.0154793129845185,-0.2073956628477905,1
2021-04-14,Stocks That Hit 52-Week Highs On Wednesday,CI,0.0170431535664026,-0.1787144362486827,-0.0022781595194724,-0.001137687597184,0.0329485130396716,-0.0082008173143163,0.0045581255602566,0.0197241957608831,0.4284492344538533,0
2021-04-15,Stocks That Hit 52-Week Highs On Thursday,CI,0.0197241957608831,0.4284492344538533,0.0170431535664026,-0.0022781595194724,-0.001137687597184,0.0329485130396716,-0.0082008173143163,-0.0070372788046347,-0.0761077844311377,1
2021-04-21,Stocks That Hit 52-Week Highs On Wednesday,CI,-0.0014603454085841,0.3798856053384176,0.0034852237906048,-0.0003167268078733,-0.0070372788046347,0.0197241957608831,0.0170431535664026,-0.0018181152055908,-0.1318825561312607,2
2021-05-05,Stocks That Hit 52-Week Highs On Wednesday,CI,-0.0041618080090555,-0.1743447392302354,0.0295576486195963,0.0122083213269641,-0.0049154102174098,0.0125436202605535,-0.0131768235597953,-0.0057658480315305,0.1049977371177346,1
2021-05-07,Stocks That Hit 52-Week Highs On Friday,CI,0.0165414856361658,0.030366859750746,-0.0057658480315305,-0.0041618080090555,0.0295576486195963,0.0122083213269641,-0.0049154102174098,0.0219387229169809,0.4294718909710391,0
2021-05-10,Stocks That Hit 52-Week Highs On Monday,CI,0.0219387229169809,0.4294718909710391,0.0165414856361658,-0.0057658480315305,-0.0041618080090555,0.0295576486195963,0.0122083213269641,-0.0226667078428282,-0.4512374369364,1
2021-06-28,Biogen's Costly Alzheimer's Treatment May Face Restricted Medicare Access: WSJ,CI,0.0123998624456078,-0.4534900765149072,0.0099245482434608,0.0078994514112298,-0.0130503146121059,-0.001987583125789,0.0194422521459662,-0.0139560568951444,-0.072256195687158,1
2021-08-03,Another Big Earnings Week Ahead,CI,0.0201003688034737,0.041969620617666,-0.0006100368434565,0.0023586571248701,0.0074807057866133,-0.0071216339482211,0.001926100664114,-0.0106001798304216,0.2123117313804061,1
2021-08-05,"Delta, Lambda COVID Variants Still Weighing On Market Despite Positive Earnings Reports",CI,-0.1091670389006354,3.53735681313045,-0.0106001798304216,0.0201003688034737,-0.0006100368434565,0.0023586571248701,0.0074807057866133,0.0149846851287176,-0.5093886983935592,0
2021-12-03,"Biden's New COVID-19 Plan Includes Reimbursement For Over The Counter, At-Home COVID Tests",CI,0.0104655925804704,0.0616635228599657,0.015766236403818,0.0146950426217749,-0.0386252888935843,-0.0119782919321778,-0.0406022406225072,0.038871591075728,-0.2196793434578451,0
2021-12-21,A Peek Into The Markets: US Stock Futures Gain Following Monday's Sell-Off,CI,0.0149308588239069,-0.1481260508759559,-0.0119296225256944,0.0043443983405444,0.0055642789295655,0.0038777461495802,0.0068324938486703,0.0094896142450024,-0.0196103399974532,0
2022-02-03,"Earnings Scheduled For February 3, 2022",CI,-0.0541691907246498,0.4819489286762548,0.0181930677366879,-0.0197431055540238,-0.0128077919055272,0.0264696470567606,-0.028160055999404,0.0175123654266393,-0.327688651218063,0
2022-04-01,House Passes Bill To Cap Out-of-Pocket Insulin Costs To No More Than $35/Month,CI,0.0277116739423664,-0.1118148189664836,-0.0253020545695913,0.0102326676084818,-0.0013133862700771,0.0003284384964543,0.0061131925883968,-0.0162030700156067,-0.1133337540228434,1
2022-04-05,Biden To Propose Change To Obamacare To Extend Subsidies For Families: WSJ,CI,0.0116817543353955,0.0199274073019712,-0.0162030700156067,0.0277116739423664,-0.0253020545695913,0.0102326676084818,-0.0013133862700771,0.0184421301031914,-0.0420068383225176,0
2022-04-29,From Big Tech To Big Energy: A Wild Week Of Earnings Ends With Mixed Results,CI,-0.0293423133082867,0.5516564952048824,0.0138373149311448,-0.007244627983722,-0.0069192961308555,-0.0027444883197859,-0.0360907991506476,-0.0027150044471038,0.0517628880460738,2
2022-05-02,April's Sell-Off Continues Into May As Futures Point To A Lower Open,CI,-0.0027150044471038,0.0517628880460738,-0.0293423133082867,0.0138373149311448,-0.007244627983722,-0.0069192961308555,-0.0027444883197859,0.0047946041693887,-0.2548247078464106,2
2022-05-02,Disappointing Earnings And A Spike In Inflation Send Stocks Plunging,CI,-0.0027150044471038,0.0517628880460738,-0.0293423133082867,0.0138373149311448,-0.007244627983722,-0.0069192961308555,-0.0027444883197859,0.0047946041693887,-0.2548247078464106,2
2022-05-04,Lyft And Uber Battle Over Earnings Ahead Of The Fed Announcement,CI,0.0338873460461899,0.0132628371717895,0.0047946041693887,-0.0027150044471038,-0.0293423133082867,0.0138373149311448,-0.007244627983722,-0.0140414801299512,0.4402582471035641,1
2022-05-05,Textbook Company's Results Show Students Are Hitting The Job Market Instead Of The Books,CI,-0.0140414801299512,0.4402582471035641,0.0338873460461899,0.0047946041693887,-0.0027150044471038,-0.0293423133082867,0.0138373149311448,0.0587908306731057,0.3559103469450415,0
2022-05-06,Bulls Look To Bounce Back After Bear Barrage,CI,0.0587908306731057,0.3559103469450415,-0.0140414801299512,0.0338873460461899,0.0047946041693887,-0.0027150044471038,-0.0293423133082867,-0.0205694812796227,0.00919342421086,1
2022-05-06,S&P 500 and Dow Lose 3% While Nasdaq Composite Slides 5%,CI,0.0587908306731057,0.3559103469450415,-0.0140414801299512,0.0338873460461899,0.0047946041693887,-0.0027150044471038,-0.0293423133082867,-0.0205694812796227,0.00919342421086,1
2022-05-13,"Eli Lilly, Novo Nordisk, Sanofi Accused Of Artificially Raising Insulin Prices",CI,-0.0032303200036871,-0.0926942819625163,-0.0006535904094471,-0.0017262973461821,-0.0029073484626164,-0.0205694812796227,0.0587908306731057,0.0281647384019234,0.0148674429313861,0
2022-07-28,Meta and Qualcomm Miss— Will Tech Investors Shrug Off These Reports Too?,CI,-0.005496202902352,0.4737077046692259,-0.0003638612020607,0.0080694285446705,0.012741486188657,0.0107002613514957,-0.0013871874762344,0.007832445289329,0.1128006300357424,0
2022-07-29,Big Tech Continues To Rally Despite Earnings Misses,CI,0.007832445289329,0.1128006300357424,-0.005496202902352,-0.0003638612020607,0.0080694285446705,0.012741486188657,0.0107002613514957,-0.0070815804571701,-0.2190102890739833,1
2022-08-01,Is The Energy Ready To Rebound?,CI,-0.0070815804571701,-0.2190102890739833,0.007832445289329,-0.005496202902352,-0.0003638612020607,0.0080694285446705,0.012741486188657,-0.007205259676958,-0.0133835215391049,1
2022-08-02,U.S. Manufacturing Picture Is Looking Brighter Than Europe's Right Now,CI,-0.007205259676958,-0.0133835215391049,-0.0070815804571701,0.007832445289329,-0.005496202902352,-0.0003638612020607,0.0080694285446705,0.0011051024545762,1.507277094814187,2
2022-08-04,A Flurry Of Employment News Drops Ahead Of Friday's Jobs Report,CI,0.0307647613331165,0.0298410730387737,0.0011051024545762,-0.007205259676958,-0.0070815804571701,0.007832445289329,-0.005496202902352,0.0059621213340355,-0.4418693736832024,0
2022-08-17,Michael Burry Puts His Money Where His Mouth Is For Market Crash Prediction: But Did He Sell Too Soon?,CI,0.0034067222926932,-0.2574244150968693,-0.0008939335432268,-0.0001719215587724,0.0172028132216799,-0.0037272805489234,0.0071218381083759,-0.0024347461870272,0.665613433240047,2
2022-09-14,These 5 Experts See A Market Crash Ahead: What Do BZ Readers Think?,CI,-0.0095530863429765,0.0782444424918724,-0.0249191929203421,0.0044733547850488,0.0073269586398838,0.0024482990753156,0.016651970020783,0.0206984411269337,-0.0345923481237012,0
2022-10-19,JPMorgan And 2 Other Stocks Insiders Are Selling,CI,-0.0022468900972253,-0.3031776037447115,0.0131760071987356,-0.0182187322630869,-0.0078618641263147,0.0321819957052136,-0.0089019802331834,0.0041968683404123,-0.0249967704430952,2
2022-11-07,"Meta Goes Twitter Way With Layoffs, Twitter Might Want Some People Back After Firing Them, Coal Miners Terminate $6B Combination Discussions: Top Stories Monday, Nov. 07",CI,0.00695369767411,-0.2976147776183644,-0.0065075236781005,0.0105342771597869,-0.0131028836635594,0.0063765069166878,-0.0052347091738801,0.0103892823715552,-0.1387080301289416,0
2022-11-07,Walgreens Boots Alliance's Unit Close To Merging with Summit Health In $9B Deal,CI,0.00695369767411,-0.2976147776183644,-0.0065075236781005,0.0105342771597869,-0.0131028836635594,0.0063765069166878,-0.0052347091738801,0.0103892823715552,-0.1387080301289416,0
2023-02-02,How Medicare Advantage Insurers Will Be Affected By Proposed 2024 Payment Cut,CI,-0.0375063540742578,0.7117332695222143,-0.0107051625382607,0.0203312828413886,0.0066817777262611,-0.0156449961043833,-0.0012436591707329,-0.0296488069307162,0.3243243243243243,1
2023-02-03,"Alphabet, Apple And 3 Stocks To Watch Heading Into Friday",CI,-0.0296488069307162,0.3243243243243243,-0.0375063540742578,-0.0107051625382607,0.0203312828413886,0.0066817777262611,-0.0156449961043833,,,2
2023-02-03,Nasdaq Futures Deflate As Apple Leads Tech Disappointments: Traders Look To Jobs Data For Mitigating Impact,CI,-0.0296488069307162,0.3243243243243243,-0.0375063540742578,-0.0107051625382607,0.0203312828413886,0.0066817777262611,-0.0156449961043833,,,2
