date,title,stock,close,volume,1_past_close,2_past_close,3_past_close,4_past_close,5_past_close,next_close,next_volume,label
2013-10-24,"Market Primer: Thursday, October 24: Investors Switch Focus To Earnings",F,0.0136985285992483,0.5694167864568909,-0.0045455335739422,0.0057146429815222,-0.0017114247800752,0.004009106172365,0.0098323170797509,-0.0090088310716422,-0.3345373061167326,1
2013-10-25,"#PreMarket Primer: Friday, October 25: Microsoft Earnings Surpass Expectations",F,-0.0090088310716422,-0.3345373061167326,0.0136985285992483,-0.0045455335739422,0.0057146429815222,-0.0017114247800752,0.004009106172365,-0.0017046174957583,-0.2145122559490863,2
2013-11-01,"This Week's Top News Items: New Apple iPads, Auto Sales, Chinese Media and Major Earnings",F,-0.0128582233217954,0.3549133127014896,-0.013263891551811,-0.009708828387573,0.0022765626444249,-0.0017046174957583,-0.0090088310716422,0.0065130750962356,-0.3527765606842817,0
2013-11-01,This Week's Top 5 News Items,F,-0.0128582233217954,0.3549133127014896,-0.013263891551811,-0.009708828387573,0.0022765626444249,-0.0017046174957583,-0.0090088310716422,0.0065130750962356,-0.3527765606842817,0
2013-11-04,"Microsoft Advised to Spin Off Xbox by Co-founder, Paul Allen",F,0.0065130750962356,-0.3527765606842817,-0.0128582233217954,-0.013263891551811,-0.009708828387573,0.0022765626444249,-0.0017046174957583,0.0052938729854628,0.2808795956991525,0
2013-11-06,"Elop, Mulally Remain At the Top  of Microsoft's CEO Candidates",F,-0.010532425178677,-0.1485632216924226,0.0052938729854628,0.0065130750962356,-0.0128582233217954,-0.013263891551811,-0.009708828387573,-0.0212893392683717,0.2826942384298994,1
2013-11-07,Microsoft COO Another Internal Candidate for the Company's CEO,F,-0.0212893392683717,0.2826942384298994,-0.010532425178677,0.0052938729854628,0.0065130750962356,-0.0128582233217954,-0.013263891551811,0.0181269537839354,-0.179679297408415,0
2013-11-07,"Microsoft COO Turner on internal list for CEO role, Bloomberg says ",F,-0.0212893392683717,0.2826942384298994,-0.010532425178677,0.0052938729854628,0.0065130750962356,-0.0128582233217954,-0.013263891551811,0.0181269537839354,-0.179679297408415,0
2013-11-13,U.S. markets were mostly lower during Wednesday's trading session as details coming out of China's recent four-day meeting were iffy at best.  The country's leaders recently convened to discuss its economic future.  Barclays economists were quoted as sayi,F,0.0227272364131463,0.2458521966257638,-0.0100651342659385,0.002373836952018,0.0181269537839354,-0.0212893392683717,-0.010532425178677,-0.0005846527947028,-0.0919330949948927,2
2013-11-13,Market Wrap For November 13: Markets Await Janet Yellen's Big Day Thursday,F,0.0227272364131463,0.2458521966257638,-0.0100651342659385,0.002373836952018,0.0181269537839354,-0.0212893392683717,-0.010532425178677,-0.0005846527947028,-0.0919330949948927,2
2013-11-18,Market Wrap For November 18: Markets Hit New Highs Before Carl Icahn Comments,F,-0.0052725134760366,-0.0564732965565578,-0.0011703370112045,-0.0005846527947028,0.0227272364131463,-0.0100651342659385,0.002373836952018,-0.0064780294874811,-0.1405481039854248,1
2013-11-18,Market Wrap For November 18: Markets Hit New Highs Before Carl Icahn Spoils The Party,F,-0.0052725134760366,-0.0564732965565578,-0.0011703370112045,-0.0005846527947028,0.0227272364131463,-0.0100651342659385,0.002373836952018,-0.0064780294874811,-0.1405481039854248,1
2013-11-19,A Small Cap That is Cashing In on ObamaCare,F,-0.0064780294874811,-0.1405481039854248,-0.0052725134760366,-0.0011703370112045,-0.0005846527947028,0.0227272364131463,-0.0100651342659385,0.0029637341766137,0.1578135594483232,2
2013-11-22,Twitter Launches TV Conversation Targeting to Snatch Up Even More Advertising Dollars,F,-0.0046812611987947,-0.0984586424068542,0.0100473759376131,0.0029637341766137,-0.0064780294874811,-0.0052725134760366,-0.0011703370112045,-0.0041150087398453,-0.1565577897881768,2
2013-11-26,Warren Buffett: U.S. Is Better With Detroit Than Without,F,-0.0041322748504236,0.0523496236860854,-0.0041150087398453,-0.0046812611987947,0.0100473759376131,0.0029637341766137,-0.0064780294874811,0.0094842660880256,0.1936075580735687,0
2013-11-27,#PreMarket Primer for November 27: Some US Retailers Fight To Preserve Thanksgiving,F,0.0094842660880256,0.1936075580735687,-0.0041322748504236,-0.0041150087398453,-0.0046812611987947,0.0100473759376131,0.0029637341766137,0.0029359765721479,-0.5272832124513225,2
2013-11-27,"#PreMarket Primer: Wednesday, November 27: Some US Retailers Fight To Preserve Thanksgiving",F,0.0094842660880256,0.1936075580735687,-0.0041322748504236,-0.0041150087398453,-0.0046812611987947,0.0100473759376131,0.0029637341766137,0.0029359765721479,-0.5272832124513225,2
2013-11-29,"Startups, Small Enterprises Rush To Sign Up For Goldman Sachs' 10,000 Small Businesses Initiative In Detroit",F,0.0029359765721479,-0.5272832124513225,0.0094842660880256,-0.0041322748504236,-0.0041150087398453,-0.0046812611987947,0.0100473759376131,-0.0011710222565484,0.8600423626565139,2
2013-12-03,The Ford Mustang at 50: Does the Iconic Car Still Have a Market?,F,-0.029308312956776,1.6979487992619715,-0.0011710222565484,0.0029359765721479,0.0094842660880256,-0.0041322748504236,-0.0041150087398453,0.0036233806460495,-0.4643300786728465,2
2013-12-05,Market Wrap For December 5: Market Participants Anxiously Await Tomorrow's Employment Report,F,0.0072200625042195,0.1169409535208458,0.0036233806460495,-0.029308312956776,-0.0011710222565484,0.0029359765721479,0.0094842660880256,-0.002389435626831,-0.2576093120030004,2
2013-12-05,Alan Mulally Says He's Committed To Ford ,F,0.0072200625042195,0.1169409535208458,0.0036233806460495,-0.029308312956776,-0.0011710222565484,0.0029359765721479,0.0094842660880256,-0.002389435626831,-0.2576093120030004,2
2013-12-05,Nomura Pounds The Table On Mulally: Insists He Should Still Be Viewed As Top Candidate To Head Microsoft,F,0.0072200625042195,0.1169409535208458,0.0036233806460495,-0.029308312956776,-0.0011710222565484,0.0029359765721479,0.0094842660880256,-0.002389435626831,-0.2576093120030004,2
2013-12-09,Benzinga's Top #PreMarket Losers,F,-0.0083833220877891,0.0335353110105398,-0.002389435626831,0.0072200625042195,0.0036233806460495,-0.029308312956776,-0.0011710222565484,-0.0018115110719786,-0.1119037989857345,2
2013-12-12,Market Wrap For December 12: Dow Suffers Second Consecutive Day of Triple Point Loss,F,-0.0012187431940314,-0.1823941578068525,-0.007259553551643,-0.0018115110719786,-0.0083833220877891,-0.002389435626831,0.0072200625042195,0.0122024845248078,0.5684237398773324,0
2013-12-12,"Ford's board wants to know CEO Mulally's future plans, Reuters reports ",F,-0.0012187431940314,-0.1823941578068525,-0.007259553551643,-0.0018115110719786,-0.0083833220877891,-0.002389435626831,0.0072200625042195,0.0122024845248078,0.5684237398773324,0
2013-12-12,Ford's Board Waiting to Hear About Mulally's Future Plans,F,-0.0012187431940314,-0.1823941578068525,-0.007259553551643,-0.0018115110719786,-0.0083833220877891,-0.002389435626831,0.0072200625042195,0.0122024845248078,0.5684237398773324,0
2013-12-18,Market Wrap For December 18: Markets Surge Following the Fed's Taper Announcement,F,-0.0628744712876018,4.433575468860187,-0.0094898916922381,0.0162749226163514,0.0122024845248078,-0.0012187431940314,-0.007259553551643,-0.0223641742273085,-0.6159246334457236,1
2013-12-18,"Ford prepares for life after Mulally, Reuters reports ",F,-0.0628744712876018,4.433575468860187,-0.0094898916922381,0.0162749226163514,0.0122024845248078,-0.0012187431940314,-0.007259553551643,-0.0223641742273085,-0.6159246334457236,1
2013-12-18,Mulally's Absence Strengthens Speculation CEO Will Be Leaving Ford,F,-0.0628744712876018,4.433575468860187,-0.0094898916922381,0.0162749226163514,0.0122024845248078,-0.0012187431940314,-0.007259553551643,-0.0223641742273085,-0.6159246334457236,1
2013-12-18,2013 is the year of the big cash buildup ,F,-0.0628744712876018,4.433575468860187,-0.0094898916922381,0.0162749226163514,0.0122024845248078,-0.0012187431940314,-0.007259553551643,-0.0223641742273085,-0.6159246334457236,1
2013-12-19,Market Wrap For December 18: Markets Flat During Day One of Post Fed Taper,F,-0.0223641742273085,-0.6159246334457236,-0.0628744712876018,-0.0094898916922381,0.0162749226163514,0.0122024845248078,-0.0012187431940314,0.0078434571860055,-0.2732643319627581,0
2013-12-20,"Ford Tumbles Amid Weaker 2014 Guidance, Mulally ",F,0.0078434571860055,-0.2732643319627581,-0.0223641742273085,-0.0628744712876018,-0.0094898916922381,0.0162749226163514,0.0122024845248078,-0.0175097866132817,-0.0371658971190739,1
2013-12-24,Market Wrap For December 24: Markets Higher on Strong Durable Goods Data,F,0.0026401098012938,-0.6176724865759347,-0.0175097866132817,0.0078434571860055,-0.0223641742273085,-0.0628744712876018,-0.0094898916922381,0.0092166880209534,0.1026313697432228,0
2013-12-30,Market Wrap For December 30: Markets Quiet Ahead of New Year,F,-0.0013070650191606,0.5031956780514606,-0.0019571476163704,0.0092166880209534,0.0026401098012938,-0.0175097866132817,0.0078434571860055,0.0098166917562285,-0.1524024755732073,0
2013-12-30,Market Wrap For December 30: Markets Quiet Ahead of New Year's Eve,F,-0.0013070650191606,0.5031956780514606,-0.0019571476163704,0.0092166880209534,0.0026401098012938,-0.0175097866132817,0.0078434571860055,0.0098166917562285,-0.1524024755732073,0
2013-12-31,Market Wrap For December 31: Markets End The Year On A Positive Note,F,0.0098166917562285,-0.1524024755732073,-0.0013070650191606,-0.0019571476163704,0.0092166880209534,0.0026401098012938,-0.0175097866132817,0.0006479301728268,0.1329368644220059,2
2013-12-31,Market Wrap For December 31: Markets End The Year on a Positive Note,F,0.0098166917562285,-0.1524024755732073,-0.0013070650191606,-0.0019571476163704,0.0092166880209534,0.0026401098012938,-0.0175097866132817,0.0006479301728268,0.1329368644220059,2
2014-01-02,Market Wrap For January 2: Markets Begin 2014 on Negative Note,F,0.0006479301728268,0.1329368644220059,0.0098166917562285,-0.0013070650191606,-0.0019571476163704,0.0092166880209534,0.0026401098012938,0.0045339201943146,0.4628764451210809,2
2014-01-06,USA TD Ameritrade's Investor Movement Index for Dec 5.62 vs 5.42 Prior,F,0.0045132651565289,-0.0751198444136567,0.0045339201943146,0.0006479301728268,0.0098166917562285,-0.0013070650191606,-0.0019571476163704,-0.0128369835598816,0.2770596564269907,1
2014-01-08,Market Wrap For January 8: Fed Minutes Released,F,0.0104031895793434,-0.1106536236858964,-0.0128369835598816,0.0045132651565289,0.0045339201943146,0.0006479301728268,0.0098166917562285,0.0193047036483584,0.4001832881649099,0
2014-01-08,"#PreMarket Primer: Wednesday, January 8: FOMC Minutes Released Today",F,0.0104031895793434,-0.1106536236858964,-0.0128369835598816,0.0045132651565289,0.0045339201943146,0.0006479301728268,0.0098166917562285,0.0193047036483584,0.4001832881649099,0
2014-01-08,Alan Mulally to Remain at Ford ,F,0.0104031895793434,-0.1106536236858964,-0.0128369835598816,0.0045132651565289,0.0045339201943146,0.0006479301728268,0.0098166917562285,0.0193047036483584,0.4001832881649099,0
2014-01-15,"Ford's Mulally Talks Aluminum, his Future and his Favorite Ride",F,0.0182924715764727,0.4559347127104942,0.0180012704589729,0.0024894270466448,0.0145203189078695,0.0193047036483584,0.0104031895793434,0.0017962357170331,-0.4009376432900486,2
2014-01-15,"Ford's Alan Mulally Talks Aluminum, His Future & His Favorite Ride",F,0.0182924715764727,0.4559347127104942,0.0180012704589729,0.0024894270466448,0.0145203189078695,0.0193047036483584,0.0104031895793434,0.0017962357170331,-0.4009376432900486,2
2014-01-24,Benzinga Weekly Preview:  Tech Sector To Steal The Spotlight,F,-0.0365190415025323,0.7438485187846005,-0.0072503331151725,0.0085312928029845,-0.0066586784686198,-0.0125520811385658,0.0017962357170331,-0.0075804774694775,-0.2242353101547176,1
2014-01-24,Benzinga Weekly Preview: Tech Sector To Steal The Spotlight,F,-0.0365190415025323,0.7438485187846005,-0.0072503331151725,0.0085312928029845,-0.0066586784686198,-0.0125520811385658,0.0017962357170331,-0.0075804774694775,-0.2242353101547176,1
2014-01-27,"Earnings Expectations For The Week Of January 27: Facebook, Google, Apple And More",F,-0.0075804774694775,-0.2242353101547176,-0.0365190415025323,-0.0072503331151725,0.0085312928029845,-0.0066586784686198,-0.0125520811385658,0.0006366655090357,0.1261023805758443,2
2014-01-28,"Market Wrap For January 28: Markets Snap Losing Streak, Apple Tumbles",F,0.0006366655090357,0.1261023805758443,-0.0075804774694775,-0.0365190415025323,-0.0072503331151725,0.0085312928029845,-0.0066586784686198,-0.0214813188784481,-0.0942481903688613,1
2014-01-28,"#PreMarket Primer: Tuesday, January 28: Apple's Earnings Take The Shine Off Share Prices",F,0.0006366655090357,0.1261023805758443,-0.0075804774694775,-0.0365190415025323,-0.0072503331151725,0.0085312928029845,-0.0066586784686198,-0.0214813188784481,-0.0942481903688613,1
2014-01-28,"Earnings Scheduled For January 28, 2014",F,0.0006366655090357,0.1261023805758443,-0.0075804774694775,-0.0365190415025323,-0.0072503331151725,0.0085312928029845,-0.0066586784686198,-0.0214813188784481,-0.0942481903688613,1
2014-01-28,"Stocks To Watch For January 28, 2014",F,0.0006366655090357,0.1261023805758443,-0.0075804774694775,-0.0365190415025323,-0.0072503331151725,0.0085312928029845,-0.0066586784686198,-0.0214813188784481,-0.0942481903688613,1
2014-01-28,Mid-Afternoon Market Update: Markets Green Despite Disappointing Apple Report,F,0.0006366655090357,0.1261023805758443,-0.0075804774694775,-0.0365190415025323,-0.0072503331151725,0.0085312928029845,-0.0066586784686198,-0.0214813188784481,-0.0942481903688613,1
2014-01-28,Top Trending Tickers On StockTwits For January 28,F,0.0006366655090357,0.1261023805758443,-0.0075804774694775,-0.0365190415025323,-0.0072503331151725,0.0085312928029845,-0.0066586784686198,-0.0214813188784481,-0.0942481903688613,1
2014-01-29,"#PreMarket Primer: Wednesday, January 29: Fed Seen Cutting Stimulus Further",F,-0.0214813188784481,-0.0942481903688613,0.0006366655090357,-0.0075804774694775,-0.0365190415025323,-0.0072503331151725,0.0085312928029845,-0.000655438499259,-0.3749394638362221,2
2014-01-30,"Microsoft's CEO Search Nearing Completion, Announcement Coming Soon",F,-0.000655438499259,-0.3749394638362221,-0.0214813188784481,0.0006366655090357,-0.0075804774694775,-0.0365190415025323,-0.0072503331151725,-0.019016224463205,0.9639983953010496,1
2014-01-30,The Saga of Microsoft's Next Top Boss is Nearing Its End,F,-0.000655438499259,-0.3749394638362221,-0.0214813188784481,0.0006366655090357,-0.0075804774694775,-0.0365190415025323,-0.0072503331151725,-0.019016224463205,0.9639983953010496,1
2014-02-03,Market Wrap For January 3: Bears In Complete and Absolute Control,F,-0.0274064607312477,0.4411890364650739,-0.019016224463205,-0.000655438499259,-0.0214813188784481,0.0006366655090357,-0.0075804774694775,0.0219929533416172,-0.4006363927501861,0
2014-02-03,Market Wrap For February 3: Bears In Complete and Absolute Control,F,-0.0274064607312477,0.4411890364650739,-0.019016224463205,-0.000655438499259,-0.0214813188784481,0.0006366655090357,-0.0075804774694775,0.0219929533416172,-0.4006363927501861,0
2014-02-11,"Goldman Sachs: Aerospace and Automotive demand ""Game Changer"" for the Steel Market",F,0.0080860760603909,0.2005759614773992,-0.0086840897290367,0.008080828912591,0.0081471645508328,-0.0094150236781647,0.0219929533416172,0.0026737386328461,-0.2981157763769458,2
2014-02-11,Goldman Sachs: Aerospace And Automotive Demand 'Game Changer' For The Steel Market,F,0.0080860760603909,0.2005759614773992,-0.0086840897290367,0.008080828912591,0.0081471645508328,-0.0094150236781647,0.0219929533416172,0.0026737386328461,-0.2981157763769458,2
2014-02-12,"Market Wrap For February 12: Markets Take a Breather, Senate Passes Debt Limit Bill",F,0.0026737386328461,-0.2981157763769458,0.0080860760603909,-0.0086840897290367,0.008080828912591,0.0081471645508328,-0.0094150236781647,0.0053332176356624,-0.1150284736921433,0
2014-02-13,Market Wrap For February 13: Markets Close Higher; Nasdaq on a Six Day Winning Streak,F,0.0053332176356624,-0.1150284736921433,0.0026737386328461,0.0080860760603909,-0.0086840897290367,0.008080828912591,0.0081471645508328,0.010610045906956,0.2692974141761204,0
2014-02-14,Market Wrap For February 14: Markets End the Week Positive,F,0.010610045906956,0.2692974141761204,0.0053332176356624,0.0026737386328461,0.0080860760603909,-0.0086840897290367,0.008080828912591,0.0098428390056528,-0.0616734048573311,0
2014-02-14,Market Wrap For February 14: Markets End The Week Positive,F,0.010610045906956,0.2692974141761204,0.0053332176356624,0.0026737386328461,0.0080860760603909,-0.0086840897290367,0.008080828912591,0.0098428390056528,-0.0616734048573311,0
2014-02-24,Does BlackBerry's Deal with Ford Signal a Turnaround?,F,0.0013191355165533,0.0148593814653159,-0.007203560288825,0.0013114471094239,-0.0090970956092445,0.0098428390056528,0.010610045906956,-0.0019759995398516,-0.1319012655813816,2
2014-02-24,"BlackBerry Partners With Ford, Could Signal A Turnaround",F,0.0013191355165533,0.0148593814653159,-0.007203560288825,0.0013114471094239,-0.0090970956092445,0.0098428390056528,0.010610045906956,-0.0019759995398516,-0.1319012655813816,2
2014-02-25,Ford More Likely To Pick Google Over BlackBerry,F,-0.0019759995398516,-0.1319012655813816,0.0013191355165533,-0.007203560288825,0.0013114471094239,-0.0090970956092445,0.0098428390056528,0.0072606162470756,0.3136500337103336,0
2014-02-28,Companies That Blame The Weather For Earnings Misses,F,0.0,0.3871391535193584,0.0085191566929312,0.0072606162470756,-0.0019759995398516,0.0013191355165533,-0.007203560288825,-0.0123458396473059,0.1999585293614922,1
2014-03-03,Market Wrap For March 3: Markets Lower On Ukraine Tension,F,-0.0123458396473059,0.1999585293614922,0.0,0.0085191566929312,0.0072606162470756,-0.0019759995398516,0.0013191355165533,0.0111842100164831,-0.2277297776947505,0
2014-03-03,Market Wrap For March 3: Markets Lower on Ukraine Tension,F,-0.0123458396473059,0.1999585293614922,0.0,0.0085191566929312,0.0072606162470756,-0.0019759995398516,0.0013191355165533,0.0111842100164831,-0.2277297776947505,0
2014-03-04,Market Wrap For March 4: Bulls Take Over as Ukraine Fears Dissipate,F,0.0111842100164831,-0.2277297776947505,-0.0123458396473059,0.0,0.0085191566929312,0.0072606162470756,-0.0019759995398516,0.0169162780030811,-0.003501483141175,0
2014-03-04,Market Wrap For March 4: Bulls Take Over As Ukraine Fears Dissipate,F,0.0111842100164831,-0.2277297776947505,-0.0123458396473059,0.0,0.0085191566929312,0.0072606162470756,-0.0019759995398516,0.0169162780030811,-0.003501483141175,0
2014-03-20,5 Publicly-Traded Companies That Support Marriage Equality,F,0.0045221982350072,-0.1301042491476678,-0.0006457062294253,0.0137436875080521,0.0132627038422825,-0.0065875704274772,-0.014285788042148,-0.005144960025149,0.494050398290816,1
2014-03-28,Market Wrap For March 28: Markets Still Positive Despite Giving up Early Gains,F,0.013114953847354,0.2963483543873562,0.0,-0.0052187003798457,-0.0038987415936344,-0.0051711868231626,-0.005144960025149,0.0097088599970875,-0.2611108531725982,0
2014-03-28,Market Wrap For March 28: Markets Still Positive Despite Giving Up Early Gains,F,0.013114953847354,0.2963483543873562,0.0,-0.0052187003798457,-0.0038987415936344,-0.0051711868231626,-0.005144960025149,0.0097088599970875,-0.2611108531725982,0
2014-04-02,Market Wrap For April 2: Markets on Four-day Winning Streak,F,0.0085784260654668,-0.5299315154775963,0.0461535905899515,0.0097088599970875,0.013114953847354,0.0,-0.0052187003798457,-0.0042526865652549,-0.3461007686508662,2
2014-04-02,Market Wrap For April 2: Markets On Four-Day Winning Streak,F,0.0085784260654668,-0.5299315154775963,0.0461535905899515,0.0097088599970875,0.013114953847354,0.0,-0.0052187003798457,-0.0042526865652549,-0.3461007686508662,2
2014-04-08,Market Wrap For April: Dead Cat Bounce or The Start of a Recovery?,F,0.0100377013057131,-0.0454062014235457,-0.0117793573613041,-0.0158633464821933,-0.0042526865652549,0.0085784260654668,0.0461535905899515,-0.0161490841142828,0.374357216318135,1
2014-04-08,Market Wrap For April 8: Markets Bounce Higher As Earnings Season Begins,F,0.0100377013057131,-0.0454062014235457,-0.0117793573613041,-0.0158633464821933,-0.0042526865652549,0.0085784260654668,0.0461535905899515,-0.0161490841142828,0.374357216318135,1
2014-04-08,Market Wrap For April: Markets Bounce Higher As Earnings Season Begins,F,0.0100377013057131,-0.0454062014235457,-0.0117793573613041,-0.0158633464821933,-0.0042526865652549,0.0085784260654668,0.0461535905899515,-0.0161490841142828,0.374357216318135,1
2014-04-09,Market Wrap For April 9: Investors Breathe Sigh Of Relief Over Rate Worries,F,-0.0161490841142828,0.374357216318135,0.0100377013057131,-0.0117793573613041,-0.0158633464821933,-0.0042526865652549,0.0085784260654668,-0.0132573350973589,-0.1525887405511512,1
2014-04-09,Market Wrap For April 9: Investors Breathe a Sight of Relief Over Rate Worries,F,-0.0161490841142828,0.374357216318135,0.0100377013057131,-0.0117793573613041,-0.0158633464821933,-0.0042526865652549,0.0085784260654668,-0.0132573350973589,-0.1525887405511512,1
2014-04-11,Market Wrap For April 11: Markets Pick up Exactly Where They Left Off,F,0.0,0.2585930526093509,-0.0132573350973589,-0.0161490841142828,0.0100377013057131,-0.0117793573613041,-0.0158633464821933,0.0044784216662911,-0.4810332204630732,2
2014-04-11,Market Wrap For April 11: Markets Pick Up Exactly Where They Left Off,F,0.0,0.2585930526093509,-0.0132573350973589,-0.0161490841142828,0.0100377013057131,-0.0117793573613041,-0.0158633464821933,0.0044784216662911,-0.4810332204630732,2
2014-04-11,US Stock Futures Slip Ahead Of Consumer Sentiment Report,F,0.0,0.2585930526093509,-0.0132573350973589,-0.0161490841142828,0.0100377013057131,-0.0117793573613041,-0.0158633464821933,0.0044784216662911,-0.4810332204630732,2
2014-04-11,"#PreMarket Primer: Friday, April 11: Tension Between The West And Russia Escalates With Threats Of Energy Supply Interruptions",F,0.0,0.2585930526093509,-0.0132573350973589,-0.0161490841142828,0.0100377013057131,-0.0117793573613041,-0.0158633464821933,0.0044784216662911,-0.4810332204630732,2
2014-04-17,Market Wrap For April 17: Mixed Earnings Drag the Dow Lower While S&P 500 and Nasdaq Positive,F,-0.0043561686459575,-0.1919986455444819,0.0145203058309613,0.0089170972176673,0.0044784216662911,0.0,-0.0132573350973589,-0.0012497890331081,0.4108019639934532,2
2014-04-17,Market Wrap For April 17: Mixed Earnings Drag The Dow Lower While S&P 500 & Nasdaq End Positive,F,-0.0043561686459575,-0.1919986455444819,0.0145203058309613,0.0089170972176673,0.0044784216662911,0.0,-0.0132573350973589,-0.0012497890331081,0.4108019639934532,2
2014-04-21,"Market Wrap For April 21: S&P 500 Extends Winning Streak to Five Days, Dow and Nasdaq Also Positive",F,-0.0012497890331081,0.4108019639934532,-0.0043561686459575,0.0145203058309613,0.0089170972176673,0.0044784216662911,0.0,0.0075093155815235,-0.2406490097062436,0
2014-04-21,"Market Wrap For April 21: S&P 500 Extends Winning Streak To Five Days, Dow & Nasdaq Also Positive",F,-0.0012497890331081,0.4108019639934532,-0.0043561686459575,0.0145203058309613,0.0089170972176673,0.0044784216662911,0.0,0.0075093155815235,-0.2406490097062436,0
2014-04-25,Market Wrap For April 25: Markets Finish of The Week in Negative Territory,F,-0.0330882406011998,0.9624014686812464,0.0055453026047818,0.008074496330531,0.0075093155815235,-0.0012497890331081,-0.0043561686459575,0.0120405302905539,-0.386903192994049,0
2014-04-25,Mid-Morning Market Update: Markets Open Lower; Ford Profit Misses Street View,F,-0.0330882406011998,0.9624014686812464,0.0055453026047818,0.008074496330531,0.0075093155815235,-0.0012497890331081,-0.0043561686459575,0.0120405302905539,-0.386903192994049,0
2014-04-25,"#PreMarket Primer: Friday, April 25: More Sanctions On Russia Likely",F,-0.0330882406011998,0.9624014686812464,0.0055453026047818,0.008074496330531,0.0075093155815235,-0.0012497890331081,-0.0043561686459575,0.0120405302905539,-0.386903192994049,0
2014-04-25,"Stocks To Watch For April 25, 2014",F,-0.0330882406011998,0.9624014686812464,0.0055453026047818,0.008074496330531,0.0075093155815235,-0.0012497890331081,-0.0043561686459575,0.0120405302905539,-0.386903192994049,0
2014-04-25,US Stock Futures Decline Ahead Of Consumer Sentiment Report,F,-0.0330882406011998,0.9624014686812464,0.0055453026047818,0.008074496330531,0.0075093155815235,-0.0012497890331081,-0.0043561686459575,0.0120405302905539,-0.386903192994049,0
2014-04-25,Benzinga's Top #PreMarket Losers,F,-0.0330882406011998,0.9624014686812464,0.0055453026047818,0.008074496330531,0.0075093155815235,-0.0012497890331081,-0.0043561686459575,0.0120405302905539,-0.386903192994049,0
2014-04-25,Market Wrap For April 25: Markets Finish The Week In Negative Territory,F,-0.0330882406011998,0.9624014686812464,0.0055453026047818,0.008074496330531,0.0075093155815235,-0.0012497890331081,-0.0043561686459575,0.0120405302905539,-0.386903192994049,0
2014-04-25,Market Wrap For April 25: Markets Finish The Week in Negative Territory,F,-0.0330882406011998,0.9624014686812464,0.0055453026047818,0.008074496330531,0.0075093155815235,-0.0012497890331081,-0.0043561686459575,0.0120405302905539,-0.386903192994049,0
2014-04-30,Market Wrap For April 30: Markets Positive Despite Fed Tapering and GDP Rising Less Than Expected,F,0.0096899564674912,-0.0235129971248394,0.009393099556898,0.0120405302905539,-0.0330882406011998,0.0055453026047818,0.008074496330531,-0.0148604692123655,0.1582318567389256,1
2014-05-01,"Outgoing CEO Mulally, Praised As 'The Man Who Saved Ford,' To Be Succeeded By COO Fields",F,-0.0148604692123655,0.1582318567389256,0.0096899564674912,0.009393099556898,0.0120405302905539,-0.0330882406011998,0.0055453026047818,-0.0006288363332229,-0.2782719931254699,2
