date,title,stock,close,volume,1_past_close,2_past_close,3_past_close,4_past_close,5_past_close,next_close,next_volume,label
2017-07-10,TD Ameritrade's Investor Movement Index (IMX) For June 2017,F,0.0071049822979691,-0.0953679126860165,0.0071554853560804,-0.0106193590204618,-0.0224915812934218,0.0330655309892613,0.0017900793695795,0.0035271523376563,0.3724849454221901,2
2017-07-17,"The Most Popular Buys And Sells Of The First Half Of 2017, According To TD Ameritrade Clients",F,0.0051369329804198,-0.3869602585431315,0.0068964070698713,0.0113339782400301,0.0079087503762227,0.0035271523376563,0.0071049822979691,0.000851744350637,0.0094694640529306,2
2017-07-26,"A Peek Into The Markets: U.S. Stock Futures Up Ahead Of Earnings, Fed Decision",F,-0.0186336365965664,0.3673759750862275,-0.0017714101141803,-0.0208154162589234,-0.0145299276461694,0.0017124739943124,0.0068086896850736,0.0108499346887895,-0.464693649104698,0
2017-07-26,"Earnings Scheduled For July 26, 2017",F,-0.0186336365965664,0.3673759750862275,-0.0017714101141803,-0.0208154162589234,-0.0145299276461694,0.0017124739943124,0.0068086896850736,0.0108499346887895,-0.464693649104698,0
2017-07-26,"12 Stocks To Watch For July 26, 2017",F,-0.0186336365965664,0.3673759750862275,-0.0017714101141803,-0.0208154162589234,-0.0145299276461694,0.0017124739943124,0.0068086896850736,0.0108499346887895,-0.464693649104698,0
2017-08-09,The Market In 5 Minutes,F,0.0027546564849214,0.2216312528255724,-0.0027470891978479,-0.0027399016941953,0.0018298680414996,-0.0063636692134776,0.0045662012674858,-0.0137361263547636,-0.0078399298418019,1
2017-08-29,The Market In 5 Minutes,F,0.0046337966020584,0.3362068192617695,-0.0027727063974237,0.0102708944806211,0.0,0.0056338155901181,0.0075688830564282,0.0092251898321065,-0.2072646633542789,0
2017-09-22,"The 9 Hottest Toys For The 2017 Holidays, Courtesy Of Walmart",F,0.0102390380242527,-0.2510677242220867,0.0008537789818521,-0.0008530506651238,0.0077384647833893,0.0008603916049905,0.0051904298397014,0.0084459302231334,0.3500240094050635,0
2017-10-03,Benzinga's Option Alert Recap From October 3,F,0.0206782066685846,0.8223681288173237,0.0100252939224965,0.0008358288444503,0.0008371502819981,0.0016761728331504,-0.0008374364261304,-0.0032416655929684,-0.1939605464209488,2
2017-10-16,"The Market In 5 Minutes: Health Insurers, Tesla Firings And Big Analyst Rating Changes",F,0.0058092617504423,-0.2746264908413738,-0.0057757091442292,-0.0210013984995586,-0.0008071210543663,0.0040517558679114,0.0024369981116207,0.0123760087593964,0.7086155358473185,0
2017-10-23,Upcoming Earnings: General Motors And Ford To Report Quarterly Results This Week,F,-0.0049588227076842,-0.2366523851950717,0.001655508613535,0.0032815550904075,-0.0065199155840171,0.0123760087593964,0.0058092617504423,0.0124585331840176,0.6113239834827573,0
2017-10-23,The Week Ahead: Earnings Season Starts In Earnest,F,-0.0049588227076842,-0.2366523851950717,0.001655508613535,0.0032815550904075,-0.0065199155840171,0.0123760087593964,0.0058092617504423,0.0124585331840176,0.6113239834827573,0
2017-10-26,"Earnings Scheduled For October 26, 2017",F,0.0191030774431899,0.0278616795455879,-0.0123052280915026,0.0124585331840176,-0.0049588227076842,0.001655508613535,0.0032815550904075,-0.017114817913397,-0.3076886972456845,1
2017-10-26,"15 Stocks To Watch For October 26, 2017",F,0.0191030774431899,0.0278616795455879,-0.0123052280915026,0.0124585331840176,-0.0049588227076842,0.001655508613535,0.0032815550904075,-0.017114817913397,-0.3076886972456845,1
2017-10-27,"The Market In 5 Minutes: Big Tech Blows Out Earnings, Trump And The Opioid Epidemic",F,-0.017114817913397,-0.3076886972456845,0.0191030774431899,-0.0123052280915026,0.0124585331840176,-0.0049588227076842,0.001655508613535,0.0033167112390306,0.0746343447682267,2
2017-11-01,"The Market In 5 Minutes: Bitcoin, Gold, Steel, And More",F,0.0065199923405614,0.0353628404530328,0.0140495259612938,0.0033167112390306,-0.017114817913397,0.0191030774431899,-0.0123052280915026,0.0056680501147019,-0.0591413423824829,0
2017-12-08,Alibaba Ups The Ante In Connected Cars With Ford Partnership,F,0.0063847008476427,-0.1351531055863966,0.0121163753738884,-0.0040225782344285,-0.0158352286361779,0.0039744195897788,0.0047922765570282,-0.0023790367752645,1.0104995473548692,2
2017-12-08,"Tesla Developing Its Own AI Chip, Analyst Says Chipmakers Could Gain Manufacturing Contracts",F,0.0063847008476427,-0.1351531055863966,0.0121163753738884,-0.0040225782344285,-0.0158352286361779,0.0039744195897788,0.0047922765570282,-0.0023790367752645,1.0104995473548692,2
2017-12-11,AI In Focus: 3 Pure-Play Stocks That Hold Promise,F,-0.0023790367752645,1.0104995473548692,0.0063847008476427,0.0121163753738884,-0.0040225782344285,-0.0158352286361779,0.0039744195897788,0.0015898067255086,0.2302543749688876,2
2017-12-20,Rocket Mortgage Now Lets You Pay Your Bills With Alexa,F,0.0023641354607499,-0.1764113996244074,0.0023698346806031,0.0063590324540492,0.0096308052269202,-0.013459862027505,0.0023808278082084,-0.0070755823658326,0.106127629098339,1
2018-01-12,TD Ameritrade Index Indicates Retail Investors Are At Their Most Bullish Point Yet,F,0.0053191805749952,1.010394357550375,0.0099770496881292,-0.0038227726612564,-0.0053230400082294,-0.0037879279243885,0.0169492419790155,-0.0098262240277385,-0.0529631865663259,1
2018-01-16,"Upcoming Earnings: Bank Of America, Goldman Sachs And Morgan Stanley To Report This Week",F,-0.0098262240277385,-0.0529631865663259,0.0053191805749952,0.0099770496881292,-0.0038227726612564,-0.0053230400082294,-0.0037879279243885,-0.0702290414159395,1.453837372640443,1
2018-01-16,"BlackBerry Launches Jarvis Platform, An 'Ideal' Automotive Solution",F,-0.0098262240277385,-0.0529631865663259,0.0053191805749952,0.0099770496881292,-0.0038227726612564,-0.0053230400082294,-0.0037879279243885,-0.0702290414159395,1.453837372640443,1
2018-01-16,"The Market In 5 Minutes: Auto Show Highlights, Bitcoin Tumbles, Northrop Vs. Lockheed",F,-0.0098262240277385,-0.0529631865663259,0.0053191805749952,0.0099770496881292,-0.0038227726612564,-0.0053230400082294,-0.0037879279243885,-0.0702290414159395,1.453837372640443,1
2018-01-22,"The Week Ahead: IPOs, Earnings, And FDA Actions Provide Catalysts",F,0.0016667495641764,0.0301771607116057,-0.0057994370800799,-0.0090312961352945,-0.0702290414159395,-0.0098262240277385,0.0053191805749952,-0.0049915213837671,-0.0193162402865365,2
2018-01-22,Earnings Preview: Johnson & Johnson And Procter & Gamble Take The Stage Tomorrow Morning,F,0.0016667495641764,0.0301771607116057,-0.0057994370800799,-0.0090312961352945,-0.0702290414159395,-0.0098262240277385,0.0053191805749952,-0.0049915213837671,-0.0193162402865365,2
2018-01-22,Upcoming Earnings: Verizon To Report Q4 Results Tomorrow Morning,F,0.0016667495641764,0.0301771607116057,-0.0057994370800799,-0.0090312961352945,-0.0702290414159395,-0.0098262240277385,0.0053191805749952,-0.0049915213837671,-0.0193162402865365,2
2018-01-22,"Washington Shutdown Takes Center Stage, But Market Impact Only Slight So Far",F,0.0016667495641764,0.0301771607116057,-0.0057994370800799,-0.0090312961352945,-0.0702290414159395,-0.0098262240277385,0.0053191805749952,-0.0049915213837671,-0.0193162402865365,2
2018-01-23,"Ford Earnings Preview: After Last Week's Wall Street Presentation, Not Much New Expected",F,-0.0049915213837671,-0.0193162402865365,0.0016667495641764,-0.0057994370800799,-0.0090312961352945,-0.0702290414159395,-0.0098262240277385,0.007524995883873,0.2212864887808454,0
2018-01-24,Like Old Times: GE And Ford Step Onto Stage While Dollar Looks Back To 2014,F,0.007524995883873,0.2212864887808454,-0.0049915213837671,0.0016667495641764,-0.0057994370800799,-0.0090312961352945,-0.0702290414159395,-0.0398341729771054,0.8149430099288315,1
2018-01-25,"A Peek Into The Markets: U.S. Stock Futures Gain Ahead Of Earnings, Economic Data",F,-0.0398341729771054,0.8149430099288315,0.007524995883873,-0.0049915213837671,0.0016667495641764,-0.0057994370800799,-0.0090312961352945,0.0069143549399877,-0.5430632587903919,0
2018-01-25,"12 Stocks To Watch For January 25, 2018",F,-0.0398341729771054,0.8149430099288315,0.007524995883873,-0.0049915213837671,0.0016667495641764,-0.0057994370800799,-0.0090312961352945,0.0069143549399877,-0.5430632587903919,0
2018-03-06,An Eventful February Took Its Toll On TD Ameritrade's Investor Index,F,0.0047258750997931,-0.2962747579012886,0.0173077006952508,0.0106900085448609,-0.0301603257705351,0.0,-0.025711304248698,0.0,-0.0300946773449024,2
2018-03-06,Investor Movement Index February Summary,F,0.0047258750997931,-0.2962747579012886,0.0173077006952508,0.0106900085448609,-0.0301603257705351,0.0,-0.025711304248698,0.0,-0.0300946773449024,2
2018-03-14,"The Market In 5 Minutes: Ford Upgrade, Google To Ban Crypto Ads, Bezos And Amazon",F,0.0222635003454811,1.069094041856364,-0.0027750628836471,0.0074556746740903,0.0113098268373672,-0.0018813686670704,0.0,0.0045370750391655,-0.4820335423160005,2
2018-04-02,"The Week Ahead: Switch's Lockup Expires, Spotify Debuts, And More",F,-0.0198558424426092,0.0936709813365441,0.0202580837619763,0.0027700479908721,0.0,0.0255680813042151,-0.0176742695525423,0.0267035279244141,-0.0246386883832093,0
2018-04-04,13 Stocks And ETFs To Watch Amid China's 25% Tariff Threat,F,0.0161436144160405,0.0543388541502543,0.0267035279244141,-0.0198558424426092,0.0202580837619763,0.0027700479908721,0.0,0.0017651322637606,-0.358629272927605,2
2018-04-11,Volatility Up Again After U.S. Missile Threat Vs. Syria Spooks Market,F,-0.001746633112907,-0.2356116566962496,0.0177776910074156,0.0062614937300715,-0.0149781340571288,0.0017651322637606,0.0161436144160405,-0.0104987616724705,0.4292034324873404,1
2018-04-16,Upcoming Earnings: Johnson & Johnson And IBM Are Scheduled To Report This Week,F,0.0088654187819341,-0.0518948634056672,-0.0026526971039754,-0.0104987616724705,-0.001746633112907,0.0177776910074156,0.0062614937300715,0.0,-0.0578143052680675,2
2018-04-19,Upcoming Earnings: Industrial Conglomerate GE Reports Friday Morning,F,-0.0196779481733399,0.0633430031951647,-0.0043936520030833,0.0,0.0088654187819341,-0.0026526971039754,-0.0104987616724705,-0.0127736418286178,-0.0859377225140476,1
2018-04-23,Earnings Preview: Verizon And AT&T Report Q1 Results This Week,F,0.0203324469489301,-0.2891943022479413,-0.0127736418286178,-0.0196779481733399,-0.0043936520030833,0.0,0.0088654187819341,-0.0072461951260783,0.2407433500853255,1
2018-04-23,"Upcoming Earnings: CAT, LLY And BA Report This Week",F,0.0203324469489301,-0.2891943022479413,-0.0127736418286178,-0.0196779481733399,-0.0043936520030833,0.0,0.0088654187819341,-0.0072461951260783,0.2407433500853255,1
2018-04-23,Benchmark Nears Benchmark: 10-Year Close To 3% Ahead Of Earnings Deluge,F,0.0203324469489301,-0.2891943022479413,-0.0127736418286178,-0.0196779481733399,-0.0043936520030833,0.0,0.0088654187819341,-0.0072461951260783,0.2407433500853255,1
2018-04-23,"The Week Ahead: Sohn Conference, FANG Earnings, DocuSign IPO",F,0.0203324469489301,-0.2891943022479413,-0.0127736418286178,-0.0196779481733399,-0.0043936520030833,0.0,0.0088654187819341,-0.0072461951260783,0.2407433500853255,1
2018-04-24,Earnings Preview: Checking In On The Automakers With Reports From Ford And GM Coming Up,F,-0.0072461951260783,0.2407433500853255,0.0203324469489301,-0.0127736418286178,-0.0196779481733399,-0.0043936520030833,0.0,0.0136860678458061,0.0184504731861199,0
2018-04-25,9 Stocks Moving In Wednesday's After-Hours Session,F,0.0136860678458061,0.0184504731861199,-0.0072461951260783,0.0203324469489301,-0.0127736418286178,-0.0196779481733399,-0.0043936520030833,0.0288030028166248,0.9991228091911756,0
2018-04-25,"More Big Companies Beat Projections, But Wall Street Appears To Still Struggle",F,0.0136860678458061,0.0184504731861199,-0.0072461951260783,0.0203324469489301,-0.0127736418286178,-0.0196779481733399,-0.0043936520030833,0.0288030028166248,0.9991228091911756,0
2018-04-25,"15 Stocks To Watch For April 25, 2018",F,0.0136860678458061,0.0184504731861199,-0.0072461951260783,0.0203324469489301,-0.0127736418286178,-0.0196779481733399,-0.0043936520030833,0.0288030028166248,0.9991228091911756,0
2018-04-25,"Earnings Scheduled For April 25, 2018",F,0.0136860678458061,0.0184504731861199,-0.0072461951260783,0.0203324469489301,-0.0127736418286178,-0.0196779481733399,-0.0043936520030833,0.0288030028166248,0.9991228091911756,0
2018-04-30,"The Week Ahead: Tesla And Apple Earnings, Dropbox Quiet Period Expires, Fed Rate Decision And More",F,-0.0217579527831562,0.980198286787772,0.0052491336718987,0.0288030028166248,0.0136860678458061,-0.0072461951260783,0.0203324469489301,0.0017793931808161,-0.0705165158894794,2
2018-04-30,"McDonald's Strong Results Start Busy Earnings Week As Fed, Jobs Report Also Loom",F,-0.0217579527831562,0.980198286787772,0.0052491336718987,0.0288030028166248,0.0136860678458061,-0.0072461951260783,0.0203324469489301,0.0017793931808161,-0.0705165158894794,2
2018-05-02,Apple's Results Digested As Investors Await Latest Word From Fed,F,-0.0044404768044216,-0.317935419596812,0.0017793931808161,-0.0217579527831562,0.0052491336718987,0.0288030028166248,0.0136860678458061,-0.0008920775319398,-0.0714113533574386,2
2018-05-11,"The Market In 5 Minutes: AT&T And Cohen, The Yield Curve, Ford SUVs And More",F,-0.0017842601377939,-0.3805326038758673,0.0135625390252211,-0.0186335812696591,-0.0061729561989131,-0.0017603895958465,0.014285564046097,-0.0008936720754002,0.4065693099502463,2
2018-05-15,"Trade Concerns, Earnings Could Put 8-Day Dow Win Streak in Jeopardy",F,0.003577991114074,-0.0341539112141662,-0.0008936720754002,-0.0017842601377939,0.0135625390252211,-0.0186335812696591,-0.0061729561989131,0.0160426639791719,0.0751982367412364,0
2018-05-22,"China, U.S. Back Away From Trade War, Helping Market Sentiment",F,0.0008686213307322,-0.2789574324694713,0.0158873278443978,-0.0113438146721955,0.005263154631915,0.0160426639791719,0.003577991114074,-0.0069445758026726,0.055190086266653,1
2018-05-23,"Geopolitics Back In Town, And It Looks Like They Might Weigh On Market",F,-0.0069445758026726,0.055190086266653,0.0008686213307322,0.0158873278443978,-0.0113438146721955,0.005263154631915,0.0160426639791719,0.0157342565541385,0.478122483577029,0
2018-05-29,"The Week Ahead: Retail Earnings, CEO Conference Appearances In Focus",F,-0.0060819866786153,0.6198733031674208,-0.0094661107457412,0.0157342565541385,-0.0069445758026726,0.0008686213307322,0.0158873278443978,0.0096154648064967,-0.1841924639975992,0
2018-07-19,Delivering Alpha 2018: Everything You Need To Know,F,-0.0045995786509852,0.1067764964305326,0.0009209364506126,0.0009213507151297,-0.0118395055397849,-0.0063351736661779,-0.0018062937248956,-0.0103092671277085,0.0303258841741753,1
2018-07-19,"Upcoming Earnings: GE Reports Friday Morning, Turnaround And Restructuring Rolls On",F,-0.0045995786509852,0.1067764964305326,0.0009209364506126,0.0009213507151297,-0.0118395055397849,-0.0063351736661779,-0.0018062937248956,-0.0103092671277085,0.0303258841741753,1
2018-07-20,"Trade Tension Back In Town, Weighing On Sentiment Despite Strong Tech Results",F,-0.0103092671277085,0.0303258841741753,-0.0045995786509852,0.0009209364506126,0.0009213507151297,-0.0118395055397849,-0.0063351736661779,-0.0085228678915878,-0.1586566244173055,1
2018-07-23,"Big Week Ahead For Info Tech With Some Major Names On Tap, Along With GDP",F,-0.0085228678915878,-0.1586566244173055,-0.0103092671277085,-0.0045995786509852,0.0009209364506126,0.0009213507151297,-0.0118395055397849,0.0095509984554831,0.353757655543472,0
2018-07-23,Upcoming Earnings: Alphabet's $5 Billion Fine to Weigh on Results,F,-0.0085228678915878,-0.1586566244173055,-0.0103092671277085,-0.0045995786509852,0.0009209364506126,0.0009213507151297,-0.0118395055397849,0.0095509984554831,0.353757655543472,0
2018-07-23,"The Week Ahead: FANG Earnings Continue, Fox Vote On Disney Deal, More IPOs",F,-0.0085228678915878,-0.1586566244173055,-0.0103092671277085,-0.0045995786509852,0.0009209364506126,0.0009213507151297,-0.0118395055397849,0.0095509984554831,0.353757655543472,0
2018-07-24,Food And Beverage Earnings: Reports Coming Up From Coca-Cola And McDonald's,F,0.0095509984554831,0.353757655543472,-0.0085228678915878,-0.0103092671277085,-0.0045995786509852,0.0009209364506126,0.0009213507151297,-0.0047303748947929,0.9554298881677694,2
2018-07-24,"Earnings Preview: Boeing, GM And Ford To Report Q2 Earnings This Week",F,0.0095509984554831,0.353757655543472,-0.0085228678915878,-0.0103092671277085,-0.0045995786509852,0.0009209364506126,0.0009213507151297,-0.0047303748947929,0.9554298881677694,2
2018-07-25,"Concerns About Trade Picture Overshadowing Earnings As GM, Boeing Report",F,-0.0047303748947929,0.9554298881677694,0.0095509984554831,-0.0085228678915878,-0.0103092671277085,-0.0045995786509852,0.0009209364506126,-0.0598859406900863,0.1231954956717842,1
2018-07-25,"Earnings Scheduled For July 25, 2018",F,-0.0047303748947929,0.9554298881677694,0.0095509984554831,-0.0085228678915878,-0.0103092671277085,-0.0045995786509852,0.0009209364506126,-0.0598859406900863,0.1231954956717842,1
2018-07-25,A Peek Into The Markets: US Stock Futures Flat Ahead Of Earnings,F,-0.0047303748947929,0.9554298881677694,0.0095509984554831,-0.0085228678915878,-0.0103092671277085,-0.0045995786509852,0.0009209364506126,-0.0598859406900863,0.1231954956717842,1
2018-07-25,"14 Stocks To Watch For July 25, 2018",F,-0.0047303748947929,0.9554298881677694,0.0095509984554831,-0.0085228678915878,-0.0103092671277085,-0.0045995786509852,0.0009209364506126,-0.0598859406900863,0.1231954956717842,1
2018-07-26,"15 Stocks To Watch For July 26, 2018",F,-0.0598859406900863,0.1231954956717842,-0.0047303748947929,0.0095509984554831,-0.0085228678915878,-0.0103092671277085,-0.0045995786509852,0.0040446354496006,-0.5555898857478367,2
2018-07-27,"A Running List Of The Companies Blaming Trade Policy For Stifled Earnings, Guidance",F,0.0040446354496006,-0.5555898857478367,-0.0598859406900863,-0.0047303748947929,0.0095509984554831,-0.0085228678915878,-0.0103092671277085,0.0140986130889424,-0.222955485141138,0
2018-07-30,"The Week Ahead: Apple And Tesla Earnings, FOMC Meeting, Sonos IPO",F,0.0140986130889424,-0.222955485141138,0.0040446354496006,-0.0598859406900863,-0.0047303748947929,0.0095509984554831,-0.0085228678915878,-0.0029790803434679,0.0599241854112662,2
2018-08-07,The Highs And Lows Of Earnings Season Dominate July's IMX Results,F,0.0049850509848445,0.2568017655598955,-0.0009961096192605,0.0120968591794494,0.0020201574591773,-0.0139442620557319,-0.0029790803434679,-0.0029761249716671,-0.1917049339799436,2
2018-09-11,Investor Movement Index August Summary,F,-0.0074628302683643,-0.1072688245561556,0.011866412036309,-0.0169671216212521,-0.0063224885945698,0.0021118242039892,-0.0010545841327666,0.0032222704087105,-0.0629050312242253,2
2018-09-11,US-China Trade Tensions Appear To Weigh On Wall Street As Downbeat September Continues,F,-0.0074628302683643,-0.1072688245561556,0.011866412036309,-0.0169671216212521,-0.0063224885945698,0.0021118242039892,-0.0010545841327666,0.0032222704087105,-0.0629050312242253,2
2018-10-09,Investor Movement Index September Summary,F,-0.0334776426546468,0.3366920382887783,0.0153509827700966,-0.003278552838792,0.0021906596526712,-0.0076087805314707,-0.01287550251506,-0.0145251455376248,-0.0728757010739089,1
2018-10-15,Heavy Is The Crown: WWE's Saudi Arabia Problem,F,0.0196760997314051,-0.3224714838513872,-0.0192964214191035,-0.0011336302923187,-0.0145251455376248,-0.0334776426546468,0.0153509827700966,-0.0011349827906759,-0.0848911983117323,2
2018-10-15,"Saudi Arabia Mixes Oil, Politics After Journalist's Disappearance Strains US Ties",F,0.0196760997314051,-0.3224714838513872,-0.0192964214191035,-0.0011336302923187,-0.0145251455376248,-0.0334776426546468,0.0153509827700966,-0.0011349827906759,-0.0848911983117323,2
2018-10-19,A Peek Into The Markets: US Stock Futures Up Ahead Of Procter & Gamble Earnings,F,-0.0011750622285466,0.0027132926199782,-0.0285387813011741,-0.0045456177383367,-0.0011349827906759,0.0196760997314051,-0.0192964214191035,0.0071856865949608,-0.3347356140869881,0
2018-10-22,"Benzinga's Week Ahead: Can Tech Earnings Restore The Rally? Amazon, Google To Report",F,0.0071856865949608,-0.3347356140869881,-0.0011750622285466,-0.0285387813011741,-0.0045456177383367,-0.0011349827906759,0.0196760997314051,0.0214030591304807,0.3929252452673759,0
2018-10-22,Upcoming Earnings: Telecom Giants Verizon And AT&T Report This Week,F,0.0071856865949608,-0.3347356140869881,-0.0011750622285466,-0.0285387813011741,-0.0045456177383367,-0.0011349827906759,0.0196760997314051,0.0214030591304807,0.3929252452673759,0
2018-10-23,Will Tariffs Weigh On Boeing and Ford Earnings? Analysts Don't Seem Too Worried,F,0.0214030591304807,0.3929252452673759,0.0071856865949608,-0.0011750622285466,-0.0285387813011741,-0.0045456177383367,-0.0011349827906759,-0.0477299584067467,0.0622581989167312,1
2018-10-23,Wall Street Starts The Day In Risk-off Mood As Global Sentiment Weakens,F,0.0214030591304807,0.3929252452673759,0.0071856865949608,-0.0011750622285466,-0.0285387813011741,-0.0045456177383367,-0.0011349827906759,-0.0477299584067467,0.0622581989167312,1
2018-10-24,7 Stocks Moving In Wednesday's After-Hours Session,F,-0.0477299584067467,0.0622581989167312,0.0214030591304807,0.0071856865949608,-0.0011750622285466,-0.0285387813011741,-0.0045456177383367,0.0990219319034944,0.5349188642179061,0
2018-10-24,Struggling For Direction: Wall Street Seems Rudderless After Mixed Earnings Results,F,-0.0477299584067467,0.0622581989167312,0.0214030591304807,0.0071856865949608,-0.0011750622285466,-0.0285387813011741,-0.0045456177383367,0.0990219319034944,0.5349188642179061,0
2018-10-24,"Earnings Scheduled For October 24, 2018",F,-0.0477299584067467,0.0622581989167312,0.0214030591304807,0.0071856865949608,-0.0011750622285466,-0.0285387813011741,-0.0045456177383367,0.0990219319034944,0.5349188642179061,0
2018-10-24,"14 Stocks To Watch For October 24, 2018",F,-0.0477299584067467,0.0622581989167312,0.0214030591304807,0.0071856865949608,-0.0011750622285466,-0.0285387813011741,-0.0045456177383367,0.0990219319034944,0.5349188642179061,0
2018-10-25,31 Stocks Moving In Thursday's Pre-Market Session,F,0.0990219319034944,0.5349188642179061,-0.0477299584067467,0.0214030591304807,0.0071856865949608,-0.0011750622285466,-0.0285387813011741,-0.0011123666768756,0.1132819759466898,2
2018-10-25,58 Stocks Moving In Thursday's Mid-Day Session,F,0.0990219319034944,0.5349188642179061,-0.0477299584067467,0.0214030591304807,0.0071856865949608,-0.0011750622285466,-0.0285387813011741,-0.0011123666768756,0.1132819759466898,2
2018-10-25,"15 Stocks To Watch For October 25, 2018",F,0.0990219319034944,0.5349188642179061,-0.0477299584067467,0.0214030591304807,0.0071856865949608,-0.0011750622285466,-0.0285387813011741,-0.0011123666768756,0.1132819759466898,2
2018-10-26,66 Biggest Movers From Yesterday,F,-0.0011123666768756,0.1132819759466898,0.0990219319034944,-0.0477299584067467,0.0214030591304807,0.0071856865949608,-0.0011750622285466,0.0334076541693557,-0.0831152287663529,0
2018-10-29,A Peek Into The Markets: US Stock Futures Up; Dow Futures Rise Over 100 Points,F,0.0334076541693557,-0.0831152287663529,-0.0011123666768756,0.0990219319034944,-0.0477299584067467,0.0214030591304807,0.0071856865949608,0.0193965853786293,-0.3707728303735244,0
2018-11-02,"Tug-of-War: Solid Jobs Report, China Trade Talks Lift Market, But AAPL Disappoints",F,0.0096879451283178,-0.1889006328351818,-0.0272251311402761,0.0095137281102202,0.0193965853786293,0.0334076541693557,-0.0011123666768756,0.0159912029558826,-0.1489694675376088,0
2018-11-06,Investor Movement Index October Summary,F,0.0010494562703007,-0.0083756720283566,0.0159912029558826,0.0096879451283178,-0.0272251311402761,0.0095137281102202,0.0193965853786293,0.0062892991491512,-0.0874987172783823,0
2018-11-06,"IMX Dips In October, But Investors Remain Bullish",F,0.0010494562703007,-0.0083756720283566,0.0159912029558826,0.0096879451283178,-0.0272251311402761,0.0095137281102202,0.0193965853786293,0.0062892991491512,-0.0874987172783823,0
2018-12-03,Trade Truce: Market Appears To Get A Big Lift As Tariff Fears Retreat After G20,F,0.020191338957388,0.783002247067095,0.0042687744821443,-0.0042506295033872,0.0140085596080783,-0.012765819528833,0.0295727973781556,-0.0437498781689735,-0.104197400283909,1
2019-01-17,Industry Turns To Exoskeletons To Boost Worker Productivity,F,0.0084437118224354,-0.2321283770520875,-0.0622171250664752,-0.0166851193795115,0.0192743933586654,0.0173010141540412,-0.0057341105481241,0.0263159133917221,-0.0986326437786702,0
2019-01-18,Hope Takes Flight: China Optimism Has Markets Looking Strong Ahead of Weekend,F,0.0263159133917221,-0.0986326437786702,0.0084437118224354,-0.0622171250664752,-0.0166851193795115,0.0192743933586654,0.0173010141540412,-0.0093239735190933,-0.0771653050487112,1
2019-01-22,"Wakeup Call: World, China Growth Data Fail To Impress, Pushing Down Global Markets",F,-0.0093239735190933,-0.0771653050487112,0.0263159133917221,0.0084437118224354,-0.0622171250664752,-0.0166851193795115,0.0192743933586654,-0.0188235235683176,-0.0420854297982731,1
2019-01-23,"Geopolitics Aside, How About Those Earnings? Investors Appear To Switch Focus",F,-0.0188235235683176,-0.0420854297982731,-0.0093239735190933,0.0263159133917221,0.0084437118224354,-0.0622171250664752,-0.0166851193795115,0.0311750586396477,0.7593330516030967,0
2019-01-23,"12 Stocks To Watch For January 23, 2019",F,-0.0188235235683176,-0.0420854297982731,-0.0093239735190933,0.0263159133917221,0.0084437118224354,-0.0622171250664752,-0.0166851193795115,0.0311750586396477,0.7593330516030967,0
2019-01-23,"Earnings Scheduled For January 23, 2019",F,-0.0188235235683176,-0.0420854297982731,-0.0093239735190933,0.0263159133917221,0.0084437118224354,-0.0622171250664752,-0.0166851193795115,0.0311750586396477,0.7593330516030967,0
