date,title,stock,close,volume,1_past_close,2_past_close,3_past_close,4_past_close,5_past_close,next_close,next_volume,label
2021-08-05,"Delta, Lambda COVID Variants Still Weighing On Market Despite Positive Earnings Reports",F,0.0292793182395332,-0.257393926826964,-0.0499288881791381,0.0079081372359406,-0.0028673446938548,-0.0305768134191006,0.038239512059742,0.006564577618368,-0.2655755364778502,0
2021-08-06,"Payrolling In: Employment Report Shows Solid Gains, But Initial Market Reaction Muted",F,0.006564577618368,-0.2655755364778502,0.0292793182395332,-0.0499288881791381,0.0079081372359406,-0.0028673446938548,-0.0305768134191006,-0.0036232535969505,-0.1280117703698038,2
2021-08-06,"Cramer Says Forget AMC, Robinhood In This Frothy Market And Buy These Old-School Undervalued Stocks",F,0.006564577618368,-0.2655755364778502,0.0292793182395332,-0.0499288881791381,0.0079081372359406,-0.0028673446938548,-0.0305768134191006,-0.0036232535969505,-0.1280117703698038,2
2021-08-09,Tesla Mandates Masks At Giga Nevada Regardless Of Vaccination Status: WSJ,F,-0.0036232535969505,-0.1280117703698038,0.006564577618368,0.0292793182395332,-0.0499288881791381,0.0079081372359406,-0.0028673446938548,0.0050909551128544,-0.171298541810714,0
2021-08-10,The Dog Days Aren't Over: Wait And See Mode For Now As Key Inflation Data Ahead,F,0.0050909551128544,-0.171298541810714,-0.0036232535969505,0.006564577618368,0.0292793182395332,-0.0499288881791381,0.0079081372359406,0.0079594853509186,0.3323329431396478,0
2021-08-11,Inflation Slowing On The Consumer End As Market Awaits Tomorrow's Report On Producer Costs,F,0.0079594853509186,0.3323329431396478,0.0050909551128544,-0.0036232535969505,0.006564577618368,0.0292793182395332,-0.0499288881791381,-0.0021536338360241,-0.0992555309424333,2
2021-08-17,Hamburg's Data Watchdog Warns Government Against Zoom,F,-0.034918309534159,0.93008278955005,-0.0095658434049138,-0.0223021210263776,-0.0021536338360241,0.0079594853509186,0.0050909551128544,0.000769771999592,-0.31703189132908,2
2021-09-01,"Smartphone-Maker Xiaomi Set To Rival Tesla, Nio As It Officially Registers EV Business",F,0.0061395941324227,0.3947390240377895,-0.0015326267287198,-0.0195341556038727,0.031783129719753,-0.0205012990911913,0.006880761064844,-0.0076277421703409,-0.166834534451395,1
2021-09-07,"Intel Plans $95B Chip Plant In Europe, Robotaxi Service",F,0.0046545442554313,0.5380580392006094,-0.0092235491554663,-0.0076277421703409,0.0061395941324227,-0.0015326267287198,-0.0195341556038727,0.0061777668476554,-0.0941744038719615,0
2021-09-07,Volatile Trading Week Expected Ahead Of Friday Inflation Report,F,0.0046545442554313,0.5380580392006094,-0.0092235491554663,-0.0076277421703409,0.0061395941324227,-0.0015326267287198,-0.0195341556038727,0.0061777668476554,-0.0941744038719615,0
2021-09-07,"Intel To Dedicate Production At Ireland Facility For Auto Chips As Ford, Tesla And Others Face Crippling Shortages",F,0.0046545442554313,0.5380580392006094,-0.0092235491554663,-0.0076277421703409,0.0061395941324227,-0.0015326267287198,-0.0195341556038727,0.0061777668476554,-0.0941744038719615,0
2021-09-07,Key Apple Car Exec Jumps Ship To Join Ford: What You Need To Know,F,0.0046545442554313,0.5380580392006094,-0.0092235491554663,-0.0076277421703409,0.0061395941324227,-0.0015326267287198,-0.0195341556038727,0.0061777668476554,-0.0941744038719615,0
2021-09-08,Could Ford's New Hire Who Once Worked At Apple And Tesla Help The Stock Reverse Back Up?,F,0.0061777668476554,-0.0941744038719615,0.0046545442554313,-0.0092235491554663,-0.0076277421703409,0.0061395941324227,-0.0015326267287198,-0.0207214128075247,0.1867080366120568,1
2021-09-09,"Taper Or Tarry: Will Delta, Inflation, And Employment Data Spur Fed Action Or Delay?",F,-0.0207214128075247,0.1867080366120568,0.0061777668476554,0.0046545442554313,-0.0092235491554663,-0.0076277421703409,0.0061395941324227,-0.0062695896332318,-0.2908726513812668,1
2021-09-10,Apple Car Said To Get A New Chief: What You Need To Know,F,-0.0062695896332318,-0.2908726513812668,-0.0207214128075247,0.0061777668476554,0.0046545442554313,-0.0092235491554663,-0.0076277421703409,0.0244479072542269,0.2762371266075729,0
2021-09-14,"Playing Yo-Yo: Market Swings Up And Down Amid Lack Of Major Data, Earnings",F,-0.0100077649454546,-0.2349415777539392,0.0244479072542269,-0.0062695896332318,-0.0207214128075247,0.0061777668476554,0.0046545442554313,0.0279939739598094,0.2653460899061308,0
2021-09-15,"Walmart Signs Autonomous Last Mile Delivery Deal With Ford, Argo AI: What Investors Should Know About $7.5B Private Company",F,0.0279939739598094,0.2653460899061308,-0.0100077649454546,0.0244479072542269,-0.0062695896332318,-0.0207214128075247,0.0061777668476554,0.0136156269406397,0.2678075249535103,0
2021-09-17,Even Covid-19 Cannot End Disney's Enduring Magic,F,0.0111940740894282,-0.0031887012421148,0.0136156269406397,0.0279939739598094,-0.0100077649454546,0.0244479072542269,-0.0062695896332318,-0.0538746975352387,0.6559231528542024,1
2021-09-20,Elon Musk Derides President Biden Over Failure To Acknowledge SpaceX's 1st All-Civilian Mission,F,-0.0538746975352387,0.6559231528542024,0.0111940740894282,0.0136156269406397,0.0279939739598094,-0.0100077649454546,0.0244479072542269,-0.0039000624788007,-0.5206338058313688,2
2021-09-23,"This Sushi Company Has A Better One-Year Return Than Apple, Disney, Ford And Tesla",F,0.0362811643513159,-0.093369312783701,0.0360219325192168,-0.0039000624788007,-0.0538746975352387,0.0111940740894282,0.0136156269406397,0.0051057314314051,-0.1639966757922283,0
2021-09-23,Apple Among Companies That Will Attend White House Meeting On Chip Shortage Today: Report,F,0.0362811643513159,-0.093369312783701,0.0360219325192168,-0.0039000624788007,-0.0538746975352387,0.0111940740894282,0.0136156269406397,0.0051057314314051,-0.1639966757922283,0
2021-09-24,Tesla's Elon Musk Sees Respite From Chip Crisis Soon,F,0.0051057314314051,-0.1639966757922283,0.0362811643513159,0.0360219325192168,-0.0039000624788007,-0.0538746975352387,0.0111940740894282,0.0275762064743034,0.1972399121172976,0
2021-09-24,Key Takeaways From White House Chip Crisis Meet,F,0.0051057314314051,-0.1639966757922283,0.0362811643513159,0.0360219325192168,-0.0039000624788007,-0.0538746975352387,0.0111940740894282,0.0275762064743034,0.1972399121172976,0
2021-09-28,Troubling Tuesday: Second Selloff in Seven Sessions Comes as Tech Gets Hit by Yield Climb,F,0.0105932628423528,0.5572395982533005,0.0275762064743034,0.0051057314314051,0.0362811643513159,0.0360219325192168,-0.0039000624788007,-0.0006987657784753,-0.469558104376749,2
2021-09-28,"A Peek Into The Markets: US Stock Futures Down Ahead Of Economic Data, Fed Speakers",F,0.0105932628423528,0.5572395982533005,0.0275762064743034,0.0051057314314051,0.0362811643513159,0.0360219325192168,-0.0039000624788007,-0.0006987657784753,-0.469558104376749,2
2021-09-29,"Technology Stocks Pull Down the S&P 500, Can Other Sectors Pull It Higher?",F,-0.0006987657784753,-0.469558104376749,0.0105932628423528,0.0275762064743034,0.0051057314314051,0.0362811643513159,0.0360219325192168,-0.009790297256692,0.3875505012718838,1
2021-10-04,A Look into Share CFDs and the Top 5 to Watch… Come Rise or Fall,F,0.0134181577010428,0.5098523734168066,0.0,-0.009790297256692,-0.0006987657784753,0.0105932628423528,0.0275762064743034,-0.0041812011209209,-0.2861736826987521,2
2021-10-05,Rising Oil Prices and Yields Makes Market Navigation More Complex,F,-0.0041812011209209,-0.2861736826987521,0.0134181577010428,0.0,-0.009790297256692,-0.0006987657784753,0.0105932628423528,-0.0118965271609023,0.0912890453145622,1
2021-10-08,10 Consumer Discretionary Stocks With Unusual Options Alerts In Today's Session,F,0.0154465750067851,0.0301519819796494,0.0545326993297956,-0.0118965271609023,-0.0041812011209209,0.0134181577010428,0.0,-0.0019841348538122,-0.5445581483257581,2
2021-10-14,A Peek Into The Markets: US Stock Futures Rise Ahead Of Bank Earnings,F,-0.003868487173782,-0.1970913854190503,-0.0083119417050745,0.0364479377179058,-0.0019841348538122,0.0154465750067851,0.0545326993297956,0.0161811801873139,0.5176736753342992,0
2021-10-14,Tesla Co-Founder Has Warning For Legacy Automakers Investing In Electric Vehicle Production,F,-0.003868487173782,-0.1970913854190503,-0.0083119417050745,0.0364479377179058,-0.0019841348538122,0.0154465750067851,0.0545326993297956,0.0161811801873139,0.5176736753342992,0
2021-10-18,"Apple Supplier Foxconn Unveils 3 EVs Including Sedan, SUV, Bus: What You Need To Know",F,-0.0089170767417577,-0.369995259791897,0.0161811801873139,-0.003868487173782,-0.0083119417050745,0.0364479377179058,-0.0019841348538122,-0.0089975092641902,-0.0817267565445133,1
2021-10-22,"A Peek Into The Markets: US Stock Futures Mostly Lower Ahead Of Earnings, PMI Data",F,-0.0163140743641514,-0.3673068697511866,0.0317954402714257,0.0402075226092986,-0.0089975092641902,-0.0089170767417577,0.0161811801873139,-0.0171991058023772,0.118080426337416,1
2021-10-27,"7 Stocks To Watch For October 27, 2021",F,-0.0269761568340963,0.4810556962376489,-0.003749949202382,-0.0171991058023772,-0.0163140743641514,0.0317954402714257,0.0402075226092986,0.0870406900706024,1.2398581393485355,0
2021-10-27,"A Peek Into The Markets: US Stock Futures Edge Lower Ahead Of GM, Coca-Cola Earnings",F,-0.0269761568340963,0.4810556962376489,-0.003749949202382,-0.0171991058023772,-0.0163140743641514,0.0317954402714257,0.0402075226092986,0.0870406900706024,1.2398581393485355,0
2021-10-27,4 Ways Hertz Is Creating Value For Tesla,F,-0.0269761568340963,0.4810556962376489,-0.003749949202382,-0.0171991058023772,-0.0163140743641514,0.0317954402714257,0.0402075226092986,0.0870406900706024,1.2398581393485355,0
2021-10-27,Aerospace & Defense Struggle to Launch with Lockheed and Raytheon,F,-0.0269761568340963,0.4810556962376489,-0.003749949202382,-0.0171991058023772,-0.0163140743641514,0.0317954402714257,0.0402075226092986,0.0870406900706024,1.2398581393485355,0
2021-10-27,"Earnings Scheduled For October 27, 2021",F,-0.0269761568340963,0.4810556962376489,-0.003749949202382,-0.0171991058023772,-0.0163140743641514,0.0317954402714257,0.0402075226092986,0.0870406900706024,1.2398581393485355,0
2021-10-28,"A Peek Into The Markets: US Stock Futures Edge Higher; Apple, Amazon Earnings In Focus",F,0.0870406900706024,1.2398581393485355,-0.0269761568340963,-0.003749949202382,-0.0171991058023772,-0.0163140743641514,0.0317954402714257,0.0130485823042101,-0.5327921329730494,0
2021-10-28,"7 Stocks To Watch For October 28, 2021",F,0.0870406900706024,1.2398581393485355,-0.0269761568340963,-0.003749949202382,-0.0171991058023772,-0.0163140743641514,0.0317954402714257,0.0130485823042101,-0.5327921329730494,0
2021-10-28,Market Breadth Could Be a Liability as Stocks Struggle to Maintain Highs,F,0.0870406900706024,1.2398581393485355,-0.0269761568340963,-0.003749949202382,-0.0171991058023772,-0.0163140743641514,0.0317954402714257,0.0130485823042101,-0.5327921329730494,0
2021-11-02,"Why Cathie Wood's Ark Expects Next Major EV Adoption Cycle Around $25,000 Price Point",F,0.0033426318378355,-0.0806433712718519,0.0509366599180345,0.0130485823042101,0.0870406900706024,-0.0269761568340963,-0.003749949202382,0.0344253794696947,-0.0902391915668949,0
2021-11-08,Apple Supplier TSMC Says It Has Complied With US Request For Data Without Compromising Customer-Related Information,F,0.0445824604310032,0.2557280323842654,-0.0066942276277939,0.0424048535493397,0.0344253794696947,0.0033426318378355,0.0509366599180345,-0.0014886310567598,0.0745199699785785,2
2021-11-10,A Peek Into The Markets: US Stock Futures Down; Inflation Data In Focus,F,-0.03777336919741,0.3891449931333881,-0.0014886310567598,0.0445824604310032,-0.0066942276277939,0.0424048535493397,0.0344253794696947,0.0098140521131449,-0.5790813654251066,0
2021-11-10,"Amazon, Ford Among the Big Winners in Rivian's IPO",F,-0.03777336919741,0.3891449931333881,-0.0014886310567598,0.0445824604310032,-0.0066942276277939,0.0424048535493397,0.0344253794696947,0.0098140521131449,-0.5790813654251066,0
2021-11-11,Opendoor and Beazer Give the Housing Market a Boost,F,0.0098140521131449,-0.5790813654251066,-0.03777336919741,-0.0014886310567598,0.0445824604310032,-0.0066942276277939,0.0424048535493397,-0.0025575907284376,-0.1928585131148475,2
2021-11-12,Stock Index Futures Point to a Higher Open as Equities Cling to a 5-Week Win Streak,F,-0.0025575907284376,-0.1928585131148475,0.0098140521131449,-0.03777336919741,-0.0014886310567598,0.0445824604310032,-0.0066942276277939,0.0184615042624844,0.0899394767844457,0
2021-11-17,Metaverse: A Quick Intro for Investors,F,0.008590266916042,0.2148227389373351,-0.0035246515822683,0.0184615042624844,-0.0025575907284376,0.0098140521131449,-0.03777336919741,-0.0151058127987416,0.3773857463712908,1
2021-11-17,Here's Why EV Maker Canoo's Stock Is All Charged Up Today,F,0.008590266916042,0.2148227389373351,-0.0035246515822683,0.0184615042624844,-0.0025575907284376,0.0098140521131449,-0.03777336919741,-0.0151058127987416,0.3773857463712908,1
2021-11-22,Ford and Rivian Won't Be Doing the EV Race Together,F,0.0562149300506826,1.1337385312581256,-0.0086914059573134,-0.0151058127987416,0.008590266916042,-0.0035246515822683,0.0184615042624844,-0.0136719940035257,-0.3400306248943687,1
2021-11-24,"GameStop Remains Top Discussed Stock On WallStreetBets; Zoom, Tesla And These Are Other Top Trends",F,0.0024751212996003,-0.1501376608103578,-0.0136719940035257,0.0562149300506826,-0.0086914059573134,-0.0151058127987416,0.008590266916042,-0.0246912393149137,-0.3606925636572203,1
2021-11-24,Stock Wars: Ford Vs. Tesla,F,0.0024751212996003,-0.1501376608103578,-0.0136719940035257,0.0562149300506826,-0.0086914059573134,-0.0151058127987416,0.008590266916042,-0.0246912393149137,-0.3606925636572203,1
2021-12-02,Apple Loses Another Key Car Engineer: All You Need To Know,F,0.014811024729239,-0.2486384198647039,0.0203231404867607,-0.0244027805807253,-0.0040505323764313,-0.0246912393149137,0.0024751212996003,-0.0367389305988917,0.2775893514392573,1
2021-12-07,Ford Launches New Field Service Tool Built On Salesforce,F,0.0385016719610009,-0.1391056344259729,0.0041797344900511,-0.0367389305988917,0.014811024729239,0.0203231404867607,-0.0244027805807253,-0.0075150665314785,-0.1665507026366003,1
2021-12-23,Tesla Leads Automobile Stocks to be Among Wednesday's Top Performers,F,0.0054616973239574,-0.3323716731041178,0.0270270385693769,0.0097835515757376,-0.0177034308121474,-0.0285014172825234,0.0079249339044418,0.0271605596919404,0.1786447476314203,0
2021-12-27,"CES Growing Virtual, Ford In China, Apple AR Headset Push, Bitcoin Rebound, US Holiday Sales: 5 Headlines You May Have Missed From The Weekend",F,0.0271605596919404,0.1786447476314203,0.0054616973239574,0.0270270385693769,0.0097835515757376,-0.0177034308121474,-0.0285014172825234,-0.0019229789746648,-0.1111668046898836,2
2022-01-05,"What Investors Should Know About Amazon, Sony And John Deere's Latest Push Into The Electric Vehicle Sector",F,-0.0267379826523841,-0.186446638677573,0.1166743381007786,0.0481462227951912,0.0146557675844356,-0.0043775140766909,-0.0096339239988535,0.0338122993910408,-0.3884247061607636,0
2022-01-11,How The Economy Has Changed Since Georgia's Last College Football National Championship,F,0.0209644343861212,-0.1367182760358858,-0.0241408073698086,-0.000817619844606,0.0338122993910408,-0.0267379826523841,0.1166743381007786,0.0049281380907026,-0.0185036354512148,2
2022-01-12,"This EV Stock Has A Better 6-Month Return Than Tesla, Ford, Nvidia And Apple",F,0.0049281380907026,-0.0185036354512148,0.0209644343861212,-0.0241408073698086,-0.000817619844606,0.0338122993910408,-0.0267379826523841,0.0224765535186919,0.7854925516578568,0
2022-01-20,A Peek Into The Markets: US Stock Futures Gain Ahead Of Jobless Claims Data,F,-0.0356347912324424,-0.0077292030846315,-0.0791631675125752,-0.0321557217398069,0.0067945522412165,0.0224765535186919,0.0049281380907026,-0.0461894400954996,-0.0426355186788593,1
2022-01-21,"This Chicken Wing Stock Has A Better 5-Year Return Than Disney, Netflix, Ford And Amazon",F,-0.0461894400954996,-0.0426355186788593,-0.0356347912324424,-0.0791631675125752,-0.0321557217398069,0.0067945522412165,0.0224765535186919,-0.0125905637486258,0.2826927794333789,1
2022-01-21,"No Production In Sight Yet For Tesla Roadster, Cybertruck Or Apple Car But People Are Really Out 'Searching' For Them!",F,-0.0461894400954996,-0.0426355186788593,-0.0356347912324424,-0.0791631675125752,-0.0321557217398069,0.0067945522412165,0.0224765535186919,-0.0125905637486258,0.2826927794333789,1
2022-01-24,Tesla's Gross Margin In Focus  With Q4 Earnings As Investors Look For Apple-Like Growth Story: Munster,F,-0.0125905637486258,0.2826927794333789,-0.0461894400954996,-0.0356347912324424,-0.0791631675125752,-0.0321557217398069,0.0067945522412165,-0.0201082026647739,-0.374439932716929,1
2022-01-25,"Ford, GM CEOs Among Those Invited By Biden To Discuss $1.75T 'Build Back Better' Legislation On Wednesday",F,-0.0201082026647739,-0.374439932716929,-0.0125905637486258,-0.0461894400954996,-0.0356347912324424,-0.0791631675125752,-0.0321557217398069,-0.0035033254451225,0.1627957162357269,2
2022-01-26,Stock Wars: Lyft Vs. Uber,F,-0.0035033254451225,0.1627957162357269,-0.0201082026647739,-0.0125905637486258,-0.0461894400954996,-0.0356347912324424,-0.0791631675125752,-0.0180812852325269,-0.2217600584447338,1
2022-01-26,A Peek Into The Markets: US Stock Futures Gain; Fed Policy Decision In Focus,F,-0.0035033254451225,0.1627957162357269,-0.0201082026647739,-0.0125905637486258,-0.0461894400954996,-0.0356347912324424,-0.0791631675125752,-0.0180812852325269,-0.2217600584447338,1
2022-01-27,Ford CEO Jim Farley Sees These 2 Companies As Rivals In EV Race (Hint: GM Isn't Among Them),F,-0.0180812852325269,-0.2217600584447338,-0.0035033254451225,-0.0201082026647739,-0.0125905637486258,-0.0461894400954996,-0.0356347912324424,0.0046272274428953,-0.1703089868501737,2
2022-01-28,Ford's New 'Escape Room' Game Concept For The Mustang Mach-E Offers Glimpse Into The Future,F,0.0046272274428953,-0.1703089868501737,-0.0180812852325269,-0.0035033254451225,-0.0201082026647739,-0.0125905637486258,-0.0461894400954996,0.0388944866324321,0.0420269374785433,0
2022-02-02,"GM Reveals Strong Demand For Silverado EV: How Do The Numbers Stack Up Against Ford, Tesla And Rivian?",F,-0.0014520411048014,-0.1893230702802677,0.0177339080596583,0.0388944866324321,0.0046272274428953,-0.0180812852325269,-0.0035033254451225,-0.0358700733538299,0.0800858901880525,1
2022-02-03,"Earnings Scheduled For February 3, 2022",F,-0.0358700733538299,0.0800858901880525,-0.0014520411048014,0.0177339080596583,0.0388944866324321,0.0046272274428953,-0.0180812852325269,-0.0970337501365355,1.0492010949755377,1
2022-02-03,"7 Stocks To Watch For February 3, 2022",F,-0.0358700733538299,0.0800858901880525,-0.0014520411048014,0.0177339080596583,0.0388944866324321,0.0046272274428953,-0.0180812852325269,-0.0970337501365355,1.0492010949755377,1
2022-02-03,A Peek Into The Markets: Nasdaq Futures Tumble Following Downbeat Earnings From Meta,F,-0.0358700733538299,0.0800858901880525,-0.0014520411048014,0.0177339080596583,0.0388944866324321,0.0046272274428953,-0.0180812852325269,-0.0970337501365355,1.0492010949755377,1
2022-02-09,"This Cargo Shipping Company's 5-Year Return Beats Apple, Microsoft, Ford And Wells Fargo",F,0.0355529987123572,-0.3894738612544439,-0.0095024457332024,-0.0038974808854687,-0.0970337501365355,-0.0358700733538299,-0.0014520411048014,-0.014713828349226,-0.1253842463033152,1
2022-02-09,"Ford Begins E-Transit Deliveries, Says Working On Ways To Increase Production And Meet 'Strong' Demand",F,0.0355529987123572,-0.3894738612544439,-0.0095024457332024,-0.0038974808854687,-0.0970337501365355,-0.0358700733538299,-0.0014520411048014,-0.014713828349226,-0.1253842463033152,1
2022-02-10,Ford Poaches Another Tesla Executive To Further Its EV Ambitions,F,-0.014713828349226,-0.1253842463033152,0.0355529987123572,-0.0095024457332024,-0.0038974808854687,-0.0970337501365355,-0.0358700733538299,-0.0293142263913177,0.2406815118517808,1
2022-02-16,Nvidia Aims To Transform The Auto Industry: Why Jim Cramer Is Telling Competitors To Pay Attention,F,-0.0038718424414624,-0.1281235153673237,0.0355098451819877,-0.0051282407348063,-0.0293142263913177,-0.014713828349226,0.0355529987123572,-0.026096430355854,-0.0360972178941926,1
2022-02-18,GE And Intel Lead The S&P 500 Lower To End The Week,F,0.0285061499151366,0.921742648360262,-0.026096430355854,-0.0038718424414624,0.0355098451819877,-0.0051282407348063,-0.0293142263913177,-0.0415742226067972,-0.0738081767449029,1
2022-03-01,"Markets Fall As Russia-Ukraine Tensions Escalate; American Express, Boeing See Sharp Drops",F,-0.0489749063041764,0.1511719385488017,-0.0151428329434305,0.0396499757329074,0.0117993478594675,-0.019664521174927,-0.0415742226067972,0.0838322677362988,0.4621275159645432,0
2022-03-01,"'Russia Weaker, Rest Of World Stronger:' Biden Talks Ukraine, US Manufacturing, Inflation, Taxes In First State Of The Union Address",F,-0.0489749063041764,0.1511719385488017,-0.0151428329434305,0.0396499757329074,0.0117993478594675,-0.019664521174927,-0.0415742226067972,0.0838322677362988,0.4621275159645432,0
2022-03-02,Apple Pauses Sales Of iPhone And Other Products In Russia Amid Country's Invasion Of Ukraine,F,0.0838322677362988,0.4621275159645432,-0.0489749063041764,-0.0151428329434305,0.0396499757329074,0.0117993478594675,-0.019664521174927,-0.0276241943101563,-0.3119104258422281,1
2022-03-02,The Companies Pulling Their Business From Russia After The Ukraine Invasion,F,0.0838322677362988,0.4621275159645432,-0.0489749063041764,-0.0151428329434305,0.0396499757329074,0.0117993478594675,-0.019664521174927,-0.0276241943101563,-0.3119104258422281,1
2022-03-02,36 Stocks To Watch After Biden's First State of The Union Address,F,0.0838322677362988,0.4621275159645432,-0.0489749063041764,-0.0151428329434305,0.0396499757329074,0.0117993478594675,-0.019664521174927,-0.0276241943101563,-0.3119104258422281,1
2022-03-08,Russia Braces For Deep Recession Amid Corporate Exodus,F,0.0037571358092001,0.1479683906217328,-0.0522255316497695,-0.0426137496717226,-0.0276241943101563,0.0838322677362988,-0.0489749063041764,0.0212102681464401,-0.3778804854073884,0
2022-03-17,Benzinga Launches March Madness Stock Competition: What Companies Are The No. 1 Seeds And The Top Matchups?,F,0.0,-0.2924298721781958,0.0323786334637448,0.020330423306103,-0.0187033710285854,-0.0177587005329855,-0.0024435957121536,0.0168878918138708,0.5238238501748711,0
2022-03-18,"This Telecommunications Company Has A Better 1-Year Return Than Tesla, Ford, Microsoft, Apple, Disney, Netflix And Amazon",F,0.0168878918138708,0.5238238501748711,0.0,0.0323786334637448,0.020330423306103,-0.0187033710285854,-0.0177587005329855,-0.0225386249660943,-0.1857713362649197,1
2022-03-22,ESG Stocks And ETFs To Watch As SEC Weighs Greenhouse Gas Disclosure Requirement,F,0.0370145879179093,0.0697609377324905,-0.0225386249660943,0.0168878918138708,0.0,0.0323786334637448,0.020330423306103,-0.0239907222409956,-0.1848143716893483,1
2022-03-22,"Benzinga's Daily Brief On Trending Tickers For March 22, 2022: Alibaba, Nike, Tesla And More",F,0.0370145879179093,0.0697609377324905,-0.0225386249660943,0.0168878918138708,0.0,0.0323786334637448,0.020330423306103,-0.0239907222409956,-0.1848143716893483,1
2022-03-22,Apple's EV Map Routing Feature Finally Comes To Ford Mustang Mach-Es,F,0.0370145879179093,0.0697609377324905,-0.0225386249660943,0.0168878918138708,0.0,0.0323786334637448,0.020330423306103,-0.0239907222409956,-0.1848143716893483,1
2022-03-24,"Benzinga's Daily Brief On Trending Tickers For March 24, 2022: Nvidia, Disney, GameStop And More",F,0.0089928686442382,-0.1103152134073128,-0.0239907222409956,0.0370145879179093,-0.0225386249660943,0.0168878918138708,0.0,-0.0213904607031916,0.1013758519165681,1
2022-03-30,EXCLUSIVE: Benzinga's 2022 EV Listmakers Are Accelerating Electrification Efforts Around The Globe,F,-0.02704226525626,-0.3619830408847236,0.0647869893716479,0.0121434182248276,-0.0213904607031916,0.0089928686442382,-0.0239907222409956,-0.0208454210155938,-0.092025706354337,1
2022-03-31,"This EV Charging Stock Has A Better 6-Month Return Than Tesla, Ford, Nvidia And Apple",F,-0.0208454210155938,-0.092025706354337,-0.02704226525626,0.0647869893716479,0.0121434182248276,-0.0213904607031916,0.0089928686442382,-0.0153755426496361,0.2316093463850719,1
2022-03-31,"34 Public Companies That Made Time's 100 Most Influential For 2022: AMC, Disney, Ford And More",F,-0.0208454210155938,-0.092025706354337,-0.02704226525626,0.0647869893716479,0.0121434182248276,-0.0213904607031916,0.0089928686442382,-0.0153755426496361,0.2316093463850719,1
2022-04-01,"This Canadian Clothing Company Has A Better One-Year Return Than Apple, Ford and AMD",F,-0.0153755426496361,0.2316093463850719,-0.0208454210155938,-0.02704226525626,0.0647869893716479,0.0121434182248276,-0.0213904607031916,0.0006006256590258,-0.2094296838893465,2
2022-04-01,"Morning Brief: Top Stories Dominating Financial Media on Friday, April 1",F,-0.0153755426496361,0.2316093463850719,-0.0208454210155938,-0.02704226525626,0.0647869893716479,0.0121434182248276,-0.0213904607031916,0.0006006256590258,-0.2094296838893465,2
2022-04-12,Nokia Exits Russia Amid Ukraine Invasion: What You Need To Know,F,0.0052355474944354,-0.2567928720406672,0.0152824058670177,0.0060160848031602,-0.0279403009962263,-0.0271807315086751,-0.0504201449525874,0.0097656932028402,0.0556201120501762,0
2022-04-14,"Morning Brief: Top Stories Dominating Financial Media on Thursday, April 14",F,-0.0019342493547913,-0.2421142123465929,0.0097656932028402,0.0052355474944354,0.0152824058670177,0.0060160848031602,-0.0279403009962263,0.0122740092914908,0.022712646484996,0
