date,title,stock,close,volume,1_past_close,2_past_close,3_past_close,4_past_close,5_past_close,next_close,next_volume,label
2012-11-15,"Sharp Higher on Rumors of Rescue by Intel, Qualcom",HNHPF,0.0066667000446312,-0.7043337097684923,-0.0180034480515896,0.0032841235089757,-0.0065250389136084,-0.0269842450558379,0.0806174745000862,0.0298012240444396,1.352828837431368,0
2012-11-15,"Sharp Higher on Rumors of Rescue by Intel, Qualcomm",HNHPF,0.0066667000446312,-0.7043337097684923,-0.0180034480515896,0.0032841235089757,-0.0065250389136084,-0.0269842450558379,0.0806174745000862,0.0298012240444396,1.352828837431368,0
2013-08-19,"Will Apple, Dell And HP Follow Lenovo And Build Notebooks In-House?",HNHPF,0.0,-1.0,-0.0079209162667117,-0.0019764424747868,0.0305499814750864,0.0,-0.0334644591705467,0.0,,2
2013-08-19,"Will Apple, Dell And Hewlett-Packard Follow Lenovo And Build Notebooks In-House?",HNHPF,0.0,-1.0,-0.0079209162667117,-0.0019764424747868,0.0305499814750864,0.0,-0.0334644591705467,0.0,,2
2013-08-19,"Apple's iPhone 5S, iPhone 5C Practically Confirmed For September Launch",HNHPF,0.0,-1.0,-0.0079209162667117,-0.0019764424747868,0.0305499814750864,0.0,-0.0334644591705467,0.0,,2
2013-08-19,"Apple's iPhone 5S, iPhone 5C Planned For September Launch? (AAPL)",HNHPF,0.0,-1.0,-0.0079209162667117,-0.0019764424747868,0.0305499814750864,0.0,-0.0334644591705467,0.0,,2
2013-08-23,Google Acquires Foxconn Patents To Enhance Google Glass,HNHPF,0.0,-1.0,0.0439123556838365,0.0,0.0,0.0,-0.0079209162667117,-0.017208394802436,inf,1
2013-08-23,Google Acquires Foxconn Patents To Enhance Google Glass (GOOG),HNHPF,0.0,-1.0,0.0439123556838365,0.0,0.0,0.0,-0.0079209162667117,-0.017208394802436,inf,1
2013-09-05,Will Google Glass Be Dethroned Ahead Of Its Release?,HNHPF,0.0746803750253239,inf,0.0,0.0175097087840681,0.0,0.0,0.0,-0.0240000342059202,99.5,1
2013-09-05,Will Google Glass Be Dethroned Ahead Of Its Release? (GOOG),HNHPF,0.0746803750253239,inf,0.0,0.0175097087840681,0.0,0.0,0.0,-0.0240000342059202,99.5,1
2013-10-16,iPhone 5C Orders Reduced By Apple - Again! (AAPL),HNHPF,0.0,,0.0,0.0,0.0,0.0,0.0,0.0,,2
2013-10-16,iPhone 5C Orders Reduced By Apple - Again!,HNHPF,0.0,,0.0,0.0,0.0,0.0,0.0,0.0,,2
2013-11-05,"Apple Rumor Mill Strikes Back, Promises Large iPad In 2014",HNHPF,0.0061476281908461,inf,0.0,0.0,0.0,0.0,0.0,0.0,-1.0,2
2013-11-18,Is Apple's iPhone 5C The Biggest Flop Of The Year?,HNHPF,0.0416666732944879,inf,0.0,0.0,-0.002078978647967,-0.0243408053469671,0.0,-0.0139999945026199,75.0,1
2013-11-20,Apple Reduces iPhone 5C Orders By 50% From One Supplier,HNHPF,0.0,-1.0,-0.0139999945026199,0.0416666732944879,0.0,0.0,-0.002078978647967,0.0,,2
2014-05-27,"DigiTimes Reports Foxconn to Manufacture 5.5-inch, 4.7-inch iPhone Models",HNHPF,0.0305083879366934,inf,0.0,0.0172415824479787,0.0,0.0,0.0,0.0,-1.0,2
2014-06-23,FoxConn Reportedly to Hire 100K Workers for Production of Apple's iPhone 6,HNHPF,0.0,-0.9375,0.0078741075850081,0.0,-0.0078125904076209,0.0,0.0,-0.0093751919996898,5.0,1
2014-06-24,Apple Rejects Catcher's 4.7-inch iPhone 6 Chassis Due to Defects,HNHPF,-0.0093751919996898,5.0,0.0,0.0078741075850081,0.0,-0.0078125904076209,0.0,-0.0236592230794617,0.3333333333333332,1
2014-07-07,"Digitimes Reports Cisco, Dell May Move Server ODM Orders Away from Foxconn",HNHPF,0.024637624388184,2.0,0.0222223127140839,-0.0073530823559371,0.028744466753392,0.0678513516613885,0.0,-0.0240452075951196,5.666666666666667,1
2014-08-14,"Pegatron, Foxconn Reportedly to Each Produce 50% of Apple's 4.7-inch iPhone ",HNHPF,0.0,-1.0,0.0208954006050536,0.0,0.0,-0.0088757523432085,0.0014815780061339,0.0,,2
2014-09-03,"Supply Chain Sources Report Taiwan Handset Makers See Drop in Orders from Amazon, Microsoft, Facebook ",HNHPF,0.0,,0.0,0.0217391688275907,0.0,0.0179518243275111,0.0555558284202799,0.0,,2
2014-10-03,Shipments of Apple's iPhone 6 Plus to Account for 60% of Total iPhone 6 Shipments,HNHPF,0.0,,0.0,0.0263590648854119,-0.0162073013041722,0.0,-0.0493067874340558,0.0,,2
2014-10-23,Apple May Increase Payments to Foxconn to Accelerate iPhone 6 Plus Production,HNHPF,0.0,,0.0,0.0,-0.0266224387950183,-0.0579936649911589,0.0,0.0,,2
2015-03-26,Apple Allegedly Releasing 3 New iPhones In 2015,HNHPF,0.0,,0.0,-0.0455283215584297,0.0477000235698632,0.087037015240841,0.0,0.006814061133022,inf,0
2015-03-26,Apple Reportedly Releasing 3 New iPhones In 2015,HNHPF,0.0,,0.0,-0.0455283215584297,0.0477000235698632,0.087037015240841,0.0,0.006814061133022,inf,0
2015-08-28,"SPIL, Hon Hai Precision Industry Sign LoI for Hon Hai Stake in SPIL",HNHPF,0.0,-1.0,0.0132075088239196,0.019230843457324,0.0,0.0,-0.0940768361803179,0.0,,2
2015-12-09,"What McDonald's, Wal-Mart, The DoD, China Petroleum And Foxconn Have In Common",HNHPF,0.0,,0.0,0.0,-0.027472848643512,0.0,-0.0072726111743308,0.0,,2
2015-12-09,"What Mc. Donald's, Wal-Mart, The DoD, China Petroleum And Foxconn Have In Common",HNHPF,0.0,,0.0,0.0,-0.027472848643512,0.0,-0.0072726111743308,0.0,,2
2015-12-21,Apple CEO Tim Cook On Taxes And Manufacturing In China,HNHPF,-0.0072860918713428,inf,0.0,0.0,0.0,0.0828402445399347,-0.0451975713494839,0.0,-1.0,2
2016-01-21,"Benzinga's M&A Chatter for Thursday January 21, 2016",HNHPF,0.0,,0.0,-0.0428266911634235,-0.0042642564060694,0.0,0.0,0.0,,2
2017-11-06,Apple Likely to Add More Partners to Upstream Supply Chain -DigiTimes,HNHPF,0.0,-1.0,0.0319149617261871,0.0093960397990344,0.0,0.0,0.0067565653698908,0.0,,2
2020-02-07,"iPhone Maker Foxconn Makes Masks For Chinese Employees, Forces Them To Return To Work",HNHPF,-0.0247348883569032,0.1572387344199424,0.0216606519518962,-0.0071684594820083,0.0163933937660021,0.0129151807636267,-0.0269301276016917,-0.0126813076241186,0.2361226180613089,1
2020-02-18,Apple To Miss Q2 Earnings As Coronavirus Outbreak Hits Both Supply And Demand,HNHPF,-0.0314136140604427,0.2513863216266174,-0.0069323154733333,-0.018707531105093,0.0556551466315946,0.0220185520721523,-0.0126813076241186,0.0252251281961579,-0.1004431314623338,0
2020-03-04,"iPhone Maker Foxconn Expects 15% Q1 Revenue Hit From Coronavirus, Says Production Rebounding",HNHPF,0.0354477103180885,-0.3426808749298934,-0.0018621467062854,0.0740000626107892,-0.0328820660854587,-0.0245283533386877,-0.0056284669493076,-0.0198197716594069,0.6979522184300342,1
2020-03-13,Apple Reopens All China Stores As Coronavirus Cases Drop To Negligible In Country,HNHPF,0.0899122860786481,-0.2637271214642263,-0.0988142831413132,-0.0269230769230769,0.0077520444996082,-0.0227273760208504,-0.0294117647058823,-0.1348087507789915,-0.0583804143126177,1
2020-04-08,iPhone Maker Foxconn To Produce Ventilators In The US,HNHPF,0.0418411230564486,0.7907771135781383,0.0063157324267839,0.0393873108841849,-0.0172043020841995,0.0175054715040821,-0.0086766728217281,0.0020079773704728,-0.3447782546494993,2
2020-07-21,"Apple Plans To Go Carbon Neutral Across Supply Chain, Products Within A Decade",HNHPF,-0.0033003303300276,-0.385175079581628,-0.0065573776354637,-0.0048940088139668,0.0199667230357447,0.0016667122673421,0.0,0.009933775731421,0.7233727810650887,0
2020-08-12,Apple Supplier Foxconn Reports Q2 Earnings Beat,HNHPF,0.0992780869233083,0.7834101382488479,-0.0053860495315314,0.0238969739687242,0.0,-0.0054843249872921,0.0110905870462365,-0.0853859199832263,0.1352282515073213,1
2020-10-13,Apple Supplier Foxconn Fails To Secure Wisconsin Tax Credits As It Misses US Jobs Target Second Year In A Row,HNHPF,0.0,-0.0965018094089263,0.0090909357308626,-0.0036232552917667,0.0109891198134575,-0.0072727674904636,-0.007220163076809,-0.0126126117686733,0.061415220293725,1
2020-10-16,Apple Supplier Foxconn Aims To Serve 10% Of All Electric Vehicles Globally Within Next 7 Years,HNHPF,0.0200730320006685,-0.0519578313253011,0.0,-0.0126126117686733,0.0,0.0090909357308626,-0.0036232552917667,0.0339891965010421,0.4225575853852263,0
2020-11-18,Apple Supplier Foxconn Starts Making Displays In Vietnam While Wisconsin Plans Remain Unclear,HNHPF,0.0138169125517921,0.2472989195678272,0.0069564695320361,0.0176990735134383,0.0053382238064947,-0.0174825689674448,0.0123892870459356,-0.0153321721151394,-0.2723772858517805,1
2020-11-19,Apple Supplier Taiwan Semiconductor Wins Phoenix City's Support For $12B Plant,HNHPF,-0.0153321721151394,-0.2723772858517805,0.0138169125517921,0.0069564695320361,0.0176990735134383,0.0053382238064947,-0.0174825689674448,0.0069204535079674,-0.3346560846560846,0
2021-01-04,Apple Supplier Foxconn Confirms It Will Make Electric Vehicles With Chinese Startup Byton,HNHPF,0.0920059678936355,2.7920384351407,-0.0104476833640674,0.0182370241876879,-0.0237388490562151,0.0385208346835073,0.0046439280893746,0.1464089671337227,0.5281447963800905,0
2021-01-04,Apple Supplier Foxconn Looks To Invest $200M In Chinese EV Startup Byton: Report,HNHPF,0.0920059678936355,2.7920384351407,-0.0104476833640674,0.0182370241876879,-0.0237388490562151,0.0385208346835073,0.0046439280893746,0.1464089671337227,0.5281447963800905,0
2021-01-05,What iPhone Supplier Foxconn's Strong Quarterly Revenue Means For Apple,HNHPF,0.1464089671337227,0.5281447963800905,0.0920059678936355,-0.0104476833640674,0.0182370241876879,-0.0237388490562151,0.0385208346835073,-0.0602410083823692,-0.2962217221366813,1
2021-01-08,Strong iPhone Demand Helps Taiwan Semiconductor Clock Record Quarterly Revenue: Bloomberg,HNHPF,0.0089742913793864,-0.4744325950232431,0.0,-0.0602410083823692,0.1464089671337227,0.0920059678936355,-0.0104476833640674,-0.0038119156352555,0.2107180020811654,2
2021-01-13,"Apple Supplier Foxconn, Geely Partner On Automotive Contract Manufacturing Services",HNHPF,0.03355707789197,0.2388365424006555,-0.049744989395917,-0.0038119156352555,0.0089742913793864,0.0,-0.0602410083823692,0.1259741031404517,0.1977513227513228,0
2021-01-21,Apple Supplier Pegatron Prepares To Make iPhones In India With $150M Investment,HNHPF,0.0130485993177416,-0.157254561251086,0.0071685295799521,-0.0094675076103566,-0.0253748455190371,0.1259741031404517,0.03355707789197,0.059719070283811,0.6611683848797252,0
2021-01-25,Apple Supplier Luxshare Hit With US Patent Infringement Probe,HNHPF,0.0055247050853735,-0.1917666528754654,0.059719070283811,0.0130485993177416,0.0071685295799521,-0.0094675076103566,-0.0253748455190371,-0.0186812941958182,-0.1499872024571282,1
2021-02-11,"Potential Partners For An Apple Car Grow In Number, With Nissan The Latest To Express Interest",HNHPF,0.0060239880869494,0.3197064989517819,0.0036276681236895,0.0012105816658278,0.0024272925863657,-0.0036276052568496,-0.0060095085824323,0.0179640621624095,-0.318506751389992,0
2021-02-16,Apple Talked EV Tie-Up With Nissan But Concerns Over Automaker Becoming 'Foxconn' Came In The Way: FT,HNHPF,0.0117648015887432,0.6958041958041958,0.0179640621624095,0.0060239880869494,0.0036276681236895,0.0012105816658278,0.0024272925863657,-0.0279071285834028,0.3243986254295532,1
2021-02-19,"Apple Looks To Make iPads in India This Year, In A Shift Away From China: Report",HNHPF,-0.012315179467137,0.8509984639016897,-0.0287081080835682,-0.0279071285834028,0.0117648015887432,0.0179640621624095,0.0060239880869494,0.0087281787428112,-0.4589211618257262,0
2021-02-22,Apple Supplier Foxconn Expects 'Limited Impact' From Chip Crisis: Reuters,HNHPF,0.0087281787428112,-0.4589211618257262,-0.012315179467137,-0.0287081080835682,-0.0279071285834028,0.0117648015887432,0.0179640621624095,-0.0173053778807941,0.9394171779141104,1
2021-02-22,"China EV Updates: Nio Tests New Power Swap Station, Xpeng's Travel Statistics, Geely, Baidu Make Progress On JV, Xiaomi Downplays Rumors",HNHPF,0.0087281787428112,-0.4589211618257262,-0.012315179467137,-0.0287081080835682,-0.0279071285834028,0.0117648015887432,0.0179640621624095,-0.0173053778807941,0.9394171779141104,1
2021-02-24,Fisker Joins Hands With Foxconn For Second EV Model: What You Need To Know,HNHPF,0.0440252867934538,-0.1739818109924871,-0.0173053778807941,0.0087281787428112,-0.012315179467137,-0.0287081080835682,-0.0279071285834028,0.0192769623249715,0.163714696026807,0
2021-02-26,Top 10 Electric Vehicle Stocks You Should Know About,HNHPF,-0.0236405476003843,-0.490744549568079,0.0192769623249715,0.0440252867934538,-0.0173053778807941,0.0087281787428112,-0.012315179467137,0.0108958014789577,0.011308562197092,0
2021-03-04,IPhone Demand Drives Q1 Growth For Apple Supplier Foxconn,HNHPF,0.0,0.9293478260869564,0.0073708879466376,-0.0251496372157546,0.0108958014789577,-0.0236405476003843,0.0192769623249715,0.0207317437354319,-0.1890140845070422,0
2021-03-10,Fisker CEO's Tweet Reveals Additional Details for Project Pear EV Collab,HNHPF,-0.0024450963995303,0.0297504798464491,0.0086314474940203,-0.0310633383063198,0.0207317437354319,0.0,0.0073708879466376,0.034313724553221,-0.1593662628145387,0
2021-03-16,Apple Supplier Foxconn Is Exploring North American EV Manufacturing Sites,HNHPF,0.0253456120449202,0.2558869701726844,0.0152046862569505,0.0130332014116139,0.034313724553221,-0.0024450963995303,0.0086314474940203,0.0280897944362519,0.0933333333333332,0
2021-03-16,The Market Was Mixed Today. Here's Why.,HNHPF,0.0253456120449202,0.2558869701726844,0.0152046862569505,0.0130332014116139,0.034313724553221,-0.0024450963995303,0.0086314474940203,0.0280897944362519,0.0933333333333332,0
2021-03-19,"Apple Supplier Foxconn In Talks To Make Batteries, EV Parts With Vietnam's VinFast: Report",HNHPF,-0.0368763068206168,-0.2009430540442509,0.0076503303551744,0.0280897944362519,0.0253456120449202,0.0152046862569505,0.0130332014116139,0.0416665886022884,-0.339083068542896,0
2021-03-19,Tesla On Geely's Mind As It Launches A High-End EV Line: Reuters,HNHPF,-0.0368763068206168,-0.2009430540442509,0.0076503303551744,0.0280897944362519,0.0253456120449202,0.0152046862569505,0.0130332014116139,0.0416665886022884,-0.339083068542896,0
2021-03-30,"Smartphone Maker Xiaomi Confirms EV Venture, Plans $10B Investment Over 10 Years",HNHPF,-0.0066372335424432,-0.3327044025157233,0.0044444110675863,0.0215663569364026,-0.0156423417900128,-0.0334774068209556,0.001081185472995,-0.0189308173915863,-0.0838831291234684,1
2021-03-30,"Apple Supplier Foxconn: Chip Supply Shortage Will Hurt Shipments, Last Through 2022",HNHPF,-0.0066372335424432,-0.3327044025157233,0.0044444110675863,0.0215663569364026,-0.0156423417900128,-0.0334774068209556,0.001081185472995,-0.0189308173915863,-0.0838831291234684,1
2021-03-30,"iPhone Maker Foxconn Q4 Earnings Drop YoY, Miss Street Estimates",HNHPF,-0.0066372335424432,-0.3327044025157233,0.0044444110675863,0.0215663569364026,-0.0156423417900128,-0.0334774068209556,0.001081185472995,-0.0189308173915863,-0.0838831291234684,1
2021-04-09,Nokia Launches Smartphones In Range Of $89-$415 Featuring 5G Technology,HNHPF,-0.0183066179150088,-0.4148506860371267,0.0045977265644399,0.0,0.0034601816754291,0.0069686493205136,-0.022701540169116,-0.0069930150441473,-0.3,1
2021-04-14,"The Global Chip Shortage: Worst-Hit Stocks And Industries, Potential Beneficiaries",HNHPF,-0.0127166689917309,-0.2791817087845969,0.0152581014384691,-0.0069930150441473,-0.0183066179150088,0.0045977265644399,0.0,0.0046838665553712,0.5943238731218699,2
2021-04-21,Apple Supplier Foxconn Slashes Planned Wisconsin Investment From $10B To $672M,HNHPF,0.0011627214561797,-0.462135922330097,-0.006928294852879,-0.0080183865462621,0.0174825073126558,0.0046838665553712,-0.0127166689917309,-0.0383276014549716,2.131768953068592,1
2021-04-21,A Peek Into The Markets: US Stock Futures Edge Lower Ahead Of Verizon Earnings,HNHPF,0.0011627214561797,-0.462135922330097,-0.006928294852879,-0.0080183865462621,0.0174825073126558,0.0046838665553712,-0.0127166689917309,-0.0383276014549716,2.131768953068592,1
2021-04-22,Fisker CEO Calls On US To Improve Incentives For Affordable EVs Under '75 And More For 55 And Less' Proposal,HNHPF,-0.0383276014549716,2.131768953068592,0.0011627214561797,-0.006928294852879,-0.0080183865462621,0.0174825073126558,0.0046838665553712,0.0241545359845334,0.3141210374639769,0
2021-05-03,Apple Supplier TSMC Expects To Catch Up With Customers' Chip Demand By June,HNHPF,-0.0281862555360568,0.3683420855213803,0.0,-0.0192306899177556,-0.0107016511894381,-0.0070837726521714,-0.0011791752970714,-0.0302647876346419,0.7571271929824561,1
2021-05-06,"Tesla, Apple Supplier Delta To Pour $7M In AI Semiconductor Startup Amid Chip Shortage",HNHPF,0.0280254004241262,-0.4627492130115425,0.0208062209482391,-0.0302647876346419,-0.0281862555360568,0.0,-0.0192306899177556,0.0371747678916434,3.763671875,0
2021-05-06,"Fisker, Which Won't Begin Production Until Late 2022, Says It's Not Hit By Chip Shortage",HNHPF,0.0280254004241262,-0.4627492130115425,0.0208062209482391,-0.0302647876346419,-0.0281862555360568,0.0,-0.0192306899177556,0.0371747678916434,3.763671875,0
2021-05-10,Apple Supply Chain Hit With COVID-19 Second Wave In India,HNHPF,-0.0346475409805516,-0.4186141861418614,0.0371747678916434,0.0280254004241262,0.0208062209482391,-0.0302647876346419,-0.0281862555360568,-0.0532177462881215,1.005641748942172,1
2021-05-11,iPhone 12 Production Sees Over 50% Slump At Apple Supplier Foxconn's Factory In India With COVID-19,HNHPF,-0.0532177462881215,1.005641748942172,-0.0346475409805516,0.0371747678916434,0.0280254004241262,0.0208062209482391,-0.0302647876346419,-0.0915033252750877,0.4834739803094234,1
2021-05-14,Apple Supplier Foxconn Reiterates Aggravating Semiconductor Chip Crisis Warning: Bloomberg,HNHPF,0.0357633572746425,-0.2909591555759523,0.0460431950675246,-0.0915033252750877,-0.0532177462881215,-0.0346475409805516,0.0371747678916434,-0.0544488103893378,2.520388349514563,1
2021-05-18,Why The Foxconn and Stellantis Mobile Drive Collaboration Is Important,HNHPF,0.0828651294649445,-0.7155727155727156,-0.0544488103893378,0.0357633572746425,0.0460431950675246,-0.0915033252750877,-0.0532177462881215,-0.0272373525112907,-0.7007110536522301,1
2021-06-02,"Apple Has Added More Suppliers In China Than Anywhere Else, Sidelining Political Concerns: SCMP",HNHPF,-0.026097321982753,-0.1475976494987901,0.0485075546174205,0.0024936820066974,-0.0110973280791133,0.0,0.0175658718563782,-0.0219245084867348,-0.6317923763179238,1
2021-06-07,"Apple Supplier Foxconn's May Revenue Falls Amid Rising COVID-19 Cases in Taiwan, After Q1 Profit Beat",HNHPF,-0.0197287114660081,0.4829097283085013,0.0099626306659292,-0.0219245084867348,-0.026097321982753,0.0485075546174205,0.0024936820066974,0.0012579176548204,0.6897163120567376,2
2021-06-23,Apple Supplier Foxconn Offers Record Cash Bonuses To Workers In Bid To Ramp Up iPhone 13 Production: Report,HNHPF,0.0322165210922158,-0.2936288088642659,-0.0102040714824144,-0.0101010001547909,-0.0161490765064146,-0.0024782319595993,-0.0110294569737575,0.0149812255177181,0.1529411764705881,0
2021-07-06,Apple Supplier Foxconn Sees 20% Surge In Q2 Revenue,HNHPF,0.0335402505611461,1.602536997885835,-0.006172857335691,0.002475293394559,-0.0024691814460356,0.0012360846488557,-0.0097919117725668,-0.0024036409614663,-0.3688058489033307,2
2021-07-06,What We Know About Apple's Next iPhone,HNHPF,0.0335402505611461,1.602536997885835,-0.006172857335691,0.002475293394559,-0.0024691814460356,0.0012360846488557,-0.0097919117725668,-0.0024036409614663,-0.3688058489033307,2
2021-07-14,Apple Said To Be Boosting iPhone Production In Anticipated Of High Demand,HNHPF,0.0084336083775709,0.0447761194029849,-0.0024036409614663,0.0024094323718091,0.0109623492327894,-0.0108434792266088,-0.0024036409614663,0.0107526701384399,0.726530612244898,0
2021-07-22,"Fisker To Begin Production Prototype Testing This Year, Lays Out Global Retail-Stores Plan",HNHPF,-0.0005073723951743,-0.3235533822330888,-0.0168471092164436,0.0060531601009201,-0.0305163859434003,0.0070922687535124,0.0107526701384399,-0.0012691067158111,-0.0698795180722892,2
2021-08-04,Apple Enlists More Asian Suppliers to Ramp Up iPhone 13 Production as Launch Schedule Looms: Report,HNHPF,-0.007490681276059,1.3644067796610169,-0.0062035106292853,0.0176768095882122,0.001264230040648,-0.0100125125796101,0.0269922545966971,0.0163522361855741,-0.2365591397849462,0
2021-08-12,iPhone Supplier Foxconn Sees Sales Correction Amid Holiday Season: Bloomberg,HNHPF,0.0089399636552669,0.5703883495145632,-0.0038168165505683,-0.0211705497553935,-0.0049566590745132,-0.0012376311397234,0.0163522361855741,-0.0151898370818177,-0.1761978361669243,1
2021-08-12,Apple Supplier Foxconn Aims To Begin Mass-Producing EVs In US Within 2 Years As Smartphone Sales Slump: Report,HNHPF,0.0089399636552669,0.5703883495145632,-0.0038168165505683,-0.0211705497553935,-0.0049566590745132,-0.0012376311397234,0.0163522361855741,-0.0151898370818177,-0.1761978361669243,1
2021-09-16,"Battery Swap Giant Gogoro Lands SPAC Deal, Has Eyes Set On China And India Expansion",HNHPF,-0.0050955716882091,-0.3200636942675159,0.0102960068888424,-0.0012853546694125,-0.0101781136375488,-0.0012705918952671,0.0234069653488862,-0.0051216052831414,-0.1756440281030444,1
2021-10-01,"Apple Supplier Foxconn Confirms Deal To Buy Lordstown Ohio Plant, Fisker PEAR Could Come Sooner",HNHPF,-0.002649022289226,0.6995515695067265,0.0053262633591655,-0.0157274191929971,-0.0192801910672106,0.0038709907965244,-0.0038560640082377,-0.0345285573234256,-0.0606860158311345,1
2021-10-06,Apple Supplier Pegatron Joins Hands With Microsoft For 5G Private Networks: Report,HNHPF,0.0054347466728561,-0.5785472972972974,0.0123796468273855,-0.0345285573234256,-0.002649022289226,0.0053262633591655,-0.0157274191929971,0.027027052680508,1.2845691382765532,0
2021-10-12,Apple Supplier Foxconn's First Electric Car Seen Being Shipped Ahead Of Unveiling,HNHPF,-0.0385108844726921,1.079331941544885,0.0051612563254148,0.0197368273389035,0.027027052680508,0.0054347466728561,0.0123796468273855,0.0120160260122277,-0.4528112449799196,0
2021-10-18,A Peek Into The Markets: US Stock Futures Down Ahead Of Earnings,HNHPF,0.0077022284179073,-0.0882647943831494,0.0277044519572797,0.0,0.0120160260122277,-0.0385108844726921,0.0051612563254148,-0.0038216787661569,-0.187018701870187,2
2021-10-18,"Elon Musk Milestone, Apple Event, Dogecoin Forecast, Foxconn EVs, Bitcoin ETF: 5 Key Headlines You May Have Missed From This Weekend",HNHPF,0.0077022284179073,-0.0882647943831494,0.0277044519572797,0.0,0.0120160260122277,-0.0385108844726921,0.0051612563254148,-0.0038216787661569,-0.187018701870187,2
2021-10-18,"Apple Supplier Foxconn Unveils 3 EVs Including Sedan, SUV, Bus: What You Need To Know",HNHPF,0.0077022284179073,-0.0882647943831494,0.0277044519572797,0.0,0.0120160260122277,-0.0385108844726921,0.0051612563254148,-0.0038216787661569,-0.187018701870187,2
2021-10-25,Apple Supplier Foxconn Said To Be In Talks With Indonesia For EV Investment,HNHPF,0.011553342626861,0.1460481099656356,0.0012852901824234,0.0012870089323533,-0.0063938358851513,-0.0038216787661569,0.0077022284179073,0.0050761085201163,0.4542728635682158,0
2021-10-25,A Peek Into The Markets: US Stock Futures Edge Higher; Facebook Earnings In Focus,HNHPF,0.011553342626861,0.1460481099656356,0.0012852901824234,0.0012870089323533,-0.0063938358851513,-0.0038216787661569,0.0077022284179073,0.0050761085201163,0.4542728635682158,0
2021-11-03,"Tesla, Nio Supplier CATL To Power Fisker's Ocean EV Under New Battery-Deal: What You Need To Know",HNHPF,0.0025707093388251,-0.547677261613692,-0.0063856700179917,0.0,-0.0113636406827547,0.0050761085201163,-0.005050471777297,0.0064102300218924,1.4756756756756757,0
2021-12-21,Apple Faces iPhone Production Disruption Again In India — This Time Over Food Poisoning,HNHPF,0.0233515800035974,-0.2854077253218884,-0.0122116059338059,0.015151466986802,-0.0307075922606629,0.0135318126827095,0.0054421409299278,0.0,-0.4129129129129129,2
2021-12-27,Foxconn Extends India iPhone Plant Closure For 3 Days Following A Week-Long Production Halt: Report,HNHPF,0.0107816676962289,0.2531280076997113,-0.0040268024292942,0.0,0.0233515800035974,-0.0122116059338059,0.015151466986802,0.0,1.2726574500768049,2
2022-01-04,"Fisker Sees $1.3B Revenue Potential From Over 23,500 Ocean Electric SUV Reservations",HNHPF,-0.001355089546517,-0.2647058823529411,-0.0013531201670642,-0.0013513594138739,-0.0172643119757085,0.0040000238144437,0.0,0.0407056027190575,1.1745454545454543,0
2022-01-12,Apple Supplier Foxconn Taps Autoware's AI Expertise In New Alliance,HNHPF,0.005361962388922,-0.3422619047619047,0.0081080886847582,-0.0237467109282366,-0.0026315945823373,-0.0091264556668334,0.0407056027190575,0.0133333458203075,0.1689291101055807,0
2022-02-14,Fisker Teases A New Launch In a Cryptic Tweet: Here's What Investors Are Guessing,HNHPF,-0.0268096101850383,0.5310344827586206,-0.017127835530474,-0.0013157972911687,0.0092961372355393,0.0066845318818835,0.0204638321694441,0.0220385602588872,-0.5105105105105106,0
2022-02-15,"Fisker Begins Taking Reservations For Its Sub-$30,000 PEAR Urban EV Due To 'Continued Demand'",HNHPF,0.0220385602588872,-0.5105105105105106,-0.0268096101850383,-0.017127835530474,-0.0013157972911687,0.0092961372355393,0.0066845318818835,-0.0067385845699801,0.9693251533742332,1
2022-03-03,"Foxconn, Luxshare Could Produce Apple Car, Speculation Suggests",HNHPF,-0.0136054547143662,0.9479905437352244,0.0137931163340188,-0.001377418654417,-0.0041151821557388,0.0096952793093485,-0.0176871116065855,0.0082758421199264,3.4308252427184467,0
2022-03-14,"China Restricts Activities In Shenzhen, Shanghai Following Covid-19 Resurgence",HNHPF,-0.035014003929209,-0.7288512012921462,-0.006954144166819,0.0213068744653308,0.0014224121658168,0.0144301011388501,-0.0519836199971105,0.0159651894194639,0.8428890543559195,0
2022-03-14,A Peek Into The Markets: US Stock Futures Higher; Crude Oil Down 4%,HNHPF,-0.035014003929209,-0.7288512012921462,-0.006954144166819,0.0213068744653308,0.0014224121658168,0.0144301011388501,-0.0519836199971105,0.0159651894194639,0.8428890543559195,0
