date,title,stock,close,volume,1_past_close,2_past_close,3_past_close,4_past_close,5_past_close,next_close,next_volume,label
2021-04-28,"Earnings Scheduled For April 28, 2021",HUM,-0.0226827014901925,0.4526564965807469,0.0059622808877861,-0.0055725651008168,0.0089507992412325,0.0004725090117394,0.0032731648079453,0.0205645802365035,-0.3632989317399964,0
2021-06-28,Biogen's Costly Alzheimer's Treatment May Face Restricted Medicare Access: WSJ,HUM,0.0071766778725528,-0.5013944464653813,0.0022235603399372,0.0051772910283733,0.0062651906999389,0.0004134152651087,0.0284532687666863,-0.0042549931690154,-0.1787451361867704,2
2021-07-28,"Earnings Scheduled For July 28, 2021",HUM,-0.0570908986863405,2.872504829362524,0.000406542726097,-0.0082976106980906,0.0162173540736907,0.0004746726118889,0.0064713010368417,-0.0228215970720024,-0.4255487196541403,1
2021-09-27,A Peek Into The Markets: US Stock Futures Mostly Higher; Crude Oil Rises Over 1%,HUM,0.0052391525690613,-0.2145969498910676,-0.0063270657933922,0.0027476116603126,-0.0009981202760313,-0.0083145603116419,-0.0090242838407431,-0.0149625484731584,0.3155339805825243,1
2021-11-03,A Peek Into The Markets: US Stock Futures Mixed; All Eyes On Fed Decision,HUM,0.0051191373771941,1.0490341753343235,-0.0052228960579006,-0.0078806815026516,-0.009495377851084,0.0195361074225295,-0.0181118014713389,-0.0128415128379972,-0.3452435888984112,1
2021-11-03,"5 Stocks To Watch For November 3, 2021",HUM,0.0051191373771941,1.0490341753343235,-0.0052228960579006,-0.0078806815026516,-0.009495377851084,0.0195361074225295,-0.0181118014713389,-0.0128415128379972,-0.3452435888984112,1
2021-11-10,5 Stocks Insiders Are Selling,HUM,-0.0041961734483024,-0.2523700555737169,-0.0090209864198829,0.002359718318422,-0.000264488262019,-0.0128415128379972,0.0051191373771941,-0.0044815216718008,0.0124617402710975,2
2022-02-03,A Peek Into The Markets: Nasdaq Futures Tumble Following Downbeat Earnings From Meta,HUM,0.0622850498070755,1.0139341199081735,0.0269786588242695,-0.0046369709756486,0.0163654123523084,0.0081713347328762,0.0158051934911338,0.0085402984657216,-0.4930413805900909,0
2022-04-01,House Passes Bill To Cap Out-of-Pocket Insulin Costs To No More Than $35/Month,HUM,0.0143392697709587,-0.468889360798471,-0.009604281814467,0.0028026113381007,0.0089645820205024,-0.0011250253747886,-0.0042980180151834,-0.0084275964149056,-0.1079568172730908,1
2022-04-05,Biden To Propose Change To Obamacare To Extend Subsidies For Families: WSJ,HUM,0.0126344954451624,0.1743612729717616,-0.0084275964149056,0.0143392697709587,-0.009604281814467,0.0028026113381007,0.0089645820205024,0.0131537216156751,0.0613231552162849,0
2022-04-27,"Earnings Scheduled For April 27, 2022",HUM,0.0298955002710028,0.2212599237034747,-0.0249813015977107,-0.0066370052783509,-0.0250921016089608,-0.0205589413808932,0.014824832081774,0.0352300949517412,0.0623047699451244,0
2022-05-17,"Q1 13F Roundup: How Buffett, Einhorn, Ackman And Others Adjusted Their Portfolios",HUM,-0.0008844705770107,0.2234273318872017,0.0047620215453962,0.0231966873824416,-0.0064623103634984,-0.0024722248457746,0.0195283382166939,-0.0466419142746875,0.6820921985815602,1
2022-07-27,"Earnings Scheduled For July 27, 2022",HUM,-0.0282969054198822,1.0281739130434784,0.0009963486926611,0.0057672734435019,0.0067325012544339,0.0041555525246257,-0.0234599795458971,0.0118323549194496,-0.384210827188018,0
2022-07-28,Meta Platforms To $255? Here Are 5 Other Price Target Changes for Thursday,HUM,0.0118323549194496,-0.384210827188018,-0.0282969054198822,0.0009963486926611,0.0057672734435019,0.0067325012544339,0.0041555525246257,-0.0041528683626937,-0.2357965094689936,2
2022-07-28,QUALCOMM To $175? Plus Barclays Predicts $570 For This Stock,HUM,0.0118323549194496,-0.384210827188018,-0.0282969054198822,0.0009963486926611,0.0057672734435019,0.0067325012544339,0.0041555525246257,-0.0041528683626937,-0.2357965094689936,2
2022-09-23,"Top Financial Media Stories Friday, September 23: Apple Resolves iPhone 14 Pro Camera Glitch, Credit Suisse Shares Tumble As It Looks For Capital Infusion, Boeing Penalized $200M For Misleading About 737 MAX Safety And More..",HUM,-0.0141928424404578,0.7481606681248758,0.0066851919273789,-0.0243790712088928,0.0036321935850247,0.0025611323104484,0.0051282777447201,-0.0087697386236624,-0.5088437695501337,1
2022-11-02,All Is Calm Ahead Of The Federal Reserve This Afternoon,HUM,0.0091796025784511,-0.0879188065541697,-0.0064328112477204,0.005857696976588,0.0189715435827508,0.0100166592811881,0.0182072014157512,0.0061117708612465,0.0499396701970773,0
2022-11-02,Investor Sentiment Decreases As US Stocks Fall For Second Straight Session,HUM,0.0091796025784511,-0.0879188065541697,-0.0064328112477204,0.005857696976588,0.0189715435827508,0.0100166592811881,0.0182072014157512,0.0061117708612465,0.0499396701970773,0
2022-11-17,Tesla Fame's Robot-Run ETF Is Now Betting Big On These Oil Stocks,HUM,0.0051392459778043,-0.0742022299115724,0.0091634543050096,-0.0322641513351069,0.0027813393962707,-0.0533226032496825,0.0087267922262697,0.0185291671650469,-0.0106935215946843,0
2022-12-16,"Jim Cramer Recommends These 5 Healthcare Stocks For 2023: 'Biggest Winners Were Boring, Consistent Operators'",HUM,-0.009656999047495,0.2898930804922333,-0.0250618483302884,-0.0029632884601674,-0.0130757762502251,-0.0064301838981484,-0.0254677312953549,0.0026016665816865,-0.5699614221666145,2
2023-01-30,"Why United Health, Humana And CVS Health Shares Are Moving Lower In Monday's After-Hours Session",HUM,0.0066847997765842,0.1307731104546436,-0.0353852599897769,-0.0056947470474871,0.0037373740269339,0.0117278706980272,-0.0055298613864934,0.0552473826949329,0.4439913342678732,0
2023-02-01,Investor Optimism Improves Ahead Of Fed's Decision,HUM,0.0030877800511064,-0.1193628099902921,0.0552473826949329,0.0066847997765842,-0.0353852599897769,-0.0056947470474871,0.0037373740269339,-0.0458035359673134,0.2998446660319687,1
2023-02-02,How Medicare Advantage Insurers Will Be Affected By Proposed 2024 Payment Cut,HUM,-0.0458035359673134,0.2998446660319687,0.0030877800511064,0.0552473826949329,0.0066847997765842,-0.0353852599897769,-0.0056947470474871,,,2
2023-02-02,"Nasdaq Futures Fly As Meta Keeps Tech Earnings' Buoyancy Intact: Will Apple, Amazon, Alphabet Toe In Line?",HUM,-0.0458035359673134,0.2998446660319687,0.0030877800511064,0.0552473826949329,0.0066847997765842,-0.0353852599897769,-0.0056947470474871,,,2
