date,title,stock,close,volume,1_past_close,2_past_close,3_past_close,4_past_close,5_past_close,next_close,next_volume,label
2022-11-15,"Nasdaq, S&P 500 Futures Skyrocket After Tamer PPI Data That Confirms Slowing Inflation, Walmart's Beat-And-Raise Q3",PARA,0.0513791653533419,1.0755826647017086,-0.0170122862009032,0.1351840611856922,0.0669672049037852,-0.063329277587695,0.0128282769251653,-0.0668724211571031,-0.3638261224006784,1
2022-11-17,"Ukraine Asserts It Does Not Take Blame For Poland Missile Attack, Crypto Exchange Gemini Suffers $485M In Outflows, FTX, Bahamas Regulator Lock Horns Over Control Of Bankruptcy Proceedings: Top Stories Thursday, Nov. 17",PARA,0.0148842246504092,-0.3299230622167796,-0.0668724211571031,0.0513791653533419,-0.0170122862009032,0.1351840611856922,0.0669672049037852,0.0135796035346438,-0.1995959346709643,0
2022-11-18,The Sam Bankman-Fried Movie Is Coming — And These Two Streaming Companies Are Considering Buying The Rights,PARA,0.0135796035346438,-0.1995959346709643,0.0148842246504092,-0.0668724211571031,0.0513791653533419,-0.0170122862009032,0.1351840611856922,-0.0075027446383455,-0.1738472802944179,1
2022-11-22,"Jack Ma's Ant Group Slapped With $1B Fine, Carl Icahn's Huge Short Position In GameStop, Novavax Culls COVID-19 Vaccine Alliance With GAVI: Top Stories Tuesday, Nov. 22",PARA,0.0334773733251498,0.3576318029689924,-0.0075027446383455,0.0135796035346438,0.0148842246504092,-0.0668724211571031,0.0513791653533419,0.0271681493460942,-0.2725882787469614,0
2022-11-28,"Fox Scores Big With Record-Breaking USA Vs. England, Michigan Vs. Ohio State Viewership",PARA,-0.0336513472818921,0.6069933818526689,0.0127162013692305,0.0271681493460942,0.0334773733251498,-0.0075027446383455,0.0135796035346438,0.026507259454112,0.0448398850456737,0
2022-11-28,Few Hours Left: Take Advantage Of These Amazing Streaming Deals Before Cyber Monday Is Over,PARA,-0.0336513472818921,0.6069933818526689,0.0127162013692305,0.0271681493460942,0.0334773733251498,-0.0075027446383455,0.0135796035346438,0.026507259454112,0.0448398850456737,0
2022-12-21,"Pandora's Box Office: Here's How Much Avatar Sequel Made, How It Stacks Up To The Original",PARA,0.0,-0.3655784166252412,-0.0023641249964914,-0.0225302229802162,-0.0198188562485761,-0.0878099126166831,-0.0036026667623164,0.0035545909921541,-0.1417726671415488,2
2022-12-22,YouTube Beats Apple To NFL Sunday Ticket Deal: Here's How Much They're Paying And Why It's Important,PARA,0.0035545909921541,-0.1417726671415488,0.0,-0.0023641249964914,-0.0225302229802162,-0.0198188562485761,-0.0878099126166831,-0.0165289943749656,0.1484502833835281,1
2022-12-27,Disney's 'Avatar: The Way Of Water' Braves Winter Storm To Gross $82M In 4-Day US Weekend Box Office,PARA,-0.0084033389476879,-0.1501889363810939,-0.0165289943749656,0.0035545909921541,0.0,-0.0023641249964914,-0.0225302229802162,-0.0248183769660612,0.0714485305730703,1
2023-01-05,2022 Box Office Performance: Year Of The Sequel — Top 10 Movies And Which Stocks To Watch,PARA,0.0086486556431908,-0.3526340840579929,0.0837726361789812,0.0112559760703288,0.0065592650049892,0.0409683427558988,-0.0248183769660612,0.01982859074294,-0.0150899796932988,0
2023-01-24,Can Netflix Win A Best Picture Like Apple? Will Big Box Office Movies Have Their Day In The Awards Spotlight Again? 2 Big Questions From The Academy Award Nominations,PARA,-0.0155954866368258,-0.3591354390897509,0.0423645414829554,0.0373020359954372,-0.0224775995453082,-0.0300386680588328,0.0289132109965131,0.0528084683953755,1.154150671785029,0
2023-02-10,"The Super Bowl LVII Commercials List: From A Breaking Bad Reunion To Ozzy Osbourne, The Celebrities And 21 Stocks To Watch",PARA,-0.009178573570744,-0.2462717783592906,-0.0280999212022177,-0.0398286928341209,-0.0295094934360092,-0.0219512947358846,-0.0257425277773657,0.0333487997906887,0.1495334340031748,0
2023-02-13,Super Bowl Commercials 2023: The Complete List Of Super Bowl LVII Ads And The Companies Behind Them,PARA,0.0333487997906887,0.1495334340031748,-0.009178573570744,-0.0280999212022177,-0.0398286928341209,-0.0295094934360092,-0.0219512947358846,0.00627528276371,-0.1272300627617412,0
2023-02-14,Warren Buffett's Berkshire Hathaway Bites More Into Apple Stock In Q4 — Makes Massive Stake Sale In Chip Company,PARA,0.00627528276371,-0.1272300627617412,0.0333487997906887,-0.009178573570744,-0.0280999212022177,-0.0398286928341209,-0.0295094934360092,0.0930957601770292,2.0769923457901847,0
2023-02-16,"Inflation Up, Jobless Claims Down",PARA,-0.0423798189405355,0.1178059283414858,0.0930957601770292,0.00627528276371,0.0333487997906887,-0.009178573570744,-0.0280999212022177,0.008085143333478,-0.3217625145866372,0
2023-02-16,"Paramount Adds 9.9M Streaming Subscribers In Q4: How It Stacks Up To Netflix, Disney+ And Other Rivals",PARA,-0.0423798189405355,0.1178059283414858,0.0930957601770292,0.00627528276371,0.0333487997906887,-0.009178573570744,-0.0280999212022177,0.008085143333478,-0.3217625145866372,0
2023-02-21,"Benzinga Buzz: Latest On Marvel, Disney, Star Wars, Paramount, Nintendo World & More",PARA,-0.0320811108037044,-0.3193300944639597,0.008085143333478,-0.0423798189405355,0.0930957601770292,0.00627528276371,0.0333487997906887,0.0161360474526337,-0.2854446172791496,0
2023-03-03,Wall Street's Most Accurate Analysts Say Buy These 3 Tech And Telecom Stocks With Over 3% Dividend Yields,PARA,0.0107382630336738,-0.0571100373325342,0.0290056271270382,0.0140054999944121,-0.0303304351777849,-0.009417015435397,-0.0486348689276833,-0.0243470634831308,0.2238171537534594,1
2023-03-07,"'Unvarnished Examination' Of Elon Musk, New Documentary From Oscar-Winner Coming: Here's What Tesla CEO Says",PARA,-0.025408367374897,-0.1606920654843701,-0.0243470634831308,0.0107382630336738,0.0290056271270382,0.0140054999944121,-0.0303304351777849,,,2
