date,title,stock,close,volume,1_past_close,2_past_close,3_past_close,4_past_close,5_past_close,next_close,next_volume,label
2013-10-25,Mid-Afternoon Market Update: Markets Float Higher on Relatively Thin Volume,RMD,-0.1200498730154384,2.716033938866529,-0.0140080457427359,0.0035142027873842,0.0101171323241127,0.0021345715608824,0.0062646469425484,0.0117055591065156,-0.4578106933243564,0
2013-10-25,Mid-Day Market Update: Microsoft Jumps On Upbeat Results; Synaptics Shares Decline,RMD,-0.1200498730154384,2.716033938866529,-0.0140080457427359,0.0035142027873842,0.0101171323241127,0.0021345715608824,0.0062646469425484,0.0117055591065156,-0.4578106933243564,0
2013-10-25,Mid-Morning Market Update: Markets Open Higher; Procter & Gamble Net Profit Surges 7.6 percent,RMD,-0.1200498730154384,2.716033938866529,-0.0140080457427359,0.0035142027873842,0.0101171323241127,0.0021345715608824,0.0062646469425484,0.0117055591065156,-0.4578106933243564,0
2013-10-25,Mid-Morning Market Update: Markets Open Higher; Procter & Gamble Net Profit Surges 7.6%,RMD,-0.1200498730154384,2.716033938866529,-0.0140080457427359,0.0035142027873842,0.0101171323241127,0.0021345715608824,0.0062646469425484,0.0117055591065156,-0.4578106933243564,0
2014-10-24,Morning Market Movers ,RMD,0.090565986157455,1.5358938789665335,0.0042109403720116,-0.0108291501589157,0.0208333884239946,0.0057731133175138,0.0112429346778706,-0.0090349482325517,-0.4589900509419126,1
2016-01-21,"Earnings Recap For January 21, 2016",RMD,0.0052083766813757,-0.2827215068229867,0.0018635006974587,0.0069432101857709,-0.016245156709441,0.0197667336499947,-0.0001883428302299,0.0653219607908985,1.1695069667738478,0
2016-01-21,Earnings Recap For January 21,RMD,0.0052083766813757,-0.2827215068229867,0.0018635006974587,0.0069432101857709,-0.016245156709441,0.0197667336499947,-0.0001883428302299,0.0653219607908985,1.1695069667738478,0
2016-01-21,"Earnings Scheduled For January 21, 2016",RMD,0.0052083766813757,-0.2827215068229867,0.0018635006974587,0.0069432101857709,-0.016245156709441,0.0197667336499947,-0.0001883428302299,0.0653219607908985,1.1695069667738478,0
2016-08-23,"The Market In 5 Minutes: S&P And Dow Unchanged, Monsanto Takeover Talks Heat Up Again",RMD,-0.035253846797681,3.73079955842927,-0.0041389203467683,0.0071872397986876,0.0159168100002569,-0.0088287222517781,-0.0167924917588472,0.0101013846132385,-0.5093339555970398,0
2017-01-23,"Earnings Scheduled For January 23, 2017",RMD,-0.0007854868689926,1.3153270419785228,0.0119235714772638,-0.0061620740194318,-0.0138671374360641,-0.0176029936485768,0.0166510493373135,0.0962264995336368,1.985874912157414,0
2017-07-21,Benzinga's Option Alert Recap From July 21,RMD,-0.0132001401821598,-0.347855158934266,-0.0003844070612012,0.0069658517759332,-0.0012880980472015,0.0003866310954907,0.0060940987329196,0.0024674613477411,-0.1597129111128638,2
2017-08-02,25 Stocks Moving In Wednesday's Pre-Market Session,RMD,-0.0641454105029865,3.2806603773584904,0.0046676367856146,-0.0034884630196714,-0.0009036882398103,-0.0025754956256999,-0.0002573162024515,0.012963654109235,-0.7144628099173553,0
2018-01-23,Mid-Afternoon Market Update: Crude Oil Up 1.4%; ResMed Shares Rise On Earnings Beat,RMD,0.1467258256311661,3.193052951156353,-0.0131935330429399,-0.0012390818643324,0.0006766331430643,0.0099020174524464,0.0009112695468462,-0.0012954244758317,-0.5903573406022403,2
2018-01-23,Mid-Day Market Update: Netflix Climbs Following Q4 Results; Insmed Shares Plummet,RMD,0.1467258256311661,3.193052951156353,-0.0131935330429399,-0.0012390818643324,0.0006766331430643,0.0099020174524464,0.0009112695468462,-0.0012954244758317,-0.5903573406022403,2
2018-01-23,Mid-Morning Market Update: Markets Mixed; Johnson & Johnson Beats Q4 Views,RMD,0.1467258256311661,3.193052951156353,-0.0131935330429399,-0.0012390818643324,0.0006766331430643,0.0099020174524464,0.0009112695468462,-0.0012954244758317,-0.5903573406022403,2
2018-06-07,"Benzinga's Daily Biotech Pulse: Johnson & Johnson to Dispose Sterilization Products Business, Mixed Results From Protesostasis' Cystic Fibrosis Study",RMD,-0.007031432040415,-0.0086422560836934,0.0104205186798524,0.0040901330900777,0.0151604759476049,0.0072947415121165,0.0023400068100087,0.0083088642831494,-0.2080752466161963,0
2018-06-14,"Benzinga's Daily Biotech Pulse: FDA Nods For Teligent And Keytruda, Sonoma's Q4 Miss, Sage Inks Deal With Japan's Shionogi",RMD,-0.0003744672659488,0.1959923664122138,-0.0014024880170256,0.0036598593457595,-0.0021538179841074,0.0083088642831494,-0.007031432040415,-0.0089921509589908,0.6120951013243976,1
2018-07-11,"Benzinga's Daily Biotech Pulse: Pfizer To Defer Price Hikes, Idera-BioCryst Merger Falls Through, ArQule To Offer Shares",RMD,-0.0039814416651215,-0.052503711701984,0.0071807975182267,0.0038382619245418,0.0148204677936902,0.0168084181713203,-0.0025053676837407,0.0134794403626135,-0.0306267806267805,0
2018-07-18,"Benzinga's Daily Biotech Pulse: Novartis Earnings, J&J's HIV Cocktail Clears FDA Hurdle, Cara To Offer Shares",RMD,-0.0078626375899556,-0.0992792057663538,0.0037625321610001,-0.0013745245518623,0.0009172878674805,0.0134794403626135,-0.0039814416651215,0.0026723176398411,-0.0670391061452514,2
2018-08-30,"The Daily Biotech Pulse: Verastem Gets New CFO, Mesoblast Earnings, Vertex's Precision Medicine Collaboration",RMD,0.00017814274195,-0.3357086302454474,0.0076211000028953,0.0071338432355834,0.0168962808053088,0.0060046123875825,0.0093240623950618,-0.0088079681644785,0.7461263408820025,1
2018-08-31,"The Daily Biotech Pulse: FDA Blessings for Merck's HIV Drug Combo, Veracyte's Test Gets Medicare Coverage",RMD,-0.0088079681644785,0.7461263408820025,0.00017814274195,0.0076211000028953,0.0071338432355834,0.0168962808053088,0.0060046123875825,0.0039494787132157,-0.2427303754266211,2
2018-09-14,"The Daily Biotech Pulse: FDA Nod For STAAR, Supernus Opens Wallet, Principia Biopharma To Debut",RMD,0.0013149405271781,-0.3152658662092624,0.0217643070721156,0.0028744511276508,-0.006070966146739,-0.0002677055335678,0.0009826225462417,-0.0128686589915382,0.1299265197060788,1
2018-09-27,"The Daily Biotech Pulse: Hologic Goes Shopping, Johnson & Johnson Snaps Ties With Geron",RMD,-0.0083081446222078,-0.4716833890746934,0.0016469493997601,0.0120187379749472,0.0014055905835212,0.0030842300968543,0.0077256467315598,0.0065452328851292,0.1903355138214812,0
2018-10-02,"The Daily Biotech Pulse: TransEnterix's Positive Pre-Announcement, Merit Medical Opens Wallet, GW Pharma To Offer ADS Shares",RMD,-0.0112875127892847,1.039808917197452,-0.001474077686018,0.0065452328851292,-0.0083081446222078,0.0016469493997601,0.0120187379749472,-0.0186177400226159,-0.2293780900338277,1
2018-10-25,"The Daily Biotech Pulse: AbbVie Takes Full Control Of Cystic Fibrosis Program, Amgen Slashes Cholesterol Drug Price",RMD,0.0044869208665747,0.7615419094576423,-0.0255387479791467,-0.0194876670591506,-0.0033988566723782,-0.0195180155199938,-0.0152822907977544,0.0568528525424658,0.656403731976251,0
2019-01-17,"The Daily Biotech Pulse: FDA Panel Backs Amgen's Hypertension Drug, Adamis Allergy Drug Launched In US",RMD,0.004448702312654,-0.1129917657822506,0.0105473472287707,0.0184010391825264,-0.0107133352685772,-0.0050264223911975,0.0073330713324957,0.0036621429132202,0.3260701392470346,2
2019-01-24,9 Stocks Moving In Thursday's After-Hours Session,RMD,0.0006826346098858,0.1315656139165681,-0.0021281535444362,-0.0031397672622799,0.0036621429132202,0.004448702312654,0.0105473472287707,-0.1938621282251925,7.777611940298508,1
2019-01-24,"Earnings Scheduled For January 24, 2019",RMD,0.0006826346098858,0.1315656139165681,-0.0021281535444362,-0.0031397672622799,0.0036621429132202,0.004448702312654,0.0105473472287707,-0.1938621282251925,7.777611940298508,1
2019-01-25,35 Stocks Moving In Friday's Mid-Day Session,RMD,-0.1938621282251925,7.777611940298508,0.0006826346098858,-0.0021281535444362,-0.0031397672622799,0.0036621429132202,0.004448702312654,-0.0317259089600779,-0.4491583064104744,1
2019-01-25,21 Stocks Moving In Friday's Pre-Market Session,RMD,-0.1938621282251925,7.777611940298508,0.0006826346098858,-0.0021281535444362,-0.0031397672622799,0.0036621429132202,0.004448702312654,-0.0317259089600779,-0.4491583064104744,1
2019-01-28,55 Biggest Movers From Yesterday,RMD,-0.0317259089600779,-0.4491583064104744,-0.1938621282251925,0.0006826346098858,-0.0021281535444362,-0.0031397672622799,0.0036621429132202,0.0052426336815756,-0.2762154653495909,0
2019-06-20,"The Daily Biotech Pulse: DiaMedica Reports Positive Data For Chronic Kidney Disease Drug, Eloxx Offering, IPO Deluge",RMD,0.0226480308532279,-0.0331804281345565,0.0076067476437591,0.0095359558606444,0.0034719542936647,-0.0113026379322191,-0.0007530558703071,-0.0259594475594135,0.743476198007275,1
2019-06-21,"The Daily Biotech Pulse: ContraVir's Volatile Ride Continues, Late-Stage Disappointment For Exelixis, Regeneron-Sanofi Breathe Easy",RMD,-0.0259594475594135,0.743476198007275,0.0226480308532279,0.0076067476437591,0.0095359558606444,0.0034719542936647,-0.0113026379322191,0.0091614439733844,-0.5871734397677795,0
2019-07-05,"The Daily Biotech Pulse: FDA Approves Karyopharm's Blood Cancer, Grifols' Immunodeficiency Drug; ESMO, ISTH Conferences In The Spotlight",RMD,0.0036326186900734,-0.1642461050963823,0.004133662837441,-0.0031511986584659,0.0141769184345981,0.0118573652790412,0.0092049431141771,-0.004182504909304,0.6527646129541864,2
2019-07-26,Companies That Achieved 52-Week Highs Friday,RMD,0.0244670914985563,1.2673604541154209,-0.012912493494298,0.0131632953349845,0.0015368103208075,0.0014579139987533,-0.0104200338233085,0.0200204777157844,-0.3045147291996996,0
2019-08-13,Stocks That Hit 52-Week Highs Of Tuesday,RMD,0.0256820567839406,0.2385024266235267,0.0015979808574062,-7.61084953847524e-05,0.0186821960016534,-0.0033220620008805,0.0199366826639415,-0.02563184079834,-0.0849038999813398,1
2019-08-14,"The Daily Biotech Pulse: Regeneron's Bad Cholesterol Drug Aces Late-Stage Trial, Oncolytics Offering",RMD,-0.02563184079834,-0.0849038999813398,0.0256820567839406,0.0015979808574062,-7.61084953847524e-05,0.0186821960016534,-0.0033220620008805,0.0089977994131889,-0.3417618270799347,0
2019-10-25,Stocks That Hit 52-Week Highs On Friday,RMD,0.1294134268759272,2.1833721833721835,0.0078114103248818,0.0017387908055064,-0.0306467146796646,-0.0052585288366056,-0.0031908169325859,0.0082490099512868,-0.5146448620942152,0
2019-10-30,"The Daily Biotech Pulse: Novartis Program Placed On Partial Clinical Hold, Adcom Snub For Amag, Amgen Earnings",RMD,0.0037496806528931,-0.2055546031201782,0.0084564208046011,0.0082490099512868,0.1294134268759272,0.0078114103248818,0.0017387908055064,0.004686511597171,0.5211480362537764,2
2019-11-01,Stocks That Hit 52-Week Highs On Friday,RMD,-0.0033126764029889,-0.3542346432118031,0.004686511597171,0.0037496806528931,0.0084564208046011,0.0082490099512868,0.1294134268759272,0.0004074512487455,0.2904217926186292,2
2019-11-01,"The Daily Biotech Pulse: Amgen Takes 20.5% Stake In BeiGene, Paratek's Mixed Clinical Readout, CareDx Slips On Guidance",RMD,-0.0033126764029889,-0.3542346432118031,0.004686511597171,0.0037496806528931,0.0084564208046011,0.0082490099512868,0.1294134268759272,0.0004074512487455,0.2904217926186292,2
2019-11-20,Stocks That Hit 52-Week Highs On Wednesday,RMD,0.0016733229083698,0.1466334164588529,0.0108945416837078,0.0046227659760764,0.01155283866706,0.0009635834402395,0.0078389039713364,-0.0220527837768585,0.3366681165724228,1
2019-11-21,"The Daily Biotech Pulse: Patent Win For Cellectis, Hepion Proves Efficacy In Animal Model, Job Cuts At Neon",RMD,-0.0220527837768585,0.3366681165724228,0.0016733229083698,0.0108945416837078,0.0046227659760764,0.01155283866706,0.0009635834402395,-0.0074482484847,-0.0465343312723722,1
2019-12-06,Stocks That Hit 52-Week Highs On Friday,RMD,0.0027298433591371,-0.405070640603832,0.0001997031760414,0.0045492571818666,0.0030870469953097,-0.0039437829685986,-0.0081548586850168,-0.0084330742040068,0.2726089785296031,1
2019-12-12,Stocks That Hit 52-Week Highs On Thursday,RMD,0.0117624729273322,0.0880518234165066,0.0100681959447159,-0.0022768612559943,-0.0084330742040068,0.0027298433591371,0.0001997031760414,0.0090640571315501,0.2884233737596471,0
2019-12-13,Stocks That Hit 52-Week Highs On Friday,RMD,0.0090640571315501,0.2884233737596471,0.0117624729273322,0.0100681959447159,-0.0022768612559943,-0.0084330742040068,0.0027298433591371,0.0154265161353153,0.7485880540818073,0
2019-12-13,"The Daily Biotech Pulse: Second Time's The Charm For Sarepta, Pfizer's Xeljanz Snags Third Approval, NewLink Genetics Rejects Competing Offer",RMD,0.0090640571315501,0.2884233737596471,0.0117624729273322,0.0100681959447159,-0.0022768612559943,-0.0084330742040068,0.0027298433591371,0.0154265161353153,0.7485880540818073,0
2019-12-16,Stocks That Hit 52-Week Highs On Tuesday,RMD,0.0154265161353153,0.7485880540818073,0.0090640571315501,0.0117624729273322,0.0100681959447159,-0.0022768612559943,-0.0084330742040068,0.0030770342013073,-0.4983850445336204,2
2019-12-17,Stocks That Hit 52-Week Highs On Tuesday,RMD,0.0030770342013073,-0.4983850445336204,0.0154265161353153,0.0090640571315501,0.0117624729273322,0.0100681959447159,-0.0022768612559943,-0.0029395786177259,0.4950243902439024,2
2019-12-17,"The Daily Biotech Pulse: Roche Gets US Antitrust Clearance For Spark Purchase, An Orphan Drug Designation For Prevail, Dynavax Names CEO",RMD,0.0030770342013073,-0.4983850445336204,0.0154265161353153,0.0090640571315501,0.0117624729273322,0.0100681959447159,-0.0022768612559943,-0.0029395786177259,0.4950243902439024,2
2019-12-18,Stocks That Hit 52-Week Highs On Wednesday,RMD,-0.0029395786177259,0.4950243902439024,0.0030770342013073,0.0154265161353153,0.0090640571315501,0.0117624729273322,0.0100681959447159,0.0001279926815469,-0.3910206212477159,2
2019-12-18,"The Daily Biotech Pulse: Positive Adcom Verdict For Merck, Homology Medicine Slips On Mixed Gene Therapy Efficacy Data",RMD,-0.0029395786177259,0.4950243902439024,0.0030770342013073,0.0154265161353153,0.0090640571315501,0.0117624729273322,0.0100681959447159,0.0001279926815469,-0.3910206212477159,2
2019-12-19,"The Daily Biotech Pulse: Seattle Genetics' Bladder Cancer Drug Gets FDA Nod, Paratek Wins Contract For Antibiotic",RMD,0.0001279926815469,-0.3910206212477159,-0.0029395786177259,0.0030770342013073,0.0154265161353153,0.0090640571315501,0.0117624729273322,-0.0007048726074148,1.3621945992284612,2
2019-12-20,Stocks That Hit 52-Week Highs On Friday,RMD,-0.0007048726074148,1.3621945992284612,0.0001279926815469,-0.0029395786177259,0.0030770342013073,0.0154265161353153,0.0090640571315501,-0.0015391072756265,-0.6288332426056977,2
2020-01-09,Stocks That Hit 52-Week Highs On Thursday,RMD,0.0083830289206334,-0.0633951137320977,0.0072188794385805,-0.0056402432908456,0.0047655505729151,-0.0052528949418003,0.0073563249963872,-0.0043787863740192,-0.1164830222621992,2
2020-01-14,"The Daily Biotech Pulse: PhaseBio To Buy Hypertension Asset, Stemline Falls On Q4 Pre-Announcement, FDA Panel To Review Nektar's Opioid Drug",RMD,0.000315729416034,-0.1863920750782064,0.0087960889424443,-0.0043787863740192,0.0083830289206334,0.0072188794385805,-0.0056402432908456,0.0025267185585851,0.3101570009612304,2
2020-01-15,Stocks That Hit 52-Week Highs On Wednesday,RMD,0.0025267185585851,0.3101570009612304,0.000315729416034,0.0087960889424443,-0.0043787863740192,0.0083830289206334,0.0072188794385805,0.0126635747897523,0.7737833211054048,0
2020-01-16,Stocks That Hit 52-Week Highs On Thursday,RMD,0.0126635747897523,0.7737833211054048,0.0025267185585851,0.000315729416034,0.0087960889424443,-0.0043787863740192,0.0083830289206334,-0.0009953968130944,-0.3439955880325382,2
2020-01-17,Stocks That Hit 52-Week Highs On Friday,RMD,-0.0009953968130944,-0.3439955880325382,0.0126635747897523,0.0025267185585851,0.000315729416034,0.0087960889424443,-0.0043787863740192,0.0085321196683876,0.0645229087852039,0
2020-01-22,Stocks That Hit 52-Week Highs On Wednesday,RMD,0.0150672721665801,-0.237314906219151,0.0085321196683876,-0.0009953968130944,0.0126635747897523,0.0025267185585851,0.000315729416034,-0.0181896458733814,0.3769091379756666,1
2020-01-22,"The Daily Biotech Pulse: Johnson & Johnson Earnings, FDA Nod For Horizon Therapeutics, Slew Of Secondary Offerings",RMD,0.0150672721665801,-0.237314906219151,0.0085321196683876,-0.0009953968130944,0.0126635747897523,0.0025267185585851,0.000315729416034,-0.0181896458733814,0.3769091379756666,1
2020-01-30,"The Daily Biotech Pulse: Sanofi Reports Positive Readout, Tonix Vaccine Candidate Aces Animal Study, Hologix's Weak Guidance",RMD,-0.0024118620050294,0.0837998600419873,0.0155537938775385,0.0166856551342864,-0.0108996943625434,0.0061962009408436,-0.0181896458733814,-0.0391076387108638,0.8684422921711057,1
2020-02-04,Stocks That Hit 52-Week Highs On Tuesday,RMD,0.0227414485618657,-0.03578231292517,0.0262312240680036,-0.0391076387108638,-0.0024118620050294,0.0155537938775385,0.0166856551342864,0.0053339483908814,-0.2157471426555665,0
2020-02-05,Stocks That Hit 52-Week Highs On Wednesday,RMD,0.0053339483908814,-0.2157471426555665,0.0227414485618657,0.0262312240680036,-0.0391076387108638,-0.0024118620050294,0.0155537938775385,0.0165135937004348,-0.3173803526448362,0
2020-02-05,"The Daily Biotech Pulse: Merck Spins Off Slow-Growth Businesses, ZioPharm Announces Offering, PhaseBio Data",RMD,0.0053339483908814,-0.2157471426555665,0.0227414485618657,0.0262312240680036,-0.0391076387108638,-0.0024118620050294,0.0155537938775385,0.0165135937004348,-0.3173803526448362,0
2020-02-06,"The Daily Biotech Pulse: Tonix Slumps On Failed Study, Applied Genetic Announces Offering, Beam Therapeutics, PPD Price IPOs",RMD,0.0165135937004348,-0.3173803526448362,0.0053339483908814,0.0227414485618657,0.0262312240680036,-0.0391076387108638,-0.0024118620050294,0.0055716299183603,0.2258829731154454,0
2020-02-07,"The Daily Biotech Pulse: Assertio To Sell Opioid Pain Drug, Milestone Payment For Aduro, Myriad Genetics CEO Resigns",RMD,0.0055716299183603,0.2258829731154454,0.0165135937004348,0.0053339483908814,0.0227414485618657,0.0262312240680036,-0.0391076387108638,0.0100898146204329,0.0481616856589981,0
2020-02-10,Stocks That Hit 52-Week Highs On Monday,RMD,0.0100898146204329,0.0481616856589981,0.0055716299183603,0.0165135937004348,0.0053339483908814,0.0227414485618657,0.0262312240680036,0.0066978160914035,-0.2683076923076923,0
2020-02-11,Stocks That Hit 52-Week Highs On Tuesday,RMD,0.0066978160914035,-0.2683076923076923,0.0100898146204329,0.0055716299183603,0.0165135937004348,0.0053339483908814,0.0227414485618657,-0.0068980349648366,0.5562097000280348,1
2020-02-11,"The Daily Biotech Pulse: LogicBio Slapped With Clinical Hold, Agile Inks Debt Deal Ahead of Twirla Approval, Gilead Builds Stake In Sierra Oncology",RMD,0.0066978160914035,-0.2683076923076923,0.0100898146204329,0.0055716299183603,0.0165135937004348,0.0053339483908814,0.0227414485618657,-0.0068980349648366,0.5562097000280348,1
2020-02-14,Stocks That Hit 52-Week Highs On Friday,RMD,0.0098353655999448,-0.3605865809562073,0.0122712838977427,-0.0068980349648366,0.0066978160914035,0.0100898146204329,0.0055716299183603,-0.0101926384348634,1.002827521206409,1
2020-02-14,"The Daily Biotech Pulse: Epizyme's Tazemetostat sNDA Accepted For Priority Review, Eisai To Withdraw Weight Loss Drug, Sol-Gel Prices Offering",RMD,0.0098353655999448,-0.3605865809562073,0.0122712838977427,-0.0068980349648366,0.0066978160914035,0.0100898146204329,0.0055716299183603,-0.0101926384348634,1.002827521206409,1
2020-02-19,"The Daily Biotech Pulse: FDA Snub For Merck, Priority Review For Roche's Tecentriq sBLA",RMD,0.0104118521133591,-0.4070588235294118,-0.0101926384348634,0.0098353655999448,0.0122712838977427,-0.0068980349648366,0.0066978160914035,-0.003510061788121,-0.2309523809523809,2
2020-02-20,"The Daily Biotech Pulse: Heron Pain Drug Review Extended, Disappointment For Teva In Tourette Syndrome Study",RMD,-0.003510061788121,-0.2309523809523809,0.0104118521133591,-0.0101926384348634,0.0098353655999448,0.0122712838977427,-0.0068980349648366,-0.0120456454985755,0.541795665634675,1
2020-04-30,"The Daily Biotech Pulse: FDA Nod For GlaxoSmithKline, Hologic To Launch Coronavirus Test, Amarin's Strong Q1",RMD,-0.0063336137461625,0.4732676465837506,-0.0120718752220564,-0.0279534283805219,0.0109936440131384,0.0143009173828176,-0.0136089876161871,0.0241438486996874,0.389979168950773,0
2020-06-23,"The Daily Biotech Pulse: Sanofi Expedites COVID-19 Vaccine Timeline, Apyx Cleared For Market Expansion, Miragen's Positive Readout",RMD,0.0158560317545086,-0.2118607649333906,0.0369965024870071,-0.0058709722136666,0.007772842653928,0.020178489399167,0.0319998614815217,-0.000494627253799,0.1296346782988005,2
2020-06-23,Stocks That Hit 52-Week Highs On Tuesday,RMD,0.0158560317545086,-0.2118607649333906,0.0369965024870071,-0.0058709722136666,0.007772842653928,0.020178489399167,0.0319998614815217,-0.000494627253799,0.1296346782988005,2
2020-07-01,"The Daily Biotech Pulse: T2 Biosystems Launches COVID-19 Test, Akero Aces Midstage NASH Study, Aravive Added to Russell Indexes",RMD,-0.0059373848341587,0.379813886900501,0.0195411351893886,0.0144911031431154,-0.0035963676085083,0.024414486378598,-0.000494627253799,0.0084878988122378,-0.353496576053123,0
2020-07-02,Stocks That Hit 52-Week Highs On Thursday,RMD,0.0084878988122378,-0.353496576053123,-0.0059373848341587,0.0195411351893886,0.0144911031431154,-0.0035963676085083,0.024414486378598,0.0059226586268015,-0.0065800032097577,0
2020-07-06,Stocks That Hit 52-Week Highs On Monday,RMD,0.0059226586268015,-0.0065800032097577,0.0084878988122378,-0.0059373848341587,0.0195411351893886,0.0144911031431154,-0.0035963676085083,-0.0111042201990761,-0.1189014539579967,1
2020-07-07,"The Daily Biotech Pulse: Novavax Lands $1.6B For COVID-19 Vaccine, Amgen Prevails In Avastin Biosimilar Lawsuit, Cellectis Study Placed On Clinical Hold",RMD,-0.0111042201990761,-0.1189014539579967,0.0059226586268015,0.0084878988122378,-0.0059373848341587,0.0195411351893886,0.0144911031431154,0.0065284048831473,-0.1235790245691236,0
2020-07-15,Stocks That Hit 52-Week Highs On Wednesday,RMD,0.0128693382092528,-0.0383979423112254,0.0369505246598973,-0.0208236637999026,-0.0082607703210348,0.0050332895852793,0.0065284048831473,-0.008757358224142,-0.2821933511654566,1
2020-07-16,"The Daily Biotech Pulse: Mallinckrodt Gets FDA Panel Backing, Regulatory Setback For Tricida, Relay Therapeutics IPO",RMD,-0.008757358224142,-0.2821933511654566,0.0128693382092528,0.0369505246598973,-0.0208236637999026,-0.0082607703210348,0.0050332895852793,0.0162392834651357,0.3763641203087569,0
2020-07-21,Stocks That Hit 52-Week Highs On Tuesday,RMD,0.0068469451267516,0.3825697735650342,0.0201508491537427,0.0162392834651357,-0.008757358224142,0.0128693382092528,0.0369505246598973,0.0045498736946465,-0.0253285088554561,2
2020-07-22,Stocks That Hit 52-Week Highs On Wednesday,RMD,0.0045498736946465,-0.0253285088554561,0.0068469451267516,0.0201508491537427,0.0162392834651357,-0.008757358224142,0.0128693382092528,-0.0061850729889597,-0.1588511137162954,1
2020-07-23,Stocks That Hit 52-Week Highs On Thursday,RMD,-0.0061850729889597,-0.1588511137162954,0.0045498736946465,0.0068469451267516,0.0201508491537427,0.0162392834651357,-0.008757358224142,-0.0079388430660611,-0.1663182346109175,1
2020-10-29,"The Daily Biotech Pulse: Novartis Acquires Gene Therapy Company, Moderna's Japanese Vaccine Supply Deal",RMD,-0.0063655518640129,-0.0506287767434264,-0.022667072464007,0.0239297985532538,-0.0136590930034742,0.0011485997040747,0.0205995155097118,0.0692441867413173,0.5441252365387923,0
2020-10-30,62 Stocks Moving In Friday's Mid-Day Session,RMD,0.0692441867413173,0.5441252365387923,-0.0063655518640129,-0.022667072464007,0.0239297985532538,-0.0136590930034742,0.0011485997040747,0.0253204037424887,-0.0305258467023172,0
2020-11-02,76 Biggest Movers From Friday,RMD,0.0253204037424887,-0.0305258467023172,0.0692441867413173,-0.0063655518640129,-0.022667072464007,0.0239297985532538,-0.0136590930034742,0.0287600562129735,-0.1875430935417145,0
2020-11-04,Stocks That Hit 52-Week Highs On Wednesday,RMD,0.0343772038970178,-0.0449787835926449,0.0287600562129735,0.0253204037424887,0.0692441867413173,-0.0063655518640129,-0.022667072464007,0.0161875487463298,-0.1676540284360189,0
2020-11-05,"The Daily Biotech Pulse: Bluebird Bio Plunges On Regulatory Filing Delay, Synlogic Soars On Study Initiation, European Label Expansion For Vertex, Merck Goes Shopping",RMD,0.0161875487463298,-0.1676540284360189,0.0343772038970178,0.0287600562129735,0.0253204037424887,0.0692441867413173,-0.0063655518640129,0.0064846316159175,-0.0220640569395017,0
2020-11-05,Stocks That Hit 52-Week Highs On Thursday,RMD,0.0161875487463298,-0.1676540284360189,0.0343772038970178,0.0287600562129735,0.0253204037424887,0.0692441867413173,-0.0063655518640129,0.0064846316159175,-0.0220640569395017,0
2020-11-09,Stocks That Hit 52-Week Highs On Monday,RMD,0.0298800946701243,1.0842430858806409,0.0064846316159175,0.0161875487463298,0.0343772038970178,0.0287600562129735,0.0253204037424887,-0.0367394267075092,-0.3155827149716281,1
2020-11-10,"The Daily Biotech Pulse: Lilly's COVID-19 Antibody Treatment Approved For Emergency Use, Supernus Faces Twin Regulatory Setbacks, Revance, Arena Flunk Midstage Studies",RMD,-0.0367394267075092,-0.3155827149716281,0.0298800946701243,0.0064846316159175,0.0161875487463298,0.0343772038970178,0.0287600562129735,0.0175380543655323,-0.2822704081632653,0
2021-01-28,"The Daily Biotech Pulse: Decision Day For Amgen, Zymeworks Sinks On Data, Ortho Clinical Diagnostics IPO",RMD,0.0087358669952541,-0.0488036460311431,-0.0369804553959279,0.002706671778631,0.0285820334550648,-0.0071407191418412,-0.0040831661293498,-0.0665028806169731,1.2958674386105011,1
