date,title,stock,close,volume,1_past_close,2_past_close,3_past_close,4_past_close,5_past_close,next_close,next_volume,label
2020-02-20,Sling TV Starts Losing Subscribers As Streaming Wars Intensify,T,0.0044224001454922,0.2024184342535349,0.0047047212187341,0.0002614983695208,-0.0015662783518556,0.0070978960543162,-0.0034059224871991,-0.0015541084422896,0.0475454707458538,2
2020-03-02,"Apple, Microsoft And A Few Cyclicals Lead Broad-Based Stock Rally; Bond Yields Extend Weakness",T,0.0556500617844142,-0.4339686008566978,-0.014273657041822,-0.0369271010145224,-0.0066936831930887,-0.0183967469673997,-0.0129701351670206,-0.0236686106179828,-0.0675816254654391,1
2020-03-03,And The Winner Of The Streaming Wars Is...,T,-0.0236686106179828,-0.0675816254654391,0.0556500617844142,-0.014273657041822,-0.0369271010145224,-0.0066936831930887,-0.0183967469673997,0.051790891237258,-0.3406720113133964,0
2020-03-03,"Super Tuesday Begins As Investors Eye Earnings From Kohl's, Target, And G7 Disappoints",T,-0.0236686106179828,-0.0675816254654391,0.0556500617844142,-0.014273657041822,-0.0369271010145224,-0.0066936831930887,-0.0183967469673997,0.051790891237258,-0.3406720113133964,0
2020-03-05,The New AT&T TV Streaming Service: What You Should Know,T,-0.0261919903043553,0.0767213854061699,0.051790891237258,-0.0236686106179828,0.0556500617844142,-0.014273657041822,-0.0369271010145224,-0.0040343120542514,0.0791423928136079,2
2020-03-13,Wild Week Ends With A Late Surge To Nearly Erase Thursday's Losses As Trump Promises Help,T,0.1002232723095779,-0.231863134767716,-0.0924101164568874,-0.037099172283607,0.0334390839532814,-0.0631919691205319,-0.0040343120542514,-0.0771685004172141,-0.091394494330753,1
2020-03-20,Stocks That Hit 52-Week Lows On Friday,T,-0.0866772894023871,0.9193961504147444,-0.0517503848825415,-0.0263782208295976,0.0606727876966113,-0.0771685004172141,0.1002232723095779,-0.0590510897230218,-0.1700317750677572,1
2020-03-23,Stocks That Hit 52-Week Lows On Monday,T,-0.0590510897230218,-0.1700317750677572,-0.0866772894023871,-0.0517503848825415,-0.0263782208295976,0.0606727876966113,-0.0771685004172141,0.0493088681356213,-0.212451779600112,0
2020-03-26,"Companies Suspend Dividends, Buybacks As Pandemic Weakens Market",T,0.0774649756163625,-0.0586481704099677,0.0110360810971781,0.0493088681356213,-0.0590510897230218,-0.0866772894023871,-0.0517503848825415,-0.0248370333103563,-0.2756488335051064,1
2020-04-01,"A Peek Into The Markets: US Stock Futures Tumble Ahead Of ADP, Manufacturing Reports",T,-0.0377357712568857,-0.2172562894298009,-0.0357261909034775,0.0130701187041599,-0.0248370333103563,0.0774649756163625,0.0110360810971781,0.0253117718610904,-0.381136765689807,0
2020-04-09,Communications Services Sector Earnings: When Staying In Becomes The Trend,T,0.028103021367102,0.2330897484442282,0.0169600035250316,0.0217391928037358,0.0721048756893871,-0.0452016207553555,0.0253117718610904,-0.0175723686147276,-0.3211813503396861,1
2020-04-17,"Big Earnings Day As Honeywell, Procter & Gamble, Schlumberger Among Those Reporting",T,0.0354775283973465,0.0652334896595425,0.0023264846873338,-0.0334083803906933,0.0311360140905667,-0.0175723686147276,0.028103021367102,-0.0080051348325512,-0.1175258678749212,1
2020-04-21,How Stable Are Their Networks? AT&T And Verizon Set To Release Q1 Earnings,T,-0.0358296810682459,0.4129685410436396,-0.0080051348325512,0.0354775283973465,0.0023264846873338,-0.0334083803906933,0.0311360140905667,-0.0133913836324935,0.1742573479732563,1
2020-04-22,Netflix Doubles Growth Estimates But Misses Earnings Expectations,T,-0.0133913836324935,0.1742573479732563,-0.0358296810682459,-0.0080051348325512,0.0354775283973465,0.0023264846873338,-0.0334083803906933,0.001018072181447,-0.3297341698066816,2
2020-04-22,"Little Things Count: After Selloff To Start Week, A Bit of Light Arrives With Positive Earnings",T,-0.0133913836324935,0.1742573479732563,-0.0358296810682459,-0.0080051348325512,0.0354775283973465,0.0023264846873338,-0.0334083803906933,0.001018072181447,-0.3297341698066816,2
2020-04-29,"Netflix Working On 'Social Distance,' A New Show From The Maker Of 'Orange Is The New Black'",T,0.0254485233632315,0.072281788721715,0.003602109734375,0.0279366364153856,0.0071186117512722,0.001018072181447,-0.0133913836324935,-0.0305440695848679,0.2289438413453799,1
2020-04-29,AT&T Is Hoping HBO Max Will Turn The Tide,T,0.0254485233632315,0.072281788721715,0.003602109734375,0.0279366364153856,0.0071186117512722,0.001018072181447,-0.0133913836324935,-0.0305440695848679,0.2289438413453799,1
2020-05-04,Investor Movement Index Summary: April 2020,T,-0.0100332484720023,-0.0457840064793756,-0.0187070767471017,-0.0305440695848679,0.0254485233632315,0.003602109734375,0.0279366364153856,0.0047296719813503,-0.2996806427731111,2
2020-06-04,FAANG Stocks Seem Immune To COVID-19,T,0.0092034829826932,0.1041408697990133,0.0167794470492135,0.0019400316353233,0.0022681267048749,-0.0064391595081843,-0.0248037449438205,0.0305032133337379,0.5177227213185422,0
2020-06-05,"US Debt Market Raised $22.5B This Week, The Highest Since 2007: FT",T,0.0305032133337379,0.5177227213185422,0.0092034829826932,0.0167794470492135,0.0019400316353233,0.0022681267048749,-0.0064391595081843,0.0140373087740082,-0.2658012391007319,0
2020-06-05,Should Salesforce Shareholders Rejoice or Be Concerned?,T,0.0305032133337379,0.5177227213185422,0.0092034829826932,0.0167794470492135,0.0019400316353233,0.0022681267048749,-0.0064391595081843,0.0140373087740082,-0.2658012391007319,0
2020-06-08,Investor Movement Index Summary: May 2020,T,0.0140373087740082,-0.2658012391007319,0.0305032133337379,0.0092034829826932,0.0167794470492135,0.0019400316353233,0.0022681267048749,-0.0183569903763233,-0.060380458704335,1
2020-06-15,A Peek Into The Markets: US Stock Futures Plunge Following Last Week's Selloff,T,0.0,0.1098107076475294,0.0109380127374301,-0.0612941612300746,-0.0147149993057035,-0.0183569903763233,0.0140373087740082,0.009180216357957,0.0339612034784515,0
2020-07-06,Investor Movement Index Summary: June 2020,T,0.0136305112908536,-0.1062716951063007,0.0060199490832013,-0.0109165124365185,0.0106990139163061,0.0285418664871297,-0.021534499287406,-0.0055755237464154,-0.1840882223355041,1
2020-07-08,TAWK: Media Is The Message,T,0.0046172534147039,0.4152719739655348,-0.0055755237464154,0.0136305112908536,0.0060199490832013,-0.0109165124365185,0.0106990139163061,-0.0077764901022842,0.011113968896756,1
2020-07-16,Thursday's Market Minute: Nasdaq-100 Losing its Lead?,T,0.0126623957972793,0.0656159044300717,0.0016689698664833,0.0067203265588318,-0.0122799936159149,0.0199728424544127,-0.0077764901022842,-0.004606830412676,-0.2985742847382433,2
2020-07-20,"A Week Of Dow And Tesla To ""Cure"" COVID-19 Tainted Earnings",T,-0.0132230409866169,0.4002722793672746,-0.004606830412676,0.0126623957972793,0.0016689698664833,0.0067203265588318,-0.0122799936159149,0.0134002328143514,0.0569885430983441,0
2020-07-23,"Disney Takes 'Mulan' Off The Calendar, 'Star Wars,' And 'Avatar' Pushed By A Year",T,-0.0086207428620804,0.6881545279578143,-0.0029751816579727,0.0134002328143514,-0.0132230409866169,-0.004606830412676,0.0126623957972793,-0.0110366624591504,-0.2480651777574536,1
2020-07-23,"7 Stocks To Watch For July 23, 2020",T,-0.0086207428620804,0.6881545279578143,-0.0029751816579727,0.0134002328143514,-0.0132230409866169,-0.004606830412676,0.0126623957972793,-0.0110366624591504,-0.2480651777574536,1
2020-07-23,"Earnings Scheduled For July 23, 2020",T,-0.0086207428620804,0.6881545279578143,-0.0029751816579727,0.0134002328143514,-0.0132230409866169,-0.004606830412676,0.0126623957972793,-0.0110366624591504,-0.2480651777574536,1
2020-07-23,"A Peek Into The Markets: US Stock Futures Up Ahead Of Earnings, Jobless Claims Data",T,-0.0086207428620804,0.6881545279578143,-0.0029751816579727,0.0134002328143514,-0.0132230409866169,-0.004606830412676,0.0126623957972793,-0.0110366624591504,-0.2480651777574536,1
2020-07-23,"Microsoft, Tesla Go Opposite Ways in Pre-Market Trading as Earnings Results Digested",T,-0.0086207428620804,0.6881545279578143,-0.0029751816579727,0.0134002328143514,-0.0132230409866169,-0.004606830412676,0.0126623957972793,-0.0110366624591504,-0.2480651777574536,1
2020-07-24,"Twitter Internal Tool That Led To Massive Hack Was Accessible To More Than 1,000 Workers: Report",T,-0.0110366624591504,-0.2480651777574536,-0.0086207428620804,-0.0029751816579727,0.0134002328143514,-0.0132230409866169,-0.004606830412676,-0.0094689527988702,-0.1351143494175201,1
2020-08-07,T-Mobile Claims It Beat AT&T To Become Second Largest US Wireless Carrier In Q2,T,0.0060323287908226,0.3885853331383926,-0.0003350863699669,-0.0053315568369266,0.0131667013362777,0.0013523701403721,0.0003381544030001,0.005995847955126,0.167388203141797,0
2020-08-10,Investor Movement Index Summary: July 2020,T,0.005995847955126,0.167388203141797,0.0060323287908226,-0.0003350863699669,-0.0053315568369266,0.0131667013362777,0.0013523701403721,0.0,-0.1274834985663659,2
2020-08-26,NBA Postpones Playoff Games As Milwaukee Bucks Boycott Following Kenosha Police Shooting,T,0.0030101120465182,0.3240199670400878,-0.0043291854604082,0.0114517209713695,0.000674133969984,-0.0020182159117436,-0.0020142548548426,-0.0030010784640809,0.0636559290191951,2
2020-08-27,NBA Players Vote To Resume Playoff Games,T,-0.0030010784640809,0.0636559290191951,0.0030101120465182,-0.0043291854604082,0.0114517209713695,0.000674133969984,-0.0020182159117436,0.0046824311038686,-0.0936462540442447,2
2020-08-31,How Google Could Change The Streaming Space With Kaleidoscope,T,-0.0076563813884681,0.5456008529643399,0.0046824311038686,-0.0030010784640809,0.0030101120465182,-0.0043291854604082,0.0114517209713695,-0.0114057250095436,0.1214111804835715,1
2020-09-10,What Netflix CEO Reed Hastings Thinks About Disney+,T,-0.0156625065334387,0.600819692509488,-0.004744102830492,0.0030589060068955,-0.0057451578211996,-0.0037034174061558,0.007804469478412,0.0031135133325292,-0.3742782087512598,2
2020-09-16,Spotify Spars With Apple Over Services Bundle Launch,T,0.0041209865394602,0.1913151132516597,-0.0006865015357916,0.0048275327162292,0.0031135133325292,-0.0156625065334387,-0.004744102830492,-0.0058140336826888,0.0253004632479185,1
2020-09-17,"Warner Bros Unveils Harry Potter RPG For PlayStation, Xbox",T,-0.0058140336826888,0.0253004632479185,0.0041209865394602,-0.0006865015357916,0.0048275327162292,0.0031135133325292,-0.0156625065334387,-0.004815909009896,0.4490300110250427,2
2020-09-17,"After China, Disney's 'Mulan' Sees Muted Opening In Hong Kong",T,-0.0058140336826888,0.0253004632479185,0.0041209865394602,-0.0006865015357916,0.0048275327162292,0.0031135133325292,-0.0156625065334387,-0.004815909009896,0.4490300110250427,2
2020-09-29,"The Daily Biotech Pulse: FDA Nod For Pfizer, Sorrento's COVID-19 Antibody Animal Data, Orphazyme's Wall Street Debut",T,-0.0028188870020514,-0.166276269303613,0.0121255929553369,0.0,0.0060996101944552,-0.0224481592219977,-0.0041915163189557,0.007420468512999,0.5359123028372816,0
2020-10-05,Investor Movement Index Summary: September 2020,T,-0.0003488643788375,0.1660562911888963,0.0066690348009013,-0.0007014539662945,0.007420468512999,-0.0028188870020514,0.0121255929553369,0.0013954034469008,0.1703044517461209,2
2020-10-05,A Peek Into The Markets: US Stock Futures Gain Following President Trump's Health Improvement,T,-0.0003488643788375,0.1660562911888963,0.0066690348009013,-0.0007014539662945,0.007420468512999,-0.0028188870020514,0.0121255929553369,0.0013954034469008,0.1703044517461209,2
2020-10-09,WarnerMedia Plans Layoffs To Trim Costs By Up To 20%: WSJ,T,-0.0101362615513879,0.018347123783508,0.0177322788705927,0.0031346614148553,0.0013954034469008,-0.0003488643788375,0.0066690348009013,-0.0067091875224488,0.566131564774863,1
2020-10-19,"Halliburton, IBM Earnings Today Kick Off Busy Week Of Corporate Reporting",T,-0.0164656909277645,0.7775292499520188,-0.0043714432724012,-0.0014549909007989,-0.0093694842778661,-0.013508578908953,-0.0067091875224488,-0.0044640292122177,-0.2021600704239066,2
2020-10-19,"Churn, Baby Churn? As Netflix Prepares To Report Q3 Earnings, Analysts Eyeing Subscription, Cancellation Counts",T,-0.0164656909277645,0.7775292499520188,-0.0043714432724012,-0.0014549909007989,-0.0093694842778661,-0.013508578908953,-0.0067091875224488,-0.0044640292122177,-0.2021600704239066,2
2020-10-20,"Tech Giants Have Too Much 'Market Power' Over Streaming, AT&T CEO says",T,-0.0044640292122177,-0.2021600704239066,-0.0164656909277645,-0.0043714432724012,-0.0014549909007989,-0.0093694842778661,-0.013508578908953,-0.0014949083715095,0.1480988204917126,2
2020-10-21,"Quibi Shuts Down — The Idea Wasn't 'Strong Enough' Or 'Timing' Went Amiss, Says Leadership",T,-0.0014949083715095,0.1480988204917126,-0.0044640292122177,-0.0164656909277645,-0.0043714432724012,-0.0014549909007989,-0.0093694842778661,0.0583831588815806,0.8745424011072709,0
2020-10-22,"7 Stocks To Watch For October 22, 2020",T,0.0583831588815806,0.8745424011072709,-0.0014949083715095,-0.0044640292122177,-0.0164656909277645,-0.0043714432724012,-0.0014549909007989,-0.0162659407043438,-0.5237236058927777,1
2020-10-22,"Earnings Scheduled For October 22, 2020",T,0.0583831588815806,0.8745424011072709,-0.0014949083715095,-0.0044640292122177,-0.0164656909277645,-0.0043714432724012,-0.0014549909007989,-0.0162659407043438,-0.5237236058927777,1
2020-10-22,"Tesla Records Another Profitable Quarter, While AT&T, Coca-Cola Also Shine And Intel Awaited",T,0.0583831588815806,0.8745424011072709,-0.0014949083715095,-0.0044640292122177,-0.0164656909277645,-0.0043714432724012,-0.0014549909007989,-0.0162659407043438,-0.5237236058927777,1
2020-10-22,PreMarket Prep Stock Of The Day: AT&T,T,0.0583831588815806,0.8745424011072709,-0.0014949083715095,-0.0044640292122177,-0.0164656909277645,-0.0043714432724012,-0.0014549909007989,-0.0162659407043438,-0.5237236058927777,1
2020-10-22,A Peek Into The Markets: US Stock Futures Fall; Tesla Beats Q3 Estimates,T,0.0583831588815806,0.8745424011072709,-0.0014949083715095,-0.0044640292122177,-0.0164656909277645,-0.0043714432724012,-0.0014549909007989,-0.0162659407043438,-0.5237236058927777,1
2020-10-22,AT&T Earnings Show 'Solid Sequential Momentum',T,0.0583831588815806,0.8745424011072709,-0.0014949083715095,-0.0044640292122177,-0.0164656909277645,-0.0043714432724012,-0.0014549909007989,-0.0162659407043438,-0.5237236058927777,1
2020-10-23,AT&T And Verizon Beat Estimates,T,-0.0162659407043438,-0.5237236058927777,0.0583831588815806,-0.0014949083715095,-0.0044640292122177,-0.0164656909277645,-0.0043714432724012,-0.0158157038463899,-0.0259438664805714,1
2020-11-03,Microsoft's New Xbox Series Will Feature Apple TV,T,0.0043889200813143,-0.3073164229787092,0.0118431814875576,0.0097158859306829,0.009811325929443,-0.0156017826430449,-0.0168006098171986,-0.0152948676819868,0.3664664679247242,1
2020-11-06,"More Trouble For Movie Theaters As Disney Postpones 'Free Guy,' 'Death On The Nile'",T,-0.002544602928671,-0.2529684555187927,0.0173816641770601,-0.0152948676819868,0.0043889200813143,0.0118431814875576,0.0097158859306829,0.0313414026759564,1.693851429445297,0
2020-11-09,Investor Movement Index Summary: October 2020,T,0.0313414026759564,1.693851429445297,-0.002544602928671,0.0173816641770601,-0.0152948676819868,0.0043889200813143,0.0118431814875576,0.0194344690322303,-0.3747063983926196,0
2020-11-10,"Go Out Or Stay At Home? Tug Of War Could Continue After Peloton, Amazon, Netflix Hammered Monday",T,0.0194344690322303,-0.3747063983926196,0.0313414026759564,-0.002544602928671,0.0173816641770601,-0.0152948676819868,0.0043889200813143,-0.004159310678622,-0.101221944040944,2
2020-11-12,A Trump Media Network? Report Says It Could Happen,T,-0.0100941332073529,-0.2327739014059392,-0.004159310678622,0.0194344690322303,0.0313414026759564,-0.002544602928671,0.0173816641770601,0.0165259195379106,-0.0985485560399328,0
2020-11-17,"Q3 13F Roundup: How Buffett, Einhorn, Ackman And Others Adjusted Their Portfolios",T,0.0020710930684184,-0.4279084605875032,0.0020756013299352,0.0165259195379106,-0.0100941332073529,-0.004159310678622,0.0194344690322303,-0.0141233405022751,0.0344177155736016,1
2020-11-17,"Activist Investor Elliott Exits AT&T, Buys Uniti, Boosts Dell",T,0.0020710930684184,-0.4279084605875032,0.0020756013299352,0.0165259195379106,-0.0100941332073529,-0.004159310678622,0.0194344690322303,-0.0141233405022751,0.0344177155736016,1
2020-11-23,COVID-19 Could Make Disney Even Stronger,T,0.0105932513762319,-0.0140980789039727,0.0014145599877839,-0.0118799657470651,-0.0141233405022751,0.0020710930684184,0.0020756013299352,0.0213137014172981,0.58195178221079,0
2020-12-03,"Google, Justice Department Must Give Fresh Proposal In Antitrust Case Over Concerns Raised By Apple, Microsoft, Others, Judge Says",T,0.004812685644318,0.1855279620659822,0.0076203479065179,0.0041737774492358,-0.0096451598063436,0.0013800202401574,-0.0082108910392567,0.0106055529551396,0.0791695060048491,0
2020-12-08,Christopher Nolan Criticizes HBO Max As 'Worst Streaming Service',T,0.0394736532909236,1.1253963214460851,0.0033853528617575,0.0106055529551396,0.004812685644318,0.0076203479065179,0.0041737774492358,0.0210971069630192,-0.0397049192735191,0
2020-12-14,Disney Just Made The Streaming Wars Even More Intense,T,-0.0148339473088769,0.3534705399778699,0.0104269390005666,-0.0244756510251723,0.0210971069630192,0.0394736532909236,0.0033853528617575,0.0009820391998882,-0.2161393833693655,2
2020-12-14,"Stock Market Recap For the Week Of 12/7/2020: IPOs, Vaccines & Facebook Lawsuit",T,-0.0148339473088769,0.3534705399778699,0.0104269390005666,-0.0244756510251723,0.0210971069630192,0.0394736532909236,0.0033853528617575,0.0009820391998882,-0.2161393833693655,2
2020-12-15,"Senator Asks Netflix, Amazon, Others To Allow Free Access To Content During Holiday Season As A 'Public Service'",T,0.0009820391998882,-0.2161393833693655,-0.0148339473088769,0.0104269390005666,-0.0244756510251723,0.0210971069630192,0.0394736532909236,-0.0094833690974904,0.0378735924031845,1
2020-12-23,"Amazon, Formula One In 'Active' Discussions For Grand Pix Race Streaming: FT",T,0.0123238711986131,-0.3848851928823529,-0.0210271664271834,-0.0132653636150232,-0.0074271908633467,-0.0221196350652123,-0.0094833690974904,-0.0020870467225023,-0.512657410476587,2
2020-12-29,Disney+ Saw 28% Higher App Downloads Over Christmas Holiday,T,-0.0003502424861743,-0.120184048342724,-0.0048796789186048,-0.0020870467225023,0.0123238711986131,-0.0210271664271834,-0.0132653636150232,-0.0017520382086937,-0.0619840281575039,2
2020-12-29,Imax CEO Bullish On 2021 Theatrical Movie Backlog,T,-0.0003502424861743,-0.120184048342724,-0.0048796789186048,-0.0020870467225023,0.0123238711986131,-0.0210271664271834,-0.0132653636150232,-0.0017520382086937,-0.0619840281575039,2
2021-01-12,33 Blue Chip Companies That Are Suspending Campaign Donations After Capitol Insurrection,T,-0.004156471224694,0.408530851788204,-0.0051689626127234,-0.0068962263377264,0.0026818107709771,0.0194806404498848,-0.0061140874586373,-0.0048695762419014,-0.1066170969486999,2
2021-01-13,US Lawmakers Seek Information From Telco's To Decide Broadband Stimulus Aid: Washington Post,T,-0.0048695762419014,-0.1066170969486999,-0.004156471224694,-0.0051689626127234,-0.0068962263377264,0.0026818107709771,0.0194806404498848,0.0237679673899846,0.645461108275333,0
2021-01-19,Google Defends Against Allegations Of Collusion With Facebook On Ads,T,-0.0075419113687729,0.002727966697225,-0.0040970715347619,0.0237679673899846,-0.0048695762419014,-0.004156471224694,-0.0051689626127234,0.0003453217235467,-0.2016853105681483,2
2021-01-19,ViacomCBS To Launch Paramount+ Streaming Service March 4: What You Need To Know,T,-0.0075419113687729,0.002727966697225,-0.0040970715347619,0.0237679673899846,-0.0048695762419014,-0.004156471224694,-0.0051689626127234,0.0003453217235467,-0.2016853105681483,2
2021-01-25,"Earnings Palooza: 20% Of S&P 500 Reports This Week, Including Apple, Tesla",T,0.0062220318690833,0.4950006710114567,0.0034686172747198,-0.0044889608239582,0.0003453217235467,-0.0075419113687729,-0.0040970715347619,0.0219855194926232,-0.0268601601301635,0
2021-01-27,"Earnings Scheduled For January 27, 2021",T,-0.0205043480284425,0.455904616118068,0.0219855194926232,0.0062220318690833,0.0034686172747198,-0.0044889608239582,0.0003453217235467,-0.0116676359406804,-0.2842692198458537,1
2021-01-27,A Peek Into The Markets: US Stock Futures Mixed; Microsoft Beats Q2 Estimates,T,-0.0205043480284425,0.455904616118068,0.0219855194926232,0.0062220318690833,0.0034686172747198,-0.0044889608239582,0.0003453217235467,-0.0116676359406804,-0.2842692198458537,1
2021-01-27,"7 Stocks To Watch For January 27, 2021",T,-0.0205043480284425,0.455904616118068,0.0219855194926232,0.0062220318690833,0.0034686172747198,-0.0044889608239582,0.0003453217235467,-0.0116676359406804,-0.2842692198458537,1
2021-02-09,"Twitter, Cisco Line Up To Report After Today's Close, Followed By Uber, GM Tomorrow",T,-0.0052135709979096,0.0224204059995634,-0.005530604090663,0.001384565393423,0.0133286884244741,-0.0010512623337505,-0.0038394502584658,-0.0024459507528733,0.2891942081824203,2
2021-02-09,Only A Year Old And Disney+ Already Is Royalty In The Magic Kingdom And More Earnings News,T,-0.0052135709979096,0.0224204059995634,-0.005530604090663,0.001384565393423,0.0133286884244741,-0.0010512623337505,-0.0038394502584658,-0.0024459507528733,0.2891942081824203,2
2021-02-10,"After Getting A Lyft, Market Awaits Uber Earnings, Fed's Powell Later Today",T,-0.0024459507528733,0.2891942081824203,-0.0052135709979096,-0.005530604090663,0.001384565393423,0.0133286884244741,-0.0010512623337505,0.004903585309576,-0.2017738321167648,2
2021-02-17,"Q4 13F Roundup: How Buffett, Einhorn, Ackman And Others Adjusted Their Portfolios",T,0.0207111290761887,0.3226039826480731,0.0059026883895405,0.003834200748938,0.004903585309576,-0.0024459507528733,-0.0052135709979096,-0.0114981664666761,-0.4724561728887559,1
2021-02-18,"Walmart Earnings Come Up Short, With Outlook Also Disappointing Wall Street",T,-0.0114981664666761,-0.4724561728887559,0.0207111290761887,0.0059026883895405,0.003834200748938,0.004903585309576,-0.0024459507528733,-0.0078685452224998,0.1000011048464297,1
2021-02-22,Roku Is Ready For The Next Level,T,0.0110345075249098,0.1740868027510622,-0.0078685452224998,-0.0114981664666761,0.0207111290761887,0.0059026883895405,0.003834200748938,-0.0047750091875612,0.3465714974304055,2
2021-02-23,"American Express Launches $1M Grant Program To Aid Small, Historic Restaurants",T,-0.0047750091875612,0.3465714974304055,0.0110345075249098,-0.0078685452224998,-0.0114981664666761,0.0207111290761887,0.0059026883895405,0.0068540255791018,-0.2625265609875175,0
2021-02-25,Netflix To Devote $500M For South Korean Content In 2021,T,-0.0255276289001761,0.6902393354222862,0.0068540255791018,-0.0047750091875612,0.0110345075249098,-0.0078685452224998,-0.0114981664666761,-0.0258469717163017,0.3240934686928889,1
2021-03-01,PayPal Has Blocked A Crowdfunding Site That Provided Financial Support For US Capitol Riot Attendees,T,0.0071711518587753,-0.4271076035444934,-0.0258469717163017,-0.0255276289001761,0.0068540255791018,-0.0047750091875612,0.0110345075249098,0.0046278863991284,-0.1954535135863516,2
2021-03-04,"Nasdaq-100 Falls Into Correction Territory As Losses Mount For Tesla, Zoom, Peloton",T,0.0069637010682022,0.0608892195115202,0.0177179714117909,0.0046278863991284,0.0071711518587753,-0.0258469717163017,-0.0255276289001761,0.0242047595805476,-0.0335653125429954,0
2021-03-08,Momentum Halt: Overnight Rally Fizzles After 10-Year Yield Climbs Back Above 1.6%,T,0.0124915884544001,-0.0465766282497769,0.0242047595805476,0.0069637010682022,0.0177179714117909,0.0046278863991284,0.0071711518587753,-0.0116704846804109,-0.1433958654845346,1
2021-03-08,Disney's 'Raya And The Last Dragon' Opens To Disappointing $8.6M Domestic Box Office,T,0.0124915884544001,-0.0465766282497769,0.0242047595805476,0.0069637010682022,0.0177179714117909,0.0046278863991284,0.0071711518587753,-0.0116704846804109,-0.1433958654845346,1
2021-03-10,"Oracle Earnings Later Today Could Give A Status Check On Business Software, Cloud Demand",T,0.0118082931851297,-0.0868116281699795,-0.0116704846804109,0.0124915884544001,0.0242047595805476,0.0069637010682022,0.0177179714117909,-0.015005035713662,-0.1664310590022777,1
2021-03-11,Verizon To Fund $36B 5G Airwaves Payment Via Debt: Bloomberg,T,-0.015005035713662,-0.1664310590022777,0.0118082931851297,-0.0116704846804109,0.0124915884544001,0.0242047595805476,0.0069637010682022,0.0091400698502888,0.920781108964615,0
2021-03-12,Netflix Looks To Root Out Password Borrowers With New Feature: What You Should Know,T,0.0091400698502888,0.920781108964615,-0.015005035713662,0.0118082931851297,-0.0116704846804109,0.0124915884544001,0.0242047595805476,0.0040255043889509,-0.3954246980700027,2
2021-03-12,"AMC Could Be Getting Up To 10% On Film-Rental Fees From WarnerMedia, Says Analyst",T,0.0091400698502888,0.920781108964615,-0.015005035713662,0.0118082931851297,-0.0116704846804109,0.0124915884544001,0.0242047595805476,0.0040255043889509,-0.3954246980700027,2
2021-03-18,Nokia Announces Partnership With AT&T For 5G Technology,T,-0.0046433626820597,-0.2163813165600865,0.0053349265044275,0.0020047811871435,0.0040255043889509,0.0091400698502888,-0.015005035713662,-0.0083304776052423,1.3543078944555775,1
2021-03-19,The State Of Streaming In 2021: A Fight For Content And Eyeballs,T,-0.0083304776052423,1.3543078944555775,-0.0046433626820597,0.0053349265044275,0.0020047811871435,0.0040255043889509,0.0091400698502888,0.0077285122951842,-0.5743537390128595,0
2021-03-19,"Is Now The Time To Buy Stock In Nike, Nokia, Facebook, Amazon Or Disney?",T,-0.0083304776052423,1.3543078944555775,-0.0046433626820597,0.0053349265044275,0.0020047811871435,0.0040255043889509,0.0091400698502888,0.0077285122951842,-0.5743537390128595,0
