date,title,stock,close,volume,1_past_close,2_past_close,3_past_close,4_past_close,5_past_close,next_close,next_volume,label
2015-02-27,Broadband Providers Say Government Intervention Is Not The Answer In Net Neutrality,T,0.0017392772483841,-0.1421908789738049,0.008477179911694,0.0046988670783085,0.005908252046141,-0.0067484631539107,-0.000293548180073,0.0023145604404863,0.0893090893383676,2
2015-03-06,Apple Joins Dow Jones Industrial Average; AT&T Out,T,-0.0152938133852972,1.737622353679487,0.0,-0.0119152232394657,-0.0066397684165865,0.0023145604404863,0.0017392772483841,-0.0038829411142473,-0.5104510606728268,2
2015-03-06,Apple To Join Dow Jones Industrial Average; AT&T Out,T,-0.0152938133852972,1.737622353679487,0.0,-0.0119152232394657,-0.0066397684165865,0.0023145604404863,0.0017392772483841,-0.0038829411142473,-0.5104510606728268,2
2015-03-19,AT&T Is Investing $2 Billion On Improving Service In This State,T,-0.0116108862142029,-0.5838246282824666,0.0209724298977393,-0.004839857751567,0.0091576408490197,-0.0111680595269767,0.0156347586441767,0.0009040419983019,0.9409652428099966,2
2015-03-19,Morgan Stanley: 'Un-Carrier 9.0 Means Business',T,-0.0116108862142029,-0.5838246282824666,0.0209724298977393,-0.004839857751567,0.0091576408490197,-0.0111680595269767,0.0156347586441767,0.0009040419983019,0.9409652428099966,2
2015-03-24,Sonus Networks Inc. Tumbles 25% On Profit Warning,T,-0.0063104177200248,-0.1608001952224108,0.0015048148184504,0.0009040419983019,-0.0116108862142029,0.0209724298977393,-0.004839857751567,-0.0136074522885261,0.4489397173482714,1
2015-04-21,Earnings Heat Up: Here's Everything You Need To Know This Morning,T,-0.0051782643260206,-0.1889481814570026,0.0098433542889544,-0.0073282230233686,-0.0042567679301378,0.0061184940253644,-0.0057788645456984,0.0061236215551478,0.5098831435387696,0
2015-04-22,"Earnings Scheduled For April 22, 2015",T,0.0061236215551478,0.5098831435387696,-0.0051782643260206,0.0098433542889544,-0.0073282230233686,-0.0042567679301378,0.0061184940253644,0.0416921308239868,2.06872765535809,0
2015-04-22,"Keep an Eye on These 10 Stocks for April 22, 2015",T,0.0061236215551478,0.5098831435387696,-0.0051782643260206,0.0098433542889544,-0.0073282230233686,-0.0042567679301378,0.0061184940253644,0.0416921308239868,2.06872765535809,0
2015-04-23,Google Has Had A Busy 3 Months,T,0.0416921308239868,2.06872765535809,0.0061236215551478,-0.0051782643260206,0.0098433542889544,-0.0073282230233686,-0.0042567679301378,-0.0064270295906645,-0.5398318301915427,1
2015-05-05,TDAmeritrade's Investor Movement Index Out For April,T,-0.0234576400552768,0.4928420558554329,0.0031956436373798,-0.0063510260382894,-0.0034522665887233,-0.0028686469759386,0.0225873911410325,-0.0100831137016347,-0.0346958025467694,1
2015-05-05,TD Ameritrade's Investor Movement Index Out For April,T,-0.0234576400552768,0.4928420558554329,0.0031956436373798,-0.0063510260382894,-0.0034522665887233,-0.0028686469759386,0.0225873911410325,-0.0100831137016347,-0.0346958025467694,1
2015-05-12,Telecom Sector Shrugs Off Verizon Inc. Deal For AOL Inc.,T,0.0050760790644472,0.9218890118376716,-0.0059364063487789,0.0095895395361689,-0.0002997823239245,-0.0100831137016347,-0.0234576400552768,0.007130512082198,-0.1582496777438899,0
2015-05-12,Cord-Cutting Increased In Q1,T,0.0050760790644472,0.9218890118376716,-0.0059364063487789,0.0095895395361689,-0.0002997823239245,-0.0100831137016347,-0.0234576400552768,0.007130512082198,-0.1582496777438899,0
2015-05-13,Verizon And Sprint Agree To Pay $158 Million For Cramming Charges,T,0.007130512082198,-0.1582496777438899,0.0050760790644472,-0.0059364063487789,0.0095895395361689,-0.0002997823239245,-0.0100831137016347,0.0067842370901256,-0.3119560889874894,0
2015-05-29,FCC Likely To Reject T-Mobile's Request To Further Limit AT&T And Verizon's Spectrum Dominance,T,-0.0074713015198289,0.5253959313108536,-0.0042916613245487,0.008075912389506,-0.0011521279128081,-0.0102652516729511,0.0129983705315501,-0.0055007331883945,-0.0551913683910016,1
2015-05-29,FCC Likely To Reject T-Mobile's Request To Further Limit AT&T and Verizon's Spectrum Dominance,T,-0.0074713015198289,0.5253959313108536,-0.0042916613245487,0.008075912389506,-0.0011521279128081,-0.0102652516729511,0.0129983705315501,-0.0055007331883945,-0.0551913683910016,1
2015-06-02,"Stop The Presses: Americans Are Dissatisfied With TV, Internet Service",T,0.0002907843330006,-0.3090732744513859,-0.0055007331883945,-0.0074713015198289,-0.0042916613245487,0.008075912389506,-0.0011521279128081,0.019499575827137,1.0050387827539753,0
2015-06-02,Stop The Presses: Americans Are Dissatisfied With TV And Internet Service,T,0.0002907843330006,-0.3090732744513859,-0.0055007331883945,-0.0074713015198289,-0.0042916613245487,0.008075912389506,-0.0011521279128081,0.019499575827137,1.0050387827539753,0
2015-06-23,BoFA Sees Dividend Boost At Frontier Communications Corp,T,0.0248290465401326,1.966565632972879,0.0014289619685725,-0.0008568383962309,0.0063218250351866,0.0037495919840948,0.0075562483057738,-0.0036203066447157,-0.5220413056476477,2
2015-06-23,Does A Frontier-Verizon Deal Make Sense?,T,0.0248290465401326,1.966565632972879,0.0014289619685725,-0.0008568383962309,0.0063218250351866,0.0037495919840948,0.0075562483057738,-0.0036203066447157,-0.5220413056476477,2
2015-06-30,Will The New 'All-in' Plan Give Sprint The Edge It Needs?,T,-0.0069886907778042,0.082447085932493,-0.0096899915406493,-0.0016584803186738,0.0111794815304022,-0.0036203066447157,0.0248290465401326,0.0014073821719706,0.1778299689041218,2
2015-07-22,"Market Update: Wednesday's Top Volume Leaders; Apple, Bank of America, Microsoft, and More!",T,-0.0086779877418808,0.8583652797720545,-0.009455691856484,-0.003141738187201,-0.0042662479112169,0.0123810102259067,-0.0111047608508695,-0.0099212226693753,-0.2846080192407907,1
2015-07-22,Market Update: Wednesday's Top Volume Leaders,T,-0.0086779877418808,0.8583652797720545,-0.009455691856484,-0.003141738187201,-0.0042662479112169,0.0123810102259067,-0.0111047608508695,-0.0099212226693753,-0.2846080192407907,1
2015-07-23,10 Stocks Moving On Thursday's After-Hours: Earnings Make The Trading Day Longer,T,-0.0099212226693753,-0.2846080192407907,-0.0086779877418808,-0.009455691856484,-0.003141738187201,-0.0042662479112169,0.0123810102259067,0.0106101552669153,1.3546768029029337,0
2015-07-23,"Earnings Scheduled For July 23, 2015",T,-0.0099212226693753,-0.2846080192407907,-0.0086779877418808,-0.009455691856484,-0.003141738187201,-0.0042662479112169,0.0123810102259067,0.0106101552669153,1.3546768029029337,0
2015-07-23,"10 Stocks To Watch For July 23, 2015",T,-0.0099212226693753,-0.2846080192407907,-0.0086779877418808,-0.009455691856484,-0.003141738187201,-0.0042662479112169,0.0123810102259067,0.0106101552669153,1.3546768029029337,0
2015-07-24,10 Must Watch Stocks for Today,T,0.0106101552669153,1.3546768029029337,-0.0099212226693753,-0.0086779877418808,-0.009455691856484,-0.003141738187201,-0.0042662479112169,0.0008748585987023,-0.4209389298798949,2
2015-07-27,Market Update: Monday's Top 10 Volume Movers,T,0.0008748585987023,-0.4209389298798949,0.0106101552669153,-0.0099212226693753,-0.0086779877418808,-0.009455691856484,-0.003141738187201,0.0002913428115203,0.0480389455162633,2
2015-07-27,Market Update: Monday's Top Ten Volume Movers,T,0.0008748585987023,-0.4209389298798949,0.0106101552669153,-0.0099212226693753,-0.0086779877418808,-0.009455691856484,-0.003141738187201,0.0002913428115203,0.0480389455162633,2
2015-08-12,Mid-Day Market Update: Wednesday's Top Volume Stocks,T,-0.0181817981427782,0.7505585657468263,-0.0037376219973461,0.0166617756402456,-0.0008761361673327,-0.0095457605231745,-0.000289022410443,-0.006173140729793,-0.4268433033282205,1
2015-08-12,Mid-Day Market Update: Wednesday's Top 10 Volume Stocks,T,-0.0181817981427782,0.7505585657468263,-0.0037376219973461,0.0166617756402456,-0.0008761361673327,-0.0095457605231745,-0.000289022410443,-0.006173140729793,-0.4268433033282205,1
2015-08-18,U.S. And India To Join Forces Against Cybercrime,T,0.0035061594871064,-0.0243413277617583,0.0052864149928133,0.0070984319664446,-0.006173140729793,-0.0181817981427782,-0.0037376219973461,0.0002905650715669,0.0292673989670049,2
2015-08-24,Mid-Day Market Update: Monday's Top 10 Volume Stocks,T,-0.0302579013229205,0.8548852231024182,-0.0167893780840105,-0.0119323286611907,0.0002905650715669,0.0035061594871064,0.0052864149928133,-0.0176085355976189,-0.3438644662180808,1
2015-08-25,Mid-Day Market Update: Tuesday's Top 10 Volume Stocks,T,-0.0176085355976189,-0.3438644662180808,-0.0302579013229205,-0.0167893780840105,-0.0119323286611907,0.0002905650715669,0.0035061594871064,0.0279869839547282,-0.020582465966722,0
2015-09-28,How 'Bout Them Apples? Wall Street Digs Into iPhone 6 Debut,T,-0.01330031889942,0.325436651954228,0.0068513142173847,-0.0027952074185387,-0.0021688863246273,-0.0089067453857512,0.0003070473474049,0.005328912384841,-0.0595603643451571,0
2015-09-28,How 'Bout Them Apples? Wall Street Digs Into iPhone 6s Debut,T,-0.01330031889942,0.325436651954228,0.0068513142173847,-0.0027952074185387,-0.0021688863246273,-0.0089067453857512,0.0003070473474049,0.005328912384841,-0.0595603643451571,0
2015-09-28,How About Them Apples? Wall Street Digs Into iPhone 6 Debut,T,-0.01330031889942,0.325436651954228,0.0068513142173847,-0.0027952074185387,-0.0021688863246273,-0.0089067453857512,0.0003070473474049,0.005328912384841,-0.0595603643451571,0
2015-09-29,"Verizon Has Best U.S. LTE Coverage, But T-Mobile Has Fastest Network",T,0.005328912384841,-0.0595603643451571,-0.01330031889942,0.0068513142173847,-0.0027952074185387,-0.0021688863246273,-0.0089067453857512,0.0159030475254768,0.0304955970169189,0
2015-10-19,The 15 Largest Mergers In History,T,-0.0059119918243707,-0.1500195610631947,0.010152209083466,0.0066124792689141,0.0015052370743415,-0.002402209924562,0.0048280816196639,0.0035681859195688,-0.2890112808345212,2
2015-10-22,10 Stocks You Should Be Watching Today,T,0.0107141120842484,0.2235421697981776,-0.0044440801172843,0.0035681859195688,-0.0059119918243707,0.010152209083466,0.0066124792689141,-0.0064780625130598,0.3883845343028118,1
2015-10-22,"Earnings Scheduled For October 22, 2015",T,0.0107141120842484,0.2235421697981776,-0.0044440801172843,0.0035681859195688,-0.0059119918243707,0.010152209083466,0.0066124792689141,-0.0064780625130598,0.3883845343028118,1
2015-10-23,"Keep an Eye on These 10 Stocks for October 23, 2015",T,-0.0064780625130598,0.3883845343028118,0.0107141120842484,-0.0044440801172843,0.0035681859195688,-0.0059119918243707,0.010152209083466,-0.0023714047850433,-0.4501745570121822,2
2015-10-23,Morning Market Gainers,T,-0.0064780625130598,0.3883845343028118,0.0107141120842484,-0.0044440801172843,0.0035681859195688,-0.0059119918243707,0.010152209083466,-0.0023714047850433,-0.4501745570121822,2
2015-10-26,T-Mobile CEO John Legere Calls Out Competitors. Again.,T,-0.0023714047850433,-0.4501745570121822,-0.0064780625130598,0.0107141120842484,-0.0044440801172843,0.0035681859195688,-0.0059119918243707,-0.0133686083398241,-0.0378926223222383,1
2015-11-09,Stock Streak Looks Vulnerable as Hot Jobs Report Incites Fed Jitters,T,-0.0096504041172787,-0.049324252765005,-0.0053990320700679,-0.0041817746527171,-0.004460002972068,0.0005948327666605,0.0029842235404009,-0.0015221180364778,-0.0573056091305519,2
2015-12-23,Mid-Day Market Update: Crude Oil Down 4%; Adamas Pharmaceuticals Shares Jump Following Positive Phase 3 Results,T,0.0107527611921174,-0.0547160006130353,0.0093868084424499,0.0145832828962677,-0.012635696647924,-0.010755696647303,0.0174502540453409,-0.0034503932993269,-0.6446119852569301,2
2015-12-23,Mid-Afternoon Market Update: Dow Surges Over 1%; Bed Bath & Beyond Shares Slip On Lowered Q3 Outlook,T,0.0107527611921174,-0.0547160006130353,0.0093868084424499,0.0145832828962677,-0.012635696647924,-0.010755696647303,0.0174502540453409,-0.0034503932993269,-0.6446119852569301,2
2015-12-23,Mid-Morning Market Update: Markets Open Higher; Nike Profit Tops Expectations,T,0.0107527611921174,-0.0547160006130353,0.0093868084424499,0.0145832828962677,-0.012635696647924,-0.010755696647303,0.0174502540453409,-0.0034503932993269,-0.6446119852569301,2
2015-12-30,"Active Fund Managers Focus On Materials And Utilities, Shy Away From Telecom",T,-0.005439416470044,-0.0427126348420815,0.0048906114529538,0.0028851453051195,-0.0034503932993269,0.0107527611921174,0.0093868084424499,-0.0094990168726307,0.4731140147075152,1
2015-12-30,"Active Fund Managers Focus On Materials And Utilities, Shying Away From Telecom",T,-0.005439416470044,-0.0427126348420815,0.0048906114529538,0.0028851453051195,-0.0034503932993269,0.0107527611921174,0.0093868084424499,-0.0094990168726307,0.4731140147075152,1
2015-12-30,Meet This Year's Best Telecom ETF,T,-0.005439416470044,-0.0427126348420815,0.0048906114529538,0.0028851453051195,-0.0034503932993269,0.0107527611921174,0.0093868084424499,-0.0094990168726307,0.4731140147075152,1
2016-01-11,"MKM's Jon Krinsky: Buy Low Volatility Stocks, Sell High Beta Stocks",T,0.0122246087083877,-0.0588092901905099,0.0008949690906645,-0.0161482318058798,0.0031079255607024,0.006986528291512,-0.0017433308561617,-0.001472325801179,-0.0875493654886901,2
2016-01-13,"Benzinga's M&A Chatter for Wednesday January 13, 2016",T,-0.0047201258495958,0.6680954047155714,-0.001472325801179,0.0122246087083877,0.0008949690906645,-0.0161482318058798,0.0031079255607024,0.0165971854327997,-0.0972607634822869,0
2016-01-13,Report: Apple Keeping 'Close Eye' On Time Warner Amid M&A Rumors,T,-0.0047201258495958,0.6680954047155714,-0.001472325801179,0.0122246087083877,0.0008949690906645,-0.0161482318058798,0.0031079255607024,0.0165971854327997,-0.0972607634822869,0
2016-01-25,Here's Why Hedge Fund Managers 'Are Driving Themselves Crazy' Over Media M&A Rumors,T,-0.0039839398464125,-0.0867657487351886,0.0173713153985972,0.018878460717068,-0.0176754883896068,0.0152983300089704,-0.009037495870009,0.0114284619053846,0.3770998031298476,0
2016-01-25,Hedge Fund Managers 'Are Driving Themselves Crazy' Over Media M&A Rumors,T,-0.0039839398464125,-0.0867657487351886,0.0173713153985972,0.018878460717068,-0.0176754883896068,0.0152983300089704,-0.009037495870009,0.0114284619053846,0.3770998031298476,0
2016-01-26,"AAPL, FB Earnings Could Carry Psychological Impact for Stocks",T,0.0114284619053846,0.3770998031298476,-0.0039839398464125,0.0173713153985972,0.018878460717068,-0.0176754883896068,0.0152983300089704,0.0022596944320472,0.2060100238345155,2
2016-01-26,Apple And Facebook Earnings Could Carry Psychological Impact: Here's Why,T,0.0114284619053846,0.3770998031298476,-0.0039839398464125,0.0173713153985972,0.018878460717068,-0.0176754883896068,0.0152983300089704,0.0022596944320472,0.2060100238345155,2
2016-01-26,Earnings Recap For January 26,T,0.0114284619053846,0.3770998031298476,-0.0039839398464125,0.0173713153985972,0.018878460717068,-0.0176754883896068,0.0152983300089704,0.0022596944320472,0.2060100238345155,2
2016-01-26,"Earnings Scheduled For January 26, 2016",T,0.0114284619053846,0.3770998031298476,-0.0039839398464125,0.0173713153985972,0.018878460717068,-0.0176754883896068,0.0152983300089704,0.0022596944320472,0.2060100238345155,2
2016-01-26,7 Stocks You Should Be Watching Today,T,0.0114284619053846,0.3770998031298476,-0.0039839398464125,0.0173713153985972,0.018878460717068,-0.0176754883896068,0.0152983300089704,0.0022596944320472,0.2060100238345155,2
2016-01-27,"Keep an Eye on These 10 Stocks for January 27, 2016",T,0.0022596944320472,0.2060100238345155,0.0114284619053846,-0.0039839398464125,0.0173713153985972,0.018878460717068,-0.0176754883896068,0.0014093840409885,-0.4790521794935677,2
2016-01-27,"Apple and Boeing Earnings, Plus Oil Drag, Combine To Dent Stocks",T,0.0022596944320472,0.2060100238345155,0.0114284619053846,-0.0039839398464125,0.0173713153985972,0.018878460717068,-0.0176754883896068,0.0014093840409885,-0.4790521794935677,2
2016-01-27,"Apple and Boeing Earnings, Plus Oil Drag, Combine to Dent Stocks",T,0.0022596944320472,0.2060100238345155,0.0114284619053846,-0.0039839398464125,0.0173713153985972,0.018878460717068,-0.0176754883896068,0.0014093840409885,-0.4790521794935677,2
2016-02-03,Yahoo's Potential Buyers,T,0.0183027375553037,0.3034231641281844,-0.0033165868158212,0.0033276231669447,0.0149171172798605,0.0014093840409885,0.0022596944320472,-0.0051743077311118,-0.1829588427654501,1
2016-02-09,Report: NFL Wants Verizon To 'Cough Up More Cash',T,-0.0123957785684396,-0.1408290371451827,0.0062365426852997,0.0095810459048786,-0.0051743077311118,0.0183027375553037,-0.0033165868158212,-0.0060026612364971,-0.2375476134541156,1
2016-02-11,Get Paid To Play Defense With This Dividend ETF,T,-0.0060387919707387,0.5720509581982749,-0.0060026612364971,-0.0123957785684396,0.0062365426852997,0.0095810459048786,-0.0051743077311118,0.0071803524044051,-0.3740222840759583,0
2016-02-12,"Immersion Files Complaint With U.S. International Trade Commission Against, Apple & AT&T",T,0.0071803524044051,-0.3740222840759583,-0.0060387919707387,-0.0060026612364971,-0.0123957785684396,0.0062365426852997,0.0095810459048786,0.0049352910573303,0.0469413874436748,2
2016-02-12,"Immersion Said It Filed A Complaint With The U.S. International Trade Commission Against, Apple & AT&T",T,0.0071803524044051,-0.3740222840759583,-0.0060387919707387,-0.0060026612364971,-0.0123957785684396,0.0062365426852997,0.0095810459048786,0.0049352910573303,0.0469413874436748,2
2016-02-16,The Race For 5G Is On,T,0.0049352910573303,0.0469413874436748,0.0071803524044051,-0.0060387919707387,-0.0060026612364971,-0.0123957785684396,0.0062365426852997,-0.0002726657380207,-0.0609859981859975,2
2016-02-19,Apple's Pushback Against US Court Order Raises Privacy Questions For Tech Firms,T,-0.0113540700540307,0.1280501229181352,0.0095521640551221,-0.0002726657380207,0.0049352910573303,0.0071803524044051,-0.0060387919707387,0.0079298091472872,-0.1346237915899828,0
2016-02-22,Report: Yahoo Will Reach Out To Potential Buyers As Soon As Monday,T,0.0079298091472872,-0.1346237915899828,-0.0113540700540307,0.0095521640551221,-0.0002726657380207,0.0049352910573303,0.0071803524044051,-0.003255225838631,-0.0376792610591474,2
2016-02-22,Report: Yahoo Will Reach Out To Potential Buyers As Soon as Monday,T,0.0079298091472872,-0.1346237915899828,-0.0113540700540307,0.0095521640551221,-0.0002726657380207,0.0049352910573303,0.0071803524044051,-0.003255225838631,-0.0376792610591474,2
2016-02-23,"T-Mobile, Crown Castle, American Tower, AT&T, Frontier Are Deutsche Bank's Favs In Telecom",T,-0.003255225838631,-0.0376792610591474,0.0079298091472872,-0.0113540700540307,0.0095521640551221,-0.0002726657380207,0.0049352910573303,0.0097985132128557,0.1061747264895294,0
2016-02-24,New ETF Goes Global For Dividends,T,0.0097985132128557,0.1061747264895294,-0.003255225838631,0.0079298091472872,-0.0113540700540307,0.0095521640551221,-0.0002726657380207,0.0072775754900449,0.0016210887604413,0
2016-03-01,Dial Up This Telecom ETF,T,0.0119078463130701,-0.3317989605636579,-0.0048477973469178,-0.0064222950248581,0.0072775754900449,0.0097985132128557,-0.003255225838631,0.0080236335931866,0.1025535815043761,0
2016-03-02,A Dividend ETF That Deserves More Love,T,0.0080236335931866,0.1025535815043761,0.0119078463130701,-0.0048477973469178,-0.0064222950248581,0.0072775754900449,0.0097985132128557,0.0079595376771277,0.2876349445369341,0
2016-03-03,BlackBerry Priv Now Being Sold To Verizon Customers,T,0.0079595376771277,0.2876349445369341,0.0080236335931866,0.0119078463130701,-0.0048477973469178,-0.0064222950248581,0.0072775754900449,-0.0015793139605065,-0.2512221146405692,2
2016-03-07,The Other Sector ETF Player,T,0.0052729353346572,0.0612647218055013,-0.0015793139605065,0.0079595376771277,0.0080236335931866,0.0119078463130701,-0.0048477973469178,-0.0010490100634366,0.1179685705944113,2
2016-03-09,"Ditch The Risk, Reap Rewards With This ETF",T,-0.0028878638249947,-0.0989571915622813,-0.0010490100634366,0.0052729353346572,-0.0015793139605065,0.0079595376771277,0.0080236335931866,0.0086887971618427,0.1373017821239019,0
2016-03-14,A Telecom ETF For Thrifty Investors,T,-0.0010426078079714,-0.1540495860938014,0.0013048190639601,0.0086887971618427,-0.0028878638249947,-0.0010490100634366,0.0052729353346572,0.0052192704609193,-0.1619500972701245,0
2016-03-24,"Tivo Worth $11 To $15.50 In Takeout, Jefferies Predicts",T,0.0088220675665264,-0.144791187985623,-0.0023300031515597,-0.0074512279119192,0.0093360327540084,-0.0143148153044648,0.0090279349914557,0.0048865130769715,0.2106535235437707,2
2016-04-07,"Benzinga's M&A Chatter for Thursday April 7, 2016",T,-0.001293523073558,0.0008218224262515,0.0022178583371286,-0.0043190262678913,0.0079387940370048,-0.0030635849390995,-0.0050801821887249,-0.0023326591254834,-0.2119206404524164,2
2016-04-08,Re/code's Swisher Reports Yahoo Deadline For Bids Pushed Back One Week,T,-0.0023326591254834,-0.2119206404524164,-0.001293523073558,0.0022178583371286,-0.0043190262678913,0.0079387940370048,-0.0030635849390995,-0.002857226906239,0.0089791203649549,2
2016-04-08,Is Yahoo Getting Close To The Finish Line?,T,-0.0023326591254834,-0.2119206404524164,-0.001293523073558,0.0022178583371286,-0.0043190262678913,0.0079387940370048,-0.0030635849390995,-0.002857226906239,0.0089791203649549,2
2016-04-08,Needham: Yahoo Bidding Delay Means There Could Be More Buyers At Table,T,-0.0023326591254834,-0.2119206404524164,-0.001293523073558,0.0022178583371286,-0.0043190262678913,0.0079387940370048,-0.0030635849390995,-0.002857226906239,0.0089791203649549,2
2016-04-13,"Benzinga's M&A Chatter for Wednesday April 13, 2016",T,-0.0108612798374149,0.2810544707687958,0.0072938517814788,-0.002857226906239,-0.0023326591254834,-0.001293523073558,0.0022178583371286,0.004444645798608,-0.391148361007812,2
2016-04-15,"Notable Imbalances Before Friday's Open: Telecom Pair Trade, Health Care Stocks In Focus",T,0.0015616918712786,0.1466102519439707,0.004444645798608,-0.0108612798374149,0.0072938517814788,-0.002857226906239,-0.0023326591254834,0.0044177467146009,0.0982410105309263,2
2016-04-19,T-Mobile Won The U.S. Growth Battle Last Quarter,T,0.0069857940978665,-0.0805100566648282,0.0044177467146009,0.0015616918712786,0.004444645798608,-0.0108612798374149,0.0072938517814788,-0.0051387274820344,0.053179474672534,1
2016-04-25,Searching for a Catalyst As Earnings Continue,T,0.0036774109488002,-0.2764216101685037,0.0055467692784869,-0.0222105637493531,-0.0051387274820344,0.0069857940978665,0.0044177467146009,-0.0031408836817793,0.1886925889767123,2
2016-04-26,"Earnings Scheduled For April 26, 2016",T,-0.0031408836817793,0.1886925889767123,0.0036774109488002,0.0055467692784869,-0.0222105637493531,-0.0051387274820344,0.0069857940978665,0.0165399457793555,0.9816227795157062,0
2016-04-26,"Keep an Eye on These 12 Stocks for April 26, 2016",T,-0.0031408836817793,0.1886925889767123,0.0036774109488002,0.0055467692784869,-0.0222105637493531,-0.0051387274820344,0.0069857940978665,0.0165399457793555,0.9816227795157062,0
2016-04-27,Should You Be Buying The T-Mobile Earnings Dip?,T,0.0165399457793555,0.9816227795157062,-0.0031408836817793,0.0036774109488002,0.0055467692784869,-0.0222105637493531,-0.0051387274820344,-0.0020663060921666,-0.5121844023842645,2
2016-05-05,Mid-Day Market Update: Fitbit Slides  On Weak Outlook; Atlas Air Worldwide Shares Shares Spike Higher,T,-0.0036007991603647,0.0490091053731454,-0.0007712314053132,-0.0048592786697877,0.0072128380027272,0.0046586224128022,-0.0020663060921666,0.0064532274545063,-0.0354567473716923,0
2016-05-05,Mid-Afternoon Market Update: U.S. Stocks Turn Lower; Zynga Shares Rise Following Earnings Beat,T,-0.0036007991603647,0.0490091053731454,-0.0007712314053132,-0.0048592786697877,0.0072128380027272,0.0046586224128022,-0.0020663060921666,0.0064532274545063,-0.0354567473716923,0
2016-05-05,Mid-Morning Market Update: Markets Edge Higher; Merck Profit Beats Views,T,-0.0036007991603647,0.0490091053731454,-0.0007712314053132,-0.0048592786697877,0.0072128380027272,0.0046586224128022,-0.0020663060921666,0.0064532274545063,-0.0354567473716923,0
2016-05-10,TD Ameritrade's IMX Sentiment For April Shows Clients Were Net Sellers Of Some Popular Names,T,0.0115800710581823,0.2875371681659111,-0.0033341272251493,0.0064532274545063,-0.0036007991603647,-0.0007712314053132,-0.0048592786697877,-0.0033072023119872,-0.1704046614740079,2
2016-05-17,"Well, That Was Quick. Markets Barely Budge in Early Trading",T,-0.0043277730385137,0.4647757355130109,0.0033207192259789,-0.010113852566433,0.0094435550887992,-0.0033072023119872,0.0115800710581823,-0.0168755369815637,0.1503198642885219,1
2016-06-03,"Twitter To Merge With Yahoo? Dorsey Is No Longer Interested, For Now",T,0.0095265511381095,0.564409802368707,0.002840148921205,-0.0107277915074677,0.0041034487992741,0.0038620116290071,0.0056961440587433,0.00331531056482,-0.1302059540393798,2
2016-06-07,"IMMR Spiking; Reuters Reporting ITC Has Said Respondents In Company Complaint Probe Are Apple, AT&T Mobility",T,0.0114387784003742,0.4882819536075422,0.00331531056482,0.0095265511381095,0.002840148921205,-0.0107277915074677,0.0041034487992741,0.0017592776186308,-0.4209171981087886,2
2016-06-07,"Benzinga's M&A Chatter for Tuesday June 7, 2016",T,0.0114387784003742,0.4882819536075422,0.00331531056482,0.0095265511381095,0.002840148921205,-0.0107277915074677,0.0041034487992741,0.0017592776186308,-0.4209171981087886,2
2016-06-07,"Immersion Corporation Spiking; Reuters Reporting ITC Has Said Respondents In Company Complaint Probe Are Apple, AT&T Mobility",T,0.0114387784003742,0.4882819536075422,0.00331531056482,0.0095265511381095,0.002840148921205,-0.0107277915074677,0.0041034487992741,0.0017592776186308,-0.4209171981087886,2
