date,title,stock,close,volume,1_past_close,2_past_close,3_past_close,4_past_close,5_past_close,next_close,next_volume,label
2009-09-04,AT&T to Introduce iPhones with Picture & Video Messaging,T,0.0143144551639571,-0.3927205521995383,-0.0086714920397176,0.0003942202151994,-0.0264877355208356,-0.006104300793719,-0.0079487882823783,0.009408181394573,0.2766480485286746,0
2009-10-06,AT&T (T) And Apple (AAPL) Call Truce,T,0.0145739559155648,0.1193529678924492,0.0090498130853675,-0.0033822999009328,-0.0148096464160065,-0.006984970609297,-0.008384731099404,-0.0160543448478135,0.5654878419808149,1
2009-10-26,"Verizon Outperforms Expectation Behind Increasing Mobile Phone Subscribers (VZ, T, RIMM, AAPL)",T,-0.0163232373056045,-0.0693243220670777,-0.0141768729678429,0.0061686815282748,-0.0019239136847694,-0.0003847926470509,0.0116731377593266,0.0114584039779281,0.0123103629339302,0
2009-11-03,Apple And France Telecom Drop Exclusive iPhone Deal in France,T,-0.008987950260215,-0.4611465980015858,-0.0031165815364611,-0.0213494612217101,0.0057514950448647,0.0187495445845842,0.0114584039779281,0.0067038617555761,-0.0550878109527196,0
2009-11-05,Verizon (VZ) To Roll Out Credible Alternative to iPhone,T,0.0160590938509375,-0.1326797763416533,0.0067038617555761,-0.008987950260215,-0.0031165815364611,-0.0213494612217101,0.0057514950448647,-0.0003855508422412,-0.1293674551248196,2
2009-11-20,Liberty (LMDIA) Looking For Buyers For DirecTV (DTV),T,-0.0034469057615479,-0.0155077788562992,-0.0076019873624789,0.0011418182703817,-0.0003802877623567,0.0015237949450401,-0.0015214765267996,0.0292084802683558,0.934784288212481,0
2009-11-23,"Barron's Savitz Take On PC Sales, ""Palm & Post Transaction Marketing""",T,0.0292084802683558,0.934784288212481,-0.0034469057615479,-0.0076019873624789,0.0011418182703817,-0.0003802877623567,0.0015237949450401,0.0119494820453265,-0.2474610913763374,0
2009-11-25,AT&T (T) To Explore Prepaid Telephony,T,-0.0007382209708179,-0.3963860432847499,0.0119494820453265,0.0292084802683558,-0.0034469057615479,-0.0076019873624789,0.0011418182703817,-0.0033236901890755,-0.2205913281892051,2
2009-12-02,AT&T Drops Lawsuit Against Verizon,T,0.0062544562701847,-0.3144542906232771,0.0089092349141792,-0.0018525042413064,-0.0033236901890755,-0.0007382209708179,0.0119494820453265,0.0062157063345316,0.3858871004760256,0
2009-12-03,Telecom and VoIP Provider Windstream Hits 52-Week High,T,0.0062157063345316,0.3858871004760256,0.0062544562701847,0.0089092349141792,-0.0018525042413064,-0.0033236901890755,-0.0007382209708179,0.0029064499707911,0.2565100909900732,2
2009-12-03,Rumors That AT&T (T) and Verizon (VZ) Are Set To Offer Discounts And Freebies,T,0.0062157063345316,0.3858871004760256,0.0062544562701847,0.0089092349141792,-0.0018525042413064,-0.0033236901890755,-0.0007382209708179,0.0029064499707911,0.2565100909900732,2
2009-12-07,Promising Stocks By Putnam Voyager (PVOYX) Fund Manager,T,0.0134059636184697,-0.2317585844778437,0.0029064499707911,0.0062157063345316,0.0062544562701847,0.0089092349141792,-0.0018525042413064,-0.012870808124633,0.0572285225634441,1
2009-12-08,"Clarity Needed On Adtran: Hold, Tells Auriga (ADTN, T, VZ)",T,-0.012870808124633,0.0572285225634441,0.0134059636184697,0.0029064499707911,0.0062157063345316,0.0062544562701847,0.0089092349141792,-0.0018105948341115,-0.108180486360442,2
2009-12-08," AT&T 3G Network Beats Verizon In Independent Study (T, VZ, OPY)",T,-0.012870808124633,0.0572285225634441,0.0134059636184697,0.0029064499707911,0.0062157063345316,0.0062544562701847,0.0089092349141792,-0.0018105948341115,-0.108180486360442,2
2009-12-14,"Congestion In Telephony Networks - Move Towards Higher Bills Or Consolidation? ATT, AAPL, RIMM, S, NWS",T,0.0014284754171478,0.1225956421634135,0.0090057233152691,0.0072563233812676,-0.0018105948341115,-0.012870808124633,0.0134059636184697,-0.0160432153298744,-0.0069864820677535,1
2009-12-15,"Research In Motion (RIMM) Announces 3Q Results, (VOD, VZ, T)",T,-0.0160432153298744,-0.0069864820677535,0.0014284754171478,0.0090057233152691,0.0072563233812676,-0.0018105948341115,-0.012870808124633,-0.0028980270003008,0.2792843862837044,2
2009-12-23,"ReadWriteWeb Releases 2010 Predictions (AAPL, MSFT, GOOG, T)",T,0.0050179027232515,-0.3997093370204346,0.0130719547226663,0.0080527244133237,0.0036737019349681,-0.010901457180016,-0.0028980270003008,0.00213932164364,-0.6087669252288992,2
2010-01-04,"Nexus – Will It Change Telecom Industry Dynamics? (GOOG, AAPL, RIMM, ATT, VZ)",T,0.019621592384738,0.8129923276638167,-0.0102398774008966,-0.0007056792688326,0.0003530246035314,0.0081854189041994,0.00213932164364,-0.0048986324750806,0.2092866142701408,2
2010-01-05,"Barron's Expects Apple (AAPL), Google (GOOG) To Benefit From Cloud Computing",T,-0.0048986324750806,0.2092866142701408,0.019621592384738,-0.0102398774008966,-0.0007056792688326,0.0003530246035314,0.0081854189041994,-0.0098236511020971,0.0754970184871417,1
2010-01-07,"AT&T Says ‘Apps To All’, Seeks To Extend Smartphone Dominance (T, AAPL, GOOG, MOT, QCOM, NOK)",T,-0.0112277584288406,-0.1133222116918747,-0.0098236511020971,-0.0048986324750806,0.019621592384738,-0.0102398774008966,-0.0007056792688326,-0.0073255311684636,-0.1775847112571399,1
2010-01-07,Google (GOOG) Android Phones To be Offered By AT&T (T)?,T,-0.0112277584288406,-0.1133222116918747,-0.0098236511020971,-0.0048986324750806,0.019621592384738,-0.0102398774008966,-0.0007056792688326,-0.0073255311684636,-0.1775847112571399,1
2010-01-08,"Palm Looking To Boost Smartphone Sales (PALM), (VZ), (T)",T,-0.0073255311684636,-0.1775847112571399,-0.0112277584288406,-0.0098236511020971,-0.0048986324750806,0.019621592384738,-0.0102398774008966,-0.0047973004055992,-0.0666657063885264,2
2010-01-08,Palm Inc. (PALM) Faces Uphill Battle To Grow In Crowded Smart-Phone Market,T,-0.0073255311684636,-0.1775847112571399,-0.0112277584288406,-0.0098236511020971,-0.0048986324750806,0.019621592384738,-0.0102398774008966,-0.0047973004055992,-0.0666657063885264,2
2010-01-12,McDonald’s (MCD) To Give Free WI-FI Services Across Its US Stores,T,-0.0003711034526308,0.0200300759506926,-0.0047973004055992,-0.0073255311684636,-0.0112277584288406,-0.0098236511020971,-0.0048986324750806,-0.0118690766331501,0.6189457326978516,1
2010-01-12,"Solid December Numbers For Smartphones (MOT, VZ, AAPL, T, PALM, NOK, QCOM, GOOG)",T,-0.0003711034526308,0.0200300759506926,-0.0047973004055992,-0.0073255311684636,-0.0112277584288406,-0.0098236511020971,-0.0048986324750806,-0.0118690766331501,0.6189457326978516,1
2010-01-13,"Short Selling Bets Increased Against Citigroup (C), Apple (AAPL)",T,-0.0118690766331501,0.6189457326978516,-0.0003711034526308,-0.0047973004055992,-0.0073255311684636,-0.0112277584288406,-0.0098236511020971,-0.0168919704092918,-0.0080956401903644,1
2010-01-15,AT&T Announces New Unlimited Calling Plans,T,-0.0152730985314262,0.5153659226948069,-0.0168919704092918,-0.0118690766331501,-0.0003711034526308,-0.0047973004055992,-0.0073255311684636,0.0158976116595888,-0.4695001236959848,0
2010-01-25,"Apple To End Deal With AT&T, Introduce Verizon iPhone, (AAPL, VZ, T, MOT, DELL)",T,0.00748393093031,-0.2209032409760454,-0.0109078437605215,-0.0061947752873912,-0.0141220094429794,0.0158976116595888,-0.0152730985314262,-0.0097734588857342,0.1427052053537514,1
2010-01-27,"Early Termination Fees Questioned By The FCC (GOOG, T, VZ, S)",T,0.0114489215845319,0.7264915849798137,-0.0097734588857342,0.00748393093031,-0.0109078437605215,-0.0061947752873912,-0.0141220094429794,-0.0031225143844383,-0.117523106000843,2
2010-01-27,Verizon (VZ) Shares Lead Telecoms Fall After Analyst Downgrade,T,0.0114489215845319,0.7264915849798137,-0.0097734588857342,0.00748393093031,-0.0109078437605215,-0.0061947752873912,-0.0141220094429794,-0.0031225143844383,-0.117523106000843,2
2010-01-28,AT&T's (T) 4th Quarter Earnings Jump 25%,T,-0.0031225143844383,-0.117523106000843,0.0114489215845319,-0.0097734588857342,0.00748393093031,-0.0109078437605215,-0.0061947752873912,-0.0070480251293127,-0.2523660743095086,1
2010-01-28,"Earnings Round-up For Companies Reporting Before The Markets Open (MOT, T, AMZN, MMM, MSFT, MO, BDX, AEP, AZN, BMY, CAH, CEL, C, D, EL)   ",T,-0.0031225143844383,-0.117523106000843,0.0114489215845319,-0.0097734588857342,0.00748393093031,-0.0109078437605215,-0.0061947752873912,-0.0070480251293127,-0.2523660743095086,1
2010-02-09,Bernstein Upgrades Verizon,T,0.0112097475575085,0.2858010510216697,-0.0103015888643416,0.0083895537315954,-0.0215009667261999,-0.0042817418395154,0.0122142086855068,-0.0055425749881016,-0.2372607305037726,1
2010-02-12,"Verizon, And AT&T Obliged To Share Internet Lines With Competitors (T, VZ, TWZ, CBEY, CMCSA, GLW)",T,-0.0047640565713233,0.2428717053916711,0.0027868333645713,-0.0055425749881016,0.0112097475575085,-0.0103015888643416,0.0083895537315954,0.0099719475810493,-0.2406524068329307,0
2010-02-16,"US FCC To Propose Higher Broadband Speeds (GOOG, CMCSA, TWX, T, VZ) ",T,0.0099719475810493,-0.2406524068329307,-0.0047640565713233,0.0027868333645713,-0.0055425749881016,0.0112097475575085,-0.0103015888643416,0.0031597764604938,-0.2469685900009793,2
2010-02-17,"AT&T Becomes The Preferred Carrier For Windows Phone 7 (T, MSFT, AAPL)",T,0.0031597764604938,-0.2469685900009793,0.0099719475810493,-0.0047640565713233,0.0027868333645713,-0.0055425749881016,0.0112097475575085,-0.0062993171484457,0.3856292689700022,1
2010-03-03,"iPad Will Be Used More On Wifi Than 3G, says AT&T CEO (T, AAPL) ",T,0.0004025472222488,-0.3804233369892462,-0.0048001975892633,0.007658275801132,0.0016144936742858,-0.0056200482313097,0.003222132091603,0.0028122474769689,0.3883093374995146,2
2010-03-08,Barron’s Says That BCE (BCE) Most Appealing Among North American Telecoms,T,0.0116044179400627,-0.1171854452479247,0.0012018209489801,0.0028122474769689,0.0004025472222488,-0.0048001975892633,0.007658275801132,0.0110763171466177,0.7608770468815766,0
2010-03-09,"Market Roundup (AAPL, CSCO, VZ, T, S, WRC, PVH, BCS)",T,0.0110763171466177,0.7608770468815766,0.0116044179400627,0.0012018209489801,0.0028122474769689,0.0004025472222488,-0.0048001975892633,-0.0015649215986686,-0.4584913198002331,2
2010-03-23,"Tech Stocks Started On A Strong Note On March 23, Driven By NOVL (DELL, AAPL, ORCL, CSCO, INTC, GOOG, PALM, T)",T,0.0056821637716251,-0.2609012965128151,0.0060970849028185,0.0069075830367983,0.0061773843622399,0.0019343533654216,0.0027152917742716,-0.0109228284688208,0.1260290230143423,1
2010-03-24,Sprint Nextel Corp. (S) Gains 5.85% By Mid-Day Trading,T,-0.0109228284688208,0.1260290230143423,0.0056821637716251,0.0060970849028185,0.0069075830367983,0.0061773843622399,0.0019343533654216,-0.004189312853015,0.179757124669474,2
2010-03-24,"Market Roundup (TIF, SBUX, GENZ, VZ, T, S, GOOG, BAC)       ",T,-0.0109228284688208,0.1260290230143423,0.0056821637716251,0.0060970849028185,0.0069075830367983,0.0061773843622399,0.0019343533654216,-0.004189312853015,0.179757124669474,2
2010-03-25,"US Stocks Dip On Portugal Worries On March 24 (VZ, T, GE, BAC)       ",T,-0.004189312853015,0.179757124669474,-0.0109228284688208,0.0056821637716251,0.0060970849028185,0.0069075830367983,0.0061773843622399,0.0034422902112181,-0.250412989293878,2
2010-03-29,"Apple Developing New iPhones (AAPL, RIMM, VZ, T)",T,0.0102893982787868,0.1251398143336746,0.0034422902112181,-0.004189312853015,-0.0109228284688208,0.0056821637716251,0.0060970849028185,-0.0211240420840287,1.5714328088088445,1
2010-03-30,"New iPhones To Hit The Market (T, AAPL, VZ, S)",T,-0.0211240420840287,1.5714328088088445,0.0102893982787868,0.0034422902112181,-0.004189312853015,-0.0109228284688208,0.0056821637716251,-0.0042390999537494,-0.2974966986277775,2
2010-03-31,"Broadcasters Gear Up For Fight With FCC (T, AAPL, NXST)",T,-0.0042390999537494,-0.2974966986277775,-0.0211240420840287,0.0102893982787868,0.0034422902112181,-0.004189312853015,-0.0109228284688208,0.0104490701497679,-0.4399438750341928,0
2010-04-13,"Four Alternative Smartphone Stock Picks (AAPL, MSFT, T, JNPR, VZ, S, VMW, EMC, AVNW)",T,-0.0068227664629499,0.6572012668310783,-0.0022694048777203,0.0161409205696405,0.0144254424328267,-0.0040354997449671,0.0,0.0015264604873037,-0.2710380213994507,2
2010-04-14,Bank of America Set To Fill Vacant CFO Post By Hiring Noski ,T,0.0015264604873037,-0.2710380213994507,-0.0068227664629499,-0.0022694048777203,0.0161409205696405,0.0144254424328267,-0.0040354997449671,0.0,0.0100822857287385,2
2010-04-16,"Motorola Rated ""Sell"" At MKM Partners (MOT)",T,-0.0118138846537925,0.1425473414984435,0.0,0.0015264604873037,-0.0068227664629499,-0.0022694048777203,0.0161409205696405,0.0173539342154802,0.0412363350356486,0
2010-04-21,"Stocks To Watch On April 21 (T, MCD, BA, MO, LMT)",T,-0.0120027084765816,0.2978593100546507,0.0106143752272511,0.0173539342154802,-0.0118138846537925,0.0,0.0015264604873037,-0.0026578870655211,-0.2637978177930719,2
2010-04-22,"Afternoon Market Update (CenturyTel (NYSE: CTL), Qwest Communications (NYSE: Q), Simon Property Group (NYSE: SPG), General Growth Properties (NYSE: GGP))",T,-0.0026578870655211,-0.2637978177930719,-0.0120027084765816,0.0106143752272511,0.0173539342154802,-0.0118138846537925,0.0,-0.0007613218252466,-0.149461675550553,2
2010-04-28,"Verizon Incredible: Best Android Yet (GOOG, T, S, QCOM, MOT)",T,-0.0015411671375823,0.0084319805297032,-0.0121813992891328,0.0007619018777749,-0.0007613218252466,-0.0026578870655211,-0.0120027084765816,0.0088767523842872,-0.2495469443289746,0
2010-05-06,"Top 5 Cable Stocks To Watch For (CVC, CMCSA, VZ, T, TWC)",T,-0.0244470343255412,1.023585667212063,-0.0050193176287431,-0.0144598572982258,0.0084420862972462,-0.0030601810900362,0.0088767523842872,-0.0015908225414915,-0.2419992750147066,2
2010-05-06,"Mad Money Lightning Round: The Apple Story Remains Best In Show, Says Jim (RTN, WFT, INTC, KMP, TEF, T, MOT, NOK, APPL, V)",T,-0.0244470343255412,1.023585667212063,-0.0050193176287431,-0.0144598572982258,0.0084420862972462,-0.0030601810900362,0.0088767523842872,-0.0015908225414915,-0.2419992750147066,2
2010-05-11,Does AAPL and T’s Five-Year iPhone Exclusivity Deal Still Holds?,T,-0.0011688347501968,-0.2072957259473562,0.0227090384975405,-0.0015908225414915,-0.0244470343255412,-0.0050193176287431,-0.0144598572982258,0.0070202542788331,-0.0940716619674141,0
2010-05-12,Apple (AAPL) Faces Another Patent Infringement Suit,T,0.0070202542788331,-0.0940716619674141,-0.0011688347501968,0.0227090384975405,-0.0015908225414915,-0.0244470343255412,-0.0050193176287431,-0.0030984253365941,-0.2176307484168924,2
2010-05-12,Piper Jaffray Says Verizon Picks Up Circumstantial Traction,T,0.0070202542788331,-0.0940716619674141,-0.0011688347501968,0.0227090384975405,-0.0015908225414915,-0.0244470343255412,-0.0050193176287431,-0.0030984253365941,-0.2176307484168924,2
2010-05-12,"News Summary (GS, KFN, BX, VZ, GOOG, T, AMZN, MS, AAPL)",T,0.0070202542788331,-0.0940716619674141,-0.0011688347501968,0.0227090384975405,-0.0015908225414915,-0.0244470343255412,-0.0050193176287431,-0.0030984253365941,-0.2176307484168924,2
2010-05-24,Rumors Of iPhone On Sprint (S) Surface,T,-0.0169021295259539,-0.4469873716750629,-0.0044068032830519,-0.0238559565220602,-0.0007811674650778,-0.0069851583072255,0.0145671027050642,-0.0045022077739944,0.7405717853101395,2
2010-06-02,"Afternoon Market Update (T, VZ, AMGN, ALXN)",T,0.0184958488198978,-0.1383314025930702,0.0012345292665218,-0.0133981442557604,0.0207210143859688,-0.007812637706654,-0.0045022077739944,0.0008068341162843,-0.0810245352157565,2
2010-06-02,Apple's Jobs Sees AT&T Quality Fix,T,0.0184958488198978,-0.1383314025930702,0.0012345292665218,-0.0133981442557604,0.0207210143859688,-0.007812637706654,-0.0045022077739944,0.0008068341162843,-0.0810245352157565,2
2010-06-10,"Top 5 Large-Cap NYSE Stocks In The Technology Sector With The Highest Net Income (T, IBM, HPQ, VZ, GLW)",T,0.0216868002337666,-0.0032578500051932,-0.0028035178749095,0.0267267658885073,0.006205844726741,-0.0254028318881566,0.0008068341162843,-0.0058960433143064,-0.2821922268595955,1
2010-06-16,Apple's (AAPL) New iPhone Is In High Demand,T,-0.0007831468445349,-0.0496459990184572,0.0146994894164484,-0.0047446803702017,-0.0058960433143064,0.0216868002337666,-0.0028035178749095,0.0019595946867232,0.1900273911105097,2
2010-06-16,Late Market Roundup,T,-0.0007831468445349,-0.0496459990184572,0.0146994894164484,-0.0047446803702017,-0.0058960433143064,0.0216868002337666,-0.0028035178749095,0.0019595946867232,0.1900273911105097,2
2010-06-16,"Demand Is Outstripping iPhone Availability (AAPL, T) ",T,-0.0007831468445349,-0.0496459990184572,0.0146994894164484,-0.0047446803702017,-0.0058960433143064,0.0216868002337666,-0.0028035178749095,0.0019595946867232,0.1900273911105097,2
2010-06-16,"Piper Jaffray Raises Price Target On Apple To $348 (AAPL, T) ",T,-0.0007831468445349,-0.0496459990184572,0.0146994894164484,-0.0047446803702017,-0.0058960433143064,0.0216868002337666,-0.0028035178749095,0.0019595946867232,0.1900273911105097,2
2010-06-17,"Top Performing Industries For June 17 (UXG, KR, CDE, AAPL)",T,0.0019595946867232,0.1900273911105097,-0.0007831468445349,0.0146994894164484,-0.0047446803702017,-0.0058960433143064,0.0216868002337666,-0.0054752733991484,0.7086320869925684,1
2010-06-22,Late Market Update,T,-0.0031448361991041,0.5360435845773883,0.0003931379695325,-0.0054752733991484,0.0019595946867232,-0.0007831468445349,0.0146994894164484,0.0031547573943573,0.0018613958359938,2
2010-06-24,iPhone 4 Buying Frenzy Underway (AAPL) ,T,-0.0153300354227439,0.0624925012436534,0.0031547573943573,-0.0031448361991041,0.0003931379695325,-0.0054752733991484,0.0019595946867232,-0.0103793328385705,0.8860457245591824,1
2010-06-28,"Look Out Apple, RIM: Here Comes Motorola",T,0.006454390010818,-0.5781805398722408,-0.0103793328385705,-0.0153300354227439,0.0031547573943573,-0.0031448361991041,0.0003931379695325,-0.0196394978640784,1.4200320098013242,1
2010-06-29,"Reports Indicate iPhone Will Be Introduced On Verizon Network By Next January (AAPL, VZ)",T,-0.0196394978640784,1.4200320098013242,0.006454390010818,-0.0103793328385705,-0.0153300354227439,0.0031547573943573,-0.0031448361991041,-0.0110378857152909,-0.2962237693438959,1
2010-07-01,"AT&T To Lose iPhone Exclusivity? (VZ, T)",T,0.0062004418207752,0.3761110738030091,-0.0110378857152909,-0.0196394978640784,0.006454390010818,-0.0103793328385705,-0.0153300354227439,-0.0020544601306456,-0.5467031880148441,2
2010-07-08,More Americans Use Smartphones To Access The Web,T,0.0098642984434158,-0.2632092038239139,0.0199581673797339,0.0049406252030645,-0.0020544601306456,0.0062004418207752,-0.0110378857152909,0.0105820814364241,-0.1619134487850267,0
2010-07-12,"News Summary (S, VZ, T, AVP)",T,0.0004028382514571,-0.1173088470416694,0.0105820814364241,0.0098642984434158,0.0199581673797339,0.0049406252030645,-0.0020544601306456,0.0044285964342882,0.5098397520185964,2
2010-07-15,iPhone 4 Antenna Design Could Lead To Dropped Calls,T,0.0016028322404502,0.7794329490424059,0.0004002573174655,0.0044285964342882,0.0004028382514571,0.0105820814364241,0.0098642984434158,-0.0124003059036161,-0.1117381333506351,1
2010-07-15,"Apple, AT&T and Antitrust",T,0.0016028322404502,0.7794329490424059,0.0004002573174655,0.0044285964342882,0.0004028382514571,0.0105820814364241,0.0098642984434158,-0.0124003059036161,-0.1117381333506351,1
2010-07-15,A Peek Into The Market Before The Opening Bell,T,0.0016028322404502,0.7794329490424059,0.0004002573174655,0.0044285964342882,0.0004028382514571,0.0105820814364241,0.0098642984434158,-0.0124003059036161,-0.1117381333506351,1
2010-07-15,Verizon Gaining Traction With Droid Line,T,0.0016028322404502,0.7794329490424059,0.0004002573174655,0.0044285964342882,0.0004028382514571,0.0105820814364241,0.0098642984434158,-0.0124003059036161,-0.1117381333506351,1
2010-07-19,24/7 Wall St. CEOs Who Need to be Fired: Nine for 2010  ,T,0.0076955085286034,-0.4305785123966942,-0.0124003059036161,0.0016028322404502,0.0004002573174655,0.0044285964342882,0.0004028382514571,-0.003617355591396,0.2695553662549046,2
2010-07-21,A Peek Into The Market Before The Trading Starts,T,0.0052439883835249,0.2050392782270969,-0.003617355591396,0.0076955085286034,-0.0124003059036161,0.0016028322404502,0.0004002573174655,0.023676149501169,0.6545739431959003,0
2010-07-22,US Stock Futures Point To A Stronger Open,T,0.023676149501169,0.6545739431959003,0.0052439883835249,-0.003617355591396,0.0076955085286034,-0.0124003059036161,0.0016028322404502,0.0011757967819483,-0.3184504985696156,2
2010-07-22,"Stocks To Watch For July 22 (MSFT, T, AMZN, MS)",T,0.023676149501169,0.6545739431959003,0.0052439883835249,-0.003617355591396,0.0076955085286034,-0.0124003059036161,0.0016028322404502,0.0011757967819483,-0.3184504985696156,2
2010-07-22,AT&T Profit Climbs 25% To $4 Billion (T),T,0.023676149501169,0.6545739431959003,0.0052439883835249,-0.003617355591396,0.0076955085286034,-0.0124003059036161,0.0016028322404502,0.0011757967819483,-0.3184504985696156,2
2010-07-26,The Biggest Companies You’ve Never Heard Of…And What They Do,T,0.0164448391842662,-0.197053960136521,0.0011757967819483,0.023676149501169,0.0052439883835249,-0.003617355591396,0.0076955085286034,0.0073192170453926,-0.0058293042218428,0
2010-07-27,Overshadowed BlackBerry Bold Is All Business,T,0.0073192170453926,-0.0058293042218428,0.0164448391842662,0.0011757967819483,0.023676149501169,0.0052439883835249,-0.003617355591396,0.0019117204600307,0.2866592302624005,2
2010-08-02,"News Summary (V, MA, BP, T, VZ, DTEGY)",T,0.025057959160641,0.3719284244334344,-0.0030747626183577,-0.0068699073212176,0.0019117204600307,0.0073192170453926,0.0164448391842662,0.0037605950650798,-0.3047059465855453,2
2010-08-03,Stop Trading: Cramer Says Love For Research In Motion Has Vanished,T,0.0037605950650798,-0.3047059465855453,0.025057959160641,-0.0030747626183577,-0.0068699073212176,0.0019117204600307,0.0073192170453926,-0.0018732830543864,0.0713434526302676,2
2010-08-03,"Market Roundup (RIMM, VZ, T, GOOG, GS, JPM, MS)",T,0.0037605950650798,-0.3047059465855453,0.025057959160641,-0.0030747626183577,-0.0068699073212176,0.0019117204600307,0.0073192170453926,-0.0018732830543864,0.0713434526302676,2
2010-08-04,New Tablet Competition From Motorola And Verizon,T,-0.0018732830543864,0.0713434526302676,0.0037605950650798,0.025057959160641,-0.0030747626183577,-0.0068699073212176,0.0019117204600307,0.0037537784049506,-0.1013813095533028,2
2010-08-05,CSL: High iPhone 4 Demand In Hong Kong Causing Delivery Challenges,T,0.0037537784049506,-0.1013813095533028,-0.0018732830543864,0.0037605950650798,0.025057959160641,-0.0030747626183577,-0.0068699073212176,-0.0074796005437614,0.1229291776308265,1
2010-08-05,"Historic Deal Between Verizon And Google To End Net Neutrality (VZ, GOOG)",T,0.0037537784049506,-0.1013813095533028,-0.0018732830543864,0.0037605950650798,0.025057959160641,-0.0030747626183577,-0.0068699073212176,-0.0074796005437614,0.1229291776308265,1
2010-08-09,"Stop Trading: Jim Cramer Prefers PG To CL, UL",T,0.0120572925045037,-0.1500797260594459,-0.0074796005437614,0.0037537784049506,-0.0018732830543864,0.0037605950650798,0.025057959160641,0.0055842807632453,0.1874905164171842,0
2010-08-09,A Peek Into The Market Before The Trading Starts,T,0.0120572925045037,-0.1500797260594459,-0.0074796005437614,0.0037537784049506,-0.0018732830543864,0.0037605950650798,0.025057959160641,0.0055842807632453,0.1874905164171842,0
2010-08-09,"Piper Jaffray On Telecom Sector (VZ, T, AMT)",T,0.0120572925045037,-0.1500797260594459,-0.0074796005437614,0.0037537784049506,-0.0018732830543864,0.0037605950650798,0.025057959160641,0.0055842807632453,0.1874905164171842,0
2010-08-10,Sam’s Club Adds Wi-Fi As A Marketing Tool ,T,0.0055842807632453,0.1874905164171842,0.0120572925045037,-0.0074796005437614,0.0037537784049506,-0.0018732830543864,0.0037605950650798,-0.0170304907209594,0.0926252052328728,1
2010-08-10,The Greatest Brands in American History,T,0.0055842807632453,0.1874905164171842,0.0120572925045037,-0.0074796005437614,0.0037537784049506,-0.0018732830543864,0.0037605950650798,-0.0170304907209594,0.0926252052328728,1
2010-08-11,Prepaid Phone Plans Finally Get Real,T,-0.0170304907209594,0.0926252052328728,0.0055842807632453,0.0120572925045037,-0.0074796005437614,0.0037537784049506,-0.0018732830543864,0.0041429422688503,0.04856049081229,2
2010-08-12,"Top 10 Dividend Yields In The S&P 500 (FTR, WIN, CTL, PBI, DO, VZ, T, RAI, MO, POM)",T,0.0041429422688503,0.04856049081229,-0.0170304907209594,0.0055842807632453,0.0120572925045037,-0.0074796005437614,0.0037537784049506,0.0022504576801556,-0.2223041142557652,2
2010-08-12,"The Verizon iPhone Already Has A Codename (AAPL, VZ)",T,0.0041429422688503,0.04856049081229,-0.0170304907209594,0.0055842807632453,0.0120572925045037,-0.0074796005437614,0.0037537784049506,0.0022504576801556,-0.2223041142557652,2
2010-08-13,Searching For Yield? Try These ETFs,T,0.0022504576801556,-0.2223041142557652,0.0041429422688503,-0.0170304907209594,0.0055842807632453,0.0120572925045037,-0.0074796005437614,-0.0026196886311568,-0.16298464713687,2
2010-08-24,"Verizon iPhone: Not As Done As You'd Like To Believe (VZ, AAPL)",T,0.0086823688256316,0.0061567842115071,0.0015120545664921,-0.0192808067342912,-0.0113633889892679,0.0114939997798084,0.0120079488475424,0.0063625900870867,0.1153958815431031,0
2010-08-25,Verizon's Smartphone Holding Pattern Will Pay Off,T,0.0063625900870867,0.1153958815431031,0.0086823688256316,0.0015120545664921,-0.0192808067342912,-0.0113633889892679,0.0114939997798084,-0.0070658409069326,-0.3196134380848721,1
2010-08-25,Dell Starts At The Back Of The Line With New Smartphone ,T,0.0063625900870867,0.1153958815431031,0.0086823688256316,0.0015120545664921,-0.0192808067342912,-0.0113633889892679,0.0114939997798084,-0.0070658409069326,-0.3196134380848721,1
