date,title,stock,close,volume,1_past_close,2_past_close,3_past_close,4_past_close,5_past_close,next_close,next_volume,label
2010-04-12,"Standpoint Research Initiates Wendy's With A Buy (WEN, MCD)",WEN,0.0248099810137911,0.7591671449524904,-0.0056929141401739,0.0057255089711554,0.0076920505539559,0.0136451021856351,,-0.011173446326036,0.1072483732395641,1
2010-05-26,"Mad Money Lightning Round: Jim Gives Up On Alcoa, Prefers DOW Instead",WEN,0.0159811577193649,0.3801447351197711,0.0022884313666609,0.0139215208660399,-0.0270880503211351,-0.043196328628648,0.0,0.0191656078305706,-0.2723626805408774,0
2010-06-24,"Benzinga's After Hours Movers (ORCL, RIMM, GS, WEN) ",WEN,0.0218451178981773,0.2420200321436563,-0.0072291655948489,-0.023529441142906,-0.0139207309053638,-0.0046192895962536,-0.0313195841690038,-0.0095011682760954,-0.5221018607495413,1
2010-08-10,"News Summary (BRK-A, WEN, INTC)",WEN,-0.0292795441806309,-0.210553946063658,0.0206895814358065,0.0,0.0116280690414829,0.0070253444285781,-0.0206420545447607,-0.0371226250297659,0.4126397714398306,1
2011-01-26,How Hysteria Kills The Market (NVAX),WEN,-0.0064521500339848,-0.3108163232006787,-0.0352695049136851,0.0083683171385831,0.0,0.0693512794059669,-0.0088693702373556,0.0173159935194238,0.8653582082484965,0
2011-04-12,"Cheaper Kindle, Tarnished Reading Experience? (AMZN)",WEN,0.0041843155883354,-0.6426464634781099,-0.0343434851968338,-0.027505166110846,-0.0097277325765212,0.0058711730377269,0.0019607942743815,0.0020829581102261,0.1745589901278523,2
2011-04-29,"5 Stocks Likely To Rise Now That The Royal Wedding Is Over (MCD, WEN, HSY, AEO, PG, GOOG, RGLD)",WEN,0.0062630786654502,-0.1425049573932151,-0.0041575774363946,0.0083852676271407,0.0063292102912815,0.0128205102857943,-0.0147368498970413,0.0041493337838123,1.2111875,2
2011-05-10,"Stocks To Watch For May 10 (DIS, MNKD, MDR, MSFT, WEN)",WEN,0.0414937217690769,4.7116382919341335,-0.0183296564218811,0.002040574571013,0.0061599398147946,0.0041239861655366,0.0020660621163213,-0.0139444145235768,-0.4982555412220006,1
2011-05-10,US Stock Futures Up After China Trade Surplus; All Eyes On Microsoft ,WEN,0.0414937217690769,4.7116382919341335,-0.0183296564218811,0.002040574571013,0.0061599398147946,0.0041239861655366,0.0020660621163213,-0.0139444145235768,-0.4982555412220006,1
2011-05-10,"Morning News Summary for May 10, 2011",WEN,0.0414937217690769,4.7116382919341335,-0.0183296564218811,0.002040574571013,0.0061599398147946,0.0041239861655366,0.0020660621163213,-0.0139444145235768,-0.4982555412220006,1
2011-06-14,Wendy's Up 6% After Arby's Sale; Investors Reconsidering The Stock?,WEN,0.063596409389133,0.340433260349716,0.0088498510051384,-0.0022077646266186,-0.0043956475723685,-0.0065501156887087,-0.0129308344541649,0.006185723321693,-0.500688751891245,0
2011-07-07,Stocks to Watch for 07/7/11: Fresh 52 Week Highs and Lows,WEN,0.0332717666864443,-0.0798109505974674,0.0484492759938461,-0.0057799020770076,0.0236685114283903,-0.003929312091275,0.0139442083587295,-0.0143110823710113,-0.5111541816067449,1
2011-07-08,Stocks to Watch for 07/8/11: Fresh 52 Week Highs and Lows,WEN,-0.0143110823710113,-0.5111541816067449,0.0332717666864443,0.0484492759938461,-0.0057799020770076,0.0236685114283903,-0.003929312091275,-0.029038283509792,0.038676552216319,1
2011-07-22,Golden Arches Have The Golden Touch,WEN,0.0109888366498585,-0.1563037328748128,0.0186567262543542,0.0018693209286089,0.0209921896561304,-0.015037396891362,0.0,-0.0126810346180381,-0.2282120395327942,1
2011-08-08," McDonald's Investors Loving It, Relatively Speaking",WEN,-0.0961143831331173,0.5594204822676203,-0.0020410556920027,-0.0558763916053222,0.0216534267777617,-0.0323808969926863,-0.0037952785461904,0.0769230020816034,-0.2660856054317518,0
2011-08-11,"EAT, Pray, Love",WEN,0.0923075863688276,1.044881791959369,-0.0441175369753639,0.0769230020816034,-0.0961143831331173,-0.0020410556920027,-0.0558763916053222,0.0040239993725557,-0.3919590189382179,2
2011-08-11,US Stock Futures Up; Cisco Shares Jump In Pre-Market,WEN,0.0923075863688276,1.044881791959369,-0.0441175369753639,0.0769230020816034,-0.0961143831331173,-0.0020410556920027,-0.0558763916053222,0.0040239993725557,-0.3919590189382179,2
2011-09-09,Is McDonald's Headed To The Dollar Menu?,WEN,-0.0223122499928168,1.1025244503886986,-0.0237621889728651,0.028513146030513,0.0082131274470849,-0.0161615840724504,0.0164270715707046,0.014522739535991,-0.2437133485737004,0
2011-11-09,Wendy's Needs to Be Re-Heated,WEN,-0.0418943428131537,-0.1331238408241319,-0.0036300758485853,0.0018186169099665,0.0147597222745918,0.0524277358439007,0.0117874514140512,-0.0171100542944042,-0.1770131252217098,1
2011-11-10,"End-of-Day Market Summary for November 10, 2011",WEN,-0.0171100542944042,-0.1770131252217098,-0.0418943428131537,-0.0036300758485853,0.0018186169099665,0.0147597222745918,0.0524277358439007,0.0174079044852994,-0.2870689655172413,0
2011-12-14,Are You a Perfect 10 or an Ugly 1?,WEN,-0.0291259861469119,0.4172167310783543,-0.015296524832561,-0.0057036532990623,0.0233466656028986,-0.0463824889559446,0.0150663010655334,0.0359998810577959,2.484796563540711,0
2012-01-17,Burger King Offers Cholesterol on Wheels,WEN,-0.0130113431467242,-0.141006247944755,-0.0018554759149322,0.0,-0.0055347197395373,0.011194033244237,-0.0128910897777654,0.0169496173868239,0.9121047393002066,0
2012-03-19,Wendy's Overtakes Burger King to Grab Number 2 Spot,WEN,-0.0019838576005678,-0.4887235436986776,0.026476758279831,0.0144624105539012,0.0,0.0062371049991218,-0.0163602340589317,0.003976205507868,-0.1504800683657567,2
2012-03-22,McDonald's New CEO Has Big Clown Shoes to Fill,WEN,-0.009920552373389,-0.0447689345314505,-0.0019805294010371,0.003976205507868,-0.0019838576005678,0.026476758279831,0.0144624105539012,-0.0120241173163878,0.196749538048043,1
2012-04-02,Burger King Goes Casual Dining,WEN,0.0,-0.0150910667823069,0.0100808055100449,0.0,-0.0060120586581939,-0.0118814338287761,0.0243410972762474,0.0099798336724672,0.4214008956876163,0
2012-04-04,"Burger King Plans to Offer Stock, not Just More Food Choices ",WEN,-0.0118574768737131,0.1907602442694043,0.0099798336724672,0.0,0.0100808055100449,0.0,-0.0060120586581939,-0.0020001528168459,-0.1429718159115234,2
2012-04-24,USDA Assures Consumers That Existing Safeguards Protected Food Supply; Reiterates Safety of Consuming Beef Products,WEN,-0.0187496748195631,0.153242431914355,-0.0020795396964148,0.0041753045068302,-0.0082817030528837,-0.0041237755840201,-0.0081800239470124,0.0254781157249956,-0.2180894436429781,0
2012-05-08,Wendy's Misses Estimates but Returns to Profit,WEN,-0.0410674848032517,1.0414892264666626,0.0124738314757129,-0.0020743446272811,-0.002070928369991,-0.0202836835080616,0.0123204012155904,-0.0364024922313517,-0.2737964584549524,1
2012-06-13,Goldman Sachs Downgrades McDonald's to Hold,WEN,-0.0089891789137278,-0.0590430305606726,-0.0044741756967854,-0.0110616761122891,-0.0022076246357782,0.0022125090252091,0.0111854054445008,0.009070717213637,0.0011545605140304,0
2012-06-21,Why Burger King is not a 'Whopper' Investment,WEN,-0.0131289499246676,0.1833144532551476,0.0,0.0,0.0133036123854939,0.0134831912315054,0.009070717213637,0.0066517056996406,0.3525734880054061,0
2012-06-27,Revisiting Three Stocks Bill Ackman Sold in Q1 2012,WEN,0.0044839364283268,0.6745983446932815,0.0,-0.0176210958263927,0.0066517056996406,-0.0131289499246676,0.0,0.0200896318167658,1.0484064396554855,0
2012-11-08,"US Stock Futures Flat; ECB, Economic Data In Focus",WEN,0.0305164315934156,1.90478657273104,-0.0206895559897963,0.0116279134833212,-0.0023202286830341,-0.0069122257107602,0.018779054678218,0.013667610278705,-0.4670702999607661,0
2012-11-08,"Earnings Scheduled For November 8, 2012",WEN,0.0305164315934156,1.90478657273104,-0.0206895559897963,0.0116279134833212,-0.0023202286830341,-0.0069122257107602,0.018779054678218,0.013667610278705,-0.4670702999607661,0
2013-01-07,Jamba Juice and Krispy Kreme: Two Takeover Targets?,WEN,0.0063027176511054,-0.4838382403668607,0.0021053918977256,0.0106381858193309,0.0,-0.0063423782134005,0.0021185206470781,-0.0104387992660104,0.0103781743847786,1
2013-01-17,This Fast Food Stock May Be Your Chipotle Replacement,WEN,0.0019683886065229,-0.6953268389100664,0.0367352389016286,0.0103089220930947,0.0062245098916948,0.0020787570411788,0.0041751212456828,0.001964404484523,0.650949953660797,2
2013-02-11,Mid-Morning Market Update: AOL Rises While BlackBerry Takes a Breather,WEN,0.0358567436422654,3.340878019140209,-0.0019880743994689,-0.0039605192930189,-0.0098038183772738,-0.0019567169175475,-0.0038987576365154,0.0153845200944358,-0.646570548712206,0
2013-02-28,"Earnings Scheduled For February 28, 2013",WEN,0.0363635658950616,0.8169808941295165,0.0018214792832078,0.0146789199664634,-0.0072857690879881,0.0,-0.0178894306576632,-0.0333331775091715,0.2141382242196039,1
2013-02-28,"US Stock Futures Flat; GDP, Weekly Jobless Claims Data In Focus ",WEN,0.0363635658950616,0.8169808941295165,0.0018214792832078,0.0146789199664634,-0.0072857690879881,0.0,-0.0178894306576632,-0.0333331775091715,0.2141382242196039,1
2013-03-22,Panera Has Analysts Eating Out of the Palm of its Hand,WEN,-0.0017792400083825,-0.2663933492768477,0.0035715063642536,0.0071941879072636,0.0145986426782684,-0.0072465338303521,0.0036364427177641,0.0035647171426025,-0.4301592722530969,2
2013-03-27,This Fast Food Chain is Up 70 Percent and Nobody Even Noticed,WEN,0.0017332939810263,-0.209900083899016,0.0248669096826394,0.0035647171426025,-0.0017792400083825,0.0035715063642536,0.0071941879072636,-0.0173012071495907,0.7208546513498728,1
2013-04-01,Obamacare May Cost Far Less than Businesses Thought,WEN,0.0070423027088257,-0.6071542100637634,-0.0173012071495907,0.0017332939810263,0.0248669096826394,0.0035647171426025,-0.0017792400083825,-0.0017482379939072,0.841210909610167,2
2013-05-09,"McDonald's Down on Slow April – Avian Flu, Stiff Competition, Poor Customer Service All Cited",WEN,0.00173008998148,-0.4918658378943316,-0.0555556845602648,-0.0032568219817111,0.0406776435846691,0.0207611822226903,0.0176058088963424,-0.0017271019397171,-0.3483579383228914,2
2013-06-25,Supreme Court Ruling a Win for Ethanol Producers,WEN,0.0088183770982588,-0.1724880867890094,-0.0087412930795568,-0.0086655450109223,-0.0351168471335292,-0.0016695931846973,0.0084173423732545,0.0157340807389319,-0.2526112659662449,0
2013-07-01,Corn Hits New Low as Yield Now Expected to be Large,WEN,0.0137221980579163,0.2746217527833285,-0.0034187960279584,0.0068850743542674,0.0157340807389319,0.0088183770982588,-0.0087412930795568,0.0,-0.3939156401642404,2
2013-07-01,"Corn Hits New Low, Larger Yield Expected  (CORN)",WEN,0.0137221980579163,0.2746217527833285,-0.0034187960279584,0.0068850743542674,0.0157340807389319,0.0088183770982588,-0.0087412930795568,0.0,-0.3939156401642404,2
2013-07-23,"Mid-Day Market Update: Sourcefire Surges On Acquisition News, STMicroelectronics Shares Fall",WEN,0.0823355733419746,2.1021008544897204,-0.0014950728276492,-0.0176209383777635,0.0287009860718769,0.0076103808735854,0.0092162080353472,-0.0152145563393293,-0.5875846092590582,1
2013-07-23,"Market Wrap for Tuesday, July 23: Stocks Close Mixed as Investors Focus on Earnings ",WEN,0.0823355733419746,2.1021008544897204,-0.0014950728276492,-0.0176209383777635,0.0287009860718769,0.0076103808735854,0.0092162080353472,-0.0152145563393293,-0.5875846092590582,1
2013-07-23,"Earnings Scheduled For July 23, 2013",WEN,0.0823355733419746,2.1021008544897204,-0.0014950728276492,-0.0176209383777635,0.0287009860718769,0.0076103808735854,0.0092162080353472,-0.0152145563393293,-0.5875846092590582,1
2013-07-25,McDonald's Fights to Regain Customers and to Counter Worker Wage Criticism,WEN,-0.0140448345181525,-0.4304972879987361,-0.0152145563393293,0.0823355733419746,-0.0014950728276492,-0.0176209383777635,0.0287009860718769,0.017093815134852,-0.0383892245099247,0
2013-07-25,McDonald's Fights to Regain Customers and to Counter Worker Wage Criticism (MCD),WEN,-0.0140448345181525,-0.4304972879987361,-0.0152145563393293,0.0823355733419746,-0.0014950728276492,-0.0176209383777635,0.0287009860718769,0.017093815134852,-0.0383892245099247,0
2013-08-29,Fast Food Workers to Strike Thursday But Don't Expect Anything to Change,WEN,0.0013124060061,-0.3077235552185452,0.0105401628066263,-0.0488720499320933,0.0037734662431998,0.0037877592247719,0.0063534896395724,-0.0091747243887212,0.6998004928998944,1
2013-08-29,"Fast Food Workers to Strike Thursday, But Don't Expect Anything to Change",WEN,0.0013124060061,-0.3077235552185452,0.0105401628066263,-0.0488720499320933,0.0037734662431998,0.0037877592247719,0.0063534896395724,-0.0091747243887212,0.6998004928998944,1
2013-10-17,Taxpayers Foot $1.2 Billion Public Assistance Bill for McDonald's Employees,WEN,-0.0035289825165831,-0.0317991349013246,0.0167461885654973,-0.0199297645138152,-0.001171022606628,0.022754729472957,0.025798469794146,0.0141673702366209,0.2310216048305469,0
2013-10-22,McDonald's Fights Slow Sales by Changing Dollar Menu Name,WEN,-0.0046295394471634,-0.3028393799678718,0.0058206932584452,0.0141673702366209,-0.0035289825165831,0.0167461885654973,-0.0199297645138152,-0.0127907701296098,0.002274291528264,1
2013-10-22,McDonald's Fights Slow Sales By Changing Dollar Menu Name,WEN,-0.0046295394471634,-0.3028393799678718,0.0058206932584452,0.0141673702366209,-0.0035289825165831,0.0167461885654973,-0.0199297645138152,-0.0127907701296098,0.002274291528264,1
2013-10-24,Panera Attempting to Speed Up Service (PNRA),WEN,0.0212015163104974,0.5736123966201894,-0.0127907701296098,-0.0046295394471634,0.0058206932584452,0.0141673702366209,-0.0035289825165831,0.0011534641873398,-0.356816241343326,2
2013-10-24,Panera Attempting to Speed Up Service,WEN,0.0212015163104974,0.5736123966201894,-0.0127907701296098,-0.0046295394471634,0.0058206932584452,0.0141673702366209,-0.0035289825165831,0.0011534641873398,-0.356816241343326,2
2013-11-07,"Earnings Scheduled For November 7, 2013",WEN,-0.1144110823591537,2.2121122889674125,-0.0151681704010572,0.0131724654693221,0.0435281192011514,0.004602901791088,-0.0034404166967402,0.0360248742090152,-0.5735553857906799,0
2013-12-05,"Time to Chow Down on this High-Dividend, Low-DebtTakeover Candidate?",WEN,0.0011707869868469,-0.1380973629969614,-0.0058205382952863,0.0,-0.0023228746500014,-0.0057738246839912,-0.0034521350080991,0.0,0.118929046891179,2
2013-12-05,"Time to Chow Down on this High-Dividend, Low-Debt Takeover Candidate?",WEN,0.0011707869868469,-0.1380973629969614,-0.0058205382952863,0.0,-0.0023228746500014,-0.0057738246839912,-0.0034521350080991,0.0,0.118929046891179,2
2013-12-05,"Time to Chow Down on this High Dividend, Low Debt Restaurant Takeover Candidate?",WEN,0.0011707869868469,-0.1380973629969614,-0.0058205382952863,0.0,-0.0023228746500014,-0.0057738246839912,-0.0034521350080991,0.0,0.118929046891179,2
2013-12-05,"Time to Chow Down on Shares of this High Dividend, Low Debt Restaurant Company Takeover Candidate?",WEN,0.0011707869868469,-0.1380973629969614,-0.0058205382952863,0.0,-0.0023228746500014,-0.0057738246839912,-0.0034521350080991,0.0,0.118929046891179,2
2014-01-03,Is Wendy's Success at McDonald's Expense?,WEN,-0.0113894253132796,-0.4567669755477732,0.0068807826970276,-0.001145505639141,-0.0045609914846298,-0.0134981489096985,0.0033858316824104,-0.0322584445624819,1.7172319365604585,1
2014-01-13,Market Wrap For January 13: Markets Showing Weakness Ahead Of Major Earning Releases,WEN,0.0639808064327365,7.252866332514865,0.0047621702481051,-0.0011890923524248,-0.0070841490689689,0.0083336941771701,-0.0322584445624819,-0.0189310094178828,-0.5724293262977234,1
2014-01-13,Market Wrap For January 13: Markets Showing Weakness Ahead of Major Earning Releases,WEN,0.0639808064327365,7.252866332514865,0.0047621702481051,-0.0011890923524248,-0.0070841490689689,0.0083336941771701,-0.0322584445624819,-0.0189310094178828,-0.5724293262977234,1
2014-01-13,Mid-Afternoon Market Update: Markets Dip Despite Large Amount of M&A,WEN,0.0639808064327365,7.252866332514865,0.0047621702481051,-0.0011890923524248,-0.0070841490689689,0.0083336941771701,-0.0322584445624819,-0.0189310094178828,-0.5724293262977234,1
2014-02-18,"Burger King Says ""Size Matters"" – Unveils Bigger Big Mac Alternative",WEN,0.0096463695333752,-0.0491403988802252,-0.0032050267333868,0.0118919558613754,0.0109289978369466,0.0066007077428364,-0.004381276996762,0.0180464431529177,0.1188622754491017,0
2014-02-27,"Earnings Scheduled For February 27, 2014",WEN,-0.019723854181195,0.7323575820229611,0.0039412210343323,0.0160155055405761,0.0090908536014204,0.0081470930997626,0.0239832253563803,-0.0362170259750699,0.3836097239234901,1
2014-04-02,Burger King and Taco Bell Tag Team McDonald's for Fast Food Crown,WEN,0.0065781548960213,-0.543400939426027,0.0,0.0122090738440536,0.0157834252328559,0.0033938466523397,-0.0100782800785093,-0.0163394255151103,0.3592793007076174,1
2014-04-02,Burger King And Taco Bell Tag Team McDonald's For Fast Food Crown,WEN,0.0065781548960213,-0.543400939426027,0.0,0.0122090738440536,0.0157834252328559,0.0033938466523397,-0.0100782800785093,-0.0163394255151103,0.3592793007076174,1
2014-08-07,McDonald's Drive-Thru Speed Test: Food in 60 Seconds or Less,WEN,0.0225561911705725,0.8263763238141029,-0.0062264055878552,-0.0110836494460299,0.0037081075275171,-0.0073620396750785,-0.0157003931466452,-0.0024509122076908,-0.442373773762678,2
2014-08-15,5 Famous Fast Food Resurrections,WEN,-0.0085784040124531,0.7187533241144559,-0.0024454105152019,0.0036813018972179,-0.0121212218314208,0.0135135602631883,-0.0024509122076908,0.0111252460752979,-0.4700251681313694,0
2014-08-18,6 Of The Most Successful Fast Food Campaigns Of All Time,WEN,0.0111252460752979,-0.4700251681313694,-0.0085784040124531,-0.0024454105152019,0.0036813018972179,-0.0121212218314208,0.0135135602631883,0.0048894861609871,-0.1954456987154534,2
2014-08-20,Russia Fires Latest Salvo In War Against McDonald's,WEN,-0.0085156486343577,0.9149450868450336,0.0048894861609871,0.0111252460752979,-0.0085784040124531,-0.0024454105152019,0.0036813018972179,0.0024539192051331,-0.509044972208186,2
2014-09-03,Fast Food Companies Handing Out Free Food,WEN,-0.0173482055020418,0.621267150928168,-0.0098161306350595,0.0012286115636837,0.0099255998104279,-0.0157767482059386,-0.0084234221773468,-0.0050441574447813,-0.3944409873470235,1
2014-11-06,"Earnings Scheduled For November 6, 2014",WEN,0.0235732641184054,1.035379072077816,-0.0110430944043079,0.0124221235991399,0.0037411272677627,0.001248052124555,0.0,0.0060608041024468,-0.6387504735262406,0
2014-11-06,"US Stock Futures Edge Lower Ahead Of Earnings, Jobless Claims ",WEN,0.0235732641184054,1.035379072077816,-0.0110430944043079,0.0124221235991399,0.0037411272677627,0.001248052124555,0.0,0.0060608041024468,-0.6387504735262406,0
2015-05-06,Limited Services Restaurants Trending In The Right Direction,WEN,0.0728667722224989,0.5089538061005501,-0.003820339708262,0.031527048971619,0.0029642092686874,-0.022222050029052,-0.0217392789759541,0.0008937577972898,-0.527325716950338,2
2015-07-15,Has Delivering Alpha Delivered So Far?,WEN,-0.0047802808525152,-0.1874971981889093,-0.0075901617664624,0.0095786624585814,-0.0019121338341082,-0.0028600511294415,-0.010377146798424,-0.0057630909716613,-0.1481971916466661,1
2015-10-15,Is A McREIT Coming?,WEN,0.0022600726930388,-0.309139839339552,-0.0220996535314846,-0.0109285189628943,-0.0140089574723861,0.0119954317740054,0.0338219986639836,0.0372038646837857,0.7752687227250095,0
2015-11-23,Vetr Crown Downgrades Wendy's To Hold; Minimal Upside Projected,WEN,0.0009460721934804,-0.3874214594602739,0.0212557814082197,0.045454925117873,0.0399156566657246,-0.002096081469691,0.0116647614072935,-0.0009451779868691,-0.1941212642971344,2
2016-01-06,Sonic Starts The Quick-Service Earnings Season Off With A...Fizzle,WEN,-0.022878879913657,0.3351072486410833,-0.0168698181887854,-0.00928536132205,-0.0073728455759598,-0.0045872597659307,0.0046083996924251,-0.0390241903716758,-0.3305337835366968,1
2016-01-14,"McDonald's Spikes Lower, But Wall Street Darling Still Closer To 52-Week High Than 52-Week Low",WEN,-0.0092115824325237,0.3891363360830719,-0.0220222730683563,0.0193875759022474,-0.0229311872742982,0.0182742060362361,-0.0390241903716758,-0.0051651757813733,0.0097138954238444,1
2016-02-09,"Earnings Scheduled For February 9, 2016",WEN,-0.043349702251778,0.4394421554505967,-0.0164727888274515,-0.0273325529019095,0.0341128564075636,-0.0106073771536876,0.0196655822976439,-0.0195675073740878,-0.4656556645851918,1
2016-02-09,"Stocks Buffeted Between Short-Term Oil Gains, Global Economic Uncertainty",WEN,-0.043349702251778,0.4394421554505967,-0.0164727888274515,-0.0273325529019095,0.0341128564075636,-0.0106073771536876,0.0196655822976439,-0.0195675073740878,-0.4656556645851918,1
2016-03-09,"The Market In 5 Minutes: Wednesday, March 9, 2016",WEN,0.0042596311682119,0.6509183228212148,-0.0259336733957679,0.005213638297598,-0.0164096434707563,0.0220124035805204,-0.0041756109747985,0.0053022179967752,-0.0986111778557354,0
2016-05-11,10 Stocks Moving In Wednesday's Pre-Market Session,WEN,-0.0885508515036657,1.5067084893251037,0.0154404409623651,0.0036464227841748,-0.0117117316926678,-0.0106955197026641,0.0008925319801802,0.0255151417778121,-0.6222703016896882,0
2016-05-11,10 Stocks You Should Be Watching Today,WEN,-0.0885508515036657,1.5067084893251037,0.0154404409623651,0.0036464227841748,-0.0117117316926678,-0.0106955197026641,0.0008925319801802,0.0255151417778121,-0.6222703016896882,0
2016-06-01,All 13 M&A Deals Announced Wednesday,WEN,-0.0087546348082332,0.0500672043010752,-0.0009716853450331,0.003902229570126,-0.0057858900251869,0.0107209903105651,0.0128330776838427,0.0225709833985219,1.77872,0
2016-06-01,The Market In 5 Minutes: Feeling The Burn (But Maybe Not In Your Nikes Anymore),WEN,-0.0087546348082332,0.0500672043010752,-0.0009716853450331,0.003902229570126,-0.0057858900251869,0.0107209903105651,0.0128330776838427,0.0225709833985219,1.77872,0
2016-06-01,The Market In 5 Minutes,WEN,-0.0087546348082332,0.0500672043010752,-0.0009716853450331,0.003902229570126,-0.0057858900251869,0.0107209903105651,0.0128330776838427,0.0225709833985219,1.77872,0
2016-06-22,"Nomura Downgrades McDonald's On Slowing Comps, Yum! Brands Is The Top Pick",WEN,-0.0180178745014352,0.6364003840129351,-0.0059701019843733,-0.0019863716918328,0.0349435666525328,0.0,-0.0161778649599556,0.008154840493987,-0.3339405916136602,0
2016-08-02,The Market In 5 Minutes: Futures Trending Lower For Seventh Session In A Row,WEN,-0.0287768956430606,1.3209888176906648,0.0072465274783481,-0.0082135620795535,0.0010276093013643,-0.0010265544045099,-0.0394479845269931,0.0052909813251216,-0.5498369219526058,0
2016-08-10,Fast Food Earnings Roundup: Winners And Losers,WEN,-0.0274778406769065,1.3228609625668448,0.014940504606467,0.0141412643081411,0.0206185811972117,0.0210524211907581,0.0052909813251216,0.0030272758283089,-0.6425548341814353,2
2016-08-10,"10 Stocks To Watch For August 10, 2016",WEN,-0.0274778406769065,1.3228609625668448,0.014940504606467,0.0141412643081411,0.0206185811972117,0.0210524211907581,0.0052909813251216,0.0030272758283089,-0.6425548341814353,2
2016-08-10,"The Market In 5 Minutes: Stocks Still In Tight Range, Disney And Michael Kors Fall On Earnings",WEN,-0.0274778406769065,1.3228609625668448,0.014940504606467,0.0141412643081411,0.0206185811972117,0.0210524211907581,0.0052909813251216,0.0030272758283089,-0.6425548341814353,2
2016-08-29,"10 Notable Stocks Trading Ex-Dividend Tuesday, August 30",WEN,0.0131313007011986,-0.3355464040211077,-0.0030210688966848,-0.0010063408083453,-0.0050047637211869,0.010111179471882,-0.0070279289015187,0.007020789788515,-0.3083847857849837,0
2016-09-26,McDonald's Happy Meal Undergoes Biggest Change In 30 Years,WEN,-0.0027699608788482,-0.1925159700379389,0.0055710890492954,0.0169970340593825,0.0,-0.0130478308621747,-0.0110596199890841,0.0009260196469307,0.467271705083929,2
2016-10-21,Take A Bite Out Of This Fast Food Guide To The Q3 Earnings Season,WEN,0.0082800079530149,0.2561043375935672,-0.0109192305523634,0.0110397764162994,0.0009207028242521,0.0018450043377529,0.0046334783726182,0.0045621074625112,0.0247215571978764,2
2016-11-25,The Market In 5 Minutes: Black Friday Closes Shortened Trading Week,WEN,0.018025193084624,-0.413547760486075,0.0047244584208228,0.0275082324419513,0.017283724251305,-0.0040981502880456,0.0132890248043009,-0.0038495039233696,0.5969034047142197,2
2016-11-29,"The Market In 5 Minutes: OPEC, Tiffany's And More Theranos Trouble",WEN,0.000388503598464,0.249553808306401,-0.0038495039233696,0.018025193084624,0.0047244584208228,0.0275082324419513,0.017283724251305,-0.0240684296374481,0.1067382115076531,1
2016-12-01,"The Market In 5 Minutes: Fast Food Downgrades, Jobless Claims Hit 5-Month High",WEN,-0.0007953424195231,-0.0838521774010708,-0.0240684296374481,0.000388503598464,-0.0038495039233696,0.018025193084624,0.0047244584208228,0.0047770629074728,0.0482762559250729,2
2016-12-06,No Relief In Sight For Restaurant Stocks,WEN,0.0108950370873401,-0.2738736160546602,0.0182251271333466,0.0047770629074728,-0.0007953424195231,-0.0240684296374481,0.000388503598464,0.0461892992478132,0.5456560829617951,0
2017-01-06,The Market In 5 Minutes: Nonfarm Payrolls Lower Than Expected,WEN,-0.0285924132322418,0.1715970341878179,0.0007335683789102,0.0156483433996847,-0.007396412054089,-0.0138585293830751,-0.0029090603069698,0.0135852959920317,-0.5021815197200743,0
2017-01-26,Benzinga's Option Alert Recap From January 26,WEN,0.0058138135996552,0.3211768764476861,-0.0007263466521323,0.0139914382993622,0.0066715998305042,0.0,0.0007416507519097,-0.005057535416395,-0.2708519844822441,1
2017-02-07,Ranking of the Most Talked About Super Bowl Commercials of 2017,WEN,0.0021784093102914,0.0041908952800042,-0.004338309835365,0.0154184788547133,0.0133930002868012,-0.0066517959327528,-0.0124089259772369,0.0115943971530956,0.2228076581981324,0
