date,title,stock,close,volume,1_past_close,2_past_close,3_past_close,4_past_close,5_past_close,next_close,next_volume,label
2017-02-15,Benzinga's Option Alert Recap From February 15,WEN,0.0034991985608505,0.3651390419394569,-0.0013977988101224,-0.0013954694737454,0.0077355215746128,0.0186245615137339,0.0115943971530956,-0.0453280827656287,0.7550174105729661,1
2017-02-16,"A Peek Into The Markets: U.S. Stock Futures Down Ahead Of Jobless Claims, Housing Starts Data",WEN,-0.0453280827656287,0.7550174105729661,0.0034991985608505,-0.0013977988101224,-0.0013954694737454,0.0077355215746128,0.0186245615137339,0.0321403116042793,-0.5871196406991216,0
2017-02-24,The Market In 5 Minutes,WEN,0.0171131794298105,0.023785873446267,-0.0182614541844911,-0.0311394790445911,0.0,0.0321403116042793,-0.0453280827656287,0.0183823465185157,0.0123508587911367,0
2017-05-10,"12 Stocks To Watch For May 10, 2017",WEN,0.0509933921188467,1.7677388423988845,0.0059960119160467,-0.0066183016051525,0.0046545182366828,0.0114324168454282,-0.0093272095895323,0.0037807467653652,-0.7306190258727934,2
2017-08-09,18 Stocks Moving In Wednesday's Pre-Market Session,WEN,0.0387648217085261,0.2156598829905602,-0.0161602901485629,-0.014649614957126,0.0234680979448276,-0.0071197993925512,0.0025957447342994,-0.0347879138256448,-0.4824104282614151,1
2017-10-26,Benzinga's Option Alert Recap From October 26,WEN,-0.0105962162030377,0.050181983621474,-0.0052700808947617,-0.0026281152573773,-0.012329509918318,-0.016592282586203,0.0181937355628107,0.0107096984836396,-0.082744877182342,0
2017-11-15,"Q3 13F Roundup: How Buffett, Einhorn, Paulson, And Others Adjusted Their Portfolio",WEN,-0.0069635884957404,-0.1005534528994465,0.0013946600669074,-0.0110344611769752,-0.0129341055103283,0.0131035887092578,-0.0162821939105892,-0.0056100861775698,-0.3292523048295694,1
2018-02-05,"The Most Loved And Hated Super Bowl LII Commercials: Pepsi Steals The Show, Diet Coke Falls Flat",WEN,-0.0359165939335002,0.9265036239562584,-0.0305439689885561,0.0117430125181869,0.0099875727934328,-0.0207825046450552,-0.0084849037239991,0.028104545816848,0.1202147320249933,0
2018-02-20,"The Week Ahead: Big Conferences, Retail Earnings And Investor Events Could Provide Catalysts",WEN,-0.0176938910834444,-0.3360911174554666,0.0439492771836536,-0.0031746677929188,0.0180996001596167,-0.0165290442518717,0.0044699826683858,0.0074532769385955,0.5412382841482064,0
2018-05-07,"The Week Ahead: Nvidia And Dropbox Earnings, April Retail Sales, Trump Drug Pricing Speech Expected",WEN,0.0071644671677399,0.9441252629875384,0.0023938302914197,0.0102779277261462,-0.0113566261414557,-0.0005975432182421,-0.0187572531080223,0.0260816290514083,0.2802439075149321,0
2018-05-08,"Earnings Scheduled For May 8, 2018",WEN,0.0260816290514083,0.2802439075149321,0.0071644671677399,0.0023938302914197,0.0102779277261462,-0.0113566261414557,-0.0005975432182421,-0.0346622105455995,0.5690947217842222,1
2018-05-16,"Q1 13F Roundup: How Buffett, Einhorn, Ackman And Others Adjusted Their Portfolio",WEN,-0.011494478316207,0.0546654798991248,0.0159802986384038,-0.0216474128769279,0.0006016664209129,-0.0053859596406832,-0.0346622105455995,0.0006121062159905,-0.3144618702674825,2
2018-08-06,"The Week Ahead: Earnings From Disney, Roku And Snap, Rite Aid Votes On Albertsons Deal",WEN,0.0160716965770502,0.1761061695416181,0.0090088128080261,-0.0023965674252639,0.0005993429598529,0.010909250039768,-0.0125671426183334,-0.0035151951527666,-0.0310491470545595,2
2018-08-07,"Earnings Scheduled For August 7, 2018",WEN,-0.0035151951527666,-0.0310491470545595,0.0160716965770502,0.0090088128080261,-0.0023965674252639,0.0005993429598529,0.010909250039768,0.0146974153586265,0.2888955387646192,0
2019-03-13,"Aurora Cannabis Appoints Nelson Peltz As Strategic Advisor: 'Solid Execution, Strongly Differentiated From Its Peers'",WEN,0.0139732020523377,0.6522680884741949,-0.0096268052250716,-0.0212016430654373,0.0322187944618959,-0.0143796736147285,-0.0363741578266307,0.0065905878511285,-0.4988907376594564,0
2019-05-08,"Earnings Scheduled For May 8, 2019",WEN,0.0395235830482758,0.6325721318200466,-0.0064552465463034,0.0086816431563707,0.0005428267908014,-0.0107409300473083,0.0005371732238057,-0.0203125836350729,-0.2196861825390178,1
2019-08-21,Stocks That Hit 52-Week Highs On Wednesday,WEN,0.0072568618612858,0.0227143170357377,0.0117475615994246,0.0240601078846729,0.0080846665960625,0.0050789076415904,0.0015258922210481,0.0177714342728187,0.6100415898469322,0
2019-09-09,"Analyst Breaks Down Popeye's Chicken Sandwich, Impact On Rivals",WEN,-0.0192137541631806,0.3523278882275971,-0.0179904746760288,0.0242697659782964,0.0197066768183569,-0.0081817907456982,-0.0018147725168939,-0.1020499575725207,4.379330794681316,1
2019-09-10,Wendys Falls After Revising 2019 Guidance,WEN,-0.1020499575725207,4.379330794681316,-0.0192137541631806,-0.0179904746760288,0.0242697659782964,0.0197066768183569,-0.0081817907456982,-0.0045662990982227,-0.7008929866603227,2
2019-11-15,"Q3 13F Roundup: How Buffett, Einhorn, Ackman And Others Adjusted Their Portfolios",WEN,-0.014825382382167,2.5070089936190523,-0.0004781299283198,0.0125846386697159,-0.0067305604603562,0.0072638316510382,-0.0157291494490139,-0.0067963042569777,-0.5260315186246418,1
2019-12-18,What Grayscale Had To Say About The Future Of Crypto In Its Latest Investor Presentation,WEN,-0.016539946887354,-0.2126748840711823,0.0117594085207517,0.0123626880209308,0.0153414329885286,0.0,0.0009310040127252,0.0049999131185183,0.2528567832871884,2
2020-01-23,The Latest Food Companies To Announce Ambitious Green Goals,WEN,0.0095497826789034,-0.1226650287242114,0.015235285951004,-0.0013830162326746,0.0083680111582351,-0.0032434558477835,0.0074695074959914,-0.004954777423151,-0.0649040441479285,2
2020-02-06,Former McDonald's Chef Defects To Wendy's,WEN,-0.0170560734586522,1.0361124979197869,-0.0040230179168364,0.0200638655036045,0.0119980830839707,-0.0109536891060901,-0.0054474274165836,0.0018265885313426,-0.0788720882713527,2
2020-02-14,Stocks That Hit 52-Week Highs On Friday,WEN,0.0,-0.3013656871113279,0.0013114423659141,0.0177934250526754,0.014440424887143,0.0100275473366482,0.0018265885313426,0.0130945704601659,0.4408761672048171,0
2020-02-18,Stocks That Hit 52-Week Highs On Tuesday,WEN,0.0130945704601659,0.4408761672048171,0.0,0.0013114423659141,0.0177934250526754,0.014440424887143,0.0100275473366482,0.0043085570896144,-0.1405729513657562,2
2020-02-19,Stocks That Hit 52-Week Highs On Wednesday,WEN,0.0043085570896144,-0.1405729513657562,0.0130945704601659,0.0,0.0013114423659141,0.0177934250526754,0.014440424887143,0.0124408435512488,0.1569415081042988,0
2020-03-02,"As Wendy's Launches Breakfast, McDonald's Declares Monday 'National Egg McMuffin Day'",WEN,0.0391951732697111,-0.110253094844719,-0.0541081187069703,-0.0826863857957123,-0.0466027719449201,-0.0183837519732585,-0.0229743003476882,-0.0234454611730249,-0.3943915927715058,1
2020-03-12,Stocks That Hit 52-Week Lows On Thursday,WEN,-0.1331853723275593,0.0836353732375185,-0.0903582794854482,0.0621983857539631,-0.0281396553535243,-0.0041516318960904,-0.0389026301667246,0.0755439954868117,-0.024031862034298,0
2020-03-16,Stocks That Hit 52-Week Lows On Monday,WEN,-0.2648807574480669,0.2764064976228209,0.0755439954868117,-0.1331853723275593,-0.0903582794854482,0.0621983857539631,-0.0281396553535243,-0.1497977860162319,0.6095013424797853,1
2020-03-17,How Trump Is Handling The Restaurant Biz Amid Coronavirus Outbreak,WEN,-0.1497977860162319,0.6095013424797853,-0.2648807574480669,0.0755439954868117,-0.1331853723275593,-0.0903582794854482,0.0621983857539631,-0.2885713326363711,0.1497516995323273,1
2020-03-18,Stocks That Hit 52-Week Lows On Wednesday,WEN,-0.2885713326363711,0.1497516995323273,-0.1497977860162319,-0.2648807574480669,0.0755439954868117,-0.1331853723275593,-0.0903582794854482,0.4270415592352106,-0.012269887197551,0
2020-04-15,Every Member Of Trump's 'Great American Economic Revival' Industry Groups,WEN,-0.025043789158751,0.3464521181195847,0.0362100444525546,-0.0235708685120957,0.0579797815745197,0.0765100151251598,0.0318560275999026,0.0322582485576998,0.1919064950658511,0
2020-05-06,Wendy's Locations Run Out Of Beef As COVID-19 Forces Meatpacking Plant Closures,WEN,0.0744282459944729,-0.0276584185311403,-0.0243774754454049,-0.0092496040836554,-0.0201410691344351,-0.0283756822019032,0.0328446137445659,0.0133598737049931,-0.3753238177477523,0
2020-09-29,Peltz's Departure From Aurora Sends Shockwaves Though Cannabis Stocks,WEN,0.0090293835057673,0.1962132311506819,0.0379569417249223,0.0066036963602915,0.0090432684458108,-0.0028474806136995,0.0198450840319268,-0.0022372589496466,-0.2274982727215627,2
2020-10-09,Stocks That Hit 52-Week Highs On Friday,WEN,0.0218577762240093,1.317221683371053,0.0214685768218432,0.0126086301566099,-0.0233544723059533,0.0159618801705896,0.0139982375237561,-0.0205675480109828,-0.5492872590284399,1
2020-10-16,Stocks That Hit 52-Week Highs On Friday,WEN,-0.0210440533282344,-0.1322005302482526,0.0248858753171901,0.001245898626538,0.0113397313551204,-0.0205675480109828,0.0218577762240093,-0.0070277643137467,-0.1531037355922788,1
2020-11-05,"Wendy's Strong Q3, Momentum Prompts Upgrade",WEN,0.0178981140152774,-0.208843675995009,-0.058340497075576,0.0451671258476149,0.0132723350219505,-0.0201793004104066,0.0008974609553193,0.0027050689676775,-0.3084375352033345,2
2020-12-07,"Burger King, Wendy's Seek Bigger Slices Of The Indian Fast-Food Pie: Report",WEN,-0.007661138826283,-0.2047123845538506,0.0174232426258156,0.0041436246123764,-0.0185268008649746,0.0063665073504062,-0.0040760658650166,-0.0031789624270978,0.0769019751280175,2
2021-02-18,"Wendys, Burger King Simultaneously Join The Latest Chicken Sandwich Craze",WEN,0.0190800012625964,0.4497307001795332,-0.0125602987651256,-0.0161598531310979,0.0081455974830919,-0.0099617742867565,0.0004746272501494,-0.0081612425190706,-0.1954751131221719,1
2021-05-06,Wendy's Adds Bourbon Bacon Cheeseburger To Menu,WEN,0.0070670999029207,-0.0845100864553314,-0.0113537707342064,0.0043860625998588,0.0101905140923512,-0.0022103938201257,0.0157161085245369,0.0,1.6915873140788542,2
2021-05-12,"Market Braced For Earnings From Disney Tomorrow, A Key Reopening Barometer",WEN,-0.0140350129670645,0.6309680370518611,0.0030795752386749,-0.0030701205713836,0.0,0.0070670999029207,-0.0113537707342064,0.0013345849103421,-0.5035759360538494,2
2021-06-08,Stocks That Hit 52-Week Highs On Tuesday,WEN,0.2585004482620405,26.060012945781832,0.0034995968963731,-0.0060869943000139,-0.010326952071354,0.0017239392127301,-0.000861184258316,-0.1267751743279787,-0.5866184155970785,1
2021-06-21,Wendy's Strengthens Partnership With Rick And Morty: 'Sir This Is A Morty's',WEN,0.0199134220856302,-0.010862931771024,-0.0170214419739379,-0.0163248032627354,0.0067425860986776,-0.0266611428646842,0.0099420203348969,-0.0148556965710361,-0.2431515301085883,1
2021-08-10,This Week's Earnings Repertoire,WEN,-0.0045187293193721,1.843792196716651,-0.0044984917525103,-0.00179620051901,-0.0035793636941108,-0.0175824127557767,-0.0244425299575633,0.0372219932654349,0.9740097463451204,0
2021-08-30,4 Stocks Insiders Are Selling,WEN,-0.0227078146107722,0.6004302366301466,0.0069025695522555,-0.0081301918437605,0.0047293133139139,-0.0214556887262125,0.002107914718888,0.0145438896038174,-0.358069457034791,0
2021-09-10,5 Stocks Insiders Are Selling,WEN,-0.0184048935454204,0.3380893702574745,-0.0043630106759886,0.0092471086864627,-0.008296986560802,-0.0052129894588197,-0.0051856987360063,0.0026785058976206,-0.2201434664598681,2
2021-11-08,This Week's Earnings Roadmap,WEN,0.0087990507481865,0.5567314197351889,0.0061973398158865,0.0044463411602915,0.000444991152352,-0.0140351519653746,0.0224214814898018,0.0047971928276795,0.4797144187490298,2
2021-11-10,"Earnings Scheduled For November 10, 2021",WEN,-0.0711805143614805,1.0952191151482094,0.0047971928276795,0.0087990507481865,0.0061973398158865,0.0044463411602915,0.000444991152352,0.0112148647167347,-0.6809375531904243,0
2022-01-14,13 Best Wendy's Roasts In Honor Of National Roast Day: 'Top Drink Of Choice For When You Hate Yourself',WEN,-0.011864374837454,0.0988554824171261,0.0021231966049,-0.014231929094044,-0.0033374258789626,-0.0041546553409946,0.000415556025135,-0.0175814998821338,0.0499730167296277,1
2022-03-01,"Earnings Scheduled For March 1, 2022",WEN,-0.001319294929568,0.0605991310313285,0.0008803912873367,0.0129290025854302,0.0195454141941122,-0.0165400764092342,-0.0149712391181069,-0.0013208636838213,0.0238711267171809,2
2022-04-22,Stocks That Hit 52-Week Lows On Friday,WEN,-0.0360924501095067,0.1782393759354166,-0.0009614857624511,0.0116731815090962,0.0053789184457353,-0.0210625920120011,0.0,0.018971484240573,-0.0964625274259979,0
2022-04-25,Stocks That Hit 52-Week Lows On Monday,WEN,0.018971484240573,-0.0964625274259979,-0.0360924501095067,-0.0009614857624511,0.0116731815090962,0.0053789184457353,-0.0210625920120011,-0.025967637620236,0.6972266007753589,1
2022-04-27,Stocks That Hit 52-Week Lows On Wednesday,WEN,-0.0015090211047422,-0.4804337458269535,-0.025967637620236,0.018971484240573,-0.0360924501095067,-0.0009614857624511,0.0116731815090962,0.0161208154157326,0.2595294458669501,0
2022-05-06,Stocks That Hit 52-Week Lows On Friday,WEN,-0.0217622158757482,0.2541429421262853,-0.0268595544744435,0.0072841918821602,-0.0158731021356559,-0.0116396847211966,-0.0203271296015055,-0.0314704115785638,0.098966627138743,1
2022-05-11,"Earnings Scheduled For May 11, 2022",WEN,-0.1121546933128342,0.7591020921938474,0.0140055507320502,-0.0314704115785638,-0.0217622158757482,-0.0268595544744435,0.0072841918821602,0.0703174878853629,-0.3785114110695505,0
2022-05-11,A Peek Into The Markets: US Stock Futures Gain; Inflation Data In Focus,WEN,-0.1121546933128342,0.7591020921938474,0.0140055507320502,-0.0314704115785638,-0.0217622158757482,-0.0268595544744435,0.0072841918821602,0.0703174878853629,-0.3785114110695505,0
2022-05-11,"5 Stocks To Watch For May 11, 2022",WEN,-0.1121546933128342,0.7591020921938474,0.0140055507320502,-0.0314704115785638,-0.0217622158757482,-0.0268595544744435,0.0072841918821602,0.0703174878853629,-0.3785114110695505,0
2022-05-12,"PreMarket Prep Hits The Drive-Thru: Comparing McDonald's, Wendy's Stock Performance",WEN,0.0703174878853629,-0.3785114110695505,-0.1121546933128342,0.0140055507320502,-0.0314704115785638,-0.0217622158757482,-0.0268595544744435,0.0075581249185805,-0.2239938593583726,0
2022-05-18,A Peek Into The Markets: US Stock Futures Down Following Tuesday's Rally,WEN,-0.0476731595272863,0.0799148536998952,0.013226229892109,0.0034620144149093,0.0075581249185805,0.0703174878853629,-0.1121546933128342,-0.0214542244245335,0.0525858612855807,1
2022-05-18,"McDonald's, Wendy's Sued Over Burgers Not Being Big And Juicy Enough",WEN,-0.0476731595272863,0.0799148536998952,0.013226229892109,0.0034620144149093,0.0075581249185805,0.0703174878853629,-0.1121546933128342,-0.0214542244245335,0.0525858612855807,1
2022-05-18,"Morning Brief: Top Financial Stories Dominating on Wednesday, May 18",WEN,-0.0476731595272863,0.0799148536998952,0.013226229892109,0.0034620144149093,0.0075581249185805,0.0703174878853629,-0.1121546933128342,-0.0214542244245335,0.0525858612855807,1
2022-05-25,"Morning Brief: Top Financial Stories Dominating on Wednesday, May 25",WEN,0.0977257651383209,3.6545018892268,-0.0234092030675397,0.0024066068038499,0.0121804395716993,-0.0214542244245335,-0.0476731595272863,0.0408733661553997,-0.606858591058488,0
2022-08-08,Monday's Market Minute: Three Things To Watch This Week,WEN,0.0153183176216871,0.4450481919917199,-0.0183272256038173,-0.0074626321990627,0.0185273850942795,-0.0080112812501753,0.0090346409293782,-0.0047146428710496,-0.352388200008953,2
2022-08-10,US Stock Futures Edge Higher; All Eyes On Inflation Data,WEN,-0.0175273477216575,0.0867145918296814,-0.0047146428710496,0.0153183176216871,-0.0183272256038173,-0.0074626321990627,0.0185273850942795,0.0265189142699202,-0.033202938650892,0
2022-08-10,Peak Inflation: July CPI Report Was Much Better Than Expected,WEN,-0.0175273477216575,0.0867145918296814,-0.0047146428710496,0.0153183176216871,-0.0183272256038173,-0.0074626321990627,0.0185273850942795,0.0265189142699202,-0.033202938650892,0
2022-08-10,"Earnings Scheduled For August 10, 2022",WEN,-0.0175273477216575,0.0867145918296814,-0.0047146428710496,0.0153183176216871,-0.0183272256038173,-0.0074626321990627,0.0185273850942795,0.0265189142699202,-0.033202938650892,0
2022-08-10,"Fox, Disney And 3 Stocks To Watch Heading Into Wednesday",WEN,-0.0175273477216575,0.0867145918296814,-0.0047146428710496,0.0153183176216871,-0.0183272256038173,-0.0074626321990627,0.0185273850942795,0.0265189142699202,-0.033202938650892,0
2022-08-10,"Bitcoin, Ethereum Notch Losses; Here Are The Top Crypto Movers For Wednesday",WEN,-0.0175273477216575,0.0867145918296814,-0.0047146428710496,0.0153183176216871,-0.0183272256038173,-0.0074626321990627,0.0185273850942795,0.0265189142699202,-0.033202938650892,0
2022-10-11,Morgan Stanley Thinks Europe Exposure & FX Headwinds Weigh On Q3 Earnings For Restaurants,WEN,0.0010341382994973,-0.0588976945244956,0.0125654915013648,-0.0225179772121859,-0.0010224077787489,0.0046225509546695,0.027440546812699,-0.0061983195729282,-0.0160127591706539,1
2022-11-09,"US Stocks Poised To Lose Steam As Traders Digest Early Midterm Results And Eye Thursday's Inflation Data — Tesla, Disney, AMC In Focus Today",WEN,0.0303773389254546,-0.0725339823659074,-0.0092234086712565,0.0083210986577273,0.003931250025023,-0.007317064400273,-0.0153697390460432,0.0166428093473953,-0.0970960314906048,0
2023-01-12,Subway's Potential Sale: Eat Fresh for $10 Billion or More,WEN,-0.0135868750921152,0.0843244817709598,-0.0182303324069667,0.0076164907464839,-0.0197628542210781,0.0035257837816835,-0.005696759638282,0.0596877195381564,1.5434276504297992,0
2023-01-17,World Wrestling Entertainment To Rally Around 12%? Here Are 10 Other Analyst Forecasts For Tuesday,WEN,-0.0112651693523939,-0.3876606231297307,0.0596877195381564,-0.0135868750921152,-0.0182303324069667,0.0076164907464839,-0.0197628542210781,-0.0157756420752428,0.049443757725587,1
2023-03-07,"Here Are The Top 5 US Fast-Food Restaurants According To Revenue, #2 Is Far Behind",WEN,-0.0119540335118085,-0.3348082595870206,-0.0082079481382085,-0.0222915734818168,0.010360339384325,0.0109290386371871,-0.0022717466555756,,,2
