date,title,stock,close,volume,1_past_close,2_past_close,3_past_close,4_past_close,5_past_close,next_close,next_volume,label
2020-10-16,Friday's Market Minute: Banking On The Capital Markets,WFC,-0.0039214253985144,-0.284896384136214,-0.0129032985268455,-0.0602265033519769,-0.0366041742620412,0.0150196780863853,0.0,-0.0139982814562937,-0.1325322429603256,1
2020-10-19,"Churn, Baby Churn? As Netflix Prepares To Report Q3 Earnings, Analysts Eyeing Subscription, Cancellation Counts",WFC,-0.0139982814562937,-0.1325322429603256,-0.0039214253985144,-0.0129032985268455,-0.0602265033519769,-0.0366041742620412,0.0150196780863853,0.0119786206937562,-0.0714094849239517,0
2020-10-21,Pioneer Extends Permian Basin Dominance With $7.6B Parsley Energy Acquisition Deal,WFC,-0.0048223479804899,-0.150294090563779,0.0119786206937562,-0.0139982814562937,-0.0039214253985144,-0.0129032985268455,-0.0602265033519769,0.0242290191790228,0.0917763636917803,0
2020-10-28,Auto Insurer Root Raises $724M In Upsized IPO,WFC,-0.0293307716116842,0.1047495290763853,-0.0387665188143934,-0.0249140182535747,0.0012903040397203,0.0242290191790228,-0.0048223479804899,-0.0018887670451379,-0.1577780249799857,2
2020-10-29,Stocks That Hit 52-Week Lows On Thursday,WFC,-0.0018887670451379,-0.1577780249799857,-0.0293307716116842,-0.0387665188143934,-0.0249140182535747,0.0012903040397203,0.0242290191790228,0.0146640595124616,-0.2509873549281136,0
2020-11-17,"Q3 13F Roundup: How Buffett, Einhorn, Ackman And Others Adjusted Their Portfolios",WFC,0.0056226784938104,-0.2019872925844544,0.0344825731866758,0.0109198719841239,-0.0157089552668844,0.0,-0.0012386402139489,0.0007986123454397,0.5028043024170576,2
2020-11-17,Tuesday's Market Minute: Costco Announces $10/Share Special Dividend,WFC,0.0056226784938104,-0.2019872925844544,0.0344825731866758,0.0109198719841239,-0.0157089552668844,0.0,-0.0012386402139489,0.0007986123454397,0.5028043024170576,2
2020-11-18,Goldman Plans Second Round Of Job Cuts In 3 Months:Report,WFC,0.0007986123454397,0.5028043024170576,0.0056226784938104,0.0344825731866758,0.0109198719841239,-0.0157089552668844,0.0,0.0438946682439693,0.0054537290464662,0
2020-12-03,"Markets Risk Short-Term Correction On Overbought Stocks, Morgan Stanley Warns",WFC,0.0100451681128008,0.1621212121212121,0.0288667263744015,0.0259597854134752,-0.0390021416584475,-0.0045471163879445,-0.0006990994326951,0.0133743551976992,0.1430814790401458,0
2020-12-08,Tesla's $5B Equity Sale: What You Need to Know,WFC,-0.0136332927414125,0.015656040109734,-0.0071064995081909,0.0133743551976992,0.0100451681128008,0.0288667263744015,0.0259597854134752,0.0038008583360227,0.095204830872879,2
2020-12-22,"Buoyant Bank Outlook, Federal Reserve Support Could Make FAS ETF Great Again",WFC,-0.0199661812191743,-0.5134625158349073,0.0186142552530317,-0.015609113071029,-0.0060707988530562,-0.0026909170263966,0.0380587920401427,0.0479973199130951,0.496096414469966,0
2020-12-28,"Tesla Becoming New AOL, Cryptocurrency Resurgence And 8 Other Top Wells Fargo Predictions For 2021",WFC,0.0030161389057561,0.4995118979208928,-0.016804008286164,0.0479973199130951,-0.0199661812191743,0.0186142552530317,-0.015609113071029,-0.0050116710558015,-0.0957637878892813,1
2021-01-08,"Travel And Leisure Sector Job Losses Hit Employment Picture, Causing Overall Drop In Job Growth",WFC,-0.0071793264372532,-0.3616021613892614,0.0226367659900565,0.0707502169755853,0.0279461122787358,-0.0159045661368619,0.0144538731987797,0.0015065712244897,0.043762200422587,2
2021-01-11,Monday's Market Minute: Watch the U.S. Dollar,WFC,0.0015065712244897,0.043762200422587,-0.0071793264372532,0.0226367659900565,0.0707502169755853,0.0279461122787358,-0.0159045661368619,0.0210590102680341,0.7530417050739049,0
2021-01-11,"Bank Week Underway, With JP Morgan, Citigroup And Others Geared To Report Friday",WFC,0.0015065712244897,0.043762200422587,-0.0071793264372532,0.0226367659900565,0.0707502169755853,0.0279461122787358,-0.0159045661368619,0.0210590102680341,0.7530417050739049,0
2021-01-13,"Brighter Horizons? Big Banks Still Struggling As Q4 Earnings Approach, But Calmer Waters Seen",WFC,-0.0041250640855865,-0.3958245979467897,0.0210590102680341,0.0015065712244897,-0.0071793264372532,0.0226367659900565,0.0707502169755853,0.0281066012588706,0.5630953580263496,0
2021-01-15,Wall Street Pulls Back A Bit Amid Mixed Bank Results After Biden Announces Further Stimulus,WFC,-0.077985452457455,0.6469424547370155,0.0281066012588706,-0.0041250640855865,0.0210590102680341,0.0015065712244897,-0.0071793264372532,0.018414313190066,-0.5238034156909595,0
2021-01-15,"Earnings Scheduled For January 15, 2021",WFC,-0.077985452457455,0.6469424547370155,0.0281066012588706,-0.0041250640855865,0.0210590102680341,0.0015065712244897,-0.0071793264372532,0.018414313190066,-0.5238034156909595,0
2021-01-15,A Peek Into The Markets: US Stock Futures Down; Biden Unveils $1.9 Trillion Covid-19 Relief Plan,WFC,-0.077985452457455,0.6469424547370155,0.0281066012588706,-0.0041250640855865,0.0210590102680341,0.0015065712244897,-0.0071793264372532,0.018414313190066,-0.5238034156909595,0
2021-01-15,"5 Stocks To Watch For January 15, 2021",WFC,-0.077985452457455,0.6469424547370155,0.0281066012588706,-0.0041250640855865,0.0210590102680341,0.0015065712244897,-0.0071793264372532,0.018414313190066,-0.5238034156909595,0
2021-01-20,"Stock Market Winners, Losers From Biden's Finance Nominations",WFC,-0.0052098247186644,-0.3163207538555658,0.018414313190066,-0.077985452457455,0.0281066012588706,-0.0041250640855865,0.0210590102680341,-0.0141713656807913,-0.0570688285063673,1
2021-01-20,"Morgan Stanley Impresses With Earnings, Buttressed By Robust Investment Banking",WFC,-0.0052098247186644,-0.3163207538555658,0.018414313190066,-0.077985452457455,0.0281066012588706,-0.0041250640855865,0.0210590102680341,-0.0141713656807913,-0.0570688285063673,1
2021-01-29,"Robinhood Gets $1B Funding, Taps Credit Line As It Prepares To Resume Trading Of GameStop, Other Hot Stocks",WFC,-0.0301849956171947,0.3729762045449805,0.0212131834877107,-0.0385595664339667,-0.0266750414208142,0.0106582785610085,-0.0031248821518355,0.0036813530915322,-0.3996729180168503,2
2021-02-16,"Warren Buffett's Berkshire Cuts Apple Stake And Buys These Drugmaker, Telecom Stocks Instead",WFC,0.0375782146834322,0.0578741105383617,0.0247555582384602,-0.0144578379527992,-0.0018038801926089,-0.0041915500016106,0.0257982918926631,0.0517390873677032,1.1980163539741473,0
2021-02-17,"Q4 13F Roundup: How Buffett, Einhorn, Ackman And Others Adjusted Their Portfolios",WFC,0.0517390873677032,1.1980163539741473,0.0375782146834322,0.0247555582384602,-0.0144578379527992,-0.0018038801926089,-0.0041915500016106,0.0101120248951445,-0.4593819433441828,0
2021-03-10,8 Financials Stocks Showing Unusual Options Activity In Today's Session,WFC,0.0380279477188343,0.0720447591767747,-0.0139643467942319,0.0331282880033738,0.0072660546537997,-0.0140620969205612,0.014808888753961,-0.0176857661961289,-0.2039300469336996,1
2021-03-12,Stocks That Hit 52-Week Highs On Friday,WFC,0.0280349639545649,-0.0602868749325952,-0.0176857661961289,0.0380279477188343,-0.0139643467942319,0.0331282880033738,0.0072660546537997,-0.0067550326020935,-0.0995270223273283,1
2021-03-15,Stocks That Hit 52-Week Highs On Monday,WFC,-0.0067550326020935,-0.0995270223273283,0.0280349639545649,-0.0176857661961289,0.0380279477188343,-0.0139643467942319,0.0331282880033738,-0.0088162544134273,-0.0472690617251527,1
2021-03-17,Stocks That Hit 52-Week Highs On Wednesday,WFC,0.0124524804117747,0.3595180859645781,-0.0088162544134273,-0.0067550326020935,0.0280349639545649,-0.0176857661961289,0.0380279477188343,0.024347322797994,0.7121567224259773,0
2021-03-18,Stocks That Hit 52-Week Highs On Thursday,WFC,0.024347322797994,0.7121567224259773,0.0124524804117747,-0.0088162544134273,-0.0067550326020935,0.0280349639545649,-0.0176857661961289,-0.0289144575011457,0.0500029606099552,1
2021-03-19,The State Of Streaming In 2021: A Fight For Content And Eyeballs,WFC,-0.0289144575011457,0.0500029606099552,0.024347322797994,0.0124524804117747,-0.0088162544134273,-0.0067550326020935,0.0280349639545649,-0.0166539337040418,-0.465831174388557,1
2021-03-19,10 Financials Stocks With Unusual Options Alerts In Today's Session,WFC,-0.0289144575011457,0.0500029606099552,0.024347322797994,0.0124524804117747,-0.0088162544134273,-0.0067550326020935,0.0280349639545649,-0.0166539337040418,-0.465831174388557,1
2021-03-23,Boeing Enters Into $5.28B Loan Agreement With Banks,WFC,-0.018732387320878,0.0089548531329566,-0.0166539337040418,-0.0289144575011457,0.024347322797994,0.0124524804117747,-0.0088162544134273,-0.0031380248145347,-0.2552039736077601,2
2021-03-24,"Thinking About Buying Stock Or Options In Wells Fargo, Netflix, Microsoft Or Apple?",WFC,-0.0031380248145347,-0.2552039736077601,-0.018732387320878,-0.0166539337040418,-0.0289144575011457,0.024347322797994,0.0124524804117747,0.0309549524403669,0.1888834255444864,0
2021-03-29,"Nomura, Credit Suisse Face 'Significant' Losses Following Hedge Fund's Default On Margin Calls",WFC,-0.0331991607146726,0.317971196422018,0.011704695334245,0.0309549524403669,-0.0031380248145347,-0.018732387320878,-0.0166539337040418,0.0247137255865925,-0.0596639333383645,0
2021-04-06,"On Thin News Day, Focus Stays On Fed Policy, Infrastructure, Vaccination Progress",WFC,0.0093716066855547,-0.015206589835348,-0.0037848255544048,0.0143331184142938,-0.0081237593250627,0.0247137255865925,-0.0331991607146726,0.0035131681288511,-0.0751754921410041,2
2021-04-08,"JPMorgan Upgrades U.S. Bancorp, Raises Big Bank Price Targets Ahead Of Q1 Earnings",WFC,0.0010003333782735,0.0748612915867417,0.0035131681288511,0.0093716066855547,-0.0037848255544048,0.0143331184142938,-0.0081237593250627,0.0117411793129591,0.3606908131446389,0
2021-04-09,Investors Appear To Be Treading Lightly Ahead Of Bank Earnings Next Week,WFC,0.0117411793129591,0.3606908131446389,0.0010003333782735,0.0035131681288511,0.0093716066855547,-0.0037848255544048,0.0143331184142938,0.0066666333369309,-0.2563355850456218,0
2021-04-12,Monday's Market Minute: What To Watch As Rates Rise,WFC,0.0066666333369309,-0.2563355850456218,0.0117411793129591,0.0010003333782735,0.0035131681288511,0.0093716066855547,-0.0037848255544048,-0.0240372386774002,0.3906604086663823,1
2021-04-12,"Beyond The Banks: Other Major Firms Reporting This Week Include PepsiCo, Delta",WFC,0.0066666333369309,-0.2563355850456218,0.0117411793129591,0.0010003333782735,0.0035131681288511,0.0093716066855547,-0.0037848255544048,-0.0240372386774002,0.3906604086663823,1
2021-04-12,A Jam-Packed Week Ahead,WFC,0.0066666333369309,-0.2563355850456218,0.0117411793129591,0.0010003333782735,0.0035131681288511,0.0093716066855547,-0.0037848255544048,-0.0240372386774002,0.3906604086663823,1
2021-04-12,"What You Need To Know In Options This Week. Alibaba, Netflix, Wells Fargo, Bed Bath And Beyond, Aphria And More",WFC,0.0066666333369309,-0.2563355850456218,0.0117411793129591,0.0010003333782735,0.0035131681288511,0.0093716066855547,-0.0037848255544048,-0.0240372386774002,0.3906604086663823,1
2021-04-13,"Flipping The Financial Playbook: Earnings Seen Firming For JP Morgan, Wells Fargo, Goldman Sachs",WFC,-0.0240372386774002,0.3906604086663823,0.0066666333369309,0.0117411793129591,0.0010003333782735,0.0035131681288511,0.0093716066855547,0.0552902851221186,1.2134271064868476,0
2021-04-13,"J&J Covid Vaccine Pause Appears To Weigh On Airline, Casino, Hotel Stocks Early",WFC,-0.0240372386774002,0.3906604086663823,0.0066666333369309,0.0117411793129591,0.0010003333782735,0.0035131681288511,0.0093716066855547,0.0552902851221186,1.2134271064868476,0
2021-04-14,"JP Morgan, Goldman Sachs Easily Beat Analysts' Earnings Estimate, Getting Season off To Good Start",WFC,0.0552902851221186,1.2134271064868476,-0.0240372386774002,0.0066666333369309,0.0117411793129591,0.0010003333782735,0.0035131681288511,0.0059539157034609,-0.320061484531065,0
2021-04-14,"5 Stocks To Watch For April 14, 2021",WFC,0.0552902851221186,1.2134271064868476,-0.0240372386774002,0.0066666333369309,0.0117411793129591,0.0010003333782735,0.0035131681288511,0.0059539157034609,-0.320061484531065,0
2021-04-14,"Earnings Scheduled For April 14, 2021",WFC,0.0552902851221186,1.2134271064868476,-0.0240372386774002,0.0066666333369309,0.0117411793129591,0.0010003333782735,0.0035131681288511,0.0059539157034609,-0.320061484531065,0
2021-04-14,A Peek Into The Markets: US Stock Futures Edge Higher; Bank Earnings In Focus,WFC,0.0552902851221186,1.2134271064868476,-0.0240372386774002,0.0066666333369309,0.0117411793129591,0.0010003333782735,0.0035131681288511,0.0059539157034609,-0.320061484531065,0
2021-04-14,Why Is This Analyst Bullish About Financial Sector Stocks?,WFC,0.0552902851221186,1.2134271064868476,-0.0240372386774002,0.0066666333369309,0.0117411793129591,0.0010003333782735,0.0035131681288511,0.0059539157034609,-0.320061484531065,0
2021-04-14,"Goldman Sachs, JPMorgan, Wells Fargo Kick Off Bullish Start To Bank Earnings: What Technical Traders Need To Know",WFC,0.0552902851221186,1.2134271064868476,-0.0240372386774002,0.0066666333369309,0.0117411793129591,0.0010003333782735,0.0035131681288511,0.0059539157034609,-0.320061484531065,0
2021-04-15,Bank Of America And Citigroup Struggle After Stellar Q1 Earnings,WFC,0.0059539157034609,-0.320061484531065,0.0552902851221186,-0.0240372386774002,0.0066666333369309,0.0117411793129591,0.0010003333782735,0.0378786454689243,0.2925250813771483,0
2021-04-15,Is Now The Time To Buy These 4 Under-The-Radar Bank Stocks?,WFC,0.0059539157034609,-0.320061484531065,0.0552902851221186,-0.0240372386774002,0.0066666333369309,0.0117411793129591,0.0010003333782735,0.0378786454689243,0.2925250813771483,0
2021-04-15,"Bank of America, BlackRock, Citigroup Earnings All Impress While Economic Data Surge",WFC,0.0059539157034609,-0.320061484531065,0.0552902851221186,-0.0240372386774002,0.0066666333369309,0.0117411793129591,0.0010003333782735,0.0378786454689243,0.2925250813771483,0
2021-04-16,Indecision Hits Morgan Stanley Stock After Bank's Q1 Print,WFC,0.0378786454689243,0.2925250813771483,0.0059539157034609,0.0552902851221186,-0.0240372386774002,0.0066666333369309,0.0117411793129591,0.0009124846941921,-0.314334685122029,2
2021-04-16,"Despite Bumper Earnings, Banks May Lag Rest Of Market Amid Lower Treasury Yields",WFC,0.0378786454689243,0.2925250813771483,0.0059539157034609,0.0552902851221186,-0.0240372386774002,0.0066666333369309,0.0117411793129591,0.0009124846941921,-0.314334685122029,2
2021-04-16,Stocks That Hit 52-Week Highs On Friday,WFC,0.0378786454689243,0.2925250813771483,0.0059539157034609,0.0552902851221186,-0.0240372386774002,0.0066666333369309,0.0117411793129591,0.0009124846941921,-0.314334685122029,2
2021-04-19,Stocks That Hit 52-Week Highs On Monday,WFC,0.0009124846941921,-0.314334685122029,0.0378786454689243,0.0059539157034609,0.0552902851221186,-0.0240372386774002,0.0066666333369309,-0.0305378362613258,-0.240010019374198,1
2021-04-20,"'House Of Pain' Made Up Of Stocks Like Tesla, Zoom 'Falling Apart,' Says Cramer",WFC,-0.0305378362613258,-0.240010019374198,0.0009124846941921,0.0378786454689243,0.0059539157034609,0.0552902851221186,-0.0240372386774002,0.0164550694894556,-0.0832716755229703,0
2021-04-26,Stocks That Hit 52-Week Highs On Monday,WFC,0.0063840279725191,-0.1219517417089515,0.0271662125467273,-0.0124884655113048,0.0164550694894556,-0.0305378362613258,0.0009124846941921,0.0215225103281264,0.1838368567782626,0
2021-04-26,Can Apple's Earnings Impress Again? Tough Act To Follow For iPhone Maker In Fiscal Q2,WFC,0.0063840279725191,-0.1219517417089515,0.0271662125467273,-0.0124884655113048,0.0164550694894556,-0.0305378362613258,0.0009124846941921,0.0215225103281264,0.1838368567782626,0
2021-04-28,Stocks That Hit 52-Week Highs On Wednesday,WFC,-0.0002217090492248,-0.2861326046508434,0.0215225103281264,0.0063840279725191,0.0271662125467273,-0.0124884655113048,0.0164550694894556,0.025731879170131,0.2926458636890421,0
2021-04-29,Stocks That Hit 52-Week Highs On Thursday,WFC,0.025731879170131,0.2926458636890421,-0.0002217090492248,0.0215225103281264,0.0063840279725191,0.0271662125467273,-0.0124884655113048,-0.0257352028915537,0.2714140628778267,1
2021-05-10,Stocks That Hit 52-Week Highs On Monday,WFC,0.0012890679563701,0.1214260711842294,-0.0019301247109145,0.0172339858833761,0.004372383244851,0.0057167499166337,0.0095449501337427,-0.0188838601033207,0.1165320592627274,1
2021-05-11,"Tech Downturn Advances, With Apple, Tesla Coming Under Early Pressure",WFC,-0.0188838601033207,0.1165320592627274,0.0012890679563701,-0.0019301247109145,0.0172339858833761,0.004372383244851,0.0057167499166337,-0.0017498433632413,0.0608161125847801,2
2021-05-17,Stocks That Hit 52-Week Highs On Monday,WFC,0.0200171367692862,0.4762889012501097,0.0120690547220525,0.0166519136889173,-0.0017498433632413,-0.0188838601033207,0.0012890679563701,-0.0217119262426696,-0.0431050894783602,1
2021-05-18,"Warren Buffett's Berkshire Sheds Wells Fargo, Chevron Stakes And Buys This Stock Instead",WFC,-0.0217119262426696,-0.0431050894783602,0.0200171367692862,0.0120690547220525,0.0166519136889173,-0.0017498433632413,-0.0188838601033207,-0.0147249074525812,0.1983378927298349,1
2021-05-18,Stocks That Hit 52-Week Highs On Tuesday,WFC,-0.0217119262426696,-0.0431050894783602,0.0200171367692862,0.0120690547220525,0.0166519136889173,-0.0017498433632413,-0.0188838601033207,-0.0147249074525812,0.1983378927298349,1
2021-05-18,"Q1 13F Roundup: How Buffett, Einhorn, Ackman And Others Adjusted Their Portfolios",WFC,-0.0217119262426696,-0.0431050894783602,0.0200171367692862,0.0120690547220525,0.0166519136889173,-0.0017498433632413,-0.0188838601033207,-0.0147249074525812,0.1983378927298349,1
2021-05-21,How to Tell Which Stocks Retail Traders are Choosing,WFC,0.0032802719786062,0.0461830160493355,-0.0095299521915037,-0.0147249074525812,-0.0217119262426696,0.0200171367692862,0.0120690547220525,0.007846532821836,-0.0587748556532309,0
2021-06-23,"Sprinklr Prices Downsized IPO At $16/Share, Trading Begins Today",WFC,0.0096463040061549,-0.2901773564365417,0.0060073553513022,0.0366467401551073,-0.0243047740865851,-0.0610050205299965,0.0024196975774528,0.0277524300340694,0.4884575445323109,0
2021-06-25,Nike And Wells Fargo Lead The SPY Higher Friday,WFC,0.0265605819344973,0.7557404028478409,0.0277524300340694,0.0096463040061549,0.0060073553513022,0.0366467401551073,-0.0243047740865851,-0.0127210138750469,-0.4472202580963307,1
2021-06-28,July Outlook: Focus Turns To Corporate Forecasts As Wall Street Begins Digesting Q2 Earnings,WFC,-0.0127210138750469,-0.4472202580963307,0.0265605819344973,0.0277524300340694,0.0096463040061549,0.0060073553513022,0.0366467401551073,-0.0218389554606602,0.4573403372961018,1
2021-06-29,Why Morgan Stanley Is Trading Higher Today,WFC,-0.0218389554606602,0.4573403372961018,-0.0127210138750469,0.0265605819344973,0.0277524300340694,0.0096463040061549,0.0060073553513022,0.0111632719287779,-0.5404436687408307,0
2021-07-01,New Quarter Feels Familiar As Stocks Wobble Amid Lack Of Momentum Ahead Of Jobs Data,WFC,0.0026495544976736,0.0269648449755339,0.0111632719287779,-0.0218389554606602,-0.0127210138750469,0.0265605819344973,0.0277524300340694,-0.0074874513414242,-0.2915371422446136,1
2021-07-12,"As Investors Wait For Big Bank Earnings To Start Tomorrow, Stocks Are Mixed After Records",WFC,0.0056933616031631,-0.2968163187113614,0.0375708523702078,-0.0248847189303391,-0.0020694805857871,-0.0350564017497831,-0.0074874513414242,-0.0210596467664695,0.4409412619403028,1
2021-07-13,"Hot Summer, Cool Fall? Big Banks Seen Delivering Huge Q2 Earnings, But Headwinds Blow",WFC,-0.0210596467664695,0.4409412619403028,0.0056933616031631,0.0375708523702078,-0.0248847189303391,-0.0020694805857871,-0.0350564017497831,0.0397869926247786,0.9544032960713412,0
2021-07-14,"Bastille Day Fireworks Delivered By Bank Earnings, With Powell Leading Parade Later",WFC,0.0397869926247786,0.9544032960713412,-0.0210596467664695,0.0056933616031631,0.0375708523702078,-0.0248847189303391,-0.0020694805857871,0.0011124858669877,-0.3270970212422911,2
2021-07-14,"A Peek Into The Markets: US Stock Futures Mixed Ahead Of Earnings, Powell Testimony",WFC,0.0397869926247786,0.9544032960713412,-0.0210596467664695,0.0056933616031631,0.0375708523702078,-0.0248847189303391,-0.0020694805857871,0.0011124858669877,-0.3270970212422911,2
2021-07-19,Key Takeaways From 4 Large-Cap Bank Q2 Earnings,WFC,-0.0277777728074904,0.5576509975501289,-0.0160001281770928,0.0011124858669877,0.0397869926247786,-0.0210596467664695,0.0056933616031631,0.0415796490067632,-0.2030801020243438,0
2021-07-28,Robinhood Gets $32B Valuation As It Prices IPO At Lower End Of Range,WFC,0.0081966723956841,0.0509977626613031,0.0028882727115262,0.0094191539499499,-0.0097712155410432,-0.0168123158554018,0.021409510380651,0.0217535272825906,0.0530946810706667,0
2021-08-09,Stocks That Hit 52-Week Highs On Monday,WFC,-0.0024605073725852,-0.1128129847933087,0.0378802720937685,0.0226333539835823,-0.0145205726511662,0.0227123233463131,-0.003264932331255,0.0201439099731637,-0.0364857426699603,0
2021-08-11,"This AI Lending Platform Has A Better Year-To-Date Return Than Wells Fargo, Bank Of America, Citigroup And JPMorgan",WFC,0.0207535717898992,0.0172703871032913,0.0201439099731637,-0.0024605073725852,0.0378802720937685,0.0226333539835823,-0.0145205726511662,0.0096722982258214,-0.2559247223829693,0
2021-08-11,Stocks That Hit 52-Week Highs On Wednesday,WFC,0.0207535717898992,0.0172703871032913,0.0201439099731637,-0.0024605073725852,0.0378802720937685,0.0226333539835823,-0.0145205726511662,0.0096722982258214,-0.2559247223829693,0
2021-08-12,Stocks That Hit 52-Week Highs On Thursday,WFC,0.0096722982258214,-0.2559247223829693,0.0207535717898992,0.0201439099731637,-0.0024605073725852,0.0378802720937685,0.0226333539835823,-0.0152493252964739,-0.2708986235555617,1
2021-08-13,Stocks That Hit 52-Week Highs On Friday,WFC,-0.0152493252964739,-0.2708986235555617,0.0096722982258214,0.0207535717898992,0.0201439099731637,-0.0024605073725852,0.0378802720937685,-0.0190588751939481,0.4274488269489311,1
2021-08-30,"This Chipmaker Has A Better 5-Year Return Than Amazon, Microsoft, Bank Of America And Wells Fargo",WFC,-0.0281067969276043,-0.0485500761558201,0.015494500466366,-0.004869179463197,0.019230661003964,0.0157529573092329,0.0040068170205254,-0.0559801871598344,3.5791604636821743,1
2021-09-09,Coca-Cola And Merck Lead The Dow Jones Lower,WFC,0.0123229858525502,-0.0694274528994371,-0.0110583328459644,0.0031695890901983,-0.00897474439386,0.0257768939529077,-0.0492342006356876,-0.0006761234439224,0.1815501923961793,2
2021-09-13,"This Chipmaker Has A Better 5-Year Return Than Coca-Cola, Starbucks, Wells Fargo And Bank Of America",WFC,0.0322579784093817,0.1994145690149524,-0.0006761234439224,0.0123229858525502,-0.0110583328459644,0.0031695890901983,-0.00897474439386,0.0063373353195292,0.2863646743163783,0
2021-09-15,"Wells Fargo Forges Multi Cloud Partnership With Microsoft, Google",WFC,0.0128121561006628,-0.1253037178391931,0.0063373353195292,0.0322579784093817,-0.0006761234439224,0.0123229858525502,-0.0110583328459644,-0.00771862916253,-0.2357082154771116,1
2021-09-28,Troubling Tuesday: Second Selloff in Seven Sessions Comes as Tech Gets Hit by Yield Climb,WFC,-0.0344827843588807,0.0086168310254968,-0.0075123730103751,0.0025103555674161,0.0152931511247176,0.0268267416090297,0.0008730780443946,0.0241725391688401,-0.5596637020735941,0
2021-10-11,Cramer Provides Outlook For This Week's Big Banks Earnings,WFC,-0.0150001134000388,0.0764231850805154,0.0050252468109073,-0.0022978083932504,-0.0018766912138545,0.0199915274498043,0.0,-0.0133247772314253,0.2344569434425749,1
2021-10-13,Financial and Technology Stocks Making Headlines,WFC,-0.0128618760762408,0.2713561490231999,-0.0133247772314253,-0.0150001134000388,0.0050252468109073,-0.0022978083932504,-0.0018766912138545,-0.0160693924622061,1.2052603901400811,1
2021-10-14,"Earnings Scheduled For October 14, 2021",WFC,-0.0160693924622061,1.2052603901400811,-0.0128618760762408,-0.0133247772314253,-0.0150001134000388,0.0050252468109073,-0.0022978083932504,0.0677554962998763,0.1284114785279875,0
2021-10-14,Taiwan Semiconductor Earnings Reflects Problems with Supply Chain,WFC,-0.0160693924622061,1.2052603901400811,-0.0128618760762408,-0.0133247772314253,-0.0150001134000388,0.0050252468109073,-0.0022978083932504,0.0677554962998763,0.1284114785279875,0
2021-10-14,A Peek Into The Markets: US Stock Futures Rise Ahead Of Bank Earnings,WFC,-0.0160693924622061,1.2052603901400811,-0.0128618760762408,-0.0133247772314253,-0.0150001134000388,0.0050252468109073,-0.0022978083932504,0.0677554962998763,0.1284114785279875,0
2021-10-15,Friday's Market Minute: Beats Relieve Markets,WFC,0.0677554962998763,0.1284114785279875,-0.0160693924622061,-0.0128618760762408,-0.0133247772314253,-0.0150001134000388,0.0050252468109073,0.0217031338254611,-0.43686165273909,0
2021-10-18,Weekly Earnings Preview- The Banks Are Coming,WFC,0.0217031338254611,-0.43686165273909,0.0677554962998763,-0.0160693924622061,-0.0128618760762408,-0.0133247772314253,-0.0150001134000388,0.0184099699238364,-0.2169566848980725,0
2021-11-08,This Week's Earnings Roadmap,WFC,0.0085249320981917,-0.1677970584220584,-0.0035559767102619,-0.0227799077264951,0.0136452973124754,-0.0079288219918211,0.0107505891082284,-0.0192647190130877,0.4518465363028268,1
2021-11-12,Wall Street Crime And Punishment: The Blood On Elizabeth Holmes' Fingers,WFC,0.0073137564062744,0.0656515056286053,0.0045670070082315,0.0094208150719179,-0.0192647190130877,0.0085249320981917,-0.0035559767102619,0.0023548858097812,0.1743388205340823,2
2021-12-07,Wells Fargo Rates Four Cannabis Stocks – Scotts Miracle-Gro Is 'Flashing Green' As Buy Opportunity,WFC,0.0295020874718443,-0.1036300043285802,0.022199081436047,-0.0237171846097018,0.0360094586604735,-0.011929802401289,-0.0280715692417867,-0.0167163307081725,-0.2953768390776237,1
