date,title,stock,close,volume,1_past_close,2_past_close,3_past_close,4_past_close,5_past_close,next_close,next_volume,label
2016-10-14,Banks Have a Big Morning: All Three Big Banks Surpass Earnings Expectations,WFC,-0.0008939703299273,0.0281609793863442,-0.0125769557439148,-0.0028605799415782,-0.004381123160848,0.0070593424868166,0.0033201520034762,-0.0046969522576979,-0.5847229989475677,2
2016-10-14,"A Peek Into The Markets: U.S. Stock Futures Rise; Citigroup, Wells Fargo Earnings In Focus",WFC,-0.0008939703299273,0.0281609793863442,-0.0125769557439148,-0.0028605799415782,-0.004381123160848,0.0070593424868166,0.0033201520034762,-0.0046969522576979,-0.5847229989475677,2
2016-10-14,7 Stocks You Should Be Watching Today,WFC,-0.0008939703299273,0.0281609793863442,-0.0125769557439148,-0.0028605799415782,-0.004381123160848,0.0070593424868166,0.0033201520034762,-0.0046969522576979,-0.5847229989475677,2
2016-10-14,"Earnings Scheduled For October 14, 2016",WFC,-0.0008939703299273,0.0281609793863442,-0.0125769557439148,-0.0028605799415782,-0.004381123160848,0.0070593424868166,0.0033201520034762,-0.0046969522576979,-0.5847229989475677,2
2016-10-17,Plenty To Chew On As Heart Of Earnings Season Approaches; Fed Speakers On Prowl,WFC,-0.0046969522576979,-0.5847229989475677,-0.0008939703299273,-0.0125769557439148,-0.0028605799415782,-0.004381123160848,0.0070593424868166,0.0101127642192822,0.2659572776001655,0
2016-10-17,How Did The Big 4 Do In Q3?,WFC,-0.0046969522576979,-0.5847229989475677,-0.0008939703299273,-0.0125769557439148,-0.0028605799415782,-0.004381123160848,0.0070593424868166,0.0101127642192822,0.2659572776001655,0
2016-10-17,"The Market In 5 Minutes: Choppy Oil Prices, Bank Of America Keeps Big Banks Green",WFC,-0.0046969522576979,-0.5847229989475677,-0.0008939703299273,-0.0125769557439148,-0.0028605799415782,-0.004381123160848,0.0070593424868166,0.0101127642192822,0.2659572776001655,0
2016-10-17,A Peek Into The Markets: U.S. Stock Futures Edge Lower Ahead Of Earnings,WFC,-0.0046969522576979,-0.5847229989475677,-0.0008939703299273,-0.0125769557439148,-0.0028605799415782,-0.004381123160848,0.0070593424868166,0.0101127642192822,0.2659572776001655,0
2016-10-18,Traders Wonder Whether Morgan Stanley Can Continue Banks' Q3 Beat Streak,WFC,0.0101127642192822,0.2659572776001655,-0.0046969522576979,-0.0008939703299273,-0.0125769557439148,-0.0028605799415782,-0.004381123160848,0.0068964952773822,0.1298036653600027,0
2016-10-19,"The Market In 5 Minutes: Oil Inventories, Earnings Beats And A Walgreens-Rite Aid Snag",WFC,0.0068964952773822,0.1298036653600027,0.0101127642192822,-0.0046969522576979,-0.0008939703299273,-0.0125769557439148,-0.0028605799415782,-0.0072914617551856,0.0086592282314563,1
2016-10-19,A Peek Into The Markets: U.S. Stock Futures Mixed Ahead Of Earnings,WFC,0.0068964952773822,0.1298036653600027,0.0101127642192822,-0.0046969522576979,-0.0008939703299273,-0.0125769557439148,-0.0028605799415782,-0.0072914617551856,0.0086592282314563,1
2016-10-24,Barclays Will Round Out Big Bank Earnings This Week,WFC,0.0095362603295037,-0.1017644759618069,0.003561350959192,-0.0072914617551856,0.0068964952773822,0.0101127642192822,-0.0046969522576979,0.0043938371713108,0.0568903531947078,2
2016-11-02,Marijuana Boom Generates Loads Of Jobs And Cash,WFC,-0.0081118901257971,-0.0226571163125243,-0.0004345944368313,-0.0047588830278111,-0.0038785300013575,0.0056336835182246,0.0094050568752361,0.0022102455223473,-0.2342716670244191,2
2016-11-14,The Republican Sweep Changes Everything For Morgan Stanley's Large-Cap Bank Thesis,WFC,0.028803380635844,0.2695466671245137,0.0019368712136116,0.0758489178139214,0.0537992212945115,0.0030834794756335,0.0179373389586243,-0.0118376647750352,-0.3333057219750348,1
2016-11-28,"The Market In 5 Minutes: Castro, Trump And Oil In Focus",WFC,-0.0197643573478738,1.752166467749468,0.0088190242386543,-0.0011491147833525,0.0019187494027699,-0.0132525567001176,0.0062870583410374,0.0054284258095687,-0.3865678677149914,0
2016-11-30,Deutsche Bank On U.S. Big Banks: Boosted Estimates And Price Targets,WFC,0.0204396403824973,0.6331659218186176,0.0054284258095687,-0.0197643573478738,0.0088190242386543,-0.0011491147833525,0.0019187494027699,0.0268328581467707,0.3408676864705351,0
2016-12-13,Wells Fargo Fails Regulatory 'Living Will' Test,WFC,0.0010756125799658,-0.1266074258952456,-0.0238013785282342,-0.0026181163589402,0.0001743751219729,0.0311434250616389,0.0220788417736013,-0.02041525246878,1.2413982821199232,1
2016-12-14,The Market In 5 Minutes: All Eyes On The Fed,WFC,-0.02041525246878,1.2413982821199232,0.0010756125799658,-0.0238013785282342,-0.0026181163589402,0.0001743751219729,0.0311434250616389,0.0089578947429858,-0.4258004125252332,0
2017-01-09,Earnings Season Kicks Off With Bank Earnings Bonanza,WFC,-0.0145347307600742,0.1644697823775507,-0.0025371348147117,-0.0155216198233295,0.0008927002190337,0.0161495110043268,0.0049231791277231,0.0070055410993032,-0.1750886707870478,0
2017-01-09,Here are the Brands Investors Were Buying And Selling In December,WFC,-0.0145347307600742,0.1644697823775507,-0.0025371348147117,-0.0155216198233295,0.0008927002190337,0.0161495110043268,0.0049231791277231,0.0070055410993032,-0.1750886707870478,0
2017-01-10,"Mixed Earnings Expectations For Bank Of America, JPMorgan And Wells Fargo",WFC,0.0070055410993032,-0.1750886707870478,-0.0145347307600742,-0.0025371348147117,-0.0155216198233295,0.0008927002190337,0.0161495110043268,0.0032954516988283,0.1736770088217953,2
2017-01-11,What To Expect When You're Expecting Big Banks' Earnings,WFC,0.0032954516988283,0.1736770088217953,0.0070055410993032,-0.0145347307600742,-0.0025371348147117,-0.0155216198233295,0.0008927002190337,-0.0054744066889015,-0.0253073372321166,1
2017-01-13,"Keep an Eye on These 7 Stocks for January 13, 2017",WFC,0.0148626032242615,0.8102943607596784,-0.0054744066889015,0.0032954516988283,0.0070055410993032,-0.0145347307600742,-0.0025371348147117,-0.0276623828222051,-0.275497158327872,1
2017-01-13,"Earnings Scheduled For January 13, 2017",WFC,0.0148626032242615,0.8102943607596784,-0.0054744066889015,0.0032954516988283,0.0070055410993032,-0.0145347307600742,-0.0025371348147117,-0.0276623828222051,-0.275497158327872,1
2017-01-13,"A Peek Into The Markets: U.S. Stock Futures Up Ahead Of JPMorgan, Wells Fargo Earnings",WFC,0.0148626032242615,0.8102943607596784,-0.0054744066889015,0.0032954516988283,0.0070055410993032,-0.0145347307600742,-0.0025371348147117,-0.0276623828222051,-0.275497158327872,1
2017-01-13,The Market In 5 Minutes: Big Banks Get Earnings Season Started,WFC,0.0148626032242615,0.8102943607596784,-0.0054744066889015,0.0032954516988283,0.0070055410993032,-0.0145347307600742,-0.0025371348147117,-0.0276623828222051,-0.275497158327872,1
2017-01-13,"Earnings Season Is Underway! JPMorgan, Wells Fargo And Bank Of America Kick Things Off",WFC,0.0148626032242615,0.8102943607596784,-0.0054744066889015,0.0032954516988283,0.0070055410993032,-0.0145347307600742,-0.0025371348147117,-0.0276623828222051,-0.275497158327872,1
2017-01-17,5 Undervalued Stocks to Watch Ahead of Earnings,WFC,-0.0276623828222051,-0.275497158327872,0.0148626032242615,-0.0054744066889015,0.0032954516988283,0.0070055410993032,-0.0145347307600742,0.0091113903276569,-0.2145626964825908,0
2017-01-18,Here's How Financials Performed In Q4,WFC,0.0091113903276569,-0.2145626964825908,-0.0276623828222051,0.0148626032242615,-0.0054744066889015,0.0032954516988283,0.0070055410993032,0.0057120824380672,-0.0132063983536842,0
2017-01-18,How Important Are Big Bank Earnings?,WFC,0.0091113903276569,-0.2145626964825908,-0.0276623828222051,0.0148626032242615,-0.0054744066889015,0.0032954516988283,0.0070055410993032,0.0057120824380672,-0.0132063983536842,0
2017-02-01,Why The Case For A Border Adjustment Tax Relies On A Questionable Assumption,WFC,-0.0007148504534308,-0.0558433850533934,0.0044578648653901,-0.0090120432716699,-0.0103181714707955,0.0098903541116182,0.0351005128385568,-0.0028619334652729,-0.3834679572921442,2
2017-02-06,Here's Your Sell-Side Conference Preview,WFC,-0.0125717664868432,-0.2987756416060524,0.0272642898769481,-0.0028619334652729,-0.0007148504534308,0.0044578648653901,-0.0090120432716699,-0.0037136868333184,0.0715341243310712,2
2017-02-10,From Bank Stocks To Your Bank Account: Here's Everything You Need To Know About The Fiduciary Rule,WFC,0.0022915408150512,-0.2287997083191892,0.0197733846875709,-0.0126019112605264,-0.0037136868333184,-0.0125717664868432,0.0272642898769481,0.0038693526428905,0.2491991424915023,2
2017-02-14,"13F Roundup: Apple, Bank Of America And Other Stocks Hedge Funds Love/Hate",WFC,0.0157673492785357,0.0690100683184016,0.0038693526428905,0.0022915408150512,0.0197733846875709,-0.0126019112605264,-0.0037136868333184,0.0098309611599449,0.5473695133340251,0
2017-02-15,"The Mind Of Munger: Berkshire's Vice Chairman Speaks On Wells Fargo, Trump And More",WFC,0.0098309611599449,0.5473695133340251,0.0157673492785357,0.0038693526428905,0.0022915408150512,0.0197733846875709,-0.0126019112605264,-0.0073441106686706,-0.4203444521585457,1
2017-02-16,"JPMorgan, BofA, Wells Fargo Push For Rewrite Of Money Laundering Rules",WFC,-0.0073441106686706,-0.4203444521585457,0.0098309611599449,0.0157673492785357,0.0038693526428905,0.0022915408150512,0.0197733846875709,-0.0005163736431357,0.0740889448433086,2
2017-03-01,Wells Fargo Brass Join Ranks Of Execs Seeing Compensation Cuts,WFC,0.0319625836579626,0.6654583550250981,-0.0031002733015558,0.0043245957504429,-0.0116258095186387,0.0022275378228113,0.0018884709482429,-0.0170769493416852,-0.3216222161334018,1
2017-03-10,How The Ultra-Wealthy Are Helping Advance Health And Life Sciences,WFC,0.0025552769351122,-0.0382469866106923,0.008417846173194,-0.0015438716671148,-0.0052892153168663,-0.0047543694991112,0.0030660269079818,-0.0025487641369003,-0.0698866417110884,2
2017-04-05,The Market In 5 Minutes,WFC,-0.0039854667187185,0.4585839462529528,-0.0052260992454337,-0.0030544927861312,-0.0103126506009054,0.010238729272664,-0.0051823668063002,0.0070933561973018,-0.4034183910818587,0
2017-04-10,Leveraged Bank ETFs Step Into Earnings Spotlight,WFC,-0.0054705981576113,-0.0783087678562415,-0.0095717028480956,0.0070933561973018,-0.0039854667187185,-0.0052260992454337,-0.0030544927861312,-0.0069672696223622,0.92273937717779,1
2017-04-11,Q1 Earnings Kick Off: Can Big Banks Reignite Sagging Rally In The Space?,WFC,-0.0069672696223622,0.92273937717779,-0.0054705981576113,-0.0095717028480956,0.0070933561973018,-0.0039854667187185,-0.0052260992454337,-0.019202644563508,-0.0884935272085107,1
2017-04-13,"7 Stocks To Watch For April 13, 2017",WFC,-0.0333205811711226,0.8742017006948866,-0.019202644563508,-0.0069672696223622,-0.0054705981576113,-0.0095717028480956,0.0070933561973018,0.0266796172519792,-0.3339356425326164,0
2017-04-19,Your Big Bank Q1 Earnings Roundup,WFC,-0.0057198784821637,-0.2175850836796585,-0.0051213204123555,0.0266796172519792,-0.0333205811711226,-0.019202644563508,-0.0069672696223622,0.0258870054808932,0.811864757157787,0
2017-04-21,The Market In 5 Minutes,WFC,-0.0093458062627079,-0.1703678584218882,0.0258870054808932,-0.0057198784821637,-0.0051213204123555,0.0266796172519792,-0.0333205811711226,0.0122639786270146,-0.0886493259427061,0
2017-04-25,"A Trio Of Financial Upgrades: American Express, JPMorgan And Wells Fargo",WFC,0.0169619254667248,0.1343270443942372,0.0122639786270146,-0.0093458062627079,0.0258870054808932,-0.0057198784821637,-0.0051213204123555,-0.000366572719434,-0.4118723047303714,2
2017-04-25,The Market In 5 Minutes,WFC,0.0169619254667248,0.1343270443942372,0.0122639786270146,-0.0093458062627079,0.0258870054808932,-0.0057198784821637,-0.0051213204123555,-0.000366572719434,-0.4118723047303714,2
2017-05-01,Big Bank Investors Shocked By Trump's Break-Up Comment,WFC,0.0115155526809842,-0.1567152873305498,-0.0110211737811778,-0.0018336187807216,-0.000366572719434,0.0169619254667248,0.0122639786270146,0.0014689833237953,0.1235358369623018,2
2017-06-08,The Market In 5 Minutes,WFC,0.0090228133933409,0.330258952909108,0.0054044470253227,0.001740079476908,-0.0017370568599158,-0.0051843269211334,0.0183808510795511,0.0235919412217062,0.1371565345651424,0
2017-06-13,Big Banks Back Zelle As Preferred Digital Payment Platform,WFC,0.0066558455464591,-0.2117202102547452,0.005390336142218,0.0235919412217062,0.0090228133933409,0.0054044470253227,0.001740079476908,0.0014690128020817,-0.077424023154848,2
2017-06-28,Benzinga's Federal Reserve Stress Test Recap,WFC,0.0220089526508717,0.5531441950756875,0.0049148406656549,0.0085795620086122,-0.0007617192538339,-0.0092489191890683,-0.0089785659992885,0.0266890103870314,0.5529322526321816,0
2017-07-06,Major Companies In The Financial Sector Report Earnings In The Upcoming Weeks,WFC,-0.0039442080095318,0.0279905444065053,0.0,0.006677681393282,-0.0066333857566404,0.0266890103870314,0.0220089526508717,0.0032400346083012,-0.2056252244289147,2
2017-07-10,JJ Kinahan: Big Bank Earnings At Risk In Tough Rate Environment,WFC,-0.0026913492587369,-0.0455948189681401,0.0032400346083012,-0.0039442080095318,0.0,0.006677681393282,-0.0066333857566404,-0.0098938592816341,0.3519172966572548,1
2017-07-10,Banking On Bank Earnings With Leveraged ETFs,WFC,-0.0026913492587369,-0.0455948189681401,0.0032400346083012,-0.0039442080095318,0.0,0.006677681393282,-0.0066333857566404,-0.0098938592816341,0.3519172966572548,1
2017-07-11,4 Great Bank Stocks To Buy Ahead Of Q2 Earnings,WFC,-0.0098938592816341,0.3519172966572548,-0.0026913492587369,0.0032400346083012,-0.0039442080095318,0.0,0.006677681393282,0.0023617922060938,-0.19478935773141,2
2017-07-13,What You Should Know About Tomorrow's Bank Earnings Deluge,WFC,0.0077942142825517,0.1882859892063757,0.0023617922060938,-0.0098938592816341,-0.0026913492587369,0.0032400346083012,-0.0039442080095318,-0.0109710715951845,0.2638961258432029,1
2017-07-13,"Here Is The Earnings Preview For WFC, JPM And C.",WFC,0.0077942142825517,0.1882859892063757,0.0023617922060938,-0.0098938592816341,-0.0026913492587369,0.0032400346083012,-0.0039442080095318,-0.0109710715951845,0.2638961258432029,1
2017-07-13,Set Yellen On Repeat: Fed Chair Back On Capitol Hill After Stocks Rise To Record Highs,WFC,0.0077942142825517,0.1882859892063757,0.0023617922060938,-0.0098938592816341,-0.0026913492587369,0.0032400346083012,-0.0039442080095318,-0.0109710715951845,0.2638961258432029,1
2017-07-13,The Market In 5 Minutes,WFC,0.0077942142825517,0.1882859892063757,0.0023617922060938,-0.0098938592816341,-0.0026913492587369,0.0032400346083012,-0.0039442080095318,-0.0109710715951845,0.2638961258432029,1
2017-07-14,Takeaway From Big Bank Earnings? Consumers Looking Healthier As Loans Grow,WFC,-0.0109710715951845,0.2638961258432029,0.0077942142825517,0.0023617922060938,-0.0098938592816341,-0.0026913492587369,0.0032400346083012,-0.005091832216181,-0.1669117974773811,1
2017-07-14,Phil's Stock World: Funtime Friday – Earnings Season Starts Today,WFC,-0.0109710715951845,0.2638961258432029,0.0077942142825517,0.0023617922060938,-0.0098938592816341,-0.0026913492587369,0.0032400346083012,-0.005091832216181,-0.1669117974773811,1
2017-07-14,A Peek Into The Markets: U.S. Stock Futures Flat; Citigroup Earnings In Focus,WFC,-0.0109710715951845,0.2638961258432029,0.0077942142825517,0.0023617922060938,-0.0098938592816341,-0.0026913492587369,0.0032400346083012,-0.005091832216181,-0.1669117974773811,1
2017-07-14,"7 Stocks To Watch For July 14, 2017",WFC,-0.0109710715951845,0.2638961258432029,0.0077942142825517,0.0023617922060938,-0.0098938592816341,-0.0026913492587369,0.0032400346083012,-0.005091832216181,-0.1669117974773811,1
2017-07-14,"Earnings Scheduled For July 14, 2017",WFC,-0.0109710715951845,0.2638961258432029,0.0077942142825517,0.0023617922060938,-0.0098938592816341,-0.0026913492587369,0.0032400346083012,-0.005091832216181,-0.1669117974773811,1
2017-07-14,"Big Bank Earnings Begin Trickling In With JPMorgan, Citi, PNC And Wells Fargo Reporting",WFC,-0.0109710715951845,0.2638961258432029,0.0077942142825517,0.0023617922060938,-0.0098938592816341,-0.0026913492587369,0.0032400346083012,-0.005091832216181,-0.1669117974773811,1
2017-07-17,Why Bank ETFs Fell On Friday Despite Decent Earnings,WFC,-0.005091832216181,-0.1669117974773811,-0.0109710715951845,0.0077942142825517,0.0023617922060938,-0.0098938592816341,-0.0026913492587369,0.0016447341373562,-0.0902993259148299,2
2017-07-18,Where Will The Money Rotate In Q3?,WFC,0.0016447341373562,-0.0902993259148299,-0.005091832216181,-0.0109710715951845,0.0077942142825517,0.0023617922060938,-0.0098938592816341,0.0025548670903516,-0.0909411686870097,2
2017-07-21,A Look Back At PayPal's Impressive Week,WFC,-0.0129371126061107,0.1495024299930571,-0.001092199522311,0.0025548670903516,0.0016447341373562,-0.005091832216181,-0.0109710715951845,0.0018459860205319,0.063585377779056,2
2017-07-21,A Peek Into The Markets: U.S. Stock Futures Edge Lower; General Electric Profit Tops Views,WFC,-0.0129371126061107,0.1495024299930571,-0.001092199522311,0.0025548670903516,0.0016447341373562,-0.005091832216181,-0.0109710715951845,0.0018459860205319,0.063585377779056,2
2017-08-02,The Market In 5 Minutes,WFC,-0.0013037154601288,0.0037105367875434,0.0025953501366686,0.0120075233755092,-0.0257723253151413,-0.0036422169466231,-0.0027241803173212,-0.0041029068336969,-0.00244051879045,2
2017-08-03,The Market In 5 Minutes,WFC,-0.0041029068336969,-0.00244051879045,-0.0013037154601288,0.0025953501366686,0.0120075233755092,-0.0257723253151413,-0.0036422169466231,-0.0104870324672142,1.3053053724702832,1
2017-08-07,These Were The Most Bought And Sold Stocks In July,WFC,-0.005677485553359,-0.4923563627570828,-0.0104870324672142,-0.0041029068336969,-0.0013037154601288,0.0025953501366686,0.0120075233755092,0.0032357224575341,0.0972095423331877,2
2017-08-22,The Golden Gate To The Golden State Of Fintech,WFC,0.0077189829634072,-0.0384356184876065,0.0027090146810309,-0.002316571890893,-0.0168911645512025,-0.0030274529289631,0.0001893255867613,-0.0036386970375484,-0.2283254133902234,2
2017-09-22,Short Sellers Piling Into Big Bank Stocks Ahead Of Q3 Earnings,WFC,0.0035143536645936,0.1133126476629922,0.0057677345206921,0.0073083923980665,0.0123318525281759,0.0203252180119468,0.0072136916729992,-0.0040552608736312,-0.3574895555136914,2
2017-09-26,"Why JPMorgan, PNC Won't Be Good Buys This Coming Earnings Season",WFC,-0.0042569287094215,0.0393759863399993,-0.0040552608736312,0.0035143536645936,0.0057677345206921,0.0073083923980665,0.0123318525281759,0.0076210998384251,0.3143165318398673,0
2017-10-04,Financial Stocks Have Been Rallying Ahead Of Upcoming Q3 Earnings,WFC,-0.0111554136367657,-0.1555463628476711,0.0019832764857947,0.0058021459250754,0.0165901002240518,0.0007375868856014,0.0076210998384251,0.0078240490941121,-0.009327926628475,0
2017-10-09,Benzinga's Option Alert Recap From October 9,WFC,-0.0079166803602638,0.020248941817921,0.0034303722717876,0.0078240490941121,-0.0111554136367657,0.0019832764857947,0.0058021459250754,0.008523896635685,0.1251208578711435,0
2017-10-09,"The Week Ahead: New IPOs, Bank Earnings, And Some Notable FDA Actions",WFC,-0.0079166803602638,0.020248941817921,0.0034303722717876,0.0078240490941121,-0.0111554136367657,0.0019832764857947,0.0058021459250754,0.008523896635685,0.1251208578711435,0
2017-10-11,"Big Banks JPM, C, BAC And WFC Report Third Quarter Earnings This Week",WFC,0.0008991538990721,0.0033279950001952,0.008523896635685,-0.0079166803602638,0.0034303722717876,0.0078240490941121,-0.0111554136367657,-0.0080848746142752,0.1731980596584936,1
2017-10-12,Banks Or Bust: The Tone For Q3 Earnings Season Will Be Set This Week By Financial Institutions,WFC,-0.0080848746142752,0.1731980596584936,0.0008991538990721,0.008523896635685,-0.0079166803602638,0.0034303722717876,0.0078240490941121,-0.0275313960583365,1.3434544549527128,1
2017-10-12,"The Market In 5 Minutes: Trump Continues Battle With Media, Helios And Matheson's Wild Ride",WFC,-0.0080848746142752,0.1731980596584936,0.0008991538990721,0.008523896635685,-0.0079166803602638,0.0034303722717876,0.0078240490941121,-0.0275313960583365,1.3434544549527128,1
2017-10-17,Big Bank Q3 Earnings Roundup,WFC,-0.0113379705047739,-0.1836517208714871,0.0020487790757353,-0.0275313960583365,-0.0080848746142752,0.0008991538990721,0.008523896635685,0.0041359910568083,0.1605881373323234,2
2017-10-24,The Financials Trade Playing Out In Leveraged ETFs,WFC,0.0092879476039218,0.0374155484722766,-0.0001822365029717,0.0217676806787541,0.0063656122646678,0.0041359910568083,-0.0113379705047739,-0.0030674918312366,-0.0895928517418022,2
2017-11-15,"Q3 13F Roundup: How Buffett, Einhorn, Paulson, And Others Adjusted Their Portfolio",WFC,-0.0053664003655731,-0.1244113086351001,0.0059567958923931,-0.0016728964483114,-0.0035184048737122,-0.0047916065556619,-0.014350607729216,0.0158140112857854,0.4453850624499686,0
2017-11-21,"Session Starts to the Upside; Watch for Economic Data, Earnings Reports",WFC,0.0086958512462622,-0.1880470516021271,-0.0018469208144371,-0.0082414295346808,0.0158140112857854,-0.0053664003655731,0.0059567958923931,-0.0084375279886328,-0.1697535799956385,1
2017-11-29,Traders See Signs Of Rotation Into Financials Amid Nasdaq's Worst Day In Months,WFC,0.0199748852405217,0.153652687150577,0.0300278361150678,-0.0025882301043647,0.0005549167850431,-0.0084375279886328,0.0086958512462622,-0.0037050967987934,0.0456469063641087,2
2017-12-21,"The Market In 5 Minutes: Tax Cuts, Trump, iPhones, Blockchain And Iced Tea",WFC,0.0244429469145821,0.3376469521593279,-0.0036447501607675,-0.0091924281480045,0.0175379632764238,0.0109763090774299,-0.0030304062030034,-0.0009740448820819,-0.4734373517331128,2
2017-12-21,Will The Tax Cut Boost GDP?,WFC,0.0244429469145821,0.3376469521593279,-0.0036447501607675,-0.0091924281480045,0.0175379632764238,0.0109763090774299,-0.0030304062030034,-0.0009740448820819,-0.4734373517331128,2
2017-12-22,Every Company Already Celebrating Tax Reform Passage With Employee Bonuses,WFC,-0.0009740448820819,-0.4734373517331128,0.0244429469145821,-0.0036447501607675,-0.0091924281480045,0.0175379632764238,0.0109763090774299,-0.0068235929230857,0.0008238080527236,1
2018-01-08,"The Week Ahead: Conferences Take Center Stage, Earnings Begin To Trickle In",WFC,-0.0113147606568509,0.0950562319329859,0.006738344052305,0.0125078843842183,0.0076937434756254,0.0069227124839605,-0.0102774196442395,0.0035460531536239,0.0126594473775483,2
2018-01-09,"After Monday's Muted Action, Markets Move Higher In Early Going",WFC,0.0035460531536239,0.0126594473775483,-0.0113147606568509,0.006738344052305,0.0125078843842183,0.0076937434756254,0.0069227124839605,0.0138132515521671,0.1484793708178733,0
2018-01-11,Big Bank Earnings Are Around The Corner With JPM And WFC Up First,WFC,-0.0017426190761596,0.2191081043766394,0.0138132515521671,0.0035460531536239,-0.0113147606568509,0.006738344052305,0.0125078843842183,-0.0073007219918034,0.1726432616081541,1
2018-01-11,Calm Before The Storm: Market Action Slows As Earnings Season Looms,WFC,-0.0017426190761596,0.2191081043766394,0.0138132515521671,0.0035460531536239,-0.0113147606568509,0.006738344052305,0.0125078843842183,-0.0073007219918034,0.1726432616081541,1
2018-01-12,TD Ameritrade Index Indicates Retail Investors Are At Their Most Bullish Point Yet,WFC,-0.0073007219918034,0.1726432616081541,-0.0017426190761596,0.0138132515521671,0.0035460531536239,-0.0113147606568509,0.006738344052305,-0.0007991632149234,-0.3082078799046592,2
2018-01-12,A Peek Into The Markets: U.S. Stock Futures Climb Ahead Of Wells Fargo Earnings,WFC,-0.0073007219918034,0.1726432616081541,-0.0017426190761596,0.0138132515521671,0.0035460531536239,-0.0113147606568509,0.006738344052305,-0.0007991632149234,-0.3082078799046592,2
2018-01-12,"7 Stocks To Watch For January 12, 2018",WFC,-0.0073007219918034,0.1726432616081541,-0.0017426190761596,0.0138132515521671,0.0035460531536239,-0.0113147606568509,0.006738344052305,-0.0007991632149234,-0.3082078799046592,2
2018-01-12,"Earnings Scheduled For January 12, 2018",WFC,-0.0073007219918034,0.1726432616081541,-0.0017426190761596,0.0138132515521671,0.0035460531536239,-0.0113147606568509,0.006738344052305,-0.0007991632149234,-0.3082078799046592,2
2018-01-12,"Big Banks Fire First Salvos Of Earnings Season, And Most Results Look Good",WFC,-0.0073007219918034,0.1726432616081541,-0.0017426190761596,0.0138132515521671,0.0035460531536239,-0.0113147606568509,0.006738344052305,-0.0007991632149234,-0.3082078799046592,2
2018-01-16,Expected Winners And Losers For Q4 Earnings Season,WFC,-0.0007991632149234,-0.3082078799046592,-0.0073007219918034,-0.0017426190761596,0.0138132515521671,0.0035460531536239,-0.0113147606568509,0.0220799673238396,0.3342174918192073,0
2018-01-16,"It's Only Been Seven Sessions since Dow Hit 25,000; Could it Close at 26,000 Today?",WFC,-0.0007991632149234,-0.3082078799046592,-0.0073007219918034,-0.0017426190761596,0.0138132515521671,0.0035460531536239,-0.0113147606568509,0.0220799673238396,0.3342174918192073,0
2018-01-19,The Big Bank Q4 Earnings Roundup: Tax Charges Drag Bottom Lines,WFC,0.004222087093489,0.0133755266498629,0.0010959227853837,0.0220799673238396,-0.0007991632149234,-0.0073007219918034,-0.0017426190761596,0.0079414084936579,-0.2589445654805131,0
2018-02-01,Quicken Loans Is Now The Largest Home Lender In The US,WFC,0.0018353145507048,-0.1339163208966326,0.0076592563393853,-0.0082041349632624,-0.0016684144365138,0.0042650969834305,0.0025960182330861,-0.0219815437245453,0.2028108617091668,1
2018-03-23,The Fed Hikes Rates Ahead Of Upcoming Financial Sector Earnings,WFC,-0.0295067226034542,-0.0514602082905901,-0.0412483870438218,-0.0020037833536934,-0.0104542275905912,-0.00751329158485,-0.0163649001839379,0.0256963642500602,-0.1374556912170146,0
