,date,title,stock,close,volume,1_past_close,2_past_close,3_past_close,4_past_close,5_past_close,next_close,next_volume
498,2020-08-28,"Back To Workday: WDAY Shares Surge On Earnings, Revenue Beat",ABT,-0.004492815760881563,-0.5263085437374377,0.07849585824211092,0.00702649836273328,0.010651858836677297,-0.009863266901875556,0.007576654775713454,-0.011914354296302165,-0.5964194373401535
499,2020-08-31,Pharmaceutical Companies Are Doing Much More Than Battling COVID-19,ABT,-0.011914354296302165,-0.5964194373401535,-0.004492815760881563,0.07849585824211092,0.00702649836273328,0.010651858836677297,-0.009863266901875556,-0.026674010115712243,0.14689192303260734
500,2020-09-29,Stocks To Watch Amid The First Trump Vs. Biden Presidential Debate,ABT,0.007181387640919246,-0.1905901550176775,0.00956968020047877,0.0250694242251861,-0.017619086628972824,-0.01975190086458789,-0.010854188875535464,0.034604057054446136,1.1250811997401606
501,2020-10-16,"Pfizer Vaccine Announcement Raises Optimism Going Into Weekend, But Stimulus Hopes Fall",ABT,0.02189721013169832,0.24015915873241434,-0.003990718848602581,-0.0024073049496164955,-0.024133243518281167,0.0127677888674671,0.010226595952137929,-0.014862745621500362,-0.03093846682708834
502,2020-10-19,"Halliburton, IBM Earnings Today Kick Off Busy Week Of Corporate Reporting",ABT,-0.014862745621500362,-0.03093846682708834,0.02189721013169832,-0.003990718848602581,-0.0024073049496164955,-0.024133243518281167,0.0127677888674671,0.0029618057501028527,-0.0839541208466359
503,2020-10-19,Monday's Market Minute: Potential Market Movers,ABT,-0.014862745621500362,-0.03093846682708834,0.02189721013169832,-0.003990718848602581,-0.0024073049496164955,-0.024133243518281167,0.0127677888674671,0.0029618057501028527,-0.0839541208466359
504,2020-10-21,"7 Stocks To Watch For October 21, 2020",ABT,-0.022425257782022312,0.47566800051632896,0.0029618057501028527,-0.014862745621500362,0.02189721013169832,-0.003990718848602581,-0.0024073049496164955,0.033512827967517866,-0.1333449965010497
505,2020-10-21,"Earnings Scheduled For October 21, 2020",ABT,-0.022425257782022312,0.47566800051632896,0.0029618057501028527,-0.014862745621500362,0.02189721013169832,-0.003990718848602581,-0.0024073049496164955,0.033512827967517866,-0.1333449965010497
506,2020-10-21,A Peek Into The Markets: US Stock Futures Edge Higher; Netflix Profit Misses Views,ABT,-0.022425257782022312,0.47566800051632896,0.0029618057501028527,-0.014862745621500362,0.02189721013169832,-0.003990718848602581,-0.0024073049496164955,0.033512827967517866,-0.1333449965010497
507,2020-10-22,"Tesla Records Another Profitable Quarter, While AT&T, Coca-Cola Also Shine And Intel Awaited",ABT,0.033512827967517866,-0.1333449965010497,-0.022425257782022312,0.0029618057501028527,-0.014862745621500362,0.02189721013169832,-0.003990718848602581,-0.015436694439475374,-0.2787355161694053
508,2020-11-05,"The Daily Biotech Pulse: Bluebird Bio Plunges On Regulatory Filing Delay, Synlogic Soars On Study Initiation, European Label Expansion For Vertex, Merck Goes Shopping",ABT,0.017932545657215693,-0.3074031153991268,0.01798096779449687,0.019352449526880644,0.02254777419146481,0.001047755667869854,-0.0133434527236993,0.00783917968631287,0.09809529368275638
509,2020-11-05,Stocks That Hit 52-Week Highs On Thursday,ABT,0.017932545657215693,-0.3074031153991268,0.01798096779449687,0.019352449526880644,0.02254777419146481,0.001047755667869854,-0.0133434527236993,0.00783917968631287,0.09809529368275638
510,2020-11-06,Stocks That Hit 52-Week Highs On Friday,ABT,0.00783917968631287,0.09809529368275638,0.017932545657215693,0.01798096779449687,0.019352449526880644,0.02254777419146481,0.001047755667869854,-0.043960817338430824,1.4788185893233643
511,2020-12-16,BioSig Technologies Achieves First Commercial Sale Of Its PURE EP System,ABT,-0.0010237917809889918,-0.15179013050260626,0.006180269951666206,-0.002149121973578083,0.00469408688722206,0.0018809730271311942,-0.004494401669256076,0.013415376640127041,-0.11985556328077696
512,2021-01-26,"The Daily Biotech Pulse: Novartis Misses, J&J Beats In Big Pharma Earnings, Vaccine Developer CureVac Taps Equity Market",ABT,8.731745859336115e-05,-0.11662721514938268,0.01666075317407878,-0.0009738689545132351,0.0005315597732822308,0.0028425539732395144,0.01141059357859353,-0.003835244211996769,1.1979770181537273
513,2021-01-26,"Earnings Continue With Johnson & Johnson, 3M Early, Followed By Microsoft Later",ABT,8.731745859336115e-05,-0.11662721514938268,0.01666075317407878,-0.0009738689545132351,0.0005315597732822308,0.0028425539732395144,0.01141059357859353,-0.003835244211996769,1.1979770181537273
514,2021-01-27,Stocks That Hit 52-Week Highs On Wednesday,ABT,-0.003835244211996769,1.1979770181537273,8.731745859336115e-05,0.01666075317407878,-0.0009738689545132351,0.0005315597732822308,0.0028425539732395144,0.05337302204368766,0.24068358795813238
515,2021-01-27,"Earnings Scheduled For January 27, 2021",ABT,-0.003835244211996769,1.1979770181537273,8.731745859336115e-05,0.01666075317407878,-0.0009738689545132351,0.0005315597732822308,0.0028425539732395144,0.05337302204368766,0.24068358795813238
516,2021-01-27,"The Daily Biotech Pulse: Sorrento, Immutep Surge On COVID-19 Study Data, T2 Biosystems Sinks On Preannouncement",ABT,-0.003835244211996769,1.1979770181537273,8.731745859336115e-05,0.01666075317407878,-0.0009738689545132351,0.0005315597732822308,0.0028425539732395144,0.05337302204368766,0.24068358795813238
517,2021-01-28,"The Daily Biotech Pulse: Decision Day For Amgen, Zymeworks Sinks On Data, Ortho Clinical Diagnostics IPO",ABT,0.05337302204368766,0.24068358795813238,-0.003835244211996769,8.731745859336115e-05,0.01666075317407878,-0.0009738689545132351,0.0005315597732822308,0.026580190999829778,-0.02666359781521388
518,2021-01-29,"The Daily Biotech Pulse: Novavax Vaccine Readout, Clinical Hold On Bellicum Study Lifted, Lilly Earnings, NLS Pharma IPO",ABT,0.026580190999829778,-0.02666359781521388,0.05337302204368766,-0.003835244211996769,8.731745859336115e-05,0.01666075317407878,-0.0009738689545132351,-0.008495723346506168,-0.24174404962210438
519,2021-02-02,"The Daily Biotech Pulse: Vertex, Pfizer Earnings, Tiziana COVID-19 Vaccine Data, Decision Day For Mallinckrodt's Burn Treatment",ABT,-0.018769369869177432,-0.12715452615417833,-0.008495723346506168,0.026580190999829778,0.05337302204368766,-0.003835244211996769,8.731745859336115e-05,-0.00016642109886555456,-0.31401676515047405
520,2021-02-08,Stocks That Hit 52-Week Highs On Monday,ABT,0.003789325113915165,-0.4044870248475032,0.03582766472744492,-0.003992673368323207,-0.00016642109886555456,-0.018769369869177432,-0.008495723346506168,0.005220990996962049,-0.00911458333333337
521,2021-02-10,Stocks That Hit 52-Week Highs On Wednesday,ABT,0.0011186136671881286,0.22511315520513953,0.005220990996962049,0.003789325113915165,0.03582766472744492,-0.003992673368323207,-0.00016642109886555456,0.012371329866064817,-0.11870143490489582
522,2021-02-11,"The Daily Biotech Pulse: DermTech Soars On Contract, Fluidigm Plunges On Earnings, Decision Day For Regeneron, Bioventus Debuts",ABT,0.012371329866064817,-0.11870143490489582,0.0011186136671881286,0.005220990996962049,0.003789325113915165,0.03582766472744492,-0.003992673368323207,0.010958679401090299,-0.010466814518310219
523,2021-02-12,52 Weeks High Article 0.004831689889895241,ABT,0.010958679401090299,-0.010466814518310219,0.012371329866064817,0.0011186136671881286,0.005220990996962049,0.003789325113915165,0.03582766472744492,-0.001637587261877127,0.41416350069696883
524,2021-04-19,"Strong Earnings from Coca-Cola Start Week, with IBM on Way Ahead of Netflix Tomorrow",ABT,0.0014475335853934013,0.09770786948791477,0.0033080352761638565,0.02008232945275612,-0.00864886330021497,0.016275636662254955,0.001158001494372174,-0.03637671769503725,0.44579825188600775
525,2021-04-19,First-Quarter Earnings Season Is In Progress,ABT,0.0014475335853934013,0.09770786948791477,0.0033080352761638565,0.02008232945275612,-0.00864886330021497,0.016275636662254955,0.001158001494372174,-0.03637671769503725,0.44579825188600775
526,2021-04-19,Monday's Market Minute: Three Major Focal Points to Observe,ABT,0.0014475335853934013,0.09770786948791477,0.0033080352761638565,0.02008232945275612,-0.00864886330021497,0.016275636662254955,0.001158001494372174,-0.03637671769503725,0.44579825188600775
527,2021-04-20,A Peek Into The Markets: US Stock Futures Drop Ahead Of Earnings,ABT,-0.03637671769503725,0.44579825188600775,0.0014475335853934013,0.0033080352761638565,0.02008232945275612,-0.00864886330021497,0.016275636662254955,0.02166663078551645,-0.28944712460386346
528,2021-04-20,"The Daily Biotech Pulse: Q1 Beat From Johnson & Johnson, KalVista Study Placed On Hold, European Label Expansion For GW Pharma's Epidiolex",ABT,-0.03637671769503725,0.44579825188600775,0.0014475335853934013,0.0033080352761638565,0.02008232945275612,-0.00864886330021497,0.016275636662254955,0.02166663078551645,-0.28944712460386346
529,2021-04-20,"7 Stocks To Watch For April 20, 2021",ABT,-0.03637671769503725,0.44579825188600775,0.0014475335853934013,0.0033080352761638565,0.02008232945275612,-0.00864886330021497,0.016275636662254955,0.02166663078551645,-0.28944712460386346
530,2021-04-20,"Earnings Scheduled For April 20, 2021",ABT,-0.03637671769503725,0.44579825188600775,0.0014475335853934013,0.0033080352761638565,0.02008232945275612,-0.00864886330021497,0.016275636662254955,0.02166663078551645,-0.28944712460386346
531,2021-04-21,"Disappointing Subscriber Numbers Hit Netflix Shares, Weighing On Nasdaq Early",ABT,0.02166663078551645,-0.28944712460386346,-0.03637671769503725,0.0014475335853934013,0.0033080352761638565,0.02008232945275612,-0.00864886330021497,0.00734097860884364,-0.0956493331250089
532,2021-06-02,"Zoom, Advance Auto Parts Earnings Both Beat Analysts' Estimates, But Shares Sputter",ABT,0.010492345106974277,-0.23519250440811812,-0.09309889237593205,0.0082980068765095,-0.00907926911987833,-0.013935773253165307,0.009463663474196915,0.021515384480904176,-0.3693501464993677
533,2021-07-09,Abbott Lays Off Around 400 Employees As COVID-19 Test Demand Evaporates,ABT,0.004024705791412453,0.11376602113126455,-0.005088835997957952,0.008837035571382934,0.006607825920764032,0.007510994613298072,0.010610000163239208,-0.0077668304826209456,-0.10299522234472624
534,2021-07-22,"Earnings Scheduled For July 22, 2021",ABT,-0.0061355497579476115,0.6236902900613726,0.0021056464055768664,-0.0005050893514257915,0.01089269970504203,0.0072861224107994005,-0.004352618514468221,0.021564524518766115,-0.3193302673181949
535,2021-07-22,"A Peek Into The Markets: US Stock Futures Higher Ahead Of Earnings, Economic Data",ABT,-0.0061355497579476115,0.6236902900613726,0.0021056464055768664,-0.0005050893514257915,0.01089269970504203,0.0072861224107994005,-0.004352618514468221,0.021564524518766115,-0.3193302673181949
536,2021-07-22,"5 Stocks To Watch For July 22, 2021",ABT,-0.0061355497579476115,0.6236902900613726,0.0021056464055768664,-0.0005050893514257915,0.01089269970504203,0.0072861224107994005,-0.004352618514468221,0.021564524518766115,-0.3193302673181949
537,2021-07-22,"The Daily Biotech Pulse: FDA Nod For Merck-Eisai, Seres' Ulcerative Colitis Drug Flunks Midstage Study, Pfizer To Invest In Arvinas, AbSci IPO",ABT,-0.0061355497579476115,0.6236902900613726,0.0021056464055768664,-0.0005050893514257915,0.01089269970504203,0.0072861224107994005,-0.004352618514468221,0.021564524518766115,-0.3193302673181949
538,2021-09-14,"The Daily Biotech Pulse: NRx Rises On COVID-19 Drug Collaboration, Amgen's Lung Cancer Drug Conditionally Approved In Canada, Coherus Data Readout",ABT,0.0033959425751597383,-0.27768026157287906,-0.016925423805195128,0.006407245277556983,-0.00836814047808232,0.005218416706975981,-0.004265438439774227,0.0034631988253681634,0.1443274407966837
539,2021-09-24,Semiconductor Shortage Hits Supply Chain For MedTech Industry,ABT,-0.007422132845720686,-0.26812447434819175,0.005214646924228683,-0.0038360452468416684,0.002082108469982913,-0.015143162616090833,-0.005100300487435039,-0.030473594524550007,1.1279837147453788
540,2021-10-06,Employer Demand For Rapid COVID-19 Tests Deepen Shortage In US: Reuters,ABT,0.005264073137936753,0.2973999622499057,0.003029516764246898,-0.014333277226999841,-0.007788061528387846,-0.011133461270131373,0.006063888897307024,0.01218984390534339,-0.18059975631489933
541,2021-10-08,10 Health Care Stocks With Unusual Options Alerts In Today's Session,ABT,0.004071004874497852,0.5964312663677926,0.01218984390534339,0.005264073137936753,0.003029516764246898,-0.014333277226999841,-0.007788061528387846,-0.012754604623577248,-0.4615470166268142
542,2021-10-18,"The Week Ahead In Biotech (Oct. 18-23): J&J, Biogen Kickstart Big Pharma Earnings, Regeneron-Sanofi, Roche Await FDA Decisions And IPOs",ABT,-0.005702702690154715,-0.12251347215754105,-0.0006803644499930872,0.008751583246682682,-0.002727585203281979,0.0037646071112977797,-0.012754604623577248,0.02157170820110066,0.11452291595587405
543,2021-10-20,Abbot Labs and Biogen Outshine Novavax in the Health Care Sector,ABT,0.033266266800995536,0.42889455782312935,0.02157170820110066,-0.005702702690154715,-0.0006803644499930872,0.008751583246682682,-0.002727585203281979,0.014110814741864708,-0.4068008426665397
544,2021-10-20,"A Peek Into The Markets: US Stock Futures Flat Ahead Of Earnings, Fed's Beige Book Report",ABT,0.033266266800995536,0.42889455782312935,0.02157170820110066,-0.005702702690154715,-0.0006803644499930872,0.008751583246682682,-0.002727585203281979,0.014110814741864708,-0.4068008426665397
545,2021-10-20,"The Daily Biotech Pulse: Novavax Retreats Amid Vaccine Issues, LumiraDx COVID Test Approved In India, Sesen Shines On Positive Bladder Cancer Review",ABT,0.033266266800995536,0.42889455782312935,0.02157170820110066,-0.005702702690154715,-0.0006803644499930872,0.008751583246682682,-0.002727585203281979,0.014110814741864708,-0.4068008426665397
546,2021-10-20,A Crowded Earnings Calendar Ahead,ABT,0.033266266800995536,0.42889455782312935,0.02157170820110066,-0.005702702690154715,-0.0006803644499930872,0.008751583246682682,-0.002727585203281979,0.014110814741864708,-0.4068008426665397
547,2021-10-20,"5 Stocks To Watch For October 20, 2021",ABT,0.033266266800995536,0.42889455782312935,0.02157170820110066,-0.005702702690154715,-0.0006803644499930872,0.008751583246682682,-0.002727585203281979,0.014110814741864708,-0.4068008426665397
548,2021-10-20,"Earnings Scheduled For October 20, 2021",ABT,0.033266266800995536,0.42889455782312935,0.02157170820110066,-0.005702702690154715,-0.0006803644499930872,0.008751583246682682,-0.002727585203281979,0.014110814741864708,-0.4068008426665397
549,2021-10-22,"A-List Executive Team, Big-Name Backers Fail to Lift Abbisko IPO",ABT,0.013354690901545174,0.15214686998394855,0.014110814741864708,0.033266266800995536,0.02157170820110066,-0.005702702690154715,-0.0006803644499930872,-0.0011047428427392036,-0.2290719746443063
550,2021-10-25,Kimberly-Clark's Earnings Remind Investors that Inflation and Supply Chain Issues are Still a Major Theme,ABT,-0.0011047428427392036,-0.2290719746443063,0.013354690901545174,0.014110814741864708,0.033266266800995536,0.02157170820110066,-0.005702702690154715,0.012245149484681361,-0.0977885201834241
551,2021-12-03,"Biden's New COVID-19 Plan Includes Reimbursement For Over The Counter, At-Home COVID Tests",ABT,0.014721882796601138,0.032156046200989996,0.012939899112588416,0.007712553880812489,-0.01765212028306351,0.01707964413317198,0.00647640162637142,0.016888048560093516,0.25637072985060416
552,2021-12-29,5 Stocks Insiders Are Selling,ABT,0.005125536080458737,-0.13564927184466025,-0.006998413948439919,0.016527850107234343,0.0012230124589838187,0.027500462586701913,0.002148635612345018,-0.0013456885148890319,-0.013970304327986294
553,2022-01-05,Walmart And Kroger Jack Up Prices On COVID At-Home Tests After White House Agreement Not Extended,ABT,-0.004492779342880393,-0.27823617919720434,-0.0235184136929949,-0.012079159021220476,-0.0018439033362248614,-0.0013456885148890319,0.005125536080458737,-0.0001480559868409781,-0.040012104502202384
554,2022-01-18,Government Website For Free At-Home COVID Test Kit Opens Ahead Of Schedule: How To Get Yours,ABT,-0.01240643009854403,-0.3680281735786278,-0.011492484991814655,-0.0270168446406579,-0.014590946662374371,0.003252980160531216,-0.0022130222141488742,-0.004108346732316748,-0.31686637835250675
555,2022-01-26,"7 Stocks To Watch For January 26, 2022",ABT,-0.025959245514643126,0.6164946420353692,-0.004441978281404024,-0.01597394838589683,0.008980827340210329,-0.01063071209187283,-0.004108346732316748,0.0030816150715486934,-0.37779178613308384
556,2022-01-26,A Peek Into The Markets: US Stock Futures Gain; Fed Policy Decision In Focus,ABT,-0.025959245514643126,0.6164946420353692,-0.004441978281404024,-0.01597394838589683,0.008980827340210329,-0.01063071209187283,-0.004108346732316748,0.0030816150715486934,-0.37779178613308384
557,2022-01-26,"Earnings Scheduled For January 26, 2022",ABT,-0.025959245514643126,0.6164946420353692,-0.004441978281404024,-0.01597394838589683,0.008980827340210329,-0.01063071209187283,-0.004108346732316748,0.0030816150715486934,-0.37779178613308384
558,2022-03-02,36 Stocks To Watch After Biden's First State of The Union Address,ABT,0.018532540666181374,-0.041491855413052225,-0.020311649016641398,-0.014623111022639579,0.031081604869650503,0.012537293426257312,-0.00221251671761169,0.005068187989729411,-0.1864076762515966
559,2022-03-11,10 More Major US Corporations Still Doing Business In Russia,ABT,-0.02547009868712513,0.8303179824561404,-0.011740930812095596,0.01963651786814191,-0.023136441937621655,-0.02100319803254669,0.003637303388615676,0.013155538895944119,-0.3101317957166392
560,2022-04-14,Raymond James Thinks Med Tech Investors are Somewhat 'Paralyzed' Ahead Of Q1 Earnings,ABT,-0.014981598286589293,-0.2876426416207264,0.01322922428302542,-0.013745367689410481,-0.02604466654074411,-0.0009726424561170566,0.028597697166677483,-0.011895641215615926,0.310796178343949
561,2022-04-19,"This Week's Earnings Spotlight: Tesla, Netflix, IBM, American Express, Snap And More",ABT,0.031731086235434525,0.2441750285478268,-0.011895641215615926,-0.014981598286589293,0.01322922428302542,-0.013745367689410481,-0.02604466654074411,0.022170270409999082,0.6274873557382492
562,2022-04-20,A Peek Into The Markets: US Stock Futures Flat Ahead Of Earnings; Netflix Shares Plunge,ABT,0.022170270409999082,0.6274873557382492,0.031731086235434525,-0.011895641215615926,-0.014981598286589293,0.01322922428302542,-0.013745367689410481,0.005952479304183189,-0.12155935782678606
563,2022-04-20,"5 Stocks To Watch For April 20, 2022",ABT,0.022170270409999082,0.6274873557382492,0.031731086235434525,-0.011895641215615926,-0.014981598286589293,0.01322922428302542,-0.013745367689410481,0.005952479304183189,-0.12155935782678606
564,2022-04-20,"Earnings Scheduled For April 20, 2022",ABT,0.022170270409999082,0.6274873557382492,0.031731086235434525,-0.011895641215615926,-0.014981598286589293,0.01322922428302542,-0.013745367689410481,0.005952479304183189,-0.12155935782678606
565,2022-04-20,"Benzinga's Daily Brief On Trending Tickers For April 20, 2022: Procter & Gamble, Lululemon, Netflix, And More",ABT,0.022170270409999082,0.6274873557382492,0.031731086235434525,-0.011895641215615926,-0.014981598286589293,0.01322922428302542,-0.013745367689410481,0.005952479304183189,-0.12155935782678606
566,2022-04-20,Homebuilders Hammer Away After Tuesday's Rally As Yields Tick Lower,ABT,0.022170270409999082,0.6274873557382492,0.031731086235434525,-0.011895641215615926,-0.014981598286589293,0.01322922428302542,-0.013745367689410481,0.005952479304183189,-0.12155935782678606
567,2022-05-10,"Amid Baby Formula Shortage, Retailers Put Cap On Purchases: Report",ABT,-0.005959586473205047,-0.03548825290975888,-0.04346667530093051,-0.006548067284322223,-0.023249771195645863,0.02908472378180238,-0.0035451904156882375,-0.008524567406659855,0.06206488164780821
568,2022-05-17,"Morning Brief: Top Financial Stories Dominating on Tuesday, May 17",ABT,0.044025168317281205,0.22965544979219743,-0.001547146654721221,0.017690093594865397,0.020124738654111907,-0.008524567406659855,-0.005959586473205047,-0.015715117527106415,-0.24401439162668992
569,2022-05-19,Markets Finish Lower Following Wednesday's Intense Sell-Off,ABT,-0.002660844174870447,-0.09072816164063513,-0.015715117527106415,0.044025168317281205,-0.001547146654721221,0.017690093594865397,0.020124738654111907,0.007114767298553204,-0.28473543966501713
570,2022-05-19,White House To Prioritize Resources To Increase Production Of Baby Formula,ABT,-0.002660844174870447,-0.09072816164063513,-0.015715117527106415,0.044025168317281205,-0.001547146654721221,0.017690093594865397,0.020124738654111907,0.007114767298553204,-0.28473543966501713
571,2022-05-23,"Morning Brief: Top Financial Stories Dominating on Monday, May 23",ABT,0.015807216664398993,-0.033838921412098655,0.007114767298553204,-0.002660844174870447,-0.015715117527106415,0.044025168317281205,-0.001547146654721221,-0.010953722403811983,0.2101445949047509
572,2022-05-25,"Morning Brief: Top Financial Stories Dominating on Wednesday, May 25",ABT,-0.005097911249341447,-0.2562113568258544,-0.010953722403811983,0.015807216664398993,0.007114767298553204,-0.002660844174870447,-0.015715117527106415,0.014842264933468963,0.02705459367111196
573,2022-06-14,Stocks That Hit 52-Week Lows On Tuesday,ABT,-0.028042643875905493,0.12938852990240246,-0.03393233259080142,-0.02732678227095875,-0.017263885757761277,-0.018737145025355617,0.00395120266371185,0.018068823021150315,-0.10390315953888729
574,2022-06-16,"Benzinga Before The Bell: Tesla Raises Prices, Revlon Goes Bankrupt And Other Top Financial Stories Thursday, June 16",ABT,-0.02604976668981307,-0.09179439571057768,0.018068823021150315,-0.028042643875905493,-0.03393233259080142,-0.02732678227095875,-0.017263885757761277,0.00450677740485661,1.1381008010680906
575,2022-06-23,"Benzinga Before The Bell: Tesla's Cybertruck Update, Twitter's New Feature, Netflix's Ad-Tier And Other Top Financial Stories Thursday, June 23",ABT,0.007302643233364492,-0.08106538936062124,0.009864986730680592,0.018336152204403433,0.00450677740485661,-0.02604976668981307,0.018068823021150315,0.030505545688300995,1.823724530090033
576,2022-07-07,Senate Finance Committee Probe Reveals How AbbVie Exploits Offshore Subsidiaries To Avoid Tax Bills,ABT,0.007360310892974065,0.04369481548562382,-0.0055809560956390225,-0.008346924423248248,0.014450054588747152,-0.004124572130848603,0.019912074376201794,-0.002100679319483878,-0.24909616775126542
577,2022-07-13,The Fed's Pickle: Whether to Raise Rates to Fight Inflation While Increasing Recession Chances,ABT,-0.01929824887159548,-0.11615099977416043,-0.0054182896450598594,-0.0033863690822336645,-0.002100679319483878,0.007360310892974065,-0.0055809560956390225,-0.000283710874151355,-0.01849558739705559
578,2022-07-14,Hot Inflation And Earnings Misses Weigh On Equity Futures,ABT,-0.000283710874151355,-0.01849558739705559,-0.01929824887159548,-0.0054182896450598594,-0.0033863690822336645,-0.002100679319483878,0.007360310892974065,0.029420047239320235,-0.07523630246715796
579,2022-07-15,Another Way To Understand Market Momentum,ABT,0.029420047239320235,-0.07523630246715796,-0.000283710874151355,-0.01929824887159548,-0.0054182896450598594,-0.0033863690822336645,-0.002100679319483878,-0.016541063001564327,-0.025552740423136044
580,2022-07-18,"Bank Of America And Goldman Sachs Split On Earnings Reports, Possibly Putting Bank Rally In Jeopardy",ABT,-0.016541063001564327,-0.025552740423136044,0.029420047239320235,-0.000283710874151355,-0.01929824887159548,-0.0054182896450598594,-0.0033863690822336645,0.027191166599669137,0.2863396964376985
581,2022-07-19,"Apple Upstages Goldman Sachs On Monday, Bringing Rally To A Screeching Halt",ABT,0.027191166599669137,0.2863396964376985,-0.016541063001564327,0.029420047239320235,-0.000283710874151355,-0.01929824887159548,-0.0054182896450598594,-0.015464361628579892,0.26117752746873046
582,2022-07-20,Stranger Things Do Happen As Netflix Surprises Investors,ABT,-0.015464361628579892,0.26117752746873046,0.027191166599669137,-0.016541063001564327,0.029420047239320235,-0.000283710874151355,-0.01929824887159548,0.02272941680014795,-0.21947343908386074
583,2022-07-20,Investor Fear Eases On Upbeat Corporate Earnings,ABT,-0.015464361628579892,0.26117752746873046,0.027191166599669137,-0.016541063001564327,0.029420047239320235,-0.000283710874151355,-0.01929824887159548,0.02272941680014795,-0.21947343908386074
584,2022-07-20,Market Volatility Subsides Following Tuesday's Surge In Stocks,ABT,-0.015464361628579892,0.26117752746873046,0.027191166599669137,-0.016541063001564327,0.029420047239320235,-0.000283710874151355,-0.01929824887159548,0.02272941680014795,-0.21947343908386074
585,2022-07-27,A Wearable Band To Help Fight Addictions? This Company's Tech Could Transform The Industry,ABT,0.008250097336495177,-0.3151948590381426,0.005437760978391104,-0.006410262738412276,-0.013461087228443525,0.02272941680014795,-0.015464361628579892,0.0033639895185109125,0.43366126835174823
586,2022-08-29,Stocks That Hit 52-Week Lows On Monday,ABT,-0.0005888800435558394,-0.2225448931203705,-0.03768060402406381,0.004267771243371854,-0.005376777556529766,-0.013401542341879624,-0.023714362813232803,0.003534984116653206,0.09451760088890993
587,2022-09-09,"Top Financial Stories Friday, September 09: Elon Musk Hints At Potential Apple-SpaceX Partnership, GM's EV For Cost Conscious Buyers, Google Under DOJ Scanner For Search-Engine Dominance And More...",ABT,0.013926536340491458,-0.33554771455170274,0.021872034781212024,0.019374923718706638,0.0020488276503463076,-0.022319714717305206,0.02133456494923558,0.007466853831335607,-0.24615996678890195
