,date,title,stock,close,volume,1_past_close,2_past_close,3_past_close,4_past_close,5_past_close,next_close,next_volume
408,2017-04-19,22 Stocks Moving In Wednesday's Pre-Market Session,ABT,0.0036838965477288266,0.3280361655085282,0.002770917970073228,0.014998834496767532,-0.018629286205932072,-0.002294390843812999,0.0058854459631061395,0.00894669642597945,-0.5635767692833678
409,2017-04-19,"10 Stocks To Watch For April 19, 2017",ABT,0.0036838965477288266,0.3280361655085282,0.002770917970073228,0.014998834496767532,-0.018629286205932072,-0.002294390843812999,0.0058854459631061395,0.00894669642597945,-0.5635767692833678
410,2017-04-25,22 Stocks Moving In Tuesday's Pre-Market Session,ABT,-0.00838444192805865,0.00982607403002822,0.013783603841890368,-0.01023166807417697,0.00894669642597945,0.0036838965477288266,0.002770917970073228,0.0009140773093252452,-0.1769295314363104
411,2017-07-14,FDA's 60-Day Extension For Medical Device Defects Not Likely Obstructive To Public Health,ABT,0.017262999400277534,-0.41410369694723936,-0.007227014209295057,0.011381497836895571,-0.0016585452166686387,-0.004335456887953226,0.010429840362646603,-0.0030668829044635526,-0.18306981269764044
412,2017-07-19,Caution Still The Watchword But Stocks Hit Record Highs As Earnings Mostly Strong,ABT,0.014156747885134102,0.5575463541166299,-0.00041018711357398985,-0.0030668829044635526,0.017262999400277534,-0.007227014209295057,0.011381497836895571,0.028727433827716142,0.9014957594448727
413,2017-07-20,"Earnings Scheduled For July 20, 2017",ABT,0.028727433827716142,0.9014957594448727,0.014156747885134102,-0.00041018711357398985,-0.0030668829044635526,0.017262999400277534,-0.007227014209295057,-0.00019674618155784973,-0.35283670688984037
414,2017-07-20,"12 Stocks To Watch For July 20, 2017",ABT,0.028727433827716142,0.9014957594448727,0.014156747885134102,-0.00041018711357398985,-0.0030668829044635526,0.017262999400277534,-0.007227014209295057,-0.00019674618155784973,-0.35283670688984037
415,2017-10-16,"The Week Ahead: Earnings, Earnings, And More Earnings",ABT,-0.0003660241020171373,-0.24764732016640412,-0.0010967919045913321,0.009875611043641985,-0.017328694759719876,0.013538500840778234,-0.006182042325493242,0.007871028873106534,0.4583277412427862
416,2017-10-18,Mid-Day Market Update: IBM Surges After Strong Q3 Results; Mobileiron Shares Plunge,ABT,0.012895210949311675,0.6645867844653046,0.007871028873106534,-0.0003660241020171373,-0.0010967919045913321,0.009875611043641985,-0.017328694759719876,0.004124147553829394,-0.46207857403496355
417,2017-10-18,Mid-Morning Market Update: Markets Mostly Higher; Abbott Tops Q3 Views,ABT,0.012895210949311675,0.6645867844653046,0.007871028873106534,-0.0003660241020171373,-0.0010967919045913321,0.009875611043641985,-0.017328694759719876,0.004124147553829394,-0.46207857403496355
418,2017-10-18,"10 Stocks To Watch For October 18, 2017",ABT,0.012895210949311675,0.6645867844653046,0.007871028873106534,-0.0003660241020171373,-0.0010967919045913321,0.009875611043641985,-0.017328694759719876,0.004124147553829394,-0.46207857403496355
419,2017-10-18,"Earnings Scheduled For October 18, 2017",ABT,0.012895210949311675,0.6645867844653046,0.007871028873106534,-0.0003660241020171373,-0.0010967919045913321,0.009875611043641985,-0.017328694759719876,0.004124147553829394,-0.46207857403496355
420,2018-01-22,"The Week Ahead: IPOs, Earnings, And FDA Actions Provide Catalysts",ABT,0.0043836197510933594,-0.07068443285386361,0.004063004432062645,0.0013561012342204748,0.009411508137621372,-0.006798004348054332,-0.0018660452462766486,-0.00570766337304518,0.18711176719916978
421,2018-01-22,"The Market In 5 Minutes: Celgene Buys Juno, Netflix Earnings Preview, Eagles And Patriots Advance To Super Bowl",ABT,0.0043836197510933594,-0.07068443285386361,0.004063004432062645,0.0013561012342204748,0.009411508137621372,-0.006798004348054332,-0.0018660452462766486,-0.00570766337304518,0.18711176719916978
422,2018-03-01,MedTech's Long-Term Prospects Outweigh Near-Term Risks,ABT,-0.02552636179133394,0.16649651080389627,-0.00363313023071532,0.00033019462602945637,0.013733121294236428,0.012205402449012137,0.0,0.011396408093547805,-0.17840999186564932
423,2018-04-16,"Earnings Parade Continues This Week After Missile Attacks, With Banks, Netflix On Way",ABT,0.013335599085329441,-0.17220958935758846,-0.005779299380077929,0.011345955330529733,-0.011666990012635381,0.015801775181174316,0.01129074414162834,0.008942138799247656,-0.17670216672787364
424,2018-04-16,"The Week Ahead: Netflix Earnings, Big Bank Results, FDA Actions Abound",ABT,0.013335599085329441,-0.17220958935758846,-0.005779299380077929,0.011345955330529733,-0.011666990012635381,0.015801775181174316,0.01129074414162834,0.008942138799247656,-0.17670216672787364
425,2018-04-18,"10 Stocks To Watch For April 18, 2018",ABT,-0.004682237603505834,1.256806908610784,0.008942138799247656,0.013335599085329441,-0.005779299380077929,0.011345955330529733,-0.011666990012635381,0.006048220853110742,-0.3931691504921532
426,2018-04-18,"Earnings Scheduled For April 18, 2018",ABT,-0.004682237603505834,1.256806908610784,0.008942138799247656,0.013335599085329441,-0.005779299380077929,0.011345955330529733,-0.011666990012635381,0.006048220853110742,-0.3931691504921532
427,2018-07-09,Health Care Sector Outlook: Checking In Ahead Of Q2 Earnings Reports,ABT,0.004504469566357638,0.0019189122508840306,0.013533286457071858,0.008551216323952726,-0.0031147586720675635,0.00016391175331720298,-0.004569833570006732,0.005925812609004044,0.08446195518345245
428,2018-07-16,"The Week Ahead: Netflix Earnings, Comic-Con, 'IPO Thursday' And More",ABT,-0.020298121874993247,0.08215063452729598,0.005100314088801072,0.0072244144322852755,-0.0038212050770251027,0.005925812609004044,0.004504469566357638,0.016510301732120425,0.3784955936437444
429,2018-07-18,"Earnings Scheduled For July 18, 2018",ABT,0.031050881248779305,0.34033877828395953,0.016510301732120425,-0.020298121874993247,0.005100314088801072,0.0072244144322852755,-0.0038212050770251027,-0.01498061706457332,-0.36519069348205735
430,2018-07-18,"11 Stocks To Watch For July 18, 2018",ABT,0.031050881248779305,0.34033877828395953,0.016510301732120425,-0.020298121874993247,0.005100314088801072,0.0072244144322852755,-0.0038212050770251027,-0.01498061706457332,-0.36519069348205735
431,2018-07-27,"Benzinga's Daily Biotech Pulse: Achaogen To Trim Workforce By 28%, Amgen's Beat-And-Raise Quarter",ABT,-0.006091884593075081,-0.22077215878194667,0.0065919577700130905,0.01288843819925467,0.018987277272758174,-0.0018951552583205133,-0.0072123231338422356,-0.0013794272233960125,0.1882530821121191
432,2018-08-30,"The Daily Biotech Pulse: Verastem Gets New CFO, Mesoblast Earnings, Vertex's Precision Medicine Collaboration",ABT,-0.0016390357060576122,-0.06871345029239762,0.005090655007929712,-0.0007479196069278826,0.01119494156606926,0.00410151532411418,0.002436532951790582,-0.002685549041875235,0.4234754256732278
433,2018-09-14,"The Daily Biotech Pulse: FDA Nod For STAAR, Supernus Opens Wallet, Principia Biopharma To Debut",ABT,-0.0011676358437434642,-0.30325160267001516,0.022845729609555,0.0055557564285324545,0.0007511169049816413,0.005135435621052897,0.00577229532555501,-0.010961878354124543,0.009129713066160727
434,2018-09-21,"The Daily Biotech Pulse: Exelixis Liver Cancer Drug On Track For European Approval, Medtronic Goes Shopping, Opiant Gets BARDA Funding",ABT,0.0037795777092102245,0.8526217563086942,0.004233900151055403,0.0013156708815109663,0.01093527212237011,-0.010961878354124543,-0.0011676358437434642,0.03461221709849105,0.08367716560748462
435,2018-09-25,"The Daily Biotech Pulse: Syndax Lung Cancer Trial Disappoints, Gemphire To Trim Workforce, Opiant's Offering",ABT,0.01063837117878963,-0.1834076681929212,0.03461221709849105,0.0037795777092102245,0.004233900151055403,0.0013156708815109663,0.01093527212237011,0.008864434023853729,0.07237232509415903
436,2018-09-27,"The Daily Biotech Pulse: Hologic Goes Shopping, Johnson & Johnson Snaps Ties With Geron",ABT,0.0024710823775602186,-0.3795638572993484,0.008864434023853729,0.01063837117878963,0.03461221709849105,0.0037795777092102245,0.004233900151055403,0.004656381600140813,0.1962540271937967
437,2018-10-02,"The Daily Biotech Pulse: TransEnterix's Positive Pre-Announcement, Merit Medical Opens Wallet, GW Pharma To Offer ADS Shares",ABT,-0.004182468258448702,-0.13283764288092337,0.010359825841295578,0.004656381600140813,0.0024710823775602186,0.008864434023853729,0.01063837117878963,-0.023980571170936438,0.19623432300998211
438,2018-10-17,"8 Stocks To Watch For October 17, 2018",ABT,-0.01014811781246483,0.4419600193750246,0.03275094445859139,-0.009087042296314962,0.018061812415721024,-0.00783507410377382,-0.03324466156763728,-0.029758971845280202,-0.00502056342887236
439,2018-10-17,"After Basking In The Glow Of Netflix Results And Tuesday Rally, Pressure Seems Possible",ABT,-0.01014811781246483,0.4419600193750246,0.03275094445859139,-0.009087042296314962,0.018061812415721024,-0.00783507410377382,-0.03324466156763728,-0.029758971845280202,-0.00502056342887236
440,2018-12-04,"The Daily Biotech Pulse: ASH Presentations Take The Spotlight, Eiger Gets A New CFO",ABT,-0.03729619116773386,0.18501181886041307,0.002970599987045519,0.010783650529596178,0.005904184482064201,0.04475713757242139,0.013079028845207397,0.0005594029987201488,0.3476332331596699
441,2019-01-23,"Geopolitics Aside, How About Those Earnings? Investors Appear To Switch Focus",ABT,-0.02210064114487964,0.5586859483918307,0.000980055093080745,0.012762496940769807,0.010025489203171478,-0.009223672766153101,0.032225167899852414,0.013588644085977153,-0.3686337200749291
442,2019-01-23,"12 Stocks To Watch For January 23, 2019",ABT,-0.02210064114487964,0.5586859483918307,0.000980055093080745,0.012762496940769807,0.010025489203171478,-0.009223672766153101,0.032225167899852414,0.013588644085977153,-0.3686337200749291
443,2019-01-23,"Earnings Scheduled For January 23, 2019",ABT,-0.02210064114487964,0.5586859483918307,0.000980055093080745,0.012762496940769807,0.010025489203171478,-0.009223672766153101,0.032225167899852414,0.013588644085977153,-0.3686337200749291
444,2019-02-13,"The Daily Biotech Pulse: Exelixis Q4 Results, FDA Panel Greenlights J&J's Depression Drug, MacroGenics Prices Offering",ABT,-0.009059474479614193,-0.19083199568163411,0.02066912598659898,0.0028636944020259403,0.008111314749045473,-0.01020546843025949,0.005197730006394563,-0.005512475896859881,-0.14602461246774223
445,2019-02-26,"The Daily Biotech Pulse: Immunomedics CEO Departs, Ultragenyx Offering, Karyopharm Awaits FDA Panel Vote",ABT,-0.0014309011364986857,-0.07254448647891276,0.009588430380890856,0.013175491261205652,-0.005294962851385643,0.0072000686237223555,-0.0033226178610084034,0.006254035541055858,0.07763341768327225
446,2019-02-28,"The Daily Biotech Pulse: Bristol-Myers Squibb-Celgene Deal Faces Setback, Syneos Hit By SEC Probe, FDA Cheer For T2 Biosystems",ABT,0.005049874766770657,0.18508718128450008,0.006254035541055858,-0.0014309011364986857,0.009588430380890856,0.013175491261205652,-0.005294962851385643,0.01249644519991433,-0.20296627086814434
447,2019-03-05,"The Daily Biotech Pulse: Novartis Psoriasis Drug Found Superior, Ascendis Offering, Adamas Earnings",ABT,-0.005088044806822789,0.09805795934795736,0.00038208809904238805,0.01249644519991433,0.005049874766770657,0.006254035541055858,-0.0014309011364986857,-0.006647671536898159,-0.36126765941198935
448,2019-03-22,"The Daily Biotech Pulse: Immutep Gets US Patent, Conatus NASH Disappointment, Eisai Moves On After Aducanumab Setback",ABT,-0.026105323213964082,0.27695750199182934,0.0015011172915506688,-0.0002501236377721039,0.014334718329775065,-0.012897649957332002,0.011141997026562711,0.0033345965724389526,-0.4896387845318536
449,2019-04-02,"The Daily Biotech Pulse: FDA Nod For ADMA, Regulatory Setback For Apyx, Achieve Life Sciences Smoking Cessation Drug Trial",ABT,-0.0005019270486403826,-0.23215613382899625,-0.0035027087566904536,0.006293919294209527,0.009018370835755851,-0.003417856244953943,0.009842766504401856,-0.0015072523815711225,0.06880228085747331
450,2019-04-17,"8 Stocks To Watch For April 17, 2019",ABT,-0.04582355541302274,0.8003789460162498,-0.014451679336582979,-0.0065376762642644914,-0.002302115403920113,-0.005824860545180055,0.0038133758564975473,0.014269917516540165,-0.13379829474510363
451,2019-04-17,"Hot, Fresh Earnings On The Menu As Netflix, Morgan Stanley Results In Focus",ABT,-0.04582355541302274,0.8003789460162498,-0.014451679336582979,-0.0065376762642644914,-0.002302115403920113,-0.005824860545180055,0.0038133758564975473,0.014269917516540165,-0.13379829474510363
452,2019-06-11,"The Daily Biotech Pulse: Lilly Reports Positive Long-Term Efficacy Data For Psoriasis Drug, Provention Bio Offering",ABT,-0.0018455916453314902,-0.0055002419087876175,0.006564123122880794,0.008116069903365108,0.017791288275177175,0.01587924043085165,0.02311426659369964,0.010231682207341608,-0.1467673793368327
453,2019-06-14,"The Daily Biotech Pulse:  Hematology And Rheumatology Conference Presentations Take The Spotlight, Eton In-Licenses Epilepsy Drug NDA",ABT,-0.0008506725205115195,-0.08606620182361502,0.00414893833634844,0.010231682207341608,-0.0018455916453314902,0.006564123122880794,0.008116069903365108,-0.0020674104878251054,-0.14151872733751125
454,2019-06-19,"The Daily Biotech Pulse: Positive Readouts From Adamas And Ironwood, Sesen Bio To Offer Shares, Stoke Therapeutics Debut",ABT,0.010908455337050649,-0.34217175755637297,0.01669705018878731,-0.0020674104878251054,-0.0008506725205115195,0.00414893833634844,0.010231682207341608,0.007233500075786159,0.5647396314484368
455,2019-06-20,"The Daily Biotech Pulse: DiaMedica Reports Positive Data For Chronic Kidney Disease Drug, Eloxx Offering, IPO Deluge",ABT,0.007233500075786159,0.5647396314484368,0.010908455337050649,0.01669705018878731,-0.0020674104878251054,-0.0008506725205115195,0.00414893833634844,0.0007064541086629905,0.3758312099931638
456,2019-06-21,"The Daily Biotech Pulse: ContraVir's Volatile Ride Continues, Late-Stage Disappointment For Exelixis, Regeneron-Sanofi Breathe Easy",ABT,0.0007064541086629905,0.3758312099931638,0.007233500075786159,0.010908455337050649,0.01669705018878731,-0.0020674104878251054,-0.0008506725205115195,-0.00341180003280106,-0.48826704609616733
457,2019-07-05,"The Daily Biotech Pulse: FDA Approves Karyopharm's Blood Cancer, Grifols' Immunodeficiency Drug; ESMO, ISTH Conferences In The Spotlight",ABT,-0.0025691902231732566,0.5526974358974359,0.00812259884640687,0.005444452092867369,0.004637141844722414,0.004899119770929827,0.008799289495452722,-0.003863000737096667,-0.05115332787275084
458,2019-07-15,"Earnings Season Starts With Beat From Citigroup; Other Banks, Netflix Report Later In Week",ABT,-0.0013105047029789985,-0.08637422360248448,-0.01790541392422318,0.004567907781922509,0.0012900268103288592,0.002115340459291959,-0.003863000737096667,-0.007755681306647277,-0.24933850937675028
459,2019-07-17,"Earnings Scheduled For July 17, 2019",ABT,0.031264917093107414,1.4137185787428925,-0.007755681306647277,-0.0013105047029789985,-0.01790541392422318,0.004567907781922509,0.0012900268103288592,0.023320950472256907,-0.11403415268510031
460,2019-07-17,"10 Stocks To Watch For July 17, 2019",ABT,0.031264917093107414,1.4137185787428925,-0.007755681306647277,-0.0013105047029789985,-0.01790541392422318,0.004567907781922509,0.0012900268103288592,0.023320950472256907,-0.11403415268510031
461,2019-07-23,"With Earnings On Tap, A Stir In This Leveraged Pharmaceuticals ETF",ABT,0.007607597371317887,-0.38333257184630143,0.006629291523350789,-0.003076537714828631,0.023320950472256907,0.031264917093107414,-0.007755681306647277,-0.001690291983912795,-0.041984638561655685
462,2019-07-24,"The Daily Biotech Pulse: Jounce Jumps On Licensing Deal, Regulus Hit With Partial Clinical Hold, Genomic Health Added to S&P SmallCap Index",ABT,-0.001690291983912795,-0.041984638561655685,0.007607597371317887,0.006629291523350789,-0.003076537714828631,0.023320950472256907,0.031264917093107414,-0.00666011522592358,0.20419684978474395
463,2019-10-16,17 Healthcare Stocks Moving In Wednesday's Pre-Market Session,ABT,-0.002439561008438118,0.665458617846977,0.027060780039967147,0.0023860891978868537,-0.002380409328900601,0.008050378537412861,0.01260985453188268,0.007336875917367536,-0.6102882118908419
464,2019-11-13,Abbott CEO Miles White Steps Down,ABT,-0.0014225687816342703,0.07443129626627765,0.006924205874500933,0.00023890550754468443,0.004197286135374734,0.003248363561429546,0.009473101902029546,-0.0011875286491406234,0.12504714727551614
465,2019-12-20,Stocks That Hit 52-Week Highs On Friday,ABT,-0.007899074992120947,1.499407799814803,0.004831709834077325,-0.001493436441012408,0.007638741333841459,0.0005791644877410906,0.004420152424529755,0.007961967167864792,-0.6495239736354629
466,2020-01-17,"Record Run: Stocks Keep Rolling To New Highs as Housing Data, Earnings Look Solid",ABT,0.008156066273750318,0.1704855373957359,0.010300093145084288,0.019127324065883577,0.011561907019193018,-0.0028115160858965815,-0.01249430458255607,0.008201955666956584,0.26844907053080935
467,2020-01-21,"Coronavirus Outbreak, IMF Forecast, Impeachment Trial Weigh On Investor Sentiment",ABT,0.008201955666956584,0.26844907053080935,0.008156066273750318,0.010300093145084288,0.019127324065883577,0.011561907019193018,-0.0028115160858965815,0.023738133408545137,0.3195317842345906
468,2020-01-21,Stocks That Hit 52-Week Highs On Tuesday,ABT,0.008201955666956584,0.26844907053080935,0.008156066273750318,0.010300093145084288,0.019127324065883577,0.011561907019193018,-0.0028115160858965815,0.023738133408545137,0.3195317842345906
469,2020-01-22,Stocks That Hit 52-Week Highs On Wednesday,ABT,0.023738133408545137,0.3195317842345906,0.008201955666956584,0.008156066273750318,0.010300093145084288,0.019127324065883577,0.011561907019193018,-0.012301432092844955,-0.2461894890866967
470,2020-01-22,"8 Stocks To Watch For January 22, 2020",ABT,0.023738133408545137,0.3195317842345906,0.008201955666956584,0.008156066273750318,0.010300093145084288,0.019127324065883577,0.011561907019193018,-0.012301432092844955,-0.2461894890866967
471,2020-01-22,A Peek Into The Markets: US Stock Futures Climb Ahead Of Earnings,ABT,0.023738133408545137,0.3195317842345906,0.008201955666956584,0.008156066273750318,0.010300093145084288,0.019127324065883577,0.011561907019193018,-0.012301432092844955,-0.2461894890866967
472,2020-01-22,"The Daily Biotech Pulse: Johnson & Johnson Earnings, FDA Nod For Horizon Therapeutics, Slew Of Secondary Offerings",ABT,0.023738133408545137,0.3195317842345906,0.008201955666956584,0.008156066273750318,0.010300093145084288,0.019127324065883577,0.011561907019193018,-0.012301432092844955,-0.2461894890866967
473,2020-01-22,"Earnings Scheduled For January 22, 2020",ABT,0.023738133408545137,0.3195317842345906,0.008201955666956584,0.008156066273750318,0.010300093145084288,0.019127324065883577,0.011561907019193018,-0.012301432092844955,-0.2461894890866967
474,2020-03-12,Stocks That Hit 52-Week Lows On Thursday,ABT,-0.042899147803851956,0.2030569957170849,-0.034495595907913734,0.050116980321908366,-0.05774403245994775,0.01515126363741448,-0.01912534767177032,0.09245371740203412,0.3200132600188812
475,2020-03-13,"The Daily Biotech Pulse: Roche Obtains FDA Emergency Use Authorization For COVID-19 Test, Chembio Appoints New CEO, Inovio Slumps On Earnings",ABT,0.09245371740203412,0.3200132600188812,-0.042899147803851956,-0.034495595907913734,0.050116980321908366,-0.05774403245994775,0.01515126363741448,-0.09785663137598377,-0.21608459946825065
476,2020-03-16,Stocks That Hit 52-Week Lows On Monday,ABT,-0.09785663137598377,-0.21608459946825065,0.09245371740203412,-0.042899147803851956,-0.034495595907913734,0.050116980321908366,-0.05774403245994775,0.07914749938716859,-0.07267966209110721
477,2020-03-17,"The Daily Biotech Pulse: Setback For DBV In Peanut Allergy Patch Review, Roche Starts Coronavirus Test Shipment, Regeneron Aims For 'Cocktail' COVID-19 Treatment",ABT,0.07914749938716859,-0.07267966209110721,-0.09785663137598377,0.09245371740203412,-0.042899147803851956,-0.034495595907913734,0.050116980321908366,-0.0028933928323482405,0.3173642351280106
478,2020-03-23,Stocks That Hit 52-Week Lows On Monday,ABT,-0.07617663665221008,-0.13840754986319836,-0.08724819741011491,-0.06005559809658967,-0.0028933928323482405,0.07914749938716859,-0.09785663137598377,0.10936014704887453,-0.16364068696259138
479,2020-03-24,"The Daily Biotech Pulse: Milestone Pharma Flunks Late-Stage Study, CytomX Strikes Cancer Drug Collaboration, BARDA Grant For GenMark's COVID-19 Test",ABT,0.10936014704887453,-0.16364068696259138,-0.07617663665221008,-0.08724819741011491,-0.06005559809658967,-0.0028933928323482405,0.07914749938716859,0.015210113691399352,-0.14240120326127825
480,2020-03-31,The Prize No One Wanted: Dow On Pace For Steepest Q1 Loss Ever As Quarter Finally Ends,ABT,-0.005419530667816974,-0.49953302678575184,0.06410945216700825,-0.01648861547869218,0.07151949340717079,0.015210113691399352,0.10936014704887453,-0.029654042426470184,-0.4868802091432942
481,2020-04-03,Quicken Loans Joins The Fight Against COVID-19 As Michigan Takes Center Stage,ABT,0.0001256379248000261,-0.10115166356868188,0.03748205375589353,-0.029654042426470184,-0.005419530667816974,0.06410945216700825,-0.01648861547869218,0.04128384821621589,0.35389631704488256
482,2020-04-08,Materials Stocks See More Interest Amid Hopes for Federal Infrastructure Spending,ABT,0.03686052910329951,-0.14768995870163082,-0.009669805798961817,0.04128384821621589,0.0001256379248000261,0.03748205375589353,-0.029654042426470184,0.012831159365398026,0.12954329620996297
483,2020-04-13,"Financials, Healthcare In Eye Of Earnings Hurricane Ahead, With Bank CEOs In Spotlight",ABT,-0.0022083805156838388,-0.36314824014980696,0.012831159365398026,0.03686052910329951,-0.009669805798961817,0.04128384821621589,0.0001256379248000261,0.04269519389824139,0.47938732035164566
484,2020-04-15,Every Member Of Trump's 'Great American Economic Revival' Industry Groups,ABT,0.02019290288413722,0.4326711488343322,0.04269519389824139,-0.0022083805156838388,0.012831159365398026,0.03686052910329951,-0.009669805798961817,0.05564119180180094,0.9136820498301246
485,2020-04-16,"Next 45 Days Will Be 'Most Critical Period' For US, Says Alan Lancz Who Predicted 1987 and 2008 Crises",ABT,0.05564119180180094,0.9136820498301246,0.02019290288413722,0.04269519389824139,-0.0022083805156838388,0.012831159365398026,0.03686052910329951,0.00010427662862699805,-0.4054407930020528
486,2020-04-16,Gilead's Encouraging Remdesivir Data: Rapid Reaction On The Stock,ABT,0.05564119180180094,0.9136820498301246,0.02019290288413722,0.04269519389824139,-0.0022083805156838388,0.012831159365398026,0.03686052910329951,0.00010427662862699805,-0.4054407930020528
487,2020-04-17,"Big Earnings Day As Honeywell, Procter & Gamble, Schlumberger Among Those Reporting",ABT,0.00010427662862699805,-0.4054407930020528,0.05564119180180094,0.02019290288413722,0.04269519389824139,-0.0022083805156838388,0.012831159365398026,0.020726720698354795,0.07319531191678896
488,2020-04-27,"Apple And Amazon Earnings, Fed Meeting Among Highlights In Busy Week Ahead",ABT,0.009462037584285099,-0.24155677066580894,0.0012772325034036136,-0.016128948783102004,0.015204543168379159,-0.04030598045611933,0.020726720698354795,-0.03675604947511324,0.14145535374806228
489,2020-07-06,Investor Movement Index Summary: June 2020,ABT,0.008023420929647251,0.5393077263152419,0.006438249390364081,0.0022969977063147518,0.02718773423788079,0.0033818720302714045,-0.010154030423316418,-0.005485773423755336,-0.42741295129327095
490,2020-07-14,"The Daily Biotech Pulse: Blueprint, Roche Ink $1.7B Cancer Drug Collaboration, INmune's Positive Alzheimer's Readout, Edwards, Abbott Settle Patent Lawsuits",ABT,0.022538622968100386,-0.040606892700067454,0.0005374566785845136,-0.006725693324414972,0.011773548819433932,0.0012978495832329795,-0.005485773423755336,0.020143482983657757,0.5050451149704085
491,2020-07-15,"Q2 Health Sector Earnings: As Industry Focuses On Pandemic, Will Vital Procedures Make A Comeback?",ABT,0.020143482983657757,0.5050451149704085,0.022538622968100386,0.0005374566785845136,-0.006725693324414972,0.011773548819433932,0.0012978495832329795,-0.00341171935076956,0.2219500402900887
492,2020-07-16,"The Daily Biotech Pulse: Mallinckrodt Gets FDA Panel Backing, Regulatory Setback For Tricida, Relay Therapeutics IPO",ABT,-0.00341171935076956,0.2219500402900887,0.020143482983657757,0.022538622968100386,0.0005374566785845136,-0.006725693324414972,0.011773548819433932,0.02956425888068437,0.09671335496293954
493,2020-07-16,"Earnings Scheduled For July 16, 2020",ABT,-0.00341171935076956,0.2219500402900887,0.020143482983657757,0.022538622968100386,0.0005374566785845136,-0.006725693324414972,0.011773548819433932,0.02956425888068437,0.09671335496293954
494,2020-07-23,Stocks That Hit 52-Week Highs On Thursday,ABT,0.006288019354335095,0.26679536679536686,0.020368650508276298,-0.008982669777667263,-0.0017126635349695718,0.02956425888068437,-0.00341171935076956,-0.018547894414141397,-0.23221240136814658
495,2020-08-24,Stocks That Hit 52-Week Highs On Monday,ABT,-0.009863266901875556,-0.10384937238493719,0.007576654775713454,0.011444998748016744,-0.004754340838693194,0.002482244231957198,0.007200772672889766,0.010651858836677297,-0.18249447505213678
496,2020-08-27,Stocks That Hit 52-Week Highs On Thursday,ABT,0.07849585824211092,11.233562382107248,0.00702649836273328,0.010651858836677297,-0.009863266901875556,0.007576654775713454,0.011444998748016744,-0.004492815760881563,-0.5263085437374377
497,2020-08-28,Stocks That Hit 52-Week Highs On Friday,ABT,-0.004492815760881563,-0.5263085437374377,0.07849585824211092,0.00702649836273328,0.010651858836677297,-0.009863266901875556,0.007576654775713454,-0.011914354296302165,-0.5964194373401535
