,date,title,stock,close,volume,1_past_close,2_past_close,3_past_close,4_past_close,5_past_close,next_close,next_volume
87,2022-08-10,"Microsoft Continues To Focus On Cost Cutting To Beat Inflation, Slowdown: Report",META,0.058209206845368344,0.622189106464184,-0.010102797184746715,0.018790014829632717,-0.020284965499769325,0.010485807111734635,0.05374867644128356,-0.004766125727153958,-0.204314968227585
88,2022-08-11,Gene Munster's Q2 Earnings Review With Benzinga Is Friday: What Are His Favorite Tech Stocks For 2023?,META,-0.004766125727153958,-0.204314968227585,0.058209206845368344,-0.010102797184746715,0.018790014829632717,-0.020284965499769325,0.010485807111734635,0.016958670424695343,-0.11649521784452077
89,2022-08-11,Samsung Unveils Premium Foldable Smartphones,META,-0.004766125727153958,-0.204314968227585,0.058209206845368344,-0.010102797184746715,0.018790014829632717,-0.020284965499769325,0.010485807111734635,0.016958670424695343,-0.11649521784452077
90,2022-08-11,US Department Of Justice Braces To Prosecute Google By September: Report,META,-0.004766125727153958,-0.204314968227585,0.058209206845368344,-0.010102797184746715,0.018790014829632717,-0.020284965499769325,0.010485807111734635,0.016958670424695343,-0.11649521784452077
91,2022-08-11,"Benzinga Before The Bell: iPhone 14 Might Be Costlier, Coinbase Face Another SEC Probe, Binance Sees Crypto User Growth And Other Top Financial Stories Thursday, August 11",META,-0.004766125727153958,-0.204314968227585,0.058209206845368344,-0.010102797184746715,0.018790014829632717,-0.020284965499769325,0.010485807111734635,0.016958670424695343,-0.11649521784452077
92,2022-08-12,Have Tech Stocks Bottomed? World's Largest Hedge Fund's Holdings Suggest Yes,META,0.016958670424695343,-0.11649521784452077,-0.004766125727153958,0.058209206845368344,-0.010102797184746715,0.018790014829632717,-0.020284965499769325,0.0021606614384954703,-0.25361004042493185
93,2022-08-15,"Elon Musk's Chest-Thumping, Shiba Inu Rallies, Google Issues Ultimatum To Workforce: 5 Key Stories You May Have Missed From The Weekend",META,0.0021606614384954703,-0.25361004042493185,0.016958670424695343,-0.004766125727153958,0.058209206845368344,-0.010102797184746715,0.018790014829632717,-0.007850064535002588,0.3323949693614716
94,2022-08-17,"Benzinga Before The Bell: More Amazon Workers Join Union Over Pay and Work Conditions, UK Inflation Highest In 40 Years, Sole  Monkeypox Vaccine Maker Finds It Difficult To Meet Accelerating Demand And Other Top Financial Stories Wednesday, August 17",META,-0.02574243653960895,-0.04909083174597173,-0.007850064535002588,0.0021606614384954703,0.016958670424695343,-0.004766125727153958,0.058209206845368344,-0.0010866596212399937,-0.06330617702466934
95,2022-08-17,Michael Burry Puts His Money Where His Mouth Is For Market Crash Prediction: But Did He Sell Too Soon?,META,-0.02574243653960895,-0.04909083174597173,-0.007850064535002588,0.0021606614384954703,0.016958670424695343,-0.004766125727153958,0.058209206845368344,-0.0010866596212399937,-0.06330617702466934
96,2022-08-18,"Facebook, Twitter, Google Ordered By Vietnam To Store User Data Onshore And Set Up Physical Offices",META,-0.0010866596212399937,-0.06330617702466934,-0.02574243653960895,-0.007850064535002588,0.0021606614384954703,0.016958670424695343,-0.004766125727153958,-0.0383602244804927,0.3924911777972353
97,2022-08-18,"Former Meta Employee And Mark Zuckerberg's Sister Emphasizes On Evolution Of Web3, Metaverse For Higher Adoption",META,-0.0010866596212399937,-0.06330617702466934,-0.02574243653960895,-0.007850064535002588,0.0021606614384954703,0.016958670424695343,-0.004766125727153958,-0.0383602244804927,0.3924911777972353
98,2022-08-18,"Benzinga Before The Bell: Tesla Model Y Delivery Wait Time Shortened In China, Mark Zuckerberg's Sister Emphasizes On Evolution Of Web3, Amazon Succumbs To TikTok Fever And Other Top Financial Stories Thursday, August 18",META,-0.0010866596212399937,-0.06330617702466934,-0.02574243653960895,-0.007850064535002588,0.0021606614384954703,0.016958670424695343,-0.004766125727153958,-0.0383602244804927,0.3924911777972353
99,2022-08-19,"Benzinga Before The Bell: Tesla's Autopilot Attracts Regulatory Ire Again, Roblox Poaches Meta Official, Snap Cancels Drone Project And Other Top Financial Stories Friday, August 19",META,-0.0383602244804927,0.3924911777972353,-0.0010866596212399937,-0.02574243653960895,-0.007850064535002588,0.0021606614384954703,0.016958670424695343,-0.029233171385102064,-0.25689384469985677
100,2022-08-19,"DoorDash Reportedly Terminates Long-Term Collaboration With Walmart, Shares Fall",META,-0.0383602244804927,0.3924911777972353,-0.0010866596212399937,-0.02574243653960895,-0.007850064535002588,0.0021606614384954703,0.016958670424695343,-0.029233171385102064,-0.25689384469985677
101,2022-08-19,Snap Bows To Economic Slowdown; Aborts Plum Drone Project,META,-0.0383602244804927,0.3924911777972353,-0.0010866596212399937,-0.02574243653960895,-0.007850064535002588,0.0021606614384954703,0.016958670424695343,-0.029233171385102064,-0.25689384469985677
102,2022-08-19,"Roblox Poaches Meta Official To Boost Presence In Asia, Remains Bullish On China",META,-0.0383602244804927,0.3924911777972353,-0.0010866596212399937,-0.02574243653960895,-0.007850064535002588,0.0021606614384954703,0.016958670424695343,-0.029233171385102064,-0.25689384469985677
103,2022-08-19,"Meta Platforms Price Target Cut By This Analyst, Plus BMO Capital Predicts $223 For Salesforce",META,-0.0383602244804927,0.3924911777972353,-0.0010866596212399937,-0.02574243653960895,-0.007850064535002588,0.0021606614384954703,0.016958670424695343,-0.029233171385102064,-0.25689384469985677
104,2022-08-22,Apple Employees Resist Calls For Return-To-Office,META,-0.029233171385102064,-0.25689384469985677,-0.0383602244804927,-0.0010866596212399937,-0.02574243653960895,-0.007850064535002588,0.0021606614384954703,-0.01189820548970133,-0.07117545398134328
105,2022-08-23,"Benzinga Before The Bell: Tesla Loses Challenge Against Racial Bias Accusation, Monkey Pox Vaccines May Not Be Enough, Apple To Manufacture iPhone 14 In India Soon After Release And Other Top Financial Stories Tuesday, August 23",META,-0.01189820548970133,-0.07117545398134328,-0.029233171385102064,-0.0383602244804927,-0.0010866596212399937,-0.02574243653960895,-0.007850064535002588,0.013344881685428023,0.1534745304166345
106,2022-08-23,Sony's New Virtual Reality Headset Gets A Debut Update: What Investors Should Know,META,-0.01189820548970133,-0.07117545398134328,-0.029233171385102064,-0.0383602244804927,-0.0010866596212399937,-0.02574243653960895,-0.007850064535002588,0.013344881685428023,0.1534745304166345
107,2022-08-24,Trump SPAC Merger Deal Includes Provisions For 'Material Disruptive Events' Like A Presidential Run And Prison Time,META,0.013344881685428023,0.1534745304166345,-0.01189820548970133,-0.029233171385102064,-0.0383602244804927,-0.0010866596212399937,-0.02574243653960895,0.03381112616802029,-0.2556542134360864
108,2022-08-24,Top Amazon Seller Succumbs To Economic Meltdown,META,0.013344881685428023,0.1534745304166345,-0.01189820548970133,-0.029233171385102064,-0.0383602244804927,-0.0010866596212399937,-0.02574243653960895,0.03381112616802029,-0.2556542134360864
109,2022-08-24,"Benzinga Before The Bell: Top Amazon Seller Succumbs To Economic Meltdown, Twitter To Tackle Toxic Content, Spam Bots, Bed Bath & Beyond Secures Loan Deal As It Tries To Stay Afloat And Other Top Financial Stories Wednesday, August 24",META,0.013344881685428023,0.1534745304166345,-0.01189820548970133,-0.029233171385102064,-0.0383602244804927,-0.0010866596212399937,-0.02574243653960895,0.03381112616802029,-0.2556542134360864
110,2022-08-24,"Snap, Meta Have More Downside As Competition, Budget Constraints Weigh, Analysts Say",META,0.013344881685428023,0.1534745304166345,-0.01189820548970133,-0.029233171385102064,-0.0383602244804927,-0.0010866596212399937,-0.02574243653960895,0.03381112616802029,-0.2556542134360864
111,2022-08-25,"Benzinga Before The Bell: Twitter Whistleblower Peiter Zatko To Depose Before Senate Panel, GameStop To Boost Employee Compensation To Drive Growth, California Proposes Total Ban On New Gasoline Car Sales By 2035 And Other Top Financial Stories Thursday, August 25",META,0.03381112616802029,-0.2556542134360864,0.013344881685428023,-0.01189820548970133,-0.029233171385102064,-0.0383602244804927,-0.0010866596212399937,-0.041474108606633364,0.5448763705347095
112,2022-08-25,"Apple Hypes 'Far Out' Event For September, But This Analyst Says There's A 'Bigger Story'",META,0.03381112616802029,-0.2556542134360864,0.013344881685428023,-0.01189820548970133,-0.029233171385102064,-0.0383602244804927,-0.0010866596212399937,-0.041474108606633364,0.5448763705347095
113,2022-08-29,Apple Said To Be Zeroing In On This Word For AR/VR Products,META,-0.01613302404527872,-0.16529162989726764,-0.041474108606633364,0.03381112616802029,0.013344881685428023,-0.01189820548970133,-0.029233171385102064,-0.012627973424379269,-0.024176295461459052
114,2022-08-29,"Fear & Greed Index Moves To 'Fear' Zone As Dow Dips Over 1,000 Points Following Powell's Speech",META,-0.01613302404527872,-0.16529162989726764,-0.041474108606633364,0.03381112616802029,0.013344881685428023,-0.01189820548970133,-0.029233171385102064,-0.012627973424379269,-0.024176295461459052
115,2022-08-29,Qualcomm Earns Legal Reprieve From EU Regulators Over Antitrust Ruling With An Apple Link,META,-0.01613302404527872,-0.16529162989726764,-0.041474108606633364,0.03381112616802029,0.013344881685428023,-0.01189820548970133,-0.029233171385102064,-0.012627973424379269,-0.024176295461459052
116,2022-08-29,Meta Loses Key Metaverse Official Shortly After Criticism Over Chief Mark Zuckerberg's Avatar,META,-0.01613302404527872,-0.16529162989726764,-0.041474108606633364,0.03381112616802029,0.013344881685428023,-0.01189820548970133,-0.029233171385102064,-0.012627973424379269,-0.024176295461459052
117,2022-08-29,"Benzinga Before The Bell: Meta Loses Key Metaverse Official, US Government To Cancel Free At-Home COVID Tests, Singapore Mulls Rules To Regulate Cryptocurrency Trading And Other Top Financial Stories Monday, August 29",META,-0.01613302404527872,-0.16529162989726764,-0.041474108606633364,0.03381112616802029,0.013344881685428023,-0.01189820548970133,-0.029233171385102064,-0.012627973424379269,-0.024176295461459052
118,2022-08-30,Facebook Aborts Game Streaming App After Losing To Amazon's Twitch,META,-0.012627973424379269,-0.024176295461459052,-0.01613302404527872,-0.041474108606633364,0.03381112616802029,0.013344881685428023,-0.01189820548970133,0.036714105874400715,1.092866378098825
119,2022-08-30,Google Rejects Donald Trump: Why Truth Social Is Not Approved For Google Play Store,META,-0.012627973424379269,-0.024176295461459052,-0.01613302404527872,-0.041474108606633364,0.03381112616802029,0.013344881685428023,-0.01189820548970133,0.036714105874400715,1.092866378098825
120,2022-08-30,"Australia Compels Apple, Meta, Snapchat To Explain How They Are Tackling Child Abuse Content",META,-0.012627973424379269,-0.024176295461459052,-0.01613302404527872,-0.041474108606633364,0.03381112616802029,0.013344881685428023,-0.01189820548970133,0.036714105874400715,1.092866378098825
121,2022-08-31,"Netflix Poaches Two Key Officials From Snap As They Downsize Workforce Over Recession, Apple Privacy Concerns",META,0.036714105874400715,1.092866378098825,-0.012627973424379269,-0.01613302404527872,-0.041474108606633364,0.03381112616802029,0.013344881685428023,0.014914429778474458,-0.2638951969330696
122,2022-08-31,"Amazon Battles Regulatory Headwinds As It Strives To Expand In India, This Analyst Says",META,0.036714105874400715,1.092866378098825,-0.012627973424379269,-0.01613302404527872,-0.041474108606633364,0.03381112616802029,0.013344881685428023,0.014914429778474458,-0.2638951969330696
123,2022-09-01,T-Mobile Joins Bevy Of Companies Opting For Downsizing Employee Workforce,META,0.014914429778474458,-0.2638951969330696,0.036714105874400715,-0.012627973424379269,-0.01613302404527872,-0.041474108606633364,0.03381112616802029,-0.03047891429323879,-0.24917318224489726
124,2022-09-02,US Stock Futures Mostly Flat; All Eyes On Jobs Report,META,-0.03047891429323879,-0.24917318224489726,0.014914429778474458,0.036714105874400715,-0.012627973424379269,-0.01613302404527872,-0.041474108606633364,-0.011102881466853787,-0.14554965494693872
125,2022-09-06,"Facebook, Google's Ad Duopoly Nearing Its Demise. From A Former Ally",META,-0.011102881466853787,-0.14554965494693872,-0.03047891429323879,0.014914429778474458,0.036714105874400715,-0.012627973424379269,-0.01613302404527872,0.011669018429796063,-0.1297117860577669
126,2022-09-06,US Stocks Record Third Consecutive Weekly Loss But Market Volatility Decreases,META,-0.011102881466853787,-0.14554965494693872,-0.03047891429323879,0.014914429778474458,0.036714105874400715,-0.012627973424379269,-0.01613302404527872,0.011669018429796063,-0.1297117860577669
127,2022-09-06,Apple's Rivals Bled After It Unleashed Privacy Moves — Now The iPhone Maker Reportedly Plans To Double Its Advertising Staff,META,-0.011102881466853787,-0.14554965494693872,-0.03047891429323879,0.014914429778474458,0.036714105874400715,-0.012627973424379269,-0.01613302404527872,0.011669018429796063,-0.1297117860577669
128,2022-09-06,"Fear Among US Investors Is Increasing,  Here's Why",META,-0.011102881466853787,-0.14554965494693872,-0.03047891429323879,0.014914429778474458,0.036714105874400715,-0.012627973424379269,-0.01613302404527872,0.011669018429796063,-0.1297117860577669
129,2022-09-06,"Top Financial Stories Tuesday, September 6: Focus on iPhone 14 Event, OPEC+ Plans Mild Production Cut, Netflix Says No To Crypto Ads And More…",META,-0.011102881466853787,-0.14554965494693872,-0.03047891429323879,0.014914429778474458,0.036714105874400715,-0.012627973424379269,-0.01613302404527872,0.011669018429796063,-0.1297117860577669
130,2022-09-06,Elon Musk Hailed App Signal Ropes In Another Big Tech Critic,META,-0.011102881466853787,-0.14554965494693872,-0.03047891429323879,0.014914429778474458,0.036714105874400715,-0.012627973424379269,-0.01613302404527872,0.011669018429796063,-0.1297117860577669
131,2022-09-07,Senator Attacks Big Tech Lobbying For Delaying Antitrust Bill,META,0.011669018429796063,-0.1297117860577669,-0.011102881466853787,-0.03047891429323879,0.014914429778474458,0.036714105874400715,-0.012627973424379269,0.010412109079745324,0.33863301487713304
132,2022-09-08,"Steve Jobs Would Not Be On Twitter, Says Apple Co-Founder's Wife",META,0.010412109079745324,0.33863301487713304,0.011669018429796063,-0.011102881466853787,-0.03047891429323879,0.014914429778474458,0.036714105874400715,0.04374920674256577,-0.019706357519484463
133,2022-09-08,'We Have Not Hit Bottom Yet:' Michael Burry Calls Out Recent Market Crashes — What Could Be Next?,META,0.010412109079745324,0.33863301487713304,0.011669018429796063,-0.011102881466853787,-0.03047891429323879,0.014914429778474458,0.036714105874400715,0.04374920674256577,-0.019706357519484463
134,2022-09-08,Amazon Looks To Pull Brakes On Hiring To Trim Pandemic Induced Fluff,META,0.010412109079745324,0.33863301487713304,0.011669018429796063,-0.011102881466853787,-0.03047891429323879,0.014914429778474458,0.036714105874400715,0.04374920674256577,-0.019706357519484463
135,2022-09-09,Google Under DOJ Scanner For Splurging To Maintain Search-Engine Dominance,META,0.04374920674256577,-0.019706357519484463,0.010412109079745324,0.011669018429796063,-0.011102881466853787,-0.03047891429323879,0.014914429778474458,-0.0011231876409848462,0.0513247731676838
136,2022-09-12,"Elon Musk Calls Instagram 'Envy Amplifier,' Janet Yellen Warns On Gas Price Spike, Disney's Bob Chapek Wants To Keep ESPN And More: 5 Key Stories You May Have Missed From The Weekend",META,-0.0011231876409848462,0.0513247731676838,0.04374920674256577,0.010412109079745324,0.011669018429796063,-0.011102881466853787,-0.03047891429323879,-0.09369082150820873,0.9140109558836196
137,2022-09-12,"Internal Documents Show Instagram Is Not Even Close To TikTok, Lags In Engagement: WSJ",META,-0.0011231876409848462,0.0513247731676838,0.04374920674256577,0.010412109079745324,0.011669018429796063,-0.011102881466853787,-0.03047891429323879,-0.09369082150820873,0.9140109558836196
138,2022-09-12,"Netflix Goes Aggressive In Gaming Stance, Collaborates To Piggybank On Popular Franchises",META,-0.0011231876409848462,0.0513247731676838,0.04374920674256577,0.010412109079745324,0.011669018429796063,-0.011102881466853787,-0.03047891429323879,-0.09369082150820873,0.9140109558836196
139,2022-09-13,"Going To A Starbucks Is Hard. Luckily, DoorDash Is Going Nationwide With Coffee Delivery",META,-0.09369082150820873,0.9140109558836196,-0.0011231876409848462,0.04374920674256577,0.010412109079745324,0.011669018429796063,-0.011102881466853787,-0.010840485921617682,-0.031047990621927313
140,2022-09-13,"Snap, TikTok and Others Protest As Meta Seeks Sensitive Information To Battle FTC Lawsuit",META,-0.09369082150820873,0.9140109558836196,-0.0011231876409848462,0.04374920674256577,0.010412109079745324,0.011669018429796063,-0.011102881466853787,-0.010840485921617682,-0.031047990621927313
141,2022-09-13,"TikTok and Facebook Are Tracking User Data Via In-App Browsers, A Study Shows How They Do It",META,-0.09369082150820873,0.9140109558836196,-0.0011231876409848462,0.04374920674256577,0.010412109079745324,0.011669018429796063,-0.011102881466853787,-0.010840485921617682,-0.031047990621927313
142,2022-09-14,Mark Zuckerberg's Metaverse Strategies Draw Concerns From VR Developers,META,-0.010840485921617682,-0.031047990621927313,-0.09369082150820873,-0.0011231876409848462,0.04374920674256577,0.010412109079745324,0.011669018429796063,-0.012675765190941823,-0.1964021159106636
143,2022-09-14,"Twilio Joins Other Tech Firms, To Axe 11% Of Its Workforce, Reaffirms Q3 Outlook",META,-0.010840485921617682,-0.031047990621927313,-0.09369082150820873,-0.0011231876409848462,0.04374920674256577,0.010412109079745324,0.011669018429796063,-0.012675765190941823,-0.1964021159106636
144,2022-09-14,"Top Financial Stories Wednesday, September 14: Multiple Antitrust Setbacks For Google, Bitcoin Crashes, Visa Finds New Gun Control System Ineffective And More…",META,-0.010840485921617682,-0.031047990621927313,-0.09369082150820873,-0.0011231876409848462,0.04374920674256577,0.010412109079745324,0.011669018429796063,-0.012675765190941823,-0.1964021159106636
145,2022-09-14,Tuesday's Market Bloodbath Hit The Top 10 Richest People Where It Hurts: Here's Who And How Much,META,-0.010840485921617682,-0.031047990621927313,-0.09369082150820873,-0.0011231876409848462,0.04374920674256577,0.010412109079745324,0.011669018429796063,-0.012675765190941823,-0.1964021159106636
146,2022-09-14,These 5 Experts See A Market Crash Ahead: What Do BZ Readers Think?,META,-0.010840485921617682,-0.031047990621927313,-0.09369082150820873,-0.0011231876409848462,0.04374920674256577,0.010412109079745324,0.011669018429796063,-0.012675765190941823,-0.1964021159106636
147,2022-09-14,Google Suffers Another EU Setback As Top Court Rejects Request To Topple $4.3B Dominance-Abuse Fine,META,-0.010840485921617682,-0.031047990621927313,-0.09369082150820873,-0.0011231876409848462,0.04374920674256577,0.010412109079745324,0.011669018429796063,-0.012675765190941823,-0.1964021159106636
148,2022-09-14,"Tesla, Meta, NVIDIA And Other Big Losers From Tuesday",META,-0.010840485921617682,-0.031047990621927313,-0.09369082150820873,-0.0011231876409848462,0.04374920674256577,0.010412109079745324,0.011669018429796063,-0.012675765190941823,-0.1964021159106636
149,2022-09-19,Some iPhone 14 Users Are Getting This 'Shaking' Glitch While Using TikTok Or Snapchat,META,0.011825901057664012,-0.44745880147945805,-0.021798794377133834,-0.012675765190941823,-0.010840485921617682,-0.09369082150820873,-0.0011231876409848462,-0.013038831771803872,0.04726764248178794
150,2022-09-19,Will TikTok Get Banned In The US? Over 60% Of Benzinga's Twitter Followers Say This,META,0.011825901057664012,-0.44745880147945805,-0.021798794377133834,-0.012675765190941823,-0.010840485921617682,-0.09369082150820873,-0.0011231876409848462,-0.013038831771803872,0.04726764248178794
151,2022-09-19,"Top Financial Media Stories Monday, September 19: Apple iPhone 14's Glitch With Some Third Party Apps, Tesla Wants To Double Sales In Germany, Ford Working On Smartphone Based Crash Detection Tech And More..",META,0.011825901057664012,-0.44745880147945805,-0.021798794377133834,-0.012675765190941823,-0.010840485921617682,-0.09369082150820873,-0.0011231876409848462,-0.013038831771803872,0.04726764248178794
152,2022-09-20,"Top Financial Media Stories Tuesday, September 20: Apple Feels The Forex Pinch, Pepsi Ends Russian Production, Beyond Meat's COO Arrested And More..",META,-0.013038831771803872,0.04726764248178794,0.011825901057664012,-0.021798794377133834,-0.012675765190941823,-0.010840485921617682,-0.09369082150820873,-0.02717503812869526,0.6512873965215744
153,2022-09-20,US Imposes Record Fine On Morgan Stanley For Sensitive Data Breach,META,-0.013038831771803872,0.04726764248178794,0.011825901057664012,-0.021798794377133834,-0.012675765190941823,-0.010840485921617682,-0.09369082150820873,-0.02717503812869526,0.6512873965215744
154,2022-09-20,TikTok's Answer To BeReal Launches In Multiple Countries After US Debut,META,-0.013038831771803872,0.04726764248178794,0.011825901057664012,-0.021798794377133834,-0.012675765190941823,-0.010840485921617682,-0.09369082150820873,-0.02717503812869526,0.6512873965215744
155,2022-09-20,US Fed Policy Meeting Among Biggest Macro Catalysts Today,META,-0.013038831771803872,0.04726764248178794,0.011825901057664012,-0.021798794377133834,-0.012675765190941823,-0.010840485921617682,-0.09369082150820873,-0.02717503812869526,0.6512873965215744
156,2022-09-20,Volatility In Markets Declines Ahead Of Fed's Policy Meeting,META,-0.013038831771803872,0.04726764248178794,0.011825901057664012,-0.021798794377133834,-0.012675765190941823,-0.010840485921617682,-0.09369082150820873,-0.02717503812869526,0.6512873965215744
157,2022-09-20,"Apple Faces Back-To-Back iPhone 14 Glitches, Looks To Resolve Pro Camera Issue By Next Week",META,-0.013038831771803872,0.04726764248178794,0.011825901057664012,-0.021798794377133834,-0.012675765190941823,-0.010840485921617682,-0.09369082150820873,-0.02717503812869526,0.6512873965215744
158,2022-09-21,"Twitter, Microsoft To Invest Toward Christchurch Call Anti-Online Hate Project, Says New Zealand PM",META,-0.02717503812869526,0.6512873965215744,-0.013038831771803872,0.011825901057664012,-0.021798794377133834,-0.012675765190941823,-0.010840485921617682,0.004925501203782323,-0.10224943007830234
159,2022-09-22,"Microsoft, Google, Meta Have All Dropped Below June Lows But These 2 Big Tech Stocks Are Holding Up",META,0.004925501203782323,-0.10224943007830234,-0.02717503812869526,-0.013038831771803872,0.011825901057664012,-0.021798794377133834,-0.012675765190941823,-0.016874412116772763,-0.07867280677542599
160,2022-09-22,Salesforce Chases Higher Margins Via Cost Cuts By FY26; CFO Shares New Guidance During Investor Day,META,0.004925501203782323,-0.10224943007830234,-0.02717503812869526,-0.013038831771803872,0.011825901057664012,-0.021798794377133834,-0.012675765190941823,-0.016874412116772763,-0.07867280677542599
161,2022-09-22,"Top Financial Media Stories Thursday, September 22: Facebook Sued For Bypassing Apple Privacy Rules, Walmart Slows Hiring Plans Ahead Of Holiday Season, China Blames US For Northwestern Polytechnical University Hack And More..",META,0.004925501203782323,-0.10224943007830234,-0.02717503812869526,-0.013038831771803872,0.011825901057664012,-0.021798794377133834,-0.012675765190941823,-0.016874412116772763,-0.07867280677542599
162,2022-09-22,Competition Intensifies For India's Digital Payments Market: Amazon India Poaches WhatsApp Pay India Head,META,0.004925501203782323,-0.10224943007830234,-0.02717503812869526,-0.013038831771803872,0.011825901057664012,-0.021798794377133834,-0.012675765190941823,-0.016874412116772763,-0.07867280677542599
163,2022-09-22,Investor Fear Increases After Fed Rate Hike,META,0.004925501203782323,-0.10224943007830234,-0.02717503812869526,-0.013038831771803872,0.011825901057664012,-0.021798794377133834,-0.012675765190941823,-0.016874412116772763,-0.07867280677542599
164,2022-09-22,Facebook Parent Sued Over 'Secret Work-Around' To Bypass Apple's Privacy Rules And Spy On Users,META,0.004925501203782323,-0.10224943007830234,-0.02717503812869526,-0.013038831771803872,0.011825901057664012,-0.021798794377133834,-0.012675765190941823,-0.016874412116772763,-0.07867280677542599
165,2022-09-22,"US Weekly Jobless Claims Might Rise To This Level, Here Are The Major Macro Issues For Thursday",META,0.004925501203782323,-0.10224943007830234,-0.02717503812869526,-0.013038831771803872,0.011825901057664012,-0.021798794377133834,-0.012675765190941823,-0.016874412116772763,-0.07867280677542599
166,2022-09-22,"More Antitrust Pain For Amazon, Microsoft And Google: UK Regulator Promises Action",META,0.004925501203782323,-0.10224943007830234,-0.02717503812869526,-0.013038831771803872,0.011825901057664012,-0.021798794377133834,-0.012675765190941823,-0.016874412116772763,-0.07867280677542599
167,2022-09-23,"A Bill Is Underway To Compel Google, Facebook And Other Tech Platforms To Share Revenue With Media Organizations",META,-0.016874412116772763,-0.07867280677542599,0.004925501203782323,-0.02717503812869526,-0.013038831771803872,0.011825901057664012,-0.021798794377133834,-0.028772939531032105,-0.03827414721213973
168,2022-09-23,"Apple Resolves iPhone 14 Pro Camera Glitch, As Promised",META,-0.016874412116772763,-0.07867280677542599,0.004925501203782323,-0.02717503812869526,-0.013038831771803872,0.011825901057664012,-0.021798794377133834,-0.028772939531032105,-0.03827414721213973
