,date,title,stock,close,volume,1_past_close,2_past_close,3_past_close,4_past_close,5_past_close,next_close,next_volume
169,2022-09-23,"Top Financial Media Stories Friday, September 23: Apple Resolves iPhone 14 Pro Camera Glitch, Credit Suisse Shares Tumble As It Looks For Capital Infusion, Boeing Penalized $200M For Misleading About 737 MAX Safety And More..",META,-0.016874412116772763,-0.07867280677542599,0.004925501203782323,-0.02717503812869526,-0.013038831771803872,0.011825901057664012,-0.021798794377133834,-0.028772939531032105,-0.03827414721213973
170,2022-09-26,"iPhone 14 Popular In China?, Netflix May Lose Comics, Elon Musk's Starlink Slows, Byron Allen Faces $10B Lawsuit And More Top Financial Media Stories Monday, Sept. 26",META,-0.028772939531032105,-0.03827414721213973,-0.016874412116772763,0.004925501203782323,-0.02717503812869526,-0.013038831771803872,0.011825901057664012,-0.014446001989002255,0.01080434141063047
171,2022-09-26,Rihanna Is 'Da One' For Apple Music: Singer Confirmed To Headline 2023 Super Bowl Halftime Show,META,-0.028772939531032105,-0.03827414721213973,-0.016874412116772763,0.004925501203782323,-0.02717503812869526,-0.013038831771803872,0.011825901057664012,-0.014446001989002255,0.01080434141063047
172,2022-09-27,Android WhatsApp Users Can Exhale: A Major Bug That Exposed Data May Finally Be Fixed,META,-0.014446001989002255,0.01080434141063047,-0.028772939531032105,-0.016874412116772763,0.004925501203782323,-0.02717503812869526,-0.013038831771803872,0.05364588572392637,0.05942938705334688
173,2022-09-27,"Elon Musk Twitter Case Deposition Delayed, FTX US Goes Shopping, Spotify's Analyst Sees Audiobooks Immaterial: Top Financial Media Stories Tuesday, Sept. 27",META,-0.014446001989002255,0.01080434141063047,-0.028772939531032105,-0.016874412116772763,0.004925501203782323,-0.02717503812869526,-0.013038831771803872,0.05364588572392637,0.05942938705334688
174,2022-09-28,"Is iPhone Demand Really Slowing Down?, Lyft Freezes Hiring, Biogen's New Drug Slows Alzheimer's Progression: Top Financial Media Stories Wednesday, Sept. 28",META,0.05364588572392637,0.05942938705334688,-0.014446001989002255,-0.028772939531032105,-0.016874412116772763,0.004925501203782323,-0.02717503812869526,-0.03672054887246479,0.19372904450602446
175,2022-09-28,WhatsApp Boss Highlights Global Repercussions Of UK Online Safety Bill,META,0.05364588572392637,0.05942938705334688,-0.014446001989002255,-0.028772939531032105,-0.016874412116772763,0.004925501203782323,-0.02717503812869526,-0.03672054887246479,0.19372904450602446
176,2022-09-28,Apple Drops Russia's Largest Social Media Network From App Store,META,0.05364588572392637,0.05942938705334688,-0.014446001989002255,-0.028772939531032105,-0.016874412116772763,0.004925501203782323,-0.02717503812869526,-0.03672054887246479,0.19372904450602446
177,2022-09-29,"Vietnam Law May Impact Facebook, Twitter; Amazon Has A Sleep Tracker; India Lures Apple, Dell, HP: Top Financial Media Stories Thursday, Sept. 29",META,-0.03672054887246479,0.19372904450602446,0.05364588572392637,-0.014446001989002255,-0.028772939531032105,-0.016874412116772763,0.004925501203782323,-0.005351594213987232,-0.14926100540202225
178,2022-09-30,Mark Zuckerberg's Meta No Longer Among Top 10 Most-Valuable Companies: Who Overtook The Tech Giant?,META,-0.005351594213987232,-0.14926100540202225,-0.03672054887246479,0.05364588572392637,-0.014446001989002255,-0.028772939531032105,-0.016874412116772763,0.021594988891043165,-0.16412091755511604
179,2022-09-30,Google To Shut Down Gaming Service Stadia: Analyst Says Demise Also Casts Doubts On Amazon And Meta's Forays,META,-0.005351594213987232,-0.14926100540202225,-0.03672054887246479,0.05364588572392637,-0.014446001989002255,-0.028772939531032105,-0.016874412116772763,0.021594988891043165,-0.16412091755511604
180,2022-10-03,"Google Now Shuts Down Translate App In China, Moderna-China COVID-19 Sales Talk Collapse, Disney-Dish Temporary Accord Ends Weekend Blackout: Top Stories Monday, Oct. 03",META,0.021594988891043165,-0.16412091755511604,-0.005351594213987232,-0.03672054887246479,0.05364588572392637,-0.014446001989002255,-0.028772939531032105,0.012048179507911927,0.2506068946113529
181,2022-10-04,"Russia Fines TikTok, Amazon's Twitch, India Exported $1B iPhones, Sony Eyes Investment For PC & Mobile Push: Top Stories Tuesday, Oct. 04",META,0.012048179507911927,0.2506068946113529,0.021594988891043165,-0.005351594213987232,-0.03672054887246479,0.05364588572392637,-0.014446001989002255,-0.009267201761265387,-0.19299869918980583
182,2022-10-04,Meta Moves To Close One New York Office Amid Hiring Freeze,META,0.012048179507911927,0.2506068946113529,0.021594988891043165,-0.005351594213987232,-0.03672054887246479,0.05364588572392637,-0.014446001989002255,-0.009267201761265387,-0.19299869918980583
183,2022-10-04,Market Volatility Decreases As US Stocks Open Q4 On Positive Note,META,0.012048179507911927,0.2506068946113529,0.021594988891043165,-0.005351594213987232,-0.03672054887246479,0.05364588572392637,-0.014446001989002255,-0.009267201761265387,-0.19299869918980583
184,2022-10-04,This Analyst Sees $196 For Meta? Plus Wells Fargo Slashes PT On This Stock By 96%,META,0.012048179507911927,0.2506068946113529,0.021594988891043165,-0.005351594213987232,-0.03672054887246479,0.05364588572392637,-0.014446001989002255,-0.009267201761265387,-0.19299869918980583
185,2022-10-05,TTD Analyst Remains Bullish Citing Stronger Relative Revenue & FCF Growth Estimates,META,-0.009267201761265387,-0.19299869918980583,0.012048179507911927,0.021594988891043165,-0.005351594213987232,-0.03672054887246479,0.05364588572392637,0.0006476586519412741,0.29492517682715436
186,2022-10-05,"Dow Jumps Over 800 Points, Volatility In Markets Decreases",META,-0.009267201761265387,-0.19299869918980583,0.012048179507911927,0.021594988891043165,-0.005351594213987232,-0.03672054887246479,0.05364588572392637,0.0006476586519412741,0.29492517682715436
187,2022-10-06,"Apple Co-Founder Takes Swipe At Mark Zuckerberg's Meta Over Cost Cuts, Citing His Personal 'Sacrifice'",META,0.0006476586519412741,0.29492517682715436,-0.009267201761265387,0.012048179507911927,0.021594988891043165,-0.005351594213987232,-0.03672054887246479,-0.040411376141474054,-0.08325168156638907
188,2022-10-06,"Tesla To Feel Pressure After Musk's Twitter-Deal News; OPEC Output Cut Disappoints Biden; Shell Profits Low: Top Stories Thursday, Oct. 6",META,0.0006476586519412741,0.29492517682715436,-0.009267201761265387,0.012048179507911927,0.021594988891043165,-0.005351594213987232,-0.03672054887246479,-0.040411376141474054,-0.08325168156638907
189,2022-10-07,"AppLovin Analyst Fears Competition From Meta, Google, Apple",META,-0.040411376141474054,-0.08325168156638907,0.0006476586519412741,-0.009267201761265387,0.012048179507911927,0.021594988891043165,-0.005351594213987232,0.0025477433170904007,-0.2767079735539578
190,2022-10-11,Goldman Sachs To $470? Plus This Analyst Sees $174 For Meta Platforms,META,-0.03924060291095144,0.6017898767898768,0.0025477433170904007,-0.040411376141474054,0.0006476586519412741,-0.009267201761265387,0.012048179507911927,-0.008090814847156236,-0.10072918344966664
191,2022-10-11,"Apple, Google Give OG App The Boot: How An Instagram Ad Blocker Ticked Off Meta",META,-0.03924060291095144,0.6017898767898768,0.0025477433170904007,-0.040411376141474054,0.0006476586519412741,-0.009267201761265387,0.012048179507911927,-0.008090814847156236,-0.10072918344966664
192,2022-10-11,"Facebook Parent Unveils $1,500 VR Headset, To Partner With Microsoft On Office, Xbox Gaming For Quest Devices",META,-0.03924060291095144,0.6017898767898768,0.0025477433170904007,-0.040411376141474054,0.0006476586519412741,-0.009267201761265387,0.012048179507911927,-0.008090814847156236,-0.10072918344966664
193,2022-10-11,"BeReal-ity Check! Social Media App Is Dubbed A Threat To Instagram, TikTok But There Is More To The Story Than 50M Downloads",META,-0.03924060291095144,0.6017898767898768,0.0025477433170904007,-0.040411376141474054,0.0006476586519412741,-0.009267201761265387,0.012048179507911927,-0.008090814847156236,-0.10072918344966664
194,2022-10-11,Facebook Parent's 'Meta Connect 2022' Is Here: Why Munster Thinks It's A Big Deal,META,-0.03924060291095144,0.6017898767898768,0.0025477433170904007,-0.040411376141474054,0.0006476586519412741,-0.009267201761265387,0.012048179507911927,-0.008090814847156236,-0.10072918344966664
195,2022-10-12,"Analysts See Meta Connect Shows Progress With Partnerships, Admire Mark Zuckerberg's Vision",META,-0.008090814847156236,-0.10072918344966664,-0.03924060291095144,0.0025477433170904007,-0.040411376141474054,0.0006476586519412741,-0.009267201761265387,0.02188230028339455,-0.008076820824615916
196,2022-10-12,Meta Analyst Says Quest Pro Uptake Likely To Be Slow Due to These 2 Reasons,META,-0.008090814847156236,-0.10072918344966664,-0.03924060291095144,0.0025477433170904007,-0.040411376141474054,0.0006476586519412741,-0.009267201761265387,0.02188230028339455,-0.008076820824615916
197,2022-10-12,"US Stock Futures Higher; Producer Price Data, Fed Minutes In Focus",META,-0.008090814847156236,-0.10072918344966664,-0.03924060291095144,0.0025477433170904007,-0.040411376141474054,0.0006476586519412741,-0.009267201761265387,0.02188230028339455,-0.008076820824615916
198,2022-10-12,"Joe Biden Vows Consequences Against Saudi Arabia, Philips Warns Lower Sales & Profit, Intel Explores Substantial Job Cuts: Top Stories Wednesday, Oct. 12",META,-0.008090814847156236,-0.10072918344966664,-0.03924060291095144,0.0025477433170904007,-0.040411376141474054,0.0006476586519412741,-0.009267201761265387,0.02188230028339455,-0.008076820824615916
199,2022-10-13,"Facebook Parent Takes 'Step Forward' With Metaverse, Quest Pro Plans: Gene Munster",META,0.02188230028339455,-0.008076820824615916,-0.008090814847156236,-0.03924060291095144,0.0025477433170904007,-0.040411376141474054,0.0006476586519412741,-0.02709334048509815,-0.31365128751926397
200,2022-10-17,"iPhone 14 Devices Get 'Sim Not Supported' Pop-Up Alert, Apple Investigating Bug: Report",META,0.05743129557601656,0.25691655984447825,-0.02709334048509815,0.02188230028339455,-0.008090814847156236,-0.03924060291095144,0.0025477433170904007,-0.009250897467056873,-0.14072578194122698
201,2022-10-17,"Earnings Season Is Here: Tesla, Netflix, IBM, AT&T And More On Deck - But This Stock Could Be 'Most Important'",META,0.05743129557601656,0.25691655984447825,-0.02709334048509815,0.02188230028339455,-0.008090814847156236,-0.03924060291095144,0.0025477433170904007,-0.009250897467056873,-0.14072578194122698
202,2022-10-17,Apple XR Headset Could Come With Iris Scanner To Let You Make Payments With Your Eyes,META,0.05743129557601656,0.25691655984447825,-0.02709334048509815,0.02188230028339455,-0.008090814847156236,-0.03924060291095144,0.0025477433170904007,-0.009250897467056873,-0.14072578194122698
203,2022-10-18,Mark Zuckerberg Aims At Apple's iMessage 'Bubble' As He Talks Up WhatsApp's End-To-End Encryption,META,-0.009250897467056873,-0.14072578194122698,0.05743129557601656,-0.02709334048509815,0.02188230028339455,-0.008090814847156236,-0.03924060291095144,0.003237896580572164,0.2061701709569661
204,2022-10-18,More Job Losses At Microsoft As Global Slowdown Weighs,META,-0.009250897467056873,-0.14072578194122698,0.05743129557601656,-0.02709334048509815,0.02188230028339455,-0.008090814847156236,-0.03924060291095144,0.003237896580572164,0.2061701709569661
205,2022-10-18,"New Social Media App That Asks Teens To Say Nice Things To Each Other Tops iPhone Downloads — Beating WhatsApp, Facebook",META,-0.009250897467056873,-0.14072578194122698,0.05743129557601656,-0.02709334048509815,0.02188230028339455,-0.008090814847156236,-0.03924060291095144,0.003237896580572164,0.2061701709569661
206,2022-10-19,"SpaceX Starlink's New In-Flight Connectivity Service, Amazon's NY Workers Reject Union, Celsius Network Faces Several Federal Investigations: Top Stories Wednesday, Oct. 19",META,0.003237896580572164,0.2061701709569661,-0.009250897467056873,0.05743129557601656,-0.02709334048509815,0.02188230028339455,-0.008090814847156236,-0.012759866417159982,-0.1412368446775928
207,2022-10-20,"Snap Reports Q3 Results Today: What To Expect And Should Meta, Twitter, Google And Pinterest Shareholders Care?",META,-0.012759866417159982,-0.1412368446775928,0.003237896580572164,-0.009250897467056873,0.05743129557601656,-0.02709334048509815,0.02188230028339455,-0.011556331533245534,0.7585397039796937
208,2022-10-20,"Apple Reinstates VKontakte, The Russian Equivalent Of Facebook, On App Store",META,-0.012759866417159982,-0.1412368446775928,0.003237896580572164,-0.009250897467056873,0.05743129557601656,-0.02709334048509815,0.02188230028339455,-0.011556331533245534,0.7585397039796937
209,2022-10-20,"Apple Supplier Says Smartphone Market May Slump Into Next Year, Meta Loses Veteran Exec Behind Instagram and WhatsApp Acquisitions, Voyager Digital Seeks Creditors' Vote For Sale To FTX: Top Stories Thursday, Oct. 20",META,-0.012759866417159982,-0.1412368446775928,0.003237896580572164,-0.009250897467056873,0.05743129557601656,-0.02709334048509815,0.02188230028339455,-0.011556331533245534,0.7585397039796937
210,2022-10-20,Meta's New AI-Powered Translator Can Interpret A Spoken-Only Language In Real Time,META,-0.012759866417159982,-0.1412368446775928,0.003237896580572164,-0.009250897467056873,0.05743129557601656,-0.02709334048509815,0.02188230028339455,-0.011556331533245534,0.7585397039796937
211,2022-10-21,Google Faces Hefty Penalty Over User Privacy Violation In Texas From This Big Tech Critic,META,-0.011556331533245534,0.7585397039796937,-0.012759866417159982,0.003237896580572164,-0.009250897467056873,0.05743129557601656,-0.02709334048509815,-0.00223054609941975,0.3714200644679666
212,2022-10-21,"Twitter Rebuffs Elon Musk Layoff Plans Report, Toyota Cuts 2023's Production Target, Vaccine Makers Expect 3x Price Increase In COVID-19 Shot: Top Stories Friday, Oct. 21",META,-0.011556331533245534,0.7585397039796937,-0.012759866417159982,0.003237896580572164,-0.009250897467056873,0.05743129557601656,-0.02709334048509815,-0.00223054609941975,0.3714200644679666
213,2022-10-21,Munster Not Concerned About Meta And Google Despite Snap's Disappointing Q3: 'Long-Term Will Be Intact',META,-0.011556331533245534,0.7585397039796937,-0.012759866417159982,0.003237896580572164,-0.009250897467056873,0.05743129557601656,-0.02709334048509815,-0.00223054609941975,0.3714200644679666
214,2022-10-21,"US Stocks Headed For Another Tough Day Amid Mixed Earnings, Rate Worries — Tesla Extends Losses, Snap Drags Social Media Stocks Lower",META,-0.011556331533245534,0.7585397039796937,-0.012759866417159982,0.003237896580572164,-0.009250897467056873,0.05743129557601656,-0.02709334048509815,-0.00223054609941975,0.3714200644679666
215,2022-10-21,S&P 500 Rebounds From 2022 Lows This Week As Big Tech Earnings Loom Large,META,-0.011556331533245534,0.7585397039796937,-0.012759866417159982,0.003237896580572164,-0.009250897467056873,0.05743129557601656,-0.02709334048509815,-0.00223054609941975,0.3714200644679666
216,2022-10-21,"Apple Loses Crucial Design Chief, Casting Concerns Over Its AR, VR, Electric Car Prospects",META,-0.011556331533245534,0.7585397039796937,-0.012759866417159982,0.003237896580572164,-0.009250897467056873,0.05743129557601656,-0.02709334048509815,-0.00223054609941975,0.3714200644679666
217,2022-10-21,Instagram-TikTok Battle Intensifies As New Rivals Emerge Like Mushrooms,META,-0.011556331533245534,0.7585397039796937,-0.012759866417159982,0.003237896580572164,-0.009250897467056873,0.05743129557601656,-0.02709334048509815,-0.00223054609941975,0.3714200644679666
218,2022-10-24,"Tesla Slashes China EV Prices, TSMC Joins Embargo After NVIDIA and AMD, Schlumberger Rebrands As SLB: Top Stories Monday, Oct. 24",META,-0.00223054609941975,0.3714200644679666,-0.011556331533245534,-0.012759866417159982,0.003237896580572164,-0.009250897467056873,0.05743129557601656,0.060052368276493295,-0.3953564472636769
219,2022-10-24,"Oh MAMAA! Apple, Microsoft And 3 More Of The Largest Companies In Jim Cramer's FAANG Replacement Are Reporting This Week",META,-0.00223054609941975,0.3714200644679666,-0.011556331533245534,-0.012759866417159982,0.003237896580572164,-0.009250897467056873,0.05743129557601656,0.060052368276493295,-0.3953564472636769
220,2022-10-24,"Bill Gates, Warren Buffett's Initiative For Billionaires To Donate Most Of Their Wealth Sees Sharp Drop In Pledgers In 2022",META,-0.00223054609941975,0.3714200644679666,-0.011556331533245534,-0.012759866417159982,0.003237896580572164,-0.009250897467056873,0.05743129557601656,0.060052368276493295,-0.3953564472636769
221,2022-10-24,Meta-Backed Meesho Scored Against Amazon and Walmart In Indian Online Shopping,META,-0.00223054609941975,0.3714200644679666,-0.011556331533245534,-0.012759866417159982,0.003237896580572164,-0.009250897467056873,0.05743129557601656,0.060052368276493295,-0.3953564472636769
222,2022-10-25,"China's 'Wartime Cabinet' Is Complete: What Xi Jinping's Loyalists Mean For US Stocks, Investing, Chip Sector, Taiwan",META,0.060052368276493295,-0.3953564472636769,-0.00223054609941975,-0.011556331533245534,-0.012759866417159982,0.003237896580572164,-0.009250897467056873,-0.05592311460847965,1.154166189648533
223,2022-10-25,"State of Michigan Retirement System Doubles-Down On Tesla, Amazon Bets — Nearly Doubles Stake In This Telecom Stock",META,0.060052368276493295,-0.3953564472636769,-0.00223054609941975,-0.011556331533245534,-0.012759866417159982,0.003237896580572164,-0.009250897467056873,-0.05592311460847965,1.154166189648533
224,2022-10-25,"Apple, Amazon, Tesla, Snap, Nio: Why These 5 Stocks Are Drawing High Attention Today",META,0.060052368276493295,-0.3953564472636769,-0.00223054609941975,-0.011556331533245534,-0.012759866417159982,0.003237896580572164,-0.009250897467056873,-0.05592311460847965,1.154166189648533
225,2022-10-25,Is Apple 'Twisting The Knife' In Meta's Ad Business? New App Store Guidelines Could Further Inflame Rivalry,META,0.060052368276493295,-0.3953564472636769,-0.00223054609941975,-0.011556331533245534,-0.012759866417159982,0.003237896580572164,-0.009250897467056873,-0.05592311460847965,1.154166189648533
226,2022-10-26,Wednesday's Market Minute: The Bearish Baton Passes to Earnings,META,-0.05592311460847965,1.154166189648533,0.060052368276493295,-0.00223054609941975,-0.011556331533245534,-0.012759866417159982,0.003237896580572164,-0.24557081408256154,1.806044098729942
227,2022-10-26,"Metaverse Is 'A Word I'll Never Use,' Apple Exec Says Echoing Snap Founder's Sentiment",META,-0.05592311460847965,1.154166189648533,0.060052368276493295,-0.00223054609941975,-0.011556331533245534,-0.012759866417159982,0.003237896580572164,-0.24557081408256154,1.806044098729942
228,2022-10-26,Big Tech Misses,META,-0.05592311460847965,1.154166189648533,0.060052368276493295,-0.00223054609941975,-0.011556331533245534,-0.012759866417159982,0.003237896580572164,-0.24557081408256154,1.806044098729942
229,2022-10-26,What To Watch For When Meta Platforms Reports Q3 Earnings After The Bell,META,-0.05592311460847965,1.154166189648533,0.060052368276493295,-0.00223054609941975,-0.011556331533245534,-0.012759866417159982,0.003237896580572164,-0.24557081408256154,1.806044098729942
230,2022-10-26,"Didn't Quibi Fail? Yes, But Disney Aims for TikTok Generation With New Start Wars Shorts",META,-0.05592311460847965,1.154166189648533,0.060052368276493295,-0.00223054609941975,-0.011556331533245534,-0.012759866417159982,0.003237896580572164,-0.24557081408256154,1.806044098729942
231,2022-10-26,"Apple, Meta, Microsoft, Tesla, Alphabet: Earnings, Criminal Probe Report Draw Retail Investors' Attention To These 5 Stocks Today",META,-0.05592311460847965,1.154166189648533,0.060052368276493295,-0.00223054609941975,-0.011556331533245534,-0.012759866417159982,0.003237896580572164,-0.24557081408256154,1.806044098729942
232,2022-10-26,"Tech Titans Get Slaughtered: Will Meta, Apple, Amazon Earnings Revive The Sector?",META,-0.05592311460847965,1.154166189648533,0.060052368276493295,-0.00223054609941975,-0.011556331533245534,-0.012759866417159982,0.003237896580572164,-0.24557081408256154,1.806044098729942
233,2022-10-26,"Nasdaq, S&P 500 Futures Lower Following Alphabet, Microsoft Earnings",META,-0.05592311460847965,1.154166189648533,0.060052368276493295,-0.00223054609941975,-0.011556331533245534,-0.012759866417159982,0.003237896580572164,-0.24557081408256154,1.806044098729942
234,2022-10-26,"Boeing, Meta Platforms And 3 Stocks To Watch Heading Into Wednesday",META,-0.05592311460847965,1.154166189648533,0.060052368276493295,-0.00223054609941975,-0.011556331533245534,-0.012759866417159982,0.003237896580572164,-0.24557081408256154,1.806044098729942
235,2022-10-26,Market Volatility Decreases As US Stocks Extend Gains,META,-0.05592311460847965,1.154166189648533,0.060052368276493295,-0.00223054609941975,-0.011556331533245534,-0.012759866417159982,0.003237896580572164,-0.24557081408256154,1.806044098729942
236,2022-10-26,"Bitcoin Jumps Above 20,000; Here Are The Top Crypto Movers For Wednesday",META,-0.05592311460847965,1.154166189648533,0.060052368276493295,-0.00223054609941975,-0.011556331533245534,-0.012759866417159982,0.003237896580572164,-0.24557081408256154,1.806044098729942
237,2022-10-26,Battle Of The Giants: Facebook Parent Hits Back At Apple As New App Store Rules Risk Ad Revenue,META,-0.05592311460847965,1.154166189648533,0.060052368276493295,-0.00223054609941975,-0.011556331533245534,-0.012759866417159982,0.003237896580572164,-0.24557081408256154,1.806044098729942
238,2022-10-26,Investor Sentiment Improves As Wall Street Rises For Third Straight Session,META,-0.05592311460847965,1.154166189648533,0.060052368276493295,-0.00223054609941975,-0.011556331533245534,-0.012759866417159982,0.003237896580572164,-0.24557081408256154,1.806044098729942
239,2022-10-26,"US Stocks Poised To Lose Momentum As Nasdaq Futures Sink On Disappointing Big Tech Earnings — Focus Now Moves To Ford, Meta",META,-0.05592311460847965,1.154166189648533,0.060052368276493295,-0.00223054609941975,-0.011556331533245534,-0.012759866417159982,0.003237896580572164,-0.24557081408256154,1.806044098729942
240,2022-10-27,Boeing To $185? Plus This Analyst Boosts PT On Harley-Davidson,META,-0.24557081408256154,1.806044098729942,-0.05592311460847965,0.060052368276493295,-0.00223054609941975,-0.011556331533245534,-0.012759866417159982,0.012864962991906648,-0.5870794424505179
241,2022-10-27,Arista Networks Shares Pop As Meta Boosts Capex Outlook,META,-0.24557081408256154,1.806044098729942,-0.05592311460847965,0.060052368276493295,-0.00223054609941975,-0.011556331533245534,-0.012759866417159982,0.012864962991906648,-0.5870794424505179
242,2022-10-27,Why UserTesting Shares Are Trading Higher By Around 93%? Here Are 53 Stocks Moving In Thursday's Mid-Day Session,META,-0.24557081408256154,1.806044098729942,-0.05592311460847965,0.060052368276493295,-0.00223054609941975,-0.011556331533245534,-0.012759866417159982,0.012864962991906648,-0.5870794424505179
243,2022-10-27,"US Stock Futures Mostly Higher Ahead Of GDP, Jobless Claims Data; Apple, Amazon Earnings In Focus",META,-0.24557081408256154,1.806044098729942,-0.05592311460847965,0.060052368276493295,-0.00223054609941975,-0.011556331533245534,-0.012759866417159982,0.012864962991906648,-0.5870794424505179
244,2022-10-27,"Mark Zuckerberg's Net Worth Dropped The Most This Year, Thanks To Meta's Slump; Elon Musk And These 2 Billionaires Also Suffered Losses",META,-0.24557081408256154,1.806044098729942,-0.05592311460847965,0.060052368276493295,-0.00223054609941975,-0.011556331533245534,-0.012759866417159982,0.012864962991906648,-0.5870794424505179
245,2022-10-27,"Apple, Amazon And 5 Stocks To Watch Heading Into Thursday",META,-0.24557081408256154,1.806044098729942,-0.05592311460847965,0.060052368276493295,-0.00223054609941975,-0.011556331533245534,-0.012759866417159982,0.012864962991906648,-0.5870794424505179
246,2022-10-28,"Meta Platforms Is Now The 2nd Most Profitable Stock For Short Sellers In 2022, Behind Only Tesla",META,0.012864962991906648,-0.5870794424505179,-0.24557081408256154,-0.05592311460847965,0.060052368276493295,-0.00223054609941975,-0.011556331533245534,-0.06088703096719039,0.26512614108662413
247,2022-10-28,"Pinterest Only Social Media Asset Likely To See Double-Digit Revenue Growth, Margin Expansion In 2023, Says Analyst; How Minnow Outdid Bigger Rivals In Q3",META,0.012864962991906648,-0.5870794424505179,-0.24557081408256154,-0.05592311460847965,0.060052368276493295,-0.00223054609941975,-0.011556331533245534,-0.06088703096719039,0.26512614108662413
248,2022-10-28,"TikTok Is Bullish On Gaming Despite China Crackdown, To Launch Standalone Gaming Channel",META,0.012864962991906648,-0.5870794424505179,-0.24557081408256154,-0.05592311460847965,0.060052368276493295,-0.00223054609941975,-0.011556331533245534,-0.06088703096719039,0.26512614108662413
249,2022-10-28,"Tesla's Autopilot Draws Regulatory Scrutiny, Volkswagen Expects Supply Crisis To Continue, TikTok To Launch Standalone Gaming Channel: Top Stories Friday, Oct. 28",META,0.012864962991906648,-0.5870794424505179,-0.24557081408256154,-0.05592311460847965,0.060052368276493295,-0.00223054609941975,-0.011556331533245534,-0.06088703096719039,0.26512614108662413
250,2022-10-28,Market Volatility Increases As US Stocks End Mixed,META,0.012864962991906648,-0.5870794424505179,-0.24557081408256154,-0.05592311460847965,0.060052368276493295,-0.00223054609941975,-0.011556331533245534,-0.06088703096719039,0.26512614108662413
251,2022-10-28,"Tim Cook Says Lag In iPhone Sales Due To Supply Chain Issues, Not Economic Slowdown",META,0.012864962991906648,-0.5870794424505179,-0.24557081408256154,-0.05592311460847965,0.060052368276493295,-0.00223054609941975,-0.011556331533245534,-0.06088703096719039,0.26512614108662413
