,date,title,stock,close,volume,1_past_close,2_past_close,3_past_close,4_past_close,5_past_close,next_close,next_volume
334,2022-12-23,"Meta Settles Cambridge Analytica Scandal Case, Microsoft Files Rebuttal To FTC's Lawsuit Against Activision Deal, US Winter Storm Snaps Holiday Plans: Today's Top Stories",META,0.007855175438613582,-0.2464846875912965,-0.02204408268668334,0.02280302230632003,0.022798680157436912,-0.041446846986465835,0.028239334793001003,-0.00982720817614624,0.20204421069193002
335,2022-12-27,"For Better Or For Worse, IPO Aspirant Powerwin Is Bound To Its Ad Partners",META,-0.00982720817614624,0.20204421069193002,0.007855175438613582,-0.02204408268668334,0.02280302230632003,0.022798680157436912,-0.041446846986465835,-0.0107802407293357,-0.0831981600856383
336,2022-12-27,Meta and Alphabet Are Losing Their Advertising Throne,META,-0.00982720817614624,0.20204421069193002,0.007855175438613582,-0.02204408268668334,0.02280302230632003,0.022798680157436912,-0.041446846986465835,-0.0107802407293357,-0.0831981600856383
337,2022-12-28,3 Catalysts For Apple Stock In 2023 — First 'Major New Product' Launch In 8 Years?,META,-0.0107802407293357,-0.0831981600856383,-0.00982720817614624,0.007855175438613582,-0.02204408268668334,0.02280302230632003,0.022798680157436912,0.0401314589121613,0.1404053537284895
338,2023-01-03,Shopify Could Emerge As Another Benefactor Of Apple's Privacy Concerns: FT,META,0.03656308509038486,0.8141780451189249,0.0006651771182371036,0.0401314589121613,-0.0107802407293357,-0.00982720817614624,0.007855175438613582,0.021083893922178687,-0.08813769227521562
339,2023-01-04,"Technology Stocks And EV Predictions For 2023: Gene Munster Sizes Up Apple, Tesla, Ford And More",META,0.021083893922178687,-0.08813769227521562,0.03656308509038486,0.0006651771182371036,0.0401314589121613,-0.0107802407293357,-0.00982720817614624,-0.0033759935298998123,-0.2145253741847264
340,2023-01-04,Meta Bets Go Bust As Digital NFT Land Prices Plummet: Are Investors Wasting Money?,META,0.021083893922178687,-0.08813769227521562,0.03656308509038486,0.0006651771182371036,0.0401314589121613,-0.0107802407293357,-0.00982720817614624,-0.0033759935298998123,-0.2145253741847264
341,2023-01-05,Irish Watchdog Penalizes Meta By €390M For User Privacy Violation,META,-0.0033759935298998123,-0.2145253741847264,0.021083893922178687,0.03656308509038486,0.0006651771182371036,0.0401314589121613,-0.0107802407293357,0.02426344550037629,0.08399385391655634
342,2023-01-05,Why Tesla Is Preferred Choice Of Uber Drivers: Cathie Wood Weighs In,META,-0.0033759935298998123,-0.2145253741847264,0.021083893922178687,0.03656308509038486,0.0006651771182371036,0.0401314589121613,-0.0107802407293357,0.02426344550037629,0.08399385391655634
343,2023-01-05,"Over $400M Robinhood Stock Linked To Sam Bankman-Fried, Dell Eyes Reducing Dependence On China, Walgreens Swings To Quarterly Loss: Top Stories Today",META,-0.0033759935298998123,-0.2145253741847264,0.021083893922178687,0.03656308509038486,0.0006651771182371036,0.0401314589121613,-0.0107802407293357,0.02426344550037629,0.08399385391655634
344,2023-01-06,"Stock Market Pops After Latest Jobs Report, But New Data Shows Key Sectors Contracting",META,0.02426344550037629,0.08399385391655634,-0.0033759935298998123,0.021083893922178687,0.03656308509038486,0.0006651771182371036,0.0401314589121613,-0.0042301417757629745,-0.03391034820279504
345,2023-01-09,"Should You Be Worried About Job Cuts At Goldman, Amazon Or Salesforce? One Important Caveat",META,-0.0042301417757629745,-0.03391034820279504,0.02426344550037629,-0.0033759935298998123,0.021083893922178687,0.03656308509038486,0.0006651771182371036,0.027187798248804462,0.07637406141295577
346,2023-01-09,"Exclusive: Top 10 Most Searched Tickers On Benzinga Pro In 2022 — Where Do SPY, Tesla, Apple And AMC Rank?",META,-0.0042301417757629745,-0.03391034820279504,0.02426344550037629,-0.0033759935298998123,0.021083893922178687,0.03656308509038486,0.0006651771182371036,0.027187798248804462,0.07637406141295577
347,2023-01-09,"Ahead Of Tech Earnings, Analyst Says Sector Is 'Under-Owned' — Repeats Calls For 20% Rally",META,-0.0042301417757629745,-0.03391034820279504,0.02426344550037629,-0.0033759935298998123,0.021083893922178687,0.03656308509038486,0.0006651771182371036,0.027187798248804462,0.07637406141295577
348,2023-01-10,Microsoft's AI Model Can Clone Any Voice With Eerie Accuracy Using Just 3 Seconds Of Audio,META,0.027187798248804462,0.07637406141295577,-0.0042301417757629745,0.02426344550037629,-0.0033759935298998123,0.021083893922178687,0.03656308509038486,-0.00075198209929217,-0.11369943244411596
349,2023-01-10,"Coinbase Discloses Restructuring Plan Amid Macro Headwinds, Pfizer Rebuts Generic Version Of COVID-19 Oral Treatment In China, Microsoft Mulls $10B Investment In ChatGPT Owner: Today's Top Stories",META,0.027187798248804462,0.07637406141295577,-0.0042301417757629745,0.02426344550037629,-0.0033759935298998123,0.021083893922178687,0.03656308509038486,-0.00075198209929217,-0.11369943244411596
350,2023-01-10,"Coinbase Bows Down To Macro Headwinds, To Let Go Of 950 Employees",META,0.027187798248804462,0.07637406141295577,-0.0042301417757629745,0.02426344550037629,-0.0033759935298998123,0.021083893922178687,0.03656308509038486,-0.00075198209929217,-0.11369943244411596
351,2023-01-11,Tech Stocks Rebounding: How The Worst Performers Of 2022 Are Faring In 2023,META,-0.00075198209929217,-0.11369943244411596,0.027187798248804462,-0.0042301417757629745,0.02426344550037629,-0.0033759935298998123,0.021083893922178687,0.028745634297266065,0.20983754867639548
352,2023-01-12,Top Asset Manager BlackRock Bows Down To Macro Uncertainties; Lets Go Of 500 Employees,META,0.028745634297266065,0.20983754867639548,-0.00075198209929217,0.027187798248804462,-0.0042301417757629745,0.02426344550037629,-0.0033759935298998123,0.0019749030825297886,-0.27095328974533206
353,2023-01-12,Deadpool's Ryan Reynolds' Mint Mobile in T-Mobile's Acquisition Crosshairs,META,0.028745634297266065,0.20983754867639548,-0.00075198209929217,0.027187798248804462,-0.0042301417757629745,0.02426344550037629,-0.0033759935298998123,0.0019749030825297886,-0.27095328974533206
354,2023-01-12,Meta Quest Users Can Now Monitor Their Heart Rates During VR Workouts — But It's Not That Simple,META,0.028745634297266065,0.20983754867639548,-0.00075198209929217,0.027187798248804462,-0.0042301417757629745,0.02426344550037629,-0.0033759935298998123,0.0019749030825297886,-0.27095328974533206
355,2023-01-13,"Crypto.com Sheds 20% Of Its Workforce, 'New Disney Chairman A Rubber Stamp,' Nelson Peltz Says, Microsoft-Activision Deal Faces More Challenges: Today's Top Stories",META,0.0019749030825297886,-0.27095328974533206,0.028745634297266065,-0.00075198209929217,0.027187798248804462,-0.0042301417757629745,0.02426344550037629,-0.011826508743727482,-0.05691274449468864
356,2023-01-13,"Meta Takes Legal Action Against Voyager Labs, Accuses It For Alleged Data Scraping",META,0.0019749030825297886,-0.27095328974533206,0.028745634297266065,-0.00075198209929217,0.027187798248804462,-0.0042301417757629745,0.02426344550037629,-0.011826508743727482,-0.05691274449468864
357,2023-01-17,Your Clothes Are Getting Smarter – The $60 Billion Wearables Market Is Producing Some of the Most Revolutionary and Bizarre Technology of the Decade,META,-0.011826508743727482,-0.05691274449468864,0.0019749030825297886,0.028745634297266065,-0.00075198209929217,0.027187798248804462,-0.0042301417757629745,-0.017287206910012953,-0.04407592350905065
358,2023-01-17,"Another Tech Giant Prepares For Major Layoffs, This Time 11,000 Jobs Will Be Cut: Report",META,-0.011826508743727482,-0.05691274449468864,0.0019749030825297886,0.028745634297266065,-0.00075198209929217,0.027187798248804462,-0.0042301417757629745,-0.017287206910012953,-0.04407592350905065
359,2023-01-17,"Microsoft Will Surpass Apple, Google And Meta To Become 'Sole' Big Tech Leader On The Back Of ChatGPT, Says Expert",META,-0.011826508743727482,-0.05691274449468864,0.0019749030825297886,0.028745634297266065,-0.00075198209929217,0.027187798248804462,-0.0042301417757629745,-0.017287206910012953,-0.04407592350905065
360,2023-01-18,Amazon Initiates Layoff Affecting 18K Employees: Report,META,-0.017287206910012953,-0.04407592350905065,-0.011826508743727482,0.0019749030825297886,0.028745634297266065,-0.00075198209929217,0.027187798248804462,0.02353021743716366,0.4160025722836438
361,2023-01-18,This Unexpected Economic Safe Haven Might Be Your Best Bet To Weather The Current Storm,META,-0.017287206910012953,-0.04407592350905065,-0.011826508743727482,0.0019749030825297886,0.028745634297266065,-0.00075198209929217,0.027187798248804462,0.02353021743716366,0.4160025722836438
362,2023-01-18,Spotify Teams Up With European Companies For Regulatory Action Against Apple,META,-0.017287206910012953,-0.04407592350905065,-0.011826508743727482,0.0019749030825297886,0.028745634297266065,-0.00075198209929217,0.027187798248804462,0.02353021743716366,0.4160025722836438
363,2023-01-18,Apple Could Be Bringing Cheaper MR Headset Next Year To Capture Wider Market,META,-0.017287206910012953,-0.04407592350905065,-0.011826508743727482,0.0019749030825297886,0.028745634297266065,-0.00075198209929217,0.027187798248804462,0.02353021743716366,0.4160025722836438
364,2023-01-19,"Microsoft-Backed ChatGPT Outsourced Content Moderation To Kenyan Workers At Below $2/Hour, Investigation Finds",META,0.02353021743716366,0.4160025722836438,-0.017287206910012953,-0.011826508743727482,0.0019749030825297886,0.028745634297266065,-0.00075198209929217,0.023650395630214316,0.002214831686765617
365,2023-01-20,Google Layoffs Only The Latest In Tech Sector Bloodbath,META,0.023650395630214316,0.002214831686765617,0.02353021743716366,-0.017287206910012953,-0.011826508743727482,0.0019749030825297886,0.028745634297266065,0.02798313332790303,-0.04247331692728118
366,2023-01-20,Google To Fire 12K Employees Worldwide; Extends Support Packages,META,0.023650395630214316,0.002214831686765617,0.02353021743716366,-0.017287206910012953,-0.011826508743727482,0.0019749030825297886,0.028745634297266065,0.02798313332790303,-0.04247331692728118
367,2023-01-23,Spotify To Downsize Employee Count To Fight Macro Headwinds,META,0.02798313332790303,-0.04247331692728118,0.023650395630214316,0.02353021743716366,-0.017287206910012953,-0.011826508743727482,0.0019749030825297886,-0.0009074117326419717,-0.20021405091353872
368,2023-01-23,ChatGPT Is Just the Beginning – AI Is Quietly Reshaping Every Aspect of Your Life,META,0.02798313332790303,-0.04247331692728118,0.023650395630214316,0.02353021743716366,-0.017287206910012953,-0.011826508743727482,0.0019749030825297886,-0.0009074117326419717,-0.20021405091353872
369,2023-01-23,German Regulatory Watchdog Launch Probe Against PayPal Over Antitrust Concerns,META,0.02798313332790303,-0.04247331692728118,0.023650395630214316,0.02353021743716366,-0.017287206910012953,-0.011826508743727482,0.0019749030825297886,-0.0009074117326419717,-0.20021405091353872
370,2023-01-23,"Spotify To Downsize Employee Count, Activist Investor Elliott Invests Multibillion Dollars In Salesforce, Abbott Draws DOJ Investigation On Baby Formula Plant Shutdown: Today's Top Stories",META,0.02798313332790303,-0.04247331692728118,0.023650395630214316,0.02353021743716366,-0.017287206910012953,-0.011826508743727482,0.0019749030825297886,-0.0009074117326419717,-0.20021405091353872
371,2023-01-24,"Uber Freight Bows Down To Macro Uncertainties, Lets Go Of 150 Employees",META,-0.0009074117326419717,-0.20021405091353872,0.02798313332790303,0.023650395630214316,0.02353021743716366,-0.017287206910012953,-0.011826508743727482,-0.01145731030209185,0.21173225550973584
372,2023-01-24,"Facebook App, Messenger Slated For Updates: What's In Store?",META,-0.0009074117326419717,-0.20021405091353872,0.02798313332790303,0.023650395630214316,0.02353021743716366,-0.017287206910012953,-0.011826508743727482,-0.01145731030209185,0.21173225550973584
373,2023-01-24,"Apple Weighs Content Deals With Disney, Other Partners For VR Headset",META,-0.0009074117326419717,-0.20021405091353872,0.02798313332790303,0.023650395630214316,0.02353021743716366,-0.017287206910012953,-0.011826508743727482,-0.01145731030209185,0.21173225550973584
374,2023-01-24,DOJ Likely To Take Action Against Google For Influencing Online Ad Market,META,-0.0009074117326419717,-0.20021405091353872,0.02798313332790303,0.023650395630214316,0.02353021743716366,-0.017287206910012953,-0.011826508743727482,-0.01145731030209185,0.21173225550973584
375,2023-01-24,"Davos 2023: Hedera Exec Spent Years On Capitol Hill, Now She's Shaping Blockchain Policy",META,-0.0009074117326419717,-0.20021405091353872,0.02798313332790303,0.023650395630214316,0.02353021743716366,-0.017287206910012953,-0.011826508743727482,-0.01145731030209185,0.21173225550973584
376,2023-01-24,Apple Headset OS' Internal Name 'xrOS' Filed For Trademark By Mysterious Shell Company,META,-0.0009074117326419717,-0.20021405091353872,0.02798313332790303,0.023650395630214316,0.02353021743716366,-0.017287206910012953,-0.011826508743727482,-0.01145731030209185,0.21173225550973584
377,2023-01-25,Satya Nadella Touts ChatGPT Advantage: 'Age Of AI Is Upon Us And Microsoft Is Powering It',META,-0.01145731030209185,0.21173225550973584,-0.0009074117326419717,0.02798313332790303,0.023650395630214316,0.02353021743716366,-0.017287206910012953,0.0409894208604793,-0.04281797009991739
378,2023-01-26,From Apple To IRS And Coinbase To Japan: The Full List Of Sam Bankman-Fried's FTX Creditors,META,0.0409894208604793,-0.04281797009991739,-0.01145731030209185,-0.0009074117326419717,0.02798313332790303,0.023650395630214316,0.02353021743716366,0.030142582141333252,0.4038050239187507
379,2023-01-26,FTX's Bankruptcy: A Who's Who of Institutional Creditors,META,0.0409894208604793,-0.04281797009991739,-0.01145731030209185,-0.0009074117326419717,0.02798313332790303,0.023650395630214316,0.02353021743716366,0.030142582141333252,0.4038050239187507
380,2023-01-26,NIKE To Rally Over 23%? Here Are 10 Other Analyst Forecasts For Thursday,META,0.0409894208604793,-0.04281797009991739,-0.01145731030209185,-0.0009074117326419717,0.02798313332790303,0.023650395630214316,0.02353021743716366,0.030142582141333252,0.4038050239187507
381,2023-01-30,"Meta Needs To Slash Another 7.5K Jobs To Accommodate Metaverse Ambitions, Analyst Says",META,-0.03084228130452482,-0.2161417201770105,0.030142582141333252,0.0409894208604793,-0.01145731030209185,-0.0009074117326419717,0.02798313332790303,0.0129879212145938,0.0642651060445576
382,2023-01-30,Meta Quest Pro Available At $400 Discount Now — A Good Bargain Or Still Too Pricey?,META,-0.03084228130452482,-0.2161417201770105,0.030142582141333252,0.0409894208604793,-0.01145731030209185,-0.0009074117326419717,0.02798313332790303,0.0129879212145938,0.0642651060445576
383,2023-01-31,"Waiting for Powell: As Fed Meeting Starts, Investors Parse Mixed Q4 Earnings and Consider What's Next for Rates",META,0.0129879212145938,0.0642651060445576,-0.03084228130452482,0.030142582141333252,0.0409894208604793,-0.01145731030209185,-0.0009074117326419717,0.027857916778399217,0.8651837504733246
384,2023-01-31,Sony Scales Back PlayStation VR2 Output After Disappointing Pre-Order Numbers,META,0.0129879212145938,0.0642651060445576,-0.03084228130452482,0.030142582141333252,0.0409894208604793,-0.01145731030209185,-0.0009074117326419717,0.027857916778399217,0.8651837504733246
385,2023-01-31,Earnings Season In Full Swing,META,0.0129879212145938,0.0642651060445576,-0.03084228130452482,0.030142582141333252,0.0409894208604793,-0.01145731030209185,-0.0009074117326419717,0.027857916778399217,0.8651837504733246
386,2023-01-31,Most Important Week Of Earnings Season Is Here — Will S&P 500 Companies Continue Beating Wall Street Estimates?,META,0.0129879212145938,0.0642651060445576,-0.03084228130452482,0.030142582141333252,0.0409894208604793,-0.01145731030209185,-0.0009074117326419717,0.027857916778399217,0.8651837504733246
387,2023-02-01,"23 Things That Didn't Exist When Tom Brady Entered The NFL: Tesla, Bitcoin, iPhones, Social Media And More",META,0.027857916778399217,0.8651837504733246,0.0129879212145938,-0.03084228130452482,0.030142582141333252,0.0409894208604793,-0.01145731030209185,0.2328239961605887,1.7034314870376028
388,2023-02-01,Investor Optimism Improves Ahead Of Fed's Decision,META,0.027857916778399217,0.8651837504733246,0.0129879212145938,-0.03084228130452482,0.030142582141333252,0.0409894208604793,-0.01145731030209185,0.2328239961605887,1.7034314870376028
389,2023-02-02,Central Banks And More Earnings,META,0.2328239961605887,1.7034314870376028,0.027857916778399217,0.0129879212145938,-0.03084228130452482,0.030142582141333252,0.0409894208604793,-0.011866321144597514,-0.48955412734414927
390,2023-02-02,What's Going On With Apple Shares,META,0.2328239961605887,1.7034314870376028,0.027857916778399217,0.0129879212145938,-0.03084228130452482,0.030142582141333252,0.0409894208604793,-0.011866321144597514,-0.48955412734414927
391,2023-02-02,Alphabet Q4 Earnings Preview: Google Search Ads In Focus Following 'Code Red' On ChatGPT,META,0.2328239961605887,1.7034314870376028,0.027857916778399217,0.0129879212145938,-0.03084228130452482,0.030142582141333252,0.0409894208604793,-0.011866321144597514,-0.48955412734414927
392,2023-02-02,"Tesla, Amazon, Apple, Alphabet, Gaucho Group: Why These Five Stocks Are Drawing Investors' Attention Today?",META,0.2328239961605887,1.7034314870376028,0.027857916778399217,0.0129879212145938,-0.03084228130452482,0.030142582141333252,0.0409894208604793,-0.011866321144597514,-0.48955412734414927
393,2023-02-02,'The Year Of The Efficient Rabbit': Why Analysts Are Raising Their Price Targets On Meta Platforms (Including One Doubling The PT),META,0.2328239961605887,1.7034314870376028,0.027857916778399217,0.0129879212145938,-0.03084228130452482,0.030142582141333252,0.0409894208604793,-0.011866321144597514,-0.48955412734414927
394,2023-02-02,"S&P 500 Rises 1% Following Fed Decision, Market Volatility Falls Sharply",META,0.2328239961605887,1.7034314870376028,0.027857916778399217,0.0129879212145938,-0.03084228130452482,0.030142582141333252,0.0409894208604793,-0.011866321144597514,-0.48955412734414927
395,2023-02-02,"Apple, Amazon And 5 Stocks To Watch Heading Into Thursday",META,0.2328239961605887,1.7034314870376028,0.027857916778399217,0.0129879212145938,-0.03084228130452482,0.030142582141333252,0.0409894208604793,-0.011866321144597514,-0.48955412734414927
396,2023-02-02,"Nasdaq Futures Fly As Meta Keeps Tech Earnings' Buoyancy Intact: Will Apple, Amazon, Alphabet Toe In Line?",META,0.2328239961605887,1.7034314870376028,0.027857916778399217,0.0129879212145938,-0.03084228130452482,0.030142582141333252,0.0409894208604793,-0.011866321144597514,-0.48955412734414927
397,2023-02-02,"Samsung Hints Metaverse Ambitions At Product Launch Event, Eyes Integrating Different Realities Into Premium Smartphones",META,0.2328239961605887,1.7034314870376028,0.027857916778399217,0.0129879212145938,-0.03084228130452482,0.030142582141333252,0.0409894208604793,-0.011866321144597514,-0.48955412734414927
398,2023-02-02,Pinterest Bows Down To Macro Uncertainties; Lets Go Of 150 Workers,META,0.2328239961605887,1.7034314870376028,0.027857916778399217,0.0129879212145938,-0.03084228130452482,0.030142582141333252,0.0409894208604793,-0.011866321144597514,-0.48955412734414927
399,2023-02-06,"After Apple And Snap, Microsoft Gaming CEO Swipes At Zuckerberg's Metaverse: 'Poorly Built Video Game'",META,-0.002519708485385408,-0.44689537909925436,-0.011866321144597514,0.2328239961605887,0.027857916778399217,0.0129879212145938,-0.03084228130452482,0.02988282076507498,0.10820359760661713
400,2023-02-06,Get Creative With iPhone Photography And Make Your Images Insta-Worthy — Here's How,META,-0.002519708485385408,-0.44689537909925436,-0.011866321144597514,0.2328239961605887,0.027857916778399217,0.0129879212145938,-0.03084228130452482,0.02988282076507498,0.10820359760661713
401,2023-02-07,"Biden Targets Meta, Exxon, Others For Enriching Wall Street Using A Special Tactic",META,0.02988282076507498,0.10820359760661713,-0.002519708485385408,-0.011866321144597514,0.2328239961605887,0.027857916778399217,0.0129879212145938,-0.04274085507828951,-0.2324009626025102
402,2023-02-07,"EXCLUSIVE: Risk Appetite On The Rise, TD Ameritrade's IMX Climbs 3.36%",META,0.02988282076507498,0.10820359760661713,-0.002519708485385408,-0.011866321144597514,0.2328239961605887,0.027857916778399217,0.0129879212145938,-0.04274085507828951,-0.2324009626025102
403,2023-02-09,Former Google Colleagues Bret Taylor And Clay Bavor Collaborate For AI Startup,META,-0.03003867811615213,0.02710914217564908,-0.04274085507828951,0.02988282076507498,-0.002519708485385408,-0.011866321144597514,0.2328239961605887,-0.021189322792601994,-0.09928122676379625
404,2023-02-09,"Cops Joke About Pot Arrest, Call Jail 'Bed & Breakfast,' Concealing Cannabis In Body Cavity & More In Weed Chronicles",META,-0.03003867811615213,0.02710914217564908,-0.04274085507828951,0.02988282076507498,-0.002519708485385408,-0.011866321144597514,0.2328239961605887,-0.021189322792601994,-0.09928122676379625
405,2023-02-10,Tesla Rally Burns Short Sellers: Here's How Much Betting Against EV Maker Has Cost This Year,META,-0.021189322792601994,-0.09928122676379625,-0.03003867811615213,-0.04274085507828951,0.02988282076507498,-0.002519708485385408,-0.011866321144597514,0.030318684836907472,-0.0589347243491577
406,2023-02-10,Microsoft Vs. Google: Analyst Says There's A Clear 'Usain Bolt Style' Leader In Week's AI Battle,META,-0.021189322792601994,-0.09928122676379625,-0.03003867811615213,-0.04274085507828951,0.02988282076507498,-0.002519708485385408,-0.011866321144597514,0.030318684836907472,-0.0589347243491577
407,2023-02-13,"Game Streaming Slowdown: Twitch, YouTube Gaming See Decrease In Hours Watched In 2022",META,0.030318684836907472,-0.0589347243491577,-0.021189322792601994,-0.03003867811615213,-0.04274085507828951,0.02988282076507498,-0.002519708485385408,0.0002786772211944566,-0.23610440133235022
408,2023-02-13,"Nasdaq, S&P 500 Futures Rise Amid Caution Ahead Of Tuesday's Inflation Data: 'Bears May Be Finally Going Into Hibernation,' Says Analyst",META,0.030318684836907472,-0.0589347243491577,-0.021189322792601994,-0.03003867811615213,-0.04274085507828951,0.02988282076507498,-0.002519708485385408,0.0002786772211944566,-0.23610440133235022
409,2023-02-13,"Spy Balloon Saga, Meta Job Cuts, Googlers Pan Pichai For 'Botched' ChatGPT Rival And More: 5 Key Stories You May Have Missed From The Weekend",META,0.030318684836907472,-0.0589347243491577,-0.021189322792601994,-0.03003867811615213,-0.04274085507828951,0.02988282076507498,-0.002519708485385408,0.0002786772211944566,-0.23610440133235022
410,2023-02-13,"Tesla, Apple, And Other Big Techs: How Largest US Pension Fund Shuffled Its Portfolio In Q4",META,0.030318684836907472,-0.0589347243491577,-0.021189322792601994,-0.03003867811615213,-0.04274085507828951,0.02988282076507498,-0.002519708485385408,0.0002786772211944566,-0.23610440133235022
411,2023-02-14,ChatGPT's 100 Millionth User Means the Age of AI Is Here,META,0.0002786772211944566,-0.23610440133235022,0.030318684836907472,-0.021189322792601994,-0.03003867811615213,-0.04274085507828951,0.02988282076507498,-0.012926187434011083,0.05301939703593983
412,2023-02-14,"S&P 500 Settles Higher Ahead Of Inflation Data, Market Volatility Falls",META,0.0002786772211944566,-0.23610440133235022,0.030318684836907472,-0.021189322792601994,-0.03003867811615213,-0.04274085507828951,0.02988282076507498,-0.012926187434011083,0.05301939703593983
413,2023-02-14,"MrBeast Turned Down A $1B Offer For His YouTube Brand — Here's How Much He Thinks It Could Be Worth: 'It's So Crazy, I Don't Even Want To Say It'",META,0.0002786772211944566,-0.23610440133235022,0.030318684836907472,-0.021189322792601994,-0.03003867811615213,-0.04274085507828951,0.02988282076507498,-0.012926187434011083,0.05301939703593983
414,2023-02-14,Walmart Opts To Shutdown Three US Tech Hubs And Expects Workers To Resume Office,META,0.0002786772211944566,-0.23610440133235022,0.030318684836907472,-0.021189322792601994,-0.03003867811615213,-0.04274085507828951,0.02988282076507498,-0.012926187434011083,0.05301939703593983
415,2023-02-14,Meta Loses Veteran Leader As It Battles Growing Competition From TikTok And Apple Privacy Changes,META,0.0002786772211944566,-0.23610440133235022,0.030318684836907472,-0.021189322792601994,-0.03003867811615213,-0.04274085507828951,0.02988282076507498,-0.012926187434011083,0.05301939703593983
416,2023-02-15,"No Summons For Elon Musk But Apple's Tim Cook, Other Big Tech CEOs Subpoenaed By House Panel Over Content Moderation",META,-0.012926187434011083,0.05301939703593983,0.0002786772211944566,0.030318684836907472,-0.021189322792601994,-0.03003867811615213,-0.04274085507828951,-0.026642589315506005,0.02049081548388121
417,2023-02-17,Alibaba Rival Tencent Dumps Metaverse Ambitions As Macro Uncertainties Weigh,META,0.0025516262768308096,-0.06412544768173456,-0.026642589315506005,-0.012926187434011083,0.0002786772211944566,0.030318684836907472,-0.021189322792601994,-0.004627504796174131,0.4311435462718183
418,2023-02-21,"Nasdaq, S&P 500 Futures Slump As Traders Weigh-In Retail Earnings, Uncertain Economic Backdrop",META,-0.004627504796174131,0.4311435462718183,0.0025516262768308096,-0.026642589315506005,-0.012926187434011083,0.0002786772211944566,0.030318684836907472,-0.005578839514481793,-0.35150292259038063
419,2023-02-21,Big Retailers Report,META,-0.004627504796174131,0.4311435462718183,0.0025516262768308096,-0.026642589315506005,-0.012926187434011083,0.0002786772211944566,0.030318684836907472,-0.005578839514481793,-0.35150292259038063
