,date,title,stock,close,volume,1_past_close,2_past_close,3_past_close,4_past_close,5_past_close,next_close,next_volume
115,2022-06-13,Stocks That Hit 52-Week Lows On Monday,PTCT,-0.0447760779758305,0.17710049423393737,-0.037702015440825964,-0.010305579760793826,-0.008107206301766756,0.05308093083992227,-0.06034180459130145,0.002343729103450043,-0.07266153487287152
116,2022-06-14,Stocks That Hit 52-Week Lows On Tuesday,PTCT,0.002343729103450043,-0.07266153487287152,-0.0447760779758305,-0.037702015440825964,-0.010305579760793826,-0.008107206301766756,0.05308093083992227,0.020654742392719028,-0.09508237957489629
117,2022-07-20,"The Daily Biotech Pulse: CDC AdComm Backs Novavax COVID-19 Vaccine, European Approval For PTC Therapeutics' Gene Therapy, Merck's Keytruda Flunks In Head, Neck Cancer Study",PTCT,0.006346387143536081,0.13468085106382977,0.016355657382362,-0.009356454821256799,-0.0013673968056171493,-0.011711721619211746,0.016018323815067292,0.00900895714943828,-0.40727545471591975
118,2022-08-04,"Biotech Daily: Amgen, Gilead Go Shopping, Nod For AstraZeneca's Lynparza In Early Stage Breast Cancer, Decision Day For Alzheimer's Associated Hallucinations Candidate",PTCT,0.029485567888130282,1.2877270412493633,0.019616165010947206,0.04500892178451332,0.030539652223986025,-0.018923184594225817,0.000901937246980733,0.0867357403507647,-0.08169473918527859
119,2022-10-28,Why Edwards Lifesciences Shares Are Trading Lower By Around 17%? Here Are 47 Stocks Moving In Friday's Mid-Day Session,PTCT,-0.1372504801736265,2.3754693366708386,-0.023220182647531895,0.023772176937960632,-0.023006118560525146,-0.0212310026976118,0.021020427800732877,-0.016896321945763293,-0.5682504369934849
120,2022-10-31,Why Pinterest Shares Jumped Around 14%; Here Are 69 Biggest Movers From Friday,PTCT,-0.016896321945763293,-0.5682504369934849,-0.1372504801736265,-0.023220182647531895,0.023772176937960632,-0.023006118560525146,-0.0212310026976118,,
