,date,title,stock,close,volume,1_past_close,2_past_close,3_past_close,4_past_close,5_past_close,next_close,next_volume
155,2021-02-11,"The Daily Biotech Pulse: DermTech Soars On Contract, Fluidigm Plunges On Earnings, Decision Day For Regeneron, Bioventus Debuts",ALNY,0.0074317811494100106,-0.30781302544557787,-0.02081712115378842,0.015137754116824276,0.00024222207004398477,0.04559557204272191,0.04403308206353307,-0.045108274843463136,0.49748987854251014
156,2021-02-11,"Earnings Scheduled For February 11, 2021",ALNY,0.0074317811494100106,-0.30781302544557787,-0.02081712115378842,0.015137754116824276,0.00024222207004398477,0.04559557204272191,0.04403308206353307,-0.045108274843463136,0.49748987854251014
157,2021-04-29,"The Daily Biotech Pulse: Clinical Setback For Adverum, Galera Posts Data Readout, Moderna To Invest In Vaccine Manufacturing, Decision Day For Ardelyx",ALNY,-0.02675396342610792,0.6110132158590309,0.015781993484615953,-0.01119657741822988,0.045201818465500754,-0.007621419896897685,0.0017451137591386612,0.00680075117502188,-0.4108558928083128
158,2021-06-23,"The Daily Biotech Pulse: Gemini Sinks On Data, Amgen's Migraine Drug Approved In Japan, Liver Congress Gets Underway",ALNY,0.009713836161980849,-0.26487311052558593,0.009868051475026673,-0.03182771723804967,0.026937587167770394,0.023469975499806894,0.010810829139686451,-0.0054401430479760204,0.49066213921901536
159,2021-07-12,Stocks That Hit 52-Week Highs On Monday,ALNY,0.0016407902971578014,0.3845098338161306,0.024579741989356974,-0.0005214458531792587,-0.010264987354053567,0.01720826187404967,0.009896864069403488,-0.007908229713257553,-0.5037991410637594
160,2021-07-13,"The Daily Biotech Pulse: Equillium Issues Positive Regulatory Update, Biogen In-Licenses Multiple Sclerosis Drug, Aridis Releases COVID-19 Antibody Cocktail Data",ALNY,-0.007908229713257553,-0.5037991410637594,0.0016407902971578014,0.024579741989356974,-0.0005214458531792587,-0.010264987354053567,0.01720826187404967,-0.030120186744010957,0.3521970705725699
161,2021-07-21,"The Daily Biotech Pulse: J&J, Novartis Report Solid Results, Chembio Soars On COVID Test Order, Lumos Signals Clinical Trial Delay",ALNY,-0.016814990783664663,-0.48499176158750623,0.044834868061215394,-0.012560526145481421,0.032509429701084835,0.00945168865190027,-0.030120186744010957,0.009550787137981853,0.06955070246209494
162,2021-07-30,"The Daily Biotech Pulse: Erytech Jumps On Fast Track Designation, GlaxoSmithKline FDA Nod, Alnylam's Clinical Collaboration, 4 IPOs",ALNY,-0.01589396337538207,0.18368527625108477,-0.001482725224662862,0.031202275779439015,-0.008534075948863906,-0.023573285266322408,0.003300182121845463,-0.005476672148028827,0.09579667644183765
163,2021-08-03,"Earnings Scheduled For August 3, 2021",ALNY,0.004776302611031236,1.19892952720785,-0.005476672148028827,-0.01589396337538207,-0.001482725224662862,0.031202275779439015,-0.008534075948863906,0.025893434069844457,-0.1881338742393509
164,2021-08-05,Stocks That Hit 52-Week Highs On Thursday,ALNY,0.05702132204462451,0.21511555277951278,0.025893434069844457,0.004776302611031236,-0.005476672148028827,-0.01589396337538207,-0.001482725224662862,0.00685921543537904,-0.16130358795106403
165,2021-08-05,"The Daily Biotech Pulse: Merck Reports Positive Keytruda Readout, Moderna Slips Despite Q2 Beat, Bayer To Buy Vividion For Up To $2B, GlycoMimetics Gets New CEO",ALNY,0.05702132204462451,0.21511555277951278,0.025893434069844457,0.004776302611031236,-0.005476672148028827,-0.01589396337538207,-0.001482725224662862,0.00685921543537904,-0.16130358795106403
166,2021-08-06,Stocks That Hit 52-Week Highs On Friday,ALNY,0.00685921543537904,-0.16130358795106403,0.05702132204462451,0.025893434069844457,0.004776302611031236,-0.005476672148028827,-0.01589396337538207,0.025713283728524994,0.5835989213042412
167,2021-08-10,"The Daily Biotech Pulse: Arcturus Soars On COVID-19 Vaccine Updates, Merck's Keytruda On Track For More Label Expansions, Eliem Debuts",ALNY,0.03735328702890928,-0.2420465980339036,0.025713283728524994,0.00685921543537904,0.05702132204462451,0.025893434069844457,0.004776302611031236,-0.023491983461185306,0.19403594771241828
168,2021-08-11,Stocks That Hit 52-Week Highs On Wednesday,ALNY,-0.023491983461185306,0.19403594771241828,0.03735328702890928,0.025713283728524994,0.00685921543537904,0.05702132204462451,0.025893434069844457,-0.009514458350991739,-0.6143516934656175
169,2021-08-12,"The Daily Biotech Pulse: Xeris Gets OK For Initiating Hyperthyroidism Study, Merck-Eisai Snag FDA Approval For Drug Combo, Decision Day For Jazz Pharma",ALNY,-0.009514458350991739,-0.6143516934656175,-0.023491983461185306,0.03735328702890928,0.025713283728524994,0.00685921543537904,0.05702132204462451,-0.021799745783043112,0.9201596806387227
170,2021-08-18,"This Robot-Run Large Cap ETF Has Less Apple, Microsoft, Amazon, Facebook Compared To SPY And Is Bullish On These Manufacturing Stocks Instead",ALNY,-0.013583027319366447,-0.19035446489434216,0.017633912197524637,0.0012211534617010411,-0.021799745783043112,-0.009514458350991739,-0.023491983461185306,-0.0027337279880012,-0.20101031361818567
171,2021-10-08,10 Health Care Stocks With Unusual Options Alerts In Today's Session,ALNY,0.0038933185741218956,0.0201691607026675,0.009100864404170128,0.013763527318039648,0.017075180792234912,0.012144548918564535,0.020496770124614372,0.004074628588558893,-0.2914540816326531
172,2021-10-28,"The Daily Biotech Pulse: Merck Reports Beat-And-Raise Quarter, Pfizer-BioNTech Snag Orders For Additional Vaccine Doses, HCW Cleared For Phase 1 Study Of Pancreatic Cancer Drug",ALNY,-0.1518100215344007,2.596333853354134,-0.033129345148610545,-0.009816154019392176,0.005337080486059298,-0.02799393710881759,0.002502180789468289,-0.015912186016816987,-0.46997794888479194
173,2021-10-28,"Earnings Scheduled For October 28, 2021",ALNY,-0.1518100215344007,2.596333853354134,-0.033129345148610545,-0.009816154019392176,0.005337080486059298,-0.02799393710881759,0.002502180789468289,-0.015912186016816987,-0.46997794888479194
174,2021-12-06,"The Week Ahead In Biotech (Dec. 6-Dec. 11): Daré FDA Decision, Adcom Tryst For Reata, Multiple Conference Presentations And More",ALNY,0.03291316158706725,-0.0912357444149352,-0.06283842006906637,0.016228608606659645,-0.021055551206311862,0.016930383233331625,-0.0413196485258146,0.018531066549699826,0.9037304452466908
175,2021-12-21,"The Daily Biotech Pulse: Aldeyra Sinks On Dry Eye Disease Readout, Sanofi Goes Shopping, Regulatory Setback For Aquestive, Aridis Touts Pan-Coronavirus Antibody Cocktail",ALNY,0.006556069876314519,-0.23017953086096188,0.019119010237355516,0.052412387416088224,-0.03234582201795533,0.028697582262768417,-0.003701332733524243,-0.06117536789973954,0.0554089709762533
176,2022-02-10,"The Daily Biotech Pulse: AstraZeneca Q4 Gets COVID Boost, Seagen Plunges On Earnings, Adcom Test Awaits Lilly",ALNY,-0.003566666498692306,0.14939728135419328,0.02546731591966922,-0.006794447011812643,0.02221149613677298,0.020419646160114047,-0.01893157169209847,-0.0006629066890562196,0.08523931719290423
177,2022-02-10,"Earnings Scheduled For February 10, 2022",ALNY,-0.003566666498692306,0.14939728135419328,0.02546731591966922,-0.006794447011812643,0.02221149613677298,0.020419646160114047,-0.01893157169209847,-0.0006629066890562196,0.08523931719290423
178,2022-04-01,Attention Biotech Investors: Mark Your Calendar For April PDUFA Dates,ALNY,0.0367444439138791,1.769075994428107,-0.01180109018522102,-0.00899604144526367,0.031487855173933266,-0.013186030732567189,0.0006719646450961125,-0.04442075321582439,-0.15734168017438932
179,2022-04-28,"Earnings Scheduled For April 28, 2022",ALNY,-0.07591011261187386,0.8070828560519283,-0.0005161408455141014,-0.04362316903012964,-0.02952091422623504,-0.010370370370370363,0.004763340674571959,-0.0679659872689945,-0.24536474565527444
180,2022-04-28,"The Daily Biotech Pulse: Moderna Seeks FDA Approval For COVID-19 Shot For Children 2-6, Tax Disclosure For Amgen, Fast Track Tags For SQZ Biotech, Timber Pharma Candidates",ALNY,-0.07591011261187386,0.8070828560519283,-0.0005161408455141014,-0.04362316903012964,-0.02952091422623504,-0.010370370370370363,0.004763340674571959,-0.0679659872689945,-0.24536474565527444
181,2022-07-28,"Daily Biotech Pulse: GSK's Kidney Disease Drug Approved For Children, Tonix Pharma To Launch Monkeypox Vaccine Study In Kenya, Positive Effect Of Cyclerion's Schizophrenia Candidate",ALNY,0.010917820937031752,-0.3037227214377407,0.014071437290736677,-0.008498562140068944,-0.01403540026110739,-0.02710591248026961,0.004366808135300104,-0.010312227858622736,0.1237094395280236
182,2022-07-28,"Earnings Scheduled For July 28, 2022",ALNY,0.010917820937031752,-0.3037227214377407,0.014071437290736677,-0.008498562140068944,-0.01403540026110739,-0.02710591248026961,0.004366808135300104,-0.010312227858622736,0.1237094395280236
183,2022-08-03,Recap Of Wednesday's Biotech Catalysts - End Of the Day Summary,ALNY,0.4933436126217281,25.953026481715007,0.014433757174056927,-0.014714139937196613,-0.010312227858622736,0.010917820937031752,0.014071437290736677,0.05678981584301512,-0.6006900988361892
184,2022-08-03,"Biotech Daily: Merck's Two Combo Cancer Trials Miss Main Goal, Approval For Sinovac's COVID-19 Shot For Youngest Kids, Alnylam Aces Protein Disorder Trial",ALNY,0.4933436126217281,25.953026481715007,0.014433757174056927,-0.014714139937196613,-0.010312227858622736,0.010917820937031752,0.014071437290736677,0.05678981584301512,-0.6006900988361892
