,date,title,stock,close,volume,1_past_close,2_past_close,3_past_close,4_past_close,5_past_close,next_close,next_volume
0,2009-08-31,Boston Scientific (BSX) Adds New Leading Electrophysiologist to its Medical Team,BSX,0.027097939771629997,0.963706135906063,-0.004351626782495344,0.005249296967666295,-0.01210020685748725,0.009598573849135317,,-0.04255319148936165,0.4603723989871189
1,2009-09-30,Boston Scientific Corp (BSX) to Pay $716.3M to Johnson& Johnson (JNJ),BSX,-0.008426980338593681,0.41728620787007786,-0.012025912062409327,0.04444444649205437,-0.026340520221708186,-0.01756003565085018,-0.015468615089575088,-0.03210577409716131,0.1365085086604314
2,2009-12-24,"Benzinga’s News Roundup (BG, AZN, QCOR, BSX, CVX, MOS, PFE)",BSX,0.003401438512873556,-0.8639016346429595,0.00227267086998606,-0.003397478282038291,-0.007865134587025757,0.02298848432756806,-0.009111608899671664,-0.002259938632946157,2.9235631881156823
3,2010-01-20,Johnson & Johnson Suing Boston Scientific Over Stents,BSX,-0.014553050414575663,1.2820084888943835,0.02014841720408178,-0.008412189461688424,0.03934433064046261,0.001094012563667368,0.007717822585868506,-0.029535838237513157,-0.04518682377018346
4,2010-02-22,"Healthcare Conference Update (JNJ, BSX, ATEC, BAX, ZOLL)",BSX,0.023406999609787205,0.8223440569349176,-0.012836958295540324,0.005161285400390625,0.04588396215779045,0.0027063574137822233,-0.010709494772824124,-0.015247762046257884,-0.20410236926624759
5,2010-04-05,"Oracle’s Ellison Tops The List Of Highest Paid CEOs In 2009 (ORCL, BSX, OXY, HPQ, APC)",BSX,-0.0027662490835064224,-0.4622246541414825,0.001385073292581085,-0.004137959973565475,0.008344915480116954,0.025677578097217157,0.007183935411037012,-0.00970876162150025,0.7855235060614378
6,2010-04-16,"Afternoon Market Update Goldman (NYSE: GS), Best Buy (NYSE: BBY), General Electric Co (NYSE: GE), Boston Scientific (NYSE: BSX)",BSX,0.028011245075938218,2.8612220717670955,-0.0027932934850189994,0.037681122963931335,-0.005763683216603255,-0.004304122507063468,-0.0014326975436259604,0.0013623640104629686,-0.6308099648870555
7,2010-04-20,Johnson & Johnson (JNJ) Reports 29% Increase In First-Quarter Profit,BSX,-0.0027210858756485656,-0.41181132747565896,0.0013623640104629686,0.028011245075938218,-0.0027932934850189994,0.037681122963931335,-0.005763683216603255,-0.013642551933616964,0.28576475278704416
8,2010-04-20,"Johnson & Johnson Lowers Its Guidance (JNJ, BSX) ",BSX,-0.0027210858756485656,-0.41181132747565896,0.0013623640104629686,0.028011245075938218,-0.0027932934850189994,0.037681122963931335,-0.005763683216603255,-0.013642551933616964,0.28576475278704416
9,2010-04-20,Johnson & Johnson Beats Q1 Forecasts With 29% Profit Growth; Lowers Guidance,BSX,-0.0027210858756485656,-0.41181132747565896,0.0013623640104629686,0.028011245075938218,-0.0027932934850189994,0.037681122963931335,-0.005763683216603255,-0.013642551933616964,0.28576475278704416
10,2010-04-26,US Stock Futures Point To Bright Day At The Market,BSX,-0.020804451397198997,1.1794823870240467,0.0,-0.0027662490835064224,-0.013642551933616964,-0.0027210858756485656,0.0013623640104629686,0.005665717022269368,0.6855341192613098
11,2010-04-27,US Stock Futures Sink As Goldman Weighed,BSX,0.005665717022269368,0.6855341192613098,-0.020804451397198997,0.0,-0.0027662490835064224,-0.013642551933616964,-0.0027210858756485656,-0.015492976759426735,-0.5798121319273967
12,2010-09-10,Morgan Stanley's Equity Morning Summary,BSX,0.005660326771994351,0.13263318507937538,0.029126231570822947,-0.011516303712136078,-0.026168199809568193,0.007532949582686577,0.035087685053246886,-0.016885582340742666,-0.1915435363133029
13,2010-10-19,"Earnings Scheduled For October 19 (GS, BAC, KO, YHOO, UNH, JNPR, SLM, NYT, HOG, JNJ, ITW, EMC, LMT, GILD, BK, MICC, STT, WDC, BSX, MNI, OXY, BTU)",BSX,-0.03709677841115089,-0.3617381016312009,0.008130034654042939,-0.0016233364111005733,-0.008051560455349493,0.013050558272844404,0.0,0.055276450944836464,3.353898942358888
14,2010-10-20,"Market Roundup (EBAY, NFLX, STJ, BSX, UNH, RCRC, DAL, LCC, AMR)",BSX,0.055276450944836464,3.353898942358888,-0.03709677841115089,0.008130034654042939,-0.0016233364111005733,-0.008051560455349493,0.013050558272844404,0.006349200101906982,-0.5425786162572487
15,2011-04-11,Unconfirmed Rumors circulate that (JNJ) is in final stages to acquire (BSX) at $9.50 a share,BSX,-0.017687090629617708,-0.19816522691324978,-0.009433985302105263,0.026279399269601544,0.024079331114982283,-0.023513150186095122,-0.009589064360603805,-0.016620483247395845,0.04347614972353231
16,2011-04-27,"Trading on Johnson & Johnson's $21.3 Billion Purchase of Synthes (JNJ, MDT, BSX, TMO, IHI)",BSX,0.004126576325592435,0.17379411764705877,-0.005471951048718893,0.02094973443632786,0.011299424374030087,0.007112334623823324,0.007163351088572023,0.017808169069468693,-0.23216567691498158
17,2011-06-20,Stocks and Sectors to Watch: S&P 500 Recap 6/20/11,BSX,-0.007363798382293063,-0.1176429269979522,-0.005856509853564229,-0.014430001025922401,0.028189920426204607,0.010494706750155292,-0.013313631588852348,0.026706277639223064,-0.10830720619213241
18,2011-06-20,Consumer Goods and Health Care Stocks Leading the Market,BSX,-0.007363798382293063,-0.1176429269979522,-0.005856509853564229,-0.014430001025922401,0.028189920426204607,0.010494706750155292,-0.013313631588852348,0.026706277639223064,-0.10830720619213241
19,2011-06-22,Wednesday's S&P Sector Recap 6/22/11,BSX,0.02023119435579157,0.7307594580303125,0.026706277639223064,-0.007363798382293063,-0.005856509853564229,-0.014430001025922401,0.028189920426204607,0.0042493215370393855,-0.48819972384020827
20,2011-07-01,Time To Look At Boston Scientific?,BSX,0.046309721957696004,0.16254468392310284,-0.00288600020518448,-0.007163351088572134,0.016011664533740033,-0.0029027549077029757,-0.028208784456696168,-0.012448153852069321,-0.5643150825566778
21,2011-07-05,Hottest and Coldest Sectors For the First Half of 2011,BSX,-0.012448153852069321,-0.5643150825566778,0.046309721957696004,-0.00288600020518448,-0.007163351088572134,0.016011664533740033,-0.0029027549077029757,0.0028011178292022265,1.9404239177912137
22,2011-07-13,"Boston Scientific Earnings Preview: Revenue, Earnings Expected to Fall from Previous Quarter",BSX,-0.013736315740073168,-0.306400835240734,0.0013755473050993672,0.01394698794539706,-0.009668466441596024,0.01117317394007622,0.0028011178292022265,-0.0125347740811238,-0.39567641422591715
23,2011-07-15,"Boston Scientific Earnings Preview: Revenue, Earnings Expected to Fall from Previous Quarter",BSX,-0.011283486880723781,0.42094977151451873,-0.0125347740811238,-0.013736315740073168,0.0013755473050993672,0.01394698794539706,-0.009668466441596024,-0.012838823059816984,0.12374345179102364
24,2011-07-15,"Earnings Preview: Johnson & Johnson EPS, Revenue Expected to Rise from Previous Quarter",BSX,-0.011283486880723781,0.42094977151451873,-0.0125347740811238,-0.013736315740073168,0.0013755473050993672,0.01394698794539706,-0.009668466441596024,-0.012838823059816984,0.12374345179102364
25,2011-07-15,"Earnings Preview: Analysts Expect Abbott Laboratories Revenue, Earnings to Dip from Previous Quarter",BSX,-0.011283486880723781,0.42094977151451873,-0.0125347740811238,-0.013736315740073168,0.0013755473050993672,0.01394698794539706,-0.009668466441596024,-0.012838823059816984,0.12374345179102364
26,2011-07-25,"Boston Scientific Earnings Preview: Analysts Expect Rising Revenue, Falling EPS Over Previous Quarter",BSX,-0.012482684065424965,-0.3674950918471396,0.018361598282739644,0.011428560529436416,-0.01960782480441492,0.031791876844815325,-0.012838823059816984,-0.030898847433671772,1.2127767083734362
27,2011-07-28,Thursday's S&P Sector Recap,BSX,0.08494786414618072,1.574242367343873,-0.027536239796289608,-0.030898847433671772,-0.012482684065424965,0.018361598282739644,0.011428560529436416,-0.016483565788166232,-0.6860024507837402
28,2011-07-28,"News Summary for July 28, 2011",BSX,0.08494786414618072,1.574242367343873,-0.027536239796289608,-0.030898847433671772,-0.012482684065424965,0.018361598282739644,0.011428560529436416,-0.016483565788166232,-0.6860024507837402
29,2011-09-29,Boston Scientific Announces Favorable Appellate Court Ruling Affirming Non-Infringement of Johnson & Johnson Patent ,BSX,0.0016419953684940758,-0.095640417132556,0.0,0.026981505713482345,0.02951381817736287,0.024911093625196168,-0.05227655172907353,-0.03114755085097065,0.2667621288487134
30,2011-10-14,"Abbott Laboratories Earnings Preview: Analysts Expect Higher EPS, Revenue",BSX,0.012455546812597973,0.2422802394842114,-0.005309771557870824,0.0035523944085211756,-0.01228064862571343,0.014234862159271389,-0.0035460959929022318,-0.024604545707858083,-0.3551788228320202
31,2011-10-14,"Johnson & Johnson Earnings Preview: Analysts Expect Rising Revenue, Falling EPS",BSX,0.012455546812597973,0.2422802394842114,-0.005309771557870824,0.0035523944085211756,-0.01228064862571343,0.014234862159271389,-0.0035460959929022318,-0.024604545707858083,-0.3551788228320202
32,2011-10-19,"Earnings Preview: Analysts Expect Boston Scientific's Revenue, Earnings to Dip",BSX,-0.0035335656299810836,0.48511967165577397,0.019819757278725758,-0.024604545707858083,0.012455546812597973,-0.005309771557870824,0.0035523944085211756,-0.04432624218407655,1.250576003989222
33,2011-11-08,"End-of-Day Market Summary for November 8, 2011",BSX,0.008635611582778147,-0.3154467375977439,0.0034662012118935603,-0.017035759213314572,0.031634415910103186,0.019713285845592843,-0.052631570425571095,-0.01369861671503625,0.5790326205011049
34,2011-12-02,Seven Stocks Insiders Are Buying,BSX,-0.06779662523760033,1.475710222800592,0.0,0.06306304371247706,0.022099514952094612,0.030360502465121453,-0.00939853178975536,0.018181800842285156,-0.46192926753792873
35,2012-02-02,"Financial Breakfast: Morning News Summary for February 2, 2012",BSX,-0.04105090209131845,1.6841819916724496,0.021812099598800705,-0.005008302857679614,0.010118034488434624,-0.005033592217505545,-0.027732475223526176,0.03253425552330924,-0.2047511708261629
36,2012-04-19,Boston Scientific Sees First-Quarter Earnings Surge,BSX,0.05595666875706118,3.1168885372194737,-0.007168452042999429,0.012704118315149948,-0.019572893045762596,-0.03436430931327672,0.013937352566762984,0.015384641718817926,-0.6280574734249827
37,2012-09-28,A Peek Into The Market Before The Trading Starts,BSX,0.014134262519924334,0.13344697013030093,0.00891260476073863,-0.0035523944085211756,-0.0017730057236523544,-0.025906752393038968,0.0,-0.008710751897463065,0.43633299016936156
40,2012-10-15,Earnings Expectations for the Week of October 15,BSX,0.010771982213717779,-0.5227659798941958,-0.0017920702834053337,0.0017952875649005495,-0.005357095264657774,-0.026086973107379396,-0.0017361507785524921,0.005328549264900007,-0.06486862051541187
42,2012-10-18,"Earnings Scheduled For October 18, 2012",BSX,-0.039145870937996374,1.4398267728713945,-0.007067131259962167,0.005328549264900007,0.010771982213717779,-0.0017920702834053337,0.0017952875649005495,-0.033333389258678014,-0.40830887433675445
45,2012-10-26,"Benzinga Market Primer, Friday October 26",BSX,0.009765662471182601,0.5169018866094379,0.009861876174517059,-0.005882300692582665,-0.024856618349295534,0.0019157527363558025,-0.033333389258678014,-0.005802748426621873,-0.6278031780541612
49,2012-10-26,"Benzinga Market Primer, Friday, October 26",BSX,0.009765662471182601,0.5169018866094379,0.009861876174517059,-0.005882300692582665,-0.024856618349295534,0.0019157527363558025,-0.033333389258678014,-0.005802748426621873,-0.6278031780541612
52,2013-02-13,"13-F Alert: Leon Cooperman's Omega Advisors Dumps Apple, Buys Facebook ",BSX,-0.01844536765589122,0.19482313642877513,-0.005242458879826439,-0.009090869682878533,0.007853395789016115,-0.002610963619440576,-0.0013038107930068987,0.010738309072668928,-0.2936711554944518
54,2013-04-08,These Are the 100 Highest-Paid CEOs in Business Today,BSX,-0.006361347313680876,0.30117075043183417,-0.0075757502779744135,0.021935493715347754,-0.017743963099451254,0.011538419685891421,-0.0012803779920539382,0.0012804390467482385,-0.3581514951864927
56,2013-04-08,These Are the 100 Highest-Paid CEOs in Business Today [DRAFT],BSX,-0.006361347313680876,0.30117075043183417,-0.0075757502779744135,0.021935493715347754,-0.017743963099451254,0.011538419685891421,-0.0012803779920539382,0.0012804390467482385,-0.3581514951864927
58,2013-04-25,"Earnings Scheduled For April 25, 2013",BSX,0.02445649797191951,1.9434861972725228,0.001360575375726647,0.011004116081972715,0.0,0.025387845481628313,-0.026098908206688254,-0.011936359820056586,-0.6150909650587223
61,2013-07-25,"Benzinga Market Primer: Thursday, July 25: Futures Lower After Technical Breakdown",BSX,0.12695112493382088,3.0823767935121644,-0.009278366428618456,-0.031936191005918824,0.03619445488193462,0.00729163458777915,0.006289352186228392,0.012003704095727485,-0.6837493601057449
62,2013-07-25,"Benzinga Market Primer, Thursday July 25",BSX,0.12695112493382088,3.0823767935121644,-0.009278366428618456,-0.031936191005918824,0.03619445488193462,0.00729163458777915,0.006289352186228392,0.012003704095727485,-0.6837493601057449
65,2013-07-26,"Benzinga Market Primer: Friday, July 26: Futures Flat On Mixed Global Stocks Overnight",BSX,0.012003704095727485,-0.6837493601057449,0.12695112493382088,-0.009278366428618456,-0.031936191005918824,0.03619445488193462,0.00729163458777915,0.0009124296393274722,-0.34417943910782967
67,2013-07-26,"Benzinga Market Primer, Friday July 26",BSX,0.012003704095727485,-0.6837493601057449,0.12695112493382088,-0.009278366428618456,-0.031936191005918824,0.03619445488193462,0.00729163458777915,0.0009124296393274722,-0.34417943910782967
69,2013-12-12,Market Wrap For December 12: Dow Suffers Second Consecutive Day of Triple Point Loss,BSX,0.026833562510875986,0.4085575246693631,-0.03454228162052164,-0.011945421513053112,-0.010970473439326112,0.04497356455197665,0.002652496185513664,-0.00783965178591306,-0.6805319397212776
73,2013-12-17,Slideshow: The Top 10 'Highs & Dives' Of S&P 500 Stocks In 2013,BSX,0.0035087687010102453,0.20219642638433388,0.0008778994649794036,-0.00783965178591306,0.026833562510875986,-0.03454228162052164,-0.011945421513053112,0.008741292407143275,1.0206472645770366
74,2013-12-17,Slideshow: The Top 10 S&P 500 Stocks of 2013 Have Had Very Big Years,BSX,0.0035087687010102453,0.20219642638433388,0.0008778994649794036,-0.00783965178591306,0.026833562510875986,-0.03454228162052164,-0.011945421513053112,0.008741292407143275,1.0206472645770366
77,2013-12-17,The Top 10 S&P 500 Stocks of 2013 Have Had Very Big Years,BSX,0.0035087687010102453,0.20219642638433388,0.0008778994649794036,-0.00783965178591306,0.026833562510875986,-0.03454228162052164,-0.011945421513053112,0.008741292407143275,1.0206472645770366
81,2014-01-06,"#PreMarket Primer: Monday, January 6: Asia Plunges",BSX,0.03352888585901681,1.0352113643545042,0.0016792995818566414,-0.009151464738964554,0.0,-0.0033167463069042613,-0.009038591289043274,0.008921302299909728,-0.41533403986742357
89,2014-01-21,"#PreMarket Primer: Tuesday, January 21: China's Central Bank Adds Record Amount Of Cash To Markets",BSX,0.034788993737373985,0.800541378723099,-0.0029520266634666115,0.015742131615060995,0.012139593604506782,0.020123856605766877,-0.014492721995345681,-0.007868359104370226,-0.4449350610560481
94,2014-04-29,Market Wrap For April 29: Dow Approaches Record Highs Despite Ongoing Ukraine Tension and Upcoming Fed Meeting ,BSX,-0.06259207557033308,1.441332178265473,0.014947668726047247,-0.02690908258611502,0.004382791925185758,-0.0043636668812144785,0.0021865694159850513,-0.009426542802373206,-0.2227429157208758
98,2014-05-15,"US Stock Futures Flat Ahead Of Economic Data, Wal-Mart Earnings",BSX,-0.007818638136668055,0.027816124783802243,-0.000781267869751634,-0.010054146277852727,0.015710979586124774,-0.005468800582456579,0.0023492350740639267,0.008668291094477754,-0.151357025967209
102,2014-05-15,Market Wrap For May 15: Bears Return In Full-Force As Dow Suffers Triple-Digit Point Loss,BSX,-0.007818638136668055,0.027816124783802243,-0.000781267869751634,-0.010054146277852727,0.015710979586124774,-0.005468800582456579,0.0023492350740639267,0.008668291094477754,-0.151357025967209
103,2014-05-15,Market Wrap For May 15: Bears Return in Full-Force as Dow Suffers Triple-Digit Point Loss,BSX,-0.007818638136668055,0.027816124783802243,-0.000781267869751634,-0.010054146277852727,0.015710979586124774,-0.005468800582456579,0.0023492350740639267,0.008668291094477754,-0.151357025967209
106,2014-06-11,#PreMarket Primer: Wednesday June 11th: PBOC Looking For Stable Monetary Policy,BSX,0.0023364277737289996,-0.28107164794754036,0.0062695863848794,-0.028179732089426368,-0.0037936410908296914,0.009961694447576663,0.006168074175713301,-0.005438981775187313,0.4244109725460019
108,2014-06-11,"#PreMarket Primer: Wednesday, June 11: PBOC Looking For Stable Monetary Policy",BSX,0.0023364277737289996,-0.28107164794754036,0.0062695863848794,-0.028179732089426368,-0.0037936410908296914,0.009961694447576663,0.006168074175713301,-0.005438981775187313,0.4244109725460019
110,2014-07-21,Will Boston Scientific (BSX) Surprise this Earnings Season? ,BSX,-0.009471182702169512,0.1948684228934372,0.01685393559422521,-0.031857020284215665,0.0015563815949917181,-0.013814225264026203,-0.01956359891859505,0.023904397304817637,0.12673285874859497
112,2014-07-24,"Boston Scientific Tops Q2 Earnings, Revenues; Ups EPS View ",BSX,0.018433161496169914,1.0922096253808928,0.013229577528969694,0.023904397304817637,-0.009471182702169512,0.01685393559422521,-0.031857020284215665,-0.011312260151992382,-0.2464780813776043
115,2014-07-24,"Earnings Scheduled For July 24, 2014",BSX,0.018433161496169914,1.0922096253808928,0.013229577528969694,0.023904397304817637,-0.009471182702169512,0.01685393559422521,-0.031857020284215665,-0.011312260151992382,-0.2464780813776043
118,2014-10-22,"Keep an Eye on These 7 Stocks for October 22, 2014",BSX,0.024106398029104747,2.068637224983067,0.03617571823547738,0.021108159501653567,-0.006986893016480256,0.0008741459133427831,-0.01038069505860606,0.03165587280709081,-0.4677844958856412
120,2014-10-22,"Keep an Eye on These 7 Stocks October 22nd, 2014",BSX,0.024106398029104747,2.068637224983067,0.03617571823547738,0.021108159501653567,-0.006986893016480256,0.0008741459133427831,-0.01038069505860606,0.03165587280709081,-0.4677844958856412
123,2014-10-22,"Keep an Eye on These 7 Stocks, October 22nd, 2014",BSX,0.024106398029104747,2.068637224983067,0.03617571823547738,0.021108159501653567,-0.006986893016480256,0.0008741459133427831,-0.01038069505860606,0.03165587280709081,-0.4677844958856412
125,2014-10-22,"Earnings Scheduled For October 22, 2014",BSX,0.024106398029104747,2.068637224983067,0.03617571823547738,0.021108159501653567,-0.006986893016480256,0.0008741459133427831,-0.01038069505860606,0.03165587280709081,-0.4677844958856412
128,2015-01-12,Biotechs Presenting at the J.P. Morgan Healthcare Conference: Day Two,BSX,-0.004778136289893098,-0.37313707144289243,0.0041123691099989035,0.039914499663223024,0.024087586007328188,-0.007965286532164773,0.04462936011123797,-0.005486963245862619,0.20093819131639967
130,2015-01-12,Biotechs Presenting At The J.P. Morgan Healthcare Conference: Day 2,BSX,-0.004778136289893098,-0.37313707144289243,0.0041123691099989035,0.039914499663223024,0.024087586007328188,-0.007965286532164773,0.04462936011123797,-0.005486963245862619,0.20093819131639967
136,2015-02-04,"Earnings Scheduled For February 4, 2015",BSX,0.02116043875008633,0.4617306394084848,0.0027378482404512017,-0.013504440058930811,-0.0026936000555892736,0.017820440449804797,-0.01017636505152364,0.01136364143452262,-0.24221519977017425
137,2015-02-04,"Keep an Eye on These 10 Stocks for February 4, 2015",BSX,0.02116043875008633,0.4617306394084848,0.0027378482404512017,-0.013504440058930811,-0.0026936000555892736,0.017820440449804797,-0.01017636505152364,0.01136364143452262,-0.24221519977017425
142,2015-02-18,Boston Scientific Corp Gains On Settlement With Johnson & Johnson,BSX,0.12398922733616136,4.565497904670023,-0.009345753933683865,0.016282209962338312,0.010973926491725239,-0.009510892716241282,0.01868515303305074,-0.013788941128793586,-0.6370822995778305
144,2015-02-18,Mid-Day Market Update: Angie's List Jumps On Upbeat Earnings; MedAssets Shares Tumble,BSX,0.12398922733616136,4.565497904670023,-0.009345753933683865,0.016282209962338312,0.010973926491725239,-0.009510892716241282,0.01868515303305074,-0.013788941128793586,-0.6370822995778305
145,2015-02-18,Sterne Agree On The Boston Scientific-Johnson & Johnson Litigation Settlement: How Much Will It Impact On 4Q14 GAAP Earnings?,BSX,0.12398922733616136,4.565497904670023,-0.009345753933683865,0.016282209962338312,0.010973926491725239,-0.009510892716241282,0.01868515303305074,-0.013788941128793586,-0.6370822995778305
147,2015-02-18,Sterne Agree Weighs In On Boston Scientific-Johnson & Johnson Litigation Settlement,BSX,0.12398922733616136,4.565497904670023,-0.009345753933683865,0.016282209962338312,0.010973926491725239,-0.009510892716241282,0.01868515303305074,-0.013788941128793586,-0.6370822995778305
149,2015-02-18,Stocks Hitting 52-Week Highs,BSX,0.12398922733616136,4.565497904670023,-0.009345753933683865,0.016282209962338312,0.010973926491725239,-0.009510892716241282,0.01868515303305074,-0.013788941128793586,-0.6370822995778305
153,2015-02-18,Morning Market Gainers,BSX,0.12398922733616136,4.565497904670023,-0.009345753933683865,0.016282209962338312,0.010973926491725239,-0.009510892716241282,0.01868515303305074,-0.013788941128793586,-0.6370822995778305
154,2015-02-18,Benzinga's Top #PreMarket Gainers,BSX,0.12398922733616136,4.565497904670023,-0.009345753933683865,0.016282209962338312,0.010973926491725239,-0.009510892716241282,0.01868515303305074,-0.013788941128793586,-0.6370822995778305
161,2015-02-18,Boston Scientific Soars 11% After Settling Dispute With Johnson & Johnson,BSX,0.12398922733616136,4.565497904670023,-0.009345753933683865,0.016282209962338312,0.010973926491725239,-0.009510892716241282,0.01868515303305074,-0.013788941128793586,-0.6370822995778305
166,2015-02-24,"Benzinga's M&A Chatter for Tuesday February 24, 2015",BSX,0.019006829150322258,1.1574732044898304,-0.009714623805865963,0.0012157172940741034,-0.013788941128793586,0.12398922733616136,-0.009345753933683865,0.01805049469987785,-0.27531401703183
169,2015-03-02,'Merger Monday' Lives Up To Its Name: At Least $20 Billon In Total Deals,BSX,0.009467446806133317,0.42546275794880883,0.0047562381187600256,-0.005910188003476091,0.01805049469987785,0.019006829150322258,-0.009714623805865963,-0.01758494996787363,-0.37038440748311574
170,2015-03-02,"'Merger Monday' Lives Up To Name: From NXP Semiconductors To eBay, There's At Least $20 Billon In Total Deals",BSX,0.009467446806133317,0.42546275794880883,0.0047562381187600256,-0.005910188003476091,0.01805049469987785,0.019006829150322258,-0.009714623805865963,-0.01758494996787363,-0.37038440748311574
174,2015-03-02,"Benzinga's M&A Chatter for Monday March 2, 2015",BSX,0.009467446806133317,0.42546275794880883,0.0047562381187600256,-0.005910188003476091,0.01805049469987785,0.019006829150322258,-0.009714623805865963,-0.01758494996787363,-0.37038440748311574
177,2015-04-28,"Earnings Scheduled For April 28, 2015",BSX,-0.012791965967298369,0.4427921024832244,-0.019629258852583154,-0.004343101160407259,0.0005431954896644164,0.005461517443281938,0.006596972422298064,-0.009014075910541375,-0.02386783745739729
180,2015-07-23,"Earnings Scheduled For July 23, 2015",BSX,-0.022752488179625274,0.6664970768063552,0.014639652338461984,-0.006711349972995273,-0.003344558054895752,-0.0005571157914646685,0.012408416603679973,-0.014196478781099198,-0.5570201279016207
183,2015-10-27,13 Stocks To Watch In The Healthcare Space,BSX,0.007185564455246318,0.3216786035824184,-0.001793112977746425,0.018879382734591887,-0.04479350982206842,0.0,0.006440316794081857,0.09393578789375634,1.8304662559222433
189,2015-10-28,"Earnings Scheduled For October 28, 2015",BSX,0.09393578789375634,1.8304662559222433,0.007185564455246318,-0.001793112977746425,0.018879382734591887,-0.04479350982206842,0.0,-0.011956484669322198,-0.5008135805085507
192,2016-04-27,"Earnings Scheduled For April 27, 2016",BSX,0.11173178242354553,2.8463786095558348,-0.002532889444796349,-0.0010121689034415793,0.00867790071310881,-0.0030534079952756477,-0.0010168000857191384,-0.0027409532944416837,-0.37487533579761745
195,2016-05-23,The Market In 5 Minutes: Merger Monday Mania,BSX,-0.0004470374835344737,-0.18228800450007032,0.00902123420167733,-0.005383617510298366,-0.0008963940337859411,-0.015880044514336666,0.014317659479304856,0.007602865458565589,0.7805294008054229
199,2016-07-28,"Earnings Scheduled For July 28, 2016",BSX,0.028740503362689518,1.262249718156323,-0.01334444123990075,0.011814294104779854,-0.00919729567946459,0.0,-0.014014845399016762,-0.0024650561037898866,-0.46264286155556933
202,2016-08-16,The Most Popular Stocks This 13F Season,BSX,-0.0041718179802108235,0.2891604697063339,0.0033486783486782468,0.0012572832577322224,-0.0008374602645671025,-0.011180143355219774,0.01130655223000443,0.0012567565245984458,-0.009448989375686279
205,2016-12-09,Wonderful Wearables Get Their Own ETF,BSX,0.0097039713570104,-0.2835778101453098,0.0,-0.009610709309153864,0.0048286038575782175,0.01769035362430449,0.012941773365210407,0.013455103019284431,0.16960955384442977
206,2017-02-02,"The Market In 5 Minutes: Facebook Beats, Trump Tweets",BSX,0.04757935478118824,0.4772296231976785,-0.004156291923916311,0.00880499291881831,-0.0008378909535184942,0.019214379226025313,-0.0067854049164459695,0.004780833866973033,-0.433238460586561
207,2017-04-27,"Earnings Scheduled For April 27, 2017",BSX,0.008086291774112686,0.2687159147248388,0.008935491230827486,0.00704226560785437,0.028157636299467548,-0.0063948778770890335,0.008464369058514665,0.007639375601965925,-0.24892536146932398
