,date,title,stock,close,volume,1_past_close,2_past_close,3_past_close,4_past_close,5_past_close,next_close,next_volume
208,2017-06-21,Non-Horrible Bosses: Meet The Best CEOs Of 2017,BSX,-0.0035701671064827245,0.8864544720329681,-0.008495567119227054,0.018018018018018056,0.0,-0.0025161644713188602,-0.0035816755442860115,-0.0017914452645610979,-0.2514078709040013
209,2017-07-14,FDA's 60-Day Extension For Medical Device Defects Not Likely Obstructive To Public Health,BSX,0.006886572417789338,-0.17986021965482812,-0.008267417137287736,0.010533926659848758,-0.0010884898359285744,-0.0010873753707715261,0.010252680048371543,-0.003239746233381302,0.18226086956521748
210,2017-07-27,"Earnings Scheduled For July 27, 2017",BSX,-0.013493830714949029,2.0552664514854095,-0.005801299777183244,-0.0014482590264994766,0.0,-0.003966776228589097,-0.007160786278344267,-0.0014787064438770425,-0.6283040834806606
211,2017-10-20,Benzinga's Option Alert Recap From October 20,BSX,0.004058195484337501,0.8171993206731512,0.001693741066572274,0.004081661251375213,0.008230444868793985,-0.009510892716241282,0.00033979710425202647,-0.002694507317852257,-0.04511469838572646
212,2017-10-26,"Earnings Scheduled For October 26, 2017",BSX,-0.02668020598591825,0.5757841405716202,-0.006375793005816366,0.006416704586036381,-0.002694507317852257,0.004058195484337501,0.001693741066572274,-0.01110338994492377,-0.15942633680214668
213,2018-02-01,"Earnings Scheduled For February 1, 2018",BSX,-0.0118025727650799,0.35232623567388277,-0.002497381393436915,-0.010589454213500105,-0.00316678931549208,0.00566170722279713,0.012540321869696447,-0.008686202620626693,-0.2878270263957019
214,2018-04-25,"Earnings Scheduled For April 25, 2018",BSX,0.032280704431366436,0.9066197825408635,-0.01110338994492377,-0.0006934971448631089,-0.0017306762934187203,-0.001727752020955764,0.0027720000697906144,0.0010197378167133841,-0.566654707278232
215,2018-05-08,"Benzinga's Daily Biotech Pulse: Valeant Earnings, Lipocine's FDA Watch, Invivo CFO Departure",BSX,-0.003674035016346555,-0.015309770004708012,0.01319801377551122,0.004077435631683057,0.005466342497773002,-0.007123442596116303,0.026462404145269014,0.0,-0.2902728834268917
216,2018-05-22,"Benzinga's Daily Biotech Pulse: Melinta, Ardelyx Pull Back On Offerings, Insys Awaits FDA Verdict",BSX,-0.012398015187473743,0.052827826086956575,0.006568106751387637,0.0042876342158217895,0.011678358007628287,0.011816288460650526,-0.00803750054294916,0.006276796294538922,-0.38417115974204463
217,2018-07-25,"Earnings Scheduled For July 25, 2018",BSX,0.02234137643187517,0.30401583710407243,-0.00415305231239016,-0.0017767655456818465,0.001482776846100764,-0.0005927817655217993,-0.006185539904372983,0.0002914375384444057,-0.4721735648866423
218,2018-07-25,A Peek Into The Markets: US Stock Futures Flat Ahead Of Earnings,BSX,0.02234137643187517,0.30401583710407243,-0.00415305231239016,-0.0017767655456818465,0.001482776846100764,-0.0005927817655217993,-0.006185539904372983,0.0002914375384444057,-0.4721735648866423
219,2018-09-07,"The Daily Biotech Pulse: Amgen-AstraZeneca, Boston Scientific Opens Walle, Advaxis Offering",BSX,-0.0038900582888682367,-0.10341744486389826,0.006713333663406873,-0.008321754324813968,0.013779466952933417,0.0045197695060872345,-0.003939206135115003,-0.0002788932206070349,-0.16560664819944604
220,2018-09-14,"The Daily Biotech Pulse: FDA Nod For STAAR, Supernus Opens Wallet, Principia Biopharma To Debut",BSX,-0.006113757277153797,-0.4334903192046049,0.032382007399717416,0.008301030496045803,0.008370514391275341,-0.0002788932206070349,-0.0038900582888682367,-0.0032093857674142523,-0.24187449966130914
221,2018-09-19,"The Daily Biotech Pulse: Johnson & Johnson's Generic Unit Files NDA For Urinary Tract Cancer Drug, G1 Therapeutics Prices Offering",BSX,-0.003455535808316812,-0.20771914224152677,0.009390889987182405,-0.0032093857674142523,-0.006113757277153797,0.032382007399717416,0.008301030496045803,0.008802293987278276,0.02352636463706803
222,2018-09-25,"The Daily Biotech Pulse: Syndax Lung Cancer Trial Disappoints, Gemphire To Trim Workforce, Opiant's Offering",BSX,0.0054687259408343625,0.2635737439222041,0.01667993276356272,-0.0013220316621892492,0.008802293987278276,-0.003455535808316812,0.009390889987182405,0.0005180123659027647,-0.032937080556128207
223,2018-09-27,"The Daily Biotech Pulse: Hologic Goes Shopping, Johnson & Johnson Snaps Ties With Geron",BSX,-0.007507142311903969,-0.3035219440562753,0.0005180123659027647,0.0054687259408343625,0.01667993276356272,-0.0013220316621892492,0.008802293987278276,0.0041731832753086895,0.10224103924369166
224,2018-10-03,"The Daily Biotech Pulse: Endologix's Q3 Sales, Obseva's Positive Trial Results, Kala To Offer Shares",BSX,-0.011014351821000079,-0.02219364199973617,0.0015392861466301255,0.01246752057756706,0.0041731832753086895,-0.007507142311903969,0.0005180123659027647,-0.01579903135738403,0.08950794239654658
225,2018-10-16,Surverying The Q3 Earnings Heat Map,BSX,0.046115846585296216,0.587359953044349,-0.015139263257103686,0.02750004662407779,-0.0030462644279222184,-0.034750046574792415,0.002949078085831891,-0.0028863974964535855,0.012680666876923485
226,2018-10-24,"Earnings Scheduled For October 24, 2018",BSX,-0.009714085095173686,0.15011726485430876,-0.016111419164302143,0.002189327157992249,-0.026378840819884508,-0.012368453176398009,-0.0028863974964535855,0.019899077309415425,-0.28788155295125806
227,2019-02-12,"The Daily Biotech Pulse: NASH Disappointment For Gilead, Xeris To Offer Shares",BSX,0.01857032604258113,0.28505648750427937,0.0030620758047243957,0.008751613022954796,0.0020633999332697606,0.02701987967585895,-0.004745591978052799,-0.010989071711924425,-0.1692619183994245
228,2019-02-13,"The Daily Biotech Pulse: Exelixis Q4 Results, FDA Panel Greenlights J&J's Depression Drug, MacroGenics Prices Offering",BSX,-0.010989071711924425,-0.1692619183994245,0.01857032604258113,0.0030620758047243957,0.008751613022954796,0.0020633999332697606,0.02701987967585895,0.008080800685720702,-0.16568322483404418
229,2019-04-16,"FDA Determines Boston Scientific Hasn't Showed Reasonable Assurance Of Safety, Effectiveness For Surgical Meshes",BSX,-0.04337485175295974,5.429519330223844,0.002120377207138091,-0.005010512549670554,-0.011470345005352156,0.003925713935435837,0.0015726751295948027,-0.03483545439089919,-0.5134479670971757
230,2019-04-24,"Earnings Scheduled For April 24, 2019",BSX,-0.012538332978329403,0.4318509442121954,0.02748351205512045,-0.005126753120098582,0.005729039353011611,-0.03483545439089919,-0.04337485175295974,0.04204293838047368,-0.3350330975812338
231,2019-05-17,"Q1 13F Roundup: How Buffett, Einhorn, Ackman And Others Adjusted Their Portfolios",BSX,-0.007974461604949301,-0.26893636315143754,0.014836774793320018,0.008433117177522487,0.021962665388384206,-0.016675794964933544,-0.013218178252047408,-0.00080382581838645,-0.07821820105434052
232,2019-07-24,"The Daily Biotech Pulse: Jounce Jumps On Licensing Deal, Regulus Hit With Partial Clinical Hold, Genomic Health Added to S&P SmallCap Index",BSX,-0.0002332587682211118,0.23193493651629504,0.008941201602711502,0.00591715976331364,-0.009146327280274646,0.009469642407366585,0.009077904027102734,-0.020060663209206075,-0.26271669437188316
233,2019-07-24,"Earnings Scheduled For July 24, 2019",BSX,-0.0002332587682211118,0.23193493651629504,0.008941201602711502,0.00591715976331364,-0.009146327280274646,0.009469642407366585,0.009077904027102734,-0.020060663209206075,-0.26271669437188316
234,2019-10-21,Earnings Season Kicks Into Full Gear In Round 3 Of The WeTrader Competition,BSX,0.004678978410817214,-0.18844947471846418,0.007859655911691688,-0.00026197318361764754,-0.007280259645401799,0.012904868264854263,-0.006800897845838483,-0.01216044507497438,0.1300217692459924
235,2019-10-23,"Earnings Scheduled For October 23, 2019",BSX,0.05002618732701225,1.18984238178634,-0.01216044507497438,0.004678978410817214,0.007859655911691688,-0.00026197318361764754,-0.007280259645401799,0.011224763313212538,-0.4953191449324451
236,2019-12-10,Stocks That Hit 52-Week Highs On Tuesday,BSX,0.006863400671337949,-0.4148863065262208,-0.008393891361441863,0.018955236739186754,0.005812601947367213,0.009387413880591833,-0.0025749205807197306,-0.004317169596800952,0.024435563034637564
237,2019-12-12,Stocks That Hit 52-Week Highs On Thursday,BSX,0.019397500685548685,0.20172136477191072,-0.004317169596800952,0.006863400671337949,-0.008393891361441863,0.018955236739186754,0.005812601947367213,0.00940232820368836,0.07345758995315466
238,2019-12-13,"The Daily Biotech Pulse: Second Time's The Charm For Sarepta, Pfizer's Xeljanz Snags Third Approval, NewLink Genetics Rejects Competing Offer",BSX,0.00940232820368836,0.07345758995315466,0.019397500685548685,-0.004317169596800952,0.006863400671337949,-0.008393891361441863,0.018955236739186754,0.0024395788418565267,0.13664942300039784
239,2019-12-13,Stocks That Hit 52-Week Highs On Friday,BSX,0.00940232820368836,0.07345758995315466,0.019397500685548685,-0.004317169596800952,0.006863400671337949,-0.008393891361441863,0.018955236739186754,0.0024395788418565267,0.13664942300039784
240,2019-12-16,Stocks That Hit 52-Week Highs On Tuesday,BSX,0.0024395788418565267,0.13664942300039784,0.00940232820368836,0.019397500685548685,-0.004317169596800952,0.006863400671337949,-0.008393891361441863,-0.009955768923535446,0.06305139336227428
241,2019-12-17,"The Daily Biotech Pulse: Roche Gets US Antitrust Clearance For Spark Purchase, An Orphan Drug Designation For Prevail, Dynavax Names CEO",BSX,-0.009955768923535446,0.06305139336227428,0.0024395788418565267,0.00940232820368836,0.019397500685548685,-0.004317169596800952,0.006863400671337949,-0.00022342617951287558,-0.45852132389263955
242,2019-12-20,Stocks That Hit 52-Week Highs On Friday,BSX,0.012045440079728298,1.0676439395040025,0.002011626044064352,-0.00022342617951287558,-0.009955768923535446,0.0024395788418565267,0.00940232820368836,-0.003306099067950985,-0.6443106283112466
243,2020-02-05,"The Daily Biotech Pulse: Merck Spins Off Slow-Growth Businesses, ZioPharm Announces Offering, PhaseBio Data",BSX,-0.006063482503590789,0.44937048684542136,0.015391937791256805,0.008598056353839922,-0.03547571805898431,-0.012286710037618387,0.011507479659850217,0.00915061941394546,-0.4712219609740609
244,2020-02-05,"10 Stocks To Watch For February 5, 2020",BSX,-0.006063482503590789,0.44937048684542136,0.015391937791256805,0.008598056353839922,-0.03547571805898431,-0.012286710037618387,0.011507479659850217,0.00915061941394546,-0.4712219609740609
245,2020-02-05,"Earnings Scheduled For February 5, 2020",BSX,-0.006063482503590789,0.44937048684542136,0.015391937791256805,0.008598056353839922,-0.03547571805898431,-0.012286710037618387,0.011507479659850217,0.00915061941394546,-0.4712219609740609
246,2020-03-11,Stocks That Hit 52-Week Lows On Wednesday,BSX,-0.037521309931029645,0.5041055323731323,0.031974190311206074,-0.0933510229780734,0.003737303605713782,-0.033290346207157206,0.04082730261759138,-0.08446546245711561,0.1706391822285862
247,2020-03-12,Stocks That Hit 52-Week Lows On Thursday,BSX,-0.08446546245711561,0.1706391822285862,-0.037521309931029645,0.031974190311206074,-0.0933510229780734,0.003737303605713782,-0.033290346207157206,0.04290328487273176,-0.2601113598042921
248,2020-03-13,"The Daily Biotech Pulse: Roche Obtains FDA Emergency Use Authorization For COVID-19 Test, Chembio Appoints New CEO, Inovio Slumps On Earnings",BSX,0.04290328487273176,-0.2601113598042921,-0.08446546245711561,-0.037521309931029645,0.031974190311206074,-0.0933510229780734,0.003737303605713782,-0.14785036570590893,-0.010837557187056923
249,2020-03-16,Stocks That Hit 52-Week Lows On Monday,BSX,-0.14785036570590893,-0.010837557187056923,0.04290328487273176,-0.08446546245711561,-0.037521309931029645,0.031974190311206074,-0.0933510229780734,0.04500913658098149,0.05020281915727054
250,2020-03-17,"The Daily Biotech Pulse: Setback For DBV In Peanut Allergy Patch Review, Roche Starts Coronavirus Test Shipment, Regeneron Aims For 'Cocktail' COVID-19 Treatment",BSX,0.04500913658098149,0.05020281915727054,-0.14785036570590893,0.04290328487273176,-0.08446546245711561,-0.037521309931029645,0.031974190311206074,-0.05383817628061327,0.0038845788298742523
251,2020-03-19,"The Daily Biotech Pulse: Pfizer's Eczema Drug Aces Latestage Study, Orphan Drug Designation For Dicerna, Dyadic's COVID-19 Connection",BSX,0.037812066640969366,-0.33460850419705523,-0.05383817628061327,0.04500913658098149,-0.14785036570590893,0.04290328487273176,-0.08446546245711561,-0.03643440643675844,-0.07160524465400997
252,2020-03-23,Stocks That Hit 52-Week Lows On Monday,BSX,-0.051762109370760534,0.5317342219925332,-0.03643440643675844,0.037812066640969366,-0.05383817628061327,0.04500913658098149,-0.14785036570590893,0.09252804478156285,-0.025461737587621047
253,2020-04-29,"Earnings Scheduled For April 29, 2020",BSX,0.04174784267351983,0.4091293604327597,-0.02891891067092478,0.0027099856364765085,0.013736263160442963,0.025641020128895686,0.01255356493534543,0.0013358064828450367,-0.11981137291763755
254,2020-04-29,"The Daily Biotech Pulse: Inovio's MERS Vaccine Data, Fast Track Designation For Erytech, FDA Approves Higher Dose Of Merck's Keytruda",BSX,0.04174784267351983,0.4091293604327597,-0.02891891067092478,0.0027099856364765085,0.013736263160442963,0.025641020128895686,0.01255356493534543,0.0013358064828450367,-0.11981137291763755
255,2020-05-21,"The Daily Biotech Pulse: Mixed Filgotinib Readout For Gilead-Galapagos, Akorn To File For Chapter 11, D-Day For Aquestive",BSX,-0.06428185503042416,1.2643974412849603,0.04939316920480952,-0.027182809268059938,0.045650193921981774,-0.018873187857614382,-0.00754823747018063,0.03219312740474489,0.1722924906075889
256,2020-07-15,"Q2 Health Sector Earnings: As Industry Focuses On Pandemic, Will Vital Procedures Make A Comeback?",BSX,0.042021564194789196,-0.06815221252911219,0.022648159846011984,-0.006920463562711587,0.0052174001500227,-0.0014471559526668676,-0.002598156875683544,-0.008991875318649312,-0.006280049986232661
257,2020-07-29,"The Daily Biotech Pulse: Merck's Breakthrough Therapy Designation, Sonoma Surges On Sanitizer News, Sanofi-Glaxo And More",BSX,0.040240420619460204,0.8528193285599899,-0.0020859979019661745,-0.006476684193850724,0.00442357969282714,0.0010419618693229271,0.02427961202044915,-0.021853873814878244,-0.5427368895736645
258,2020-07-29,"Earnings Scheduled For July 29, 2020",BSX,0.040240420619460204,0.8528193285599899,-0.0020859979019661745,-0.006476684193850724,0.00442357969282714,0.0010419618693229271,0.02427961202044915,-0.021853873814878244,-0.5427368895736645
259,2020-10-09,"FuboTV Uplisting, Kronos Bio Highlight This Week's IPOs",BSX,0.01605328931184813,0.34259589652096345,0.007715315354317687,0.021611961214045516,0.0022935817721250196,0.019750575500820267,0.001561722440151403,0.02017505696083055,0.27741603268994375
260,2020-10-28,"Earnings Scheduled For October 28, 2020",BSX,-0.05492370552398862,0.4862648049594027,-0.021975077587587988,-0.008339993916188781,0.008410134385800738,-0.0078062154405385,-0.01038890197488318,-0.01673025241942727,0.5449680351056958
261,2020-10-28,"The Daily Biotech Pulse: Sanofi-GlaxoSmithKline To Supply 200M Doses To COVID-19 Vaccine Alliance, Gilead Earnings, Biodesix Debuts",BSX,-0.05492370552398862,0.4862648049594027,-0.021975077587587988,-0.008339993916188781,0.008410134385800738,-0.0078062154405385,-0.01038890197488318,-0.01673025241942727,0.5449680351056958
262,2021-01-12,33 Blue Chip Companies That Are Suspending Campaign Donations After Capitol Insurrection,BSX,-0.03046094504626895,1.7165861959243527,-0.008435411518122882,0.005196898784795678,-0.005440613639120739,0.014348692576782618,0.027502160706369017,0.02066231260692053,-0.493682618415893
263,2021-01-21,"The Daily Biotech Pulse: Addex Jumps On Positive Data For Out-Licensed Drug, COVID-19 Vaccine Developer Inovio Announces $150M Follow-On Offering, Boston Scientific Goes Shopping",BSX,0.023458827439473362,0.5999501168316312,0.010752671208333453,-0.001651565380316744,0.004701382310839275,0.002773113430748708,0.02066231260692053,-0.01305974606845739,-0.39239093870250485
264,2021-01-27,"Earnings Triple Crown After Close As Facebook, Apple, Tesla Prepare To Report",BSX,-0.022379904707528042,1.5783358320839582,-0.003806400062395965,-0.006751282966279026,-0.01305974606845739,0.023458827439473362,0.010752671208333453,0.014517042495642674,0.0899575784006661
265,2021-02-03,"The Daily Biotech Pulse: Amgen Earnings, GSK-CureVac Vaccine Collaboration, Mallinckrodt FDA Decision",BSX,0.02210702474847359,0.3371059402528074,0.019193285453843467,0.014390580022373589,-0.024766139848648727,0.014517042495642674,-0.022379904707528042,0.03497990739402401,-0.03873729138691728
266,2021-03-03,"The Daily Biotech Pulse: KemPharm ADHD Drug Gets The Nod, MediciNova Shelves Vaccine Study",BSX,0.0015480231137596778,0.0993321790749444,-0.0035990539551152834,0.0030944494677522805,-0.022435075138096505,0.0035415986332323346,0.0201290007560484,-0.022926311093379503,0.2770853020144295
267,2021-03-18,"The Daily Biotech Pulse: Translate Bio's Cystic Fibrosis Study Disappoints, Adverum Nominates Directors, Gain Therapeutics To Debut On Nasdaq",BSX,-0.01774697588607088,0.2526554248679789,0.0005146798108475181,-0.013705606462290576,0.014157093265375176,0.0051745650801144905,-0.01753936512538612,-0.0005237093082711697,0.477226726708744
268,2021-04-23,Stocks That Hit 52-Week Highs On Friday,BSX,0.003758511828966693,-0.17584218714900202,0.006145079486982397,0.028689527705617834,0.006115459722798144,-0.0007332872013875447,0.0012236719606870672,-0.010765248991354892,0.12820771669123143
269,2021-04-23,"The Daily Biotech Pulse: Quidel Slides On Negative Pre-Announcement, Roche Gets Positive EMA Committee Recommendation, 3 IPOs",BSX,0.003758511828966693,-0.17584218714900202,0.006145079486982397,0.028689527705617834,0.006115459722798144,-0.0007332872013875447,0.0012236719606870672,-0.010765248991354892,0.12820771669123143
270,2021-04-28,"The Daily Biotech Pulse: FDA Rejection For Protalix, Amgen Q1 Trail Estimates, Pfizer Goes Shopping",BSX,0.04315024375474863,0.9150795162365488,0.0033120271618716224,-0.010765248991354892,0.003758511828966693,0.006145079486982397,0.028689527705617834,-0.003164629272919939,-0.4523501696895862
271,2021-04-28,"Earnings Scheduled For April 28, 2021",BSX,0.04315024375474863,0.9150795162365488,0.0033120271618716224,-0.010765248991354892,0.003758511828966693,0.006145079486982397,0.028689527705617834,-0.003164629272919939,-0.4523501696895862
272,2021-04-28,Stocks That Hit 52-Week Highs On Wednesday,BSX,0.04315024375474863,0.9150795162365488,0.0033120271618716224,-0.010765248991354892,0.003758511828966693,0.006145079486982397,0.028689527705617834,-0.003164629272919939,-0.4523501696895862
273,2021-04-29,"The Daily Biotech Pulse: Clinical Setback For Adverum, Galera Posts Data Readout, Moderna To Invest In Vaccine Manufacturing, Decision Day For Ardelyx",BSX,-0.003164629272919939,-0.4523501696895862,0.04315024375474863,0.0033120271618716224,-0.010765248991354892,0.003758511828966693,0.006145079486982397,-0.011337868873020795,0.4352548605672648
274,2021-07-27,"Earnings Scheduled For July 27, 2021",BSX,0.03502381301060731,1.390147983659078,-0.003399766881527322,0.013088397354991343,-0.0006884486630003295,0.018462278537616728,0.03783656052901341,-0.0017578118942617182,-0.42071034453412004
275,2021-07-27,"The Daily Biotech Pulse: ObsEva Surges On Out-Licensing Deal, EyeGate Appoints New CEO, 2 Positive Catalysts For Merck, Candel Therapeutics Debuts",BSX,0.03502381301060731,1.390147983659078,-0.003399766881527322,0.013088397354991343,-0.0006884486630003295,0.018462278537616728,0.03783656052901341,-0.0017578118942617182,-0.42071034453412004
276,2021-07-27,Stocks That Hit 52-Week Highs On Tuesday,BSX,0.03502381301060731,1.390147983659078,-0.003399766881527322,0.013088397354991343,-0.0006884486630003295,0.018462278537616728,0.03783656052901341,-0.0017578118942617182,-0.42071034453412004
277,2021-07-28,"The Daily Biotech Pulse: Pfizer, Bristol-Myers Squibb Earnings, Amgen Goes Shopping, GlaxoSmithKline-Vir's COVID-19 Antibody Treatment Supply Deal",BSX,-0.0017578118942617182,-0.42071034453412004,0.03502381301060731,-0.003399766881527322,0.013088397354991343,-0.0006884486630003295,0.018462278537616728,-0.002421320924777315,-0.3616018413094845
278,2021-09-21,"The Daily Biotech Pulse: Aprea Jumps On ESMO Presentation, Verrica Sinks On Regulatory Setback, Aerie CEO Quits, J&J Touts Positive COVID-19 Booster Shot Data",BSX,-0.006416104106621301,-0.16255402386962903,-0.016452548113805365,-0.011804066280235337,-0.0024438302545253254,0.003567443764896261,0.014476349307892544,0.021909611383000183,0.4119345980240523
279,2021-10-27,"Earnings Scheduled For October 27, 2021",BSX,-0.013312277902763459,0.31580928009633835,-0.003821127831623805,-0.007805496720117544,-0.0006685709830841491,0.008994776258189452,0.007704512675245523,-0.011205073608479443,-0.18029458029458034
280,2022-04-22,Goldman Sachs And 3 Other Stocks Insiders Are Selling,BSX,-0.05204059114543802,0.4245758086922009,-0.016772762769071803,0.03018366615425805,0.0452674775092905,-0.01152538579736051,-0.004051323518780459,0.01571750803476024,-0.10066605720255972
281,2022-04-27,"Earnings Scheduled For April 27, 2022",BSX,0.01079819050813735,0.030378716657078364,-0.04462887803671156,0.01571750803476024,-0.05204059114543802,-0.016772762769071803,0.03018366615425805,-0.007663767313750736,-0.41782873951410826
282,2022-06-10,Stocks That Hit 52-Week Lows On Friday,BSX,-0.01948911389719188,0.8864674209378407,-0.029148539295770437,-0.011874714475994752,0.00507873939854675,-0.013279849193766458,-0.01868695244037455,-0.022025240529319756,0.3652597255968133
283,2022-06-14,Stocks That Hit 52-Week Lows On Tuesday,BSX,-0.032133978957664566,-0.16540303800148193,-0.022025240529319756,-0.01948911389719188,-0.029148539295770437,-0.011874714475994752,0.00507873939854675,0.022417623813928422,0.0739669126681517
284,2022-07-19,Accenture And 3 Other Stocks Insiders Are Selling,BSX,0.01452787038279979,0.8497696023095287,-0.010119868863810444,0.02288205321539194,-0.0016318023536588955,-0.0029826628841034264,-0.016795448723235684,-0.011402819295024513,0.08728840689903561
285,2022-07-20,Apple Stock To Jump 20%? Plus This Analyst's Amazon Stock Price Forecast,BSX,-0.011402819295024513,0.08728840689903561,0.01452787038279979,-0.010119868863810444,0.02288205321539194,-0.0016318023536588955,-0.0029826628841034264,0.02253219367202286,0.08709894093723825
286,2022-07-26,"Tuesday's Market Minute: Tech Heavyweight Earnings On Deck: GOOGL, MSFT, META, AMZN, AAPL",BSX,-0.0010526556717721514,0.7022133757961784,-0.003147925898402737,0.0,0.02253219367202286,-0.011402819295024513,0.01452787038279979,0.06190733260000569,0.7622802832580287
287,2022-07-27,"Earnings Scheduled For July 27, 2022",BSX,0.06190733260000569,0.7622802832580287,-0.0010526556717721514,-0.003147925898402737,0.0,0.02253219367202286,-0.011402819295024513,0.02108654044066327,-0.518605416538384
288,2022-09-23,Why Jim Cramer Says He Likes This Stock Over Medtronic,BSX,-0.010178059006281992,0.32643315496620984,-0.011569393961053831,-0.016571901523255828,-0.018212724488633203,-0.0124700347302108,-0.011848341018019792,-0.013881771062864812,-0.17653771356016645
289,2022-10-26,Big Tech Misses,BSX,0.011864447639676756,0.7639964382821072,0.007808679804752305,0.010105985962440611,0.008451408313612685,-0.017822254847487562,-0.0029211962325501606,-0.005025103610242554,-0.6574799778257518
290,2022-11-22,"Scotts Miracle-Gro, Walgreens Boots Alliance And 2 Other Stocks Insiders Are Selling",BSX,0.013973039310838598,0.2981480574200186,-0.0004655600137314364,0.018009438573296066,-0.018147947594331026,0.01320135307551662,0.0042612803817732026,0.008038549994524136,-0.3840129828467911
291,2023-01-19,"Clearmind Teams With Yissum, University of Jerusalem On 2 Psychedelic R&D Projects",BSX,0.008205786884734056,0.1481323697223278,-0.02063424726429708,-0.010530794683526912,-0.0038535711561513697,0.019646314870149117,-0.005427702834263637,,
