,date,title,stock,close,volume,1_past_close,2_past_close,3_past_close,4_past_close,5_past_close,next_close,next_volume
509,2022-05-18,A Big Earnings Miss By Target May Take Yesterday's Rally Off Course,DKS,-0.14220828960188991,2.241588242877401,0.02289817068480926,0.0005535258457574077,0.010061534453063237,0.030173807551858944,-0.033288802701066045,-0.0007563807402685141,-0.5741499304036588
510,2022-05-19,Weak Housing Data Raises Profit Margin Concerns Causing Stocks To Plunge,DKS,-0.0007563807402685141,-0.5741499304036588,-0.14220828960188991,0.02289817068480926,0.0005535258457574077,0.010061534453063237,0.030173807551858944,-0.021953120428543582,-0.014537417507159756
511,2022-05-20,"Top-Down Or Bottom-Up, Finding Diamonds In The Rough Takes Time",DKS,-0.021953120428543582,-0.014537417507159756,-0.0007563807402685141,-0.14220828960188991,0.02289817068480926,0.0005535258457574077,0.010061534453063237,-0.029024851970811505,0.30388223773572975
512,2022-05-23,"After A Brief Detour Into Bear Country, The S&P 500 Appears To Be Heading Higher On Monday",DKS,-0.029024851970811505,0.30388223773572975,-0.021953120428543582,-0.0007563807402685141,-0.14220828960188991,0.02289817068480926,0.0005535258457574077,-0.053540564862460616,0.4982678004699954
513,2022-05-23,Cboe's Weekly Market Recap: May 16th to May 20th,DKS,-0.029024851970811505,0.30388223773572975,-0.021953120428543582,-0.0007563807402685141,-0.14220828960188991,0.02289817068480926,0.0005535258457574077,-0.053540564862460616,0.4982678004699954
514,2022-05-24,The Shakeout In Financials May Have Set The Sector Up For Success,DKS,-0.053540564862460616,0.4982678004699954,-0.029024851970811505,-0.021953120428543582,-0.0007563807402685141,-0.14220828960188991,0.02289817068480926,0.0968557890780617,5.228138542138283
515,2022-05-25,"China's Lockdowns Hurting Apple, Airbnb, Starbucks, And Many More",DKS,0.0968557890780617,5.228138542138283,-0.053540564862460616,-0.029024851970811505,-0.021953120428543582,-0.0007563807402685141,-0.14220828960188991,0.08241616613670932,-0.8620593863017397
516,2022-05-25,Stocks That Hit 52-Week Lows On Wednesday,DKS,0.0968557890780617,5.228138542138283,-0.053540564862460616,-0.029024851970811505,-0.021953120428543582,-0.0007563807402685141,-0.14220828960188991,0.08241616613670932,-0.8620593863017397
517,2022-06-22,Telsey Advisory Cuts Nike Price Target - Read Why,DKS,0.003452820321132144,-0.25136182060283263,0.019910568817328667,0.0302818399019793,-0.04082453157412913,0.009049284651228229,0.00638837203400211,0.030307007380399265,-0.09742097178429943
518,2022-06-24,"The Companies Paying For Abortion Travel: Tesla, Zillow And Many More",DKS,0.08400776637965701,2.244983876746686,0.030307007380399265,0.003452820321132144,0.019910568817328667,0.0302818399019793,-0.04082453157412913,-0.04491063509522575,-0.3542937587986861
519,2022-08-16,The S&P 500 May Be Breaking Away From The Suppression Of A Strong Dollar,DKS,0.05045152115247875,1.440610859728507,0.0017716451100737718,0.02026452700551218,0.030793405782863825,0.039449555195639086,-0.03501885387895154,-0.00522818687077975,-0.20852838933951334
520,2022-08-17,Mixed Earnings Reports From Lowe's And Target Keep Retailers In The Forefront,DKS,-0.00522818687077975,-0.20852838933951334,0.05045152115247875,0.0017716451100737718,0.02026452700551218,0.030793405782863825,0.039449555195639086,0.001870683628378167,-0.4578355586788475
521,2022-08-19,Apple To $185? Here Are 5 Other Price Target Changes For Friday,DKS,-0.012625614831057286,0.27327716569453453,0.001870683628378167,-0.00522818687077975,0.05045152115247875,0.0017716451100737718,0.02026452700551218,-0.006123397222352112,1.0861045130641331
522,2022-08-23,Equity Index Futures Trim Overnight Gains As Bulls Try To Charge,DKS,0.006976584695470134,1.2555813102354518,-0.006123397222352112,-0.012625614831057286,0.001870683628378167,-0.00522818687077975,0.05045152115247875,-0.027712857294922566,-0.6295995817332829
523,2022-09-26,Macy's Ramps Up Hiring For Seasonal Positions Targeting Upcoming Holiday Season,DKS,-0.021252128952985228,-0.09453268173488083,-0.01943114870483753,-0.017613485087562775,-0.02857650833416714,-0.021304558733695078,0.02167675916648948,0.08147496021961809,1.6871310507674142
524,2022-10-03,Why F45 Training  Shares Climbed 41%; Here Are 84 Biggest Movers From Friday,DKS,0.04950304777657277,-0.596455351056578,-0.07357236709116632,-0.032465303530716194,0.05580173972419544,0.08147496021961809,-0.021252128952985228,0.0021854505255511913,-0.07836189848384967
525,2022-10-03,"Nike, Lululemon, Dick's Sporting Goods And Other Big Losers From Friday",DKS,0.04950304777657277,-0.596455351056578,-0.07357236709116632,-0.032465303530716194,0.05580173972419544,0.08147496021961809,-0.021252128952985228,0.0021854505255511913,-0.07836189848384967
526,2022-10-18,2 Equity REITs Touting Double-Digit Yields To Fight Inflation,DKS,0.012700681495033006,-0.001716410794316725,0.0024554049001472844,-0.02066252050063133,0.004922486135098714,0.012597491197506194,0.006384549095705072,-0.02257457024575471,-0.045754131244627017
527,2022-11-25,Friday Market Wrap: S&P 500 Gains This Week Following Dovish Fed Minutes,DKS,0.022776925438245277,-0.4323831704723812,0.010360064037410632,0.10117816181079453,-0.019708400800412917,0.06522793446468467,0.034131178605344425,-0.022269690361351957,0.4144144144144144
528,2023-02-24,Dick's Sporting To Acquire E-Commerce Retailer Moosejaw From Walmart For Undisclosed Terms,DKS,-0.013003952592533063,-0.2934230723816271,0.005026674953369392,-0.0025454553211500253,-0.0039186096419800975,0.0010768992062284433,-0.011330908586191568,0.011616055542909232,0.8795120320855614
529,2023-03-07,US Stocks Listless As Jerome Powell Heads To Capitol Hill: Analyst Sees Potential For Double-Digit Returns Despite Challenging Rate Outlook,DKS,0.1108671185573602,3.0947536759806313,0.0002271208323529894,0.02007577006764416,0.0063717551169710784,0.00046647114015141433,-0.008708336870516087,,
530,2023-03-07,Investor Optimism Declines Ahead Of Fed Chair Powell's Testimony,DKS,0.1108671185573602,3.0947536759806313,0.0002271208323529894,0.02007577006764416,0.0063717551169710784,0.00046647114015141433,-0.008708336870516087,,
