,date,title,stock,close,volume,1_past_close,2_past_close,3_past_close,4_past_close,5_past_close,next_close,next_volume
0,2010-06-02,"Mad Money Lightning Round: Jim Believes DNDN Is A Winner, Backs F",DKS,0.0053879468545841025,0.16598453842655747,-0.02350025413899015,-0.005580678347346435,0.04065340286343222,-0.004337108656894628,,0.043944128649598735,0.29712688507540297
1,2010-08-19,Before The Bell – What To Expect In The Market Today,DKS,-0.027452409772373843,0.9429723796395568,0.014105556793285734,0.003725701814278004,-0.014684243612637315,0.0036844269346139047,-0.009127356393856756,-0.0037638412436897806,-0.4973329479465013
2,2010-09-14,"Cramer Sets Rules For New Bullish Market (BA, HON, LVS, WYNN, BUCY, JOYG, APD, ARG, CAT, DE, WHR, INTC, KO, PEP, ETP, WMT, FE, SYK, UA, LULU, DKS, LTD, PBCT, CHK, ARNA, CLNE)",DKS,0.02377309072146061,0.46965002868617334,0.028726790945759584,0.0007773882603017146,-0.0007767843972305011,-0.006172952180717006,-0.01482320883558974,-0.0014742048392376583,-0.44472204871955023
3,2010-10-22,"Mad Money Lightning Round: Cramer Prefers Nike Over Dicks Sporting Goods (XLNX, PPO, DKS, NKE, ATVI, ERTS, SNDK)",DKS,0.005181105086795812,0.19094804499196583,0.0,0.005557847090545076,-0.018745715318138734,-0.004749164778876436,0.012015141484785552,0.004467452765382296,0.028671014166854025
4,2010-11-16,News Summary,DKS,0.11998677006109526,4.421459117891109,0.016649475142992642,-0.04788085390927377,0.0003235454164451923,0.0,-0.004189506746869243,-0.005371177957923412,-0.7363488662318397
5,2010-12-17,Unconfirmed Rumors circulate that Dick's Sporting Goods Inc Common (DKS) will be acquired by Wal-Mart Stores Inc. (WMT) at $50.00 a share ,DKS,0.023848315327068548,2.010227446191421,0.015130585141561292,-0.007101705291578608,0.013846139598760132,-0.0049601941484480605,0.011145475706701768,-0.013234622834459864,-0.5787018255578094
6,2011-05-17,"Earnings Scheduled For May 17 (SKS, HD, DKS, WMT, HPQ, TJX, GILT, CHUX, DELL, ADI, TSL, SYPR, VSAT, YTEC)",DKS,-0.03121199359133342,0.5826669548303436,-0.04191182920729253,-0.002583322115240816,0.012122868620818128,0.005496971242731741,0.029527527139239895,-0.012176411394335562,-0.5002048340843916
7,2011-05-17,"Earnings Roundup For May 17 (HD, TJX, WMT, HPQ, SKS, TSL, DKS, STV, VOD, SCEI, TSEM, CHUX, ITRN, GCAP)",DKS,-0.03121199359133342,0.5826669548303436,-0.04191182920729253,-0.002583322115240816,0.012122868620818128,0.005496971242731741,0.029527527139239895,-0.012176411394335562,-0.5002048340843916
8,2011-05-27,Five Investments to Consider for Memorial Day,DKS,0.009310982553750957,-0.25168252494778376,0.03435747875803785,0.006286165401474975,-0.017499024078177827,-0.007914182351878019,0.022982180707156408,-0.009225087921061026,0.17273995968367184
9,2011-08-16,Earnings Roundup,DKS,-0.004252672414500114,0.5880616401960206,0.022360165116059205,0.04443704717502772,0.03075895238537729,-0.04926867826827919,0.05358339659493194,-0.009151950950197829,-0.5306539762798825
10,2011-08-16,Earnings Scheduled For August 16,DKS,-0.004252672414500114,0.5880616401960206,0.022360165116059205,0.04443704717502772,0.03075895238537729,-0.04926867826827919,0.05358339659493194,-0.009151950950197829,-0.5306539762798825
11,2011-08-16,US Stock Futures Down; Wal-Mart Earnings In Focus,DKS,-0.004252672414500114,0.5880616401960206,0.022360165116059205,0.04443704717502772,0.03075895238537729,-0.04926867826827919,0.05358339659493194,-0.009151950950197829,-0.5306539762798825
12,2011-11-15,"US Stock Futures Down Ahead Of Earnings, Economic Data",DKS,0.04623593874552956,1.3257877026613643,-0.010252535491868775,0.033066307053814414,0.008597931064750375,-0.03373618959175151,-0.0005032104364585122,-0.028737102556060767,-0.4529790872024201
13,2011-11-15,Earnings Scheduled For November 15,DKS,0.04623593874552956,1.3257877026613643,-0.010252535491868775,0.033066307053814414,0.008597931064750375,-0.03373618959175151,-0.0005032104364585122,-0.028737102556060767,-0.4529790872024201
14,2011-11-15,"Financial Breakfast: Morning News Summary for November 15, 2011",DKS,0.04623593874552956,1.3257877026613643,-0.010252535491868775,0.033066307053814414,0.008597931064750375,-0.03373618959175151,-0.0005032104364585122,-0.028737102556060767,-0.4529790872024201
15,2011-11-28,5 Stocks For The End Of The NBA Lockout,DKS,0.03485259854937839,1.1128183087998282,-0.01374970788363128,-0.04301631835873965,-0.00678508747465012,-0.000502947779236318,0.0005032008629928253,-0.0018132208603760525,0.013883238405207443
16,2011-12-06,Would You Take a Bribe From Amazon to Leave a Store Empty-Handed?,DKS,-0.0077579887978860285,-0.38847847705640004,0.017053111814556043,0.019733279974007534,-0.00737734395327061,0.020243899632216067,-0.0018132208603760525,-0.007313721503394821,0.744918108955744
17,2011-12-19,"Warm Weather Not an Issue for Sporting Goods Retailers, Guns Makeup for Slow Outerwear",DKS,-0.02178685140713954,-0.6230795493342438,0.02806905075530941,0.0008512992881639647,-0.024093080324650518,-0.05322462136717809,-0.01827562634079627,0.03298531461360721,0.4141963109354414
18,2011-12-21,"Dick's Sporting Goods Offering Incentives on Outerwear, Cabela's Keeping Silent",DKS,0.0016376767660517544,-0.3424944683824386,0.03298531461360721,-0.02178685140713954,0.02806905075530941,0.0008512992881639647,-0.024093080324650518,-0.007629685085377869,-0.037725823591923446
19,2012-03-07,"Morning Social Media Outlook for Wednesday Mar 7 (DKS, BRY, SMP, PLCM)",DKS,0.007038269981794132,-0.5236501705386447,0.02896610271101241,0.0010982849264895567,0.003970406318649644,0.012957977661327558,-0.007209028945186158,-0.003388747655197588,-0.0531838241916599
20,2012-05-15,"Social Media Outlook for Tuesday 15 (DKS, MDVN, BBY, ACOM)",DKS,0.05948333683586027,1.3427843963159716,-0.02214854398010746,-0.02107422841329165,-0.0024253988915843294,-0.007025223592154739,-0.005787306788787583,-0.04095904952789564,-0.24148340958795667
21,2012-05-15,Earnings Scheduled For May 15,DKS,0.05948333683586027,1.3427843963159716,-0.02214854398010746,-0.02107422841329165,-0.0024253988915843294,-0.007025223592154739,-0.005787306788787583,-0.04095904952789564,-0.24148340958795667
22,2012-05-15,Stocks To Watch For May 15,DKS,0.05948333683586027,1.3427843963159716,-0.02214854398010746,-0.02107422841329165,-0.0024253988915843294,-0.007025223592154739,-0.005787306788787583,-0.04095904952789564,-0.24148340958795667
23,2012-05-16,"Einhorn Bullish On Apple, Says Could Be $1 Trillion Company",DKS,-0.04095904952789564,-0.24148340958795667,0.05948333683586027,-0.02214854398010746,-0.02107422841329165,-0.0024253988915843294,-0.007025223592154739,-0.047083056551338376,-0.26213008331417054
24,2012-05-17,Ira Sohn Investment Conference Market Movers for Thursday,DKS,-0.047083056551338376,-0.26213008331417054,-0.04095904952789564,0.05948333683586027,-0.02214854398010746,-0.02107422841329165,-0.0024253988915843294,-0.0089636219419158,-0.49395886273193657
25,2012-06-14,Time to Lace-Up ETFs with Footwear Exposure?,DKS,0.010584338573521368,-0.42215915063597187,-0.03366726826654631,0.018888656844535445,-0.024566213113328406,0.01679626589930039,-0.0161016303570779,-0.0006546126356800075,0.967072948881208
26,2012-08-06,These Retailers Are on a Roll,DKS,-0.005852407738463072,-0.4146540961728873,0.034719346725574196,0.013087895370864855,-0.004478632197555843,-0.004257073966623226,-0.007844063267243073,0.0056907491312734315,0.2097521512098257
32,2012-08-13,Earnings Expectations for the Week of August 13,DKS,0.0037738602223169604,0.3697357886309047,-0.009638622016031384,-0.007224672884977967,-0.0007807643363864081,0.0056907491312734315,-0.005852407738463072,-0.03858311023329064,1.610123918634557
34,2012-08-14,"Earnings Scheduled For August 14, 2012",DKS,-0.03858311023329064,1.610123918634557,0.0037738602223169604,-0.009638622016031384,-0.007224672884977967,-0.0007807643363864081,0.0056907491312734315,0.025931133291350328,-0.6284916618145444
37,2012-11-09,"The Week Ahead: Home Depot, Dell, Walmart Earnings; European GDP",DKS,0.0010141455685765965,0.20982433311646065,-0.027804827582180724,-0.010150735355415441,0.011251386209713665,0.003963905321004768,-0.021524108985870316,-0.013171322286326892,0.916823518867079
40,2012-11-12,Retail Earnings to the Rescue?,DKS,-0.013171322286326892,0.916823518867079,0.0010141455685765965,-0.027804827582180724,-0.010150735355415441,0.011251386209713665,0.003963905321004768,0.04661238089173403,0.9596932572711119
45,2012-11-13,"Earnings Scheduled For November 13, 2012",DKS,0.04661238089173403,0.9596932572711119,-0.013171322286326892,0.0010141455685765965,-0.027804827582180724,-0.010150735355415441,0.011251386209713665,-0.02452464971621282,-0.7352899069434502
46,2012-11-13,US Stock Futures Down Ahead Of Home Depot Earnings,DKS,0.04661238089173403,0.9596932572711119,-0.013171322286326892,0.0010141455685765965,-0.027804827582180724,-0.010150735355415441,0.011251386209713665,-0.02452464971621282,-0.7352899069434502
50,2012-11-13,"Benzinga Market Primer, Tuesday, November 13",DKS,0.04661238089173403,0.9596932572711119,-0.013171322286326892,0.0010141455685765965,-0.027804827582180724,-0.010150735355415441,0.011251386209713665,-0.02452464971621282,-0.7352899069434502
52,2012-11-13,"Benzinga Market Primer, Tuesday November 13",DKS,0.04661238089173403,0.9596932572711119,-0.013171322286326892,0.0010141455685765965,-0.027804827582180724,-0.010150735355415441,0.011251386209713665,-0.02452464971621282,-0.7352899069434502
56,2012-11-26,"Cabela's, Home Depot and Other Retail Stocks Worth a Look Now",DKS,-0.009236247860453517,1.2875109681193333,0.006975553871484186,0.0023305407248466192,-0.00019431534326952438,0.029588144056727606,0.0014013471704261704,0.0031075761424490533,-0.040531901291394945
58,2012-12-13,Friday is the Last Day Companies Can Pay Special Dividends,DKS,-0.03964436412238159,-0.1320597049331489,-0.0349830802594443,-0.008116955842408347,-0.028199619177971313,-0.008214611240024317,0.0025489631896906673,-0.003752587438536348,-0.48238770293150957
61,2012-12-13,Year-End Trades in Retail: Are There Quality Names on Sale?,DKS,-0.03964436412238159,-0.1320597049331489,-0.0349830802594443,-0.008116955842408347,-0.028199619177971313,-0.008214611240024317,0.0025489631896906673,-0.003752587438536348,-0.48238770293150957
65,2013-03-11,"Benzinga Market Primer, Monday March 11",DKS,-0.10849795722411548,2.42636725468036,0.004765680959458063,-0.0045461175901844175,-0.004819954272472282,-0.0003921194345084533,0.009105176712512986,0.048991297387888766,-0.5238563028825469
71,2013-03-11,Stocks Cramer's Watching this Week,DKS,-0.10849795722411548,2.42636725468036,0.004765680959458063,-0.0045461175901844175,-0.004819954272472282,-0.0003921194345084533,0.009105176712512986,0.048991297387888766,-0.5238563028825469
72,2013-03-11,Stocks Jim Cramer is Watching this Week,DKS,-0.10849795722411548,2.42636725468036,0.004765680959458063,-0.0045461175901844175,-0.004819954272472282,-0.0003921194345084533,0.009105176712512986,0.048991297387888766,-0.5238563028825469
75,2013-05-17,"Weekly Preview: FOMC Minutes in Focus, Earnings Season Wanes",DKS,-0.004775490416314754,0.20455065172650344,-0.011891380125894635,0.008566685835934118,0.008253249449305944,-0.004014777260877733,0.020882246989118114,0.002111283436186051,0.9688656858092075
79,2013-05-21,"Earnings Scheduled For May 21, 2013",DKS,0.010342974028925589,0.33429756050525494,0.002111283436186051,-0.004775490416314754,-0.011891380125894635,0.008566685835934118,0.008253249449305944,-0.01327023330165511,-0.059257118080647486
80,2013-05-21,"US Stock Futures Flat, Gold Futures Decline",DKS,0.010342974028925589,0.33429756050525494,0.002111283436186051,-0.004775490416314754,-0.011891380125894635,0.008566685835934118,0.008253249449305944,-0.01327023330165511,-0.059257118080647486
85,2013-07-26,"Einhorn's Investor Letter Leaks, Sends Multiple Shares to Session Highs",DKS,0.007582672262198775,0.12085876198779433,0.016403521701556567,-0.007259292756814584,-0.013929158320462598,0.01952645616430515,-0.005492168228402705,-0.0017363354813996201,-0.18317938745746232
92,2013-08-20,Mid-Afternoon Market Update: Dick's Sporting Goods Falls on Poor Earnings While Goodrich Petroleum Rises on Little News,DKS,-0.07807862404633237,2.151200543642404,0.012002305411065839,-0.0276209303681223,-0.00522451524534806,-0.006154117560508543,0.005025324970890699,-0.007932926775097382,-0.5754711329954834
97,2013-08-20,"  Earnings Scheduled For August 20, 2013",DKS,-0.07807862404633237,2.151200543642404,0.012002305411065839,-0.0276209303681223,-0.00522451524534806,-0.006154117560508543,0.005025324970890699,-0.007932926775097382,-0.5754711329954834
99,2013-08-20,"Stocks To Watch For August 20, 2013",DKS,-0.07807862404633237,2.151200543642404,0.012002305411065839,-0.0276209303681223,-0.00522451524534806,-0.006154117560508543,0.005025324970890699,-0.007932926775097382,-0.5754711329954834
103,2013-11-19,"Earnings Scheduled For November 19, 2013 ",DKS,-0.0040802141198168496,0.5921686480753083,0.009672403491567172,0.003956160105239581,0.002343019349223985,0.013333223332653743,-0.002005034703365882,-0.022088074461508067,-0.22139565869094546
107,2014-01-15,Market Wrap For January 15: Bulls Take Over as Economic Growth Remains Healthy,DKS,0.020633590477650898,0.22891084585070542,0.018245374441048234,-0.04404481592265719,-0.010115215934976884,-0.015115263871908868,-0.006145301691541594,-0.03493529568705367,-0.060463819305665245
110,2014-01-15,Market Wrap For January 15: Bulls Take Over As Economic Growth Remains Healthy,DKS,0.020633590477650898,0.22891084585070542,0.018245374441048234,-0.04404481592265719,-0.010115215934976884,-0.015115263871908868,-0.006145301691541594,-0.03493529568705367,-0.060463819305665245
112,2014-02-10,Market Wrap For February 10: Markets Cautious Ahead of Yellen Testimony,DKS,0.01506884081256965,0.6393008654335652,0.00610357586722432,0.011551516421200336,0.000797377217621742,-0.011623193153046718,-0.033143131421232264,-0.003278154243692044,-0.500372655376589
114,2014-02-10,Market Wrap For February 10: Markets Cautious Ahead Of Yellen Testimony,DKS,0.01506884081256965,0.6393008654335652,0.00610357586722432,0.011551516421200336,0.000797377217621742,-0.011623193153046718,-0.033143131421232264,-0.003278154243692044,-0.500372655376589
116,2014-03-11,Market Wrap For March 11: Markets End Slightly In The Red As Ukraine Worries Persist And Continued Chinese Conerns,DKS,0.043069585045037995,1.2953861140630534,0.013619676916183376,-0.00018647745777511382,0.004685032752828722,-0.008270571949806516,0.013912300748561535,0.009175932674489129,-0.20723779393892627
117,2014-03-11,Market Wrap For March 11: Markets End Slightly in the Red as Ukraine Worries Persist and Continued Chinese Conerns,DKS,0.043069585045037995,1.2953861140630534,0.013619676916183376,-0.00018647745777511382,0.004685032752828722,-0.008270571949806516,0.013912300748561535,0.009175932674489129,-0.20723779393892627
120,2014-05-12,Market Wrap For May 12: Dow And S&P Close At Record Highs,DKS,0.009118584119688133,-0.11741071428571426,0.01956178568705469,0.007414595374751531,-0.013853931870706937,-0.0005770290555699997,-0.0001920301774319677,-0.006777005097003741,-0.4057916034395549
121,2014-05-12,Market Wrap For May 12: Dow and S&P Close at Record Highs,DKS,0.009118584119688133,-0.11741071428571426,0.01956178568705469,0.007414595374751531,-0.013853931870706937,-0.0005770290555699997,-0.0001920301774319677,-0.006777005097003741,-0.4057916034395549
124,2014-05-14,Market Wrap For May 14: Dow's Winning Streak Ends At Five Sessions,DKS,-0.008718607568553138,1.7871887635667165,-0.006777005097003741,0.009118584119688133,0.01956178568705469,0.007414595374751531,-0.013853931870706937,-0.017399706601109233,0.038558448499656395
126,2014-05-14,Market Wrap For May 14: Dow's Winning Streak Ends at Five Sessions,DKS,-0.008718607568553138,1.7871887635667165,-0.006777005097003741,0.009118584119688133,0.01956178568705469,0.007414595374751531,-0.013853931870706937,-0.017399706601109233,0.038558448499656395
128,2014-05-15,Retail Companies Set to Release Quarterly Earnings,DKS,-0.017399706601109233,0.038558448499656395,-0.008718607568553138,-0.006777005097003741,0.009118584119688133,0.01956178568705469,0.007414595374751531,0.003502526556792951,-0.19283928833995
130,2014-05-20,"Market Wrap For May 20: Markets Sharply Lower On Fed Talk, Disappointing Earnings",DKS,-0.17983439199533113,4.385286868410242,0.03083217306850572,0.003502526556792951,-0.017399706601109233,-0.008718607568553138,-0.006777005097003741,-0.0172022513007557,-0.4590217080380129
132,2014-05-20,Retailers Struggle To Start May,DKS,-0.17983439199533113,4.385286868410242,0.03083217306850572,0.003502526556792951,-0.017399706601109233,-0.008718607568553138,-0.006777005097003741,-0.0172022513007557,-0.4590217080380129
137,2014-05-20,"Market Wrap For May 20: Markets Sharply Lower on Fed Talk, Disappointing Earnings",DKS,-0.17983439199533113,4.385286868410242,0.03083217306850572,0.003502526556792951,-0.017399706601109233,-0.008718607568553138,-0.006777005097003741,-0.0172022513007557,-0.4590217080380129
139,2014-05-20,"Earnings Scheduled For May 20, 2014",DKS,-0.17983439199533113,4.385286868410242,0.03083217306850572,0.003502526556792951,-0.017399706601109233,-0.008718607568553138,-0.006777005097003741,-0.0172022513007557,-0.4590217080380129
140,2014-05-20,"Stocks To Watch For May 20, 2014",DKS,-0.17983439199533113,4.385286868410242,0.03083217306850572,0.003502526556792951,-0.017399706601109233,-0.008718607568553138,-0.006777005097003741,-0.0172022513007557,-0.4590217080380129
145,2014-05-21,Deutsche Bank Weighs In On The Retail Industry Amid Weak Earnings,DKS,-0.0172022513007557,-0.4590217080380129,-0.17983439199533113,0.03083217306850572,0.003502526556792951,-0.017399706601109233,-0.008718607568553138,0.00933504467260815,-0.5037601052829479
147,2014-05-21,Market Wrap For May 21: Fed's Minutes Support Wednesday's Bull Run,DKS,-0.0172022513007557,-0.4590217080380129,-0.17983439199533113,0.03083217306850572,0.003502526556792951,-0.017399706601109233,-0.008718607568553138,0.00933504467260815,-0.5037601052829479
150,2014-05-21,Deutsche Bank Weighs in on the Retail Industry Amid Weak Earnings,DKS,-0.0172022513007557,-0.4590217080380129,-0.17983439199533113,0.03083217306850572,0.003502526556792951,-0.017399706601109233,-0.008718607568553138,0.00933504467260815,-0.5037601052829479
152,2014-05-21,Market Wrap For May 21: Fed's Minutes Supports Wednesday's Bull Run,DKS,-0.0172022513007557,-0.4590217080380129,-0.17983439199533113,0.03083217306850572,0.003502526556792951,-0.017399706601109233,-0.008718607568553138,0.00933504467260815,-0.5037601052829479
155,2014-06-24,Market Wrap For June 24: Consumer Confidence And Housing Data Take A Back-Seat,DKS,-0.015631920237114016,-0.019981834695731115,0.01703382314372237,-0.009225666533074883,-0.0020212489283203405,-0.004471013271854396,0.01153263307906971,0.013384775365823831,-0.06286685202347853
156,2014-06-24,Morgan Stanley Initiates Coverage on Specialty Retailers,DKS,-0.015631920237114016,-0.019981834695731115,0.01703382314372237,-0.009225666533074883,-0.0020212489283203405,-0.004471013271854396,0.01153263307906971,0.013384775365823831,-0.06286685202347853
158,2014-06-24,Consumer Confidence And Housing Data Take A Back-Seat To Markets,DKS,-0.015631920237114016,-0.019981834695731115,0.01703382314372237,-0.009225666533074883,-0.0020212489283203405,-0.004471013271854396,0.01153263307906971,0.013384775365823831,-0.06286685202347853
159,2014-06-24,Morgan Stanley Initiates Coverage On Specialty Retailers,DKS,-0.015631920237114016,-0.019981834695731115,0.01703382314372237,-0.009225666533074883,-0.0020212489283203405,-0.004471013271854396,0.01153263307906971,0.013384775365823831,-0.06286685202347853
164,2014-08-19,"Dow Flirts With 19,000, S&P 500 Approaches 2,000 & Nasdaq Trading At 14-Year Highs ",DKS,0.016088527407359443,2.004451789147078,0.012566887718323816,-0.000930117428572963,0.007968494015553107,-0.010894706907882856,-0.0004640501488021309,0.018773671675446302,-0.697524835830948
166,2014-08-19,"Markets Gather Momentum: Dow Flits With 19,000, S&P 500 Approaches 2,000 And Nasdaq Trading At 14-Year Highs ",DKS,0.016088527407359443,2.004451789147078,0.012566887718323816,-0.000930117428572963,0.007968494015553107,-0.010894706907882856,-0.0004640501488021309,0.018773671675446302,-0.697524835830948
168,2014-08-19,"Dow Flirts With 19,000, S&P 500 Approaches 2,000 & NASDAQ Trading At 14-Year Highs ",DKS,0.016088527407359443,2.004451789147078,0.012566887718323816,-0.000930117428572963,0.007968494015553107,-0.010894706907882856,-0.0004640501488021309,0.018773671675446302,-0.697524835830948
169,2014-08-19,Benzinga's Top #PreMarket Gainers,DKS,0.016088527407359443,2.004451789147078,0.012566887718323816,-0.000930117428572963,0.007968494015553107,-0.010894706907882856,-0.0004640501488021309,0.018773671675446302,-0.697524835830948
172,2014-08-19,"Earnings Scheduled For August 19, 2014",DKS,0.016088527407359443,2.004451789147078,0.012566887718323816,-0.000930117428572963,0.007968494015553107,-0.010894706907882856,-0.0004640501488021309,0.018773671675446302,-0.697524835830948
173,2014-08-19,"Stocks To Watch For August 19, 2014",DKS,0.016088527407359443,2.004451789147078,0.012566887718323816,-0.000930117428572963,0.007968494015553107,-0.010894706907882856,-0.0004640501488021309,0.018773671675446302,-0.697524835830948
178,2014-08-19,Morning Market Movers ,DKS,0.016088527407359443,2.004451789147078,0.012566887718323816,-0.000930117428572963,0.007968494015553107,-0.010894706907882856,-0.0004640501488021309,0.018773671675446302,-0.697524835830948
179,2014-08-19,Markets Rise; Home Depot Profit Beats Estimates,DKS,0.016088527407359443,2.004451789147078,0.012566887718323816,-0.000930117428572963,0.007968494015553107,-0.010894706907882856,-0.0004640501488021309,0.018773671675446302,-0.697524835830948
180,2014-08-19,Mid-Morning Market Update: Markets Rise; Home Depot Profit Beats Estimates,DKS,0.016088527407359443,2.004451789147078,0.012566887718323816,-0.000930117428572963,0.007968494015553107,-0.010894706907882856,-0.0004640501488021309,0.018773671675446302,-0.697524835830948
185,2014-08-20,Markets Mostly Higher Despite Initial Negative Reaction From FOMC Minutes,DKS,0.018773671675446302,-0.697524835830948,0.016088527407359443,0.012566887718323816,-0.000930117428572963,0.007968494015553107,-0.010894706907882856,-0.009102767175562465,-0.4827432643063906
190,2014-08-26,"Athleisurewear Fad A Rapidly Growing, But Crowded Space",DKS,0.0030997927346898546,-0.07134192570128883,-0.0008848563176704349,0.012995605966070745,-0.009102767175562465,0.018773671675446302,0.016088527407359443,-0.002427852115667317,0.42166707486325405
192,2014-09-03,The Business Of Tennis: Who's Taking Advantage?,DKS,0.00917430131469299,0.29102268990463664,0.006434313289611637,-0.003316923111325809,0.0004424732067858095,-0.002427852115667317,0.0030997927346898546,0.006133642233135506,0.043937850229240905
198,2014-09-03,The Business Of Tennis,DKS,0.00917430131469299,0.29102268990463664,0.006434313289611637,-0.003316923111325809,0.0004424732067858095,-0.002427852115667317,0.0030997927346898546,0.006133642233135506,0.043937850229240905
204,2014-10-27,"Citigroup Names Dick's Sporting Goods, Foot Locker As Top Apparel and Footwear Picks",DKS,0.00426402155356409,0.1458625525946704,0.00382997532729501,0.0038438365821931164,-0.017769540318721577,0.017630929643151605,0.022181113115522066,0.00871505130496164,0.08023935808513527
206,2014-11-17,Notable Retail Earnings This Week,DKS,-0.008142327171921093,0.6488898111641419,0.003141487054216352,-0.017085103576806482,0.057696426322626726,-0.011620294263961384,0.00999756429294818,-0.00862976942561644,0.5575551640238274
207,2014-11-17,"Notable Retail Earnings Expected This Week: Urban Outfitters, PetSmart, The Gap And Many More",DKS,-0.008142327171921093,0.6488898111641419,0.003141487054216352,-0.017085103576806482,0.057696426322626726,-0.011620294263961384,0.00999756429294818,-0.00862976942561644,0.5575551640238274
211,2014-11-18,"#PreMarket Primer: Tuesday, November 18: Abe To Delay Sales Tax Increase In Japan",DKS,-0.00862976942561644,0.5575551640238274,-0.008142327171921093,0.003141487054216352,-0.017085103576806482,0.057696426322626726,-0.011620294263961384,0.02866246444497289,-0.15260308653613075
213,2014-11-18,"Earnings Scheduled For November 18, 2014",DKS,-0.00862976942561644,0.5575551640238274,-0.008142327171921093,0.003141487054216352,-0.017085103576806482,0.057696426322626726,-0.011620294263961384,0.02866246444497289,-0.15260308653613075
214,2014-11-18,"Keep an Eye on These 7 Stocks for November 18, 2014",DKS,-0.00862976942561644,0.5575551640238274,-0.008142327171921093,0.003141487054216352,-0.017085103576806482,0.057696426322626726,-0.011620294263961384,0.02866246444497289,-0.15260308653613075
221,2014-11-18,"#PreMarket Primer: Tuesday, November 18: Abe To Delay Sales Tax Increase",DKS,-0.00862976942561644,0.5575551640238274,-0.008142327171921093,0.003141487054216352,-0.017085103576806482,0.057696426322626726,-0.011620294263961384,0.02866246444497289,-0.15260308653613075
223,2014-11-19,"#PreMarket Primer: Wednesday, November 19: Burst Of Cold Creates Chaos In New York",DKS,0.02866246444497289,-0.15260308653613075,-0.00862976942561644,-0.008142327171921093,0.003141487054216352,-0.017085103576806482,0.057696426322626726,-0.006398272561639717,-0.4651495407303817
227,2014-11-25,Citigroup: Best Buy And Dick's Sporting Goods 'Well Positioned To Outshine',DKS,-0.00020125804469672826,-0.002875673029858028,0.016990671299533133,0.014748708740742966,-0.006398272561639717,0.02866246444497289,-0.00862976942561644,-0.00040250135005059917,-0.423513530097564
229,2014-12-01,Thanksgiving Weekend Retail Sales Scorecard Roundup,DKS,-0.03359023306693465,1.0470534490634993,0.01933522117938713,-0.00040250135005059917,-0.00020125804469672826,0.016990671299533133,0.014748708740742966,-0.00224917760158716,-0.22997098861861187
