,date,title,stock,close,volume,1_past_close,2_past_close,3_past_close,4_past_close,5_past_close,next_close,next_volume
246,2022-05-23,"Morning Brief: Top Financial Stories Dominating on Monday, May 23",TLT,-0.016454222383614714,-0.3009407003235166,0.011350074492915807,0.0023952091812013965,0.02131748719387816,-0.012083680126273033,-0.0010345936361055852,0.019732154080546627,0.46862833747770827
247,2022-05-26,"Morning Brief: Top Financial Stories Dominating on Thursday, May 26",TLT,-0.004525298093346786,0.03484192411247111,0.003954280709230318,0.019732154080546627,-0.016454222383614714,0.011350074492915807,0.0023952091812013965,0.002441364752582942,-0.24961610417826174
248,2022-06-02,"Morning Brief: Top Financial Stories Dominating on Thursday, June 2",TLT,0.0005163169906217124,-0.3675055323966857,-0.001143166416355701,-0.021162174192604133,0.002441364752582942,-0.004525298093346786,0.003954280709230318,-0.0021500654891918325,0.5592351505288853
249,2022-06-29,"Benzinga Before The Bell: Tesla's Autopilot Layoff, TikTok Removal From App Stores, US Sanction On Russian Gold And Other Top Financial Stories Wednesday, June 29",TLT,0.015608252282091728,-0.056994440634438925,0.0046595970070719694,-0.008528789811587778,-0.013842729135144949,0.00821476350136563,0.027500650824137995,0.008782008878033487,0.9962322249214723
250,2022-07-15,"Benzinga Before The Bell: Donald Trump's Presidential Bid, Facebook Testing Multiple Profiles, UnitedHealth Q2 Earnings Growth And Other Top Financial Stories Friday, July 15",TLT,0.005628176268178686,0.022827960421321514,-0.008158679317123108,0.011466184323440043,0.005941980133450153,0.017244501448015592,-0.011075867853452825,-0.01041850499312047,-0.011502502714915153
251,2022-07-25,Morgan Stanley Views Differ From JPMorgan On Federal Reserve's Policy Outlook: Bloomberg,TLT,-0.009784999991804488,0.4037639780302902,0.016811227404732065,0.017275948798449958,0.0026244293802275553,-0.005394552615705761,-0.01041850499312047,0.000766730973633889,-0.45568821100124257
252,2022-07-25,"Benzinga Before The Bell: Apple's iPhone Discount, Tesla's Bitcoin Loss, US Investor Fear And Other Top Financial Stories Monday, July 25",TLT,-0.009784999991804488,0.4037639780302902,0.016811227404732065,0.017275948798449958,0.0026244293802275553,-0.005394552615705761,-0.01041850499312047,0.000766730973633889,-0.45568821100124257
253,2022-08-11,"Benzinga Before The Bell: iPhone 14 Might Be Costlier, Coinbase Face Another SEC Probe, Binance Sees Crypto User Growth And Other Top Financial Stories Thursday, August 11",TLT,-0.02330944687982861,0.40902675021990675,-0.006531503087435997,-0.003886717546442764,0.0161413439575826,-0.023803426662355798,-0.000335171881549412,,
